player_match_sk,playermatch_key,match_id,player_id,player_name,dob,batting_hand,bowling_skill,country_name,role_desc,player_team,opposit_team,season_year,is_manofthematch,age_as_on_match,isplayers_team_won,batting_status,bowling_status,player_captain,opposit_captain,player_keeper,opposit_keeper,dob_cleaned
12697,33598700009,335987,9,Jh Kallis,10/16/1975,Right-hand Bat,Right-arm Fast-medium,South Africa,Player,Royal Challengers Bangalore,Kolkata Knight Riders,2008,0,33,0,Blank,Blank,R Dravid,Sc Ganguly,Mv Boucher,Wp Saha,1975-10-16
12699,33598700011,335987,11,Mv Boucher,12/3/1976,Right-hand Bat,Right-arm Medium,South Africa,Keeper,Royal Challengers Bangalore,Kolkata Knight Riders,2008,0,32,0,Blank,Blank,R Dravid,Sc Ganguly,Mv Boucher,Wp Saha,1976-12-03
12704,33598700016,335987,16,Sb Joshi,6/6/1970,Left-hand Bat,Slow Left-arm Orthodox,India,Player,Royal Challengers Bangalore,Kolkata Knight Riders,2008,0,38,0,Blank,Blank,R Dravid,Sc Ganguly,Mv Boucher,Wp Saha,1970-06-06
12708,33598700004,335987,4,Dj Hussey,7/15/1977,Right-hand Bat,Right-arm Offbreak,Australia,Player,Kolkata Knight Riders,Royal Challengers Bangalore,2008,0,31,1,Blank,Blank,Sc Ganguly,R Dravid,Wp Saha,Mv Boucher,1977-07-15
12711,33598700063,335987,63,Lr Shukla,5/6/1981,Right-hand Bat,Right-arm Medium,India,Player,Kolkata Knight Riders,Royal Challengers Bangalore,2008,0,27,1,Blank,Blank,Sc Ganguly,R Dravid,Wp Saha,Mv Boucher,1981-05-06
12720,33598800028,335988,28,Sm Katich,8/21/1975,Left-hand Bat,Slow Left-arm Chinaman,Australia,Player,Kings Xi Punjab,Chennai Super Kings,2008,0,33,0,Blank,Blank,Yuvraj Singh,Ms Dhoni,Kc Sangakkara,Ms Dhoni,1975-08-21
12724,33598800068,335988,68,Wa Mota,9/20/1981,Right-hand Bat,Right-arm Medium,India,Player,Kings Xi Punjab,Chennai Super Kings,2008,0,27,0,Blank,Blank,Yuvraj Singh,Ms Dhoni,Kc Sangakkara,Ms Dhoni,1981-09-20
12727,33598800017,335988,17,Pa Patel,3/9/1985,Left-hand Bat,N/a,India,Player,Chennai Super Kings,Kings Xi Punjab,2008,0,23,1,Blank,Blank,Ms Dhoni,Yuvraj Singh,Ms Dhoni,Kc Sangakkara,1985-03-09
12731,33598800021,335988,21,Sk Raina,11/27/1986,Left-hand Bat,Right-arm Offbreak,India,Player,Chennai Super Kings,Kings Xi Punjab,2008,0,22,1,Blank,Blank,Ms Dhoni,Yuvraj Singh,Ms Dhoni,Kc Sangakkara,1986-11-27
12734,33598800119,335988,119,Joginder Sharma,10/23/1983,Right-hand Bat,Right-arm Fast-medium,India,Player,Chennai Super Kings,Kings Xi Punjab,2008,0,25,1,Blank,Blank,Ms Dhoni,Yuvraj Singh,Ms Dhoni,Kc Sangakkara,1983-10-23
12735,33598800120,335988,120,Ms Gony,1/4/1984,Right-hand Bat,Right-arm Medium,India,Player,Chennai Super Kings,Kings Xi Punjab,2008,0,24,1,Blank,Blank,Ms Dhoni,Yuvraj Singh,Ms Dhoni,Kc Sangakkara,1984-01-04
12736,33598800121,335988,121,M Muralitharan,4/17/1972,Right-hand Bat,Right-arm Offbreak,Sri Lanka,Player,Chennai Super Kings,Kings Xi Punjab,2008,0,36,1,Blank,Blank,Ms Dhoni,Yuvraj Singh,Ms Dhoni,Kc Sangakkara,1972-04-17
12737,33598800435,335988,435,P Amarnath,6/1/1982,Right-hand Bat,Right-arm Medium,India,Player,Chennai Super Kings,Kings Xi Punjab,2008,0,26,1,Blank,Blank,Ms Dhoni,Yuvraj Singh,Ms Dhoni,Kc Sangakkara,1982-06-01
12741,33598900087,335989,87,Mk Tiwary,11/14/1985,Right-hand Bat,Legbreak Googly,India,Player,Delhi Daredevils,Rajasthan Royals,2008,0,23,1,Blank,Blank,V Sehwag,Sk Warne,Kd Karthik,M Rawat,1985-11-14
12743,33598900089,335989,89,R Bhatia,10/22/1979,Right-hand Bat,Right-arm Medium-fast,India,Player,Delhi Daredevils,Rajasthan Royals,2008,0,29,1,Blank,Blank,V Sehwag,Sk Warne,Kd Karthik,M Rawat,1979-10-22
12744,33598900090,335989,90,Mf Maharoof,9/7/1984,Right-hand Bat,Right-arm Fast-medium,India,Player,Delhi Daredevils,Rajasthan Royals,2008,1,24,1,Blank,Blank,V Sehwag,Sk Warne,Kd Karthik,M Rawat,1984-09-07
12745,33598900118,335989,118,Gd Mcgrath,2/9/1970,Right-hand Bat,Right-arm Fast-medium,Australia,Player,Delhi Daredevils,Rajasthan Royals,2008,0,38,1,Blank,Blank,V Sehwag,Sk Warne,Kd Karthik,M Rawat,1970-02-09
12750,33598900031,335989,31,Yk Pathan,11/17/1982,Right-hand Bat,Right-arm Offbreak,India,Player,Rajasthan Royals,Delhi Daredevils,2008,0,26,0,Blank,Blank,Sk Warne,V Sehwag,M Rawat,Kd Karthik,1982-11-17
12752,33598900033,335989,33,M Kaif,12/1/1980,Right-hand Bat,Right-arm Offbreak,India,Player,Rajasthan Royals,Delhi Daredevils,2008,0,28,0,Blank,Blank,Sk Warne,V Sehwag,M Rawat,Kd Karthik,1980-12-01
12757,33598900038,335989,38,Sk Warne,9/13/1969,Right-hand Bat,Legbreak Googly,Australia,Captain,Rajasthan Royals,Delhi Daredevils,2008,0,39,0,Blank,Blank,Sk Warne,V Sehwag,M Rawat,Kd Karthik,1969-09-13
12759,33598900126,335989,126,Mm Patel,7/12/1983,Right-hand Bat,Right-arm Medium-fast,India,Player,Rajasthan Royals,Delhi Daredevils,2008,0,25,0,Blank,Blank,Sk Warne,V Sehwag,M Rawat,Kd Karthik,1983-07-12
12763,33599000046,335990,46,Rv Uthappa,11/11/1985,Right-hand Bat,Right-arm Medium,India,Player,Mumbai Indians,Royal Challengers Bangalore,2008,0,23,0,Blank,Blank,Harbhajan Singh,R Dravid,L Ronchi,Mv Boucher,1985-11-11
12765,33599000048,335990,48,Am Nayar,10/8/1983,Left-hand Bat,Right-arm Medium,India,Player,Mumbai Indians,Royal Challengers Bangalore,2008,0,25,0,Blank,Blank,Harbhajan Singh,R Dravid,L Ronchi,Mv Boucher,1983-10-08
12766,33599000049,335990,49,Sm Pollock,7/16/1973,Right-hand Bat,Right-arm Fast-medium,South Africa,Player,Mumbai Indians,Royal Challengers Bangalore,2008,0,35,0,Blank,Blank,Harbhajan Singh,R Dravid,L Ronchi,Mv Boucher,1973-07-16
12767,33599000050,335990,50,Harbhajan Singh,7/3/1980,Right-hand Bat,Right-arm Offbreak,India,Captain,Mumbai Indians,Royal Challengers Bangalore,2008,0,28,0,Blank,Blank,Harbhajan Singh,R Dravid,L Ronchi,Mv Boucher,1980-07-03
12768,33599000072,335990,72,Ma Khote,4/22/1980,Right-hand Bat,Right-arm Medium,India,Player,Mumbai Indians,Royal Challengers Bangalore,2008,0,28,0,Blank,Blank,Harbhajan Singh,R Dravid,L Ronchi,Mv Boucher,1980-04-22
12769,33599000073,335990,73,A Nehra,4/29/1979,Right-hand Bat,Left-arm Medium-fast,India,Player,Mumbai Indians,Royal Challengers Bangalore,2008,0,29,0,Blank,Blank,Harbhajan Singh,R Dravid,L Ronchi,Mv Boucher,1979-04-29
12770,33599000080,335990,80,Ds Kulkarni,12/10/1988,Right-hand Bat,Right-arm Medium,India,Player,Mumbai Indians,Royal Challengers Bangalore,2008,0,20,0,Blank,Blank,Harbhajan Singh,R Dravid,L Ronchi,Mv Boucher,1988-12-10
12774,33599000011,335990,11,Mv Boucher,12/3/1976,Right-hand Bat,Right-arm Medium,South Africa,Keeper,Royal Challengers Bangalore,Mumbai Indians,2008,1,32,1,Blank,Blank,R Dravid,Harbhajan Singh,Mv Boucher,L Ronchi,1976-12-03
12775,33599000012,335990,12,B Akhil,10/7/1977,Right-hand Bat,Right-arm Medium-fast,India,Player,Royal Challengers Bangalore,Mumbai Indians,2008,0,31,1,Blank,Blank,R Dravid,Harbhajan Singh,Mv Boucher,L Ronchi,1977-10-07
12781,33599000081,335990,81,R Vinay Kumar,2/12/1984,Right-hand Bat,Right-arm Medium,India,Player,Royal Challengers Bangalore,Mumbai Indians,2008,0,24,1,Blank,Blank,R Dravid,Harbhajan Singh,Mv Boucher,L Ronchi,1984-02-12
12782,33599100053,335991,53,Ac Gilchrist,11/14/1971,Left-hand Bat,Right-arm Offbreak,Australia,Keeper,Deccan Chargers,Kolkata Knight Riders,2008,0,37,0,Blank,Blank,Vvs Laxman,Sc Ganguly,Ac Gilchrist,Wp Saha,1971-11-14
12784,33599100055,335991,55,Vvs Laxman,11/1/1974,Right-hand Bat,Right-arm Offbreak,India,Captain,Deccan Chargers,Kolkata Knight Riders,2008,0,34,0,Blank,Blank,Vvs Laxman,Sc Ganguly,Ac Gilchrist,Wp Saha,1974-11-01
12785,33599100056,335991,56,A Symonds,6/9/1975,Right-hand Bat,Right-arm Offbreak,Australia,Player,Deccan Chargers,Kolkata Knight Riders,2008,0,33,0,Blank,Blank,Vvs Laxman,Sc Ganguly,Ac Gilchrist,Wp Saha,1975-06-09
12788,33599100059,335991,59,Sb Bangar,10/11/1972,Right-hand Bat,Right-arm Medium-fast,India,Player,Deccan Chargers,Kolkata Knight Riders,2008,0,36,0,Blank,Blank,Vvs Laxman,Sc Ganguly,Ac Gilchrist,Wp Saha,1972-10-11
12793,33599100001,335991,1,Sc Ganguly,7/8/1972,Left-hand Bat,Right-arm Medium,India,Captain,Kolkata Knight Riders,Deccan Chargers,2008,0,36,1,Blank,Blank,Sc Ganguly,Vvs Laxman,Wp Saha,Ac Gilchrist,1972-07-08
12794,33599100002,335991,2,Bb Mccullum,9/27/1981,Right-hand Bat,Right-arm Medium,New Zealand,Player,Kolkata Knight Riders,Deccan Chargers,2008,0,27,1,Blank,Blank,Sc Ganguly,Vvs Laxman,Wp Saha,Ac Gilchrist,1981-09-27
12798,33599100062,335991,62,Wp Saha,10/24/1984,Right-hand Bat,N/a,India,Keeper,Kolkata Knight Riders,Deccan Chargers,2008,0,24,1,Blank,Blank,Sc Ganguly,Vvs Laxman,Wp Saha,Ac Gilchrist,1984-10-24
12800,33599100082,335991,82,Ab Agarkar,12/4/1977,Right-hand Bat,Right-arm Fast,India,Player,Kolkata Knight Riders,Deccan Chargers,2008,0,31,1,Blank,Blank,Sc Ganguly,Vvs Laxman,Wp Saha,Ac Gilchrist,1977-12-04
12801,33599100083,335991,83,M Kartik,9/11/1976,Left-hand Bat,Slow Left-arm Orthodox,India,Player,Kolkata Knight Riders,Deccan Chargers,2008,0,32,1,Blank,Blank,Sc Ganguly,Vvs Laxman,Wp Saha,Ac Gilchrist,1976-09-11
12803,33599100106,335991,106,Ab Dinda,3/25/1984,Right-hand Bat,Right-arm Medium-fast,India,Player,Kolkata Knight Riders,Deccan Chargers,2008,0,24,1,Blank,Blank,Sc Ganguly,Vvs Laxman,Wp Saha,Ac Gilchrist,1984-03-25
12810,33599200038,335992,38,Sk Warne,9/13/1969,Right-hand Bat,Legbreak Googly,Australia,Captain,Rajasthan Royals,Kings Xi Punjab,2008,0,39,1,Blank,Blank,Sk Warne,Yuvraj Singh,Kamran Akmal,Kc Sangakkara,1969-09-13
12817,33599200026,335992,26,Kc Sangakkara,10/27/1977,Left-hand Bat,Right-arm Offbreak,Sri Lanka,Keeper,Kings Xi Punjab,Rajasthan Royals,2008,0,31,0,Blank,Blank,Yuvraj Singh,Sk Warne,Kc Sangakkara,Kamran Akmal,1977-10-27
12818,33599200027,335992,27,Yuvraj Singh,12/12/1981,Left-hand Bat,Slow Left-arm Orthodox,India,Captain,Kings Xi Punjab,Rajasthan Royals,2008,0,27,0,Blank,Blank,Yuvraj Singh,Sk Warne,Kc Sangakkara,Kamran Akmal,1981-12-12
12824,33599200068,335992,68,Wa Mota,9/20/1981,Right-hand Bat,Right-arm Medium,India,Player,Kings Xi Punjab,Rajasthan Royals,2008,0,27,0,Blank,Blank,Yuvraj Singh,Sk Warne,Kc Sangakkara,Kamran Akmal,1981-09-20
12828,33599300055,335993,55,Vvs Laxman,11/1/1974,Right-hand Bat,Right-arm Offbreak,India,Captain,Deccan Chargers,Delhi Daredevils,2008,0,34,0,Blank,Blank,Vvs Laxman,V Sehwag,Ac Gilchrist,Kd Karthik,1974-11-01
12833,33599300061,335993,61,Rp Singh,12/6/1985,Right-hand Bat,Left-arm Fast-medium,India,Player,Deccan Chargers,Delhi Daredevils,2008,0,23,0,Blank,Blank,Vvs Laxman,V Sehwag,Ac Gilchrist,Kd Karthik,1985-12-06
12834,33599300070,335993,70,Shahid Afridi,3/1/1980,Right-hand Bat,Legbreak Googly,Pakistan,Player,Deccan Chargers,Delhi Daredevils,2008,0,28,0,Blank,Blank,Vvs Laxman,V Sehwag,Ac Gilchrist,Kd Karthik,1980-03-01
12836,33599300232,335993,232,Ut Yadav,10/25/1987,Right-hand Bat,Right-arm Fast-medium,India,Player,Deccan Chargers,Delhi Daredevils,2008,0,21,0,Blank,Blank,Vvs Laxman,V Sehwag,Ac Gilchrist,Kd Karthik,1987-10-25
12838,33599300041,335993,41,V Sehwag,10/20/1978,Right-hand Bat,Right-arm Offbreak,India,Captain,Delhi Daredevils,Deccan Chargers,2008,1,30,1,Blank,Blank,V Sehwag,Vvs Laxman,Kd Karthik,Ac Gilchrist,1978-10-20
12842,33599300088,335993,88,Kd Karthik,6/1/1985,Right-hand Bat,N/a,India,Keeper,Delhi Daredevils,Deccan Chargers,2008,0,23,1,Blank,Blank,V Sehwag,Vvs Laxman,Kd Karthik,Ac Gilchrist,1985-06-01
12845,33599300091,335993,91,Vy Mahesh,12/21/1987,Right-hand Bat,Right-arm Medium-fast,India,Player,Delhi Daredevils,Deccan Chargers,2008,0,21,1,Blank,Blank,V Sehwag,Vvs Laxman,Kd Karthik,Ac Gilchrist,1987-12-21
12846,33599300117,335993,117,Mohammad Asif,12/20/1982,Left-hand Bat,Right-arm Fast-medium,Pakistan,Player,Delhi Daredevils,Deccan Chargers,2008,0,26,1,Blank,Blank,V Sehwag,Vvs Laxman,Kd Karthik,Ac Gilchrist,1982-12-20
12849,33599400044,335994,44,St Jayasuriya,6/30/1969,Left-hand Bat,Slow Left-arm Orthodox,Sri Lanka,Player,Mumbai Indians,Chennai Super Kings,2008,0,39,0,Blank,Blank,Harbhajan Singh,Ms Dhoni,L Ronchi,Ms Dhoni,1969-06-30
12855,33599400072,335994,72,Ma Khote,4/22/1980,Right-hand Bat,Right-arm Medium,India,Player,Mumbai Indians,Chennai Super Kings,2008,0,28,0,Blank,Blank,Harbhajan Singh,Ms Dhoni,L Ronchi,Ms Dhoni,1980-04-22
12857,33599400080,335994,80,Ds Kulkarni,12/10/1988,Right-hand Bat,Right-arm Medium,India,Player,Mumbai Indians,Chennai Super Kings,2008,0,20,0,Blank,Blank,Harbhajan Singh,Ms Dhoni,L Ronchi,Ms Dhoni,1988-12-10
12859,33599400017,335994,17,Pa Patel,3/9/1985,Left-hand Bat,N/a,India,Player,Chennai Super Kings,Mumbai Indians,2008,0,23,1,Blank,Blank,Ms Dhoni,Harbhajan Singh,Ms Dhoni,L Ronchi,1985-03-09
12869,33599400435,335994,435,P Amarnath,6/1/1982,Right-hand Bat,Right-arm Medium,India,Player,Chennai Super Kings,Mumbai Indians,2008,0,26,1,Blank,Blank,Ms Dhoni,Harbhajan Singh,Ms Dhoni,L Ronchi,1982-06-01
12875,33599500060,335995,60,Wpujc Vaas,1/27/1974,Left-hand Bat,Left-arm Fast-medium,Sri Lanka,Player,Deccan Chargers,Rajasthan Royals,2008,0,34,0,Blank,Blank,Vvs Laxman,Sk Warne,Ac Gilchrist,Kamran Akmal,1974-01-27
12877,33599500070,335995,70,Shahid Afridi,3/1/1980,Right-hand Bat,Legbreak Googly,Pakistan,Player,Deccan Chargers,Rajasthan Royals,2008,0,28,0,Blank,Blank,Vvs Laxman,Sk Warne,Ac Gilchrist,Kamran Akmal,1980-03-01
12878,33599500099,335995,99,D Kalyankrishna,12/16/1983,Right-hand Bat,Right-arm Medium-fast,India,Player,Deccan Chargers,Rajasthan Royals,2008,0,25,0,Blank,Blank,Vvs Laxman,Sk Warne,Ac Gilchrist,Kamran Akmal,1983-12-16
12882,33599500032,335995,32,Sr Watson,6/17/1981,Right-hand Bat,Right-arm Fast-medium,Australia,Player,Rajasthan Royals,Deccan Chargers,2008,0,27,1,Blank,Blank,Sk Warne,Vvs Laxman,Kamran Akmal,Ac Gilchrist,1981-06-17
12884,33599500035,335995,35,Ra Jadeja,12/6/1988,Left-hand Bat,Slow Left-arm Orthodox,India,Player,Rajasthan Royals,Deccan Chargers,2008,0,20,1,Blank,Blank,Sk Warne,Vvs Laxman,Kamran Akmal,Ac Gilchrist,1988-12-06
12890,33599500075,335995,75,Pankaj Singh,5/6/1985,Right-hand Bat,Right-arm Medium-fast,India,Player,Rajasthan Royals,Deccan Chargers,2008,0,23,1,Blank,Blank,Sk Warne,Vvs Laxman,Kamran Akmal,Ac Gilchrist,1985-05-06
12892,33599600024,335996,24,K Goel,12/24/1986,Left-hand Bat,Right-arm Offbreak,India,Player,Kings Xi Punjab,Mumbai Indians,2008,0,22,1,Blank,Blank,Yuvraj Singh,Harbhajan Singh,Kc Sangakkara,L Ronchi,1986-12-24
12893,33599600026,335996,26,Kc Sangakkara,10/27/1977,Left-hand Bat,Right-arm Offbreak,Sri Lanka,Keeper,Kings Xi Punjab,Mumbai Indians,2008,1,31,1,Blank,Blank,Yuvraj Singh,Harbhajan Singh,Kc Sangakkara,L Ronchi,1977-10-27
12896,33599600064,335996,64,Dpmd Jayawardene,5/27/1977,Right-hand Bat,Right-arm Medium,Sri Lanka,Player,Kings Xi Punjab,Mumbai Indians,2008,0,31,1,Blank,Blank,Yuvraj Singh,Harbhajan Singh,Kc Sangakkara,L Ronchi,1977-05-27
12897,33599600065,335996,65,S Sohal,11/10/1987,Right-hand Bat,Legbreak,India,Player,Kings Xi Punjab,Mumbai Indians,2008,0,21,1,Blank,Blank,Yuvraj Singh,Harbhajan Singh,Kc Sangakkara,L Ronchi,1987-11-10
12899,33599600067,335996,67,Pp Chawla,12/24/1988,Left-hand Bat,Legbreak,India,Player,Kings Xi Punjab,Mumbai Indians,2008,0,20,1,Blank,Blank,Yuvraj Singh,Harbhajan Singh,Kc Sangakkara,L Ronchi,1988-12-24
12900,33599600076,335996,76,Rr Sarwan,6/23/1980,Right-hand Bat,Legbreak,West Indies,Player,Kings Xi Punjab,Mumbai Indians,2008,0,28,1,Blank,Blank,Yuvraj Singh,Harbhajan Singh,Kc Sangakkara,L Ronchi,1980-06-23
12903,33599600043,335996,43,L Ronchi,4/23/1981,Right-hand Bat,N/a,Australia,Keeper,Mumbai Indians,Kings Xi Punjab,2008,0,27,0,Blank,Blank,Harbhajan Singh,Yuvraj Singh,L Ronchi,Kc Sangakkara,1981-04-23
12906,33599600048,335996,48,Am Nayar,10/8/1983,Left-hand Bat,Right-arm Medium,India,Player,Mumbai Indians,Kings Xi Punjab,2008,0,25,0,Blank,Blank,Harbhajan Singh,Yuvraj Singh,L Ronchi,Kc Sangakkara,1983-10-08
12907,33599600049,335996,49,Sm Pollock,7/16/1973,Right-hand Bat,Right-arm Fast-medium,South Africa,Player,Mumbai Indians,Kings Xi Punjab,2008,0,35,0,Blank,Blank,Harbhajan Singh,Yuvraj Singh,L Ronchi,Kc Sangakkara,1973-07-16
12918,33599700036,335997,36,M Rawat,10/25/1985,Right-hand Bat,N/a,India,Keeper,Rajasthan Royals,Royal Challengers Bangalore,2008,0,23,1,Blank,Blank,Sk Warne,R Dravid,M Rawat,Mv Boucher,1985-10-25
12919,33599700037,335997,37,D Salunkhe,11/12/1982,Right-hand Bat,Legbreak,India,Player,Rajasthan Royals,Royal Challengers Bangalore,2008,0,26,1,Blank,Blank,Sk Warne,R Dravid,M Rawat,Mv Boucher,1982-11-12
12923,33599700102,335997,102,Sohail Tanvir,12/12/1984,Left-hand Bat,Left-arm Medium-fast,Pakistan,Player,Rajasthan Royals,Royal Challengers Bangalore,2008,0,24,1,Blank,Blank,Sk Warne,R Dravid,M Rawat,Mv Boucher,1984-12-12
12924,33599700126,335997,126,Mm Patel,7/12/1983,Right-hand Bat,Right-arm Medium-fast,India,Player,Rajasthan Royals,Royal Challengers Bangalore,2008,0,25,1,Blank,Blank,Sk Warne,R Dravid,M Rawat,Mv Boucher,1983-07-12
12925,33599700006,335997,6,R Dravid,1/11/1973,Right-hand Bat,Right-arm Offbreak,India,Captain,Royal Challengers Bangalore,Rajasthan Royals,2008,0,35,0,Blank,Blank,R Dravid,Sk Warne,Mv Boucher,M Rawat,1973-01-11
12927,33599700009,335997,9,Jh Kallis,10/16/1975,Right-hand Bat,Right-arm Fast-medium,South Africa,Player,Royal Challengers Bangalore,Rajasthan Royals,2008,0,33,0,Blank,Blank,R Dravid,Sk Warne,Mv Boucher,M Rawat,1975-10-16
12928,33599700011,335997,11,Mv Boucher,12/3/1976,Right-hand Bat,Right-arm Medium,South Africa,Keeper,Royal Challengers Bangalore,Rajasthan Royals,2008,0,32,0,Blank,Blank,R Dravid,Sk Warne,Mv Boucher,M Rawat,1976-12-03
12932,33599700051,335997,51,S Chanderpaul,8/16/1974,Left-hand Bat,Legbreak,West Indies,Player,Royal Challengers Bangalore,Rajasthan Royals,2008,0,34,0,Blank,Blank,R Dravid,Sk Warne,Mv Boucher,M Rawat,1974-08-16
12934,33599700081,335997,81,R Vinay Kumar,2/12/1984,Right-hand Bat,Right-arm Medium,India,Player,Royal Challengers Bangalore,Rajasthan Royals,2008,0,24,0,Blank,Blank,R Dravid,Sk Warne,Mv Boucher,M Rawat,1984-02-12
12938,33599800003,335998,3,Rt Ponting,12/19/1974,Right-hand Bat,Right-arm Medium,Australia,Player,Kolkata Knight Riders,Chennai Super Kings,2008,0,34,0,Blank,Blank,Sc Ganguly,Ms Dhoni,Bb Mccullum,Ms Dhoni,1974-12-19
12939,33599800004,335998,4,Dj Hussey,7/15/1977,Right-hand Bat,Right-arm Offbreak,Australia,Player,Kolkata Knight Riders,Chennai Super Kings,2008,0,31,0,Blank,Blank,Sc Ganguly,Ms Dhoni,Bb Mccullum,Ms Dhoni,1977-07-15
12941,33599800062,335998,62,Wp Saha,10/24/1984,Right-hand Bat,N/a,India,Player,Kolkata Knight Riders,Chennai Super Kings,2008,0,24,0,Blank,Blank,Sc Ganguly,Ms Dhoni,Bb Mccullum,Ms Dhoni,1984-10-24
12942,33599800063,335998,63,Lr Shukla,5/6/1981,Right-hand Bat,Right-arm Medium,India,Player,Kolkata Knight Riders,Chennai Super Kings,2008,0,27,0,Blank,Blank,Sc Ganguly,Ms Dhoni,Bb Mccullum,Ms Dhoni,1981-05-06
12944,33599800083,335998,83,M Kartik,9/11/1976,Left-hand Bat,Slow Left-arm Orthodox,India,Player,Kolkata Knight Riders,Chennai Super Kings,2008,0,32,0,Blank,Blank,Sc Ganguly,Ms Dhoni,Bb Mccullum,Ms Dhoni,1976-09-11
12951,33599800021,335998,21,Sk Raina,11/27/1986,Left-hand Bat,Right-arm Offbreak,India,Player,Chennai Super Kings,Kolkata Knight Riders,2008,0,22,1,Blank,Blank,Ms Dhoni,Sc Ganguly,Ms Dhoni,Bb Mccullum,1986-11-27
12954,33599800119,335998,119,Joginder Sharma,10/23/1983,Right-hand Bat,Right-arm Fast-medium,India,Player,Chennai Super Kings,Kolkata Knight Riders,2008,0,25,1,Blank,Blank,Ms Dhoni,Sc Ganguly,Ms Dhoni,Bb Mccullum,1983-10-23
12955,33599800120,335998,120,Ms Gony,1/4/1984,Right-hand Bat,Right-arm Medium,India,Player,Chennai Super Kings,Kolkata Knight Riders,2008,0,24,1,Blank,Blank,Ms Dhoni,Sc Ganguly,Ms Dhoni,Bb Mccullum,1984-01-04
12957,33599800435,335998,435,P Amarnath,6/1/1982,Right-hand Bat,Right-arm Medium,India,Player,Chennai Super Kings,Kolkata Knight Riders,2008,0,26,1,Blank,Blank,Ms Dhoni,Sc Ganguly,Ms Dhoni,Bb Mccullum,1982-06-01
12960,33599900056,335999,56,A Symonds,6/9/1975,Right-hand Bat,Right-arm Offbreak,Australia,Player,Deccan Chargers,Mumbai Indians,2008,0,33,1,Blank,Blank,Vvs Laxman,Sm Pollock,Ac Gilchrist,L Ronchi,1975-06-09
12963,33599900061,335999,61,Rp Singh,12/6/1985,Right-hand Bat,Left-arm Fast-medium,India,Player,Deccan Chargers,Mumbai Indians,2008,0,23,1,Blank,Blank,Vvs Laxman,Sm Pollock,Ac Gilchrist,L Ronchi,1985-12-06
12964,33599900070,335999,70,Shahid Afridi,3/1/1980,Right-hand Bat,Legbreak Googly,Pakistan,Player,Deccan Chargers,Mumbai Indians,2008,0,28,1,Blank,Blank,Vvs Laxman,Sm Pollock,Ac Gilchrist,L Ronchi,1980-03-01
12971,33599900046,335999,46,Rv Uthappa,11/11/1985,Right-hand Bat,Right-arm Medium,India,Player,Mumbai Indians,Deccan Chargers,2008,0,23,0,Blank,Blank,Sm Pollock,Vvs Laxman,L Ronchi,Ac Gilchrist,1985-11-11
12972,33599900048,335999,48,Am Nayar,10/8/1983,Left-hand Bat,Right-arm Medium,India,Player,Mumbai Indians,Deccan Chargers,2008,0,25,0,Blank,Blank,Sm Pollock,Vvs Laxman,L Ronchi,Ac Gilchrist,1983-10-08
12973,33599900049,335999,49,Sm Pollock,7/16/1973,Right-hand Bat,Right-arm Fast-medium,South Africa,Captain,Mumbai Indians,Deccan Chargers,2008,0,35,0,Blank,Blank,Sm Pollock,Vvs Laxman,L Ronchi,Ac Gilchrist,1973-07-16
12983,33600000028,336000,28,Sm Katich,8/21/1975,Left-hand Bat,Slow Left-arm Chinaman,Australia,Player,Kings Xi Punjab,Delhi Daredevils,2008,1,33,1,Blank,Blank,Yuvraj Singh,V Sehwag,Kc Sangakkara,Kd Karthik,1975-08-21
12988,33600000077,336000,77,S Sreesanth,2/6/1983,Right-hand Bat,Right-arm Fast-medium,India,Player,Kings Xi Punjab,Delhi Daredevils,2008,0,25,1,Blank,Blank,Yuvraj Singh,V Sehwag,Kc Sangakkara,Kd Karthik,1983-02-06
12989,33600000078,336000,78,Vrv Singh,9/17/1984,Right-hand Bat,Right-arm Medium-fast,India,Player,Kings Xi Punjab,Delhi Daredevils,2008,0,24,1,Blank,Blank,Yuvraj Singh,V Sehwag,Kc Sangakkara,Kd Karthik,1984-09-17
12994,33600000086,336000,86,Shoaib Malik,2/1/1982,Right-hand Bat,Right-arm Offbreak,Pakistan,Player,Delhi Daredevils,Kings Xi Punjab,2008,0,26,0,Blank,Blank,V Sehwag,Yuvraj Singh,Kd Karthik,Kc Sangakkara,1982-02-01
12996,33600000088,336000,88,Kd Karthik,6/1/1985,Right-hand Bat,N/a,India,Keeper,Delhi Daredevils,Kings Xi Punjab,2008,0,23,0,Blank,Blank,V Sehwag,Yuvraj Singh,Kd Karthik,Kc Sangakkara,1985-06-01
13001,33600000118,336000,118,Gd Mcgrath,2/9/1970,Right-hand Bat,Right-arm Fast-medium,Australia,Player,Delhi Daredevils,Kings Xi Punjab,2008,0,38,0,Blank,Blank,V Sehwag,Yuvraj Singh,Kd Karthik,Kc Sangakkara,1970-02-09
13010,33600100119,336001,119,Joginder Sharma,10/23/1983,Right-hand Bat,Right-arm Fast-medium,India,Player,Chennai Super Kings,Royal Challengers Bangalore,2008,0,25,1,Blank,Blank,Ms Dhoni,R Dravid,Ms Dhoni,Mv Boucher,1983-10-23
13011,33600100120,336001,120,Ms Gony,1/4/1984,Right-hand Bat,Right-arm Medium,India,Player,Chennai Super Kings,Royal Challengers Bangalore,2008,0,24,1,Blank,Blank,Ms Dhoni,R Dravid,Ms Dhoni,Mv Boucher,1984-01-04
13013,33600100006,336001,6,R Dravid,1/11/1973,Right-hand Bat,Right-arm Offbreak,India,Captain,Royal Challengers Bangalore,Chennai Super Kings,2008,0,35,0,Blank,Blank,R Dravid,Ms Dhoni,Mv Boucher,Ms Dhoni,1973-01-11
13014,33600100007,336001,7,W Jaffer,2/16/1978,Right-hand Bat,Right-arm Offbreak,India,Player,Royal Challengers Bangalore,Chennai Super Kings,2008,0,30,0,Blank,Blank,R Dravid,Ms Dhoni,Mv Boucher,Ms Dhoni,1978-02-16
13016,33600100009,336001,9,Jh Kallis,10/16/1975,Right-hand Bat,Right-arm Fast-medium,South Africa,Player,Royal Challengers Bangalore,Chennai Super Kings,2008,0,33,0,Blank,Blank,R Dravid,Ms Dhoni,Mv Boucher,Ms Dhoni,1975-10-16
13018,33600100012,336001,12,B Akhil,10/7/1977,Right-hand Bat,Right-arm Medium-fast,India,Player,Royal Challengers Bangalore,Chennai Super Kings,2008,0,31,0,Blank,Blank,R Dravid,Ms Dhoni,Mv Boucher,Ms Dhoni,1977-10-07
13019,33600100014,336001,14,P Kumar,10/2/1986,Right-hand Bat,Right-arm Medium,India,Player,Royal Challengers Bangalore,Chennai Super Kings,2008,0,22,0,Blank,Blank,R Dravid,Ms Dhoni,Mv Boucher,Ms Dhoni,1986-10-02
13020,33600100015,336001,15,Z Khan,10/7/1978,Right-hand Bat,Left-arm Fast-medium,India,Player,Royal Challengers Bangalore,Chennai Super Kings,2008,0,30,0,Blank,Blank,R Dravid,Ms Dhoni,Mv Boucher,Ms Dhoni,1978-10-07
13022,33600100093,336001,93,B Chipli,1/27/1983,Right-hand Bat,Right-arm Medium,India,Player,Royal Challengers Bangalore,Chennai Super Kings,2008,0,25,0,Blank,Blank,R Dravid,Ms Dhoni,Mv Boucher,Ms Dhoni,1983-01-27
13023,33600100094,336001,94,Dw Steyn,6/27/1983,Right-hand Bat,Right-arm Fast,South Africa,Player,Royal Challengers Bangalore,Chennai Super Kings,2008,0,25,0,Blank,Blank,R Dravid,Ms Dhoni,Mv Boucher,Ms Dhoni,1983-06-27
13029,33600200063,336002,63,Lr Shukla,5/6/1981,Right-hand Bat,Right-arm Medium,India,Player,Kolkata Knight Riders,Mumbai Indians,2008,0,27,0,Blank,Blank,Sc Ganguly,Sm Pollock,Bb Mccullum,Pr Shah,1981-05-06
13033,33600200095,336002,95,Db Das,9/22/1986,Right-hand Bat,Legbreak Googly,India,Player,Kolkata Knight Riders,Mumbai Indians,2008,0,22,0,Blank,Blank,Sc Ganguly,Sm Pollock,Bb Mccullum,Pr Shah,1986-09-22
13034,33600200106,336002,106,Ab Dinda,3/25/1984,Right-hand Bat,Right-arm Medium-fast,India,Player,Kolkata Knight Riders,Mumbai Indians,2008,0,24,0,Blank,Blank,Sc Ganguly,Sm Pollock,Bb Mccullum,Pr Shah,1984-03-25
13043,33600200085,336002,85,Am Rahane,6/6/1988,Right-hand Bat,Right-arm Medium,India,Player,Mumbai Indians,Kolkata Knight Riders,2008,0,20,1,Blank,Blank,Sm Pollock,Sc Ganguly,Pr Shah,Bb Mccullum,1988-06-06
13046,33600300040,336003,40,G Gambhir,10/14/1981,Left-hand Bat,Legbreak,India,Player,Delhi Daredevils,Royal Challengers Bangalore,2008,0,27,1,Blank,Blank,V Sehwag,R Dravid,Kd Karthik,Mv Boucher,1981-10-14
13047,33600300041,336003,41,V Sehwag,10/20/1978,Right-hand Bat,Right-arm Offbreak,India,Captain,Delhi Daredevils,Royal Challengers Bangalore,2008,0,30,1,Blank,Blank,V Sehwag,R Dravid,Kd Karthik,Mv Boucher,1978-10-20
13049,33600300086,336003,86,Shoaib Malik,2/1/1982,Right-hand Bat,Right-arm Offbreak,Pakistan,Player,Delhi Daredevils,Royal Challengers Bangalore,2008,0,26,1,Blank,Blank,V Sehwag,R Dravid,Kd Karthik,Mv Boucher,1982-02-01
13054,33600300117,336003,117,Mohammad Asif,12/20/1982,Left-hand Bat,Right-arm Fast-medium,Pakistan,Player,Delhi Daredevils,Royal Challengers Bangalore,2008,0,26,1,Blank,Blank,V Sehwag,R Dravid,Kd Karthik,Mv Boucher,1982-12-20
13056,33600300175,336003,175,Dl Vettori,1/27/1979,Left-hand Bat,Slow Left-arm Orthodox,New Zealand,Player,Delhi Daredevils,Royal Challengers Bangalore,2008,0,29,1,Blank,Blank,V Sehwag,R Dravid,Kd Karthik,Mv Boucher,1979-01-27
13060,33600300009,336003,9,Jh Kallis,10/16/1975,Right-hand Bat,Right-arm Fast-medium,South Africa,Player,Royal Challengers Bangalore,Delhi Daredevils,2008,0,33,0,Blank,Blank,R Dravid,V Sehwag,Mv Boucher,Kd Karthik,1975-10-16
13062,33600300014,336003,14,P Kumar,10/2/1986,Right-hand Bat,Right-arm Medium,India,Player,Royal Challengers Bangalore,Delhi Daredevils,2008,0,22,0,Blank,Blank,R Dravid,V Sehwag,Mv Boucher,Kd Karthik,1986-10-02
13064,33600300016,336003,16,Sb Joshi,6/6/1970,Left-hand Bat,Slow Left-arm Orthodox,India,Player,Royal Challengers Bangalore,Delhi Daredevils,2008,0,38,0,Blank,Blank,R Dravid,V Sehwag,Mv Boucher,Kd Karthik,1970-06-06
13070,33600400055,336004,55,Vvs Laxman,11/1/1974,Right-hand Bat,Right-arm Offbreak,India,Captain,Deccan Chargers,Kings Xi Punjab,2008,0,34,0,Blank,Blank,Vvs Laxman,Yuvraj Singh,Ac Gilchrist,Kc Sangakkara,1974-11-01
13073,33600400061,336004,61,Rp Singh,12/6/1985,Right-hand Bat,Left-arm Fast-medium,India,Player,Deccan Chargers,Kings Xi Punjab,2008,0,23,0,Blank,Blank,Vvs Laxman,Yuvraj Singh,Ac Gilchrist,Kc Sangakkara,1985-12-06
13075,33600400097,336004,97,Hh Gibbs,2/23/1974,Right-hand Bat,Right-arm Bowler,South Africa,Player,Deccan Chargers,Kings Xi Punjab,2008,0,34,0,Blank,Blank,Vvs Laxman,Yuvraj Singh,Ac Gilchrist,Kc Sangakkara,1974-02-23
13079,33600400024,336004,24,K Goel,12/24/1986,Left-hand Bat,Right-arm Offbreak,India,Player,Kings Xi Punjab,Deccan Chargers,2008,0,22,1,Blank,Blank,Yuvraj Singh,Vvs Laxman,Kc Sangakkara,Ac Gilchrist,1986-12-24
13091,33600500032,336005,32,Sr Watson,6/17/1981,Right-hand Bat,Right-arm Fast-medium,Australia,Player,Rajasthan Royals,Kolkata Knight Riders,2008,0,27,1,Blank,Blank,Sk Warne,Sc Ganguly,M Rawat,Wp Saha,1981-06-17
13094,33600500036,336005,36,M Rawat,10/25/1985,Right-hand Bat,N/a,India,Keeper,Rajasthan Royals,Kolkata Knight Riders,2008,0,23,1,Blank,Blank,Sk Warne,Sc Ganguly,M Rawat,Wp Saha,1985-10-25
13095,33600500038,336005,38,Sk Warne,9/13/1969,Right-hand Bat,Legbreak Googly,Australia,Captain,Rajasthan Royals,Kolkata Knight Riders,2008,0,39,1,Blank,Blank,Sk Warne,Sc Ganguly,M Rawat,Wp Saha,1969-09-13
13096,33600500039,336005,39,Sk Trivedi,9/4/1982,Right-hand Bat,Right-arm Medium,India,Player,Rajasthan Royals,Kolkata Knight Riders,2008,0,26,1,Blank,Blank,Sk Warne,Sc Ganguly,M Rawat,Wp Saha,1982-09-04
13098,33600500101,336005,101,Sa Asnodkar,3/29/1984,Right-hand Bat,Right-arm Offbreak,India,Player,Rajasthan Royals,Kolkata Knight Riders,2008,1,24,1,Blank,Blank,Sk Warne,Sc Ganguly,M Rawat,Wp Saha,1984-03-29
13102,33600500004,336005,4,Dj Hussey,7/15/1977,Right-hand Bat,Right-arm Offbreak,Australia,Player,Kolkata Knight Riders,Rajasthan Royals,2008,0,31,0,Blank,Blank,Sc Ganguly,Sk Warne,Wp Saha,M Rawat,1977-07-15
13103,33600500062,336005,62,Wp Saha,10/24/1984,Right-hand Bat,N/a,India,Keeper,Kolkata Knight Riders,Rajasthan Royals,2008,0,24,0,Blank,Blank,Sc Ganguly,Sk Warne,Wp Saha,M Rawat,1984-10-24
13104,33600500063,336005,63,Lr Shukla,5/6/1981,Right-hand Bat,Right-arm Medium,India,Player,Kolkata Knight Riders,Rajasthan Royals,2008,0,27,0,Blank,Blank,Sc Ganguly,Sk Warne,Wp Saha,M Rawat,1981-05-06
13106,33600500084,336005,84,I Sharma,9/2/1988,Right-hand Bat,Right-arm Fast-medium,India,Player,Kolkata Knight Riders,Rajasthan Royals,2008,0,20,0,Blank,Blank,Sc Ganguly,Sk Warne,Wp Saha,M Rawat,1988-09-02
13112,33600600040,336006,40,G Gambhir,10/14/1981,Left-hand Bat,Legbreak,India,Player,Delhi Daredevils,Chennai Super Kings,2008,0,27,1,Blank,Blank,V Sehwag,Ms Dhoni,Kd Karthik,Ms Dhoni,1981-10-14
13120,33600600116,336006,116,Pj Sangwan,11/5/1990,Right-hand Bat,Left-arm Medium,India,Player,Delhi Daredevils,Chennai Super Kings,2008,0,18,1,Blank,Blank,V Sehwag,Ms Dhoni,Kd Karthik,Ms Dhoni,1990-11-05
13121,33600600117,336006,117,Mohammad Asif,12/20/1982,Left-hand Bat,Right-arm Fast-medium,Pakistan,Player,Delhi Daredevils,Chennai Super Kings,2008,0,26,1,Blank,Blank,V Sehwag,Ms Dhoni,Kd Karthik,Ms Dhoni,1982-12-20
13125,33600600021,336006,21,Sk Raina,11/27/1986,Left-hand Bat,Right-arm Offbreak,India,Player,Chennai Super Kings,Delhi Daredevils,2008,0,22,0,Blank,Blank,Ms Dhoni,V Sehwag,Ms Dhoni,Kd Karthik,1986-11-27
13127,33600600107,336006,107,Sp Fleming,4/1/1973,Left-hand Bat,N/a,New Zealand,Player,Chennai Super Kings,Delhi Daredevils,2008,0,35,0,Blank,Blank,Ms Dhoni,V Sehwag,Ms Dhoni,Kd Karthik,1973-04-01
13130,33600600119,336006,119,Joginder Sharma,10/23/1983,Right-hand Bat,Right-arm Fast-medium,India,Player,Chennai Super Kings,Delhi Daredevils,2008,0,25,0,Blank,Blank,Ms Dhoni,V Sehwag,Ms Dhoni,Kd Karthik,1983-10-23
13131,33600600120,336006,120,Ms Gony,1/4/1984,Right-hand Bat,Right-arm Medium,India,Player,Chennai Super Kings,Delhi Daredevils,2008,0,24,0,Blank,Blank,Ms Dhoni,V Sehwag,Ms Dhoni,Kd Karthik,1984-01-04
13132,33600600121,336006,121,M Muralitharan,4/17/1972,Right-hand Bat,Right-arm Offbreak,Sri Lanka,Player,Chennai Super Kings,Delhi Daredevils,2008,0,36,0,Blank,Blank,Ms Dhoni,V Sehwag,Ms Dhoni,Kd Karthik,1972-04-17
13135,33600700054,336007,54,Y Venugopal Rao,2/26/1982,Right-hand Bat,Right-arm Offbreak,India,Player,Deccan Chargers,Royal Challengers Bangalore,2008,0,26,0,Blank,Blank,Ac Gilchrist,R Dravid,Ac Gilchrist,Sp Goswami,1982-02-26
13140,33600700097,336007,97,Hh Gibbs,2/23/1974,Right-hand Bat,Right-arm Bowler,South Africa,Player,Deccan Chargers,Royal Challengers Bangalore,2008,0,34,0,Blank,Blank,Ac Gilchrist,R Dravid,Ac Gilchrist,Sp Goswami,1974-02-23
13141,33600700111,336007,111,Lpc Silva,12/14/1979,Right-hand Bat,Legbreak,Sri Lanka,Player,Deccan Chargers,Royal Challengers Bangalore,2008,0,29,0,Blank,Blank,Ac Gilchrist,R Dravid,Ac Gilchrist,Sp Goswami,1979-12-14
13144,33600700232,336007,232,Ut Yadav,10/25/1987,Right-hand Bat,Right-arm Fast-medium,India,Player,Deccan Chargers,Royal Challengers Bangalore,2008,0,21,0,Blank,Blank,Ac Gilchrist,R Dravid,Ac Gilchrist,Sp Goswami,1987-10-25
13150,33600700012,336007,12,B Akhil,10/7/1977,Right-hand Bat,Right-arm Medium-fast,India,Player,Royal Challengers Bangalore,Deccan Chargers,2008,0,31,1,Blank,Blank,R Dravid,Ac Gilchrist,Sp Goswami,Ac Gilchrist,1977-10-07
13159,33600800027,336008,27,Yuvraj Singh,12/12/1981,Left-hand Bat,Slow Left-arm Orthodox,India,Captain,Kings Xi Punjab,Kolkata Knight Riders,2008,0,27,1,Blank,Blank,Yuvraj Singh,Sc Ganguly,Kc Sangakkara,Wp Saha,1981-12-12
13164,33600800078,336008,78,Vrv Singh,9/17/1984,Right-hand Bat,Right-arm Medium-fast,India,Player,Kings Xi Punjab,Kolkata Knight Riders,2008,0,24,1,Blank,Blank,Yuvraj Singh,Sc Ganguly,Kc Sangakkara,Wp Saha,1984-09-17
13166,33600800437,336008,437,Gagandeep Singh,10/3/1981,Right-hand Bat,Right-arm Medium-fast,India,Player,Kings Xi Punjab,Kolkata Knight Riders,2008,0,27,1,Blank,Blank,Yuvraj Singh,Sc Ganguly,Kc Sangakkara,Wp Saha,1981-10-03
13167,33600800001,336008,1,Sc Ganguly,7/8/1972,Left-hand Bat,Right-arm Medium,India,Captain,Kolkata Knight Riders,Kings Xi Punjab,2008,0,36,0,Blank,Blank,Sc Ganguly,Yuvraj Singh,Wp Saha,Kc Sangakkara,1972-07-08
13175,33600800104,336008,104,Bj Hodge,12/29/1974,Right-hand Bat,Right-arm Offbreak,Australia,Player,Kolkata Knight Riders,Kings Xi Punjab,2008,0,34,0,Blank,Blank,Sc Ganguly,Yuvraj Singh,Wp Saha,Kc Sangakkara,1974-12-29
13176,33600800105,336008,105,Umar Gul,4/14/1984,Right-hand Bat,Right-arm Fast-medium,Pakistan,Player,Kolkata Knight Riders,Kings Xi Punjab,2008,0,24,0,Blank,Blank,Sc Ganguly,Yuvraj Singh,Wp Saha,Kc Sangakkara,1984-04-14
13177,33600800106,336008,106,Ab Dinda,3/25/1984,Right-hand Bat,Right-arm Medium-fast,India,Player,Kolkata Knight Riders,Kings Xi Punjab,2008,0,24,0,Blank,Blank,Sc Ganguly,Yuvraj Singh,Wp Saha,Kc Sangakkara,1984-03-25
13179,33600900041,336009,41,V Sehwag,10/20/1978,Right-hand Bat,Right-arm Offbreak,India,Captain,Delhi Daredevils,Mumbai Indians,2008,0,30,0,Blank,Blank,V Sehwag,Sm Pollock,Kd Karthik,Yv Takawale,1978-10-20
13184,33600900091,336009,91,Vy Mahesh,12/21/1987,Right-hand Bat,Right-arm Medium-fast,India,Player,Delhi Daredevils,Mumbai Indians,2008,0,21,0,Blank,Blank,V Sehwag,Sm Pollock,Kd Karthik,Yv Takawale,1987-12-21
13187,33600900117,336009,117,Mohammad Asif,12/20/1982,Left-hand Bat,Right-arm Fast-medium,Pakistan,Player,Delhi Daredevils,Mumbai Indians,2008,0,26,0,Blank,Blank,V Sehwag,Sm Pollock,Kd Karthik,Yv Takawale,1982-12-20
13188,33600900118,336009,118,Gd Mcgrath,2/9/1970,Right-hand Bat,Right-arm Fast-medium,Australia,Player,Delhi Daredevils,Mumbai Indians,2008,0,38,0,Blank,Blank,V Sehwag,Sm Pollock,Kd Karthik,Yv Takawale,1970-02-09
13196,33600900079,336009,79,Ss Tiwary,12/30/1989,Left-hand Bat,N/a,India,Player,Mumbai Indians,Delhi Daredevils,2008,0,19,1,Blank,Blank,Sm Pollock,V Sehwag,Yv Takawale,Kd Karthik,1989-12-30
13199,33600900115,336009,115,Rr Raje,9/3/1986,Right-hand Bat,Right-arm Fast-medium,India,Player,Mumbai Indians,Delhi Daredevils,2008,0,22,1,Blank,Blank,Sm Pollock,V Sehwag,Yv Takawale,Kd Karthik,1986-09-03
13201,33601000032,336010,32,Sr Watson,6/17/1981,Right-hand Bat,Right-arm Fast-medium,Australia,Player,Rajasthan Royals,Chennai Super Kings,2008,0,27,1,Blank,Blank,Sk Warne,Ms Dhoni,M Rawat,Ms Dhoni,1981-06-17
13205,33601000038,336010,38,Sk Warne,9/13/1969,Right-hand Bat,Legbreak Googly,Australia,Captain,Rajasthan Royals,Chennai Super Kings,2008,0,39,1,Blank,Blank,Sk Warne,Ms Dhoni,M Rawat,Ms Dhoni,1969-09-13
13206,33601000039,336010,39,Sk Trivedi,9/4/1982,Right-hand Bat,Right-arm Medium,India,Player,Rajasthan Royals,Chennai Super Kings,2008,0,26,1,Blank,Blank,Sk Warne,Ms Dhoni,M Rawat,Ms Dhoni,1982-09-04
13207,33601000074,336010,74,Gc Smith,2/1/1981,Left-hand Bat,Right-arm Offbreak,South Africa,Player,Rajasthan Royals,Chennai Super Kings,2008,0,27,1,Blank,Blank,Sk Warne,Ms Dhoni,M Rawat,Ms Dhoni,1981-02-01
13210,33601000126,336010,126,Mm Patel,7/12/1983,Right-hand Bat,Right-arm Medium-fast,India,Player,Rajasthan Royals,Chennai Super Kings,2008,0,25,1,Blank,Blank,Sk Warne,Ms Dhoni,M Rawat,Ms Dhoni,1983-07-12
13211,33601000017,336010,17,Pa Patel,3/9/1985,Left-hand Bat,N/a,India,Player,Chennai Super Kings,Rajasthan Royals,2008,0,23,0,Blank,Blank,Ms Dhoni,Sk Warne,Ms Dhoni,M Rawat,1985-03-09
13215,33601000107,336010,107,Sp Fleming,4/1/1973,Left-hand Bat,N/a,New Zealand,Player,Chennai Super Kings,Rajasthan Royals,2008,0,35,0,Blank,Blank,Ms Dhoni,Sk Warne,Ms Dhoni,M Rawat,1973-04-01
13216,33601000108,336010,108,S Vidyut,12/3/1981,Left-hand Bat,Slow Left-arm Orthodox,India,Player,Chennai Super Kings,Rajasthan Royals,2008,0,27,0,Blank,Blank,Ms Dhoni,Sk Warne,Ms Dhoni,M Rawat,1981-12-03
13220,33601000121,336010,121,M Muralitharan,4/17/1972,Right-hand Bat,Right-arm Offbreak,Sri Lanka,Player,Chennai Super Kings,Rajasthan Royals,2008,0,36,0,Blank,Blank,Ms Dhoni,Sk Warne,Ms Dhoni,M Rawat,1972-04-17
13226,33601100010,336011,10,Cl White,8/18/1983,Right-hand Bat,Legbreak Googly,Australia,Player,Royal Challengers Bangalore,Kings Xi Punjab,2008,0,25,0,Blank,Blank,R Dravid,Yuvraj Singh,Dt Patil,U Kaul,1983-08-18
13228,33601100015,336011,15,Z Khan,10/7/1978,Right-hand Bat,Left-arm Fast-medium,India,Player,Royal Challengers Bangalore,Kings Xi Punjab,2008,0,30,0,Blank,Blank,R Dravid,Yuvraj Singh,Dt Patil,U Kaul,1978-10-07
13229,33601100094,336011,94,Dw Steyn,6/27/1983,Right-hand Bat,Right-arm Fast,South Africa,Player,Royal Challengers Bangalore,Kings Xi Punjab,2008,0,25,0,Blank,Blank,R Dravid,Yuvraj Singh,Dt Patil,U Kaul,1983-06-27
13233,33601100025,336011,25,Jr Hopes,10/24/1978,Right-hand Bat,Right-arm Medium,Australia,Player,Kings Xi Punjab,Royal Challengers Bangalore,2008,0,30,1,Blank,Blank,Yuvraj Singh,R Dravid,U Kaul,Dt Patil,1978-10-24
13234,33601100027,336011,27,Yuvraj Singh,12/12/1981,Left-hand Bat,Slow Left-arm Orthodox,India,Captain,Kings Xi Punjab,Royal Challengers Bangalore,2008,0,27,1,Blank,Blank,Yuvraj Singh,R Dravid,U Kaul,Dt Patil,1981-12-12
13249,33601200061,336012,61,Rp Singh,12/6/1985,Right-hand Bat,Left-arm Fast-medium,India,Player,Deccan Chargers,Chennai Super Kings,2008,0,23,1,Blank,Blank,Ac Gilchrist,Ms Dhoni,Ac Gilchrist,Ms Dhoni,1985-12-06
13252,33601200131,336012,131,Pp Ojha,9/5/1986,Left-hand Bat,Slow Left-arm Orthodox,India,Player,Deccan Chargers,Chennai Super Kings,2008,0,22,1,Blank,Blank,Ac Gilchrist,Ms Dhoni,Ac Gilchrist,Ms Dhoni,1986-09-05
13253,33601200143,336012,143,Dp Vijaykumar,10/20/1986,Right-hand Bat,Right-arm Medium,India,Player,Deccan Chargers,Chennai Super Kings,2008,0,22,1,Blank,Blank,Ac Gilchrist,Ms Dhoni,Ac Gilchrist,Ms Dhoni,1986-10-20
13254,33601200232,336012,232,Ut Yadav,10/25/1987,Right-hand Bat,Right-arm Fast-medium,India,Player,Deccan Chargers,Chennai Super Kings,2008,0,21,1,Blank,Blank,Ac Gilchrist,Ms Dhoni,Ac Gilchrist,Ms Dhoni,1987-10-25
13257,33601200021,336012,21,Sk Raina,11/27/1986,Left-hand Bat,Right-arm Offbreak,India,Player,Chennai Super Kings,Deccan Chargers,2008,0,22,0,Blank,Blank,Ms Dhoni,Ac Gilchrist,Ms Dhoni,Ac Gilchrist,1986-11-27
13265,33601200125,336012,125,S Anirudha,4/14/1987,Right-hand Bat,N/a,India,Player,Chennai Super Kings,Deccan Chargers,2008,0,21,0,Blank,Blank,Ms Dhoni,Ac Gilchrist,Ms Dhoni,Ac Gilchrist,1987-04-14
13267,33601300032,336013,32,Sr Watson,6/17/1981,Right-hand Bat,Right-arm Fast-medium,Australia,Player,Rajasthan Royals,Mumbai Indians,2008,0,27,0,Blank,Blank,Sk Warne,Sm Pollock,M Rawat,Yv Takawale,1981-06-17
13269,33601300035,336013,35,Ra Jadeja,12/6/1988,Left-hand Bat,Slow Left-arm Orthodox,India,Player,Rajasthan Royals,Mumbai Indians,2008,0,20,0,Blank,Blank,Sk Warne,Sm Pollock,M Rawat,Yv Takawale,1988-12-06
13270,33601300036,336013,36,M Rawat,10/25/1985,Right-hand Bat,N/a,India,Keeper,Rajasthan Royals,Mumbai Indians,2008,0,23,0,Blank,Blank,Sk Warne,Sm Pollock,M Rawat,Yv Takawale,1985-10-25
13273,33601300074,336013,74,Gc Smith,2/1/1981,Left-hand Bat,Right-arm Offbreak,South Africa,Player,Rajasthan Royals,Mumbai Indians,2008,0,27,0,Blank,Blank,Sk Warne,Sm Pollock,M Rawat,Yv Takawale,1981-02-01
13277,33601300044,336013,44,St Jayasuriya,6/30/1969,Left-hand Bat,Slow Left-arm Orthodox,Sri Lanka,Player,Mumbai Indians,Rajasthan Royals,2008,0,39,1,Blank,Blank,Sm Pollock,Sk Warne,Yv Takawale,M Rawat,1969-06-30
13280,33601300048,336013,48,Am Nayar,10/8/1983,Left-hand Bat,Right-arm Medium,India,Player,Mumbai Indians,Rajasthan Royals,2008,0,25,1,Blank,Blank,Sm Pollock,Sk Warne,Yv Takawale,M Rawat,1983-10-08
13281,33601300049,336013,49,Sm Pollock,7/16/1973,Right-hand Bat,Right-arm Fast-medium,South Africa,Captain,Mumbai Indians,Rajasthan Royals,2008,0,35,1,Blank,Blank,Sm Pollock,Sk Warne,Yv Takawale,M Rawat,1973-07-16
13282,33601300071,336013,71,Dj Bravo,10/7/1983,Right-hand Bat,Right-arm Medium-fast,West Indies,Player,Mumbai Indians,Rajasthan Royals,2008,0,25,1,Blank,Blank,Sm Pollock,Sk Warne,Yv Takawale,M Rawat,1983-10-07
13286,33601300114,336013,114,Yv Takawale,11/5/1984,Right-hand Bat,N/a,India,Keeper,Mumbai Indians,Rajasthan Royals,2008,0,24,1,Blank,Blank,Sm Pollock,Sk Warne,Yv Takawale,M Rawat,1984-11-05
13289,33601400041,336014,41,V Sehwag,10/20/1978,Right-hand Bat,Right-arm Offbreak,India,Captain,Delhi Daredevils,Chennai Super Kings,2008,0,30,0,Blank,Blank,V Sehwag,Ms Dhoni,Kd Karthik,Ms Dhoni,1978-10-20
13292,33601400087,336014,87,Mk Tiwary,11/14/1985,Right-hand Bat,Legbreak Googly,India,Player,Delhi Daredevils,Chennai Super Kings,2008,0,23,0,Blank,Blank,V Sehwag,Ms Dhoni,Kd Karthik,Ms Dhoni,1985-11-14
13295,33601400110,336014,110,Ab De Villiers,2/17/1984,Right-hand Bat,Right-arm Medium,South Africa,Player,Delhi Daredevils,Chennai Super Kings,2008,0,24,0,Blank,Blank,V Sehwag,Ms Dhoni,Kd Karthik,Ms Dhoni,1984-02-17
13297,33601400117,336014,117,Mohammad Asif,12/20/1982,Left-hand Bat,Right-arm Fast-medium,Pakistan,Player,Delhi Daredevils,Chennai Super Kings,2008,0,26,0,Blank,Blank,V Sehwag,Ms Dhoni,Kd Karthik,Ms Dhoni,1982-12-20
13298,33601400118,336014,118,Gd Mcgrath,2/9/1970,Right-hand Bat,Right-arm Fast-medium,Australia,Player,Delhi Daredevils,Chennai Super Kings,2008,0,38,0,Blank,Blank,V Sehwag,Ms Dhoni,Kd Karthik,Ms Dhoni,1970-02-09
13300,33601400021,336014,21,Sk Raina,11/27/1986,Left-hand Bat,Right-arm Offbreak,India,Player,Chennai Super Kings,Delhi Daredevils,2008,0,22,1,Blank,Blank,Ms Dhoni,V Sehwag,Ms Dhoni,Kd Karthik,1986-11-27
13302,33601400107,336014,107,Sp Fleming,4/1/1973,Left-hand Bat,N/a,New Zealand,Player,Chennai Super Kings,Delhi Daredevils,2008,0,35,1,Blank,Blank,Ms Dhoni,V Sehwag,Ms Dhoni,Kd Karthik,1973-04-01
13304,33601400109,336014,109,Ja Morkel,6/10/1981,Left-hand Bat,Right-arm Medium-fast,South Africa,Player,Chennai Super Kings,Delhi Daredevils,2008,0,27,1,Blank,Blank,Ms Dhoni,V Sehwag,Ms Dhoni,Kd Karthik,1981-06-10
13306,33601400121,336014,121,M Muralitharan,4/17/1972,Right-hand Bat,Right-arm Offbreak,Sri Lanka,Player,Chennai Super Kings,Delhi Daredevils,2008,0,36,1,Blank,Blank,Ms Dhoni,V Sehwag,Ms Dhoni,Kd Karthik,1972-04-17
13308,33601400151,336014,151,L Balaji,9/27/1981,Right-hand Bat,Right-arm Medium-fast,India,Player,Chennai Super Kings,Delhi Daredevils,2008,0,27,1,Blank,Blank,Ms Dhoni,V Sehwag,Ms Dhoni,Kd Karthik,1981-09-27
13312,33601500010,336015,10,Cl White,8/18/1983,Right-hand Bat,Legbreak Googly,Australia,Player,Royal Challengers Bangalore,Kolkata Knight Riders,2008,0,25,0,Blank,Blank,R Dravid,Sc Ganguly,Mv Boucher,Wp Saha,1983-08-18
13314,33601500014,336015,14,P Kumar,10/2/1986,Right-hand Bat,Right-arm Medium,India,Player,Royal Challengers Bangalore,Kolkata Knight Riders,2008,0,22,0,Blank,Blank,R Dravid,Sc Ganguly,Mv Boucher,Wp Saha,1986-10-02
13315,33601500015,336015,15,Z Khan,10/7/1978,Right-hand Bat,Left-arm Fast-medium,India,Player,Royal Challengers Bangalore,Kolkata Knight Riders,2008,0,30,0,Blank,Blank,R Dravid,Sc Ganguly,Mv Boucher,Wp Saha,1978-10-07
13320,33601500130,336015,130,J Arunkumar,1/18/1975,Right-hand Bat,Right-arm Offbreak,India,Player,Royal Challengers Bangalore,Kolkata Knight Riders,2008,0,33,0,Blank,Blank,R Dravid,Sc Ganguly,Mv Boucher,Wp Saha,1975-01-18
13323,33601500062,336015,62,Wp Saha,10/24/1984,Right-hand Bat,N/a,India,Keeper,Kolkata Knight Riders,Royal Challengers Bangalore,2008,0,24,1,Blank,Blank,Sc Ganguly,R Dravid,Wp Saha,Mv Boucher,1984-10-24
13324,33601500063,336015,63,Lr Shukla,5/6/1981,Right-hand Bat,Right-arm Medium,India,Player,Kolkata Knight Riders,Royal Challengers Bangalore,2008,0,27,1,Blank,Blank,Sc Ganguly,R Dravid,Wp Saha,Mv Boucher,1981-05-06
13327,33601500104,336015,104,Bj Hodge,12/29/1974,Right-hand Bat,Right-arm Offbreak,Australia,Player,Kolkata Knight Riders,Royal Challengers Bangalore,2008,0,34,1,Blank,Blank,Sc Ganguly,R Dravid,Wp Saha,Mv Boucher,1974-12-29
13330,33601500128,336015,128,A Chopra,9/19/1977,Right-hand Bat,Right-arm Offbreak,India,Player,Kolkata Knight Riders,Royal Challengers Bangalore,2008,0,31,1,Blank,Blank,Sc Ganguly,R Dravid,Wp Saha,Mv Boucher,1977-09-19
13331,33601500129,336015,129,T Taibu,5/14/1983,Right-hand Bat,Right-arm Medium,Zimbabwea,Player,Kolkata Knight Riders,Royal Challengers Bangalore,2008,0,25,1,Blank,Blank,Sc Ganguly,R Dravid,Wp Saha,Mv Boucher,1983-05-14
13336,33601600059,336016,59,Sb Bangar,10/11/1972,Right-hand Bat,Right-arm Medium-fast,India,Player,Deccan Chargers,Rajasthan Royals,2008,0,36,0,Blank,Blank,Ac Gilchrist,Sk Warne,Ac Gilchrist,M Rawat,1972-10-11
13338,33601600070,336016,70,Shahid Afridi,3/1/1980,Right-hand Bat,Legbreak Googly,Pakistan,Player,Deccan Chargers,Rajasthan Royals,2008,0,28,0,Blank,Blank,Ac Gilchrist,Sk Warne,Ac Gilchrist,M Rawat,1980-03-01
13339,33601600097,336016,97,Hh Gibbs,2/23/1974,Right-hand Bat,Right-arm Bowler,South Africa,Player,Deccan Chargers,Rajasthan Royals,2008,0,34,0,Blank,Blank,Ac Gilchrist,Sk Warne,Ac Gilchrist,M Rawat,1974-02-23
13342,33601600143,336016,143,Dp Vijaykumar,10/20/1986,Right-hand Bat,Right-arm Medium,India,Player,Deccan Chargers,Rajasthan Royals,2008,0,22,0,Blank,Blank,Ac Gilchrist,Sk Warne,Ac Gilchrist,M Rawat,1986-10-20
13343,33601600031,336016,31,Yk Pathan,11/17/1982,Right-hand Bat,Right-arm Offbreak,India,Player,Rajasthan Royals,Deccan Chargers,2008,1,26,1,Blank,Blank,Sk Warne,Ac Gilchrist,M Rawat,Ac Gilchrist,1982-11-17
13348,33601600038,336016,38,Sk Warne,9/13/1969,Right-hand Bat,Legbreak Googly,Australia,Captain,Rajasthan Royals,Deccan Chargers,2008,0,39,1,Blank,Blank,Sk Warne,Ac Gilchrist,M Rawat,Ac Gilchrist,1969-09-13
13350,33601600074,336016,74,Gc Smith,2/1/1981,Left-hand Bat,Right-arm Offbreak,South Africa,Player,Rajasthan Royals,Deccan Chargers,2008,0,27,1,Blank,Blank,Sk Warne,Ac Gilchrist,M Rawat,Ac Gilchrist,1981-02-01
13352,33601600126,336016,126,Mm Patel,7/12/1983,Right-hand Bat,Right-arm Medium-fast,India,Player,Rajasthan Royals,Deccan Chargers,2008,0,25,1,Blank,Blank,Sk Warne,Ac Gilchrist,M Rawat,Ac Gilchrist,1983-07-12
13354,33601700006,336017,6,R Dravid,1/11/1973,Right-hand Bat,Right-arm Offbreak,India,Captain,Royal Challengers Bangalore,Mumbai Indians,2008,0,35,0,Blank,Blank,R Dravid,Sr Tendulkar,Sp Goswami,Yv Takawale,1973-01-11
13357,33601700011,336017,11,Mv Boucher,12/3/1976,Right-hand Bat,Right-arm Medium,South Africa,Player,Royal Challengers Bangalore,Mumbai Indians,2008,0,32,0,Blank,Blank,R Dravid,Sr Tendulkar,Sp Goswami,Yv Takawale,1976-12-03
13361,33601700094,336017,94,Dw Steyn,6/27/1983,Right-hand Bat,Right-arm Fast,South Africa,Player,Royal Challengers Bangalore,Mumbai Indians,2008,0,25,0,Blank,Blank,R Dravid,Sr Tendulkar,Sp Goswami,Yv Takawale,1983-06-27
13369,33601700073,336017,73,A Nehra,4/29/1979,Right-hand Bat,Left-arm Medium-fast,India,Player,Mumbai Indians,Royal Challengers Bangalore,2008,0,29,1,Blank,Blank,Sr Tendulkar,R Dravid,Yv Takawale,Sp Goswami,1979-04-29
13374,33601700147,336017,147,Dr Smith,4/12/1983,Right-hand Bat,Right-arm Medium,West Indies,Player,Mumbai Indians,Royal Challengers Bangalore,2008,0,25,1,Blank,Blank,Sr Tendulkar,R Dravid,Yv Takawale,Sp Goswami,1983-04-12
13376,33601800020,336018,20,Ms Dhoni,7/7/1981,Right-hand Bat,Right-arm Medium,India,Captainkeeper,Chennai Super Kings,Kings Xi Punjab,2008,0,27,1,Blank,Blank,Ms Dhoni,Yuvraj Singh,Ms Dhoni,U Kaul,1981-07-07
13377,33601800021,336018,21,Sk Raina,11/27/1986,Left-hand Bat,Right-arm Offbreak,India,Player,Chennai Super Kings,Kings Xi Punjab,2008,0,22,1,Blank,Blank,Ms Dhoni,Yuvraj Singh,Ms Dhoni,U Kaul,1986-11-27
13380,33601800108,336018,108,S Vidyut,12/3/1981,Left-hand Bat,Slow Left-arm Orthodox,India,Player,Chennai Super Kings,Kings Xi Punjab,2008,0,27,1,Blank,Blank,Ms Dhoni,Yuvraj Singh,Ms Dhoni,U Kaul,1981-12-03
13381,33601800109,336018,109,Ja Morkel,6/10/1981,Left-hand Bat,Right-arm Medium-fast,South Africa,Player,Chennai Super Kings,Kings Xi Punjab,2008,0,27,1,Blank,Blank,Ms Dhoni,Yuvraj Singh,Ms Dhoni,U Kaul,1981-06-10
13383,33601800121,336018,121,M Muralitharan,4/17/1972,Right-hand Bat,Right-arm Offbreak,Sri Lanka,Player,Chennai Super Kings,Kings Xi Punjab,2008,0,36,1,Blank,Blank,Ms Dhoni,Yuvraj Singh,Ms Dhoni,U Kaul,1972-04-17
13384,33601800127,336018,127,Ck Kapugedera,2/24/1987,Right-hand Bat,Right-arm Medium,Sri Lanka,Player,Chennai Super Kings,Kings Xi Punjab,2008,0,21,1,Blank,Blank,Ms Dhoni,Yuvraj Singh,Ms Dhoni,U Kaul,1987-02-24
13385,33601800151,336018,151,L Balaji,9/27/1981,Right-hand Bat,Right-arm Medium-fast,India,Player,Chennai Super Kings,Kings Xi Punjab,2008,1,27,1,Blank,Blank,Ms Dhoni,Yuvraj Singh,Ms Dhoni,U Kaul,1981-09-27
13388,33601800025,336018,25,Jr Hopes,10/24/1978,Right-hand Bat,Right-arm Medium,Australia,Player,Kings Xi Punjab,Chennai Super Kings,2008,0,30,0,Blank,Blank,Yuvraj Singh,Ms Dhoni,U Kaul,Ms Dhoni,1978-10-24
13392,33601800067,336018,67,Pp Chawla,12/24/1988,Left-hand Bat,Legbreak,India,Player,Kings Xi Punjab,Chennai Super Kings,2008,0,20,0,Blank,Blank,Yuvraj Singh,Ms Dhoni,U Kaul,Ms Dhoni,1988-12-24
13394,33601800077,336018,77,S Sreesanth,2/6/1983,Right-hand Bat,Right-arm Fast-medium,India,Player,Kings Xi Punjab,Chennai Super Kings,2008,0,25,0,Blank,Blank,Yuvraj Singh,Ms Dhoni,U Kaul,Ms Dhoni,1983-02-06
13398,33601900053,336019,53,Ac Gilchrist,11/14/1971,Left-hand Bat,Right-arm Offbreak,Australia,Captainkeeper,Deccan Chargers,Kolkata Knight Riders,2008,0,37,0,Blank,Blank,Ac Gilchrist,Sc Ganguly,Ac Gilchrist,Wp Saha,1971-11-14
13400,33601900057,336019,57,Rg Sharma,4/30/1987,Right-hand Bat,Right-arm Offbreak,India,Player,Deccan Chargers,Kolkata Knight Riders,2008,0,21,0,Blank,Blank,Ac Gilchrist,Sc Ganguly,Ac Gilchrist,Wp Saha,1987-04-30
13402,33601900059,336019,59,Sb Bangar,10/11/1972,Right-hand Bat,Right-arm Medium-fast,India,Player,Deccan Chargers,Kolkata Knight Riders,2008,0,36,0,Blank,Blank,Ac Gilchrist,Sc Ganguly,Ac Gilchrist,Wp Saha,1972-10-11
13406,33601900112,336019,112,Db Ravi Teja,9/5/1987,Right-hand Bat,Legbreak Googly,India,Player,Deccan Chargers,Kolkata Knight Riders,2008,0,21,0,Blank,Blank,Ac Gilchrist,Sc Ganguly,Ac Gilchrist,Wp Saha,1987-09-05
13407,33601900131,336019,131,Pp Ojha,9/5/1986,Left-hand Bat,Slow Left-arm Orthodox,India,Player,Deccan Chargers,Kolkata Knight Riders,2008,0,22,0,Blank,Blank,Ac Gilchrist,Sc Ganguly,Ac Gilchrist,Wp Saha,1986-09-05
13415,33601900103,336019,103,Salman Butt,10/7/1984,Left-hand Bat,Right-arm Offbreak,Pakistan,Player,Kolkata Knight Riders,Deccan Chargers,2008,0,24,1,Blank,Blank,Sc Ganguly,Ac Gilchrist,Wp Saha,Ac Gilchrist,1984-10-07
13417,33601900106,336019,106,Ab Dinda,3/25/1984,Right-hand Bat,Right-arm Medium-fast,India,Player,Kolkata Knight Riders,Deccan Chargers,2008,0,24,1,Blank,Blank,Sc Ganguly,Ac Gilchrist,Wp Saha,Ac Gilchrist,1984-03-25
13418,33601900128,336019,128,A Chopra,9/19/1977,Right-hand Bat,Right-arm Offbreak,India,Player,Kolkata Knight Riders,Deccan Chargers,2008,0,31,1,Blank,Blank,Sc Ganguly,Ac Gilchrist,Wp Saha,Ac Gilchrist,1977-09-19
13419,33601900129,336019,129,T Taibu,5/14/1983,Right-hand Bat,Right-arm Medium,Zimbabwea,Player,Kolkata Knight Riders,Deccan Chargers,2008,0,25,1,Blank,Blank,Sc Ganguly,Ac Gilchrist,Wp Saha,Ac Gilchrist,1983-05-14
13420,33602000040,336020,40,G Gambhir,10/14/1981,Left-hand Bat,Legbreak,India,Player,Delhi Daredevils,Rajasthan Royals,2008,0,27,0,Blank,Blank,V Sehwag,Sk Warne,Kd Karthik,M Rawat,1981-10-14
13422,33602000042,336020,42,S Dhawan,12/5/1985,Left-hand Bat,Right-arm Offbreak,India,Player,Delhi Daredevils,Rajasthan Royals,2008,0,23,0,Blank,Blank,V Sehwag,Sk Warne,Kd Karthik,M Rawat,1985-12-05
13423,33602000088,336020,88,Kd Karthik,6/1/1985,Right-hand Bat,N/a,India,Keeper,Delhi Daredevils,Rajasthan Royals,2008,0,23,0,Blank,Blank,V Sehwag,Sk Warne,Kd Karthik,M Rawat,1985-06-01
13424,33602000090,336020,90,Mf Maharoof,9/7/1984,Right-hand Bat,Right-arm Fast-medium,India,Player,Delhi Daredevils,Rajasthan Royals,2008,0,24,0,Blank,Blank,V Sehwag,Sk Warne,Kd Karthik,M Rawat,1984-09-07
13426,33602000110,336020,110,Ab De Villiers,2/17/1984,Right-hand Bat,Right-arm Medium,South Africa,Player,Delhi Daredevils,Rajasthan Royals,2008,0,24,0,Blank,Blank,V Sehwag,Sk Warne,Kd Karthik,M Rawat,1984-02-17
13428,33602000118,336020,118,Gd Mcgrath,2/9/1970,Right-hand Bat,Right-arm Fast-medium,Australia,Player,Delhi Daredevils,Rajasthan Royals,2008,0,38,0,Blank,Blank,V Sehwag,Sk Warne,Kd Karthik,M Rawat,1970-02-09
13429,33602000135,336020,135,Tm Dilshan,10/14/1976,Right-hand Bat,Right-arm Offbreak,Sri Lanka,Player,Delhi Daredevils,Rajasthan Royals,2008,0,32,0,Blank,Blank,V Sehwag,Sk Warne,Kd Karthik,M Rawat,1976-10-14
13435,33602000036,336020,36,M Rawat,10/25/1985,Right-hand Bat,N/a,India,Keeper,Rajasthan Royals,Delhi Daredevils,2008,0,23,1,Blank,Blank,Sk Warne,V Sehwag,M Rawat,Kd Karthik,1985-10-25
13436,33602000038,336020,38,Sk Warne,9/13/1969,Right-hand Bat,Legbreak Googly,Australia,Captain,Rajasthan Royals,Delhi Daredevils,2008,0,39,1,Blank,Blank,Sk Warne,V Sehwag,M Rawat,Kd Karthik,1969-09-13
13440,33602000137,336020,137,Ad Mascarenhas,10/30/1977,Right-hand Bat,Right-arm Fast-medium,England,Player,Rajasthan Royals,Delhi Daredevils,2008,0,31,1,Blank,Blank,Sk Warne,V Sehwag,M Rawat,Kd Karthik,1977-10-30
13442,33602100006,336021,6,R Dravid,1/11/1973,Right-hand Bat,Right-arm Offbreak,India,Captain,Royal Challengers Bangalore,Kings Xi Punjab,2008,0,35,0,Blank,Blank,R Dravid,Yuvraj Singh,Mv Boucher,U Kaul,1973-01-11
13445,33602100011,336021,11,Mv Boucher,12/3/1976,Right-hand Bat,Right-arm Medium,South Africa,Keeper,Royal Challengers Bangalore,Kings Xi Punjab,2008,0,32,0,Blank,Blank,R Dravid,Yuvraj Singh,Mv Boucher,U Kaul,1976-12-03
13449,33602100094,336021,94,Dw Steyn,6/27/1983,Right-hand Bat,Right-arm Fast,South Africa,Player,Royal Challengers Bangalore,Kings Xi Punjab,2008,0,25,0,Blank,Blank,R Dravid,Yuvraj Singh,Mv Boucher,U Kaul,1983-06-27
13451,33602100124,336021,124,A Kumble,10/17/1970,Right-hand Bat,Legbreak Googly,India,Player,Royal Challengers Bangalore,Kings Xi Punjab,2008,0,38,0,Blank,Blank,R Dravid,Yuvraj Singh,Mv Boucher,U Kaul,1970-10-17
13454,33602100027,336021,27,Yuvraj Singh,12/12/1981,Left-hand Bat,Slow Left-arm Orthodox,India,Captain,Kings Xi Punjab,Royal Challengers Bangalore,2008,0,27,1,Blank,Blank,Yuvraj Singh,R Dravid,U Kaul,Mv Boucher,1981-12-12
13457,33602100067,336021,67,Pp Chawla,12/24/1988,Left-hand Bat,Legbreak,India,Player,Kings Xi Punjab,Royal Challengers Bangalore,2008,0,20,1,Blank,Blank,Yuvraj Singh,R Dravid,U Kaul,Mv Boucher,1988-12-24
13458,33602100077,336021,77,S Sreesanth,2/6/1983,Right-hand Bat,Right-arm Fast-medium,India,Player,Kings Xi Punjab,Royal Challengers Bangalore,2008,0,25,1,Blank,Blank,Yuvraj Singh,R Dravid,U Kaul,Mv Boucher,1983-02-06
13460,33602100092,336021,92,Tm Srivastava,11/7/1989,Left-hand Bat,Right-arm Medium,India,Player,Kings Xi Punjab,Royal Challengers Bangalore,2008,0,19,1,Blank,Blank,Yuvraj Singh,R Dravid,U Kaul,Mv Boucher,1989-11-07
13461,33602100100,336021,100,Se Marsh,7/9/1983,Left-hand Bat,Slow Left-arm Orthodox,Australia,Player,Kings Xi Punjab,Royal Challengers Bangalore,2008,1,25,1,Blank,Blank,Yuvraj Singh,R Dravid,U Kaul,Mv Boucher,1983-07-09
13463,33602100139,336021,139,La Pomersbach,9/28/1984,Left-hand Bat,Right-arm Offbreak,Australia,Player,Kings Xi Punjab,Royal Challengers Bangalore,2008,0,24,1,Blank,Blank,Yuvraj Singh,R Dravid,U Kaul,Mv Boucher,1984-09-28
13467,33602200087,336022,87,Mk Tiwary,11/14/1985,Right-hand Bat,Legbreak Googly,India,Player,Delhi Daredevils,Kolkata Knight Riders,2008,0,23,0,Blank,Blank,V Sehwag,Sc Ganguly,Ab De Villiers,Wp Saha,1985-11-14
13468,33602200090,336022,90,Mf Maharoof,9/7/1984,Right-hand Bat,Right-arm Fast-medium,India,Player,Delhi Daredevils,Kolkata Knight Riders,2008,0,24,0,Blank,Blank,V Sehwag,Sc Ganguly,Ab De Villiers,Wp Saha,1984-09-07
13469,33602200091,336022,91,Vy Mahesh,12/21/1987,Right-hand Bat,Right-arm Medium-fast,India,Player,Delhi Daredevils,Kolkata Knight Riders,2008,0,21,0,Blank,Blank,V Sehwag,Sc Ganguly,Ab De Villiers,Wp Saha,1987-12-21
13474,33602200136,336022,136,A Mishra,11/24/1982,Right-hand Bat,Legbreak,India,Player,Delhi Daredevils,Kolkata Knight Riders,2008,0,26,0,Blank,Blank,V Sehwag,Sc Ganguly,Ab De Villiers,Wp Saha,1982-11-24
13478,33602200063,336022,63,Lr Shukla,5/6/1981,Right-hand Bat,Right-arm Medium,India,Player,Kolkata Knight Riders,Delhi Daredevils,2008,0,27,1,Blank,Blank,Sc Ganguly,V Sehwag,Wp Saha,Ab De Villiers,1981-05-06
13479,33602200084,336022,84,I Sharma,9/2/1988,Right-hand Bat,Right-arm Fast-medium,India,Player,Kolkata Knight Riders,Delhi Daredevils,2008,0,20,1,Blank,Blank,Sc Ganguly,V Sehwag,Wp Saha,Ab De Villiers,1988-09-02
13482,33602200128,336022,128,A Chopra,9/19/1977,Right-hand Bat,Right-arm Offbreak,India,Player,Kolkata Knight Riders,Delhi Daredevils,2008,0,31,1,Blank,Blank,Sc Ganguly,V Sehwag,Wp Saha,Ab De Villiers,1977-09-19
13483,33602200129,336022,129,T Taibu,5/14/1983,Right-hand Bat,Right-arm Medium,Zimbabwea,Player,Kolkata Knight Riders,Delhi Daredevils,2008,0,25,1,Blank,Blank,Sc Ganguly,V Sehwag,Wp Saha,Ab De Villiers,1983-05-14
13487,33602300021,336023,21,Sk Raina,11/27/1986,Left-hand Bat,Right-arm Offbreak,India,Player,Chennai Super Kings,Mumbai Indians,2008,0,22,0,Blank,Blank,Ms Dhoni,Sr Tendulkar,Ms Dhoni,Yv Takawale,1986-11-27
13488,33602300023,336023,23,S Badrinath,8/30/1980,Right-hand Bat,Right-arm Offbreak,India,Player,Chennai Super Kings,Mumbai Indians,2008,0,28,0,Blank,Blank,Ms Dhoni,Sr Tendulkar,Ms Dhoni,Yv Takawale,1980-08-30
13491,33602300109,336023,109,Ja Morkel,6/10/1981,Left-hand Bat,Right-arm Medium-fast,South Africa,Player,Chennai Super Kings,Mumbai Indians,2008,0,27,0,Blank,Blank,Ms Dhoni,Sr Tendulkar,Ms Dhoni,Yv Takawale,1981-06-10
13493,33602300120,336023,120,Ms Gony,1/4/1984,Right-hand Bat,Right-arm Medium,India,Player,Chennai Super Kings,Mumbai Indians,2008,0,24,0,Blank,Blank,Ms Dhoni,Sr Tendulkar,Ms Dhoni,Yv Takawale,1984-01-04
13496,33602300151,336023,151,L Balaji,9/27/1981,Right-hand Bat,Right-arm Medium-fast,India,Player,Chennai Super Kings,Mumbai Indians,2008,0,27,0,Blank,Blank,Ms Dhoni,Sr Tendulkar,Ms Dhoni,Yv Takawale,1981-09-27
13497,33602300044,336023,44,St Jayasuriya,6/30/1969,Left-hand Bat,Slow Left-arm Orthodox,Sri Lanka,Player,Mumbai Indians,Chennai Super Kings,2008,1,39,1,Blank,Blank,Sr Tendulkar,Ms Dhoni,Yv Takawale,Ms Dhoni,1969-06-30
13500,33602300048,336023,48,Am Nayar,10/8/1983,Left-hand Bat,Right-arm Medium,India,Player,Mumbai Indians,Chennai Super Kings,2008,0,25,1,Blank,Blank,Sr Tendulkar,Ms Dhoni,Yv Takawale,Ms Dhoni,1983-10-08
13504,33602300080,336023,80,Ds Kulkarni,12/10/1988,Right-hand Bat,Right-arm Medium,India,Player,Mumbai Indians,Chennai Super Kings,2008,0,20,1,Blank,Blank,Sr Tendulkar,Ms Dhoni,Yv Takawale,Ms Dhoni,1988-12-10
13508,33602400031,336024,31,Yk Pathan,11/17/1982,Right-hand Bat,Right-arm Offbreak,India,Player,Rajasthan Royals,Kings Xi Punjab,2008,0,26,0,Blank,Blank,Sr Watson,Yuvraj Singh,Kamran Akmal,Kc Sangakkara,1982-11-17
13509,33602400032,336024,32,Sr Watson,6/17/1981,Right-hand Bat,Right-arm Fast-medium,Australia,Captain,Rajasthan Royals,Kings Xi Punjab,2008,0,27,0,Blank,Blank,Sr Watson,Yuvraj Singh,Kamran Akmal,Kc Sangakkara,1981-06-17
13513,33602400039,336024,39,Sk Trivedi,9/4/1982,Right-hand Bat,Right-arm Medium,India,Player,Rajasthan Royals,Kings Xi Punjab,2008,0,26,0,Blank,Blank,Sr Watson,Yuvraj Singh,Kamran Akmal,Kc Sangakkara,1982-09-04
13516,33602400126,336024,126,Mm Patel,7/12/1983,Right-hand Bat,Right-arm Medium-fast,India,Player,Rajasthan Royals,Kings Xi Punjab,2008,0,25,0,Blank,Blank,Sr Watson,Yuvraj Singh,Kamran Akmal,Kc Sangakkara,1983-07-12
13518,33602400141,336024,141,Younis Khan,11/29/1977,Right-hand Bat,Right-arm Medium,Pakistan,Player,Rajasthan Royals,Kings Xi Punjab,2008,0,31,0,Blank,Blank,Sr Watson,Yuvraj Singh,Kamran Akmal,Kc Sangakkara,1977-11-29
13520,33602400026,336024,26,Kc Sangakkara,10/27/1977,Left-hand Bat,Right-arm Offbreak,Sri Lanka,Keeper,Kings Xi Punjab,Rajasthan Royals,2008,0,31,1,Blank,Blank,Yuvraj Singh,Sr Watson,Kc Sangakkara,Kamran Akmal,1977-10-27
13523,33602400067,336024,67,Pp Chawla,12/24/1988,Left-hand Bat,Legbreak,India,Player,Kings Xi Punjab,Rajasthan Royals,2008,0,20,1,Blank,Blank,Yuvraj Singh,Sr Watson,Kc Sangakkara,Kamran Akmal,1988-12-24
13524,33602400068,336024,68,Wa Mota,9/20/1981,Right-hand Bat,Right-arm Medium,India,Player,Kings Xi Punjab,Rajasthan Royals,2008,0,27,1,Blank,Blank,Yuvraj Singh,Sr Watson,Kc Sangakkara,Kamran Akmal,1981-09-20
13525,33602400077,336024,77,S Sreesanth,2/6/1983,Right-hand Bat,Right-arm Fast-medium,India,Player,Kings Xi Punjab,Rajasthan Royals,2008,0,25,1,Blank,Blank,Yuvraj Singh,Sr Watson,Kc Sangakkara,Kamran Akmal,1983-02-06
13530,33602500053,336025,53,Ac Gilchrist,11/14/1971,Left-hand Bat,Right-arm Offbreak,Australia,Captainkeeper,Deccan Chargers,Delhi Daredevils,2008,0,37,0,Blank,Blank,Ac Gilchrist,V Sehwag,Ac Gilchrist,Kd Karthik,1971-11-14
13535,33602500070,336025,70,Shahid Afridi,3/1/1980,Right-hand Bat,Legbreak Googly,Pakistan,Player,Deccan Chargers,Delhi Daredevils,2008,0,28,0,Blank,Blank,Ac Gilchrist,V Sehwag,Ac Gilchrist,Kd Karthik,1980-03-01
13536,33602500097,336025,97,Hh Gibbs,2/23/1974,Right-hand Bat,Right-arm Bowler,South Africa,Player,Deccan Chargers,Delhi Daredevils,2008,0,34,0,Blank,Blank,Ac Gilchrist,V Sehwag,Ac Gilchrist,Kd Karthik,1974-02-23
13538,33602500131,336025,131,Pp Ojha,9/5/1986,Left-hand Bat,Slow Left-arm Orthodox,India,Player,Deccan Chargers,Delhi Daredevils,2008,0,22,0,Blank,Blank,Ac Gilchrist,V Sehwag,Ac Gilchrist,Kd Karthik,1986-09-05
13540,33602500143,336025,143,Dp Vijaykumar,10/20/1986,Right-hand Bat,Right-arm Medium,India,Player,Deccan Chargers,Delhi Daredevils,2008,0,22,0,Blank,Blank,Ac Gilchrist,V Sehwag,Ac Gilchrist,Kd Karthik,1986-10-20
13541,33602500040,336025,40,G Gambhir,10/14/1981,Left-hand Bat,Legbreak,India,Player,Delhi Daredevils,Deccan Chargers,2008,0,27,1,Blank,Blank,V Sehwag,Ac Gilchrist,Kd Karthik,Ac Gilchrist,1981-10-14
13542,33602500041,336025,41,V Sehwag,10/20/1978,Right-hand Bat,Right-arm Offbreak,India,Captain,Delhi Daredevils,Deccan Chargers,2008,0,30,1,Blank,Blank,V Sehwag,Ac Gilchrist,Kd Karthik,Ac Gilchrist,1978-10-20
13545,33602500088,336025,88,Kd Karthik,6/1/1985,Right-hand Bat,N/a,India,Keeper,Delhi Daredevils,Deccan Chargers,2008,0,23,1,Blank,Blank,V Sehwag,Ac Gilchrist,Kd Karthik,Ac Gilchrist,1985-06-01
13546,33602500089,336025,89,R Bhatia,10/22/1979,Right-hand Bat,Right-arm Medium-fast,India,Player,Delhi Daredevils,Deccan Chargers,2008,0,29,1,Blank,Blank,V Sehwag,Ac Gilchrist,Kd Karthik,Ac Gilchrist,1979-10-22
13552,33602600001,336026,1,Sc Ganguly,7/8/1972,Left-hand Bat,Right-arm Medium,India,Captain,Kolkata Knight Riders,Mumbai Indians,2008,0,36,0,Blank,Blank,Sc Ganguly,Sr Tendulkar,Wp Saha,Yv Takawale,1972-07-08
13554,33602600005,336026,5,Mohammad Hafeez,10/17/1980,Right-hand Bat,Right-arm Offbreak,Pakistan,Player,Kolkata Knight Riders,Mumbai Indians,2008,0,28,0,Blank,Blank,Sc Ganguly,Sr Tendulkar,Wp Saha,Yv Takawale,1980-10-17
13555,33602600062,336026,62,Wp Saha,10/24/1984,Right-hand Bat,N/a,India,Keeper,Kolkata Knight Riders,Mumbai Indians,2008,0,24,0,Blank,Blank,Sc Ganguly,Sr Tendulkar,Wp Saha,Yv Takawale,1984-10-24
13560,33602600106,336026,106,Ab Dinda,3/25/1984,Right-hand Bat,Right-arm Medium-fast,India,Player,Kolkata Knight Riders,Mumbai Indians,2008,0,24,0,Blank,Blank,Sc Ganguly,Sr Tendulkar,Wp Saha,Yv Takawale,1984-03-25
13566,33602600048,336026,48,Am Nayar,10/8/1983,Left-hand Bat,Right-arm Medium,India,Player,Mumbai Indians,Kolkata Knight Riders,2008,0,25,1,Blank,Blank,Sr Tendulkar,Sc Ganguly,Yv Takawale,Wp Saha,1983-10-08
13568,33602600071,336026,71,Dj Bravo,10/7/1983,Right-hand Bat,Right-arm Medium-fast,West Indies,Player,Mumbai Indians,Kolkata Knight Riders,2008,0,25,1,Blank,Blank,Sr Tendulkar,Sc Ganguly,Yv Takawale,Wp Saha,1983-10-07
13573,33602600467,336026,467,Rv Pawar,9/6/1979,Left-hand Bat,Slow Left-arm Orthodox,India,Player,Mumbai Indians,Kolkata Knight Riders,2008,0,29,1,Blank,Blank,Sr Tendulkar,Sc Ganguly,Yv Takawale,Wp Saha,1979-09-06
13580,33602700090,336027,90,Mf Maharoof,9/7/1984,Right-hand Bat,Right-arm Fast-medium,India,Player,Delhi Daredevils,Kings Xi Punjab,2008,0,24,0,Blank,Blank,V Sehwag,Yuvraj Singh,Kd Karthik,U Kaul,1984-09-07
13582,33602700118,336027,118,Gd Mcgrath,2/9/1970,Right-hand Bat,Right-arm Fast-medium,Australia,Player,Delhi Daredevils,Kings Xi Punjab,2008,0,38,0,Blank,Blank,V Sehwag,Yuvraj Singh,Kd Karthik,U Kaul,1970-02-09
13586,33602700027,336027,27,Yuvraj Singh,12/12/1981,Left-hand Bat,Slow Left-arm Orthodox,India,Captain,Kings Xi Punjab,Delhi Daredevils,2008,0,27,1,Blank,Blank,Yuvraj Singh,V Sehwag,U Kaul,Kd Karthik,1981-12-12
13587,33602700029,336027,29,Ik Pathan,10/27/1984,Left-hand Bat,Left-arm Medium-fast,India,Player,Kings Xi Punjab,Delhi Daredevils,2008,0,24,1,Blank,Blank,Yuvraj Singh,V Sehwag,U Kaul,Kd Karthik,1984-10-27
13590,33602700077,336027,77,S Sreesanth,2/6/1983,Right-hand Bat,Right-arm Fast-medium,India,Player,Kings Xi Punjab,Delhi Daredevils,2008,0,25,1,Blank,Blank,Yuvraj Singh,V Sehwag,U Kaul,Kd Karthik,1983-02-06
13591,33602700078,336027,78,Vrv Singh,9/17/1984,Right-hand Bat,Right-arm Medium-fast,India,Player,Kings Xi Punjab,Delhi Daredevils,2008,0,24,1,Blank,Blank,Yuvraj Singh,V Sehwag,U Kaul,Kd Karthik,1984-09-17
13593,33602700134,336027,134,U Kaul,12/2/1987,Left-hand Bat,N/a,India,Keeper,Kings Xi Punjab,Delhi Daredevils,2008,0,21,1,Blank,Blank,Yuvraj Singh,V Sehwag,U Kaul,Kd Karthik,1987-12-02
13595,33602700153,336027,153,Rr Powar,5/20/1978,Right-hand Bat,Right-arm Offbreak,India,Player,Kings Xi Punjab,Delhi Daredevils,2008,0,30,1,Blank,Blank,Yuvraj Singh,V Sehwag,U Kaul,Kd Karthik,1978-05-20
13597,33602800008,336028,8,V Kohli,11/5/1988,Right-hand Bat,Right-arm Medium,India,Player,Royal Challengers Bangalore,Rajasthan Royals,2008,0,20,0,Blank,Blank,R Dravid,Sk Warne,Dt Patil,M Rawat,1988-11-05
13599,33602800010,336028,10,Cl White,8/18/1983,Right-hand Bat,Legbreak Googly,Australia,Player,Royal Challengers Bangalore,Rajasthan Royals,2008,0,25,0,Blank,Blank,R Dravid,Sk Warne,Dt Patil,M Rawat,1983-08-18
13609,33602800033,336028,33,M Kaif,12/1/1980,Right-hand Bat,Right-arm Offbreak,India,Player,Rajasthan Royals,Royal Challengers Bangalore,2008,0,28,1,Blank,Blank,Sk Warne,R Dravid,M Rawat,Dt Patil,1980-12-01
13612,33602800038,336028,38,Sk Warne,9/13/1969,Right-hand Bat,Legbreak Googly,Australia,Captain,Rajasthan Royals,Royal Challengers Bangalore,2008,0,39,1,Blank,Blank,Sk Warne,R Dravid,M Rawat,Dt Patil,1969-09-13
13620,33602900057,336029,57,Rg Sharma,4/30/1987,Right-hand Bat,Right-arm Offbreak,India,Player,Deccan Chargers,Mumbai Indians,2008,0,21,0,Blank,Blank,Ac Gilchrist,Sr Tendulkar,Ac Gilchrist,Yv Takawale,1987-04-30
13622,33602900070,336029,70,Shahid Afridi,3/1/1980,Right-hand Bat,Legbreak Googly,Pakistan,Player,Deccan Chargers,Mumbai Indians,2008,0,28,0,Blank,Blank,Ac Gilchrist,Sr Tendulkar,Ac Gilchrist,Yv Takawale,1980-03-01
13623,33602900098,336029,98,Dnt Zoysa,5/13/1978,Left-hand Bat,Left-arm Fast-medium,Sri Lanka,Player,Deccan Chargers,Mumbai Indians,2008,0,30,0,Blank,Blank,Ac Gilchrist,Sr Tendulkar,Ac Gilchrist,Yv Takawale,1978-05-13
13632,33602900047,336029,47,Pr Shah,11/3/1987,Right-hand Bat,N/a,India,Player,Mumbai Indians,Deccan Chargers,2008,0,21,1,Blank,Blank,Sr Tendulkar,Ac Gilchrist,Yv Takawale,Ac Gilchrist,1987-11-03
13633,33602900048,336029,48,Am Nayar,10/8/1983,Left-hand Bat,Right-arm Medium,India,Player,Mumbai Indians,Deccan Chargers,2008,0,25,1,Blank,Blank,Sr Tendulkar,Ac Gilchrist,Yv Takawale,Ac Gilchrist,1983-10-08
13634,33602900071,336029,71,Dj Bravo,10/7/1983,Right-hand Bat,Right-arm Medium-fast,West Indies,Player,Mumbai Indians,Deccan Chargers,2008,1,25,1,Blank,Blank,Sr Tendulkar,Ac Gilchrist,Yv Takawale,Ac Gilchrist,1983-10-07
13639,33602900149,336029,149,Crd Fernando,7/19/1979,Right-hand Bat,Right-arm Fast-medium,Sri Lanka,Player,Mumbai Indians,Deccan Chargers,2008,0,29,1,Blank,Blank,Sr Tendulkar,Ac Gilchrist,Yv Takawale,Ac Gilchrist,1979-07-19
13640,33603000017,336030,17,Pa Patel,3/9/1985,Left-hand Bat,N/a,India,Player,Chennai Super Kings,Kolkata Knight Riders,2008,0,23,1,Blank,Blank,Ms Dhoni,Sc Ganguly,Ms Dhoni,Wp Saha,1985-03-09
13642,33603000021,336030,21,Sk Raina,11/27/1986,Left-hand Bat,Right-arm Offbreak,India,Player,Chennai Super Kings,Kolkata Knight Riders,2008,0,22,1,Blank,Blank,Ms Dhoni,Sc Ganguly,Ms Dhoni,Wp Saha,1986-11-27
13644,33603000107,336030,107,Sp Fleming,4/1/1973,Left-hand Bat,N/a,New Zealand,Player,Chennai Super Kings,Kolkata Knight Riders,2008,0,35,1,Blank,Blank,Ms Dhoni,Sc Ganguly,Ms Dhoni,Wp Saha,1973-04-01
13645,33603000108,336030,108,S Vidyut,12/3/1981,Left-hand Bat,Slow Left-arm Orthodox,India,Player,Chennai Super Kings,Kolkata Knight Riders,2008,0,27,1,Blank,Blank,Ms Dhoni,Sc Ganguly,Ms Dhoni,Wp Saha,1981-12-03
13646,33603000109,336030,109,Ja Morkel,6/10/1981,Left-hand Bat,Right-arm Medium-fast,South Africa,Player,Chennai Super Kings,Kolkata Knight Riders,2008,0,27,1,Blank,Blank,Ms Dhoni,Sc Ganguly,Ms Dhoni,Wp Saha,1981-06-10
13649,33603000122,336030,122,M Ntini,7/6/1977,Right-hand Bat,Right-arm Fast,South Africa,Player,Chennai Super Kings,Kolkata Knight Riders,2008,1,31,1,Blank,Blank,Ms Dhoni,Sc Ganguly,Ms Dhoni,Wp Saha,1977-07-06
13652,33603000004,336030,4,Dj Hussey,7/15/1977,Right-hand Bat,Right-arm Offbreak,Australia,Player,Kolkata Knight Riders,Chennai Super Kings,2008,0,31,0,Blank,Blank,Sc Ganguly,Ms Dhoni,Wp Saha,Ms Dhoni,1977-07-15
13653,33603000005,336030,5,Mohammad Hafeez,10/17/1980,Right-hand Bat,Right-arm Offbreak,Pakistan,Player,Kolkata Knight Riders,Chennai Super Kings,2008,0,28,0,Blank,Blank,Sc Ganguly,Ms Dhoni,Wp Saha,Ms Dhoni,1980-10-17
13655,33603000063,336030,63,Lr Shukla,5/6/1981,Right-hand Bat,Right-arm Medium,India,Player,Kolkata Knight Riders,Chennai Super Kings,2008,0,27,0,Blank,Blank,Sc Ganguly,Ms Dhoni,Wp Saha,Ms Dhoni,1981-05-06
13659,33603000103,336030,103,Salman Butt,10/7/1984,Left-hand Bat,Right-arm Offbreak,Pakistan,Player,Kolkata Knight Riders,Chennai Super Kings,2008,0,24,0,Blank,Blank,Sc Ganguly,Ms Dhoni,Wp Saha,Ms Dhoni,1984-10-07
13660,33603000106,336030,106,Ab Dinda,3/25/1984,Right-hand Bat,Right-arm Medium-fast,India,Player,Kolkata Knight Riders,Chennai Super Kings,2008,0,24,0,Blank,Blank,Sc Ganguly,Ms Dhoni,Wp Saha,Ms Dhoni,1984-03-25
13662,33603100040,336031,40,G Gambhir,10/14/1981,Left-hand Bat,Legbreak,India,Player,Delhi Daredevils,Royal Challengers Bangalore,2008,0,27,1,Blank,Blank,V Sehwag,R Dravid,Kd Karthik,Sp Goswami,1981-10-14
13668,33603100091,336031,91,Vy Mahesh,12/21/1987,Right-hand Bat,Right-arm Medium-fast,India,Player,Delhi Daredevils,Royal Challengers Bangalore,2008,0,21,1,Blank,Blank,V Sehwag,R Dravid,Kd Karthik,Sp Goswami,1987-12-21
13675,33603100010,336031,10,Cl White,8/18/1983,Right-hand Bat,Legbreak Googly,Australia,Player,Royal Challengers Bangalore,Delhi Daredevils,2008,0,25,0,Blank,Blank,R Dravid,V Sehwag,Sp Goswami,Kd Karthik,1983-08-18
13676,33603100012,336031,12,B Akhil,10/7/1977,Right-hand Bat,Right-arm Medium-fast,India,Player,Royal Challengers Bangalore,Delhi Daredevils,2008,0,31,0,Blank,Blank,R Dravid,V Sehwag,Sp Goswami,Kd Karthik,1977-10-07
13677,33603100014,336031,14,P Kumar,10/2/1986,Right-hand Bat,Right-arm Medium,India,Player,Royal Challengers Bangalore,Delhi Daredevils,2008,0,22,0,Blank,Blank,R Dravid,V Sehwag,Sp Goswami,Kd Karthik,1986-10-02
13684,33603200031,336032,31,Yk Pathan,11/17/1982,Right-hand Bat,Right-arm Offbreak,India,Player,Rajasthan Royals,Kolkata Knight Riders,2008,1,26,1,Blank,Blank,Sk Warne,Sc Ganguly,M Rawat,Wp Saha,1982-11-17
13686,33603200033,336032,33,M Kaif,12/1/1980,Right-hand Bat,Right-arm Offbreak,India,Player,Rajasthan Royals,Kolkata Knight Riders,2008,0,28,1,Blank,Blank,Sk Warne,Sc Ganguly,M Rawat,Wp Saha,1980-12-01
13688,33603200036,336032,36,M Rawat,10/25/1985,Right-hand Bat,N/a,India,Keeper,Rajasthan Royals,Kolkata Knight Riders,2008,0,23,1,Blank,Blank,Sk Warne,Sc Ganguly,M Rawat,Wp Saha,1985-10-25
13689,33603200038,336032,38,Sk Warne,9/13/1969,Right-hand Bat,Legbreak Googly,Australia,Captain,Rajasthan Royals,Kolkata Knight Riders,2008,0,39,1,Blank,Blank,Sk Warne,Sc Ganguly,M Rawat,Wp Saha,1969-09-13
13691,33603200074,336032,74,Gc Smith,2/1/1981,Left-hand Bat,Right-arm Offbreak,South Africa,Player,Rajasthan Royals,Kolkata Knight Riders,2008,0,27,1,Blank,Blank,Sk Warne,Sc Ganguly,M Rawat,Wp Saha,1981-02-01
13692,33603200101,336032,101,Sa Asnodkar,3/29/1984,Right-hand Bat,Right-arm Offbreak,India,Player,Rajasthan Royals,Kolkata Knight Riders,2008,0,24,1,Blank,Blank,Sk Warne,Sc Ganguly,M Rawat,Wp Saha,1984-03-29
13694,33603200126,336032,126,Mm Patel,7/12/1983,Right-hand Bat,Right-arm Medium-fast,India,Player,Rajasthan Royals,Kolkata Knight Riders,2008,0,25,1,Blank,Blank,Sk Warne,Sc Ganguly,M Rawat,Wp Saha,1983-07-12
13695,33603200001,336032,1,Sc Ganguly,7/8/1972,Left-hand Bat,Right-arm Medium,India,Captain,Kolkata Knight Riders,Rajasthan Royals,2008,0,36,0,Blank,Blank,Sc Ganguly,Sk Warne,Wp Saha,M Rawat,1972-07-08
13696,33603200004,336032,4,Dj Hussey,7/15/1977,Right-hand Bat,Right-arm Offbreak,Australia,Player,Kolkata Knight Riders,Rajasthan Royals,2008,0,31,0,Blank,Blank,Sc Ganguly,Sk Warne,Wp Saha,M Rawat,1977-07-15
13697,33603200005,336032,5,Mohammad Hafeez,10/17/1980,Right-hand Bat,Right-arm Offbreak,Pakistan,Player,Kolkata Knight Riders,Rajasthan Royals,2008,0,28,0,Blank,Blank,Sc Ganguly,Sk Warne,Wp Saha,M Rawat,1980-10-17
13699,33603200063,336032,63,Lr Shukla,5/6/1981,Right-hand Bat,Right-arm Medium,India,Player,Kolkata Knight Riders,Rajasthan Royals,2008,0,27,0,Blank,Blank,Sc Ganguly,Sk Warne,Wp Saha,M Rawat,1981-05-06
13700,33603200082,336032,82,Ab Agarkar,12/4/1977,Right-hand Bat,Right-arm Fast,India,Player,Kolkata Knight Riders,Rajasthan Royals,2008,0,31,0,Blank,Blank,Sc Ganguly,Sk Warne,Wp Saha,M Rawat,1977-12-04
13701,33603200084,336032,84,I Sharma,9/2/1988,Right-hand Bat,Right-arm Fast-medium,India,Player,Kolkata Knight Riders,Rajasthan Royals,2008,0,20,0,Blank,Blank,Sc Ganguly,Sk Warne,Wp Saha,M Rawat,1988-09-02
13705,33603200106,336032,106,Ab Dinda,3/25/1984,Right-hand Bat,Right-arm Medium-fast,India,Player,Kolkata Knight Riders,Rajasthan Royals,2008,0,24,0,Blank,Blank,Sc Ganguly,Sk Warne,Wp Saha,M Rawat,1984-03-25
13706,33603300044,336033,44,St Jayasuriya,6/30/1969,Left-hand Bat,Slow Left-arm Orthodox,Sri Lanka,Player,Mumbai Indians,Kings Xi Punjab,2008,0,39,0,Blank,Blank,Sr Tendulkar,Yuvraj Singh,Pr Shah,U Kaul,1969-06-30
13707,33603300046,336033,46,Rv Uthappa,11/11/1985,Right-hand Bat,Right-arm Medium,India,Player,Mumbai Indians,Kings Xi Punjab,2008,0,23,0,Blank,Blank,Sr Tendulkar,Yuvraj Singh,Pr Shah,U Kaul,1985-11-11
13712,33603300133,336033,133,Sr Tendulkar,4/24/1973,Right-hand Bat,Right-arm Offbreak,India,Captain,Mumbai Indians,Kings Xi Punjab,2008,0,35,0,Blank,Blank,Sr Tendulkar,Yuvraj Singh,Pr Shah,U Kaul,1973-04-24
13714,33603300148,336033,148,Sd Chitnis,5/6/1987,Right-hand Bat,Right-arm Offbreak,India,Player,Mumbai Indians,Kings Xi Punjab,2008,0,21,0,Blank,Blank,Sr Tendulkar,Yuvraj Singh,Pr Shah,U Kaul,1987-05-06
13718,33603300027,336033,27,Yuvraj Singh,12/12/1981,Left-hand Bat,Slow Left-arm Orthodox,India,Captain,Kings Xi Punjab,Mumbai Indians,2008,0,27,1,Blank,Blank,Yuvraj Singh,Sr Tendulkar,U Kaul,Pr Shah,1981-12-12
13719,33603300029,336033,29,Ik Pathan,10/27/1984,Left-hand Bat,Left-arm Medium-fast,India,Player,Kings Xi Punjab,Mumbai Indians,2008,0,24,1,Blank,Blank,Yuvraj Singh,Sr Tendulkar,U Kaul,Pr Shah,1984-10-27
13721,33603300067,336033,67,Pp Chawla,12/24/1988,Left-hand Bat,Legbreak,India,Player,Kings Xi Punjab,Mumbai Indians,2008,0,20,1,Blank,Blank,Yuvraj Singh,Sr Tendulkar,U Kaul,Pr Shah,1988-12-24
13722,33603300077,336033,77,S Sreesanth,2/6/1983,Right-hand Bat,Right-arm Fast-medium,India,Player,Kings Xi Punjab,Mumbai Indians,2008,0,25,1,Blank,Blank,Yuvraj Singh,Sr Tendulkar,U Kaul,Pr Shah,1983-02-06
13725,33603300100,336033,100,Se Marsh,7/9/1983,Left-hand Bat,Slow Left-arm Orthodox,Australia,Player,Kings Xi Punjab,Mumbai Indians,2008,1,25,1,Blank,Blank,Yuvraj Singh,Sr Tendulkar,U Kaul,Pr Shah,1983-07-09
13728,33603400006,336034,6,R Dravid,1/11/1973,Right-hand Bat,Right-arm Offbreak,India,Captain,Royal Challengers Bangalore,Chennai Super Kings,2008,0,35,1,Blank,Blank,R Dravid,Ms Dhoni,Mv Boucher,Pa Patel,1973-01-11
13731,33603400011,336034,11,Mv Boucher,12/3/1976,Right-hand Bat,Right-arm Medium,South Africa,Keeper,Royal Challengers Bangalore,Chennai Super Kings,2008,0,32,1,Blank,Blank,R Dravid,Ms Dhoni,Mv Boucher,Pa Patel,1976-12-03
13737,33603400124,336034,124,A Kumble,10/17/1970,Right-hand Bat,Legbreak Googly,India,Player,Royal Challengers Bangalore,Chennai Super Kings,2008,1,38,1,Blank,Blank,R Dravid,Ms Dhoni,Mv Boucher,Pa Patel,1970-10-17
13739,33603400017,336034,17,Pa Patel,3/9/1985,Left-hand Bat,N/a,India,Keeper,Chennai Super Kings,Royal Challengers Bangalore,2008,0,23,0,Blank,Blank,Ms Dhoni,R Dravid,Pa Patel,Mv Boucher,1985-03-09
13740,33603400020,336034,20,Ms Dhoni,7/7/1981,Right-hand Bat,Right-arm Medium,India,Captain,Chennai Super Kings,Royal Challengers Bangalore,2008,0,27,0,Blank,Blank,Ms Dhoni,R Dravid,Pa Patel,Mv Boucher,1981-07-07
13743,33603400107,336034,107,Sp Fleming,4/1/1973,Left-hand Bat,N/a,New Zealand,Player,Chennai Super Kings,Royal Challengers Bangalore,2008,0,35,0,Blank,Blank,Ms Dhoni,R Dravid,Pa Patel,Mv Boucher,1973-04-01
13745,33603400109,336034,109,Ja Morkel,6/10/1981,Left-hand Bat,Right-arm Medium-fast,South Africa,Player,Chennai Super Kings,Royal Challengers Bangalore,2008,0,27,0,Blank,Blank,Ms Dhoni,R Dravid,Pa Patel,Mv Boucher,1981-06-10
13749,33603400151,336034,151,L Balaji,9/27/1981,Right-hand Bat,Right-arm Medium-fast,India,Player,Chennai Super Kings,Royal Challengers Bangalore,2008,0,27,0,Blank,Blank,Ms Dhoni,R Dravid,Pa Patel,Mv Boucher,1981-09-27
13758,33603600112,336036,112,Db Ravi Teja,9/5/1987,Right-hand Bat,Legbreak Googly,India,Player,Deccan Chargers,Kings Xi Punjab,2008,0,21,0,Blank,Blank,Ac Gilchrist,Yuvraj Singh,Ac Gilchrist,Kc Sangakkara,1987-09-05
13760,33603600143,336036,143,Dp Vijaykumar,10/20/1986,Right-hand Bat,Right-arm Medium,India,Player,Deccan Chargers,Kings Xi Punjab,2008,0,22,0,Blank,Blank,Ac Gilchrist,Yuvraj Singh,Ac Gilchrist,Kc Sangakkara,1986-10-20
13762,33603600027,336036,27,Yuvraj Singh,12/12/1981,Left-hand Bat,Slow Left-arm Orthodox,India,Captain,Kings Xi Punjab,Deccan Chargers,2008,0,27,1,Blank,Blank,Yuvraj Singh,Ac Gilchrist,Kc Sangakkara,Ac Gilchrist,1981-12-12
13763,33603600064,336036,64,Dpmd Jayawardene,5/27/1977,Right-hand Bat,Right-arm Medium,Sri Lanka,Player,Kings Xi Punjab,Deccan Chargers,2008,0,31,1,Blank,Blank,Yuvraj Singh,Ac Gilchrist,Kc Sangakkara,Ac Gilchrist,1977-05-27
13767,33603600092,336036,92,Tm Srivastava,11/7/1989,Left-hand Bat,Right-arm Medium,India,Player,Kings Xi Punjab,Deccan Chargers,2008,0,19,1,Blank,Blank,Yuvraj Singh,Ac Gilchrist,Kc Sangakkara,Ac Gilchrist,1989-11-07
13768,33603600100,336036,100,Se Marsh,7/9/1983,Left-hand Bat,Slow Left-arm Orthodox,Australia,Player,Kings Xi Punjab,Deccan Chargers,2008,1,25,1,Blank,Blank,Yuvraj Singh,Ac Gilchrist,Kc Sangakkara,Ac Gilchrist,1983-07-09
13773,33603700041,336037,41,V Sehwag,10/20/1978,Right-hand Bat,Right-arm Offbreak,India,Captain,Delhi Daredevils,Mumbai Indians,2008,0,30,1,Blank,Blank,V Sehwag,Sr Tendulkar,Kd Karthik,Pr Shah,1978-10-20
13774,33603700042,336037,42,S Dhawan,12/5/1985,Left-hand Bat,Right-arm Offbreak,India,Player,Delhi Daredevils,Mumbai Indians,2008,0,23,1,Blank,Blank,V Sehwag,Sr Tendulkar,Kd Karthik,Pr Shah,1985-12-05
13775,33603700087,336037,87,Mk Tiwary,11/14/1985,Right-hand Bat,Legbreak Googly,India,Player,Delhi Daredevils,Mumbai Indians,2008,0,23,1,Blank,Blank,V Sehwag,Sr Tendulkar,Kd Karthik,Pr Shah,1985-11-14
13777,33603700090,336037,90,Mf Maharoof,9/7/1984,Right-hand Bat,Right-arm Fast-medium,India,Player,Delhi Daredevils,Mumbai Indians,2008,0,24,1,Blank,Blank,V Sehwag,Sr Tendulkar,Kd Karthik,Pr Shah,1984-09-07
13780,33603700135,336037,135,Tm Dilshan,10/14/1976,Right-hand Bat,Right-arm Offbreak,Sri Lanka,Player,Delhi Daredevils,Mumbai Indians,2008,0,32,1,Blank,Blank,V Sehwag,Sr Tendulkar,Kd Karthik,Pr Shah,1976-10-14
13782,33603700436,336037,436,B Geeves,6/13/1982,Right-hand Bat,Right-arm Fast-medium,Australia,Player,Delhi Daredevils,Mumbai Indians,2008,0,26,1,Blank,Blank,V Sehwag,Sr Tendulkar,Kd Karthik,Pr Shah,1982-06-13
13784,33603700046,336037,46,Rv Uthappa,11/11/1985,Right-hand Bat,Right-arm Medium,India,Player,Mumbai Indians,Delhi Daredevils,2008,0,23,0,Blank,Blank,Sr Tendulkar,V Sehwag,Pr Shah,Kd Karthik,1985-11-11
13786,33603700048,336037,48,Am Nayar,10/8/1983,Left-hand Bat,Right-arm Medium,India,Player,Mumbai Indians,Delhi Daredevils,2008,0,25,0,Blank,Blank,Sr Tendulkar,V Sehwag,Pr Shah,Kd Karthik,1983-10-08
13792,33603700148,336037,148,Sd Chitnis,5/6/1987,Right-hand Bat,Right-arm Offbreak,India,Player,Mumbai Indians,Delhi Daredevils,2008,0,21,0,Blank,Blank,Sr Tendulkar,V Sehwag,Pr Shah,Kd Karthik,1987-05-06
13793,33603700438,336037,438,A Nel,7/15/1977,Right-hand Bat,Right-arm Fast-medium,South Africa,Player,Mumbai Indians,Delhi Daredevils,2008,0,31,0,Blank,Blank,Sr Tendulkar,V Sehwag,Pr Shah,Kd Karthik,1977-07-15
13794,33603800030,336038,30,T Kohli,12/17/1988,Right-hand Bat,Right-arm Medium,India,Player,Rajasthan Royals,Chennai Super Kings,2008,0,20,1,Blank,Blank,Sk Warne,Ms Dhoni,Kamran Akmal,Pa Patel,1988-12-17
13797,33603800037,336038,37,D Salunkhe,11/12/1982,Right-hand Bat,Legbreak,India,Player,Rajasthan Royals,Chennai Super Kings,2008,0,26,1,Blank,Blank,Sk Warne,Ms Dhoni,Kamran Akmal,Pa Patel,1982-11-12
13799,33603800069,336038,69,Kamran Akmal,1/13/1982,Right-hand Bat,N/a,Pakistan,Keeper,Rajasthan Royals,Chennai Super Kings,2008,0,26,1,Blank,Blank,Sk Warne,Ms Dhoni,Kamran Akmal,Pa Patel,1982-01-13
13803,33603800102,336038,102,Sohail Tanvir,12/12/1984,Left-hand Bat,Left-arm Medium-fast,Pakistan,Player,Rajasthan Royals,Chennai Super Kings,2008,0,24,1,Blank,Blank,Sk Warne,Ms Dhoni,Kamran Akmal,Pa Patel,1984-12-12
13804,33603800126,336038,126,Mm Patel,7/12/1983,Right-hand Bat,Right-arm Medium-fast,India,Player,Rajasthan Royals,Chennai Super Kings,2008,0,25,1,Blank,Blank,Sk Warne,Ms Dhoni,Kamran Akmal,Pa Patel,1983-07-12
13807,33603800021,336038,21,Sk Raina,11/27/1986,Left-hand Bat,Right-arm Offbreak,India,Player,Chennai Super Kings,Rajasthan Royals,2008,0,22,0,Blank,Blank,Ms Dhoni,Sk Warne,Pa Patel,Kamran Akmal,1986-11-27
13808,33603800023,336038,23,S Badrinath,8/30/1980,Right-hand Bat,Right-arm Offbreak,India,Player,Chennai Super Kings,Rajasthan Royals,2008,0,28,0,Blank,Blank,Ms Dhoni,Sk Warne,Pa Patel,Kamran Akmal,1980-08-30
13809,33603800107,336038,107,Sp Fleming,4/1/1973,Left-hand Bat,N/a,New Zealand,Player,Chennai Super Kings,Rajasthan Royals,2008,0,35,0,Blank,Blank,Ms Dhoni,Sk Warne,Pa Patel,Kamran Akmal,1973-04-01
13811,33603800120,336038,120,Ms Gony,1/4/1984,Right-hand Bat,Right-arm Medium,India,Player,Chennai Super Kings,Rajasthan Royals,2008,0,24,0,Blank,Blank,Ms Dhoni,Sk Warne,Pa Patel,Kamran Akmal,1984-01-04
13814,33603800151,336038,151,L Balaji,9/27/1981,Right-hand Bat,Right-arm Medium-fast,India,Player,Chennai Super Kings,Rajasthan Royals,2008,0,27,0,Blank,Blank,Ms Dhoni,Sk Warne,Pa Patel,Kamran Akmal,1981-09-27
13818,33603900057,336039,57,Rg Sharma,4/30/1987,Right-hand Bat,Right-arm Offbreak,India,Player,Deccan Chargers,Royal Challengers Bangalore,2008,0,21,0,Blank,Blank,Vvs Laxman,R Dravid,Ac Gilchrist,Mv Boucher,1987-04-30
13822,33603900070,336039,70,Shahid Afridi,3/1/1980,Right-hand Bat,Legbreak Googly,Pakistan,Player,Deccan Chargers,Royal Challengers Bangalore,2008,0,28,0,Blank,Blank,Vvs Laxman,R Dravid,Ac Gilchrist,Mv Boucher,1980-03-01
13823,33603900097,336039,97,Hh Gibbs,2/23/1974,Right-hand Bat,Right-arm Bowler,South Africa,Player,Deccan Chargers,Royal Challengers Bangalore,2008,0,34,0,Blank,Blank,Vvs Laxman,R Dravid,Ac Gilchrist,Mv Boucher,1974-02-23
13824,33603900131,336039,131,Pp Ojha,9/5/1986,Left-hand Bat,Slow Left-arm Orthodox,India,Player,Deccan Chargers,Royal Challengers Bangalore,2008,0,22,0,Blank,Blank,Vvs Laxman,R Dravid,Ac Gilchrist,Mv Boucher,1986-09-05
13826,33603900232,336039,232,Ut Yadav,10/25/1987,Right-hand Bat,Right-arm Fast-medium,India,Player,Deccan Chargers,Royal Challengers Bangalore,2008,0,21,0,Blank,Blank,Vvs Laxman,R Dravid,Ac Gilchrist,Mv Boucher,1987-10-25
13827,33603900006,336039,6,R Dravid,1/11/1973,Right-hand Bat,Right-arm Offbreak,India,Captain,Royal Challengers Bangalore,Deccan Chargers,2008,0,35,1,Blank,Blank,R Dravid,Vvs Laxman,Mv Boucher,Ac Gilchrist,1973-01-11
13830,33603900009,336039,9,Jh Kallis,10/16/1975,Right-hand Bat,Right-arm Fast-medium,South Africa,Player,Royal Challengers Bangalore,Deccan Chargers,2008,0,33,1,Blank,Blank,R Dravid,Vvs Laxman,Mv Boucher,Ac Gilchrist,1975-10-16
13833,33603900015,336039,15,Z Khan,10/7/1978,Right-hand Bat,Left-arm Fast-medium,India,Player,Royal Challengers Bangalore,Deccan Chargers,2008,0,30,1,Blank,Blank,R Dravid,Vvs Laxman,Mv Boucher,Ac Gilchrist,1978-10-07
13834,33603900093,336039,93,B Chipli,1/27/1983,Right-hand Bat,Right-arm Medium,India,Player,Royal Challengers Bangalore,Deccan Chargers,2008,0,25,1,Blank,Blank,R Dravid,Vvs Laxman,Mv Boucher,Ac Gilchrist,1983-01-27
13835,33603900094,336039,94,Dw Steyn,6/27/1983,Right-hand Bat,Right-arm Fast,South Africa,Player,Royal Challengers Bangalore,Deccan Chargers,2008,0,25,1,Blank,Blank,R Dravid,Vvs Laxman,Mv Boucher,Ac Gilchrist,1983-06-27
13839,33604000026,336040,26,Kc Sangakkara,10/27/1977,Left-hand Bat,Right-arm Offbreak,Sri Lanka,Keeper,Kings Xi Punjab,Kolkata Knight Riders,2008,0,31,0,Blank,Blank,Yuvraj Singh,Sc Ganguly,Kc Sangakkara,Wp Saha,1977-10-27
13842,33604000064,336040,64,Dpmd Jayawardene,5/27/1977,Right-hand Bat,Right-arm Medium,Sri Lanka,Player,Kings Xi Punjab,Kolkata Knight Riders,2008,0,31,0,Blank,Blank,Yuvraj Singh,Sc Ganguly,Kc Sangakkara,Wp Saha,1977-05-27
13843,33604000067,336040,67,Pp Chawla,12/24/1988,Left-hand Bat,Legbreak,India,Player,Kings Xi Punjab,Kolkata Knight Riders,2008,0,20,0,Blank,Blank,Yuvraj Singh,Sc Ganguly,Kc Sangakkara,Wp Saha,1988-12-24
13844,33604000077,336040,77,S Sreesanth,2/6/1983,Right-hand Bat,Right-arm Fast-medium,India,Player,Kings Xi Punjab,Kolkata Knight Riders,2008,0,25,0,Blank,Blank,Yuvraj Singh,Sc Ganguly,Kc Sangakkara,Wp Saha,1983-02-06
13845,33604000078,336040,78,Vrv Singh,9/17/1984,Right-hand Bat,Right-arm Medium-fast,India,Player,Kings Xi Punjab,Kolkata Knight Riders,2008,0,24,0,Blank,Blank,Yuvraj Singh,Sc Ganguly,Kc Sangakkara,Wp Saha,1984-09-17
13848,33604000153,336040,153,Rr Powar,5/20/1978,Right-hand Bat,Right-arm Offbreak,India,Player,Kings Xi Punjab,Kolkata Knight Riders,2008,0,30,0,Blank,Blank,Yuvraj Singh,Sc Ganguly,Kc Sangakkara,Wp Saha,1978-05-20
13850,33604000004,336040,4,Dj Hussey,7/15/1977,Right-hand Bat,Right-arm Offbreak,Australia,Player,Kolkata Knight Riders,Kings Xi Punjab,2008,0,31,1,Blank,Blank,Sc Ganguly,Yuvraj Singh,Wp Saha,Kc Sangakkara,1977-07-15
13851,33604000062,336040,62,Wp Saha,10/24/1984,Right-hand Bat,N/a,India,Keeper,Kolkata Knight Riders,Kings Xi Punjab,2008,0,24,1,Blank,Blank,Sc Ganguly,Yuvraj Singh,Wp Saha,Kc Sangakkara,1984-10-24
13857,33604000106,336040,106,Ab Dinda,3/25/1984,Right-hand Bat,Right-arm Medium-fast,India,Player,Kolkata Knight Riders,Kings Xi Punjab,2008,0,24,1,Blank,Blank,Sc Ganguly,Yuvraj Singh,Wp Saha,Kc Sangakkara,1984-03-25
13859,33604000174,336040,174,Baw Mendis,3/11/1985,Right-hand Bat,Right-arm Offbreak,Sri Lanka,Player,Kolkata Knight Riders,Kings Xi Punjab,2008,0,23,1,Blank,Blank,Sc Ganguly,Yuvraj Singh,Wp Saha,Kc Sangakkara,1985-03-11
13860,33604100031,336041,31,Yk Pathan,11/17/1982,Right-hand Bat,Right-arm Offbreak,India,Player,Rajasthan Royals,Mumbai Indians,2008,0,26,1,Blank,Blank,Sk Warne,Sr Tendulkar,Kamran Akmal,Yv Takawale,1982-11-17
13861,33604100032,336041,32,Sr Watson,6/17/1981,Right-hand Bat,Right-arm Fast-medium,Australia,Player,Rajasthan Royals,Mumbai Indians,2008,0,27,1,Blank,Blank,Sk Warne,Sr Tendulkar,Kamran Akmal,Yv Takawale,1981-06-17
13862,33604100033,336041,33,M Kaif,12/1/1980,Right-hand Bat,Right-arm Offbreak,India,Player,Rajasthan Royals,Mumbai Indians,2008,0,28,1,Blank,Blank,Sk Warne,Sr Tendulkar,Kamran Akmal,Yv Takawale,1980-12-01
13864,33604100038,336041,38,Sk Warne,9/13/1969,Right-hand Bat,Legbreak Googly,Australia,Captain,Rajasthan Royals,Mumbai Indians,2008,0,39,1,Blank,Blank,Sk Warne,Sr Tendulkar,Kamran Akmal,Yv Takawale,1969-09-13
13866,33604100069,336041,69,Kamran Akmal,1/13/1982,Right-hand Bat,N/a,Pakistan,Keeper,Rajasthan Royals,Mumbai Indians,2008,0,26,1,Blank,Blank,Sk Warne,Sr Tendulkar,Kamran Akmal,Yv Takawale,1982-01-13
13869,33604100102,336041,102,Sohail Tanvir,12/12/1984,Left-hand Bat,Left-arm Medium-fast,Pakistan,Player,Rajasthan Royals,Mumbai Indians,2008,1,24,1,Blank,Blank,Sk Warne,Sr Tendulkar,Kamran Akmal,Yv Takawale,1984-12-12
13872,33604100046,336041,46,Rv Uthappa,11/11/1985,Right-hand Bat,Right-arm Medium,India,Player,Mumbai Indians,Rajasthan Royals,2008,0,23,0,Blank,Blank,Sr Tendulkar,Sk Warne,Yv Takawale,Kamran Akmal,1985-11-11
13873,33604100048,336041,48,Am Nayar,10/8/1983,Left-hand Bat,Right-arm Medium,India,Player,Mumbai Indians,Rajasthan Royals,2008,0,25,0,Blank,Blank,Sr Tendulkar,Sk Warne,Yv Takawale,Kamran Akmal,1983-10-08
13876,33604100096,336041,96,Mk Pandey,9/10/1989,Right-hand Bat,Right-arm Medium,India,Player,Mumbai Indians,Rajasthan Royals,2008,0,19,0,Blank,Blank,Sr Tendulkar,Sk Warne,Yv Takawale,Kamran Akmal,1989-09-10
13877,33604100114,336041,114,Yv Takawale,11/5/1984,Right-hand Bat,N/a,India,Keeper,Mumbai Indians,Rajasthan Royals,2008,0,24,0,Blank,Blank,Sr Tendulkar,Sk Warne,Yv Takawale,Kamran Akmal,1984-11-05
13878,33604100115,336041,115,Rr Raje,9/3/1986,Right-hand Bat,Right-arm Fast-medium,India,Player,Mumbai Indians,Rajasthan Royals,2008,0,22,0,Blank,Blank,Sr Tendulkar,Sk Warne,Yv Takawale,Kamran Akmal,1986-09-03
13884,33604200058,336042,58,Sb Styris,7/10/1975,Right-hand Bat,Right-arm Medium,New Zealand,Player,Deccan Chargers,Chennai Super Kings,2008,0,33,0,Blank,Blank,Ac Gilchrist,Ms Dhoni,Ac Gilchrist,Pa Patel,1975-07-10
13886,33604200070,336042,70,Shahid Afridi,3/1/1980,Right-hand Bat,Legbreak Googly,Pakistan,Player,Deccan Chargers,Chennai Super Kings,2008,0,28,0,Blank,Blank,Ac Gilchrist,Ms Dhoni,Ac Gilchrist,Pa Patel,1980-03-01
13887,33604200097,336042,97,Hh Gibbs,2/23/1974,Right-hand Bat,Right-arm Bowler,South Africa,Player,Deccan Chargers,Chennai Super Kings,2008,0,34,0,Blank,Blank,Ac Gilchrist,Ms Dhoni,Ac Gilchrist,Pa Patel,1974-02-23
13894,33604200020,336042,20,Ms Dhoni,7/7/1981,Right-hand Bat,Right-arm Medium,India,Captain,Chennai Super Kings,Deccan Chargers,2008,0,27,1,Blank,Blank,Ms Dhoni,Ac Gilchrist,Pa Patel,Ac Gilchrist,1981-07-07
13901,33604200122,336042,122,M Ntini,7/6/1977,Right-hand Bat,Right-arm Fast,South Africa,Player,Chennai Super Kings,Deccan Chargers,2008,0,31,1,Blank,Blank,Ms Dhoni,Ac Gilchrist,Pa Patel,Ac Gilchrist,1977-07-06
13903,33604200152,336042,152,A Mukund,1/6/1990,Left-hand Bat,Legbreak Googly,India,Player,Chennai Super Kings,Deccan Chargers,2008,0,18,1,Blank,Blank,Ms Dhoni,Ac Gilchrist,Pa Patel,Ac Gilchrist,1990-01-06
13906,33604300042,336043,42,S Dhawan,12/5/1985,Left-hand Bat,Right-arm Offbreak,India,Player,Delhi Daredevils,Rajasthan Royals,2008,0,23,0,Blank,Blank,V Sehwag,Sk Warne,Kd Karthik,M Rawat,1985-12-05
13908,33604300088,336043,88,Kd Karthik,6/1/1985,Right-hand Bat,N/a,India,Keeper,Delhi Daredevils,Rajasthan Royals,2008,0,23,0,Blank,Blank,V Sehwag,Sk Warne,Kd Karthik,M Rawat,1985-06-01
13911,33604300117,336043,117,Mohammad Asif,12/20/1982,Left-hand Bat,Right-arm Fast-medium,Pakistan,Player,Delhi Daredevils,Rajasthan Royals,2008,0,26,0,Blank,Blank,V Sehwag,Sk Warne,Kd Karthik,M Rawat,1982-12-20
13914,33604300136,336043,136,A Mishra,11/24/1982,Right-hand Bat,Legbreak,India,Player,Delhi Daredevils,Rajasthan Royals,2008,0,26,0,Blank,Blank,V Sehwag,Sk Warne,Kd Karthik,M Rawat,1982-11-24
13915,33604300031,336043,31,Yk Pathan,11/17/1982,Right-hand Bat,Right-arm Offbreak,India,Player,Rajasthan Royals,Delhi Daredevils,2008,0,26,1,Blank,Blank,Sk Warne,V Sehwag,M Rawat,Kd Karthik,1982-11-17
13919,33604300036,336043,36,M Rawat,10/25/1985,Right-hand Bat,N/a,India,Keeper,Rajasthan Royals,Delhi Daredevils,2008,0,23,1,Blank,Blank,Sk Warne,V Sehwag,M Rawat,Kd Karthik,1985-10-25
13920,33604300038,336043,38,Sk Warne,9/13/1969,Right-hand Bat,Legbreak Googly,Australia,Captain,Rajasthan Royals,Delhi Daredevils,2008,0,39,1,Blank,Blank,Sk Warne,V Sehwag,M Rawat,Kd Karthik,1969-09-13
13923,33604300101,336043,101,Sa Asnodkar,3/29/1984,Right-hand Bat,Right-arm Offbreak,India,Player,Rajasthan Royals,Delhi Daredevils,2008,0,24,1,Blank,Blank,Sk Warne,V Sehwag,M Rawat,Kd Karthik,1984-03-29
13924,33604300102,336043,102,Sohail Tanvir,12/12/1984,Left-hand Bat,Left-arm Medium-fast,Pakistan,Player,Rajasthan Royals,Delhi Daredevils,2008,0,24,1,Blank,Blank,Sk Warne,V Sehwag,M Rawat,Kd Karthik,1984-12-12
13925,33604300126,336043,126,Mm Patel,7/12/1983,Right-hand Bat,Right-arm Medium-fast,India,Player,Rajasthan Royals,Delhi Daredevils,2008,0,25,1,Blank,Blank,Sk Warne,V Sehwag,M Rawat,Kd Karthik,1983-07-12
13928,33604400027,336044,27,Yuvraj Singh,12/12/1981,Left-hand Bat,Slow Left-arm Orthodox,India,Captain,Kings Xi Punjab,Chennai Super Kings,2008,0,27,0,Blank,Blank,Yuvraj Singh,Ms Dhoni,Kc Sangakkara,Pa Patel,1981-12-12
13930,33604400064,336044,64,Dpmd Jayawardene,5/27/1977,Right-hand Bat,Right-arm Medium,Sri Lanka,Player,Kings Xi Punjab,Chennai Super Kings,2008,0,31,0,Blank,Blank,Yuvraj Singh,Ms Dhoni,Kc Sangakkara,Pa Patel,1977-05-27
13931,33604400067,336044,67,Pp Chawla,12/24/1988,Left-hand Bat,Legbreak,India,Player,Kings Xi Punjab,Chennai Super Kings,2008,0,20,0,Blank,Blank,Yuvraj Singh,Ms Dhoni,Kc Sangakkara,Pa Patel,1988-12-24
13932,33604400068,336044,68,Wa Mota,9/20/1981,Right-hand Bat,Right-arm Medium,India,Player,Kings Xi Punjab,Chennai Super Kings,2008,0,27,0,Blank,Blank,Yuvraj Singh,Ms Dhoni,Kc Sangakkara,Pa Patel,1981-09-20
13938,33604400020,336044,20,Ms Dhoni,7/7/1981,Right-hand Bat,Right-arm Medium,India,Captain,Chennai Super Kings,Kings Xi Punjab,2008,0,27,1,Blank,Blank,Ms Dhoni,Yuvraj Singh,Pa Patel,Kc Sangakkara,1981-07-07
13942,33604400109,336044,109,Ja Morkel,6/10/1981,Left-hand Bat,Right-arm Medium-fast,South Africa,Player,Chennai Super Kings,Kings Xi Punjab,2008,0,27,1,Blank,Blank,Ms Dhoni,Yuvraj Singh,Pa Patel,Kc Sangakkara,1981-06-10
13948,33604500031,336045,31,Yk Pathan,11/17/1982,Right-hand Bat,Right-arm Offbreak,India,Player,Rajasthan Royals,Chennai Super Kings,2008,1,26,1,Blank,Blank,Sk Warne,Ms Dhoni,Kamran Akmal,Pa Patel,1982-11-17
13953,33604500039,336045,39,Sk Trivedi,9/4/1982,Right-hand Bat,Right-arm Medium,India,Player,Rajasthan Royals,Chennai Super Kings,2008,0,26,1,Blank,Blank,Sk Warne,Ms Dhoni,Kamran Akmal,Pa Patel,1982-09-04
13954,33604500069,336045,69,Kamran Akmal,1/13/1982,Right-hand Bat,N/a,Pakistan,Keeper,Rajasthan Royals,Chennai Super Kings,2008,0,26,1,Blank,Blank,Sk Warne,Ms Dhoni,Kamran Akmal,Pa Patel,1982-01-13
13957,33604500126,336045,126,Mm Patel,7/12/1983,Right-hand Bat,Right-arm Medium-fast,India,Player,Rajasthan Royals,Chennai Super Kings,2008,0,25,1,Blank,Blank,Sk Warne,Ms Dhoni,Kamran Akmal,Pa Patel,1983-07-12
13958,33604500138,336045,138,Nk Patel,3/26/1981,Left-hand Bat,N/a,India,Player,Rajasthan Royals,Chennai Super Kings,2008,0,27,1,Blank,Blank,Sk Warne,Ms Dhoni,Kamran Akmal,Pa Patel,1981-03-26
13959,33604500017,336045,17,Pa Patel,3/9/1985,Left-hand Bat,N/a,India,Keeper,Chennai Super Kings,Rajasthan Royals,2008,0,23,0,Blank,Blank,Ms Dhoni,Sk Warne,Pa Patel,Kamran Akmal,1985-03-09
13962,33604500023,336045,23,S Badrinath,8/30/1980,Right-hand Bat,Right-arm Offbreak,India,Player,Chennai Super Kings,Rajasthan Royals,2008,0,28,0,Blank,Blank,Ms Dhoni,Sk Warne,Pa Patel,Kamran Akmal,1980-08-30
13964,33604500109,336045,109,Ja Morkel,6/10/1981,Left-hand Bat,Right-arm Medium-fast,South Africa,Player,Chennai Super Kings,Rajasthan Royals,2008,0,27,0,Blank,Blank,Ms Dhoni,Sk Warne,Pa Patel,Kamran Akmal,1981-06-10
13965,33604500120,336045,120,Ms Gony,1/4/1984,Right-hand Bat,Right-arm Medium,India,Player,Chennai Super Kings,Rajasthan Royals,2008,0,24,0,Blank,Blank,Ms Dhoni,Sk Warne,Pa Patel,Kamran Akmal,1984-01-04
13966,33604500121,336045,121,M Muralitharan,4/17/1972,Right-hand Bat,Right-arm Offbreak,Sri Lanka,Player,Chennai Super Kings,Rajasthan Royals,2008,0,36,0,Blank,Blank,Ms Dhoni,Sk Warne,Pa Patel,Kamran Akmal,1972-04-17
13968,33604500127,336045,127,Ck Kapugedera,2/24/1987,Right-hand Bat,Right-arm Medium,Sri Lanka,Player,Chennai Super Kings,Rajasthan Royals,2008,0,21,0,Blank,Blank,Ms Dhoni,Sk Warne,Pa Patel,Kamran Akmal,1987-02-24
13969,33604500151,336045,151,L Balaji,9/27/1981,Right-hand Bat,Right-arm Medium-fast,India,Player,Chennai Super Kings,Rajasthan Royals,2008,0,27,0,Blank,Blank,Ms Dhoni,Sk Warne,Pa Patel,Kamran Akmal,1981-09-27
13970,39218600017,392186,17,Pa Patel,3/9/1985,Left-hand Bat,N/a,India,Keeper,Chennai Super Kings,Mumbai Indians,2009,0,24,0,Blank,Blank,Ms Dhoni,Sr Tendulkar,Pa Patel,Pr Shah,1985-03-09
13971,39218600018,392186,18,Ml Hayden,10/29/1971,Left-hand Bat,Right-arm Medium,Australia,Player,Chennai Super Kings,Mumbai Indians,2009,0,38,0,Blank,Blank,Ms Dhoni,Sr Tendulkar,Pa Patel,Pr Shah,1971-10-29
13972,39218600020,392186,20,Ms Dhoni,7/7/1981,Right-hand Bat,Right-arm Medium,India,Captain,Chennai Super Kings,Mumbai Indians,2009,0,28,0,Blank,Blank,Ms Dhoni,Sr Tendulkar,Pa Patel,Pr Shah,1981-07-07
13976,39218600119,392186,119,Joginder Sharma,10/23/1983,Right-hand Bat,Right-arm Fast-medium,India,Player,Chennai Super Kings,Mumbai Indians,2009,0,26,0,Blank,Blank,Ms Dhoni,Sr Tendulkar,Pa Patel,Pr Shah,1983-10-23
13977,39218600120,392186,120,Ms Gony,1/4/1984,Right-hand Bat,Right-arm Medium,India,Player,Chennai Super Kings,Mumbai Indians,2009,0,25,0,Blank,Blank,Ms Dhoni,Sr Tendulkar,Pa Patel,Pr Shah,1984-01-04
13982,39218600042,392186,42,S Dhawan,12/5/1985,Left-hand Bat,Right-arm Offbreak,India,Player,Mumbai Indians,Chennai Super Kings,2009,0,24,1,Blank,Blank,Sr Tendulkar,Ms Dhoni,Pr Shah,Pa Patel,1985-12-05
13983,39218600044,392186,44,St Jayasuriya,6/30/1969,Left-hand Bat,Slow Left-arm Orthodox,Sri Lanka,Player,Mumbai Indians,Chennai Super Kings,2009,0,40,1,Blank,Blank,Sr Tendulkar,Ms Dhoni,Pr Shah,Pa Patel,1969-06-30
13984,39218600047,392186,47,Pr Shah,11/3/1987,Right-hand Bat,N/a,India,Keeper,Mumbai Indians,Chennai Super Kings,2009,0,22,1,Blank,Blank,Sr Tendulkar,Ms Dhoni,Pr Shah,Pa Patel,1987-11-03
13985,39218600048,392186,48,Am Nayar,10/8/1983,Left-hand Bat,Right-arm Medium,India,Player,Mumbai Indians,Chennai Super Kings,2009,0,26,1,Blank,Blank,Sr Tendulkar,Ms Dhoni,Pr Shah,Pa Patel,1983-10-08
13987,39218600071,392186,71,Dj Bravo,10/7/1983,Right-hand Bat,Right-arm Medium-fast,West Indies,Player,Mumbai Indians,Chennai Super Kings,2009,0,26,1,Blank,Blank,Sr Tendulkar,Ms Dhoni,Pr Shah,Pa Patel,1983-10-07
13989,39218600133,392186,133,Sr Tendulkar,4/24/1973,Right-hand Bat,Right-arm Offbreak,India,Captain,Mumbai Indians,Chennai Super Kings,2009,1,36,1,Blank,Blank,Sr Tendulkar,Ms Dhoni,Pr Shah,Pa Patel,1973-04-24
13992,39218700031,392187,31,Yk Pathan,11/17/1982,Right-hand Bat,Right-arm Offbreak,India,Player,Rajasthan Royals,Royal Challengers Bangalore,2009,0,27,0,Blank,Blank,Sk Warne,Kp Pietersen,M Rawat,Rv Uthappa,1982-11-17
13995,39218700038,392187,38,Sk Warne,9/13/1969,Right-hand Bat,Legbreak Googly,Australia,Captain,Rajasthan Royals,Royal Challengers Bangalore,2009,0,40,0,Blank,Blank,Sk Warne,Kp Pietersen,M Rawat,Rv Uthappa,1969-09-13
13996,39218700074,392187,74,Gc Smith,2/1/1981,Left-hand Bat,Right-arm Offbreak,South Africa,Player,Rajasthan Royals,Royal Challengers Bangalore,2009,0,28,0,Blank,Blank,Sk Warne,Kp Pietersen,M Rawat,Rv Uthappa,1981-02-01
14000,39218700138,392187,138,Nk Patel,3/26/1981,Left-hand Bat,N/a,India,Player,Rajasthan Royals,Royal Challengers Bangalore,2009,0,28,0,Blank,Blank,Sk Warne,Kp Pietersen,M Rawat,Rv Uthappa,1981-03-26
14001,39218700159,392187,159,T Henderson,8/1/1974,Right-hand Bat,Right-arm Fast-medium,South Africa,Player,Rajasthan Royals,Royal Challengers Bangalore,2009,0,35,0,Blank,Blank,Sk Warne,Kp Pietersen,M Rawat,Rv Uthappa,1974-08-01
14003,39218700006,392187,6,R Dravid,1/11/1973,Right-hand Bat,Right-arm Offbreak,India,Player,Royal Challengers Bangalore,Rajasthan Royals,2009,1,36,1,Blank,Blank,Kp Pietersen,Sk Warne,Rv Uthappa,M Rawat,1973-01-11
14008,39218700052,392187,52,Lrpl Taylor,3/8/1984,Right-hand Bat,Right-arm Offbreak,New Zealand,Player,Royal Challengers Bangalore,Rajasthan Royals,2009,0,25,1,Blank,Blank,Kp Pietersen,Sk Warne,Rv Uthappa,M Rawat,1984-03-08
14012,39218700157,392187,157,Jd Ryder,8/6/1984,Left-hand Bat,Right-arm Medium,New Zealand,Player,Royal Challengers Bangalore,Rajasthan Royals,2009,0,25,1,Blank,Blank,Kp Pietersen,Sk Warne,Rv Uthappa,M Rawat,1984-08-06
14015,39218800026,392188,26,Kc Sangakkara,10/27/1977,Left-hand Bat,Right-arm Offbreak,Sri Lanka,Keeper,Kings Xi Punjab,Delhi Daredevils,2009,0,32,0,Blank,Blank,Yuvraj Singh,V Sehwag,Kc Sangakkara,Kd Karthik,1977-10-27
14016,39218800027,392188,27,Yuvraj Singh,12/12/1981,Left-hand Bat,Slow Left-arm Orthodox,India,Captain,Kings Xi Punjab,Delhi Daredevils,2009,0,28,0,Blank,Blank,Yuvraj Singh,V Sehwag,Kc Sangakkara,Kd Karthik,1981-12-12
14017,39218800029,392188,29,Ik Pathan,10/27/1984,Left-hand Bat,Left-arm Medium-fast,India,Player,Kings Xi Punjab,Delhi Daredevils,2009,0,25,0,Blank,Blank,Yuvraj Singh,V Sehwag,Kc Sangakkara,Kd Karthik,1984-10-27
14018,39218800030,392188,30,T Kohli,12/17/1988,Right-hand Bat,Right-arm Medium,India,Player,Kings Xi Punjab,Delhi Daredevils,2009,0,21,0,Blank,Blank,Yuvraj Singh,V Sehwag,Kc Sangakkara,Kd Karthik,1988-12-17
14021,39218800078,392188,78,Vrv Singh,9/17/1984,Right-hand Bat,Right-arm Medium-fast,India,Player,Kings Xi Punjab,Delhi Daredevils,2009,0,25,0,Blank,Blank,Yuvraj Singh,V Sehwag,Kc Sangakkara,Kd Karthik,1984-09-17
14022,39218800161,392188,161,Rs Bopara,5/4/1985,Right-hand Bat,Right-arm Medium,England,Player,Kings Xi Punjab,Delhi Daredevils,2009,0,24,0,Blank,Blank,Yuvraj Singh,V Sehwag,Kc Sangakkara,Kd Karthik,1985-05-04
14024,39218800243,392188,243,Vs Malik,5/9/1983,Right-hand Bat,Right-arm Medium,India,Player,Kings Xi Punjab,Delhi Daredevils,2009,0,26,0,Blank,Blank,Yuvraj Singh,V Sehwag,Kc Sangakkara,Kd Karthik,1983-05-09
14025,39218800040,392188,40,G Gambhir,10/14/1981,Left-hand Bat,Legbreak,India,Player,Delhi Daredevils,Kings Xi Punjab,2009,0,28,1,Blank,Blank,V Sehwag,Yuvraj Singh,Kd Karthik,Kc Sangakkara,1981-10-14
14026,39218800041,392188,41,V Sehwag,10/20/1978,Right-hand Bat,Right-arm Offbreak,India,Captain,Delhi Daredevils,Kings Xi Punjab,2009,0,31,1,Blank,Blank,V Sehwag,Yuvraj Singh,Kd Karthik,Kc Sangakkara,1978-10-20
14029,39218800091,392188,91,Vy Mahesh,12/21/1987,Right-hand Bat,Right-arm Medium-fast,India,Player,Delhi Daredevils,Kings Xi Punjab,2009,0,22,1,Blank,Blank,V Sehwag,Yuvraj Singh,Kd Karthik,Kc Sangakkara,1987-12-21
14030,39218800110,392188,110,Ab De Villiers,2/17/1984,Right-hand Bat,Right-arm Medium,South Africa,Player,Delhi Daredevils,Kings Xi Punjab,2009,0,25,1,Blank,Blank,V Sehwag,Yuvraj Singh,Kd Karthik,Kc Sangakkara,1984-02-17
14035,39218800439,392188,439,Am Salvi,10/20/1981,Right-hand Bat,Right-arm Medium,India,Player,Delhi Daredevils,Kings Xi Punjab,2009,0,28,1,Blank,Blank,V Sehwag,Yuvraj Singh,Kd Karthik,Kc Sangakkara,1981-10-20
14037,39218900054,392189,54,Y Venugopal Rao,2/26/1982,Right-hand Bat,Right-arm Offbreak,India,Player,Deccan Chargers,Kolkata Knight Riders,2009,0,27,1,Blank,Blank,Ac Gilchrist,Bb Mccullum,Ac Gilchrist,Bb Mccullum,1982-02-26
14038,39218900055,392189,55,Vvs Laxman,11/1/1974,Right-hand Bat,Right-arm Offbreak,India,Player,Deccan Chargers,Kolkata Knight Riders,2009,0,35,1,Blank,Blank,Ac Gilchrist,Bb Mccullum,Ac Gilchrist,Bb Mccullum,1974-11-01
14039,39218900057,392189,57,Rg Sharma,4/30/1987,Right-hand Bat,Right-arm Offbreak,India,Player,Deccan Chargers,Kolkata Knight Riders,2009,0,22,1,Blank,Blank,Ac Gilchrist,Bb Mccullum,Ac Gilchrist,Bb Mccullum,1987-04-30
14043,39218900112,392189,112,Db Ravi Teja,9/5/1987,Right-hand Bat,Legbreak Googly,India,Player,Deccan Chargers,Kolkata Knight Riders,2009,0,22,1,Blank,Blank,Ac Gilchrist,Bb Mccullum,Ac Gilchrist,Bb Mccullum,1987-09-05
14047,39218900001,392189,1,Sc Ganguly,7/8/1972,Left-hand Bat,Right-arm Medium,India,Player,Kolkata Knight Riders,Deccan Chargers,2009,0,37,0,Blank,Blank,Bb Mccullum,Ac Gilchrist,Bb Mccullum,Ac Gilchrist,1972-07-08
14052,39218900084,392189,84,I Sharma,9/2/1988,Right-hand Bat,Right-arm Fast-medium,India,Player,Kolkata Knight Riders,Deccan Chargers,2009,0,21,0,Blank,Blank,Bb Mccullum,Ac Gilchrist,Bb Mccullum,Ac Gilchrist,1988-09-02
14055,39218900128,392189,128,A Chopra,9/19/1977,Right-hand Bat,Right-arm Offbreak,India,Player,Kolkata Knight Riders,Deccan Chargers,2009,0,32,0,Blank,Blank,Bb Mccullum,Ac Gilchrist,Bb Mccullum,Ac Gilchrist,1977-09-19
14062,39219000023,392190,23,S Badrinath,8/30/1980,Right-hand Bat,Right-arm Offbreak,India,Player,Chennai Super Kings,Royal Challengers Bangalore,2009,0,29,1,Blank,Blank,Ms Dhoni,Kp Pietersen,Ms Dhoni,Rv Uthappa,1980-08-30
14064,39219000119,392190,119,Joginder Sharma,10/23/1983,Right-hand Bat,Right-arm Fast-medium,India,Player,Chennai Super Kings,Royal Challengers Bangalore,2009,0,26,1,Blank,Blank,Ms Dhoni,Kp Pietersen,Ms Dhoni,Rv Uthappa,1983-10-23
14065,39219000120,392190,120,Ms Gony,1/4/1984,Right-hand Bat,Right-arm Medium,India,Player,Chennai Super Kings,Royal Challengers Bangalore,2009,0,25,1,Blank,Blank,Ms Dhoni,Kp Pietersen,Ms Dhoni,Rv Uthappa,1984-01-04
14066,39219000121,392190,121,M Muralitharan,4/17/1972,Right-hand Bat,Right-arm Offbreak,Sri Lanka,Player,Chennai Super Kings,Royal Challengers Bangalore,2009,1,37,1,Blank,Blank,Ms Dhoni,Kp Pietersen,Ms Dhoni,Rv Uthappa,1972-04-17
14074,39219000052,392190,52,Lrpl Taylor,3/8/1984,Right-hand Bat,Right-arm Offbreak,New Zealand,Player,Royal Challengers Bangalore,Chennai Super Kings,2009,0,25,0,Blank,Blank,Kp Pietersen,Ms Dhoni,Rv Uthappa,Ms Dhoni,1984-03-08
14077,39219000124,392190,124,A Kumble,10/17/1970,Right-hand Bat,Legbreak Googly,India,Player,Royal Challengers Bangalore,Chennai Super Kings,2009,0,39,0,Blank,Blank,Kp Pietersen,Ms Dhoni,Rv Uthappa,Ms Dhoni,1970-10-17
14078,39219000158,392190,158,Kp Pietersen,6/27/1980,Right-hand Bat,Right-arm Offbreak,South Africa,Captain,Royal Challengers Bangalore,Chennai Super Kings,2009,0,29,0,Blank,Blank,Kp Pietersen,Ms Dhoni,Rv Uthappa,Ms Dhoni,1980-06-27
14081,39219100002,392191,2,Bb Mccullum,9/27/1981,Right-hand Bat,Right-arm Medium,New Zealand,Captainkeeper,Kolkata Knight Riders,Kings Xi Punjab,2009,0,28,1,Blank,Blank,Bb Mccullum,Yuvraj Singh,Bb Mccullum,Kc Sangakkara,1981-09-27
14083,39219100083,392191,83,M Kartik,9/11/1976,Left-hand Bat,Slow Left-arm Orthodox,India,Player,Kolkata Knight Riders,Kings Xi Punjab,2009,0,33,1,Blank,Blank,Bb Mccullum,Yuvraj Singh,Bb Mccullum,Kc Sangakkara,1976-09-11
14086,39219100106,392191,106,Ab Dinda,3/25/1984,Right-hand Bat,Right-arm Medium-fast,India,Player,Kolkata Knight Riders,Kings Xi Punjab,2009,0,25,1,Blank,Blank,Bb Mccullum,Yuvraj Singh,Bb Mccullum,Kc Sangakkara,1984-03-25
14087,39219100128,392191,128,A Chopra,9/19/1977,Right-hand Bat,Right-arm Offbreak,India,Player,Kolkata Knight Riders,Kings Xi Punjab,2009,0,32,1,Blank,Blank,Bb Mccullum,Yuvraj Singh,Bb Mccullum,Kc Sangakkara,1977-09-19
14088,39219100162,392191,162,Ch Gayle,9/21/1979,Left-hand Bat,Right-arm Offbreak,West Indies,Player,Kolkata Knight Riders,Kings Xi Punjab,2009,1,30,1,Blank,Blank,Bb Mccullum,Yuvraj Singh,Bb Mccullum,Kc Sangakkara,1979-09-21
14091,39219100024,392191,24,K Goel,12/24/1986,Left-hand Bat,Right-arm Offbreak,India,Player,Kings Xi Punjab,Kolkata Knight Riders,2009,0,23,0,Blank,Blank,Yuvraj Singh,Bb Mccullum,Kc Sangakkara,Bb Mccullum,1986-12-24
14093,39219100027,392191,27,Yuvraj Singh,12/12/1981,Left-hand Bat,Slow Left-arm Orthodox,India,Captain,Kings Xi Punjab,Kolkata Knight Riders,2009,0,28,0,Blank,Blank,Yuvraj Singh,Bb Mccullum,Kc Sangakkara,Bb Mccullum,1981-12-12
14094,39219100029,392191,29,Ik Pathan,10/27/1984,Left-hand Bat,Left-arm Medium-fast,India,Player,Kings Xi Punjab,Kolkata Knight Riders,2009,0,25,0,Blank,Blank,Yuvraj Singh,Bb Mccullum,Kc Sangakkara,Bb Mccullum,1984-10-27
14099,39219100161,392191,161,Rs Bopara,5/4/1985,Right-hand Bat,Right-arm Medium,England,Player,Kings Xi Punjab,Kolkata Knight Riders,2009,0,24,0,Blank,Blank,Yuvraj Singh,Bb Mccullum,Kc Sangakkara,Bb Mccullum,1985-05-04
14103,39219300054,392193,54,Y Venugopal Rao,2/26/1982,Right-hand Bat,Right-arm Offbreak,India,Player,Deccan Chargers,Royal Challengers Bangalore,2009,0,27,1,Blank,Blank,Ac Gilchrist,Kp Pietersen,Ac Gilchrist,Rv Uthappa,1982-02-26
14104,39219300055,392193,55,Vvs Laxman,11/1/1974,Right-hand Bat,Right-arm Offbreak,India,Player,Deccan Chargers,Royal Challengers Bangalore,2009,0,35,1,Blank,Blank,Ac Gilchrist,Kp Pietersen,Ac Gilchrist,Rv Uthappa,1974-11-01
14105,39219300057,392193,57,Rg Sharma,4/30/1987,Right-hand Bat,Right-arm Offbreak,India,Player,Deccan Chargers,Royal Challengers Bangalore,2009,0,22,1,Blank,Blank,Ac Gilchrist,Kp Pietersen,Ac Gilchrist,Rv Uthappa,1987-04-30
14107,39219300061,392193,61,Rp Singh,12/6/1985,Right-hand Bat,Left-arm Fast-medium,India,Player,Deccan Chargers,Royal Challengers Bangalore,2009,0,24,1,Blank,Blank,Ac Gilchrist,Kp Pietersen,Ac Gilchrist,Rv Uthappa,1985-12-06
14109,39219300112,392193,112,Db Ravi Teja,9/5/1987,Right-hand Bat,Legbreak Googly,India,Player,Deccan Chargers,Royal Challengers Bangalore,2009,0,22,1,Blank,Blank,Ac Gilchrist,Kp Pietersen,Ac Gilchrist,Rv Uthappa,1987-09-05
14113,39219300006,392193,6,R Dravid,1/11/1973,Right-hand Bat,Right-arm Offbreak,India,Player,Royal Challengers Bangalore,Deccan Chargers,2009,0,36,0,Blank,Blank,Kp Pietersen,Ac Gilchrist,Rv Uthappa,Ac Gilchrist,1973-01-11
14117,39219300046,392193,46,Rv Uthappa,11/11/1985,Right-hand Bat,Right-arm Medium,India,Keeper,Royal Challengers Bangalore,Deccan Chargers,2009,0,24,0,Blank,Blank,Kp Pietersen,Ac Gilchrist,Rv Uthappa,Ac Gilchrist,1985-11-11
14124,39219400040,392194,40,G Gambhir,10/14/1981,Left-hand Bat,Legbreak,India,Player,Delhi Daredevils,Chennai Super Kings,2009,0,28,1,Blank,Blank,V Sehwag,Ms Dhoni,Kd Karthik,Ms Dhoni,1981-10-14
14125,39219400041,392194,41,V Sehwag,10/20/1978,Right-hand Bat,Right-arm Offbreak,India,Captain,Delhi Daredevils,Chennai Super Kings,2009,0,31,1,Blank,Blank,V Sehwag,Ms Dhoni,Kd Karthik,Ms Dhoni,1978-10-20
14127,39219400087,392194,87,Mk Tiwary,11/14/1985,Right-hand Bat,Legbreak Googly,India,Player,Delhi Daredevils,Chennai Super Kings,2009,0,24,1,Blank,Blank,V Sehwag,Ms Dhoni,Kd Karthik,Ms Dhoni,1985-11-14
14128,39219400088,392194,88,Kd Karthik,6/1/1985,Right-hand Bat,N/a,India,Keeper,Delhi Daredevils,Chennai Super Kings,2009,0,24,1,Blank,Blank,V Sehwag,Ms Dhoni,Kd Karthik,Ms Dhoni,1985-06-01
14132,39219400175,392194,175,Dl Vettori,1/27/1979,Left-hand Bat,Slow Left-arm Orthodox,New Zealand,Player,Delhi Daredevils,Chennai Super Kings,2009,0,30,1,Blank,Blank,V Sehwag,Ms Dhoni,Kd Karthik,Ms Dhoni,1979-01-27
14137,39219400020,392194,20,Ms Dhoni,7/7/1981,Right-hand Bat,Right-arm Medium,India,Captainkeeper,Chennai Super Kings,Delhi Daredevils,2009,0,28,0,Blank,Blank,Ms Dhoni,V Sehwag,Ms Dhoni,Kd Karthik,1981-07-07
14139,39219400023,392194,23,S Badrinath,8/30/1980,Right-hand Bat,Right-arm Offbreak,India,Player,Chennai Super Kings,Delhi Daredevils,2009,0,29,0,Blank,Blank,Ms Dhoni,V Sehwag,Ms Dhoni,Kd Karthik,1980-08-30
14140,39219400109,392194,109,Ja Morkel,6/10/1981,Left-hand Bat,Right-arm Medium-fast,South Africa,Player,Chennai Super Kings,Delhi Daredevils,2009,0,28,0,Blank,Blank,Ms Dhoni,V Sehwag,Ms Dhoni,Kd Karthik,1981-06-10
14143,39219400121,392194,121,M Muralitharan,4/17/1972,Right-hand Bat,Right-arm Offbreak,Sri Lanka,Player,Chennai Super Kings,Delhi Daredevils,2009,0,37,0,Blank,Blank,Ms Dhoni,V Sehwag,Ms Dhoni,Kd Karthik,1972-04-17
14147,39219500002,392195,2,Bb Mccullum,9/27/1981,Right-hand Bat,Right-arm Medium,New Zealand,Captainkeeper,Kolkata Knight Riders,Rajasthan Royals,2009,0,28,0,Blank,Blank,Bb Mccullum,Sk Warne,Bb Mccullum,M Rawat,1981-09-27
14148,39219500059,392195,59,Sb Bangar,10/11/1972,Right-hand Bat,Right-arm Medium-fast,India,Player,Kolkata Knight Riders,Rajasthan Royals,2009,0,37,0,Blank,Blank,Bb Mccullum,Sk Warne,Bb Mccullum,M Rawat,1972-10-11
14149,39219500063,392195,63,Lr Shukla,5/6/1981,Right-hand Bat,Right-arm Medium,India,Player,Kolkata Knight Riders,Rajasthan Royals,2009,0,28,0,Blank,Blank,Bb Mccullum,Sk Warne,Bb Mccullum,M Rawat,1981-05-06
14153,39219500162,392195,162,Ch Gayle,9/21/1979,Left-hand Bat,Right-arm Offbreak,West Indies,Player,Kolkata Knight Riders,Rajasthan Royals,2009,0,30,0,Blank,Blank,Bb Mccullum,Sk Warne,Bb Mccullum,M Rawat,1979-09-21
14158,39219500035,392195,35,Ra Jadeja,12/6/1988,Left-hand Bat,Slow Left-arm Orthodox,India,Player,Rajasthan Royals,Kolkata Knight Riders,2009,0,21,1,Blank,Blank,Sk Warne,Bb Mccullum,M Rawat,Bb Mccullum,1988-12-06
14159,39219500036,392195,36,M Rawat,10/25/1985,Right-hand Bat,N/a,India,Keeper,Rajasthan Royals,Kolkata Knight Riders,2009,0,24,1,Blank,Blank,Sk Warne,Bb Mccullum,M Rawat,Bb Mccullum,1985-10-25
14162,39219500126,392195,126,Mm Patel,7/12/1983,Right-hand Bat,Right-arm Medium-fast,India,Player,Rajasthan Royals,Kolkata Knight Riders,2009,0,26,1,Blank,Blank,Sk Warne,Bb Mccullum,M Rawat,Bb Mccullum,1983-07-12
14164,39219500160,392195,160,Kamran Khan,3/10/1991,Left-hand Bat,Left-arm Medium-fast,India,Player,Rajasthan Royals,Kolkata Knight Riders,2009,0,18,1,Blank,Blank,Sk Warne,Bb Mccullum,M Rawat,Bb Mccullum,1991-03-10
14166,39219500168,392195,168,Rj Quiney,8/20/1982,Left-hand Bat,Right-arm Medium,Australia,Player,Rajasthan Royals,Kolkata Knight Riders,2009,0,27,1,Blank,Blank,Sk Warne,Bb Mccullum,M Rawat,Bb Mccullum,1982-08-20
14171,39219600029,392196,29,Ik Pathan,10/27/1984,Left-hand Bat,Left-arm Medium-fast,India,Player,Kings Xi Punjab,Royal Challengers Bangalore,2009,0,25,1,Blank,Blank,Yuvraj Singh,Kp Pietersen,Kc Sangakkara,Rv Uthappa,1984-10-27
14177,39219600215,392196,215,Ya Abdulla,1/17/1983,Left-hand Bat,Left-arm Fast-medium,India,Player,Kings Xi Punjab,Royal Challengers Bangalore,2009,0,26,1,Blank,Blank,Yuvraj Singh,Kp Pietersen,Kc Sangakkara,Rv Uthappa,1983-01-17
14180,39219600008,392196,8,V Kohli,11/5/1988,Right-hand Bat,Right-arm Medium,India,Player,Royal Challengers Bangalore,Kings Xi Punjab,2009,0,21,0,Blank,Blank,Kp Pietersen,Yuvraj Singh,Rv Uthappa,Kc Sangakkara,1988-11-05
14181,39219600009,392196,9,Jh Kallis,10/16/1975,Right-hand Bat,Right-arm Fast-medium,South Africa,Player,Royal Challengers Bangalore,Kings Xi Punjab,2009,0,34,0,Blank,Blank,Kp Pietersen,Yuvraj Singh,Rv Uthappa,Kc Sangakkara,1975-10-16
14184,39219600052,392196,52,Lrpl Taylor,3/8/1984,Right-hand Bat,Right-arm Offbreak,New Zealand,Player,Royal Challengers Bangalore,Kings Xi Punjab,2009,0,25,0,Blank,Blank,Kp Pietersen,Yuvraj Singh,Rv Uthappa,Kc Sangakkara,1984-03-08
14189,39219600158,392196,158,Kp Pietersen,6/27/1980,Right-hand Bat,Right-arm Offbreak,South Africa,Captain,Royal Challengers Bangalore,Kings Xi Punjab,2009,0,29,0,Blank,Blank,Kp Pietersen,Yuvraj Singh,Rv Uthappa,Kc Sangakkara,1980-06-27
14190,39219700053,392197,53,Ac Gilchrist,11/14/1971,Left-hand Bat,Right-arm Offbreak,Australia,Captainkeeper,Deccan Chargers,Mumbai Indians,2009,0,38,1,Blank,Blank,Ac Gilchrist,Sr Tendulkar,Ac Gilchrist,Pr Shah,1971-11-14
14191,39219700054,392197,54,Y Venugopal Rao,2/26/1982,Right-hand Bat,Right-arm Offbreak,India,Player,Deccan Chargers,Mumbai Indians,2009,0,27,1,Blank,Blank,Ac Gilchrist,Sr Tendulkar,Ac Gilchrist,Pr Shah,1982-02-26
14192,39219700055,392197,55,Vvs Laxman,11/1/1974,Right-hand Bat,Right-arm Offbreak,India,Player,Deccan Chargers,Mumbai Indians,2009,0,35,1,Blank,Blank,Ac Gilchrist,Sr Tendulkar,Ac Gilchrist,Pr Shah,1974-11-01
14193,39219700057,392197,57,Rg Sharma,4/30/1987,Right-hand Bat,Right-arm Offbreak,India,Player,Deccan Chargers,Mumbai Indians,2009,0,22,1,Blank,Blank,Ac Gilchrist,Sr Tendulkar,Ac Gilchrist,Pr Shah,1987-04-30
14198,39219700147,392197,147,Dr Smith,4/12/1983,Right-hand Bat,Right-arm Medium,West Indies,Player,Deccan Chargers,Mumbai Indians,2009,0,26,1,Blank,Blank,Ac Gilchrist,Sr Tendulkar,Ac Gilchrist,Pr Shah,1983-04-12
14199,39219700165,392197,165,Fh Edwards,2/6/1982,Right-hand Bat,Right-arm Fast,West Indies,Player,Deccan Chargers,Mumbai Indians,2009,0,27,1,Blank,Blank,Ac Gilchrist,Sr Tendulkar,Ac Gilchrist,Pr Shah,1982-02-06
14200,39219700256,392197,256,Harmeet Singh,9/7/1992,Left-hand Bat,Slow Left-arm Orthodox,India,Player,Deccan Chargers,Mumbai Indians,2009,0,17,1,Blank,Blank,Ac Gilchrist,Sr Tendulkar,Ac Gilchrist,Pr Shah,1992-09-07
14203,39219700044,392197,44,St Jayasuriya,6/30/1969,Left-hand Bat,Slow Left-arm Orthodox,Sri Lanka,Player,Mumbai Indians,Deccan Chargers,2009,0,40,0,Blank,Blank,Sr Tendulkar,Ac Gilchrist,Pr Shah,Ac Gilchrist,1969-06-30
14207,39219700071,392197,71,Dj Bravo,10/7/1983,Right-hand Bat,Right-arm Medium-fast,West Indies,Player,Mumbai Indians,Deccan Chargers,2009,0,26,0,Blank,Blank,Sr Tendulkar,Ac Gilchrist,Pr Shah,Ac Gilchrist,1983-10-07
14209,39219700133,392197,133,Sr Tendulkar,4/24/1973,Right-hand Bat,Right-arm Offbreak,India,Captain,Mumbai Indians,Deccan Chargers,2009,0,36,0,Blank,Blank,Sr Tendulkar,Ac Gilchrist,Pr Shah,Ac Gilchrist,1973-04-24
14210,39219700154,392197,154,Jp Duminy,4/14/1984,Left-hand Bat,Right-arm Offbreak,South Africa,Player,Mumbai Indians,Deccan Chargers,2009,0,25,0,Blank,Blank,Sr Tendulkar,Ac Gilchrist,Pr Shah,Ac Gilchrist,1984-04-14
14213,39219900041,392199,41,V Sehwag,10/20/1978,Right-hand Bat,Right-arm Offbreak,India,Captain,Delhi Daredevils,Royal Challengers Bangalore,2009,0,31,1,Blank,Blank,V Sehwag,Kp Pietersen,Kd Karthik,Mv Boucher,1978-10-20
14214,39219900073,392199,73,A Nehra,4/29/1979,Right-hand Bat,Left-arm Medium-fast,India,Player,Delhi Daredevils,Royal Challengers Bangalore,2009,0,30,1,Blank,Blank,V Sehwag,Kp Pietersen,Kd Karthik,Mv Boucher,1979-04-29
14216,39219900110,392199,110,Ab De Villiers,2/17/1984,Right-hand Bat,Right-arm Medium,South Africa,Player,Delhi Daredevils,Royal Challengers Bangalore,2009,0,25,1,Blank,Blank,V Sehwag,Kp Pietersen,Kd Karthik,Mv Boucher,1984-02-17
14222,39219900223,392199,223,Dp Nannes,5/16/1976,Right-hand Bat,Left-arm Fast,Australia,Player,Delhi Daredevils,Royal Challengers Bangalore,2009,0,33,1,Blank,Blank,V Sehwag,Kp Pietersen,Kd Karthik,Mv Boucher,1976-05-16
14225,39219900011,392199,11,Mv Boucher,12/3/1976,Right-hand Bat,Right-arm Medium,South Africa,Keeper,Royal Challengers Bangalore,Delhi Daredevils,2009,0,33,0,Blank,Blank,Kp Pietersen,V Sehwag,Mv Boucher,Kd Karthik,1976-12-03
14228,39219900052,392199,52,Lrpl Taylor,3/8/1984,Right-hand Bat,Right-arm Offbreak,New Zealand,Player,Royal Challengers Bangalore,Delhi Daredevils,2009,0,25,0,Blank,Blank,Kp Pietersen,V Sehwag,Mv Boucher,Kd Karthik,1984-03-08
14229,39219900075,392199,75,Pankaj Singh,5/6/1985,Right-hand Bat,Right-arm Medium-fast,India,Player,Royal Challengers Bangalore,Delhi Daredevils,2009,0,24,0,Blank,Blank,Kp Pietersen,V Sehwag,Mv Boucher,Kd Karthik,1985-05-06
14233,39219900181,392199,181,Kp Appanna,12/20/1988,Right-hand Bat,Slow Left-arm Orthodox,India,Player,Royal Challengers Bangalore,Delhi Daredevils,2009,0,21,0,Blank,Blank,Kp Pietersen,V Sehwag,Mv Boucher,Kd Karthik,1988-12-20
14234,39220000024,392200,24,K Goel,12/24/1986,Left-hand Bat,Right-arm Offbreak,India,Player,Kings Xi Punjab,Rajasthan Royals,2009,0,23,1,Blank,Blank,Yuvraj Singh,Sk Warne,Kc Sangakkara,M Rawat,1986-12-24
14242,39220000153,392200,153,Rr Powar,5/20/1978,Right-hand Bat,Right-arm Offbreak,India,Player,Kings Xi Punjab,Rajasthan Royals,2009,0,31,1,Blank,Blank,Yuvraj Singh,Sk Warne,Kc Sangakkara,M Rawat,1978-05-20
14244,39220000215,392200,215,Ya Abdulla,1/17/1983,Left-hand Bat,Left-arm Fast-medium,India,Player,Kings Xi Punjab,Rajasthan Royals,2009,0,26,1,Blank,Blank,Yuvraj Singh,Sk Warne,Kc Sangakkara,M Rawat,1983-01-17
14253,39220000160,392200,160,Kamran Khan,3/10/1991,Left-hand Bat,Left-arm Medium-fast,India,Player,Rajasthan Royals,Kings Xi Punjab,2009,0,18,0,Blank,Blank,Sk Warne,Yuvraj Singh,M Rawat,Kc Sangakkara,1991-03-10
14256,39220100053,392201,53,Ac Gilchrist,11/14/1971,Left-hand Bat,Right-arm Offbreak,Australia,Captainkeeper,Deccan Chargers,Chennai Super Kings,2009,0,38,1,Blank,Blank,Ac Gilchrist,Ms Dhoni,Ac Gilchrist,Ms Dhoni,1971-11-14
14258,39220100055,392201,55,Vvs Laxman,11/1/1974,Right-hand Bat,Right-arm Offbreak,India,Player,Deccan Chargers,Chennai Super Kings,2009,0,35,1,Blank,Blank,Ac Gilchrist,Ms Dhoni,Ac Gilchrist,Ms Dhoni,1974-11-01
14260,39220100061,392201,61,Rp Singh,12/6/1985,Right-hand Bat,Left-arm Fast-medium,India,Player,Deccan Chargers,Chennai Super Kings,2009,0,24,1,Blank,Blank,Ac Gilchrist,Ms Dhoni,Ac Gilchrist,Ms Dhoni,1985-12-06
14262,39220100131,392201,131,Pp Ojha,9/5/1986,Left-hand Bat,Slow Left-arm Orthodox,India,Player,Deccan Chargers,Chennai Super Kings,2009,0,23,1,Blank,Blank,Ac Gilchrist,Ms Dhoni,Ac Gilchrist,Ms Dhoni,1986-09-05
14265,39220100172,392201,172,Aa Bilakhia,5/31/1986,Right-hand Bat,Right-arm Medium,India,Player,Deccan Chargers,Chennai Super Kings,2009,0,23,1,Blank,Blank,Ac Gilchrist,Ms Dhoni,Ac Gilchrist,Ms Dhoni,1986-05-31
14269,39220100020,392201,20,Ms Dhoni,7/7/1981,Right-hand Bat,Right-arm Medium,India,Captainkeeper,Chennai Super Kings,Deccan Chargers,2009,0,28,0,Blank,Blank,Ms Dhoni,Ac Gilchrist,Ms Dhoni,Ac Gilchrist,1981-07-07
14276,39220100121,392201,121,M Muralitharan,4/17/1972,Right-hand Bat,Right-arm Offbreak,Sri Lanka,Player,Chennai Super Kings,Deccan Chargers,2009,0,37,0,Blank,Blank,Ms Dhoni,Ac Gilchrist,Ms Dhoni,Ac Gilchrist,1972-04-17
14277,39220100151,392201,151,L Balaji,9/27/1981,Right-hand Bat,Right-arm Medium-fast,India,Player,Chennai Super Kings,Deccan Chargers,2009,0,28,0,Blank,Blank,Ms Dhoni,Ac Gilchrist,Ms Dhoni,Ac Gilchrist,1981-09-27
14281,39220200084,392202,84,I Sharma,9/2/1988,Right-hand Bat,Right-arm Fast-medium,India,Player,Kolkata Knight Riders,Mumbai Indians,2009,0,21,0,Blank,Blank,Bb Mccullum,Sr Tendulkar,Bb Mccullum,Pr Shah,1988-09-02
14287,39220200174,392202,174,Baw Mendis,3/11/1985,Right-hand Bat,Right-arm Offbreak,Sri Lanka,Player,Kolkata Knight Riders,Mumbai Indians,2009,0,24,0,Blank,Blank,Bb Mccullum,Sr Tendulkar,Bb Mccullum,Pr Shah,1985-03-11
14289,39220200015,392202,15,Z Khan,10/7/1978,Right-hand Bat,Left-arm Fast-medium,India,Player,Mumbai Indians,Kolkata Knight Riders,2009,0,31,1,Blank,Blank,Sr Tendulkar,Bb Mccullum,Pr Shah,Bb Mccullum,1978-10-07
14290,39220200042,392202,42,S Dhawan,12/5/1985,Left-hand Bat,Right-arm Offbreak,India,Player,Mumbai Indians,Kolkata Knight Riders,2009,0,24,1,Blank,Blank,Sr Tendulkar,Bb Mccullum,Pr Shah,Bb Mccullum,1985-12-05
14292,39220200047,392202,47,Pr Shah,11/3/1987,Right-hand Bat,N/a,India,Keeper,Mumbai Indians,Kolkata Knight Riders,2009,0,22,1,Blank,Blank,Sr Tendulkar,Bb Mccullum,Pr Shah,Bb Mccullum,1987-11-03
14293,39220200048,392202,48,Am Nayar,10/8/1983,Left-hand Bat,Right-arm Medium,India,Player,Mumbai Indians,Kolkata Knight Riders,2009,0,26,1,Blank,Blank,Sr Tendulkar,Bb Mccullum,Pr Shah,Bb Mccullum,1983-10-08
14294,39220200050,392202,50,Harbhajan Singh,7/3/1980,Right-hand Bat,Right-arm Offbreak,India,Player,Mumbai Indians,Kolkata Knight Riders,2009,0,29,1,Blank,Blank,Sr Tendulkar,Bb Mccullum,Pr Shah,Bb Mccullum,1980-07-03
14296,39220200079,392202,79,Ss Tiwary,12/30/1989,Left-hand Bat,N/a,India,Player,Mumbai Indians,Kolkata Knight Riders,2009,0,20,1,Blank,Blank,Sr Tendulkar,Bb Mccullum,Pr Shah,Bb Mccullum,1989-12-30
14297,39220200133,392202,133,Sr Tendulkar,4/24/1973,Right-hand Bat,Right-arm Offbreak,India,Captain,Mumbai Indians,Kolkata Knight Riders,2009,1,36,1,Blank,Blank,Sr Tendulkar,Bb Mccullum,Pr Shah,Bb Mccullum,1973-04-24
14299,39220200194,392202,194,Sl Malinga,8/28/1983,Right-hand Bat,Right-arm Fast,Sri Lanka,Player,Mumbai Indians,Kolkata Knight Riders,2009,0,26,1,Blank,Blank,Sr Tendulkar,Bb Mccullum,Pr Shah,Bb Mccullum,1983-08-28
14303,39220300088,392203,88,Kd Karthik,6/1/1985,Right-hand Bat,N/a,India,Keeper,Delhi Daredevils,Rajasthan Royals,2009,0,24,0,Blank,Blank,V Sehwag,Sk Warne,Kd Karthik,M Rawat,1985-06-01
14307,39220300136,392203,136,A Mishra,11/24/1982,Right-hand Bat,Legbreak,India,Player,Delhi Daredevils,Rajasthan Royals,2009,0,27,0,Blank,Blank,V Sehwag,Sk Warne,Kd Karthik,M Rawat,1982-11-24
14308,39220300171,392203,171,M Manhas,10/12/1979,Right-hand Bat,Right-arm Offbreak,India,Player,Delhi Daredevils,Rajasthan Royals,2009,0,30,0,Blank,Blank,V Sehwag,Sk Warne,Kd Karthik,M Rawat,1979-10-12
14310,39220300223,392203,223,Dp Nannes,5/16/1976,Right-hand Bat,Left-arm Fast,Australia,Player,Delhi Daredevils,Rajasthan Royals,2009,0,33,0,Blank,Blank,V Sehwag,Sk Warne,Kd Karthik,M Rawat,1976-05-16
14311,39220300031,392203,31,Yk Pathan,11/17/1982,Right-hand Bat,Right-arm Offbreak,India,Player,Rajasthan Royals,Delhi Daredevils,2009,1,27,1,Blank,Blank,Sk Warne,V Sehwag,M Rawat,Kd Karthik,1982-11-17
14312,39220300035,392203,35,Ra Jadeja,12/6/1988,Left-hand Bat,Slow Left-arm Orthodox,India,Player,Rajasthan Royals,Delhi Daredevils,2009,0,21,1,Blank,Blank,Sk Warne,V Sehwag,M Rawat,Kd Karthik,1988-12-06
14319,39220300160,392203,160,Kamran Khan,3/10/1991,Left-hand Bat,Left-arm Medium-fast,India,Player,Rajasthan Royals,Delhi Daredevils,2009,0,18,1,Blank,Blank,Sk Warne,V Sehwag,M Rawat,Kd Karthik,1991-03-10
14320,39220300167,392203,167,Pc Valthaty,12/7/1983,Right-hand Bat,Right-arm Medium,India,Player,Rajasthan Royals,Delhi Daredevils,2009,0,26,1,Blank,Blank,Sk Warne,V Sehwag,M Rawat,Kd Karthik,1983-12-07
14321,39220300168,392203,168,Rj Quiney,8/20/1982,Left-hand Bat,Right-arm Medium,Australia,Player,Rajasthan Royals,Delhi Daredevils,2009,0,27,1,Blank,Blank,Sk Warne,V Sehwag,M Rawat,Kd Karthik,1982-08-20
14324,39220400062,392204,62,Wp Saha,10/24/1984,Right-hand Bat,N/a,India,Player,Kolkata Knight Riders,Royal Challengers Bangalore,2009,0,25,0,Blank,Blank,Bb Mccullum,Kp Pietersen,Mn Van Wyk,Mv Boucher,1984-10-24
14327,39220400083,392204,83,M Kartik,9/11/1976,Left-hand Bat,Slow Left-arm Orthodox,India,Player,Kolkata Knight Riders,Royal Challengers Bangalore,2009,0,33,0,Blank,Blank,Bb Mccullum,Kp Pietersen,Mn Van Wyk,Mv Boucher,1976-09-11
14328,39220400084,392204,84,I Sharma,9/2/1988,Right-hand Bat,Right-arm Fast-medium,India,Player,Kolkata Knight Riders,Royal Challengers Bangalore,2009,0,21,0,Blank,Blank,Bb Mccullum,Kp Pietersen,Mn Van Wyk,Mv Boucher,1988-09-02
14330,39220400106,392204,106,Ab Dinda,3/25/1984,Right-hand Bat,Right-arm Medium-fast,India,Player,Kolkata Knight Riders,Royal Challengers Bangalore,2009,0,25,0,Blank,Blank,Bb Mccullum,Kp Pietersen,Mn Van Wyk,Mv Boucher,1984-03-25
14331,39220400162,392204,162,Ch Gayle,9/21/1979,Left-hand Bat,Right-arm Offbreak,West Indies,Player,Kolkata Knight Riders,Royal Challengers Bangalore,2009,0,30,0,Blank,Blank,Bb Mccullum,Kp Pietersen,Mn Van Wyk,Mv Boucher,1979-09-21
14332,39220400176,392204,176,Mn Van Wyk,3/20/1979,Right-hand Bat,Slow Left-arm Orthodox,South Africa,Keeper,Kolkata Knight Riders,Royal Challengers Bangalore,2009,0,30,0,Blank,Blank,Bb Mccullum,Kp Pietersen,Mn Van Wyk,Mv Boucher,1979-03-20
14336,39220400014,392204,14,P Kumar,10/2/1986,Right-hand Bat,Right-arm Medium,India,Player,Royal Challengers Bangalore,Kolkata Knight Riders,2009,0,23,1,Blank,Blank,Kp Pietersen,Bb Mccullum,Mv Boucher,Mn Van Wyk,1986-10-02
14337,39220400075,392204,75,Pankaj Singh,5/6/1985,Right-hand Bat,Right-arm Medium-fast,India,Player,Royal Challengers Bangalore,Kolkata Knight Riders,2009,0,24,1,Blank,Blank,Kp Pietersen,Bb Mccullum,Mv Boucher,Mn Van Wyk,1985-05-06
14338,39220400096,392204,96,Mk Pandey,9/10/1989,Right-hand Bat,Right-arm Medium,India,Player,Royal Challengers Bangalore,Kolkata Knight Riders,2009,0,20,1,Blank,Blank,Kp Pietersen,Bb Mccullum,Mv Boucher,Mn Van Wyk,1989-09-10
14347,39220500029,392205,29,Ik Pathan,10/27/1984,Left-hand Bat,Left-arm Medium-fast,India,Player,Kings Xi Punjab,Mumbai Indians,2009,0,25,1,Blank,Blank,Yuvraj Singh,Sr Tendulkar,Kc Sangakkara,Pr Shah,1984-10-27
14348,39220500064,392205,64,Dpmd Jayawardene,5/27/1977,Right-hand Bat,Right-arm Medium,Sri Lanka,Player,Kings Xi Punjab,Mumbai Indians,2009,0,32,1,Blank,Blank,Yuvraj Singh,Sr Tendulkar,Kc Sangakkara,Pr Shah,1977-05-27
14352,39220500161,392205,161,Rs Bopara,5/4/1985,Right-hand Bat,Right-arm Medium,England,Player,Kings Xi Punjab,Mumbai Indians,2009,0,24,1,Blank,Blank,Yuvraj Singh,Sr Tendulkar,Kc Sangakkara,Pr Shah,1985-05-04
14353,39220500215,392205,215,Ya Abdulla,1/17/1983,Left-hand Bat,Left-arm Fast-medium,India,Player,Kings Xi Punjab,Mumbai Indians,2009,0,26,1,Blank,Blank,Yuvraj Singh,Sr Tendulkar,Kc Sangakkara,Pr Shah,1983-01-17
14354,39220500243,392205,243,Vs Malik,5/9/1983,Right-hand Bat,Right-arm Medium,India,Player,Kings Xi Punjab,Mumbai Indians,2009,0,26,1,Blank,Blank,Yuvraj Singh,Sr Tendulkar,Kc Sangakkara,Pr Shah,1983-05-09
14357,39220500044,392205,44,St Jayasuriya,6/30/1969,Left-hand Bat,Slow Left-arm Orthodox,Sri Lanka,Player,Mumbai Indians,Kings Xi Punjab,2009,0,40,0,Blank,Blank,Sr Tendulkar,Yuvraj Singh,Pr Shah,Kc Sangakkara,1969-06-30
14359,39220500048,392205,48,Am Nayar,10/8/1983,Left-hand Bat,Right-arm Medium,India,Player,Mumbai Indians,Kings Xi Punjab,2009,0,26,0,Blank,Blank,Sr Tendulkar,Yuvraj Singh,Pr Shah,Kc Sangakkara,1983-10-08
14362,39220500079,392205,79,Ss Tiwary,12/30/1989,Left-hand Bat,N/a,India,Player,Mumbai Indians,Kings Xi Punjab,2009,0,20,0,Blank,Blank,Sr Tendulkar,Yuvraj Singh,Pr Shah,Kc Sangakkara,1989-12-30
14365,39220500194,392205,194,Sl Malinga,8/28/1983,Right-hand Bat,Right-arm Fast,Sri Lanka,Player,Mumbai Indians,Kings Xi Punjab,2009,0,26,0,Blank,Blank,Sr Tendulkar,Yuvraj Singh,Pr Shah,Kc Sangakkara,1983-08-28
14366,39220600053,392206,53,Ac Gilchrist,11/14/1971,Left-hand Bat,Right-arm Offbreak,Australia,Captainkeeper,Deccan Chargers,Delhi Daredevils,2009,0,38,0,Blank,Blank,Ac Gilchrist,V Sehwag,Ac Gilchrist,Kd Karthik,1971-11-14
14367,39220600054,392206,54,Y Venugopal Rao,2/26/1982,Right-hand Bat,Right-arm Offbreak,India,Player,Deccan Chargers,Delhi Daredevils,2009,0,27,0,Blank,Blank,Ac Gilchrist,V Sehwag,Ac Gilchrist,Kd Karthik,1982-02-26
14370,39220600097,392206,97,Hh Gibbs,2/23/1974,Right-hand Bat,Right-arm Bowler,South Africa,Player,Deccan Chargers,Delhi Daredevils,2009,0,35,0,Blank,Blank,Ac Gilchrist,V Sehwag,Ac Gilchrist,Kd Karthik,1974-02-23
14373,39220600165,392206,165,Fh Edwards,2/6/1982,Right-hand Bat,Right-arm Fast,West Indies,Player,Deccan Chargers,Delhi Daredevils,2009,0,27,0,Blank,Blank,Ac Gilchrist,V Sehwag,Ac Gilchrist,Kd Karthik,1982-02-06
14374,39220600172,392206,172,Aa Bilakhia,5/31/1986,Right-hand Bat,Right-arm Medium,India,Player,Deccan Chargers,Delhi Daredevils,2009,0,23,0,Blank,Blank,Ac Gilchrist,V Sehwag,Ac Gilchrist,Kd Karthik,1986-05-31
14375,39220600178,392206,178,Tl Suman,12/15/1983,Right-hand Bat,Right-arm Offbreak,India,Player,Deccan Chargers,Delhi Daredevils,2009,0,26,0,Blank,Blank,Ac Gilchrist,V Sehwag,Ac Gilchrist,Kd Karthik,1983-12-15
14379,39220600073,392206,73,A Nehra,4/29/1979,Right-hand Bat,Left-arm Medium-fast,India,Player,Delhi Daredevils,Deccan Chargers,2009,0,30,1,Blank,Blank,V Sehwag,Ac Gilchrist,Kd Karthik,Ac Gilchrist,1979-04-29
14380,39220600088,392206,88,Kd Karthik,6/1/1985,Right-hand Bat,N/a,India,Keeper,Delhi Daredevils,Deccan Chargers,2009,0,24,1,Blank,Blank,V Sehwag,Ac Gilchrist,Kd Karthik,Ac Gilchrist,1985-06-01
14383,39220600135,392206,135,Tm Dilshan,10/14/1976,Right-hand Bat,Right-arm Offbreak,Sri Lanka,Player,Delhi Daredevils,Deccan Chargers,2009,0,33,1,Blank,Blank,V Sehwag,Ac Gilchrist,Kd Karthik,Ac Gilchrist,1976-10-14
14384,39220600136,392206,136,A Mishra,11/24/1982,Right-hand Bat,Legbreak,India,Player,Delhi Daredevils,Deccan Chargers,2009,0,27,1,Blank,Blank,V Sehwag,Ac Gilchrist,Kd Karthik,Ac Gilchrist,1982-11-24
14386,39220600175,392206,175,Dl Vettori,1/27/1979,Left-hand Bat,Slow Left-arm Orthodox,New Zealand,Player,Delhi Daredevils,Deccan Chargers,2009,0,30,1,Blank,Blank,V Sehwag,Ac Gilchrist,Kd Karthik,Ac Gilchrist,1979-01-27
14391,39220700038,392207,38,Sk Warne,9/13/1969,Right-hand Bat,Legbreak Googly,Australia,Captain,Rajasthan Royals,Chennai Super Kings,2009,0,40,0,Blank,Blank,Sk Warne,Ms Dhoni,M Rawat,Ms Dhoni,1969-09-13
14399,39220700017,392207,17,Pa Patel,3/9/1985,Left-hand Bat,N/a,India,Player,Chennai Super Kings,Rajasthan Royals,2009,0,24,1,Blank,Blank,Ms Dhoni,Sk Warne,Ms Dhoni,M Rawat,1985-03-09
14400,39220700018,392207,18,Ml Hayden,10/29/1971,Left-hand Bat,Right-arm Medium,Australia,Player,Chennai Super Kings,Rajasthan Royals,2009,0,38,1,Blank,Blank,Ms Dhoni,Sk Warne,Ms Dhoni,M Rawat,1971-10-29
14401,39220700020,392207,20,Ms Dhoni,7/7/1981,Right-hand Bat,Right-arm Medium,India,Captainkeeper,Chennai Super Kings,Rajasthan Royals,2009,0,28,1,Blank,Blank,Ms Dhoni,Sk Warne,Ms Dhoni,M Rawat,1981-07-07
14402,39220700021,392207,21,Sk Raina,11/27/1986,Left-hand Bat,Right-arm Offbreak,India,Player,Chennai Super Kings,Rajasthan Royals,2009,1,23,1,Blank,Blank,Ms Dhoni,Sk Warne,Ms Dhoni,M Rawat,1986-11-27
14403,39220700022,392207,22,Jdp Oram,7/28/1978,Left-hand Bat,Right-arm Fast-medium,New Zealand,Player,Chennai Super Kings,Rajasthan Royals,2009,0,31,1,Blank,Blank,Ms Dhoni,Sk Warne,Ms Dhoni,M Rawat,1978-07-28
14408,39220700186,392207,186,Sb Jakati,11/27/1980,Left-hand Bat,Slow Left-arm Orthodox,India,Player,Chennai Super Kings,Rajasthan Royals,2009,0,29,1,Blank,Blank,Ms Dhoni,Sk Warne,Ms Dhoni,M Rawat,1980-11-27
14409,39220700218,392207,218,S Tyagi,9/17/1987,Right-hand Bat,Right-arm Medium,India,Player,Chennai Super Kings,Rajasthan Royals,2009,0,22,1,Blank,Blank,Ms Dhoni,Sk Warne,Ms Dhoni,M Rawat,1987-09-17
14411,39220800002,392208,2,Bb Mccullum,9/27/1981,Right-hand Bat,Right-arm Medium,New Zealand,Captain,Kolkata Knight Riders,Mumbai Indians,2009,0,28,0,Blank,Blank,Bb Mccullum,Sr Tendulkar,Mn Van Wyk,Pr Shah,1981-09-27
14414,39220800082,392208,82,Ab Agarkar,12/4/1977,Right-hand Bat,Right-arm Fast,India,Player,Kolkata Knight Riders,Mumbai Indians,2009,0,32,0,Blank,Blank,Bb Mccullum,Sr Tendulkar,Mn Van Wyk,Pr Shah,1977-12-04
14417,39220800104,392208,104,Bj Hodge,12/29/1974,Right-hand Bat,Right-arm Offbreak,Australia,Player,Kolkata Knight Riders,Mumbai Indians,2009,0,35,0,Blank,Blank,Bb Mccullum,Sr Tendulkar,Mn Van Wyk,Pr Shah,1974-12-29
14418,39220800106,392208,106,Ab Dinda,3/25/1984,Right-hand Bat,Right-arm Medium-fast,India,Player,Kolkata Knight Riders,Mumbai Indians,2009,0,25,0,Blank,Blank,Bb Mccullum,Sr Tendulkar,Mn Van Wyk,Pr Shah,1984-03-25
14419,39220800162,392208,162,Ch Gayle,9/21/1979,Left-hand Bat,Right-arm Offbreak,West Indies,Player,Kolkata Knight Riders,Mumbai Indians,2009,0,30,0,Blank,Blank,Bb Mccullum,Sr Tendulkar,Mn Van Wyk,Pr Shah,1979-09-21
14422,39220800044,392208,44,St Jayasuriya,6/30/1969,Left-hand Bat,Slow Left-arm Orthodox,Sri Lanka,Player,Mumbai Indians,Kolkata Knight Riders,2009,0,40,1,Blank,Blank,Sr Tendulkar,Bb Mccullum,Pr Shah,Mn Van Wyk,1969-06-30
14423,39220800047,392208,47,Pr Shah,11/3/1987,Right-hand Bat,N/a,India,Keeper,Mumbai Indians,Kolkata Knight Riders,2009,0,22,1,Blank,Blank,Sr Tendulkar,Bb Mccullum,Pr Shah,Mn Van Wyk,1987-11-03
14424,39220800048,392208,48,Am Nayar,10/8/1983,Left-hand Bat,Right-arm Medium,India,Player,Mumbai Indians,Kolkata Knight Riders,2009,0,26,1,Blank,Blank,Sr Tendulkar,Bb Mccullum,Pr Shah,Mn Van Wyk,1983-10-08
14426,39220800079,392208,79,Ss Tiwary,12/30/1989,Left-hand Bat,N/a,India,Player,Mumbai Indians,Kolkata Knight Riders,2009,0,20,1,Blank,Blank,Sr Tendulkar,Bb Mccullum,Pr Shah,Mn Van Wyk,1989-12-30
14427,39220800085,392208,85,Am Rahane,6/6/1988,Right-hand Bat,Right-arm Medium,India,Player,Mumbai Indians,Kolkata Knight Riders,2009,0,21,1,Blank,Blank,Sr Tendulkar,Bb Mccullum,Pr Shah,Mn Van Wyk,1988-06-06
14428,39220800133,392208,133,Sr Tendulkar,4/24/1973,Right-hand Bat,Right-arm Offbreak,India,Captain,Mumbai Indians,Kolkata Knight Riders,2009,0,36,1,Blank,Blank,Sr Tendulkar,Bb Mccullum,Pr Shah,Mn Van Wyk,1973-04-24
14434,39220900027,392209,27,Yuvraj Singh,12/12/1981,Left-hand Bat,Slow Left-arm Orthodox,India,Captain,Kings Xi Punjab,Royal Challengers Bangalore,2009,1,28,0,Blank,Blank,Yuvraj Singh,A Kumble,Kc Sangakkara,Mv Boucher,1981-12-12
14435,39220900028,392209,28,Sm Katich,8/21/1975,Left-hand Bat,Slow Left-arm Chinaman,Australia,Player,Kings Xi Punjab,Royal Challengers Bangalore,2009,0,34,0,Blank,Blank,Yuvraj Singh,A Kumble,Kc Sangakkara,Mv Boucher,1975-08-21
14436,39220900029,392209,29,Ik Pathan,10/27/1984,Left-hand Bat,Left-arm Medium-fast,India,Player,Kings Xi Punjab,Royal Challengers Bangalore,2009,0,25,0,Blank,Blank,Yuvraj Singh,A Kumble,Kc Sangakkara,Mv Boucher,1984-10-27
14437,39220900064,392209,64,Dpmd Jayawardene,5/27/1977,Right-hand Bat,Right-arm Medium,Sri Lanka,Player,Kings Xi Punjab,Royal Challengers Bangalore,2009,0,32,0,Blank,Blank,Yuvraj Singh,A Kumble,Kc Sangakkara,Mv Boucher,1977-05-27
14441,39220900215,392209,215,Ya Abdulla,1/17/1983,Left-hand Bat,Left-arm Fast-medium,India,Player,Kings Xi Punjab,Royal Challengers Bangalore,2009,0,26,0,Blank,Blank,Yuvraj Singh,A Kumble,Kc Sangakkara,Mv Boucher,1983-01-17
14445,39220900011,392209,11,Mv Boucher,12/3/1976,Right-hand Bat,Right-arm Medium,South Africa,Keeper,Royal Challengers Bangalore,Kings Xi Punjab,2009,0,33,1,Blank,Blank,A Kumble,Yuvraj Singh,Mv Boucher,Kc Sangakkara,1976-12-03
14446,39220900014,392209,14,P Kumar,10/2/1986,Right-hand Bat,Right-arm Medium,India,Player,Royal Challengers Bangalore,Kings Xi Punjab,2009,0,23,1,Blank,Blank,A Kumble,Yuvraj Singh,Mv Boucher,Kc Sangakkara,1986-10-02
14448,39220900124,392209,124,A Kumble,10/17/1970,Right-hand Bat,Legbreak Googly,India,Captain,Royal Challengers Bangalore,Kings Xi Punjab,2009,0,39,1,Blank,Blank,A Kumble,Yuvraj Singh,Mv Boucher,Kc Sangakkara,1970-10-17
14451,39220900164,392209,164,R Bishnoi,10/8/1987,Right-hand Bat,Right-arm Medium-fast,India,Player,Royal Challengers Bangalore,Kings Xi Punjab,2009,0,22,1,Blank,Blank,A Kumble,Yuvraj Singh,Mv Boucher,Kc Sangakkara,1987-10-08
14456,39221000057,392210,57,Rg Sharma,4/30/1987,Right-hand Bat,Right-arm Offbreak,India,Player,Deccan Chargers,Rajasthan Royals,2009,0,22,0,Blank,Blank,Ac Gilchrist,Sk Warne,Ac Gilchrist,Nv Ojha,1987-04-30
14457,39221000061,392210,61,Rp Singh,12/6/1985,Right-hand Bat,Left-arm Fast-medium,India,Player,Deccan Chargers,Rajasthan Royals,2009,0,24,0,Blank,Blank,Ac Gilchrist,Sk Warne,Ac Gilchrist,Nv Ojha,1985-12-06
14461,39221000165,392210,165,Fh Edwards,2/6/1982,Right-hand Bat,Right-arm Fast,West Indies,Player,Deccan Chargers,Rajasthan Royals,2009,0,27,0,Blank,Blank,Ac Gilchrist,Sk Warne,Ac Gilchrist,Nv Ojha,1982-02-06
14467,39221000038,392210,38,Sk Warne,9/13/1969,Right-hand Bat,Legbreak Googly,Australia,Captain,Rajasthan Royals,Deccan Chargers,2009,0,40,1,Blank,Blank,Sk Warne,Ac Gilchrist,Nv Ojha,Ac Gilchrist,1969-09-13
14470,39221000101,392210,101,Sa Asnodkar,3/29/1984,Right-hand Bat,Right-arm Offbreak,India,Player,Rajasthan Royals,Deccan Chargers,2009,0,25,1,Blank,Blank,Sk Warne,Ac Gilchrist,Nv Ojha,Ac Gilchrist,1984-03-29
14472,39221000169,392210,169,As Raut,3/3/1987,Right-hand Bat,Legbreak Googly,India,Player,Rajasthan Royals,Deccan Chargers,2009,0,22,1,Blank,Blank,Sk Warne,Ac Gilchrist,Nv Ojha,Ac Gilchrist,1987-03-03
14473,39221000182,392210,182,La Carseldine,11/17/1975,Left-hand Bat,Left-arm Medium,Australia,Player,Rajasthan Royals,Deccan Chargers,2009,0,34,1,Blank,Blank,Sk Warne,Ac Gilchrist,Nv Ojha,Ac Gilchrist,1975-11-17
14474,39221000183,392210,183,Nv Ojha,7/20/1983,Right-hand Bat,N/a,India,Keeper,Rajasthan Royals,Deccan Chargers,2009,0,26,1,Blank,Blank,Sk Warne,Ac Gilchrist,Nv Ojha,Ac Gilchrist,1983-07-20
14475,39221000184,392210,184,Sm Harwood,3/1/1974,Right-hand Bat,Right-arm Fast-medium,Australia,Player,Rajasthan Royals,Deccan Chargers,2009,0,35,1,Blank,Blank,Sk Warne,Ac Gilchrist,Nv Ojha,Ac Gilchrist,1974-03-01
14476,39221100040,392211,40,G Gambhir,10/14/1981,Left-hand Bat,Legbreak,India,Captain,Delhi Daredevils,Chennai Super Kings,2009,0,28,0,Blank,Blank,G Gambhir,Ms Dhoni,Kd Karthik,Ms Dhoni,1981-10-14
14477,39221100073,392211,73,A Nehra,4/29/1979,Right-hand Bat,Left-arm Medium-fast,India,Player,Delhi Daredevils,Chennai Super Kings,2009,0,30,0,Blank,Blank,G Gambhir,Ms Dhoni,Kd Karthik,Ms Dhoni,1979-04-29
14478,39221100088,392211,88,Kd Karthik,6/1/1985,Right-hand Bat,N/a,India,Keeper,Delhi Daredevils,Chennai Super Kings,2009,0,24,0,Blank,Blank,G Gambhir,Ms Dhoni,Kd Karthik,Ms Dhoni,1985-06-01
14482,39221100135,392211,135,Tm Dilshan,10/14/1976,Right-hand Bat,Right-arm Offbreak,Sri Lanka,Player,Delhi Daredevils,Chennai Super Kings,2009,0,33,0,Blank,Blank,G Gambhir,Ms Dhoni,Kd Karthik,Ms Dhoni,1976-10-14
14483,39221100136,392211,136,A Mishra,11/24/1982,Right-hand Bat,Legbreak,India,Player,Delhi Daredevils,Chennai Super Kings,2009,0,27,0,Blank,Blank,G Gambhir,Ms Dhoni,Kd Karthik,Ms Dhoni,1982-11-24
14488,39221100020,392211,20,Ms Dhoni,7/7/1981,Right-hand Bat,Right-arm Medium,India,Captainkeeper,Chennai Super Kings,Delhi Daredevils,2009,0,28,1,Blank,Blank,Ms Dhoni,G Gambhir,Ms Dhoni,Kd Karthik,1981-07-07
14490,39221100022,392211,22,Jdp Oram,7/28/1978,Left-hand Bat,Right-arm Fast-medium,New Zealand,Player,Chennai Super Kings,Delhi Daredevils,2009,0,31,1,Blank,Blank,Ms Dhoni,G Gambhir,Ms Dhoni,Kd Karthik,1978-07-28
14491,39221100023,392211,23,S Badrinath,8/30/1980,Right-hand Bat,Right-arm Offbreak,India,Player,Chennai Super Kings,Delhi Daredevils,2009,0,29,1,Blank,Blank,Ms Dhoni,G Gambhir,Ms Dhoni,Kd Karthik,1980-08-30
14493,39221100121,392211,121,M Muralitharan,4/17/1972,Right-hand Bat,Right-arm Offbreak,Sri Lanka,Player,Chennai Super Kings,Delhi Daredevils,2009,0,37,1,Blank,Blank,Ms Dhoni,G Gambhir,Ms Dhoni,Kd Karthik,1972-04-17
14494,39221100151,392211,151,L Balaji,9/27/1981,Right-hand Bat,Right-arm Medium-fast,India,Player,Chennai Super Kings,Delhi Daredevils,2009,0,28,1,Blank,Blank,Ms Dhoni,G Gambhir,Ms Dhoni,Kd Karthik,1981-09-27
14495,39221100185,392211,185,M Vijay,4/1/1984,Right-hand Bat,Right-arm Offbreak,India,Player,Chennai Super Kings,Delhi Daredevils,2009,0,25,1,Blank,Blank,Ms Dhoni,G Gambhir,Ms Dhoni,Kd Karthik,1984-04-01
14496,39221100186,392211,186,Sb Jakati,11/27/1980,Left-hand Bat,Slow Left-arm Orthodox,India,Player,Chennai Super Kings,Delhi Daredevils,2009,1,29,1,Blank,Blank,Ms Dhoni,G Gambhir,Ms Dhoni,Kd Karthik,1980-11-27
14497,39221100218,392211,218,S Tyagi,9/17/1987,Right-hand Bat,Right-arm Medium,India,Player,Chennai Super Kings,Delhi Daredevils,2009,0,22,1,Blank,Blank,Ms Dhoni,G Gambhir,Ms Dhoni,Kd Karthik,1987-09-17
14502,39221200064,392212,64,Dpmd Jayawardene,5/27/1977,Right-hand Bat,Right-arm Medium,Sri Lanka,Player,Kings Xi Punjab,Kolkata Knight Riders,2009,1,32,1,Blank,Blank,Yuvraj Singh,Bb Mccullum,Kc Sangakkara,Mn Van Wyk,1977-05-27
14504,39221200067,392212,67,Pp Chawla,12/24/1988,Left-hand Bat,Legbreak,India,Player,Kings Xi Punjab,Kolkata Knight Riders,2009,0,21,1,Blank,Blank,Yuvraj Singh,Bb Mccullum,Kc Sangakkara,Mn Van Wyk,1988-12-24
14510,39221200002,392212,2,Bb Mccullum,9/27/1981,Right-hand Bat,Right-arm Medium,New Zealand,Captain,Kolkata Knight Riders,Kings Xi Punjab,2009,0,28,0,Blank,Blank,Bb Mccullum,Yuvraj Singh,Mn Van Wyk,Kc Sangakkara,1981-09-27
14511,39221200062,392212,62,Wp Saha,10/24/1984,Right-hand Bat,N/a,India,Player,Kolkata Knight Riders,Kings Xi Punjab,2009,0,25,0,Blank,Blank,Bb Mccullum,Yuvraj Singh,Mn Van Wyk,Kc Sangakkara,1984-10-24
14513,39221200082,392212,82,Ab Agarkar,12/4/1977,Right-hand Bat,Right-arm Fast,India,Player,Kolkata Knight Riders,Kings Xi Punjab,2009,0,32,0,Blank,Blank,Bb Mccullum,Yuvraj Singh,Mn Van Wyk,Kc Sangakkara,1977-12-04
14517,39221200106,392212,106,Ab Dinda,3/25/1984,Right-hand Bat,Right-arm Medium-fast,India,Player,Kolkata Knight Riders,Kings Xi Punjab,2009,0,25,0,Blank,Blank,Bb Mccullum,Yuvraj Singh,Mn Van Wyk,Kc Sangakkara,1984-03-25
14519,39221200176,392212,176,Mn Van Wyk,3/20/1979,Right-hand Bat,Slow Left-arm Orthodox,South Africa,Keeper,Kolkata Knight Riders,Kings Xi Punjab,2009,0,30,0,Blank,Blank,Bb Mccullum,Yuvraj Singh,Mn Van Wyk,Kc Sangakkara,1979-03-20
14521,39221300007,392213,7,W Jaffer,2/16/1978,Right-hand Bat,Right-arm Offbreak,India,Player,Royal Challengers Bangalore,Mumbai Indians,2009,0,31,1,Blank,Blank,A Kumble,Sr Tendulkar,Mv Boucher,Pr Shah,1978-02-16
14528,39221300124,392213,124,A Kumble,10/17/1970,Right-hand Bat,Legbreak Googly,India,Captain,Royal Challengers Bangalore,Mumbai Indians,2009,0,39,1,Blank,Blank,A Kumble,Sr Tendulkar,Mv Boucher,Pr Shah,1970-10-17
14536,39221300050,392213,50,Harbhajan Singh,7/3/1980,Right-hand Bat,Right-arm Offbreak,India,Player,Mumbai Indians,Royal Challengers Bangalore,2009,0,29,0,Blank,Blank,Sr Tendulkar,A Kumble,Pr Shah,Mv Boucher,1980-07-03
14538,39221300085,392213,85,Am Rahane,6/6/1988,Right-hand Bat,Right-arm Medium,India,Player,Mumbai Indians,Royal Challengers Bangalore,2009,0,21,0,Blank,Blank,Sr Tendulkar,A Kumble,Pr Shah,Mv Boucher,1988-06-06
14544,39221400055,392214,55,Vvs Laxman,11/1/1974,Right-hand Bat,Right-arm Offbreak,India,Player,Deccan Chargers,Chennai Super Kings,2009,0,35,0,Blank,Blank,Ac Gilchrist,Ms Dhoni,Ac Gilchrist,Ms Dhoni,1974-11-01
14545,39221400057,392214,57,Rg Sharma,4/30/1987,Right-hand Bat,Right-arm Offbreak,India,Player,Deccan Chargers,Chennai Super Kings,2009,0,22,0,Blank,Blank,Ac Gilchrist,Ms Dhoni,Ac Gilchrist,Ms Dhoni,1987-04-30
14548,39221400131,392214,131,Pp Ojha,9/5/1986,Left-hand Bat,Slow Left-arm Orthodox,India,Player,Deccan Chargers,Chennai Super Kings,2009,0,23,0,Blank,Blank,Ac Gilchrist,Ms Dhoni,Ac Gilchrist,Ms Dhoni,1986-09-05
14549,39221400147,392214,147,Dr Smith,4/12/1983,Right-hand Bat,Right-arm Medium,West Indies,Player,Deccan Chargers,Chennai Super Kings,2009,0,26,0,Blank,Blank,Ac Gilchrist,Ms Dhoni,Ac Gilchrist,Ms Dhoni,1983-04-12
14554,39221400020,392214,20,Ms Dhoni,7/7/1981,Right-hand Bat,Right-arm Medium,India,Captainkeeper,Chennai Super Kings,Deccan Chargers,2009,1,28,1,Blank,Blank,Ms Dhoni,Ac Gilchrist,Ms Dhoni,Ac Gilchrist,1981-07-07
14555,39221400021,392214,21,Sk Raina,11/27/1986,Left-hand Bat,Right-arm Offbreak,India,Player,Chennai Super Kings,Deccan Chargers,2009,0,23,1,Blank,Blank,Ms Dhoni,Ac Gilchrist,Ms Dhoni,Ac Gilchrist,1986-11-27
14557,39221400023,392214,23,S Badrinath,8/30/1980,Right-hand Bat,Right-arm Offbreak,India,Player,Chennai Super Kings,Deccan Chargers,2009,0,29,1,Blank,Blank,Ms Dhoni,Ac Gilchrist,Ms Dhoni,Ac Gilchrist,1980-08-30
14558,39221400109,392214,109,Ja Morkel,6/10/1981,Left-hand Bat,Right-arm Medium-fast,South Africa,Player,Chennai Super Kings,Deccan Chargers,2009,0,28,1,Blank,Blank,Ms Dhoni,Ac Gilchrist,Ms Dhoni,Ac Gilchrist,1981-06-10
14560,39221400151,392214,151,L Balaji,9/27/1981,Right-hand Bat,Right-arm Medium-fast,India,Player,Chennai Super Kings,Deccan Chargers,2009,0,28,1,Blank,Blank,Ms Dhoni,Ac Gilchrist,Ms Dhoni,Ac Gilchrist,1981-09-27
14574,39221500215,392215,215,Ya Abdulla,1/17/1983,Left-hand Bat,Left-arm Fast-medium,India,Player,Kings Xi Punjab,Rajasthan Royals,2009,0,26,0,Blank,Blank,Yuvraj Singh,Sk Warne,Kc Sangakkara,Nv Ojha,1983-01-17
14581,39221500169,392215,169,As Raut,3/3/1987,Right-hand Bat,Legbreak Googly,India,Player,Rajasthan Royals,Kings Xi Punjab,2009,0,22,1,Blank,Blank,Sk Warne,Yuvraj Singh,Nv Ojha,Kc Sangakkara,1987-03-03
14584,39221500184,392215,184,Sm Harwood,3/1/1974,Right-hand Bat,Right-arm Fast-medium,Australia,Player,Rajasthan Royals,Kings Xi Punjab,2009,0,35,1,Blank,Blank,Sk Warne,Yuvraj Singh,Nv Ojha,Kc Sangakkara,1974-03-01
14586,39221600040,392216,40,G Gambhir,10/14/1981,Left-hand Bat,Legbreak,India,Captain,Delhi Daredevils,Kolkata Knight Riders,2009,1,28,1,Blank,Blank,G Gambhir,Bb Mccullum,Kd Karthik,Mn Van Wyk,1981-10-14
14587,39221600073,392216,73,A Nehra,4/29/1979,Right-hand Bat,Left-arm Medium-fast,India,Player,Delhi Daredevils,Kolkata Knight Riders,2009,0,30,1,Blank,Blank,G Gambhir,Bb Mccullum,Kd Karthik,Mn Van Wyk,1979-04-29
14591,39221600116,392216,116,Pj Sangwan,11/5/1990,Right-hand Bat,Left-arm Medium,India,Player,Delhi Daredevils,Kolkata Knight Riders,2009,0,19,1,Blank,Blank,G Gambhir,Bb Mccullum,Kd Karthik,Mn Van Wyk,1990-11-05
14594,39221600171,392216,171,M Manhas,10/12/1979,Right-hand Bat,Right-arm Offbreak,India,Player,Delhi Daredevils,Kolkata Knight Riders,2009,0,30,1,Blank,Blank,G Gambhir,Bb Mccullum,Kd Karthik,Mn Van Wyk,1979-10-12
14599,39221600062,392216,62,Wp Saha,10/24/1984,Right-hand Bat,N/a,India,Player,Kolkata Knight Riders,Delhi Daredevils,2009,0,25,0,Blank,Blank,Bb Mccullum,G Gambhir,Mn Van Wyk,Kd Karthik,1984-10-24
14600,39221600082,392216,82,Ab Agarkar,12/4/1977,Right-hand Bat,Right-arm Fast,India,Player,Kolkata Knight Riders,Delhi Daredevils,2009,0,32,0,Blank,Blank,Bb Mccullum,G Gambhir,Mn Van Wyk,Kd Karthik,1977-12-04
14602,39221600084,392216,84,I Sharma,9/2/1988,Right-hand Bat,Right-arm Fast-medium,India,Player,Kolkata Knight Riders,Delhi Daredevils,2009,0,21,0,Blank,Blank,Bb Mccullum,G Gambhir,Mn Van Wyk,Kd Karthik,1988-09-02
14605,39221600163,392216,163,Mc Henriques,2/1/1987,Right-hand Bat,Right-arm Fast-medium,Australia,Player,Kolkata Knight Riders,Delhi Daredevils,2009,0,22,0,Blank,Blank,Bb Mccullum,G Gambhir,Mn Van Wyk,Kd Karthik,1987-02-01
14606,39221600170,392216,170,Yashpal Singh,11/27/1981,Right-hand Bat,Right-arm Medium,India,Player,Kolkata Knight Riders,Delhi Daredevils,2009,0,28,0,Blank,Blank,Bb Mccullum,G Gambhir,Mn Van Wyk,Kd Karthik,1981-11-27
14613,39221700112,392217,112,Db Ravi Teja,9/5/1987,Right-hand Bat,Legbreak Googly,India,Player,Deccan Chargers,Mumbai Indians,2009,0,22,1,Blank,Blank,Ac Gilchrist,Sr Tendulkar,Ac Gilchrist,Pr Shah,1987-09-05
14618,39221700256,392217,256,Harmeet Singh,9/7/1992,Left-hand Bat,Slow Left-arm Orthodox,India,Player,Deccan Chargers,Mumbai Indians,2009,0,17,1,Blank,Blank,Ac Gilchrist,Sr Tendulkar,Ac Gilchrist,Pr Shah,1992-09-07
14619,39221700044,392217,44,St Jayasuriya,6/30/1969,Left-hand Bat,Slow Left-arm Orthodox,Sri Lanka,Player,Mumbai Indians,Deccan Chargers,2009,0,40,0,Blank,Blank,Sr Tendulkar,Ac Gilchrist,Pr Shah,Ac Gilchrist,1969-06-30
14620,39221700047,392217,47,Pr Shah,11/3/1987,Right-hand Bat,N/a,India,Keeper,Mumbai Indians,Deccan Chargers,2009,0,22,0,Blank,Blank,Sr Tendulkar,Ac Gilchrist,Pr Shah,Ac Gilchrist,1987-11-03
14621,39221700048,392217,48,Am Nayar,10/8/1983,Left-hand Bat,Right-arm Medium,India,Player,Mumbai Indians,Deccan Chargers,2009,0,26,0,Blank,Blank,Sr Tendulkar,Ac Gilchrist,Pr Shah,Ac Gilchrist,1983-10-08
14622,39221700050,392217,50,Harbhajan Singh,7/3/1980,Right-hand Bat,Right-arm Offbreak,India,Player,Mumbai Indians,Deccan Chargers,2009,0,29,0,Blank,Blank,Sr Tendulkar,Ac Gilchrist,Pr Shah,Ac Gilchrist,1980-07-03
14628,39221700154,392217,154,Jp Duminy,4/14/1984,Left-hand Bat,Right-arm Offbreak,South Africa,Player,Mumbai Indians,Deccan Chargers,2009,0,25,0,Blank,Blank,Sr Tendulkar,Ac Gilchrist,Pr Shah,Ac Gilchrist,1984-04-14
14629,39221700194,392217,194,Sl Malinga,8/28/1983,Right-hand Bat,Right-arm Fast,Sri Lanka,Player,Mumbai Indians,Deccan Chargers,2009,0,26,0,Blank,Blank,Sr Tendulkar,Ac Gilchrist,Pr Shah,Ac Gilchrist,1983-08-28
14632,39221800008,392218,8,V Kohli,11/5/1988,Right-hand Bat,Right-arm Medium,India,Player,Royal Challengers Bangalore,Rajasthan Royals,2009,0,21,0,Blank,Blank,A Kumble,Sk Warne,Mv Boucher,Nv Ojha,1988-11-05
14634,39221800011,392218,11,Mv Boucher,12/3/1976,Right-hand Bat,Right-arm Medium,South Africa,Keeper,Royal Challengers Bangalore,Rajasthan Royals,2009,0,33,0,Blank,Blank,A Kumble,Sk Warne,Mv Boucher,Nv Ojha,1976-12-03
14639,39221800177,392218,177,Re Van Der Merwe,12/31/1984,Right-hand Bat,Slow Left-arm Orthodox,South Africa,Player,Royal Challengers Bangalore,Rajasthan Royals,2009,0,25,0,Blank,Blank,A Kumble,Sk Warne,Mv Boucher,Nv Ojha,1984-12-31
14644,39221800074,392218,74,Gc Smith,2/1/1981,Left-hand Bat,Right-arm Offbreak,South Africa,Player,Rajasthan Royals,Royal Challengers Bangalore,2009,0,28,1,Blank,Blank,Sk Warne,A Kumble,Nv Ojha,Mv Boucher,1981-02-01
14646,39221800138,392218,138,Nk Patel,3/26/1981,Left-hand Bat,N/a,India,Player,Rajasthan Royals,Royal Challengers Bangalore,2009,0,28,1,Blank,Blank,Sk Warne,A Kumble,Nv Ojha,Mv Boucher,1981-03-26
14647,39221800169,392218,169,As Raut,3/3/1987,Right-hand Bat,Legbreak Googly,India,Player,Rajasthan Royals,Royal Challengers Bangalore,2009,0,22,1,Blank,Blank,Sk Warne,A Kumble,Nv Ojha,Mv Boucher,1987-03-03
14649,39221800183,392218,183,Nv Ojha,7/20/1983,Right-hand Bat,N/a,India,Keeper,Rajasthan Royals,Royal Challengers Bangalore,2009,0,26,1,Blank,Blank,Sk Warne,A Kumble,Nv Ojha,Mv Boucher,1983-07-20
14652,39221900024,392219,24,K Goel,12/24/1986,Left-hand Bat,Right-arm Offbreak,India,Player,Kings Xi Punjab,Chennai Super Kings,2009,0,23,0,Blank,Blank,Yuvraj Singh,Ms Dhoni,Kc Sangakkara,Ms Dhoni,1986-12-24
14654,39221900027,392219,27,Yuvraj Singh,12/12/1981,Left-hand Bat,Slow Left-arm Orthodox,India,Captain,Kings Xi Punjab,Chennai Super Kings,2009,0,28,0,Blank,Blank,Yuvraj Singh,Ms Dhoni,Kc Sangakkara,Ms Dhoni,1981-12-12
14656,39221900029,392219,29,Ik Pathan,10/27/1984,Left-hand Bat,Left-arm Medium-fast,India,Player,Kings Xi Punjab,Chennai Super Kings,2009,0,25,0,Blank,Blank,Yuvraj Singh,Ms Dhoni,Kc Sangakkara,Ms Dhoni,1984-10-27
14657,39221900064,392219,64,Dpmd Jayawardene,5/27/1977,Right-hand Bat,Right-arm Medium,Sri Lanka,Player,Kings Xi Punjab,Chennai Super Kings,2009,0,32,0,Blank,Blank,Yuvraj Singh,Ms Dhoni,Kc Sangakkara,Ms Dhoni,1977-05-27
14659,39221900067,392219,67,Pp Chawla,12/24/1988,Left-hand Bat,Legbreak,India,Player,Kings Xi Punjab,Chennai Super Kings,2009,0,21,0,Blank,Blank,Yuvraj Singh,Ms Dhoni,Kc Sangakkara,Ms Dhoni,1988-12-24
14660,39221900077,392219,77,S Sreesanth,2/6/1983,Right-hand Bat,Right-arm Fast-medium,India,Player,Kings Xi Punjab,Chennai Super Kings,2009,0,26,0,Blank,Blank,Yuvraj Singh,Ms Dhoni,Kc Sangakkara,Ms Dhoni,1983-02-06
14661,39221900078,392219,78,Vrv Singh,9/17/1984,Right-hand Bat,Right-arm Medium-fast,India,Player,Kings Xi Punjab,Chennai Super Kings,2009,0,25,0,Blank,Blank,Yuvraj Singh,Ms Dhoni,Kc Sangakkara,Ms Dhoni,1984-09-17
14663,39221900018,392219,18,Ml Hayden,10/29/1971,Left-hand Bat,Right-arm Medium,Australia,Player,Chennai Super Kings,Kings Xi Punjab,2009,1,38,1,Blank,Blank,Ms Dhoni,Yuvraj Singh,Ms Dhoni,Kc Sangakkara,1971-10-29
14666,39221900023,392219,23,S Badrinath,8/30/1980,Right-hand Bat,Right-arm Offbreak,India,Player,Chennai Super Kings,Kings Xi Punjab,2009,0,29,1,Blank,Blank,Ms Dhoni,Yuvraj Singh,Ms Dhoni,Kc Sangakkara,1980-08-30
14667,39221900109,392219,109,Ja Morkel,6/10/1981,Left-hand Bat,Right-arm Medium-fast,South Africa,Player,Chennai Super Kings,Kings Xi Punjab,2009,0,28,1,Blank,Blank,Ms Dhoni,Yuvraj Singh,Ms Dhoni,Kc Sangakkara,1981-06-10
14670,39221900151,392219,151,L Balaji,9/27/1981,Right-hand Bat,Right-arm Medium-fast,India,Player,Chennai Super Kings,Kings Xi Punjab,2009,0,28,1,Blank,Blank,Ms Dhoni,Yuvraj Singh,Ms Dhoni,Kc Sangakkara,1981-09-27
14671,39221900186,392219,186,Sb Jakati,11/27/1980,Left-hand Bat,Slow Left-arm Orthodox,India,Player,Chennai Super Kings,Kings Xi Punjab,2009,0,29,1,Blank,Blank,Ms Dhoni,Yuvraj Singh,Ms Dhoni,Kc Sangakkara,1980-11-27
14675,39222000073,392220,73,A Nehra,4/29/1979,Right-hand Bat,Left-arm Medium-fast,India,Player,Delhi Daredevils,Mumbai Indians,2009,1,30,1,Blank,Blank,G Gambhir,Sr Tendulkar,Kd Karthik,Pr Shah,1979-04-29
14676,39222000088,392220,88,Kd Karthik,6/1/1985,Right-hand Bat,N/a,India,Keeper,Delhi Daredevils,Mumbai Indians,2009,0,24,1,Blank,Blank,G Gambhir,Sr Tendulkar,Kd Karthik,Pr Shah,1985-06-01
14677,39222000089,392220,89,R Bhatia,10/22/1979,Right-hand Bat,Right-arm Medium-fast,India,Player,Delhi Daredevils,Mumbai Indians,2009,0,30,1,Blank,Blank,G Gambhir,Sr Tendulkar,Kd Karthik,Pr Shah,1979-10-22
14681,39222000136,392220,136,A Mishra,11/24/1982,Right-hand Bat,Legbreak,India,Player,Delhi Daredevils,Mumbai Indians,2009,0,27,1,Blank,Blank,G Gambhir,Sr Tendulkar,Kd Karthik,Pr Shah,1982-11-24
14683,39222000187,392220,187,Da Warner,10/27/1986,Left-hand Bat,Legbreak,Australia,Player,Delhi Daredevils,Mumbai Indians,2009,0,23,1,Blank,Blank,G Gambhir,Sr Tendulkar,Kd Karthik,Pr Shah,1986-10-27
14689,39222000071,392220,71,Dj Bravo,10/7/1983,Right-hand Bat,Right-arm Medium-fast,West Indies,Player,Mumbai Indians,Delhi Daredevils,2009,0,26,0,Blank,Blank,Sr Tendulkar,G Gambhir,Pr Shah,Kd Karthik,1983-10-07
14690,39222000080,392220,80,Ds Kulkarni,12/10/1988,Right-hand Bat,Right-arm Medium,India,Player,Mumbai Indians,Delhi Daredevils,2009,0,21,0,Blank,Blank,Sr Tendulkar,G Gambhir,Pr Shah,Kd Karthik,1988-12-10
14691,39222000085,392220,85,Am Rahane,6/6/1988,Right-hand Bat,Right-arm Medium,India,Player,Mumbai Indians,Delhi Daredevils,2009,0,21,0,Blank,Blank,Sr Tendulkar,G Gambhir,Pr Shah,Kd Karthik,1988-06-06
14692,39222000115,392220,115,Rr Raje,9/3/1986,Right-hand Bat,Right-arm Fast-medium,India,Player,Mumbai Indians,Delhi Daredevils,2009,0,23,0,Blank,Blank,Sr Tendulkar,G Gambhir,Pr Shah,Kd Karthik,1986-09-03
14697,39222100054,392221,54,Y Venugopal Rao,2/26/1982,Right-hand Bat,Right-arm Offbreak,India,Player,Deccan Chargers,Kings Xi Punjab,2009,0,27,0,Blank,Blank,Ac Gilchrist,Yuvraj Singh,Ac Gilchrist,Kc Sangakkara,1982-02-26
14698,39222100056,392221,56,A Symonds,6/9/1975,Right-hand Bat,Right-arm Offbreak,Australia,Player,Deccan Chargers,Kings Xi Punjab,2009,0,34,0,Blank,Blank,Ac Gilchrist,Yuvraj Singh,Ac Gilchrist,Kc Sangakkara,1975-06-09
14700,39222100061,392221,61,Rp Singh,12/6/1985,Right-hand Bat,Left-arm Fast-medium,India,Player,Deccan Chargers,Kings Xi Punjab,2009,0,24,0,Blank,Blank,Ac Gilchrist,Yuvraj Singh,Ac Gilchrist,Kc Sangakkara,1985-12-06
14702,39222100112,392221,112,Db Ravi Teja,9/5/1987,Right-hand Bat,Legbreak Googly,India,Player,Deccan Chargers,Kings Xi Punjab,2009,0,22,0,Blank,Blank,Ac Gilchrist,Yuvraj Singh,Ac Gilchrist,Kc Sangakkara,1987-09-05
14704,39222100178,392221,178,Tl Suman,12/15/1983,Right-hand Bat,Right-arm Offbreak,India,Player,Deccan Chargers,Kings Xi Punjab,2009,0,26,0,Blank,Blank,Ac Gilchrist,Yuvraj Singh,Ac Gilchrist,Kc Sangakkara,1983-12-15
14705,39222100179,392221,179,Shoaib Ahmed,8/17/1990,Right-hand Bat,Right-arm Fast-medium,Pakistan,Player,Deccan Chargers,Kings Xi Punjab,2009,0,19,0,Blank,Blank,Ac Gilchrist,Yuvraj Singh,Ac Gilchrist,Kc Sangakkara,1990-08-17
14710,39222100029,392221,29,Ik Pathan,10/27/1984,Left-hand Bat,Left-arm Medium-fast,India,Player,Kings Xi Punjab,Deccan Chargers,2009,0,25,1,Blank,Blank,Yuvraj Singh,Ac Gilchrist,Kc Sangakkara,Ac Gilchrist,1984-10-27
14711,39222100064,392221,64,Dpmd Jayawardene,5/27/1977,Right-hand Bat,Right-arm Medium,Sri Lanka,Player,Kings Xi Punjab,Deccan Chargers,2009,1,32,1,Blank,Blank,Yuvraj Singh,Ac Gilchrist,Kc Sangakkara,Ac Gilchrist,1977-05-27
14713,39222100066,392221,66,B Lee,11/8/1976,Right-hand Bat,Right-arm Fast,Australia,Player,Kings Xi Punjab,Deccan Chargers,2009,0,33,1,Blank,Blank,Yuvraj Singh,Ac Gilchrist,Kc Sangakkara,Ac Gilchrist,1976-11-08
14722,39222200023,392222,23,S Badrinath,8/30/1980,Right-hand Bat,Right-arm Offbreak,India,Player,Chennai Super Kings,Rajasthan Royals,2009,1,29,1,Blank,Blank,Ms Dhoni,Sk Warne,Ms Dhoni,Nv Ojha,1980-08-30
14723,39222200109,392222,109,Ja Morkel,6/10/1981,Left-hand Bat,Right-arm Medium-fast,South Africa,Player,Chennai Super Kings,Rajasthan Royals,2009,0,28,1,Blank,Blank,Ms Dhoni,Sk Warne,Ms Dhoni,Nv Ojha,1981-06-10
14724,39222200121,392222,121,M Muralitharan,4/17/1972,Right-hand Bat,Right-arm Offbreak,Sri Lanka,Player,Chennai Super Kings,Rajasthan Royals,2009,0,37,1,Blank,Blank,Ms Dhoni,Sk Warne,Ms Dhoni,Nv Ojha,1972-04-17
14725,39222200151,392222,151,L Balaji,9/27/1981,Right-hand Bat,Right-arm Medium-fast,India,Player,Chennai Super Kings,Rajasthan Royals,2009,0,28,1,Blank,Blank,Ms Dhoni,Sk Warne,Ms Dhoni,Nv Ojha,1981-09-27
14730,39222200035,392222,35,Ra Jadeja,12/6/1988,Left-hand Bat,Slow Left-arm Orthodox,India,Player,Rajasthan Royals,Chennai Super Kings,2009,0,21,0,Blank,Blank,Sk Warne,Ms Dhoni,Nv Ojha,Ms Dhoni,1988-12-06
14733,39222200074,392222,74,Gc Smith,2/1/1981,Left-hand Bat,Right-arm Offbreak,South Africa,Player,Rajasthan Royals,Chennai Super Kings,2009,0,28,0,Blank,Blank,Sk Warne,Ms Dhoni,Nv Ojha,Ms Dhoni,1981-02-01
14734,39222200101,392222,101,Sa Asnodkar,3/29/1984,Right-hand Bat,Right-arm Offbreak,India,Player,Rajasthan Royals,Chennai Super Kings,2009,0,25,0,Blank,Blank,Sk Warne,Ms Dhoni,Nv Ojha,Ms Dhoni,1984-03-29
14735,39222200169,392222,169,As Raut,3/3/1987,Right-hand Bat,Legbreak Googly,India,Player,Rajasthan Royals,Chennai Super Kings,2009,0,22,0,Blank,Blank,Sk Warne,Ms Dhoni,Nv Ojha,Ms Dhoni,1987-03-03
14736,39222200182,392222,182,La Carseldine,11/17/1975,Left-hand Bat,Left-arm Medium,Australia,Player,Rajasthan Royals,Chennai Super Kings,2009,0,34,0,Blank,Blank,Sk Warne,Ms Dhoni,Nv Ojha,Ms Dhoni,1975-11-17
14744,39222300046,392223,46,Rv Uthappa,11/11/1985,Right-hand Bat,Right-arm Medium,India,Player,Royal Challengers Bangalore,Mumbai Indians,2009,0,24,0,Blank,Blank,A Kumble,Sr Tendulkar,Mv Boucher,Yv Takawale,1985-11-11
14747,39222300124,392223,124,A Kumble,10/17/1970,Right-hand Bat,Legbreak Googly,India,Captain,Royal Challengers Bangalore,Mumbai Indians,2009,0,39,0,Blank,Blank,A Kumble,Sr Tendulkar,Mv Boucher,Yv Takawale,1970-10-17
14748,39222300177,392223,177,Re Van Der Merwe,12/31/1984,Right-hand Bat,Slow Left-arm Orthodox,South Africa,Player,Royal Challengers Bangalore,Mumbai Indians,2009,0,25,0,Blank,Blank,A Kumble,Sr Tendulkar,Mv Boucher,Yv Takawale,1984-12-31
14749,39222300181,392223,181,Kp Appanna,12/20/1988,Right-hand Bat,Slow Left-arm Orthodox,India,Player,Royal Challengers Bangalore,Mumbai Indians,2009,0,21,0,Blank,Blank,A Kumble,Sr Tendulkar,Mv Boucher,Yv Takawale,1988-12-20
14750,39222300244,392223,244,A Mithun,10/25/1989,Right-hand Bat,Right-arm Medium,India,Player,Royal Challengers Bangalore,Mumbai Indians,2009,0,20,0,Blank,Blank,A Kumble,Sr Tendulkar,Mv Boucher,Yv Takawale,1989-10-25
14751,39222300044,392223,44,St Jayasuriya,6/30/1969,Left-hand Bat,Slow Left-arm Orthodox,Sri Lanka,Player,Mumbai Indians,Royal Challengers Bangalore,2009,0,40,1,Blank,Blank,Sr Tendulkar,A Kumble,Yv Takawale,Mv Boucher,1969-06-30
14752,39222300048,392223,48,Am Nayar,10/8/1983,Left-hand Bat,Right-arm Medium,India,Player,Mumbai Indians,Royal Challengers Bangalore,2009,0,26,1,Blank,Blank,Sr Tendulkar,A Kumble,Yv Takawale,Mv Boucher,1983-10-08
14754,39222300071,392223,71,Dj Bravo,10/7/1983,Right-hand Bat,Right-arm Medium-fast,West Indies,Player,Mumbai Indians,Royal Challengers Bangalore,2009,0,26,1,Blank,Blank,Sr Tendulkar,A Kumble,Yv Takawale,Mv Boucher,1983-10-07
14758,39222300133,392223,133,Sr Tendulkar,4/24/1973,Right-hand Bat,Right-arm Offbreak,India,Captain,Mumbai Indians,Royal Challengers Bangalore,2009,0,36,1,Blank,Blank,Sr Tendulkar,A Kumble,Yv Takawale,Mv Boucher,1973-04-24
14761,39222300194,392223,194,Sl Malinga,8/28/1983,Right-hand Bat,Right-arm Fast,Sri Lanka,Player,Mumbai Indians,Royal Challengers Bangalore,2009,0,26,1,Blank,Blank,Sr Tendulkar,A Kumble,Yv Takawale,Mv Boucher,1983-08-28
14763,39222400073,392224,73,A Nehra,4/29/1979,Right-hand Bat,Left-arm Medium-fast,India,Player,Delhi Daredevils,Kolkata Knight Riders,2009,0,30,1,Blank,Blank,G Gambhir,Bb Mccullum,Kd Karthik,Mn Van Wyk,1979-04-29
14766,39222400110,392224,110,Ab De Villiers,2/17/1984,Right-hand Bat,Right-arm Medium,South Africa,Player,Delhi Daredevils,Kolkata Knight Riders,2009,0,25,1,Blank,Blank,G Gambhir,Bb Mccullum,Kd Karthik,Mn Van Wyk,1984-02-17
14770,39222400171,392224,171,M Manhas,10/12/1979,Right-hand Bat,Right-arm Offbreak,India,Player,Delhi Daredevils,Kolkata Knight Riders,2009,0,30,1,Blank,Blank,G Gambhir,Bb Mccullum,Kd Karthik,Mn Van Wyk,1979-10-12
14771,39222400187,392224,187,Da Warner,10/27/1986,Left-hand Bat,Legbreak,Australia,Player,Delhi Daredevils,Kolkata Knight Riders,2009,0,23,1,Blank,Blank,G Gambhir,Bb Mccullum,Kd Karthik,Mn Van Wyk,1986-10-27
14777,39222400083,392224,83,M Kartik,9/11/1976,Left-hand Bat,Slow Left-arm Orthodox,India,Player,Kolkata Knight Riders,Delhi Daredevils,2009,0,33,0,Blank,Blank,Bb Mccullum,G Gambhir,Mn Van Wyk,Kd Karthik,1976-09-11
14778,39222400084,392224,84,I Sharma,9/2/1988,Right-hand Bat,Right-arm Fast-medium,India,Player,Kolkata Knight Riders,Delhi Daredevils,2009,0,21,0,Blank,Blank,Bb Mccullum,G Gambhir,Mn Van Wyk,Kd Karthik,1988-09-02
14780,39222400163,392224,163,Mc Henriques,2/1/1987,Right-hand Bat,Right-arm Fast-medium,Australia,Player,Kolkata Knight Riders,Delhi Daredevils,2009,0,22,0,Blank,Blank,Bb Mccullum,G Gambhir,Mn Van Wyk,Kd Karthik,1987-02-01
14784,39222500053,392225,53,Ac Gilchrist,11/14/1971,Left-hand Bat,Right-arm Offbreak,Australia,Captainkeeper,Deccan Chargers,Rajasthan Royals,2009,0,38,1,Blank,Blank,Ac Gilchrist,Sk Warne,Ac Gilchrist,Nv Ojha,1971-11-14
14785,39222500054,392225,54,Y Venugopal Rao,2/26/1982,Right-hand Bat,Right-arm Offbreak,India,Player,Deccan Chargers,Rajasthan Royals,2009,0,27,1,Blank,Blank,Ac Gilchrist,Sk Warne,Ac Gilchrist,Nv Ojha,1982-02-26
14788,39222500060,392225,60,Wpujc Vaas,1/27/1974,Left-hand Bat,Left-arm Fast-medium,Sri Lanka,Player,Deccan Chargers,Rajasthan Royals,2009,0,35,1,Blank,Blank,Ac Gilchrist,Sk Warne,Ac Gilchrist,Nv Ojha,1974-01-27
14791,39222500131,392225,131,Pp Ojha,9/5/1986,Left-hand Bat,Slow Left-arm Orthodox,India,Player,Deccan Chargers,Rajasthan Royals,2009,0,23,1,Blank,Blank,Ac Gilchrist,Sk Warne,Ac Gilchrist,Nv Ojha,1986-09-05
14795,39222500031,392225,31,Yk Pathan,11/17/1982,Right-hand Bat,Right-arm Offbreak,India,Player,Rajasthan Royals,Deccan Chargers,2009,0,27,0,Blank,Blank,Sk Warne,Ac Gilchrist,Nv Ojha,Ac Gilchrist,1982-11-17
14800,39222500101,392225,101,Sa Asnodkar,3/29/1984,Right-hand Bat,Right-arm Offbreak,India,Player,Rajasthan Royals,Deccan Chargers,2009,0,25,0,Blank,Blank,Sk Warne,Ac Gilchrist,Nv Ojha,Ac Gilchrist,1984-03-29
14802,39222500169,392225,169,As Raut,3/3/1987,Right-hand Bat,Legbreak Googly,India,Player,Rajasthan Royals,Deccan Chargers,2009,0,22,0,Blank,Blank,Sk Warne,Ac Gilchrist,Nv Ojha,Ac Gilchrist,1987-03-03
14803,39222500182,392225,182,La Carseldine,11/17/1975,Left-hand Bat,Left-arm Medium,Australia,Player,Rajasthan Royals,Deccan Chargers,2009,0,34,0,Blank,Blank,Sk Warne,Ac Gilchrist,Nv Ojha,Ac Gilchrist,1975-11-17
14804,39222500183,392225,183,Nv Ojha,7/20/1983,Right-hand Bat,N/a,India,Keeper,Rajasthan Royals,Deccan Chargers,2009,0,26,0,Blank,Blank,Sk Warne,Ac Gilchrist,Nv Ojha,Ac Gilchrist,1983-07-20
14805,39222500190,392225,190,M Morkel,10/6/1984,Left-hand Bat,Right-arm Fast,South Africa,Player,Rajasthan Royals,Deccan Chargers,2009,0,25,0,Blank,Blank,Sk Warne,Ac Gilchrist,Nv Ojha,Ac Gilchrist,1984-10-06
14806,39222600006,392226,6,R Dravid,1/11/1973,Right-hand Bat,Right-arm Offbreak,India,Player,Royal Challengers Bangalore,Kolkata Knight Riders,2009,0,36,1,Blank,Blank,A Kumble,Bb Mccullum,Mv Boucher,Wp Saha,1973-01-11
14807,39222600008,392226,8,V Kohli,11/5/1988,Right-hand Bat,Right-arm Medium,India,Player,Royal Challengers Bangalore,Kolkata Knight Riders,2009,0,21,1,Blank,Blank,A Kumble,Bb Mccullum,Mv Boucher,Wp Saha,1988-11-05
14808,39222600009,392226,9,Jh Kallis,10/16/1975,Right-hand Bat,Right-arm Fast-medium,South Africa,Player,Royal Challengers Bangalore,Kolkata Knight Riders,2009,0,34,1,Blank,Blank,A Kumble,Bb Mccullum,Mv Boucher,Wp Saha,1975-10-16
14809,39222600011,392226,11,Mv Boucher,12/3/1976,Right-hand Bat,Right-arm Medium,South Africa,Keeper,Royal Challengers Bangalore,Kolkata Knight Riders,2009,0,33,1,Blank,Blank,A Kumble,Bb Mccullum,Mv Boucher,Wp Saha,1976-12-03
14810,39222600012,392226,12,B Akhil,10/7/1977,Right-hand Bat,Right-arm Medium-fast,India,Player,Royal Challengers Bangalore,Kolkata Knight Riders,2009,0,32,1,Blank,Blank,A Kumble,Bb Mccullum,Mv Boucher,Wp Saha,1977-10-07
14812,39222600052,392226,52,Lrpl Taylor,3/8/1984,Right-hand Bat,Right-arm Offbreak,New Zealand,Player,Royal Challengers Bangalore,Kolkata Knight Riders,2009,1,25,1,Blank,Blank,A Kumble,Bb Mccullum,Mv Boucher,Wp Saha,1984-03-08
14815,39222600157,392226,157,Jd Ryder,8/6/1984,Left-hand Bat,Right-arm Medium,New Zealand,Player,Royal Challengers Bangalore,Kolkata Knight Riders,2009,0,25,1,Blank,Blank,A Kumble,Bb Mccullum,Mv Boucher,Wp Saha,1984-08-06
14816,39222600181,392226,181,Kp Appanna,12/20/1988,Right-hand Bat,Slow Left-arm Orthodox,India,Player,Royal Challengers Bangalore,Kolkata Knight Riders,2009,0,21,1,Blank,Blank,A Kumble,Bb Mccullum,Mv Boucher,Wp Saha,1988-12-20
14819,39222600004,392226,4,Dj Hussey,7/15/1977,Right-hand Bat,Right-arm Offbreak,Australia,Player,Kolkata Knight Riders,Royal Challengers Bangalore,2009,0,32,0,Blank,Blank,Bb Mccullum,A Kumble,Wp Saha,Mv Boucher,1977-07-15
14823,39222600084,392226,84,I Sharma,9/2/1988,Right-hand Bat,Right-arm Fast-medium,India,Player,Kolkata Knight Riders,Royal Challengers Bangalore,2009,0,21,0,Blank,Blank,Bb Mccullum,A Kumble,Wp Saha,Mv Boucher,1988-09-02
14830,39222700027,392227,27,Yuvraj Singh,12/12/1981,Left-hand Bat,Slow Left-arm Orthodox,India,Captain,Kings Xi Punjab,Mumbai Indians,2009,0,28,0,Blank,Blank,Yuvraj Singh,Sr Tendulkar,Kc Sangakkara,Yv Takawale,1981-12-12
14832,39222700029,392227,29,Ik Pathan,10/27/1984,Left-hand Bat,Left-arm Medium-fast,India,Player,Kings Xi Punjab,Mumbai Indians,2009,0,25,0,Blank,Blank,Yuvraj Singh,Sr Tendulkar,Kc Sangakkara,Yv Takawale,1984-10-27
14838,39222700139,392227,139,La Pomersbach,9/28/1984,Left-hand Bat,Right-arm Offbreak,Australia,Player,Kings Xi Punjab,Mumbai Indians,2009,0,25,0,Blank,Blank,Yuvraj Singh,Sr Tendulkar,Kc Sangakkara,Yv Takawale,1984-09-28
14839,39222700044,392227,44,St Jayasuriya,6/30/1969,Left-hand Bat,Slow Left-arm Orthodox,Sri Lanka,Player,Mumbai Indians,Kings Xi Punjab,2009,0,40,1,Blank,Blank,Sr Tendulkar,Yuvraj Singh,Yv Takawale,Kc Sangakkara,1969-06-30
14844,39222700085,392227,85,Am Rahane,6/6/1988,Right-hand Bat,Right-arm Medium,India,Player,Mumbai Indians,Kings Xi Punjab,2009,0,21,1,Blank,Blank,Sr Tendulkar,Yuvraj Singh,Yv Takawale,Kc Sangakkara,1988-06-06
14846,39222700115,392227,115,Rr Raje,9/3/1986,Right-hand Bat,Right-arm Fast-medium,India,Player,Mumbai Indians,Kings Xi Punjab,2009,0,23,1,Blank,Blank,Sr Tendulkar,Yuvraj Singh,Yv Takawale,Kc Sangakkara,1986-09-03
14851,39222800054,392228,54,Y Venugopal Rao,2/26/1982,Right-hand Bat,Right-arm Offbreak,India,Player,Deccan Chargers,Delhi Daredevils,2009,0,27,0,Blank,Blank,Ac Gilchrist,V Sehwag,Ac Gilchrist,Kd Karthik,1982-02-26
14853,39222800057,392228,57,Rg Sharma,4/30/1987,Right-hand Bat,Right-arm Offbreak,India,Player,Deccan Chargers,Delhi Daredevils,2009,0,22,0,Blank,Blank,Ac Gilchrist,V Sehwag,Ac Gilchrist,Kd Karthik,1987-04-30
14855,39222800061,392228,61,Rp Singh,12/6/1985,Right-hand Bat,Left-arm Fast-medium,India,Player,Deccan Chargers,Delhi Daredevils,2009,0,24,0,Blank,Blank,Ac Gilchrist,V Sehwag,Ac Gilchrist,Kd Karthik,1985-12-06
14858,39222800147,392228,147,Dr Smith,4/12/1983,Right-hand Bat,Right-arm Medium,West Indies,Player,Deccan Chargers,Delhi Daredevils,2009,0,26,0,Blank,Blank,Ac Gilchrist,V Sehwag,Ac Gilchrist,Kd Karthik,1983-04-12
14864,39222800088,392228,88,Kd Karthik,6/1/1985,Right-hand Bat,N/a,India,Keeper,Delhi Daredevils,Deccan Chargers,2009,0,24,1,Blank,Blank,V Sehwag,Ac Gilchrist,Kd Karthik,Ac Gilchrist,1985-06-01
14866,39222800110,392228,110,Ab De Villiers,2/17/1984,Right-hand Bat,Right-arm Medium,South Africa,Player,Delhi Daredevils,Deccan Chargers,2009,0,25,1,Blank,Blank,V Sehwag,Ac Gilchrist,Kd Karthik,Ac Gilchrist,1984-02-17
14881,39222900186,392229,186,Sb Jakati,11/27/1980,Left-hand Bat,Slow Left-arm Orthodox,India,Player,Chennai Super Kings,Royal Challengers Bangalore,2009,0,29,0,Blank,Blank,Ms Dhoni,A Kumble,Ms Dhoni,Mv Boucher,1980-11-27
14885,39222900009,392229,9,Jh Kallis,10/16/1975,Right-hand Bat,Right-arm Fast-medium,South Africa,Player,Royal Challengers Bangalore,Chennai Super Kings,2009,0,34,1,Blank,Blank,A Kumble,Ms Dhoni,Mv Boucher,Ms Dhoni,1975-10-16
14887,39222900012,392229,12,B Akhil,10/7/1977,Right-hand Bat,Right-arm Medium-fast,India,Player,Royal Challengers Bangalore,Chennai Super Kings,2009,0,32,1,Blank,Blank,A Kumble,Ms Dhoni,Mv Boucher,Ms Dhoni,1977-10-07
14888,39222900014,392229,14,P Kumar,10/2/1986,Right-hand Bat,Right-arm Medium,India,Player,Royal Challengers Bangalore,Chennai Super Kings,2009,0,23,1,Blank,Blank,A Kumble,Ms Dhoni,Mv Boucher,Ms Dhoni,1986-10-02
14889,39222900046,392229,46,Rv Uthappa,11/11/1985,Right-hand Bat,Right-arm Medium,India,Player,Royal Challengers Bangalore,Chennai Super Kings,2009,0,24,1,Blank,Blank,A Kumble,Ms Dhoni,Mv Boucher,Ms Dhoni,1985-11-11
14891,39222900081,392229,81,R Vinay Kumar,2/12/1984,Right-hand Bat,Right-arm Medium,India,Player,Royal Challengers Bangalore,Chennai Super Kings,2009,0,25,1,Blank,Blank,A Kumble,Ms Dhoni,Mv Boucher,Ms Dhoni,1984-02-12
14893,39222900177,392229,177,Re Van Der Merwe,12/31/1984,Right-hand Bat,Slow Left-arm Orthodox,South Africa,Player,Royal Challengers Bangalore,Chennai Super Kings,2009,0,25,1,Blank,Blank,A Kumble,Ms Dhoni,Mv Boucher,Ms Dhoni,1984-12-31
14894,39223000031,392230,31,Yk Pathan,11/17/1982,Right-hand Bat,Right-arm Offbreak,India,Player,Rajasthan Royals,Mumbai Indians,2009,0,27,1,Blank,Blank,Sk Warne,Sr Tendulkar,Nv Ojha,Yv Takawale,1982-11-17
14895,39223000035,392230,35,Ra Jadeja,12/6/1988,Left-hand Bat,Slow Left-arm Orthodox,India,Player,Rajasthan Royals,Mumbai Indians,2009,0,21,1,Blank,Blank,Sk Warne,Sr Tendulkar,Nv Ojha,Yv Takawale,1988-12-06
14896,39223000038,392230,38,Sk Warne,9/13/1969,Right-hand Bat,Legbreak Googly,Australia,Captain,Rajasthan Royals,Mumbai Indians,2009,1,40,1,Blank,Blank,Sk Warne,Sr Tendulkar,Nv Ojha,Yv Takawale,1969-09-13
14900,39223000148,392230,148,Sd Chitnis,5/6/1987,Right-hand Bat,Right-arm Offbreak,India,Player,Rajasthan Royals,Mumbai Indians,2009,0,22,1,Blank,Blank,Sk Warne,Sr Tendulkar,Nv Ojha,Yv Takawale,1987-05-06
14901,39223000168,392230,168,Rj Quiney,8/20/1982,Left-hand Bat,Right-arm Medium,Australia,Player,Rajasthan Royals,Mumbai Indians,2009,0,27,1,Blank,Blank,Sk Warne,Sr Tendulkar,Nv Ojha,Yv Takawale,1982-08-20
14902,39223000169,392230,169,As Raut,3/3/1987,Right-hand Bat,Legbreak Googly,India,Player,Rajasthan Royals,Mumbai Indians,2009,0,22,1,Blank,Blank,Sk Warne,Sr Tendulkar,Nv Ojha,Yv Takawale,1987-03-03
14904,39223000192,392230,192,J Botha,5/2/1982,Right-hand Bat,Right-arm Offbreak,South Africa,Player,Rajasthan Royals,Mumbai Indians,2009,0,27,1,Blank,Blank,Sk Warne,Sr Tendulkar,Nv Ojha,Yv Takawale,1982-05-02
14905,39223000044,392230,44,St Jayasuriya,6/30/1969,Left-hand Bat,Slow Left-arm Orthodox,Sri Lanka,Player,Mumbai Indians,Rajasthan Royals,2009,0,40,0,Blank,Blank,Sr Tendulkar,Sk Warne,Yv Takawale,Nv Ojha,1969-06-30
14909,39223000080,392230,80,Ds Kulkarni,12/10/1988,Right-hand Bat,Right-arm Medium,India,Player,Mumbai Indians,Rajasthan Royals,2009,0,21,0,Blank,Blank,Sr Tendulkar,Sk Warne,Yv Takawale,Nv Ojha,1988-12-10
14911,39223000114,392230,114,Yv Takawale,11/5/1984,Right-hand Bat,N/a,India,Keeper,Mumbai Indians,Rajasthan Royals,2009,0,25,0,Blank,Blank,Sr Tendulkar,Sk Warne,Yv Takawale,Nv Ojha,1984-11-05
14914,39223000193,392230,193,C Nanda,3/29/1979,Right-hand Bat,Legbreak,India,Player,Mumbai Indians,Rajasthan Royals,2009,0,30,0,Blank,Blank,Sr Tendulkar,Sk Warne,Yv Takawale,Nv Ojha,1979-03-29
14915,39223000194,392230,194,Sl Malinga,8/28/1983,Right-hand Bat,Right-arm Fast,Sri Lanka,Player,Mumbai Indians,Rajasthan Royals,2009,0,26,0,Blank,Blank,Sr Tendulkar,Sk Warne,Yv Takawale,Nv Ojha,1983-08-28
14918,39223100028,392231,28,Sm Katich,8/21/1975,Left-hand Bat,Slow Left-arm Chinaman,Australia,Player,Kings Xi Punjab,Delhi Daredevils,2009,0,34,1,Blank,Blank,Yuvraj Singh,V Sehwag,Kc Sangakkara,Kd Karthik,1975-08-21
14919,39223100029,392231,29,Ik Pathan,10/27/1984,Left-hand Bat,Left-arm Medium-fast,India,Player,Kings Xi Punjab,Delhi Daredevils,2009,0,25,1,Blank,Blank,Yuvraj Singh,V Sehwag,Kc Sangakkara,Kd Karthik,1984-10-27
14924,39223100077,392231,77,S Sreesanth,2/6/1983,Right-hand Bat,Right-arm Fast-medium,India,Player,Kings Xi Punjab,Delhi Daredevils,2009,0,26,1,Blank,Blank,Yuvraj Singh,V Sehwag,Kc Sangakkara,Kd Karthik,1983-02-06
14925,39223100139,392231,139,La Pomersbach,9/28/1984,Left-hand Bat,Right-arm Offbreak,Australia,Player,Kings Xi Punjab,Delhi Daredevils,2009,0,25,1,Blank,Blank,Yuvraj Singh,V Sehwag,Kc Sangakkara,Kd Karthik,1984-09-28
14929,39223100073,392231,73,A Nehra,4/29/1979,Right-hand Bat,Left-arm Medium-fast,India,Player,Delhi Daredevils,Kings Xi Punjab,2009,0,30,0,Blank,Blank,V Sehwag,Yuvraj Singh,Kd Karthik,Kc Sangakkara,1979-04-29
14932,39223100090,392231,90,Mf Maharoof,9/7/1984,Right-hand Bat,Right-arm Fast-medium,India,Player,Delhi Daredevils,Kings Xi Punjab,2009,0,25,0,Blank,Blank,V Sehwag,Yuvraj Singh,Kd Karthik,Kc Sangakkara,1984-09-07
14934,39223100116,392231,116,Pj Sangwan,11/5/1990,Right-hand Bat,Left-arm Medium,India,Player,Delhi Daredevils,Kings Xi Punjab,2009,0,19,0,Blank,Blank,V Sehwag,Yuvraj Singh,Kd Karthik,Kc Sangakkara,1990-11-05
14938,39223200017,392232,17,Pa Patel,3/9/1985,Left-hand Bat,N/a,India,Player,Chennai Super Kings,Mumbai Indians,2009,0,24,1,Blank,Blank,Ms Dhoni,Sr Tendulkar,Ms Dhoni,Yv Takawale,1985-03-09
14940,39223200020,392232,20,Ms Dhoni,7/7/1981,Right-hand Bat,Right-arm Medium,India,Captainkeeper,Chennai Super Kings,Mumbai Indians,2009,0,28,1,Blank,Blank,Ms Dhoni,Sr Tendulkar,Ms Dhoni,Yv Takawale,1981-07-07
14942,39223200022,392232,22,Jdp Oram,7/28/1978,Left-hand Bat,Right-arm Fast-medium,New Zealand,Player,Chennai Super Kings,Mumbai Indians,2009,0,31,1,Blank,Blank,Ms Dhoni,Sr Tendulkar,Ms Dhoni,Yv Takawale,1978-07-28
14943,39223200023,392232,23,S Badrinath,8/30/1980,Right-hand Bat,Right-arm Offbreak,India,Player,Chennai Super Kings,Mumbai Indians,2009,0,29,1,Blank,Blank,Ms Dhoni,Sr Tendulkar,Ms Dhoni,Yv Takawale,1980-08-30
14945,39223200121,392232,121,M Muralitharan,4/17/1972,Right-hand Bat,Right-arm Offbreak,Sri Lanka,Player,Chennai Super Kings,Mumbai Indians,2009,0,37,1,Blank,Blank,Ms Dhoni,Sr Tendulkar,Ms Dhoni,Yv Takawale,1972-04-17
14947,39223200186,392232,186,Sb Jakati,11/27/1980,Left-hand Bat,Slow Left-arm Orthodox,India,Player,Chennai Super Kings,Mumbai Indians,2009,0,29,1,Blank,Blank,Ms Dhoni,Sr Tendulkar,Ms Dhoni,Yv Takawale,1980-11-27
14953,39223200080,392232,80,Ds Kulkarni,12/10/1988,Right-hand Bat,Right-arm Medium,India,Player,Mumbai Indians,Chennai Super Kings,2009,0,21,0,Blank,Blank,Sr Tendulkar,Ms Dhoni,Yv Takawale,Ms Dhoni,1988-12-10
14955,39223200114,392232,114,Yv Takawale,11/5/1984,Right-hand Bat,N/a,India,Keeper,Mumbai Indians,Chennai Super Kings,2009,0,25,0,Blank,Blank,Sr Tendulkar,Ms Dhoni,Yv Takawale,Ms Dhoni,1984-11-05
14956,39223200133,392232,133,Sr Tendulkar,4/24/1973,Right-hand Bat,Right-arm Offbreak,India,Captain,Mumbai Indians,Chennai Super Kings,2009,0,36,0,Blank,Blank,Sr Tendulkar,Ms Dhoni,Yv Takawale,Ms Dhoni,1973-04-24
14957,39223200154,392232,154,Jp Duminy,4/14/1984,Left-hand Bat,Right-arm Offbreak,South Africa,Player,Mumbai Indians,Chennai Super Kings,2009,0,25,0,Blank,Blank,Sr Tendulkar,Ms Dhoni,Yv Takawale,Ms Dhoni,1984-04-14
14958,39223200193,392232,193,C Nanda,3/29/1979,Right-hand Bat,Legbreak,India,Player,Mumbai Indians,Chennai Super Kings,2009,0,30,0,Blank,Blank,Sr Tendulkar,Ms Dhoni,Yv Takawale,Ms Dhoni,1979-03-29
14960,39223300053,392233,53,Ac Gilchrist,11/14/1971,Left-hand Bat,Right-arm Offbreak,Australia,Captainkeeper,Deccan Chargers,Kolkata Knight Riders,2009,0,38,1,Blank,Blank,Ac Gilchrist,Bb Mccullum,Ac Gilchrist,Wp Saha,1971-11-14
14962,39223300056,392233,56,A Symonds,6/9/1975,Right-hand Bat,Right-arm Offbreak,Australia,Player,Deccan Chargers,Kolkata Knight Riders,2009,0,34,1,Blank,Blank,Ac Gilchrist,Bb Mccullum,Ac Gilchrist,Wp Saha,1975-06-09
14965,39223300097,392233,97,Hh Gibbs,2/23/1974,Right-hand Bat,Right-arm Bowler,South Africa,Player,Deccan Chargers,Kolkata Knight Riders,2009,0,35,1,Blank,Blank,Ac Gilchrist,Bb Mccullum,Ac Gilchrist,Wp Saha,1974-02-23
14972,39223300002,392233,2,Bb Mccullum,9/27/1981,Right-hand Bat,Right-arm Medium,New Zealand,Captain,Kolkata Knight Riders,Deccan Chargers,2009,0,28,0,Blank,Blank,Bb Mccullum,Ac Gilchrist,Wp Saha,Ac Gilchrist,1981-09-27
14975,39223300082,392233,82,Ab Agarkar,12/4/1977,Right-hand Bat,Right-arm Fast,India,Player,Kolkata Knight Riders,Deccan Chargers,2009,0,32,0,Blank,Blank,Bb Mccullum,Ac Gilchrist,Wp Saha,Ac Gilchrist,1977-12-04
14978,39223300104,392233,104,Bj Hodge,12/29/1974,Right-hand Bat,Right-arm Offbreak,Australia,Player,Kolkata Knight Riders,Deccan Chargers,2009,0,35,0,Blank,Blank,Bb Mccullum,Ac Gilchrist,Wp Saha,Ac Gilchrist,1974-12-29
14984,39223400056,392234,56,A Symonds,6/9/1975,Right-hand Bat,Right-arm Offbreak,Australia,Player,Deccan Chargers,Kings Xi Punjab,2009,0,34,0,Blank,Blank,Ac Gilchrist,Yuvraj Singh,Ac Gilchrist,Kc Sangakkara,1975-06-09
14986,39223400061,392234,61,Rp Singh,12/6/1985,Right-hand Bat,Left-arm Fast-medium,India,Player,Deccan Chargers,Kings Xi Punjab,2009,0,24,0,Blank,Blank,Ac Gilchrist,Yuvraj Singh,Ac Gilchrist,Kc Sangakkara,1985-12-06
14987,39223400097,392234,97,Hh Gibbs,2/23/1974,Right-hand Bat,Right-arm Bowler,South Africa,Player,Deccan Chargers,Kings Xi Punjab,2009,0,35,0,Blank,Blank,Ac Gilchrist,Yuvraj Singh,Ac Gilchrist,Kc Sangakkara,1974-02-23
14989,39223400131,392234,131,Pp Ojha,9/5/1986,Left-hand Bat,Slow Left-arm Orthodox,India,Player,Deccan Chargers,Kings Xi Punjab,2009,0,23,0,Blank,Blank,Ac Gilchrist,Yuvraj Singh,Ac Gilchrist,Kc Sangakkara,1986-09-05
14992,39223400206,392234,206,Jaskaran Singh,9/4/1989,Right-hand Bat,Right-arm Medium,India,Player,Deccan Chargers,Kings Xi Punjab,2009,0,20,0,Blank,Blank,Ac Gilchrist,Yuvraj Singh,Ac Gilchrist,Kc Sangakkara,1989-09-04
14995,39223400028,392234,28,Sm Katich,8/21/1975,Left-hand Bat,Slow Left-arm Chinaman,Australia,Player,Kings Xi Punjab,Deccan Chargers,2009,0,34,1,Blank,Blank,Yuvraj Singh,Ac Gilchrist,Kc Sangakkara,Ac Gilchrist,1975-08-21
14998,39223400066,392234,66,B Lee,11/8/1976,Right-hand Bat,Right-arm Fast,Australia,Player,Kings Xi Punjab,Deccan Chargers,2009,0,33,1,Blank,Blank,Yuvraj Singh,Ac Gilchrist,Kc Sangakkara,Ac Gilchrist,1976-11-08
15003,39223400153,392234,153,Rr Powar,5/20/1978,Right-hand Bat,Right-arm Offbreak,India,Player,Kings Xi Punjab,Deccan Chargers,2009,0,31,1,Blank,Blank,Yuvraj Singh,Ac Gilchrist,Kc Sangakkara,Ac Gilchrist,1978-05-20
15005,39223500041,392235,41,V Sehwag,10/20/1978,Right-hand Bat,Right-arm Offbreak,India,Captain,Delhi Daredevils,Rajasthan Royals,2009,0,31,1,Blank,Blank,V Sehwag,Sk Warne,Kd Karthik,Nv Ojha,1978-10-20
15006,39223500073,392235,73,A Nehra,4/29/1979,Right-hand Bat,Left-arm Medium-fast,India,Player,Delhi Daredevils,Rajasthan Royals,2009,0,30,1,Blank,Blank,V Sehwag,Sk Warne,Kd Karthik,Nv Ojha,1979-04-29
15008,39223500090,392235,90,Mf Maharoof,9/7/1984,Right-hand Bat,Right-arm Fast-medium,India,Player,Delhi Daredevils,Rajasthan Royals,2009,0,25,1,Blank,Blank,V Sehwag,Sk Warne,Kd Karthik,Nv Ojha,1984-09-07
15011,39223500136,392235,136,A Mishra,11/24/1982,Right-hand Bat,Legbreak,India,Player,Delhi Daredevils,Rajasthan Royals,2009,0,27,1,Blank,Blank,V Sehwag,Sk Warne,Kd Karthik,Nv Ojha,1982-11-24
15013,39223500223,392235,223,Dp Nannes,5/16/1976,Right-hand Bat,Left-arm Fast,Australia,Player,Delhi Daredevils,Rajasthan Royals,2009,0,33,1,Blank,Blank,V Sehwag,Sk Warne,Kd Karthik,Nv Ojha,1976-05-16
15023,39223500183,392235,183,Nv Ojha,7/20/1983,Right-hand Bat,N/a,India,Keeper,Rajasthan Royals,Delhi Daredevils,2009,0,26,0,Blank,Blank,Sk Warne,V Sehwag,Nv Ojha,Kd Karthik,1983-07-20
15025,39223500196,392235,196,A Singh,6/21/1981,Right-hand Bat,Right-arm Medium-fast,India,Player,Rajasthan Royals,Delhi Daredevils,2009,0,28,0,Blank,Blank,Sk Warne,V Sehwag,Nv Ojha,Kd Karthik,1981-06-21
15026,39223600017,392236,17,Pa Patel,3/9/1985,Left-hand Bat,N/a,India,Player,Chennai Super Kings,Kolkata Knight Riders,2009,0,24,0,Blank,Blank,Ms Dhoni,Bb Mccullum,Ms Dhoni,Wp Saha,1985-03-09
15027,39223600020,392236,20,Ms Dhoni,7/7/1981,Right-hand Bat,Right-arm Medium,India,Captainkeeper,Chennai Super Kings,Kolkata Knight Riders,2009,0,28,0,Blank,Blank,Ms Dhoni,Bb Mccullum,Ms Dhoni,Wp Saha,1981-07-07
15028,39223600021,392236,21,Sk Raina,11/27/1986,Left-hand Bat,Right-arm Offbreak,India,Player,Chennai Super Kings,Kolkata Knight Riders,2009,0,23,0,Blank,Blank,Ms Dhoni,Bb Mccullum,Ms Dhoni,Wp Saha,1986-11-27
15034,39223600186,392236,186,Sb Jakati,11/27/1980,Left-hand Bat,Slow Left-arm Orthodox,India,Player,Chennai Super Kings,Kolkata Knight Riders,2009,0,29,0,Blank,Blank,Ms Dhoni,Bb Mccullum,Ms Dhoni,Wp Saha,1980-11-27
15037,39223600001,392236,1,Sc Ganguly,7/8/1972,Left-hand Bat,Right-arm Medium,India,Player,Kolkata Knight Riders,Chennai Super Kings,2009,0,37,1,Blank,Blank,Bb Mccullum,Ms Dhoni,Wp Saha,Ms Dhoni,1972-07-08
15039,39223600004,392236,4,Dj Hussey,7/15/1977,Right-hand Bat,Right-arm Offbreak,Australia,Player,Kolkata Knight Riders,Chennai Super Kings,2009,0,32,1,Blank,Blank,Bb Mccullum,Ms Dhoni,Wp Saha,Ms Dhoni,1977-07-15
15040,39223600062,392236,62,Wp Saha,10/24/1984,Right-hand Bat,N/a,India,Keeper,Kolkata Knight Riders,Chennai Super Kings,2009,0,25,1,Blank,Blank,Bb Mccullum,Ms Dhoni,Wp Saha,Ms Dhoni,1984-10-24
15043,39223600083,392236,83,M Kartik,9/11/1976,Left-hand Bat,Slow Left-arm Orthodox,India,Player,Kolkata Knight Riders,Chennai Super Kings,2009,0,33,1,Blank,Blank,Bb Mccullum,Ms Dhoni,Wp Saha,Ms Dhoni,1976-09-11
15046,39223600174,392236,174,Baw Mendis,3/11/1985,Right-hand Bat,Right-arm Offbreak,Sri Lanka,Player,Kolkata Knight Riders,Chennai Super Kings,2009,0,24,1,Blank,Blank,Bb Mccullum,Ms Dhoni,Wp Saha,Ms Dhoni,1985-03-11
15050,39223700073,392237,73,A Nehra,4/29/1979,Right-hand Bat,Left-arm Medium-fast,India,Player,Delhi Daredevils,Royal Challengers Bangalore,2009,0,30,0,Blank,Blank,V Sehwag,A Kumble,Kd Karthik,Mv Boucher,1979-04-29
15053,39223700110,392237,110,Ab De Villiers,2/17/1984,Right-hand Bat,Right-arm Medium,South Africa,Player,Delhi Daredevils,Royal Challengers Bangalore,2009,0,25,0,Blank,Blank,V Sehwag,A Kumble,Kd Karthik,Mv Boucher,1984-02-17
15054,39223700171,392237,171,M Manhas,10/12/1979,Right-hand Bat,Right-arm Offbreak,India,Player,Delhi Daredevils,Royal Challengers Bangalore,2009,0,30,0,Blank,Blank,V Sehwag,A Kumble,Kd Karthik,Mv Boucher,1979-10-12
15060,39223700008,392237,8,V Kohli,11/5/1988,Right-hand Bat,Right-arm Medium,India,Player,Royal Challengers Bangalore,Delhi Daredevils,2009,0,21,1,Blank,Blank,A Kumble,V Sehwag,Mv Boucher,Kd Karthik,1988-11-05
15062,39223700011,392237,11,Mv Boucher,12/3/1976,Right-hand Bat,Right-arm Medium,South Africa,Keeper,Royal Challengers Bangalore,Delhi Daredevils,2009,0,33,1,Blank,Blank,A Kumble,V Sehwag,Mv Boucher,Kd Karthik,1976-12-03
15063,39223700012,392237,12,B Akhil,10/7/1977,Right-hand Bat,Right-arm Medium-fast,India,Player,Royal Challengers Bangalore,Delhi Daredevils,2009,0,32,1,Blank,Blank,A Kumble,V Sehwag,Mv Boucher,Kd Karthik,1977-10-07
15066,39223700052,392237,52,Lrpl Taylor,3/8/1984,Right-hand Bat,Right-arm Offbreak,New Zealand,Player,Royal Challengers Bangalore,Delhi Daredevils,2009,0,25,1,Blank,Blank,A Kumble,V Sehwag,Mv Boucher,Kd Karthik,1984-03-08
15071,39223800035,392238,35,Ra Jadeja,12/6/1988,Left-hand Bat,Slow Left-arm Orthodox,India,Player,Rajasthan Royals,Kolkata Knight Riders,2009,0,21,0,Blank,Blank,Sk Warne,Bb Mccullum,Nv Ojha,Ss Shaikh,1988-12-06
15072,39223800038,392238,38,Sk Warne,9/13/1969,Right-hand Bat,Legbreak Googly,Australia,Captain,Rajasthan Royals,Kolkata Knight Riders,2009,0,40,0,Blank,Blank,Sk Warne,Bb Mccullum,Nv Ojha,Ss Shaikh,1969-09-13
15074,39223800126,392238,126,Mm Patel,7/12/1983,Right-hand Bat,Right-arm Medium-fast,India,Player,Rajasthan Royals,Kolkata Knight Riders,2009,0,26,0,Blank,Blank,Sk Warne,Bb Mccullum,Nv Ojha,Ss Shaikh,1983-07-12
15075,39223800138,392238,138,Nk Patel,3/26/1981,Left-hand Bat,N/a,India,Player,Rajasthan Royals,Kolkata Knight Riders,2009,0,28,0,Blank,Blank,Sk Warne,Bb Mccullum,Nv Ojha,Ss Shaikh,1981-03-26
15076,39223800159,392238,159,T Henderson,8/1/1974,Right-hand Bat,Right-arm Fast-medium,South Africa,Player,Rajasthan Royals,Kolkata Knight Riders,2009,0,35,0,Blank,Blank,Sk Warne,Bb Mccullum,Nv Ojha,Ss Shaikh,1974-08-01
15079,39223800192,392238,192,J Botha,5/2/1982,Right-hand Bat,Right-arm Offbreak,South Africa,Player,Rajasthan Royals,Kolkata Knight Riders,2009,0,27,0,Blank,Blank,Sk Warne,Bb Mccullum,Nv Ojha,Ss Shaikh,1982-05-02
15080,39223800196,392238,196,A Singh,6/21/1981,Right-hand Bat,Right-arm Medium-fast,India,Player,Rajasthan Royals,Kolkata Knight Riders,2009,0,28,0,Blank,Blank,Sk Warne,Bb Mccullum,Nv Ojha,Ss Shaikh,1981-06-21
15088,39223800170,392238,170,Yashpal Singh,11/27/1981,Right-hand Bat,Right-arm Medium,India,Player,Kolkata Knight Riders,Rajasthan Royals,2009,0,28,1,Blank,Blank,Bb Mccullum,Sk Warne,Ss Shaikh,Nv Ojha,1981-11-27
15089,39223800200,392238,200,Ss Shaikh,1/18/1987,Right-hand Bat,Right-arm Medium,India,Keeper,Kolkata Knight Riders,Rajasthan Royals,2009,0,22,1,Blank,Blank,Bb Mccullum,Sk Warne,Ss Shaikh,Nv Ojha,1987-01-18
15092,39223900026,392239,26,Kc Sangakkara,10/27/1977,Left-hand Bat,Right-arm Offbreak,Sri Lanka,Keeper,Kings Xi Punjab,Chennai Super Kings,2009,0,32,0,Blank,Blank,Yuvraj Singh,Ms Dhoni,Kc Sangakkara,Ms Dhoni,1977-10-27
15095,39223900029,392239,29,Ik Pathan,10/27/1984,Left-hand Bat,Left-arm Medium-fast,India,Player,Kings Xi Punjab,Chennai Super Kings,2009,0,25,0,Blank,Blank,Yuvraj Singh,Ms Dhoni,Kc Sangakkara,Ms Dhoni,1984-10-27
15097,39223900066,392239,66,B Lee,11/8/1976,Right-hand Bat,Right-arm Fast,Australia,Player,Kings Xi Punjab,Chennai Super Kings,2009,0,33,0,Blank,Blank,Yuvraj Singh,Ms Dhoni,Kc Sangakkara,Ms Dhoni,1976-11-08
15101,39223900139,392239,139,La Pomersbach,9/28/1984,Left-hand Bat,Right-arm Offbreak,Australia,Player,Kings Xi Punjab,Chennai Super Kings,2009,0,25,0,Blank,Blank,Yuvraj Singh,Ms Dhoni,Kc Sangakkara,Ms Dhoni,1984-09-28
15102,39223900153,392239,153,Rr Powar,5/20/1978,Right-hand Bat,Right-arm Offbreak,India,Player,Kings Xi Punjab,Chennai Super Kings,2009,0,31,0,Blank,Blank,Yuvraj Singh,Ms Dhoni,Kc Sangakkara,Ms Dhoni,1978-05-20
15103,39223900017,392239,17,Pa Patel,3/9/1985,Left-hand Bat,N/a,India,Player,Chennai Super Kings,Kings Xi Punjab,2009,0,24,1,Blank,Blank,Ms Dhoni,Yuvraj Singh,Ms Dhoni,Kc Sangakkara,1985-03-09
15104,39223900020,392239,20,Ms Dhoni,7/7/1981,Right-hand Bat,Right-arm Medium,India,Captainkeeper,Chennai Super Kings,Kings Xi Punjab,2009,0,28,1,Blank,Blank,Ms Dhoni,Yuvraj Singh,Ms Dhoni,Kc Sangakkara,1981-07-07
15105,39223900021,392239,21,Sk Raina,11/27/1986,Left-hand Bat,Right-arm Offbreak,India,Player,Chennai Super Kings,Kings Xi Punjab,2009,0,23,1,Blank,Blank,Ms Dhoni,Yuvraj Singh,Ms Dhoni,Kc Sangakkara,1986-11-27
15108,39223900120,392239,120,Ms Gony,1/4/1984,Right-hand Bat,Right-arm Medium,India,Player,Chennai Super Kings,Kings Xi Punjab,2009,0,25,1,Blank,Blank,Ms Dhoni,Yuvraj Singh,Ms Dhoni,Kc Sangakkara,1984-01-04
15112,39223900197,392239,197,Gj Bailey,9/7/1982,Right-hand Bat,Right-arm Medium,Australia,Player,Chennai Super Kings,Kings Xi Punjab,2009,0,27,1,Blank,Blank,Ms Dhoni,Yuvraj Singh,Ms Dhoni,Kc Sangakkara,1982-09-07
15114,39224000040,392240,40,G Gambhir,10/14/1981,Left-hand Bat,Legbreak,India,Player,Delhi Daredevils,Mumbai Indians,2009,0,28,1,Blank,Blank,V Sehwag,Sr Tendulkar,Kd Karthik,Pr Shah,1981-10-14
15115,39224000041,392240,41,V Sehwag,10/20/1978,Right-hand Bat,Right-arm Offbreak,India,Captain,Delhi Daredevils,Mumbai Indians,2009,1,31,1,Blank,Blank,V Sehwag,Sr Tendulkar,Kd Karthik,Pr Shah,1978-10-20
15117,39224000089,392240,89,R Bhatia,10/22/1979,Right-hand Bat,Right-arm Medium-fast,India,Player,Delhi Daredevils,Mumbai Indians,2009,0,30,1,Blank,Blank,V Sehwag,Sr Tendulkar,Kd Karthik,Pr Shah,1979-10-22
15121,39224000136,392240,136,A Mishra,11/24/1982,Right-hand Bat,Legbreak,India,Player,Delhi Daredevils,Mumbai Indians,2009,0,27,1,Blank,Blank,V Sehwag,Sr Tendulkar,Kd Karthik,Pr Shah,1982-11-24
15122,39224000187,392240,187,Da Warner,10/27/1986,Left-hand Bat,Legbreak,Australia,Player,Delhi Daredevils,Mumbai Indians,2009,0,23,1,Blank,Blank,V Sehwag,Sr Tendulkar,Kd Karthik,Pr Shah,1986-10-27
15123,39224000223,392240,223,Dp Nannes,5/16/1976,Right-hand Bat,Left-arm Fast,Australia,Player,Delhi Daredevils,Mumbai Indians,2009,0,33,1,Blank,Blank,V Sehwag,Sr Tendulkar,Kd Karthik,Pr Shah,1976-05-16
15124,39224000439,392240,439,Am Salvi,10/20/1981,Right-hand Bat,Right-arm Medium,India,Player,Delhi Daredevils,Mumbai Indians,2009,0,28,1,Blank,Blank,V Sehwag,Sr Tendulkar,Kd Karthik,Pr Shah,1981-10-20
15126,39224000047,392240,47,Pr Shah,11/3/1987,Right-hand Bat,N/a,India,Keeper,Mumbai Indians,Delhi Daredevils,2009,0,22,0,Blank,Blank,Sr Tendulkar,V Sehwag,Pr Shah,Kd Karthik,1987-11-03
15129,39224000080,392240,80,Ds Kulkarni,12/10/1988,Right-hand Bat,Right-arm Medium,India,Player,Mumbai Indians,Delhi Daredevils,2009,0,21,0,Blank,Blank,Sr Tendulkar,V Sehwag,Pr Shah,Kd Karthik,1988-12-10
15130,39224000085,392240,85,Am Rahane,6/6/1988,Right-hand Bat,Right-arm Medium,India,Player,Mumbai Indians,Delhi Daredevils,2009,0,21,0,Blank,Blank,Sr Tendulkar,V Sehwag,Pr Shah,Kd Karthik,1988-06-06
15131,39224000133,392240,133,Sr Tendulkar,4/24/1973,Right-hand Bat,Right-arm Offbreak,India,Captain,Mumbai Indians,Delhi Daredevils,2009,0,36,0,Blank,Blank,Sr Tendulkar,V Sehwag,Pr Shah,Kd Karthik,1973-04-24
15133,39224000194,392240,194,Sl Malinga,8/28/1983,Right-hand Bat,Right-arm Fast,Sri Lanka,Player,Mumbai Indians,Delhi Daredevils,2009,0,26,0,Blank,Blank,Sr Tendulkar,V Sehwag,Pr Shah,Kd Karthik,1983-08-28
15136,39224100053,392241,53,Ac Gilchrist,11/14/1971,Left-hand Bat,Right-arm Offbreak,Australia,Captainkeeper,Deccan Chargers,Royal Challengers Bangalore,2009,0,38,0,Blank,Blank,Ac Gilchrist,A Kumble,Ac Gilchrist,Mv Boucher,1971-11-14
15139,39224100057,392241,57,Rg Sharma,4/30/1987,Right-hand Bat,Right-arm Offbreak,India,Player,Deccan Chargers,Royal Challengers Bangalore,2009,0,22,0,Blank,Blank,Ac Gilchrist,A Kumble,Ac Gilchrist,Mv Boucher,1987-04-30
15140,39224100061,392241,61,Rp Singh,12/6/1985,Right-hand Bat,Left-arm Fast-medium,India,Player,Deccan Chargers,Royal Challengers Bangalore,2009,0,24,0,Blank,Blank,Ac Gilchrist,A Kumble,Ac Gilchrist,Mv Boucher,1985-12-06
15141,39224100097,392241,97,Hh Gibbs,2/23/1974,Right-hand Bat,Right-arm Bowler,South Africa,Player,Deccan Chargers,Royal Challengers Bangalore,2009,0,35,0,Blank,Blank,Ac Gilchrist,A Kumble,Ac Gilchrist,Mv Boucher,1974-02-23
15148,39224100008,392241,8,V Kohli,11/5/1988,Right-hand Bat,Right-arm Medium,India,Player,Royal Challengers Bangalore,Deccan Chargers,2009,0,21,1,Blank,Blank,A Kumble,Ac Gilchrist,Mv Boucher,Ac Gilchrist,1988-11-05
15149,39224100009,392241,9,Jh Kallis,10/16/1975,Right-hand Bat,Right-arm Fast-medium,South Africa,Player,Royal Challengers Bangalore,Deccan Chargers,2009,0,34,1,Blank,Blank,A Kumble,Ac Gilchrist,Mv Boucher,Ac Gilchrist,1975-10-16
15152,39224100014,392241,14,P Kumar,10/2/1986,Right-hand Bat,Right-arm Medium,India,Player,Royal Challengers Bangalore,Deccan Chargers,2009,0,23,1,Blank,Blank,A Kumble,Ac Gilchrist,Mv Boucher,Ac Gilchrist,1986-10-02
15156,39224100124,392241,124,A Kumble,10/17/1970,Right-hand Bat,Legbreak Googly,India,Captain,Royal Challengers Bangalore,Deccan Chargers,2009,0,39,1,Blank,Blank,A Kumble,Ac Gilchrist,Mv Boucher,Ac Gilchrist,1970-10-17
15158,39224200053,392242,53,Ac Gilchrist,11/14/1971,Left-hand Bat,Right-arm Offbreak,Australia,Captainkeeper,Deccan Chargers,Delhi Daredevils,2009,1,38,1,Blank,Blank,Ac Gilchrist,V Sehwag,Ac Gilchrist,Kd Karthik,1971-11-14
15165,39224200172,392242,172,Aa Bilakhia,5/31/1986,Right-hand Bat,Right-arm Medium,India,Player,Deccan Chargers,Delhi Daredevils,2009,0,23,1,Blank,Blank,Ac Gilchrist,V Sehwag,Ac Gilchrist,Kd Karthik,1986-05-31
15167,39224200188,392242,188,Rj Harris,10/11/1979,Right-hand Bat,Right-arm Fast,Australia,Player,Deccan Chargers,Delhi Daredevils,2009,0,30,1,Blank,Blank,Ac Gilchrist,V Sehwag,Ac Gilchrist,Kd Karthik,1979-10-11
15176,39224200135,392242,135,Tm Dilshan,10/14/1976,Right-hand Bat,Right-arm Offbreak,Sri Lanka,Player,Delhi Daredevils,Deccan Chargers,2009,0,33,0,Blank,Blank,V Sehwag,Ac Gilchrist,Kd Karthik,Ac Gilchrist,1976-10-14
15177,39224200136,392242,136,A Mishra,11/24/1982,Right-hand Bat,Legbreak,India,Player,Delhi Daredevils,Deccan Chargers,2009,0,27,0,Blank,Blank,V Sehwag,Ac Gilchrist,Kd Karthik,Ac Gilchrist,1982-11-24
15187,39224300120,392243,120,Ms Gony,1/4/1984,Right-hand Bat,Right-arm Medium,India,Player,Chennai Super Kings,Royal Challengers Bangalore,2009,0,25,0,Blank,Blank,Ms Dhoni,A Kumble,Ms Dhoni,Mv Boucher,1984-01-04
15188,39224300121,392243,121,M Muralitharan,4/17/1972,Right-hand Bat,Right-arm Offbreak,Sri Lanka,Player,Chennai Super Kings,Royal Challengers Bangalore,2009,0,37,0,Blank,Blank,Ms Dhoni,A Kumble,Ms Dhoni,Mv Boucher,1972-04-17
15190,39224300186,392243,186,Sb Jakati,11/27/1980,Left-hand Bat,Slow Left-arm Orthodox,India,Player,Chennai Super Kings,Royal Challengers Bangalore,2009,0,29,0,Blank,Blank,Ms Dhoni,A Kumble,Ms Dhoni,Mv Boucher,1980-11-27
15194,39224300011,392243,11,Mv Boucher,12/3/1976,Right-hand Bat,Right-arm Medium,South Africa,Keeper,Royal Challengers Bangalore,Chennai Super Kings,2009,0,33,1,Blank,Blank,A Kumble,Ms Dhoni,Mv Boucher,Ms Dhoni,1976-12-03
15195,39224300014,392243,14,P Kumar,10/2/1986,Right-hand Bat,Right-arm Medium,India,Player,Royal Challengers Bangalore,Chennai Super Kings,2009,0,23,1,Blank,Blank,A Kumble,Ms Dhoni,Mv Boucher,Ms Dhoni,1986-10-02
15196,39224300046,392243,46,Rv Uthappa,11/11/1985,Right-hand Bat,Right-arm Medium,India,Player,Royal Challengers Bangalore,Chennai Super Kings,2009,0,24,1,Blank,Blank,A Kumble,Ms Dhoni,Mv Boucher,Ms Dhoni,1985-11-11
15203,39224400054,392244,54,Y Venugopal Rao,2/26/1982,Right-hand Bat,Right-arm Offbreak,India,Player,Deccan Chargers,Royal Challengers Bangalore,2009,0,27,1,Blank,Blank,Ac Gilchrist,A Kumble,Ac Gilchrist,Mv Boucher,1982-02-26
15211,39224400188,392244,188,Rj Harris,10/11/1979,Right-hand Bat,Right-arm Fast,Australia,Player,Deccan Chargers,Royal Challengers Bangalore,2009,0,30,1,Blank,Blank,Ac Gilchrist,A Kumble,Ac Gilchrist,Mv Boucher,1979-10-11
15214,39224400008,392244,8,V Kohli,11/5/1988,Right-hand Bat,Right-arm Medium,India,Player,Royal Challengers Bangalore,Deccan Chargers,2009,0,21,0,Blank,Blank,A Kumble,Ac Gilchrist,Mv Boucher,Ac Gilchrist,1988-11-05
15218,39224400046,392244,46,Rv Uthappa,11/11/1985,Right-hand Bat,Right-arm Medium,India,Player,Royal Challengers Bangalore,Deccan Chargers,2009,0,24,0,Blank,Blank,A Kumble,Ac Gilchrist,Mv Boucher,Ac Gilchrist,1985-11-11
15221,39224400096,392244,96,Mk Pandey,9/10/1989,Right-hand Bat,Right-arm Medium,India,Player,Royal Challengers Bangalore,Deccan Chargers,2009,0,20,0,Blank,Blank,A Kumble,Ac Gilchrist,Mv Boucher,Ac Gilchrist,1989-09-10
15224,41911100053,419111,53,Ac Gilchrist,11/14/1971,Left-hand Bat,Right-arm Offbreak,Australia,Captainkeeper,Deccan Chargers,Kolkata Knight Riders,2010,0,39,0,Blank,Blank,Ac Gilchrist,Sc Ganguly,Ac Gilchrist,Wp Saha,1971-11-14
15225,41911100055,419111,55,Vvs Laxman,11/1/1974,Right-hand Bat,Right-arm Offbreak,India,Player,Deccan Chargers,Kolkata Knight Riders,2010,0,36,0,Blank,Blank,Ac Gilchrist,Sc Ganguly,Ac Gilchrist,Wp Saha,1974-11-01
15228,41911100060,419111,60,Wpujc Vaas,1/27/1974,Left-hand Bat,Left-arm Fast-medium,Sri Lanka,Player,Deccan Chargers,Kolkata Knight Riders,2010,0,36,0,Blank,Blank,Ac Gilchrist,Sc Ganguly,Ac Gilchrist,Wp Saha,1974-01-27
15231,41911100131,419111,131,Pp Ojha,9/5/1986,Left-hand Bat,Slow Left-arm Orthodox,India,Player,Deccan Chargers,Kolkata Knight Riders,2010,0,24,0,Blank,Blank,Ac Gilchrist,Sc Ganguly,Ac Gilchrist,Wp Saha,1986-09-05
15232,41911100178,419111,178,Tl Suman,12/15/1983,Right-hand Bat,Right-arm Offbreak,India,Player,Deccan Chargers,Kolkata Knight Riders,2010,0,27,0,Blank,Blank,Ac Gilchrist,Sc Ganguly,Ac Gilchrist,Wp Saha,1983-12-15
15233,41911100205,419111,205,Anirudh Singh,8/2/1980,Left-hand Bat,Right-arm Medium,India,Player,Deccan Chargers,Kolkata Knight Riders,2010,0,30,0,Blank,Blank,Ac Gilchrist,Sc Ganguly,Ac Gilchrist,Wp Saha,1980-08-02
15236,41911100062,419111,62,Wp Saha,10/24/1984,Right-hand Bat,N/a,India,Keeper,Kolkata Knight Riders,Deccan Chargers,2010,0,26,1,Blank,Blank,Sc Ganguly,Ac Gilchrist,Wp Saha,Ac Gilchrist,1984-10-24
15237,41911100063,419111,63,Lr Shukla,5/6/1981,Right-hand Bat,Right-arm Medium,India,Player,Kolkata Knight Riders,Deccan Chargers,2010,0,29,1,Blank,Blank,Sc Ganguly,Ac Gilchrist,Wp Saha,Ac Gilchrist,1981-05-06
15238,41911100083,419111,83,M Kartik,9/11/1976,Left-hand Bat,Slow Left-arm Orthodox,India,Player,Kolkata Knight Riders,Deccan Chargers,2010,0,34,1,Blank,Blank,Sc Ganguly,Ac Gilchrist,Wp Saha,Ac Gilchrist,1976-09-11
15239,41911100084,419111,84,I Sharma,9/2/1988,Right-hand Bat,Right-arm Fast-medium,India,Player,Kolkata Knight Riders,Deccan Chargers,2010,0,22,1,Blank,Blank,Sc Ganguly,Ac Gilchrist,Wp Saha,Ac Gilchrist,1988-09-02
15242,41911100191,419111,191,Ad Mathews,6/2/1987,Right-hand Bat,Right-arm Fast-medium,Sri Lanka,Player,Kolkata Knight Riders,Deccan Chargers,2010,1,23,1,Blank,Blank,Sc Ganguly,Ac Gilchrist,Wp Saha,Ac Gilchrist,1987-06-02
15243,41911100203,419111,203,Ca Pujara,1/25/1988,Right-hand Bat,Legbreak,India,Player,Kolkata Knight Riders,Deccan Chargers,2010,0,22,1,Blank,Blank,Sc Ganguly,Ac Gilchrist,Wp Saha,Ac Gilchrist,1988-01-25
15245,41911100242,419111,242,Ck Langeveldt,12/17/1974,Right-hand Bat,Right-arm Fast-medium,England,Player,Kolkata Knight Riders,Deccan Chargers,2010,0,36,1,Blank,Blank,Sc Ganguly,Ac Gilchrist,Wp Saha,Ac Gilchrist,1974-12-17
15246,41911200015,419112,15,Z Khan,10/7/1978,Right-hand Bat,Left-arm Fast-medium,India,Player,Mumbai Indians,Rajasthan Royals,2010,0,32,1,Blank,Blank,Sr Tendulkar,Sk Warne,Ap Tare,Nv Ojha,1978-10-07
15250,41911200133,419112,133,Sr Tendulkar,4/24/1973,Right-hand Bat,Right-arm Offbreak,India,Captain,Mumbai Indians,Rajasthan Royals,2010,0,37,1,Blank,Blank,Sr Tendulkar,Sk Warne,Ap Tare,Nv Ojha,1973-04-24
15253,41911200208,419112,208,At Rayudu,9/23/1985,Right-hand Bat,Right-arm Offbreak,India,Player,Mumbai Indians,Rajasthan Royals,2010,0,25,1,Blank,Blank,Sr Tendulkar,Sk Warne,Ap Tare,Nv Ojha,1985-09-23
15254,41911200209,419112,209,R Sathish,1/14/1981,Right-hand Bat,Right-arm Medium,India,Player,Mumbai Indians,Rajasthan Royals,2010,0,29,1,Blank,Blank,Sr Tendulkar,Sk Warne,Ap Tare,Nv Ojha,1981-01-14
15255,41911200210,419112,210,R Mclaren,2/9/1983,Left-hand Bat,Right-arm Medium-fast,South Africa,Player,Mumbai Indians,Rajasthan Royals,2010,0,27,1,Blank,Blank,Sr Tendulkar,Sk Warne,Ap Tare,Nv Ojha,1983-02-09
15256,41911200286,419112,286,Ag Murtaza,1/1/1990,Left-hand Bat,Slow Left-arm Orthodox,India,Player,Mumbai Indians,Rajasthan Royals,2010,0,20,1,Blank,Blank,Sr Tendulkar,Sk Warne,Ap Tare,Nv Ojha,1990-01-01
15257,41911200031,419112,31,Yk Pathan,11/17/1982,Right-hand Bat,Right-arm Offbreak,India,Player,Rajasthan Royals,Mumbai Indians,2010,1,28,0,Blank,Blank,Sk Warne,Sr Tendulkar,Nv Ojha,Ap Tare,1982-11-17
15258,41911200038,419112,38,Sk Warne,9/13/1969,Right-hand Bat,Legbreak Googly,Australia,Captain,Rajasthan Royals,Mumbai Indians,2010,0,41,0,Blank,Blank,Sk Warne,Sr Tendulkar,Nv Ojha,Ap Tare,1969-09-13
15260,41911200101,419112,101,Sa Asnodkar,3/29/1984,Right-hand Bat,Right-arm Offbreak,India,Player,Rajasthan Royals,Mumbai Indians,2010,0,26,0,Blank,Blank,Sk Warne,Sr Tendulkar,Nv Ojha,Ap Tare,1984-03-29
15261,41911200137,419112,137,Ad Mascarenhas,10/30/1977,Right-hand Bat,Right-arm Fast-medium,England,Player,Rajasthan Royals,Mumbai Indians,2010,0,33,0,Blank,Blank,Sk Warne,Sr Tendulkar,Nv Ojha,Ap Tare,1977-10-30
15262,41911200160,419112,160,Kamran Khan,3/10/1991,Left-hand Bat,Left-arm Medium-fast,India,Player,Rajasthan Royals,Mumbai Indians,2010,0,19,0,Blank,Blank,Sk Warne,Sr Tendulkar,Nv Ojha,Ap Tare,1991-03-10
15264,41911200211,419112,211,Aa Jhunjhunwala,12/1/1982,Right-hand Bat,Right-arm Offbreak,India,Player,Rajasthan Royals,Mumbai Indians,2010,0,28,0,Blank,Blank,Sk Warne,Sr Tendulkar,Nv Ojha,Ap Tare,1982-12-01
15267,41911200238,419112,238,Sw Tait,2/22/1983,Right-hand Bat,Right-arm Fast,Australia,Player,Rajasthan Royals,Mumbai Indians,2010,0,27,0,Blank,Blank,Sk Warne,Sr Tendulkar,Nv Ojha,Ap Tare,1983-02-22
15272,41911300064,419113,64,Dpmd Jayawardene,5/27/1977,Right-hand Bat,Right-arm Medium,Sri Lanka,Player,Kings Xi Punjab,Delhi Daredevils,2010,0,33,0,Blank,Blank,Kc Sangakkara,G Gambhir,Kc Sangakkara,Kd Karthik,1977-05-27
15273,41911300067,419113,67,Pp Chawla,12/24/1988,Left-hand Bat,Legbreak,India,Player,Kings Xi Punjab,Delhi Daredevils,2010,0,22,0,Blank,Blank,Kc Sangakkara,G Gambhir,Kc Sangakkara,Kd Karthik,1988-12-24
15274,41911300077,419113,77,S Sreesanth,2/6/1983,Right-hand Bat,Right-arm Fast-medium,India,Player,Kings Xi Punjab,Delhi Daredevils,2010,0,27,0,Blank,Blank,Kc Sangakkara,G Gambhir,Kc Sangakkara,Kd Karthik,1983-02-06
15275,41911300153,419113,153,Rr Powar,5/20/1978,Right-hand Bat,Right-arm Offbreak,India,Player,Kings Xi Punjab,Delhi Daredevils,2010,0,32,0,Blank,Blank,Kc Sangakkara,G Gambhir,Kc Sangakkara,Kd Karthik,1978-05-20
15276,41911300161,419113,161,Rs Bopara,5/4/1985,Right-hand Bat,Right-arm Medium,England,Player,Kings Xi Punjab,Delhi Daredevils,2010,0,25,0,Blank,Blank,Kc Sangakkara,G Gambhir,Kc Sangakkara,Kd Karthik,1985-05-04
15280,41911300041,419113,41,V Sehwag,10/20/1978,Right-hand Bat,Right-arm Offbreak,India,Player,Delhi Daredevils,Kings Xi Punjab,2010,0,32,1,Blank,Blank,G Gambhir,Kc Sangakkara,Kd Karthik,Kc Sangakkara,1978-10-20
15285,41911300116,419113,116,Pj Sangwan,11/5/1990,Right-hand Bat,Left-arm Medium,India,Player,Delhi Daredevils,Kings Xi Punjab,2010,0,20,1,Blank,Blank,G Gambhir,Kc Sangakkara,Kd Karthik,Kc Sangakkara,1990-11-05
15286,41911300135,419113,135,Tm Dilshan,10/14/1976,Right-hand Bat,Right-arm Offbreak,Sri Lanka,Player,Delhi Daredevils,Kings Xi Punjab,2010,0,34,1,Blank,Blank,G Gambhir,Kc Sangakkara,Kd Karthik,Kc Sangakkara,1976-10-14
15287,41911300136,419113,136,A Mishra,11/24/1982,Right-hand Bat,Legbreak,India,Player,Delhi Daredevils,Kings Xi Punjab,2010,0,28,1,Blank,Blank,G Gambhir,Kc Sangakkara,Kd Karthik,Kc Sangakkara,1982-11-24
15288,41911300171,419113,171,M Manhas,10/12/1979,Right-hand Bat,Right-arm Offbreak,India,Player,Delhi Daredevils,Kings Xi Punjab,2010,0,31,1,Blank,Blank,G Gambhir,Kc Sangakkara,Kd Karthik,Kc Sangakkara,1979-10-12
15291,41911400008,419114,8,V Kohli,11/5/1988,Right-hand Bat,Right-arm Medium,India,Player,Royal Challengers Bangalore,Kolkata Knight Riders,2010,0,22,0,Blank,Blank,A Kumble,Sc Ganguly,Sp Goswami,Wp Saha,1988-11-05
15292,41911400009,419114,9,Jh Kallis,10/16/1975,Right-hand Bat,Right-arm Fast-medium,South Africa,Player,Royal Challengers Bangalore,Kolkata Knight Riders,2010,0,35,0,Blank,Blank,A Kumble,Sc Ganguly,Sp Goswami,Wp Saha,1975-10-16
15297,41911400124,419114,124,A Kumble,10/17/1970,Right-hand Bat,Legbreak Googly,India,Captain,Royal Challengers Bangalore,Kolkata Knight Riders,2010,0,40,0,Blank,Blank,A Kumble,Sc Ganguly,Sp Goswami,Wp Saha,1970-10-17
15299,41911400177,419114,177,Re Van Der Merwe,12/31/1984,Right-hand Bat,Slow Left-arm Orthodox,South Africa,Player,Royal Challengers Bangalore,Kolkata Knight Riders,2010,0,26,0,Blank,Blank,A Kumble,Sc Ganguly,Sp Goswami,Wp Saha,1984-12-31
15300,41911400216,419114,216,Ejg Morgan,9/10/1986,Left-hand Bat,Right-arm Medium,England,Player,Royal Challengers Bangalore,Kolkata Knight Riders,2010,0,24,0,Blank,Blank,A Kumble,Sc Ganguly,Sp Goswami,Wp Saha,1986-09-10
15303,41911400083,419114,83,M Kartik,9/11/1976,Left-hand Bat,Slow Left-arm Orthodox,India,Player,Kolkata Knight Riders,Royal Challengers Bangalore,2010,0,34,1,Blank,Blank,Sc Ganguly,A Kumble,Wp Saha,Sp Goswami,1976-09-11
15304,41911400084,419114,84,I Sharma,9/2/1988,Right-hand Bat,Right-arm Fast-medium,India,Player,Kolkata Knight Riders,Royal Challengers Bangalore,2010,0,22,1,Blank,Blank,Sc Ganguly,A Kumble,Wp Saha,Sp Goswami,1988-09-02
15306,41911400104,419114,104,Bj Hodge,12/29/1974,Right-hand Bat,Right-arm Offbreak,Australia,Player,Kolkata Knight Riders,Royal Challengers Bangalore,2010,0,36,1,Blank,Blank,Sc Ganguly,A Kumble,Wp Saha,Sp Goswami,1974-12-29
15310,41911400219,419114,219,Rs Gavaskar,2/20/1976,Left-hand Bat,Slow Left-arm Orthodox,India,Player,Kolkata Knight Riders,Royal Challengers Bangalore,2010,0,34,1,Blank,Blank,Sc Ganguly,A Kumble,Wp Saha,Sp Goswami,1976-02-20
15311,41911400242,419114,242,Ck Langeveldt,12/17/1974,Right-hand Bat,Right-arm Fast-medium,England,Player,Kolkata Knight Riders,Royal Challengers Bangalore,2010,0,36,1,Blank,Blank,Sc Ganguly,A Kumble,Wp Saha,Sp Goswami,1974-12-17
15312,41911500053,419115,53,Ac Gilchrist,11/14/1971,Left-hand Bat,Right-arm Offbreak,Australia,Captainkeeper,Deccan Chargers,Chennai Super Kings,2010,0,39,1,Blank,Blank,Ac Gilchrist,Ms Dhoni,Ac Gilchrist,Ms Dhoni,1971-11-14
15314,41911500056,419115,56,A Symonds,6/9/1975,Right-hand Bat,Right-arm Offbreak,Australia,Player,Deccan Chargers,Chennai Super Kings,2010,0,35,1,Blank,Blank,Ac Gilchrist,Ms Dhoni,Ac Gilchrist,Ms Dhoni,1975-06-09
15315,41911500057,419115,57,Rg Sharma,4/30/1987,Right-hand Bat,Right-arm Offbreak,India,Player,Deccan Chargers,Chennai Super Kings,2010,0,23,1,Blank,Blank,Ac Gilchrist,Ms Dhoni,Ac Gilchrist,Ms Dhoni,1987-04-30
15317,41911500061,419115,61,Rp Singh,12/6/1985,Right-hand Bat,Left-arm Fast-medium,India,Player,Deccan Chargers,Chennai Super Kings,2010,0,25,1,Blank,Blank,Ac Gilchrist,Ms Dhoni,Ac Gilchrist,Ms Dhoni,1985-12-06
15318,41911500097,419115,97,Hh Gibbs,2/23/1974,Right-hand Bat,Right-arm Bowler,South Africa,Player,Deccan Chargers,Chennai Super Kings,2010,0,36,1,Blank,Blank,Ac Gilchrist,Ms Dhoni,Ac Gilchrist,Ms Dhoni,1974-02-23
15319,41911500131,419115,131,Pp Ojha,9/5/1986,Left-hand Bat,Slow Left-arm Orthodox,India,Player,Deccan Chargers,Chennai Super Kings,2010,0,24,1,Blank,Blank,Ac Gilchrist,Ms Dhoni,Ac Gilchrist,Ms Dhoni,1986-09-05
15320,41911500178,419115,178,Tl Suman,12/15/1983,Right-hand Bat,Right-arm Offbreak,India,Player,Deccan Chargers,Chennai Super Kings,2010,0,27,1,Blank,Blank,Ac Gilchrist,Ms Dhoni,Ac Gilchrist,Ms Dhoni,1983-12-15
15321,41911500205,419115,205,Anirudh Singh,8/2/1980,Left-hand Bat,Right-arm Medium,India,Player,Deccan Chargers,Chennai Super Kings,2010,0,30,1,Blank,Blank,Ac Gilchrist,Ms Dhoni,Ac Gilchrist,Ms Dhoni,1980-08-02
15324,41911500020,419115,20,Ms Dhoni,7/7/1981,Right-hand Bat,Right-arm Medium,India,Captainkeeper,Chennai Super Kings,Deccan Chargers,2010,0,29,0,Blank,Blank,Ms Dhoni,Ac Gilchrist,Ms Dhoni,Ac Gilchrist,1981-07-07
15325,41911500021,419115,21,Sk Raina,11/27/1986,Left-hand Bat,Right-arm Offbreak,India,Player,Chennai Super Kings,Deccan Chargers,2010,0,24,0,Blank,Blank,Ms Dhoni,Ac Gilchrist,Ms Dhoni,Ac Gilchrist,1986-11-27
15326,41911500023,419115,23,S Badrinath,8/30/1980,Right-hand Bat,Right-arm Offbreak,India,Player,Chennai Super Kings,Deccan Chargers,2010,0,30,0,Blank,Blank,Ms Dhoni,Ac Gilchrist,Ms Dhoni,Ac Gilchrist,1980-08-30
15329,41911500151,419115,151,L Balaji,9/27/1981,Right-hand Bat,Right-arm Medium-fast,India,Player,Chennai Super Kings,Deccan Chargers,2010,0,29,0,Blank,Blank,Ms Dhoni,Ac Gilchrist,Ms Dhoni,Ac Gilchrist,1981-09-27
15331,41911500201,419115,201,R Ashwin,9/17/1986,Right-hand Bat,Right-arm Offbreak,India,Player,Chennai Super Kings,Deccan Chargers,2010,0,24,0,Blank,Blank,Ms Dhoni,Ac Gilchrist,Ms Dhoni,Ac Gilchrist,1986-09-17
15333,41911500218,419115,218,S Tyagi,9/17/1987,Right-hand Bat,Right-arm Medium,India,Player,Chennai Super Kings,Deccan Chargers,2010,0,23,0,Blank,Blank,Ms Dhoni,Ac Gilchrist,Ms Dhoni,Ac Gilchrist,1987-09-17
15334,41911600040,419116,40,G Gambhir,10/14/1981,Left-hand Bat,Legbreak,India,Captain,Delhi Daredevils,Rajasthan Royals,2010,0,29,1,Blank,Blank,G Gambhir,Sk Warne,Kd Karthik,Nv Ojha,1981-10-14
15335,41911600041,419116,41,V Sehwag,10/20/1978,Right-hand Bat,Right-arm Offbreak,India,Player,Delhi Daredevils,Rajasthan Royals,2010,1,32,1,Blank,Blank,G Gambhir,Sk Warne,Kd Karthik,Nv Ojha,1978-10-20
15336,41911600088,419116,88,Kd Karthik,6/1/1985,Right-hand Bat,N/a,India,Keeper,Delhi Daredevils,Rajasthan Royals,2010,0,25,1,Blank,Blank,G Gambhir,Sk Warne,Kd Karthik,Nv Ojha,1985-06-01
15337,41911600090,419116,90,Mf Maharoof,9/7/1984,Right-hand Bat,Right-arm Fast-medium,India,Player,Delhi Daredevils,Rajasthan Royals,2010,0,26,1,Blank,Blank,G Gambhir,Sk Warne,Kd Karthik,Nv Ojha,1984-09-07
15339,41911600116,419116,116,Pj Sangwan,11/5/1990,Right-hand Bat,Left-arm Medium,India,Player,Delhi Daredevils,Rajasthan Royals,2010,0,20,1,Blank,Blank,G Gambhir,Sk Warne,Kd Karthik,Nv Ojha,1990-11-05
15342,41911600171,419116,171,M Manhas,10/12/1979,Right-hand Bat,Right-arm Offbreak,India,Player,Delhi Daredevils,Rajasthan Royals,2010,0,31,1,Blank,Blank,G Gambhir,Sk Warne,Kd Karthik,Nv Ojha,1979-10-12
15345,41911600031,419116,31,Yk Pathan,11/17/1982,Right-hand Bat,Right-arm Offbreak,India,Player,Rajasthan Royals,Delhi Daredevils,2010,0,28,0,Blank,Blank,Sk Warne,G Gambhir,Nv Ojha,Kd Karthik,1982-11-17
15349,41911600126,419116,126,Mm Patel,7/12/1983,Right-hand Bat,Right-arm Medium-fast,India,Player,Rajasthan Royals,Delhi Daredevils,2010,0,27,0,Blank,Blank,Sk Warne,G Gambhir,Nv Ojha,Kd Karthik,1983-07-12
15356,41911700026,419117,26,Kc Sangakkara,10/27/1977,Left-hand Bat,Right-arm Offbreak,Sri Lanka,Captainkeeper,Kings Xi Punjab,Royal Challengers Bangalore,2010,0,33,0,Blank,Blank,Kc Sangakkara,A Kumble,Kc Sangakkara,Mv Boucher,1977-10-27
15358,41911700029,419117,29,Ik Pathan,10/27/1984,Left-hand Bat,Left-arm Medium-fast,India,Player,Kings Xi Punjab,Royal Challengers Bangalore,2010,0,26,0,Blank,Blank,Kc Sangakkara,A Kumble,Kc Sangakkara,Mv Boucher,1984-10-27
15362,41911700077,419117,77,S Sreesanth,2/6/1983,Right-hand Bat,Right-arm Fast-medium,India,Player,Kings Xi Punjab,Royal Challengers Bangalore,2010,0,27,0,Blank,Blank,Kc Sangakkara,A Kumble,Kc Sangakkara,Mv Boucher,1983-02-06
15365,41911700215,419117,215,Ya Abdulla,1/17/1983,Left-hand Bat,Left-arm Fast-medium,India,Player,Kings Xi Punjab,Royal Challengers Bangalore,2010,0,27,0,Blank,Blank,Kc Sangakkara,A Kumble,Kc Sangakkara,Mv Boucher,1983-01-17
15367,41911700006,419117,6,R Dravid,1/11/1973,Right-hand Bat,Right-arm Offbreak,India,Player,Royal Challengers Bangalore,Kings Xi Punjab,2010,0,37,1,Blank,Blank,A Kumble,Kc Sangakkara,Mv Boucher,Kc Sangakkara,1973-01-11
15368,41911700008,419117,8,V Kohli,11/5/1988,Right-hand Bat,Right-arm Medium,India,Player,Royal Challengers Bangalore,Kings Xi Punjab,2010,0,22,1,Blank,Blank,A Kumble,Kc Sangakkara,Mv Boucher,Kc Sangakkara,1988-11-05
15369,41911700009,419117,9,Jh Kallis,10/16/1975,Right-hand Bat,Right-arm Fast-medium,South Africa,Player,Royal Challengers Bangalore,Kings Xi Punjab,2010,1,35,1,Blank,Blank,A Kumble,Kc Sangakkara,Mv Boucher,Kc Sangakkara,1975-10-16
15370,41911700011,419117,11,Mv Boucher,12/3/1976,Right-hand Bat,Right-arm Medium,South Africa,Keeper,Royal Challengers Bangalore,Kings Xi Punjab,2010,0,34,1,Blank,Blank,A Kumble,Kc Sangakkara,Mv Boucher,Kc Sangakkara,1976-12-03
15372,41911700046,419117,46,Rv Uthappa,11/11/1985,Right-hand Bat,Right-arm Medium,India,Player,Royal Challengers Bangalore,Kings Xi Punjab,2010,0,25,1,Blank,Blank,A Kumble,Kc Sangakkara,Mv Boucher,Kc Sangakkara,1985-11-11
15380,41911800021,419118,21,Sk Raina,11/27/1986,Left-hand Bat,Right-arm Offbreak,India,Player,Chennai Super Kings,Kolkata Knight Riders,2010,0,24,1,Blank,Blank,Ms Dhoni,Sc Ganguly,Ms Dhoni,Wp Saha,1986-11-27
15382,41911800109,419118,109,Ja Morkel,6/10/1981,Left-hand Bat,Right-arm Medium-fast,South Africa,Player,Chennai Super Kings,Kolkata Knight Riders,2010,0,29,1,Blank,Blank,Ms Dhoni,Sc Ganguly,Ms Dhoni,Wp Saha,1981-06-10
15383,41911800120,419118,120,Ms Gony,1/4/1984,Right-hand Bat,Right-arm Medium,India,Player,Chennai Super Kings,Kolkata Knight Riders,2010,0,26,1,Blank,Blank,Ms Dhoni,Sc Ganguly,Ms Dhoni,Wp Saha,1984-01-04
15384,41911800121,419118,121,M Muralitharan,4/17/1972,Right-hand Bat,Right-arm Offbreak,Sri Lanka,Player,Chennai Super Kings,Kolkata Knight Riders,2010,0,38,1,Blank,Blank,Ms Dhoni,Sc Ganguly,Ms Dhoni,Wp Saha,1972-04-17
15385,41911800151,419118,151,L Balaji,9/27/1981,Right-hand Bat,Right-arm Medium-fast,India,Player,Chennai Super Kings,Kolkata Knight Riders,2010,0,29,1,Blank,Blank,Ms Dhoni,Sc Ganguly,Ms Dhoni,Wp Saha,1981-09-27
15386,41911800185,419118,185,M Vijay,4/1/1984,Right-hand Bat,Right-arm Offbreak,India,Player,Chennai Super Kings,Kolkata Knight Riders,2010,0,26,1,Blank,Blank,Ms Dhoni,Sc Ganguly,Ms Dhoni,Wp Saha,1984-04-01
15388,41911800217,419118,217,Jm Kemp,10/2/1977,Right-hand Bat,Right-arm Fast-medium,South Africa,Player,Chennai Super Kings,Kolkata Knight Riders,2010,0,33,1,Blank,Blank,Ms Dhoni,Sc Ganguly,Ms Dhoni,Wp Saha,1977-10-02
15389,41911800001,419118,1,Sc Ganguly,7/8/1972,Left-hand Bat,Right-arm Medium,India,Captain,Kolkata Knight Riders,Chennai Super Kings,2010,0,38,0,Blank,Blank,Sc Ganguly,Ms Dhoni,Wp Saha,Ms Dhoni,1972-07-08
15390,41911800062,419118,62,Wp Saha,10/24/1984,Right-hand Bat,N/a,India,Keeper,Kolkata Knight Riders,Chennai Super Kings,2010,0,26,0,Blank,Blank,Sc Ganguly,Ms Dhoni,Wp Saha,Ms Dhoni,1984-10-24
15391,41911800063,419118,63,Lr Shukla,5/6/1981,Right-hand Bat,Right-arm Medium,India,Player,Kolkata Knight Riders,Chennai Super Kings,2010,0,29,0,Blank,Blank,Sc Ganguly,Ms Dhoni,Wp Saha,Ms Dhoni,1981-05-06
15393,41911800084,419118,84,I Sharma,9/2/1988,Right-hand Bat,Right-arm Fast-medium,India,Player,Kolkata Knight Riders,Chennai Super Kings,2010,0,22,0,Blank,Blank,Sc Ganguly,Ms Dhoni,Wp Saha,Ms Dhoni,1988-09-02
15394,41911800087,419118,87,Mk Tiwary,11/14/1985,Right-hand Bat,Legbreak Googly,India,Player,Kolkata Knight Riders,Chennai Super Kings,2010,0,25,0,Blank,Blank,Sc Ganguly,Ms Dhoni,Wp Saha,Ms Dhoni,1985-11-14
15398,41911800219,419118,219,Rs Gavaskar,2/20/1976,Left-hand Bat,Slow Left-arm Orthodox,India,Player,Kolkata Knight Riders,Chennai Super Kings,2010,0,34,0,Blank,Blank,Sc Ganguly,Ms Dhoni,Wp Saha,Ms Dhoni,1976-02-20
15399,41911800220,419118,220,Se Bond,6/7/1975,Right-hand Bat,Right-arm Fast,New Zealand,Player,Kolkata Knight Riders,Chennai Super Kings,2010,0,35,0,Blank,Blank,Sc Ganguly,Ms Dhoni,Wp Saha,Ms Dhoni,1975-06-07
15401,41911900044,419119,44,St Jayasuriya,6/30/1969,Left-hand Bat,Slow Left-arm Orthodox,Sri Lanka,Player,Mumbai Indians,Delhi Daredevils,2010,0,41,1,Blank,Blank,Sr Tendulkar,G Gambhir,Ap Tare,Kd Karthik,1969-06-30
15402,41911900050,419119,50,Harbhajan Singh,7/3/1980,Right-hand Bat,Right-arm Offbreak,India,Player,Mumbai Indians,Delhi Daredevils,2010,0,30,1,Blank,Blank,Sr Tendulkar,G Gambhir,Ap Tare,Kd Karthik,1980-07-03
15404,41911900079,419119,79,Ss Tiwary,12/30/1989,Left-hand Bat,N/a,India,Player,Mumbai Indians,Delhi Daredevils,2010,0,21,1,Blank,Blank,Sr Tendulkar,G Gambhir,Ap Tare,Kd Karthik,1989-12-30
15405,41911900133,419119,133,Sr Tendulkar,4/24/1973,Right-hand Bat,Right-arm Offbreak,India,Captain,Mumbai Indians,Delhi Daredevils,2010,1,37,1,Blank,Blank,Sr Tendulkar,G Gambhir,Ap Tare,Kd Karthik,1973-04-24
15409,41911900209,419119,209,R Sathish,1/14/1981,Right-hand Bat,Right-arm Medium,India,Player,Mumbai Indians,Delhi Daredevils,2010,0,29,1,Blank,Blank,Sr Tendulkar,G Gambhir,Ap Tare,Kd Karthik,1981-01-14
15410,41911900221,419119,221,Ka Pollard,5/12/1987,Right-hand Bat,Right-arm Medium-fast,West Indies,Player,Mumbai Indians,Delhi Daredevils,2010,0,23,1,Blank,Blank,Sr Tendulkar,G Gambhir,Ap Tare,Kd Karthik,1987-05-12
15412,41911900041,419119,41,V Sehwag,10/20/1978,Right-hand Bat,Right-arm Offbreak,India,Player,Delhi Daredevils,Mumbai Indians,2010,0,32,0,Blank,Blank,G Gambhir,Sr Tendulkar,Kd Karthik,Ap Tare,1978-10-20
15415,41911900110,419119,110,Ab De Villiers,2/17/1984,Right-hand Bat,Right-arm Medium,South Africa,Player,Delhi Daredevils,Mumbai Indians,2010,0,26,0,Blank,Blank,G Gambhir,Sr Tendulkar,Kd Karthik,Ap Tare,1984-02-17
15418,41911900136,419119,136,A Mishra,11/24/1982,Right-hand Bat,Legbreak,India,Player,Delhi Daredevils,Mumbai Indians,2010,0,28,0,Blank,Blank,G Gambhir,Sr Tendulkar,Kd Karthik,Ap Tare,1982-11-24
15422,41912000006,419120,6,R Dravid,1/11/1973,Right-hand Bat,Right-arm Offbreak,India,Player,Royal Challengers Bangalore,Rajasthan Royals,2010,0,37,1,Blank,Blank,A Kumble,Sk Warne,Mv Boucher,Nv Ojha,1973-01-11
15424,41912000009,419120,9,Jh Kallis,10/16/1975,Right-hand Bat,Right-arm Fast-medium,South Africa,Player,Royal Challengers Bangalore,Rajasthan Royals,2010,1,35,1,Blank,Blank,A Kumble,Sk Warne,Mv Boucher,Nv Ojha,1975-10-16
15425,41912000011,419120,11,Mv Boucher,12/3/1976,Right-hand Bat,Right-arm Medium,South Africa,Keeper,Royal Challengers Bangalore,Rajasthan Royals,2010,0,34,1,Blank,Blank,A Kumble,Sk Warne,Mv Boucher,Nv Ojha,1976-12-03
15429,41912000094,419120,94,Dw Steyn,6/27/1983,Right-hand Bat,Right-arm Fast,South Africa,Player,Royal Challengers Bangalore,Rajasthan Royals,2010,0,27,1,Blank,Blank,A Kumble,Sk Warne,Mv Boucher,Nv Ojha,1983-06-27
15431,41912000124,419120,124,A Kumble,10/17/1970,Right-hand Bat,Legbreak Googly,India,Captain,Royal Challengers Bangalore,Rajasthan Royals,2010,0,40,1,Blank,Blank,A Kumble,Sk Warne,Mv Boucher,Nv Ojha,1970-10-17
15433,41912000031,419120,31,Yk Pathan,11/17/1982,Right-hand Bat,Right-arm Offbreak,India,Player,Rajasthan Royals,Royal Challengers Bangalore,2010,0,28,0,Blank,Blank,Sk Warne,A Kumble,Nv Ojha,Mv Boucher,1982-11-17
15441,41912000224,419120,224,Mj Lumb,2/12/1980,Left-hand Bat,Right-arm Medium,England,Player,Rajasthan Royals,Royal Challengers Bangalore,2010,0,30,0,Blank,Blank,Sk Warne,A Kumble,Nv Ojha,Mv Boucher,1980-02-12
15446,41912100089,419121,89,R Bhatia,10/22/1979,Right-hand Bat,Right-arm Medium-fast,India,Player,Delhi Daredevils,Chennai Super Kings,2010,0,31,0,Blank,Blank,Kd Karthik,Sk Raina,Kd Karthik,Pa Patel,1979-10-22
15449,41912100135,419121,135,Tm Dilshan,10/14/1976,Right-hand Bat,Right-arm Offbreak,Sri Lanka,Player,Delhi Daredevils,Chennai Super Kings,2010,0,34,0,Blank,Blank,Kd Karthik,Sk Raina,Kd Karthik,Pa Patel,1976-10-14
15452,41912100187,419121,187,Da Warner,10/27/1986,Left-hand Bat,Legbreak,Australia,Player,Delhi Daredevils,Chennai Super Kings,2010,0,24,0,Blank,Blank,Kd Karthik,Sk Raina,Kd Karthik,Pa Patel,1986-10-27
15453,41912100223,419121,223,Dp Nannes,5/16/1976,Right-hand Bat,Left-arm Fast,Australia,Player,Delhi Daredevils,Chennai Super Kings,2010,0,34,0,Blank,Blank,Kd Karthik,Sk Raina,Kd Karthik,Pa Patel,1976-05-16
15456,41912100018,419121,18,Ml Hayden,10/29/1971,Left-hand Bat,Right-arm Medium,Australia,Player,Chennai Super Kings,Delhi Daredevils,2010,1,39,1,Blank,Blank,Sk Raina,Kd Karthik,Pa Patel,Kd Karthik,1971-10-29
15457,41912100021,419121,21,Sk Raina,11/27/1986,Left-hand Bat,Right-arm Offbreak,India,Captain,Chennai Super Kings,Delhi Daredevils,2010,0,24,1,Blank,Blank,Sk Raina,Kd Karthik,Pa Patel,Kd Karthik,1986-11-27
15460,41912100119,419121,119,Joginder Sharma,10/23/1983,Right-hand Bat,Right-arm Fast-medium,India,Player,Chennai Super Kings,Delhi Daredevils,2010,0,27,1,Blank,Blank,Sk Raina,Kd Karthik,Pa Patel,Kd Karthik,1983-10-23
15461,41912100121,419121,121,M Muralitharan,4/17/1972,Right-hand Bat,Right-arm Offbreak,Sri Lanka,Player,Chennai Super Kings,Delhi Daredevils,2010,0,38,1,Blank,Blank,Sk Raina,Kd Karthik,Pa Patel,Kd Karthik,1972-04-17
15463,41912100185,419121,185,M Vijay,4/1/1984,Right-hand Bat,Right-arm Offbreak,India,Player,Chennai Super Kings,Delhi Daredevils,2010,0,26,1,Blank,Blank,Sk Raina,Kd Karthik,Pa Patel,Kd Karthik,1984-04-01
15464,41912100201,419121,201,R Ashwin,9/17/1986,Right-hand Bat,Right-arm Offbreak,India,Player,Chennai Super Kings,Delhi Daredevils,2010,0,24,1,Blank,Blank,Sk Raina,Kd Karthik,Pa Patel,Kd Karthik,1986-09-17
15467,41912200055,419122,55,Vvs Laxman,11/1/1974,Right-hand Bat,Right-arm Offbreak,India,Player,Deccan Chargers,Kings Xi Punjab,2010,0,36,1,Blank,Blank,Ac Gilchrist,Kc Sangakkara,Ac Gilchrist,Kc Sangakkara,1974-11-01
15472,41912200097,419122,97,Hh Gibbs,2/23/1974,Right-hand Bat,Right-arm Bowler,South Africa,Player,Deccan Chargers,Kings Xi Punjab,2010,0,36,1,Blank,Blank,Ac Gilchrist,Kc Sangakkara,Ac Gilchrist,Kc Sangakkara,1974-02-23
15473,41912200131,419122,131,Pp Ojha,9/5/1986,Left-hand Bat,Slow Left-arm Orthodox,India,Player,Deccan Chargers,Kings Xi Punjab,2010,0,24,1,Blank,Blank,Ac Gilchrist,Kc Sangakkara,Ac Gilchrist,Kc Sangakkara,1986-09-05
15474,41912200178,419122,178,Tl Suman,12/15/1983,Right-hand Bat,Right-arm Offbreak,India,Player,Deccan Chargers,Kings Xi Punjab,2010,0,27,1,Blank,Blank,Ac Gilchrist,Kc Sangakkara,Ac Gilchrist,Kc Sangakkara,1983-12-15
15475,41912200205,419122,205,Anirudh Singh,8/2/1980,Left-hand Bat,Right-arm Medium,India,Player,Deccan Chargers,Kings Xi Punjab,2010,0,30,1,Blank,Blank,Ac Gilchrist,Kc Sangakkara,Ac Gilchrist,Kc Sangakkara,1980-08-02
15477,41912200026,419122,26,Kc Sangakkara,10/27/1977,Left-hand Bat,Right-arm Offbreak,Sri Lanka,Captainkeeper,Kings Xi Punjab,Deccan Chargers,2010,0,33,0,Blank,Blank,Kc Sangakkara,Ac Gilchrist,Kc Sangakkara,Ac Gilchrist,1977-10-27
15484,41912200214,419122,214,Ms Bisla,12/27/1984,Right-hand Bat,N/a,India,Player,Kings Xi Punjab,Deccan Chargers,2010,0,26,0,Blank,Blank,Kc Sangakkara,Ac Gilchrist,Kc Sangakkara,Ac Gilchrist,1984-12-27
15485,41912200227,419122,227,Ab Barath,4/14/1990,Right-hand Bat,Right-arm Offbreak,India,Player,Kings Xi Punjab,Deccan Chargers,2010,0,20,0,Blank,Blank,Kc Sangakkara,Ac Gilchrist,Kc Sangakkara,Ac Gilchrist,1990-04-14
15489,41912300038,419123,38,Sk Warne,9/13/1969,Right-hand Bat,Legbreak Googly,Australia,Captain,Rajasthan Royals,Kolkata Knight Riders,2010,0,41,1,Blank,Blank,Sk Warne,Sc Ganguly,Nv Ojha,Wp Saha,1969-09-13
15490,41912300039,419123,39,Sk Trivedi,9/4/1982,Right-hand Bat,Right-arm Medium,India,Player,Rajasthan Royals,Kolkata Knight Riders,2010,0,28,1,Blank,Blank,Sk Warne,Sc Ganguly,Nv Ojha,Wp Saha,1982-09-04
15491,41912300126,419123,126,Mm Patel,7/12/1983,Right-hand Bat,Right-arm Medium-fast,India,Player,Rajasthan Royals,Kolkata Knight Riders,2010,0,27,1,Blank,Blank,Sk Warne,Sc Ganguly,Nv Ojha,Wp Saha,1983-07-12
15492,41912300183,419123,183,Nv Ojha,7/20/1983,Right-hand Bat,N/a,India,Keeper,Rajasthan Royals,Kolkata Knight Riders,2010,0,27,1,Blank,Blank,Sk Warne,Sc Ganguly,Nv Ojha,Wp Saha,1983-07-20
15499,41912300001,419123,1,Sc Ganguly,7/8/1972,Left-hand Bat,Right-arm Medium,India,Captain,Kolkata Knight Riders,Rajasthan Royals,2010,0,38,0,Blank,Blank,Sc Ganguly,Sk Warne,Wp Saha,Nv Ojha,1972-07-08
15500,41912300062,419123,62,Wp Saha,10/24/1984,Right-hand Bat,N/a,India,Keeper,Kolkata Knight Riders,Rajasthan Royals,2010,0,26,0,Blank,Blank,Sc Ganguly,Sk Warne,Wp Saha,Nv Ojha,1984-10-24
15503,41912300087,419123,87,Mk Tiwary,11/14/1985,Right-hand Bat,Legbreak Googly,India,Player,Kolkata Knight Riders,Rajasthan Royals,2010,0,25,0,Blank,Blank,Sc Ganguly,Sk Warne,Wp Saha,Nv Ojha,1985-11-14
15506,41912300191,419123,191,Ad Mathews,6/2/1987,Right-hand Bat,Right-arm Fast-medium,Sri Lanka,Player,Kolkata Knight Riders,Rajasthan Royals,2010,0,23,0,Blank,Blank,Sc Ganguly,Sk Warne,Wp Saha,Nv Ojha,1987-06-02
15507,41912300203,419123,203,Ca Pujara,1/25/1988,Right-hand Bat,Legbreak,India,Player,Kolkata Knight Riders,Rajasthan Royals,2010,0,22,0,Blank,Blank,Sc Ganguly,Sk Warne,Wp Saha,Nv Ojha,1988-01-25
15508,41912300204,419123,204,Oa Shah,10/22/1978,Right-hand Bat,Right-arm Offbreak,England,Player,Kolkata Knight Riders,Rajasthan Royals,2010,0,32,0,Blank,Blank,Sc Ganguly,Sk Warne,Wp Saha,Nv Ojha,1978-10-22
15509,41912300220,419123,220,Se Bond,6/7/1975,Right-hand Bat,Right-arm Fast,New Zealand,Player,Kolkata Knight Riders,Rajasthan Royals,2010,0,35,0,Blank,Blank,Sc Ganguly,Sk Warne,Wp Saha,Nv Ojha,1975-06-07
15512,41912400050,419124,50,Harbhajan Singh,7/3/1980,Right-hand Bat,Right-arm Offbreak,India,Player,Mumbai Indians,Royal Challengers Bangalore,2010,0,30,0,Blank,Blank,Sr Tendulkar,A Kumble,Ap Tare,Mv Boucher,1980-07-03
15515,41912400133,419124,133,Sr Tendulkar,4/24/1973,Right-hand Bat,Right-arm Offbreak,India,Captain,Mumbai Indians,Royal Challengers Bangalore,2010,0,37,0,Blank,Blank,Sr Tendulkar,A Kumble,Ap Tare,Mv Boucher,1973-04-24
15521,41912400006,419124,6,R Dravid,1/11/1973,Right-hand Bat,Right-arm Offbreak,India,Player,Royal Challengers Bangalore,Mumbai Indians,2010,0,37,1,Blank,Blank,A Kumble,Sr Tendulkar,Mv Boucher,Ap Tare,1973-01-11
15524,41912400011,419124,11,Mv Boucher,12/3/1976,Right-hand Bat,Right-arm Medium,South Africa,Keeper,Royal Challengers Bangalore,Mumbai Indians,2010,0,34,1,Blank,Blank,A Kumble,Sr Tendulkar,Mv Boucher,Ap Tare,1976-12-03
15526,41912400046,419124,46,Rv Uthappa,11/11/1985,Right-hand Bat,Right-arm Medium,India,Player,Royal Challengers Bangalore,Mumbai Indians,2010,0,25,1,Blank,Blank,A Kumble,Sr Tendulkar,Mv Boucher,Ap Tare,1985-11-11
15529,41912400096,419124,96,Mk Pandey,9/10/1989,Right-hand Bat,Right-arm Medium,India,Player,Royal Challengers Bangalore,Mumbai Indians,2010,0,21,1,Blank,Blank,A Kumble,Sr Tendulkar,Mv Boucher,Ap Tare,1989-09-10
15535,41912500057,419125,57,Rg Sharma,4/30/1987,Right-hand Bat,Right-arm Offbreak,India,Player,Deccan Chargers,Delhi Daredevils,2010,0,23,1,Blank,Blank,Ac Gilchrist,Kd Karthik,Ac Gilchrist,Kd Karthik,1987-04-30
15536,41912500060,419125,60,Wpujc Vaas,1/27/1974,Left-hand Bat,Left-arm Fast-medium,Sri Lanka,Player,Deccan Chargers,Delhi Daredevils,2010,0,36,1,Blank,Blank,Ac Gilchrist,Kd Karthik,Ac Gilchrist,Kd Karthik,1974-01-27
15537,41912500061,419125,61,Rp Singh,12/6/1985,Right-hand Bat,Left-arm Fast-medium,India,Player,Deccan Chargers,Delhi Daredevils,2010,0,25,1,Blank,Blank,Ac Gilchrist,Kd Karthik,Ac Gilchrist,Kd Karthik,1985-12-06
15539,41912500131,419125,131,Pp Ojha,9/5/1986,Left-hand Bat,Slow Left-arm Orthodox,India,Player,Deccan Chargers,Delhi Daredevils,2010,0,24,1,Blank,Blank,Ac Gilchrist,Kd Karthik,Ac Gilchrist,Kd Karthik,1986-09-05
15540,41912500178,419125,178,Tl Suman,12/15/1983,Right-hand Bat,Right-arm Offbreak,India,Player,Deccan Chargers,Delhi Daredevils,2010,0,27,1,Blank,Blank,Ac Gilchrist,Kd Karthik,Ac Gilchrist,Kd Karthik,1983-12-15
15541,41912500231,419125,231,Md Mishra,2/9/1984,Right-hand Bat,Right-arm Offbreak,India,Player,Deccan Chargers,Delhi Daredevils,2010,0,26,1,Blank,Blank,Ac Gilchrist,Kd Karthik,Ac Gilchrist,Kd Karthik,1984-02-09
15548,41912500171,419125,171,M Manhas,10/12/1979,Right-hand Bat,Right-arm Offbreak,India,Player,Delhi Daredevils,Deccan Chargers,2010,0,31,0,Blank,Blank,Kd Karthik,Ac Gilchrist,Kd Karthik,Ac Gilchrist,1979-10-12
15549,41912500187,419125,187,Da Warner,10/27/1986,Left-hand Bat,Legbreak,Australia,Player,Delhi Daredevils,Deccan Chargers,2010,0,24,0,Blank,Blank,Kd Karthik,Ac Gilchrist,Kd Karthik,Ac Gilchrist,1986-10-27
15551,41912500222,419125,222,S Ladda,7/10/1986,Right-hand Bat,Legbreak,India,Player,Delhi Daredevils,Deccan Chargers,2010,0,24,0,Blank,Blank,Kd Karthik,Ac Gilchrist,Kd Karthik,Ac Gilchrist,1986-07-10
15552,41912500223,419125,223,Dp Nannes,5/16/1976,Right-hand Bat,Left-arm Fast,Australia,Player,Delhi Daredevils,Deccan Chargers,2010,0,34,0,Blank,Blank,Kd Karthik,Ac Gilchrist,Kd Karthik,Ac Gilchrist,1976-05-16
15553,41912500232,419125,232,Ut Yadav,10/25/1987,Right-hand Bat,Right-arm Fast-medium,India,Player,Delhi Daredevils,Deccan Chargers,2010,0,23,0,Blank,Blank,Kd Karthik,Ac Gilchrist,Kd Karthik,Ac Gilchrist,1987-10-25
15554,41912600026,419126,26,Kc Sangakkara,10/27/1977,Left-hand Bat,Right-arm Offbreak,Sri Lanka,Captainkeeper,Kings Xi Punjab,Chennai Super Kings,2010,0,33,1,Blank,Blank,Kc Sangakkara,Sk Raina,Kc Sangakkara,Pa Patel,1977-10-27
15557,41912600033,419126,33,M Kaif,12/1/1980,Right-hand Bat,Right-arm Offbreak,India,Player,Kings Xi Punjab,Chennai Super Kings,2010,0,30,1,Blank,Blank,Kc Sangakkara,Sk Raina,Kc Sangakkara,Pa Patel,1980-12-01
15559,41912600067,419126,67,Pp Chawla,12/24/1988,Left-hand Bat,Legbreak,India,Player,Kings Xi Punjab,Chennai Super Kings,2010,0,22,1,Blank,Blank,Kc Sangakkara,Sk Raina,Kc Sangakkara,Pa Patel,1988-12-24
15560,41912600153,419126,153,Rr Powar,5/20/1978,Right-hand Bat,Right-arm Offbreak,India,Player,Kings Xi Punjab,Chennai Super Kings,2010,0,32,1,Blank,Blank,Kc Sangakkara,Sk Raina,Kc Sangakkara,Pa Patel,1978-05-20
15564,41912600234,419126,234,Sj Srivastava,9/22/1981,Right-hand Bat,Left-arm Fast-medium,India,Player,Kings Xi Punjab,Chennai Super Kings,2010,0,29,1,Blank,Blank,Kc Sangakkara,Sk Raina,Kc Sangakkara,Pa Patel,1981-09-22
15570,41912600120,419126,120,Ms Gony,1/4/1984,Right-hand Bat,Right-arm Medium,India,Player,Chennai Super Kings,Kings Xi Punjab,2010,0,26,0,Blank,Blank,Sk Raina,Kc Sangakkara,Pa Patel,Kc Sangakkara,1984-01-04
15572,41912600151,419126,151,L Balaji,9/27/1981,Right-hand Bat,Right-arm Medium-fast,India,Player,Chennai Super Kings,Kings Xi Punjab,2010,0,29,0,Blank,Blank,Sk Raina,Kc Sangakkara,Pa Patel,Kc Sangakkara,1981-09-27
15574,41912600201,419126,201,R Ashwin,9/17/1986,Right-hand Bat,Right-arm Offbreak,India,Player,Chennai Super Kings,Kings Xi Punjab,2010,0,24,0,Blank,Blank,Sk Raina,Kc Sangakkara,Pa Patel,Kc Sangakkara,1986-09-17
15575,41912600217,419126,217,Jm Kemp,10/2/1977,Right-hand Bat,Right-arm Fast-medium,South Africa,Player,Chennai Super Kings,Kings Xi Punjab,2010,0,33,0,Blank,Blank,Sk Raina,Kc Sangakkara,Pa Patel,Kc Sangakkara,1977-10-02
15577,41912700042,419127,42,S Dhawan,12/5/1985,Left-hand Bat,Right-arm Offbreak,India,Player,Mumbai Indians,Kolkata Knight Riders,2010,0,25,1,Blank,Blank,Sr Tendulkar,Sc Ganguly,Ap Tare,Wp Saha,1985-12-05
15579,41912700071,419127,71,Dj Bravo,10/7/1983,Right-hand Bat,Right-arm Medium-fast,West Indies,Player,Mumbai Indians,Kolkata Knight Riders,2010,0,27,1,Blank,Blank,Sr Tendulkar,Sc Ganguly,Ap Tare,Wp Saha,1983-10-07
15586,41912700221,419127,221,Ka Pollard,5/12/1987,Right-hand Bat,Right-arm Medium-fast,West Indies,Player,Mumbai Indians,Kolkata Knight Riders,2010,0,23,1,Blank,Blank,Sr Tendulkar,Sc Ganguly,Ap Tare,Wp Saha,1987-05-12
15597,41912700287,419127,287,Harpreet Singh,8/11/1991,Left-hand Bat,Right-arm Medium,India,Player,Kolkata Knight Riders,Mumbai Indians,2010,0,19,0,Blank,Blank,Sc Ganguly,Sr Tendulkar,Wp Saha,Ap Tare,1991-08-11
15599,41912800008,419128,8,V Kohli,11/5/1988,Right-hand Bat,Right-arm Medium,India,Player,Royal Challengers Bangalore,Chennai Super Kings,2010,0,22,1,Blank,Blank,A Kumble,Sk Raina,Mv Boucher,Pa Patel,1988-11-05
15602,41912800014,419128,14,P Kumar,10/2/1986,Right-hand Bat,Right-arm Medium,India,Player,Royal Challengers Bangalore,Chennai Super Kings,2010,0,24,1,Blank,Blank,A Kumble,Sk Raina,Mv Boucher,Pa Patel,1986-10-02
15606,41912800096,419128,96,Mk Pandey,9/10/1989,Right-hand Bat,Right-arm Medium,India,Player,Royal Challengers Bangalore,Chennai Super Kings,2010,0,21,1,Blank,Blank,A Kumble,Sk Raina,Mv Boucher,Pa Patel,1989-09-10
15608,41912800216,419128,216,Ejg Morgan,9/10/1986,Left-hand Bat,Right-arm Medium,England,Player,Royal Challengers Bangalore,Chennai Super Kings,2010,0,24,1,Blank,Blank,A Kumble,Sk Raina,Mv Boucher,Pa Patel,1986-09-10
15614,41912800121,419128,121,M Muralitharan,4/17/1972,Right-hand Bat,Right-arm Offbreak,Sri Lanka,Player,Chennai Super Kings,Royal Challengers Bangalore,2010,0,38,0,Blank,Blank,Sk Raina,A Kumble,Pa Patel,Mv Boucher,1972-04-17
15617,41912800197,419128,197,Gj Bailey,9/7/1982,Right-hand Bat,Right-arm Medium,Australia,Player,Chennai Super Kings,Royal Challengers Bangalore,2010,0,28,0,Blank,Blank,Sk Raina,A Kumble,Pa Patel,Mv Boucher,1982-09-07
15619,41912800218,419128,218,S Tyagi,9/17/1987,Right-hand Bat,Right-arm Medium,India,Player,Chennai Super Kings,Royal Challengers Bangalore,2010,0,23,0,Blank,Blank,Sk Raina,A Kumble,Pa Patel,Mv Boucher,1987-09-17
15620,41912900026,419129,26,Kc Sangakkara,10/27/1977,Left-hand Bat,Right-arm Offbreak,Sri Lanka,Captainkeeper,Kings Xi Punjab,Rajasthan Royals,2010,0,33,0,Blank,Blank,Kc Sangakkara,Sk Warne,Kc Sangakkara,Nv Ojha,1977-10-27
15621,41912900027,419129,27,Yuvraj Singh,12/12/1981,Left-hand Bat,Slow Left-arm Orthodox,India,Player,Kings Xi Punjab,Rajasthan Royals,2010,0,29,0,Blank,Blank,Kc Sangakkara,Sk Warne,Kc Sangakkara,Nv Ojha,1981-12-12
15625,41912900067,419129,67,Pp Chawla,12/24/1988,Left-hand Bat,Legbreak,India,Player,Kings Xi Punjab,Rajasthan Royals,2010,0,22,0,Blank,Blank,Kc Sangakkara,Sk Warne,Kc Sangakkara,Nv Ojha,1988-12-24
15628,41912900214,419129,214,Ms Bisla,12/27/1984,Right-hand Bat,N/a,India,Player,Kings Xi Punjab,Rajasthan Royals,2010,0,26,0,Blank,Blank,Kc Sangakkara,Sk Warne,Kc Sangakkara,Nv Ojha,1984-12-27
15631,41912900031,419129,31,Yk Pathan,11/17/1982,Right-hand Bat,Right-arm Offbreak,India,Player,Rajasthan Royals,Kings Xi Punjab,2010,0,28,1,Blank,Blank,Sk Warne,Kc Sangakkara,Nv Ojha,Kc Sangakkara,1982-11-17
15637,41912900212,419129,212,P Dogra,11/19/1984,Right-hand Bat,Legbreak,India,Player,Rajasthan Royals,Kings Xi Punjab,2010,0,26,1,Blank,Blank,Sk Warne,Kc Sangakkara,Nv Ojha,Kc Sangakkara,1984-11-19
15638,41912900224,419129,224,Mj Lumb,2/12/1980,Left-hand Bat,Right-arm Medium,England,Player,Rajasthan Royals,Kings Xi Punjab,2010,0,30,1,Blank,Blank,Sk Warne,Kc Sangakkara,Nv Ojha,Kc Sangakkara,1980-02-12
15639,41912900229,419129,229,Fy Fazal,9/7/1985,Left-hand Bat,Right-arm Medium,India,Player,Rajasthan Royals,Kings Xi Punjab,2010,0,25,1,Blank,Blank,Sk Warne,Kc Sangakkara,Nv Ojha,Kc Sangakkara,1985-09-07
15641,41912900238,419129,238,Sw Tait,2/22/1983,Right-hand Bat,Right-arm Fast,Australia,Player,Rajasthan Royals,Kings Xi Punjab,2010,0,27,1,Blank,Blank,Sk Warne,Kc Sangakkara,Nv Ojha,Kc Sangakkara,1983-02-22
15643,41913000042,419130,42,S Dhawan,12/5/1985,Left-hand Bat,Right-arm Offbreak,India,Player,Mumbai Indians,Chennai Super Kings,2010,0,25,1,Blank,Blank,Sr Tendulkar,Ms Dhoni,Ap Tare,Ms Dhoni,1985-12-05
15644,41913000050,419130,50,Harbhajan Singh,7/3/1980,Right-hand Bat,Right-arm Offbreak,India,Player,Mumbai Indians,Chennai Super Kings,2010,0,30,1,Blank,Blank,Sr Tendulkar,Ms Dhoni,Ap Tare,Ms Dhoni,1980-07-03
15645,41913000071,419130,71,Dj Bravo,10/7/1983,Right-hand Bat,Right-arm Medium-fast,West Indies,Player,Mumbai Indians,Chennai Super Kings,2010,0,27,1,Blank,Blank,Sr Tendulkar,Ms Dhoni,Ap Tare,Ms Dhoni,1983-10-07
15646,41913000079,419130,79,Ss Tiwary,12/30/1989,Left-hand Bat,N/a,India,Player,Mumbai Indians,Chennai Super Kings,2010,0,21,1,Blank,Blank,Sr Tendulkar,Ms Dhoni,Ap Tare,Ms Dhoni,1989-12-30
15647,41913000133,419130,133,Sr Tendulkar,4/24/1973,Right-hand Bat,Right-arm Offbreak,India,Captain,Mumbai Indians,Chennai Super Kings,2010,1,37,1,Blank,Blank,Sr Tendulkar,Ms Dhoni,Ap Tare,Ms Dhoni,1973-04-24
15651,41913000210,419130,210,R Mclaren,2/9/1983,Left-hand Bat,Right-arm Medium-fast,South Africa,Player,Mumbai Indians,Chennai Super Kings,2010,0,27,1,Blank,Blank,Sr Tendulkar,Ms Dhoni,Ap Tare,Ms Dhoni,1983-02-09
15653,41913000017,419130,17,Pa Patel,3/9/1985,Left-hand Bat,N/a,India,Player,Chennai Super Kings,Mumbai Indians,2010,0,25,0,Blank,Blank,Ms Dhoni,Sr Tendulkar,Ms Dhoni,Ap Tare,1985-03-09
15656,41913000021,419130,21,Sk Raina,11/27/1986,Left-hand Bat,Right-arm Offbreak,India,Player,Chennai Super Kings,Mumbai Indians,2010,0,24,0,Blank,Blank,Ms Dhoni,Sr Tendulkar,Ms Dhoni,Ap Tare,1986-11-27
15657,41913000023,419130,23,S Badrinath,8/30/1980,Right-hand Bat,Right-arm Offbreak,India,Player,Chennai Super Kings,Mumbai Indians,2010,0,30,0,Blank,Blank,Ms Dhoni,Sr Tendulkar,Ms Dhoni,Ap Tare,1980-08-30
15658,41913000109,419130,109,Ja Morkel,6/10/1981,Left-hand Bat,Right-arm Medium-fast,South Africa,Player,Chennai Super Kings,Mumbai Indians,2010,0,29,0,Blank,Blank,Ms Dhoni,Sr Tendulkar,Ms Dhoni,Ap Tare,1981-06-10
15662,41913000186,419130,186,Sb Jakati,11/27/1980,Left-hand Bat,Slow Left-arm Orthodox,India,Player,Chennai Super Kings,Mumbai Indians,2010,0,30,0,Blank,Blank,Ms Dhoni,Sr Tendulkar,Ms Dhoni,Ap Tare,1980-11-27
15666,41913100055,419131,55,Vvs Laxman,11/1/1974,Right-hand Bat,Right-arm Offbreak,India,Player,Deccan Chargers,Rajasthan Royals,2010,0,36,0,Blank,Blank,Ac Gilchrist,Sk Warne,Ac Gilchrist,Nv Ojha,1974-11-01
15667,41913100056,419131,56,A Symonds,6/9/1975,Right-hand Bat,Right-arm Offbreak,Australia,Player,Deccan Chargers,Rajasthan Royals,2010,0,35,0,Blank,Blank,Ac Gilchrist,Sk Warne,Ac Gilchrist,Nv Ojha,1975-06-09
15671,41913100097,419131,97,Hh Gibbs,2/23/1974,Right-hand Bat,Right-arm Bowler,South Africa,Player,Deccan Chargers,Rajasthan Royals,2010,0,36,0,Blank,Blank,Ac Gilchrist,Sk Warne,Ac Gilchrist,Nv Ojha,1974-02-23
15673,41913100178,419131,178,Tl Suman,12/15/1983,Right-hand Bat,Right-arm Offbreak,India,Player,Deccan Chargers,Rajasthan Royals,2010,0,27,0,Blank,Blank,Ac Gilchrist,Sk Warne,Ac Gilchrist,Nv Ojha,1983-12-15
15674,41913100235,419131,235,R Sharma,4/30/1987,Right-hand Bat,Right-arm Offbreak,India,Player,Deccan Chargers,Rajasthan Royals,2010,0,23,0,Blank,Blank,Ac Gilchrist,Sk Warne,Ac Gilchrist,Nv Ojha,1987-04-30
15675,41913100031,419131,31,Yk Pathan,11/17/1982,Right-hand Bat,Right-arm Offbreak,India,Player,Rajasthan Royals,Deccan Chargers,2010,1,28,1,Blank,Blank,Sk Warne,Ac Gilchrist,Nv Ojha,Ac Gilchrist,1982-11-17
15678,41913100183,419131,183,Nv Ojha,7/20/1983,Right-hand Bat,N/a,India,Keeper,Rajasthan Royals,Deccan Chargers,2010,0,27,1,Blank,Blank,Sk Warne,Ac Gilchrist,Nv Ojha,Ac Gilchrist,1983-07-20
15680,41913100212,419131,212,P Dogra,11/19/1984,Right-hand Bat,Legbreak,India,Player,Rajasthan Royals,Deccan Chargers,2010,0,26,1,Blank,Blank,Sk Warne,Ac Gilchrist,Nv Ojha,Ac Gilchrist,1984-11-19
15682,41913100226,419131,226,S Narwal,4/16/1982,Left-hand Bat,Right-arm Medium,India,Player,Rajasthan Royals,Deccan Chargers,2010,0,28,1,Blank,Blank,Sk Warne,Ac Gilchrist,Nv Ojha,Ac Gilchrist,1982-04-16
15683,41913100229,419131,229,Fy Fazal,9/7/1985,Left-hand Bat,Right-arm Medium,India,Player,Rajasthan Royals,Deccan Chargers,2010,0,25,1,Blank,Blank,Sk Warne,Ac Gilchrist,Nv Ojha,Ac Gilchrist,1985-09-07
15696,41913200243,419132,243,Vs Malik,5/9/1983,Right-hand Bat,Right-arm Medium,India,Player,Kings Xi Punjab,Kolkata Knight Riders,2010,0,27,0,Blank,Blank,Kc Sangakkara,Sc Ganguly,Kc Sangakkara,Wp Saha,1983-05-09
15698,41913200004,419132,4,Dj Hussey,7/15/1977,Right-hand Bat,Right-arm Offbreak,Australia,Player,Kolkata Knight Riders,Kings Xi Punjab,2010,0,33,1,Blank,Blank,Sc Ganguly,Kc Sangakkara,Wp Saha,Kc Sangakkara,1977-07-15
15699,41913200062,419132,62,Wp Saha,10/24/1984,Right-hand Bat,N/a,India,Keeper,Kolkata Knight Riders,Kings Xi Punjab,2010,0,26,1,Blank,Blank,Sc Ganguly,Kc Sangakkara,Wp Saha,Kc Sangakkara,1984-10-24
15700,41913200082,419132,82,Ab Agarkar,12/4/1977,Right-hand Bat,Right-arm Fast,India,Player,Kolkata Knight Riders,Kings Xi Punjab,2010,0,33,1,Blank,Blank,Sc Ganguly,Kc Sangakkara,Wp Saha,Kc Sangakkara,1977-12-04
15704,41913200162,419132,162,Ch Gayle,9/21/1979,Left-hand Bat,Right-arm Offbreak,West Indies,Player,Kolkata Knight Riders,Kings Xi Punjab,2010,0,31,1,Blank,Blank,Sc Ganguly,Kc Sangakkara,Wp Saha,Kc Sangakkara,1979-09-21
15705,41913200191,419132,191,Ad Mathews,6/2/1987,Right-hand Bat,Right-arm Fast-medium,Sri Lanka,Player,Kolkata Knight Riders,Kings Xi Punjab,2010,0,23,1,Blank,Blank,Sc Ganguly,Kc Sangakkara,Wp Saha,Kc Sangakkara,1987-06-02
15706,41913200220,419132,220,Se Bond,6/7/1975,Right-hand Bat,Right-arm Fast,New Zealand,Player,Kolkata Knight Riders,Kings Xi Punjab,2010,0,35,1,Blank,Blank,Sc Ganguly,Kc Sangakkara,Wp Saha,Kc Sangakkara,1975-06-07
15707,41913200236,419132,236,Mandeep Singh,12/18/1991,Right-hand Bat,Right-arm Medium,India,Player,Kolkata Knight Riders,Kings Xi Punjab,2010,0,19,1,Blank,Blank,Sc Ganguly,Kc Sangakkara,Wp Saha,Kc Sangakkara,1991-12-18
15714,41913300187,419133,187,Da Warner,10/27/1986,Left-hand Bat,Legbreak,Australia,Player,Delhi Daredevils,Royal Challengers Bangalore,2010,0,24,1,Blank,Blank,Kd Karthik,A Kumble,Kd Karthik,Mv Boucher,1986-10-27
15719,41913300006,419133,6,R Dravid,1/11/1973,Right-hand Bat,Right-arm Offbreak,India,Player,Royal Challengers Bangalore,Delhi Daredevils,2010,0,37,0,Blank,Blank,A Kumble,Kd Karthik,Mv Boucher,Kd Karthik,1973-01-11
15720,41913300008,419133,8,V Kohli,11/5/1988,Right-hand Bat,Right-arm Medium,India,Player,Royal Challengers Bangalore,Delhi Daredevils,2010,0,22,0,Blank,Blank,A Kumble,Kd Karthik,Mv Boucher,Kd Karthik,1988-11-05
15726,41913300094,419133,94,Dw Steyn,6/27/1983,Right-hand Bat,Right-arm Fast,South Africa,Player,Royal Challengers Bangalore,Delhi Daredevils,2010,0,27,0,Blank,Blank,A Kumble,Kd Karthik,Mv Boucher,Kd Karthik,1983-06-27
15727,41913300096,419133,96,Mk Pandey,9/10/1989,Right-hand Bat,Right-arm Medium,India,Player,Royal Challengers Bangalore,Delhi Daredevils,2010,0,21,0,Blank,Blank,A Kumble,Kd Karthik,Mv Boucher,Kd Karthik,1989-09-10
15729,41913300216,419133,216,Ejg Morgan,9/10/1986,Left-hand Bat,Right-arm Medium,England,Player,Royal Challengers Bangalore,Delhi Daredevils,2010,0,24,0,Blank,Blank,A Kumble,Kd Karthik,Mv Boucher,Kd Karthik,1986-09-10
15731,41913400020,419134,20,Ms Dhoni,7/7/1981,Right-hand Bat,Right-arm Medium,India,Captainkeeper,Chennai Super Kings,Rajasthan Royals,2010,0,29,0,Blank,Blank,Ms Dhoni,Sk Warne,Ms Dhoni,Nv Ojha,1981-07-07
15734,41913400109,419134,109,Ja Morkel,6/10/1981,Left-hand Bat,Right-arm Medium-fast,South Africa,Player,Chennai Super Kings,Rajasthan Royals,2010,0,29,0,Blank,Blank,Ms Dhoni,Sk Warne,Ms Dhoni,Nv Ojha,1981-06-10
15738,41913400185,419134,185,M Vijay,4/1/1984,Right-hand Bat,Right-arm Offbreak,India,Player,Chennai Super Kings,Rajasthan Royals,2010,0,26,0,Blank,Blank,Ms Dhoni,Sk Warne,Ms Dhoni,Nv Ojha,1984-04-01
15739,41913400186,419134,186,Sb Jakati,11/27/1980,Left-hand Bat,Slow Left-arm Orthodox,India,Player,Chennai Super Kings,Rajasthan Royals,2010,0,30,0,Blank,Blank,Ms Dhoni,Sk Warne,Ms Dhoni,Nv Ojha,1980-11-27
15741,41913400031,419134,31,Yk Pathan,11/17/1982,Right-hand Bat,Right-arm Offbreak,India,Player,Rajasthan Royals,Chennai Super Kings,2010,0,28,1,Blank,Blank,Sk Warne,Ms Dhoni,Nv Ojha,Ms Dhoni,1982-11-17
15747,41913400224,419134,224,Mj Lumb,2/12/1980,Left-hand Bat,Right-arm Medium,England,Player,Rajasthan Royals,Chennai Super Kings,2010,0,30,1,Blank,Blank,Sk Warne,Ms Dhoni,Nv Ojha,Ms Dhoni,1980-02-12
15750,41913400230,419134,230,Ac Voges,10/4/1979,Right-hand Bat,Slow Left-arm Orthodox,Australia,Player,Rajasthan Royals,Chennai Super Kings,2010,0,31,1,Blank,Blank,Sk Warne,Ms Dhoni,Nv Ojha,Ms Dhoni,1979-10-04
15753,41913500054,419135,54,Y Venugopal Rao,2/26/1982,Right-hand Bat,Right-arm Offbreak,India,Player,Deccan Chargers,Mumbai Indians,2010,0,28,0,Blank,Blank,Ac Gilchrist,Sr Tendulkar,Ac Gilchrist,At Rayudu,1982-02-26
15755,41913500057,419135,57,Rg Sharma,4/30/1987,Right-hand Bat,Right-arm Offbreak,India,Player,Deccan Chargers,Mumbai Indians,2010,0,23,0,Blank,Blank,Ac Gilchrist,Sr Tendulkar,Ac Gilchrist,At Rayudu,1987-04-30
15756,41913500061,419135,61,Rp Singh,12/6/1985,Right-hand Bat,Left-arm Fast-medium,India,Player,Deccan Chargers,Mumbai Indians,2010,0,25,0,Blank,Blank,Ac Gilchrist,Sr Tendulkar,Ac Gilchrist,At Rayudu,1985-12-06
15759,41913500178,419135,178,Tl Suman,12/15/1983,Right-hand Bat,Right-arm Offbreak,India,Player,Deccan Chargers,Mumbai Indians,2010,0,27,0,Blank,Blank,Ac Gilchrist,Sr Tendulkar,Ac Gilchrist,At Rayudu,1983-12-15
15761,41913500231,419135,231,Md Mishra,2/9/1984,Right-hand Bat,Right-arm Offbreak,India,Player,Deccan Chargers,Mumbai Indians,2010,0,26,0,Blank,Blank,Ac Gilchrist,Sr Tendulkar,Ac Gilchrist,At Rayudu,1984-02-09
15762,41913500240,419135,240,Kaj Roach,6/30/1988,Right-hand Bat,Right-arm Fast,West Indies,Player,Deccan Chargers,Mumbai Indians,2010,0,22,0,Blank,Blank,Ac Gilchrist,Sr Tendulkar,Ac Gilchrist,At Rayudu,1988-06-30
15763,41913500015,419135,15,Z Khan,10/7/1978,Right-hand Bat,Left-arm Fast-medium,India,Player,Mumbai Indians,Deccan Chargers,2010,0,32,1,Blank,Blank,Sr Tendulkar,Ac Gilchrist,At Rayudu,Ac Gilchrist,1978-10-07
15765,41913500050,419135,50,Harbhajan Singh,7/3/1980,Right-hand Bat,Right-arm Offbreak,India,Player,Mumbai Indians,Deccan Chargers,2010,1,30,1,Blank,Blank,Sr Tendulkar,Ac Gilchrist,At Rayudu,Ac Gilchrist,1980-07-03
15766,41913500071,419135,71,Dj Bravo,10/7/1983,Right-hand Bat,Right-arm Medium-fast,West Indies,Player,Mumbai Indians,Deccan Chargers,2010,0,27,1,Blank,Blank,Sr Tendulkar,Ac Gilchrist,At Rayudu,Ac Gilchrist,1983-10-07
15767,41913500079,419135,79,Ss Tiwary,12/30/1989,Left-hand Bat,N/a,India,Player,Mumbai Indians,Deccan Chargers,2010,0,21,1,Blank,Blank,Sr Tendulkar,Ac Gilchrist,At Rayudu,Ac Gilchrist,1989-12-30
15768,41913500133,419135,133,Sr Tendulkar,4/24/1973,Right-hand Bat,Right-arm Offbreak,India,Captain,Mumbai Indians,Deccan Chargers,2010,0,37,1,Blank,Blank,Sr Tendulkar,Ac Gilchrist,At Rayudu,Ac Gilchrist,1973-04-24
15769,41913500194,419135,194,Sl Malinga,8/28/1983,Right-hand Bat,Right-arm Fast,Sri Lanka,Player,Mumbai Indians,Deccan Chargers,2010,0,27,1,Blank,Blank,Sr Tendulkar,Ac Gilchrist,At Rayudu,Ac Gilchrist,1983-08-28
15770,41913500208,419135,208,At Rayudu,9/23/1985,Right-hand Bat,Right-arm Offbreak,India,Keeper,Mumbai Indians,Deccan Chargers,2010,0,25,1,Blank,Blank,Sr Tendulkar,Ac Gilchrist,At Rayudu,Ac Gilchrist,1985-09-23
15772,41913500210,419135,210,R Mclaren,2/9/1983,Left-hand Bat,Right-arm Medium-fast,South Africa,Player,Mumbai Indians,Deccan Chargers,2010,0,27,1,Blank,Blank,Sr Tendulkar,Ac Gilchrist,At Rayudu,Ac Gilchrist,1983-02-09
15774,41913600040,419136,40,G Gambhir,10/14/1981,Left-hand Bat,Legbreak,India,Captain,Delhi Daredevils,Kolkata Knight Riders,2010,0,29,1,Blank,Blank,G Gambhir,Sc Ganguly,Kd Karthik,Wp Saha,1981-10-14
15776,41913600088,419136,88,Kd Karthik,6/1/1985,Right-hand Bat,N/a,India,Keeper,Delhi Daredevils,Kolkata Knight Riders,2010,0,25,1,Blank,Blank,G Gambhir,Sc Ganguly,Kd Karthik,Wp Saha,1985-06-01
15777,41913600089,419136,89,R Bhatia,10/22/1979,Right-hand Bat,Right-arm Medium-fast,India,Player,Delhi Daredevils,Kolkata Knight Riders,2010,0,31,1,Blank,Blank,G Gambhir,Sc Ganguly,Kd Karthik,Wp Saha,1979-10-22
15779,41913600187,419136,187,Da Warner,10/27/1986,Left-hand Bat,Legbreak,Australia,Player,Delhi Daredevils,Kolkata Knight Riders,2010,1,24,1,Blank,Blank,G Gambhir,Sc Ganguly,Kd Karthik,Wp Saha,1986-10-27
15782,41913600232,419136,232,Ut Yadav,10/25/1987,Right-hand Bat,Right-arm Fast-medium,India,Player,Delhi Daredevils,Kolkata Knight Riders,2010,0,23,1,Blank,Blank,G Gambhir,Sc Ganguly,Kd Karthik,Wp Saha,1987-10-25
15784,41913600241,419136,241,Pd Collingwood,5/26/1976,Right-hand Bat,Right-arm Medium,England,Player,Delhi Daredevils,Kolkata Knight Riders,2010,0,34,1,Blank,Blank,G Gambhir,Sc Ganguly,Kd Karthik,Wp Saha,1976-05-26
15786,41913600004,419136,4,Dj Hussey,7/15/1977,Right-hand Bat,Right-arm Offbreak,Australia,Player,Kolkata Knight Riders,Delhi Daredevils,2010,0,33,0,Blank,Blank,Sc Ganguly,G Gambhir,Wp Saha,Kd Karthik,1977-07-15
15787,41913600062,419136,62,Wp Saha,10/24/1984,Right-hand Bat,N/a,India,Keeper,Kolkata Knight Riders,Delhi Daredevils,2010,0,26,0,Blank,Blank,Sc Ganguly,G Gambhir,Wp Saha,Kd Karthik,1984-10-24
15788,41913600082,419136,82,Ab Agarkar,12/4/1977,Right-hand Bat,Right-arm Fast,India,Player,Kolkata Knight Riders,Delhi Daredevils,2010,0,33,0,Blank,Blank,Sc Ganguly,G Gambhir,Wp Saha,Kd Karthik,1977-12-04
15789,41913600083,419136,83,M Kartik,9/11/1976,Left-hand Bat,Slow Left-arm Orthodox,India,Player,Kolkata Knight Riders,Delhi Daredevils,2010,0,34,0,Blank,Blank,Sc Ganguly,G Gambhir,Wp Saha,Kd Karthik,1976-09-11
15790,41913600084,419136,84,I Sharma,9/2/1988,Right-hand Bat,Right-arm Fast-medium,India,Player,Kolkata Knight Riders,Delhi Daredevils,2010,0,22,0,Blank,Blank,Sc Ganguly,G Gambhir,Wp Saha,Kd Karthik,1988-09-02
15794,41913600236,419136,236,Mandeep Singh,12/18/1991,Right-hand Bat,Right-arm Medium,India,Player,Kolkata Knight Riders,Delhi Daredevils,2010,0,19,0,Blank,Blank,Sc Ganguly,G Gambhir,Wp Saha,Kd Karthik,1991-12-18
15795,41913600242,419136,242,Ck Langeveldt,12/17/1974,Right-hand Bat,Right-arm Fast-medium,England,Player,Kolkata Knight Riders,Delhi Daredevils,2010,0,36,0,Blank,Blank,Sc Ganguly,G Gambhir,Wp Saha,Kd Karthik,1974-12-17
15797,41913700042,419137,42,S Dhawan,12/5/1985,Left-hand Bat,Right-arm Offbreak,India,Player,Mumbai Indians,Kings Xi Punjab,2010,0,25,1,Blank,Blank,Sr Tendulkar,Dpmd Jayawardene,At Rayudu,Ms Bisla,1985-12-05
15799,41913700071,419137,71,Dj Bravo,10/7/1983,Right-hand Bat,Right-arm Medium-fast,West Indies,Player,Mumbai Indians,Kings Xi Punjab,2010,0,27,1,Blank,Blank,Sr Tendulkar,Dpmd Jayawardene,At Rayudu,Ms Bisla,1983-10-07
15800,41913700079,419137,79,Ss Tiwary,12/30/1989,Left-hand Bat,N/a,India,Player,Mumbai Indians,Kings Xi Punjab,2010,0,21,1,Blank,Blank,Sr Tendulkar,Dpmd Jayawardene,At Rayudu,Ms Bisla,1989-12-30
15804,41913700209,419137,209,R Sathish,1/14/1981,Right-hand Bat,Right-arm Medium,India,Player,Mumbai Indians,Kings Xi Punjab,2010,0,29,1,Blank,Blank,Sr Tendulkar,Dpmd Jayawardene,At Rayudu,Ms Bisla,1981-01-14
15806,41913700221,419137,221,Ka Pollard,5/12/1987,Right-hand Bat,Right-arm Medium-fast,West Indies,Player,Mumbai Indians,Kings Xi Punjab,2010,0,23,1,Blank,Blank,Sr Tendulkar,Dpmd Jayawardene,At Rayudu,Ms Bisla,1987-05-12
15809,41913700029,419137,29,Ik Pathan,10/27/1984,Left-hand Bat,Left-arm Medium-fast,India,Player,Kings Xi Punjab,Mumbai Indians,2010,0,26,0,Blank,Blank,Dpmd Jayawardene,Sr Tendulkar,Ms Bisla,At Rayudu,1984-10-27
15815,41913700214,419137,214,Ms Bisla,12/27/1984,Right-hand Bat,N/a,India,Keeper,Kings Xi Punjab,Mumbai Indians,2010,0,26,0,Blank,Blank,Dpmd Jayawardene,Sr Tendulkar,Ms Bisla,At Rayudu,1984-12-27
15817,41913700243,419137,243,Vs Malik,5/9/1983,Right-hand Bat,Right-arm Medium,India,Player,Kings Xi Punjab,Mumbai Indians,2010,0,27,0,Blank,Blank,Dpmd Jayawardene,Sr Tendulkar,Ms Bisla,At Rayudu,1983-05-09
15821,41913800023,419138,23,S Badrinath,8/30/1980,Right-hand Bat,Right-arm Offbreak,India,Player,Chennai Super Kings,Royal Challengers Bangalore,2010,0,30,1,Blank,Blank,Ms Dhoni,A Kumble,Ms Dhoni,Rv Uthappa,1980-08-30
15824,41913800121,419138,121,M Muralitharan,4/17/1972,Right-hand Bat,Right-arm Offbreak,Sri Lanka,Player,Chennai Super Kings,Royal Challengers Bangalore,2010,0,38,1,Blank,Blank,Ms Dhoni,A Kumble,Ms Dhoni,Rv Uthappa,1972-04-17
15825,41913800156,419138,156,T Thushara,3/1/1981,Left-hand Bat,Left-arm Fast-medium,Sri Lanka,Player,Chennai Super Kings,Royal Challengers Bangalore,2010,0,29,1,Blank,Blank,Ms Dhoni,A Kumble,Ms Dhoni,Rv Uthappa,1981-03-01
15827,41913800186,419138,186,Sb Jakati,11/27/1980,Left-hand Bat,Slow Left-arm Orthodox,India,Player,Chennai Super Kings,Royal Challengers Bangalore,2010,0,30,1,Blank,Blank,Ms Dhoni,A Kumble,Ms Dhoni,Rv Uthappa,1980-11-27
15828,41913800443,419138,443,C Ganapathy,6/10/1981,Right-hand Bat,Right-arm Medium,India,Player,Chennai Super Kings,Royal Challengers Bangalore,2010,0,29,1,Blank,Blank,Ms Dhoni,A Kumble,Ms Dhoni,Rv Uthappa,1981-06-10
15830,41913800008,419138,8,V Kohli,11/5/1988,Right-hand Bat,Right-arm Medium,India,Player,Royal Challengers Bangalore,Chennai Super Kings,2010,0,22,0,Blank,Blank,A Kumble,Ms Dhoni,Rv Uthappa,Ms Dhoni,1988-11-05
15831,41913800009,419138,9,Jh Kallis,10/16/1975,Right-hand Bat,Right-arm Fast-medium,South Africa,Player,Royal Challengers Bangalore,Chennai Super Kings,2010,0,35,0,Blank,Blank,A Kumble,Ms Dhoni,Rv Uthappa,Ms Dhoni,1975-10-16
15833,41913800014,419138,14,P Kumar,10/2/1986,Right-hand Bat,Right-arm Medium,India,Player,Royal Challengers Bangalore,Chennai Super Kings,2010,0,24,0,Blank,Blank,A Kumble,Ms Dhoni,Rv Uthappa,Ms Dhoni,1986-10-02
15835,41913800081,419138,81,R Vinay Kumar,2/12/1984,Right-hand Bat,Right-arm Medium,India,Player,Royal Challengers Bangalore,Chennai Super Kings,2010,0,26,0,Blank,Blank,A Kumble,Ms Dhoni,Rv Uthappa,Ms Dhoni,1984-02-12
15836,41913800094,419138,94,Dw Steyn,6/27/1983,Right-hand Bat,Right-arm Fast,South Africa,Player,Royal Challengers Bangalore,Chennai Super Kings,2010,0,27,0,Blank,Blank,A Kumble,Ms Dhoni,Rv Uthappa,Ms Dhoni,1983-06-27
15839,41913800158,419138,158,Kp Pietersen,6/27/1980,Right-hand Bat,Right-arm Offbreak,South Africa,Player,Royal Challengers Bangalore,Chennai Super Kings,2010,0,30,0,Blank,Blank,A Kumble,Ms Dhoni,Rv Uthappa,Ms Dhoni,1980-06-27
15842,41913900088,419139,88,Kd Karthik,6/1/1985,Right-hand Bat,N/a,India,Keeper,Delhi Daredevils,Rajasthan Royals,2010,1,25,1,Blank,Blank,G Gambhir,Sk Warne,Kd Karthik,Nv Ojha,1985-06-01
15843,41913900090,419139,90,Mf Maharoof,9/7/1984,Right-hand Bat,Right-arm Fast-medium,India,Player,Delhi Daredevils,Rajasthan Royals,2010,0,26,1,Blank,Blank,G Gambhir,Sk Warne,Kd Karthik,Nv Ojha,1984-09-07
15845,41913900187,419139,187,Da Warner,10/27/1986,Left-hand Bat,Legbreak,Australia,Player,Delhi Daredevils,Rajasthan Royals,2010,0,24,1,Blank,Blank,G Gambhir,Sk Warne,Kd Karthik,Nv Ojha,1986-10-27
15847,41913900222,419139,222,S Ladda,7/10/1986,Right-hand Bat,Legbreak,India,Player,Delhi Daredevils,Rajasthan Royals,2010,0,24,1,Blank,Blank,G Gambhir,Sk Warne,Kd Karthik,Nv Ojha,1986-07-10
15852,41913900038,419139,38,Sk Warne,9/13/1969,Right-hand Bat,Legbreak Googly,Australia,Captain,Rajasthan Royals,Delhi Daredevils,2010,0,41,0,Blank,Blank,Sk Warne,G Gambhir,Nv Ojha,Kd Karthik,1969-09-13
15853,41913900039,419139,39,Sk Trivedi,9/4/1982,Right-hand Bat,Right-arm Medium,India,Player,Rajasthan Royals,Delhi Daredevils,2010,0,28,0,Blank,Blank,Sk Warne,G Gambhir,Nv Ojha,Kd Karthik,1982-09-04
15857,41913900224,419139,224,Mj Lumb,2/12/1980,Left-hand Bat,Right-arm Medium,England,Player,Rajasthan Royals,Delhi Daredevils,2010,0,30,0,Blank,Blank,Sk Warne,G Gambhir,Nv Ojha,Kd Karthik,1980-02-12
15859,41913900229,419139,229,Fy Fazal,9/7/1985,Left-hand Bat,Right-arm Medium,India,Player,Rajasthan Royals,Delhi Daredevils,2010,0,25,0,Blank,Blank,Sk Warne,G Gambhir,Nv Ojha,Kd Karthik,1985-09-07
15863,41914000054,419140,54,Y Venugopal Rao,2/26/1982,Right-hand Bat,Right-arm Offbreak,India,Player,Deccan Chargers,Kolkata Knight Riders,2010,0,28,0,Blank,Blank,Ac Gilchrist,Sc Ganguly,Ac Gilchrist,Wp Saha,1982-02-26
15870,41914000231,419140,231,Md Mishra,2/9/1984,Right-hand Bat,Right-arm Offbreak,India,Player,Deccan Chargers,Kolkata Knight Riders,2010,0,26,0,Blank,Blank,Ac Gilchrist,Sc Ganguly,Ac Gilchrist,Wp Saha,1984-02-09
15872,41914000256,419140,256,Harmeet Singh,9/7/1992,Left-hand Bat,Slow Left-arm Orthodox,India,Player,Deccan Chargers,Kolkata Knight Riders,2010,0,18,0,Blank,Blank,Ac Gilchrist,Sc Ganguly,Ac Gilchrist,Wp Saha,1992-09-07
15875,41914000062,419140,62,Wp Saha,10/24/1984,Right-hand Bat,N/a,India,Keeper,Kolkata Knight Riders,Deccan Chargers,2010,0,26,1,Blank,Blank,Sc Ganguly,Ac Gilchrist,Wp Saha,Ac Gilchrist,1984-10-24
15877,41914000083,419140,83,M Kartik,9/11/1976,Left-hand Bat,Slow Left-arm Orthodox,India,Player,Kolkata Knight Riders,Deccan Chargers,2010,0,34,1,Blank,Blank,Sc Ganguly,Ac Gilchrist,Wp Saha,Ac Gilchrist,1976-09-11
15878,41914000087,419140,87,Mk Tiwary,11/14/1985,Right-hand Bat,Legbreak Googly,India,Player,Kolkata Knight Riders,Deccan Chargers,2010,0,25,1,Blank,Blank,Sc Ganguly,Ac Gilchrist,Wp Saha,Ac Gilchrist,1985-11-14
15879,41914000162,419140,162,Ch Gayle,9/21/1979,Left-hand Bat,Right-arm Offbreak,West Indies,Player,Kolkata Knight Riders,Deccan Chargers,2010,0,31,1,Blank,Blank,Sc Ganguly,Ac Gilchrist,Wp Saha,Ac Gilchrist,1979-09-21
15881,41914000203,419140,203,Ca Pujara,1/25/1988,Right-hand Bat,Legbreak,India,Player,Kolkata Knight Riders,Deccan Chargers,2010,0,22,1,Blank,Blank,Sc Ganguly,Ac Gilchrist,Wp Saha,Ac Gilchrist,1988-01-25
15883,41914000444,419140,444,Mb Parmar,4/12/1988,Right-hand Bat,Right-arm Offbreak,India,Player,Kolkata Knight Riders,Deccan Chargers,2010,0,22,1,Blank,Blank,Sc Ganguly,Ac Gilchrist,Wp Saha,Ac Gilchrist,1988-04-12
15884,41914100026,419141,26,Kc Sangakkara,10/27/1977,Left-hand Bat,Right-arm Offbreak,Sri Lanka,Captainkeeper,Kings Xi Punjab,Royal Challengers Bangalore,2010,0,33,0,Blank,Blank,Kc Sangakkara,A Kumble,Kc Sangakkara,Rv Uthappa,1977-10-27
15892,41914100214,419141,214,Ms Bisla,12/27/1984,Right-hand Bat,N/a,India,Player,Kings Xi Punjab,Royal Challengers Bangalore,2010,0,26,0,Blank,Blank,Kc Sangakkara,A Kumble,Kc Sangakkara,Rv Uthappa,1984-12-27
15895,41914100006,419141,6,R Dravid,1/11/1973,Right-hand Bat,Right-arm Offbreak,India,Player,Royal Challengers Bangalore,Kings Xi Punjab,2010,0,37,1,Blank,Blank,A Kumble,Kc Sangakkara,Rv Uthappa,Kc Sangakkara,1973-01-11
15896,41914100008,419141,8,V Kohli,11/5/1988,Right-hand Bat,Right-arm Medium,India,Player,Royal Challengers Bangalore,Kings Xi Punjab,2010,0,22,1,Blank,Blank,A Kumble,Kc Sangakkara,Rv Uthappa,Kc Sangakkara,1988-11-05
15897,41914100009,419141,9,Jh Kallis,10/16/1975,Right-hand Bat,Right-arm Fast-medium,South Africa,Player,Royal Challengers Bangalore,Kings Xi Punjab,2010,0,35,1,Blank,Blank,A Kumble,Kc Sangakkara,Rv Uthappa,Kc Sangakkara,1975-10-16
15899,41914100014,419141,14,P Kumar,10/2/1986,Right-hand Bat,Right-arm Medium,India,Player,Royal Challengers Bangalore,Kings Xi Punjab,2010,0,24,1,Blank,Blank,A Kumble,Kc Sangakkara,Rv Uthappa,Kc Sangakkara,1986-10-02
15900,41914100046,419141,46,Rv Uthappa,11/11/1985,Right-hand Bat,Right-arm Medium,India,Keeper,Royal Challengers Bangalore,Kings Xi Punjab,2010,0,25,1,Blank,Blank,A Kumble,Kc Sangakkara,Rv Uthappa,Kc Sangakkara,1985-11-11
15904,41914100124,419141,124,A Kumble,10/17/1970,Right-hand Bat,Legbreak Googly,India,Captain,Royal Challengers Bangalore,Kings Xi Punjab,2010,0,40,1,Blank,Blank,A Kumble,Kc Sangakkara,Rv Uthappa,Kc Sangakkara,1970-10-17
15906,41914200018,419142,18,Ml Hayden,10/29/1971,Left-hand Bat,Right-arm Medium,Australia,Player,Chennai Super Kings,Rajasthan Royals,2010,0,39,1,Blank,Blank,Ms Dhoni,Sk Warne,Ms Dhoni,Nv Ojha,1971-10-29
15911,41914200121,419142,121,M Muralitharan,4/17/1972,Right-hand Bat,Right-arm Offbreak,Sri Lanka,Player,Chennai Super Kings,Rajasthan Royals,2010,0,38,1,Blank,Blank,Ms Dhoni,Sk Warne,Ms Dhoni,Nv Ojha,1972-04-17
15912,41914200125,419142,125,S Anirudha,4/14/1987,Right-hand Bat,N/a,India,Player,Chennai Super Kings,Rajasthan Royals,2010,0,23,1,Blank,Blank,Ms Dhoni,Sk Warne,Ms Dhoni,Nv Ojha,1987-04-14
15918,41914200032,419142,32,Sr Watson,6/17/1981,Right-hand Bat,Right-arm Fast-medium,Australia,Player,Rajasthan Royals,Chennai Super Kings,2010,0,29,0,Blank,Blank,Sk Warne,Ms Dhoni,Nv Ojha,Ms Dhoni,1981-06-17
15926,41914200238,419142,238,Sw Tait,2/22/1983,Right-hand Bat,Right-arm Fast,Australia,Player,Rajasthan Royals,Chennai Super Kings,2010,0,27,0,Blank,Blank,Sk Warne,Ms Dhoni,Nv Ojha,Ms Dhoni,1983-02-22
15927,41914200273,419142,273,Sb Wagh,10/9/1988,Left-hand Bat,Left-arm Medium-fast,India,Player,Rajasthan Royals,Chennai Super Kings,2010,0,22,0,Blank,Blank,Sk Warne,Ms Dhoni,Nv Ojha,Ms Dhoni,1988-10-09
15929,41914300055,419143,55,Vvs Laxman,11/1/1974,Right-hand Bat,Right-arm Offbreak,India,Player,Deccan Chargers,Mumbai Indians,2010,0,36,0,Blank,Blank,Ac Gilchrist,Sr Tendulkar,Ac Gilchrist,At Rayudu,1974-11-01
15932,41914300097,419143,97,Hh Gibbs,2/23/1974,Right-hand Bat,Right-arm Bowler,South Africa,Player,Deccan Chargers,Mumbai Indians,2010,0,36,0,Blank,Blank,Ac Gilchrist,Sr Tendulkar,Ac Gilchrist,At Rayudu,1974-02-23
15936,41914300206,419143,206,Jaskaran Singh,9/4/1989,Right-hand Bat,Right-arm Medium,India,Player,Deccan Chargers,Mumbai Indians,2010,0,21,0,Blank,Blank,Ac Gilchrist,Sr Tendulkar,Ac Gilchrist,At Rayudu,1989-09-04
15939,41914300015,419143,15,Z Khan,10/7/1978,Right-hand Bat,Left-arm Fast-medium,India,Player,Mumbai Indians,Deccan Chargers,2010,0,32,1,Blank,Blank,Sr Tendulkar,Ac Gilchrist,At Rayudu,Ac Gilchrist,1978-10-07
15940,41914300042,419143,42,S Dhawan,12/5/1985,Left-hand Bat,Right-arm Offbreak,India,Player,Mumbai Indians,Deccan Chargers,2010,0,25,1,Blank,Blank,Sr Tendulkar,Ac Gilchrist,At Rayudu,Ac Gilchrist,1985-12-05
15948,41914300210,419143,210,R Mclaren,2/9/1983,Left-hand Bat,Right-arm Medium-fast,South Africa,Player,Mumbai Indians,Deccan Chargers,2010,0,27,1,Blank,Blank,Sr Tendulkar,Ac Gilchrist,At Rayudu,Ac Gilchrist,1983-02-09
15951,41914400027,419144,27,Yuvraj Singh,12/12/1981,Left-hand Bat,Slow Left-arm Orthodox,India,Player,Kings Xi Punjab,Kolkata Knight Riders,2010,0,29,1,Blank,Blank,Kc Sangakkara,Sc Ganguly,Ms Bisla,Wp Saha,1981-12-12
15952,41914400029,419144,29,Ik Pathan,10/27/1984,Left-hand Bat,Left-arm Medium-fast,India,Player,Kings Xi Punjab,Kolkata Knight Riders,2010,0,26,1,Blank,Blank,Kc Sangakkara,Sc Ganguly,Ms Bisla,Wp Saha,1984-10-27
15954,41914400067,419144,67,Pp Chawla,12/24/1988,Left-hand Bat,Legbreak,India,Player,Kings Xi Punjab,Kolkata Knight Riders,2010,0,22,1,Blank,Blank,Kc Sangakkara,Sc Ganguly,Ms Bisla,Wp Saha,1988-12-24
15955,41914400153,419144,153,Rr Powar,5/20/1978,Right-hand Bat,Right-arm Offbreak,India,Player,Kings Xi Punjab,Kolkata Knight Riders,2010,0,32,1,Blank,Blank,Kc Sangakkara,Sc Ganguly,Ms Bisla,Wp Saha,1978-05-20
15960,41914400234,419144,234,Sj Srivastava,9/22/1981,Right-hand Bat,Left-arm Fast-medium,India,Player,Kings Xi Punjab,Kolkata Knight Riders,2010,0,29,1,Blank,Blank,Kc Sangakkara,Sc Ganguly,Ms Bisla,Wp Saha,1981-09-22
15962,41914400004,419144,4,Dj Hussey,7/15/1977,Right-hand Bat,Right-arm Offbreak,Australia,Player,Kolkata Knight Riders,Kings Xi Punjab,2010,0,33,0,Blank,Blank,Sc Ganguly,Kc Sangakkara,Wp Saha,Ms Bisla,1977-07-15
15963,41914400062,419144,62,Wp Saha,10/24/1984,Right-hand Bat,N/a,India,Keeper,Kolkata Knight Riders,Kings Xi Punjab,2010,0,26,0,Blank,Blank,Sc Ganguly,Kc Sangakkara,Wp Saha,Ms Bisla,1984-10-24
15970,41914400220,419144,220,Se Bond,6/7/1975,Right-hand Bat,Right-arm Fast,New Zealand,Player,Kolkata Knight Riders,Kings Xi Punjab,2010,0,35,0,Blank,Blank,Sc Ganguly,Kc Sangakkara,Wp Saha,Ms Bisla,1975-06-07
15971,41914400346,419144,346,Jd Unadkat,10/18/1991,Right-hand Bat,Left-arm Medium,India,Player,Kolkata Knight Riders,Kings Xi Punjab,2010,0,19,0,Blank,Blank,Sc Ganguly,Kc Sangakkara,Wp Saha,Ms Bisla,1991-10-18
15974,41914500088,419145,88,Kd Karthik,6/1/1985,Right-hand Bat,N/a,India,Keeper,Delhi Daredevils,Royal Challengers Bangalore,2010,0,25,1,Blank,Blank,G Gambhir,A Kumble,Kd Karthik,Rv Uthappa,1985-06-01
15975,41914500089,419145,89,R Bhatia,10/22/1979,Right-hand Bat,Right-arm Medium-fast,India,Player,Delhi Daredevils,Royal Challengers Bangalore,2010,0,31,1,Blank,Blank,G Gambhir,A Kumble,Kd Karthik,Rv Uthappa,1979-10-22
15976,41914500090,419145,90,Mf Maharoof,9/7/1984,Right-hand Bat,Right-arm Fast-medium,India,Player,Delhi Daredevils,Royal Challengers Bangalore,2010,0,26,1,Blank,Blank,G Gambhir,A Kumble,Kd Karthik,Rv Uthappa,1984-09-07
15977,41914500116,419145,116,Pj Sangwan,11/5/1990,Right-hand Bat,Left-arm Medium,India,Player,Delhi Daredevils,Royal Challengers Bangalore,2010,0,20,1,Blank,Blank,G Gambhir,A Kumble,Kd Karthik,Rv Uthappa,1990-11-05
15978,41914500136,419145,136,A Mishra,11/24/1982,Right-hand Bat,Legbreak,India,Player,Delhi Daredevils,Royal Challengers Bangalore,2010,0,28,1,Blank,Blank,G Gambhir,A Kumble,Kd Karthik,Rv Uthappa,1982-11-24
15979,41914500175,419145,175,Dl Vettori,1/27/1979,Left-hand Bat,Slow Left-arm Orthodox,New Zealand,Player,Delhi Daredevils,Royal Challengers Bangalore,2010,0,31,1,Blank,Blank,G Gambhir,A Kumble,Kd Karthik,Rv Uthappa,1979-01-27
15980,41914500187,419145,187,Da Warner,10/27/1986,Left-hand Bat,Legbreak,Australia,Player,Delhi Daredevils,Royal Challengers Bangalore,2010,0,24,1,Blank,Blank,G Gambhir,A Kumble,Kd Karthik,Rv Uthappa,1986-10-27
15981,41914500237,419145,237,Km Jadhav,3/26/1985,Right-hand Bat,Right-arm Offbreak,India,Player,Delhi Daredevils,Royal Challengers Bangalore,2010,0,25,1,Blank,Blank,G Gambhir,A Kumble,Kd Karthik,Rv Uthappa,1985-03-26
15983,41914500006,419145,6,R Dravid,1/11/1973,Right-hand Bat,Right-arm Offbreak,India,Player,Royal Challengers Bangalore,Delhi Daredevils,2010,0,37,0,Blank,Blank,A Kumble,G Gambhir,Rv Uthappa,Kd Karthik,1973-01-11
15987,41914500046,419145,46,Rv Uthappa,11/11/1985,Right-hand Bat,Right-arm Medium,India,Keeper,Royal Challengers Bangalore,Delhi Daredevils,2010,0,25,0,Blank,Blank,A Kumble,G Gambhir,Rv Uthappa,Kd Karthik,1985-11-11
15992,41914500181,419145,181,Kp Appanna,12/20/1988,Right-hand Bat,Slow Left-arm Orthodox,India,Player,Royal Challengers Bangalore,Delhi Daredevils,2010,0,22,0,Blank,Blank,A Kumble,G Gambhir,Rv Uthappa,Kd Karthik,1988-12-20
15993,41914500244,419145,244,A Mithun,10/25/1989,Right-hand Bat,Right-arm Medium,India,Player,Royal Challengers Bangalore,Delhi Daredevils,2010,0,21,0,Blank,Blank,A Kumble,G Gambhir,Rv Uthappa,Kd Karthik,1989-10-25
15994,41914600053,419146,53,Ac Gilchrist,11/14/1971,Left-hand Bat,Right-arm Offbreak,Australia,Captainkeeper,Deccan Chargers,Rajasthan Royals,2010,0,39,0,Blank,Blank,Ac Gilchrist,Sk Warne,Ac Gilchrist,Nv Ojha,1971-11-14
15995,41914600055,419146,55,Vvs Laxman,11/1/1974,Right-hand Bat,Right-arm Offbreak,India,Player,Deccan Chargers,Rajasthan Royals,2010,0,36,0,Blank,Blank,Ac Gilchrist,Sk Warne,Ac Gilchrist,Nv Ojha,1974-11-01
15997,41914600057,419146,57,Rg Sharma,4/30/1987,Right-hand Bat,Right-arm Offbreak,India,Player,Deccan Chargers,Rajasthan Royals,2010,0,23,0,Blank,Blank,Ac Gilchrist,Sk Warne,Ac Gilchrist,Nv Ojha,1987-04-30
15999,41914600131,419146,131,Pp Ojha,9/5/1986,Left-hand Bat,Slow Left-arm Orthodox,India,Player,Deccan Chargers,Rajasthan Royals,2010,0,24,0,Blank,Blank,Ac Gilchrist,Sk Warne,Ac Gilchrist,Nv Ojha,1986-09-05
16006,41914600032,419146,32,Sr Watson,6/17/1981,Right-hand Bat,Right-arm Fast-medium,Australia,Player,Rajasthan Royals,Deccan Chargers,2010,0,29,1,Blank,Blank,Sk Warne,Ac Gilchrist,Nv Ojha,Ac Gilchrist,1981-06-17
16012,41914600211,419146,211,Aa Jhunjhunwala,12/1/1982,Right-hand Bat,Right-arm Offbreak,India,Player,Rajasthan Royals,Deccan Chargers,2010,0,28,1,Blank,Blank,Sk Warne,Ac Gilchrist,Nv Ojha,Ac Gilchrist,1982-12-01
16015,41914600245,419146,245,Ap Dole,10/9/1987,Right-hand Bat,Right-arm Medium-fast,India,Player,Rajasthan Royals,Deccan Chargers,2010,0,23,1,Blank,Blank,Sk Warne,Ac Gilchrist,Nv Ojha,Ac Gilchrist,1987-10-09
16019,41914700079,419147,79,Ss Tiwary,12/30/1989,Left-hand Bat,N/a,India,Player,Mumbai Indians,Chennai Super Kings,2010,0,21,0,Blank,Blank,Sr Tendulkar,Ms Dhoni,At Rayudu,Ms Dhoni,1989-12-30
16020,41914700133,419147,133,Sr Tendulkar,4/24/1973,Right-hand Bat,Right-arm Offbreak,India,Captain,Mumbai Indians,Chennai Super Kings,2010,0,37,0,Blank,Blank,Sr Tendulkar,Ms Dhoni,At Rayudu,Ms Dhoni,1973-04-24
16023,41914700209,419147,209,R Sathish,1/14/1981,Right-hand Bat,Right-arm Medium,India,Player,Mumbai Indians,Chennai Super Kings,2010,0,29,0,Blank,Blank,Sr Tendulkar,Ms Dhoni,At Rayudu,Ms Dhoni,1981-01-14
16024,41914700210,419147,210,R Mclaren,2/9/1983,Left-hand Bat,Right-arm Medium-fast,South Africa,Player,Mumbai Indians,Chennai Super Kings,2010,0,27,0,Blank,Blank,Sr Tendulkar,Ms Dhoni,At Rayudu,Ms Dhoni,1983-02-09
16025,41914700221,419147,221,Ka Pollard,5/12/1987,Right-hand Bat,Right-arm Medium-fast,West Indies,Player,Mumbai Indians,Chennai Super Kings,2010,0,23,0,Blank,Blank,Sr Tendulkar,Ms Dhoni,At Rayudu,Ms Dhoni,1987-05-12
16026,41914700246,419147,246,An Ahmed,11/5/1988,Right-hand Bat,Right-arm Medium-fast,India,Player,Mumbai Indians,Chennai Super Kings,2010,0,22,0,Blank,Blank,Sr Tendulkar,Ms Dhoni,At Rayudu,Ms Dhoni,1988-11-05
16028,41914700019,419147,19,Mek Hussey,5/27/1975,Left-hand Bat,Right-arm Medium,Australia,Player,Chennai Super Kings,Mumbai Indians,2010,0,35,1,Blank,Blank,Ms Dhoni,Sr Tendulkar,Ms Dhoni,At Rayudu,1975-05-27
16031,41914700023,419147,23,S Badrinath,8/30/1980,Right-hand Bat,Right-arm Offbreak,India,Player,Chennai Super Kings,Mumbai Indians,2010,0,30,1,Blank,Blank,Ms Dhoni,Sr Tendulkar,Ms Dhoni,At Rayudu,1980-08-30
16034,41914700186,419147,186,Sb Jakati,11/27/1980,Left-hand Bat,Slow Left-arm Orthodox,India,Player,Chennai Super Kings,Mumbai Indians,2010,0,30,1,Blank,Blank,Ms Dhoni,Sr Tendulkar,Ms Dhoni,At Rayudu,1980-11-27
16046,41914800214,419148,214,Ms Bisla,12/27/1984,Right-hand Bat,N/a,India,Keeper,Kings Xi Punjab,Rajasthan Royals,2010,0,26,0,Blank,Blank,Kc Sangakkara,Sk Warne,Ms Bisla,Nv Ojha,1984-12-27
16048,41914800233,419148,233,J Theron,7/24/1985,Right-hand Bat,Right-arm Medium-fast,South Africa,Player,Kings Xi Punjab,Rajasthan Royals,2010,0,25,0,Blank,Blank,Kc Sangakkara,Sk Warne,Ms Bisla,Nv Ojha,1985-07-24
16049,41914800031,419148,31,Yk Pathan,11/17/1982,Right-hand Bat,Right-arm Offbreak,India,Player,Rajasthan Royals,Kings Xi Punjab,2010,0,28,1,Blank,Blank,Sk Warne,Kc Sangakkara,Nv Ojha,Ms Bisla,1982-11-17
16050,41914800032,419148,32,Sr Watson,6/17/1981,Right-hand Bat,Right-arm Fast-medium,Australia,Player,Rajasthan Royals,Kings Xi Punjab,2010,0,29,1,Blank,Blank,Sk Warne,Kc Sangakkara,Nv Ojha,Ms Bisla,1981-06-17
16051,41914800038,419148,38,Sk Warne,9/13/1969,Right-hand Bat,Legbreak Googly,Australia,Captain,Rajasthan Royals,Kings Xi Punjab,2010,0,41,1,Blank,Blank,Sk Warne,Kc Sangakkara,Nv Ojha,Ms Bisla,1969-09-13
16053,41914800169,419148,169,As Raut,3/3/1987,Right-hand Bat,Legbreak Googly,India,Player,Rajasthan Royals,Kings Xi Punjab,2010,0,23,1,Blank,Blank,Sk Warne,Kc Sangakkara,Nv Ojha,Ms Bisla,1987-03-03
16060,41914900040,419149,40,G Gambhir,10/14/1981,Left-hand Bat,Legbreak,India,Captain,Delhi Daredevils,Kolkata Knight Riders,2010,0,29,0,Blank,Blank,G Gambhir,Sc Ganguly,Kd Karthik,Wp Saha,1981-10-14
16069,41914900237,419149,237,Km Jadhav,3/26/1985,Right-hand Bat,Right-arm Offbreak,India,Player,Delhi Daredevils,Kolkata Knight Riders,2010,0,25,0,Blank,Blank,G Gambhir,Sc Ganguly,Kd Karthik,Wp Saha,1985-03-26
16075,41914900087,419149,87,Mk Tiwary,11/14/1985,Right-hand Bat,Legbreak Googly,India,Player,Kolkata Knight Riders,Delhi Daredevils,2010,0,25,1,Blank,Blank,Sc Ganguly,G Gambhir,Wp Saha,Kd Karthik,1985-11-14
16080,41914900191,419149,191,Ad Mathews,6/2/1987,Right-hand Bat,Right-arm Fast-medium,Sri Lanka,Player,Kolkata Knight Riders,Delhi Daredevils,2010,0,23,1,Blank,Blank,Sc Ganguly,G Gambhir,Wp Saha,Kd Karthik,1987-06-02
16081,41914900203,419149,203,Ca Pujara,1/25/1988,Right-hand Bat,Legbreak,India,Player,Kolkata Knight Riders,Delhi Daredevils,2010,0,22,1,Blank,Blank,Sc Ganguly,G Gambhir,Wp Saha,Kd Karthik,1988-01-25
16082,41915000053,419150,53,Ac Gilchrist,11/14/1971,Left-hand Bat,Right-arm Offbreak,Australia,Captainkeeper,Deccan Chargers,Royal Challengers Bangalore,2010,0,39,1,Blank,Blank,Ac Gilchrist,A Kumble,Ac Gilchrist,Rv Uthappa,1971-11-14
16086,41915000061,419150,61,Rp Singh,12/6/1985,Right-hand Bat,Left-arm Fast-medium,India,Player,Deccan Chargers,Royal Challengers Bangalore,2010,0,25,1,Blank,Blank,Ac Gilchrist,A Kumble,Ac Gilchrist,Rv Uthappa,1985-12-06
16089,41915000188,419150,188,Rj Harris,10/11/1979,Right-hand Bat,Right-arm Fast,Australia,Player,Deccan Chargers,Royal Challengers Bangalore,2010,0,31,1,Blank,Blank,Ac Gilchrist,A Kumble,Ac Gilchrist,Rv Uthappa,1979-10-11
16091,41915000253,419150,253,Mr Marsh,10/20/1991,Right-hand Bat,Right-arm Medium,Australia,Player,Deccan Chargers,Royal Challengers Bangalore,2010,0,19,1,Blank,Blank,Ac Gilchrist,A Kumble,Ac Gilchrist,Rv Uthappa,1991-10-20
16092,41915000256,419150,256,Harmeet Singh,9/7/1992,Left-hand Bat,Slow Left-arm Orthodox,India,Player,Deccan Chargers,Royal Challengers Bangalore,2010,0,18,1,Blank,Blank,Ac Gilchrist,A Kumble,Ac Gilchrist,Rv Uthappa,1992-09-07
16093,41915000006,419150,6,R Dravid,1/11/1973,Right-hand Bat,Right-arm Offbreak,India,Player,Royal Challengers Bangalore,Deccan Chargers,2010,0,37,0,Blank,Blank,A Kumble,Ac Gilchrist,Rv Uthappa,Ac Gilchrist,1973-01-11
16099,41915000052,419150,52,Lrpl Taylor,3/8/1984,Right-hand Bat,Right-arm Offbreak,New Zealand,Player,Royal Challengers Bangalore,Deccan Chargers,2010,0,26,0,Blank,Blank,A Kumble,Ac Gilchrist,Rv Uthappa,Ac Gilchrist,1984-03-08
16100,41915000081,419150,81,R Vinay Kumar,2/12/1984,Right-hand Bat,Right-arm Medium,India,Player,Royal Challengers Bangalore,Deccan Chargers,2010,0,26,0,Blank,Blank,A Kumble,Ac Gilchrist,Rv Uthappa,Ac Gilchrist,1984-02-12
16101,41915000094,419150,94,Dw Steyn,6/27/1983,Right-hand Bat,Right-arm Fast,South Africa,Player,Royal Challengers Bangalore,Deccan Chargers,2010,0,27,0,Blank,Blank,A Kumble,Ac Gilchrist,Rv Uthappa,Ac Gilchrist,1983-06-27
16102,41915000096,419150,96,Mk Pandey,9/10/1989,Right-hand Bat,Right-arm Medium,India,Player,Royal Challengers Bangalore,Deccan Chargers,2010,0,21,0,Blank,Blank,A Kumble,Ac Gilchrist,Rv Uthappa,Ac Gilchrist,1989-09-10
16111,41915100208,419151,208,At Rayudu,9/23/1985,Right-hand Bat,Right-arm Offbreak,India,Keeper,Mumbai Indians,Kings Xi Punjab,2010,0,25,0,Blank,Blank,Sr Tendulkar,Kc Sangakkara,At Rayudu,Kc Sangakkara,1985-09-23
16115,41915100024,419151,24,K Goel,12/24/1986,Left-hand Bat,Right-arm Offbreak,India,Player,Kings Xi Punjab,Mumbai Indians,2010,0,24,1,Blank,Blank,Kc Sangakkara,Sr Tendulkar,Kc Sangakkara,At Rayudu,1986-12-24
16119,41915100064,419151,64,Dpmd Jayawardene,5/27/1977,Right-hand Bat,Right-arm Medium,Sri Lanka,Player,Kings Xi Punjab,Mumbai Indians,2010,0,33,1,Blank,Blank,Kc Sangakkara,Sr Tendulkar,Kc Sangakkara,At Rayudu,1977-05-27
16122,41915100153,419151,153,Rr Powar,5/20/1978,Right-hand Bat,Right-arm Offbreak,India,Player,Kings Xi Punjab,Mumbai Indians,2010,0,32,1,Blank,Blank,Kc Sangakkara,Sr Tendulkar,Kc Sangakkara,At Rayudu,1978-05-20
16123,41915100227,419151,227,Ab Barath,4/14/1990,Right-hand Bat,Right-arm Offbreak,India,Player,Kings Xi Punjab,Mumbai Indians,2010,0,20,1,Blank,Blank,Kc Sangakkara,Sr Tendulkar,Kc Sangakkara,At Rayudu,1990-04-14
16126,41915200053,419152,53,Ac Gilchrist,11/14/1971,Left-hand Bat,Right-arm Offbreak,Australia,Captainkeeper,Deccan Chargers,Chennai Super Kings,2010,0,39,1,Blank,Blank,Ac Gilchrist,Ms Dhoni,Ac Gilchrist,Ms Dhoni,1971-11-14
16132,41915200178,419152,178,Tl Suman,12/15/1983,Right-hand Bat,Right-arm Offbreak,India,Player,Deccan Chargers,Chennai Super Kings,2010,0,27,1,Blank,Blank,Ac Gilchrist,Ms Dhoni,Ac Gilchrist,Ms Dhoni,1983-12-15
16134,41915200231,419152,231,Md Mishra,2/9/1984,Right-hand Bat,Right-arm Offbreak,India,Player,Deccan Chargers,Chennai Super Kings,2010,0,26,1,Blank,Blank,Ac Gilchrist,Ms Dhoni,Ac Gilchrist,Ms Dhoni,1984-02-09
16137,41915200018,419152,18,Ml Hayden,10/29/1971,Left-hand Bat,Right-arm Medium,Australia,Player,Chennai Super Kings,Deccan Chargers,2010,0,39,0,Blank,Blank,Ms Dhoni,Ac Gilchrist,Ms Dhoni,Ac Gilchrist,1971-10-29
16138,41915200019,419152,19,Mek Hussey,5/27/1975,Left-hand Bat,Right-arm Medium,Australia,Player,Chennai Super Kings,Deccan Chargers,2010,0,35,0,Blank,Blank,Ms Dhoni,Ac Gilchrist,Ms Dhoni,Ac Gilchrist,1975-05-27
16140,41915200021,419152,21,Sk Raina,11/27/1986,Left-hand Bat,Right-arm Offbreak,India,Player,Chennai Super Kings,Deccan Chargers,2010,0,24,0,Blank,Blank,Ms Dhoni,Ac Gilchrist,Ms Dhoni,Ac Gilchrist,1986-11-27
16143,41915200185,419152,185,M Vijay,4/1/1984,Right-hand Bat,Right-arm Offbreak,India,Player,Chennai Super Kings,Deccan Chargers,2010,0,26,0,Blank,Blank,Ms Dhoni,Ac Gilchrist,Ms Dhoni,Ac Gilchrist,1984-04-01
16144,41915200186,419152,186,Sb Jakati,11/27/1980,Left-hand Bat,Slow Left-arm Orthodox,India,Player,Chennai Super Kings,Deccan Chargers,2010,0,30,0,Blank,Blank,Ms Dhoni,Ac Gilchrist,Ms Dhoni,Ac Gilchrist,1980-11-27
16145,41915200201,419152,201,R Ashwin,9/17/1986,Right-hand Bat,Right-arm Offbreak,India,Player,Chennai Super Kings,Deccan Chargers,2010,0,24,0,Blank,Blank,Ms Dhoni,Ac Gilchrist,Ms Dhoni,Ac Gilchrist,1986-09-17
16146,41915200218,419152,218,S Tyagi,9/17/1987,Right-hand Bat,Right-arm Medium,India,Player,Chennai Super Kings,Deccan Chargers,2010,0,23,0,Blank,Blank,Ms Dhoni,Ac Gilchrist,Ms Dhoni,Ac Gilchrist,1987-09-17
16147,41915200248,419152,248,De Bollinger,7/24/1981,Left-hand Bat,Left-arm Fast-medium,Australia,Player,Chennai Super Kings,Deccan Chargers,2010,0,29,0,Blank,Blank,Ms Dhoni,Ac Gilchrist,Ms Dhoni,Ac Gilchrist,1981-07-24
16153,41915300046,419153,46,Rv Uthappa,11/11/1985,Right-hand Bat,Right-arm Medium,India,Keeper,Royal Challengers Bangalore,Kolkata Knight Riders,2010,0,25,1,Blank,Blank,A Kumble,Sc Ganguly,Rv Uthappa,Wp Saha,1985-11-11
16155,41915300081,419153,81,R Vinay Kumar,2/12/1984,Right-hand Bat,Right-arm Medium,India,Player,Royal Challengers Bangalore,Kolkata Knight Riders,2010,1,26,1,Blank,Blank,A Kumble,Sc Ganguly,Rv Uthappa,Wp Saha,1984-02-12
16158,41915300249,419153,249,S Sriram,2/21/1976,Left-hand Bat,Slow Left-arm Orthodox,India,Player,Royal Challengers Bangalore,Kolkata Knight Riders,2010,0,34,1,Blank,Blank,A Kumble,Sc Ganguly,Rv Uthappa,Wp Saha,1976-02-21
16161,41915300062,419153,62,Wp Saha,10/24/1984,Right-hand Bat,N/a,India,Keeper,Kolkata Knight Riders,Royal Challengers Bangalore,2010,0,26,0,Blank,Blank,Sc Ganguly,A Kumble,Wp Saha,Rv Uthappa,1984-10-24
16162,41915300082,419153,82,Ab Agarkar,12/4/1977,Right-hand Bat,Right-arm Fast,India,Player,Kolkata Knight Riders,Royal Challengers Bangalore,2010,0,33,0,Blank,Blank,Sc Ganguly,A Kumble,Wp Saha,Rv Uthappa,1977-12-04
16163,41915300084,419153,84,I Sharma,9/2/1988,Right-hand Bat,Right-arm Fast-medium,India,Player,Kolkata Knight Riders,Royal Challengers Bangalore,2010,0,22,0,Blank,Blank,Sc Ganguly,A Kumble,Wp Saha,Rv Uthappa,1988-09-02
16164,41915300087,419153,87,Mk Tiwary,11/14/1985,Right-hand Bat,Legbreak Googly,India,Player,Kolkata Knight Riders,Royal Challengers Bangalore,2010,0,25,0,Blank,Blank,Sc Ganguly,A Kumble,Wp Saha,Rv Uthappa,1985-11-14
16181,41915400040,419154,40,G Gambhir,10/14/1981,Left-hand Bat,Legbreak,India,Captain,Delhi Daredevils,Kings Xi Punjab,2010,0,29,0,Blank,Blank,G Gambhir,Kc Sangakkara,Kd Karthik,Kc Sangakkara,1981-10-14
16183,41915400073,419154,73,A Nehra,4/29/1979,Right-hand Bat,Left-arm Medium-fast,India,Player,Delhi Daredevils,Kings Xi Punjab,2010,0,31,0,Blank,Blank,G Gambhir,Kc Sangakkara,Kd Karthik,Kc Sangakkara,1979-04-29
16184,41915400088,419154,88,Kd Karthik,6/1/1985,Right-hand Bat,N/a,India,Keeper,Delhi Daredevils,Kings Xi Punjab,2010,0,25,0,Blank,Blank,G Gambhir,Kc Sangakkara,Kd Karthik,Kc Sangakkara,1985-06-01
16190,41915400187,419154,187,Da Warner,10/27/1986,Left-hand Bat,Legbreak,Australia,Player,Delhi Daredevils,Kings Xi Punjab,2010,0,24,0,Blank,Blank,G Gambhir,Kc Sangakkara,Kd Karthik,Kc Sangakkara,1986-10-27
16192,41915500015,419155,15,Z Khan,10/7/1978,Right-hand Bat,Left-arm Fast-medium,India,Player,Mumbai Indians,Rajasthan Royals,2010,0,32,1,Blank,Blank,Sr Tendulkar,Sk Warne,At Rayudu,Nv Ojha,1978-10-07
16193,41915500044,419155,44,St Jayasuriya,6/30/1969,Left-hand Bat,Slow Left-arm Orthodox,Sri Lanka,Player,Mumbai Indians,Rajasthan Royals,2010,0,41,1,Blank,Blank,Sr Tendulkar,Sk Warne,At Rayudu,Nv Ojha,1969-06-30
16195,41915500079,419155,79,Ss Tiwary,12/30/1989,Left-hand Bat,N/a,India,Player,Mumbai Indians,Rajasthan Royals,2010,0,21,1,Blank,Blank,Sr Tendulkar,Sk Warne,At Rayudu,Nv Ojha,1989-12-30
16196,41915500080,419155,80,Ds Kulkarni,12/10/1988,Right-hand Bat,Right-arm Medium,India,Player,Mumbai Indians,Rajasthan Royals,2010,0,22,1,Blank,Blank,Sr Tendulkar,Sk Warne,At Rayudu,Nv Ojha,1988-12-10
16199,41915500194,419155,194,Sl Malinga,8/28/1983,Right-hand Bat,Right-arm Fast,Sri Lanka,Player,Mumbai Indians,Rajasthan Royals,2010,0,27,1,Blank,Blank,Sr Tendulkar,Sk Warne,At Rayudu,Nv Ojha,1983-08-28
16201,41915500209,419155,209,R Sathish,1/14/1981,Right-hand Bat,Right-arm Medium,India,Player,Mumbai Indians,Rajasthan Royals,2010,0,29,1,Blank,Blank,Sr Tendulkar,Sk Warne,At Rayudu,Nv Ojha,1981-01-14
16202,41915500221,419155,221,Ka Pollard,5/12/1987,Right-hand Bat,Right-arm Medium-fast,West Indies,Player,Mumbai Indians,Rajasthan Royals,2010,0,23,1,Blank,Blank,Sr Tendulkar,Sk Warne,At Rayudu,Nv Ojha,1987-05-12
16203,41915500031,419155,31,Yk Pathan,11/17/1982,Right-hand Bat,Right-arm Offbreak,India,Player,Rajasthan Royals,Mumbai Indians,2010,0,28,0,Blank,Blank,Sk Warne,Sr Tendulkar,Nv Ojha,At Rayudu,1982-11-17
16208,41915500183,419155,183,Nv Ojha,7/20/1983,Right-hand Bat,N/a,India,Keeper,Rajasthan Royals,Mumbai Indians,2010,0,27,0,Blank,Blank,Sk Warne,Sr Tendulkar,Nv Ojha,At Rayudu,1983-07-20
16209,41915500211,419155,211,Aa Jhunjhunwala,12/1/1982,Right-hand Bat,Right-arm Offbreak,India,Player,Rajasthan Royals,Mumbai Indians,2010,0,28,0,Blank,Blank,Sk Warne,Sr Tendulkar,Nv Ojha,At Rayudu,1982-12-01
16211,41915500229,419155,229,Fy Fazal,9/7/1985,Left-hand Bat,Right-arm Medium,India,Player,Rajasthan Royals,Mumbai Indians,2010,0,25,0,Blank,Blank,Sk Warne,Sr Tendulkar,Nv Ojha,At Rayudu,1985-09-07
16213,41915500245,419155,245,Ap Dole,10/9/1987,Right-hand Bat,Right-arm Medium-fast,India,Player,Rajasthan Royals,Mumbai Indians,2010,0,23,0,Blank,Blank,Sk Warne,Sr Tendulkar,Nv Ojha,At Rayudu,1987-10-09
16214,41915600053,419156,53,Ac Gilchrist,11/14/1971,Left-hand Bat,Right-arm Offbreak,Australia,Captainkeeper,Deccan Chargers,Royal Challengers Bangalore,2010,0,39,1,Blank,Blank,Ac Gilchrist,A Kumble,Ac Gilchrist,Rv Uthappa,1971-11-14
16215,41915600056,419156,56,A Symonds,6/9/1975,Right-hand Bat,Right-arm Offbreak,Australia,Player,Deccan Chargers,Royal Challengers Bangalore,2010,0,35,1,Blank,Blank,Ac Gilchrist,A Kumble,Ac Gilchrist,Rv Uthappa,1975-06-09
16220,41915600178,419156,178,Tl Suman,12/15/1983,Right-hand Bat,Right-arm Offbreak,India,Player,Deccan Chargers,Royal Challengers Bangalore,2010,0,27,1,Blank,Blank,Ac Gilchrist,A Kumble,Ac Gilchrist,Rv Uthappa,1983-12-15
16221,41915600188,419156,188,Rj Harris,10/11/1979,Right-hand Bat,Right-arm Fast,Australia,Player,Deccan Chargers,Royal Challengers Bangalore,2010,0,31,1,Blank,Blank,Ac Gilchrist,A Kumble,Ac Gilchrist,Rv Uthappa,1979-10-11
16223,41915600250,419156,250,B Sumanth,5/10/1988,Right-hand Bat,Right-arm Medium-fast,India,Player,Deccan Chargers,Royal Challengers Bangalore,2010,0,22,1,Blank,Blank,Ac Gilchrist,A Kumble,Ac Gilchrist,Rv Uthappa,1988-05-10
16225,41915600006,419156,6,R Dravid,1/11/1973,Right-hand Bat,Right-arm Offbreak,India,Player,Royal Challengers Bangalore,Deccan Chargers,2010,0,37,0,Blank,Blank,A Kumble,Ac Gilchrist,Rv Uthappa,Ac Gilchrist,1973-01-11
16227,41915600009,419156,9,Jh Kallis,10/16/1975,Right-hand Bat,Right-arm Fast-medium,South Africa,Player,Royal Challengers Bangalore,Deccan Chargers,2010,0,35,0,Blank,Blank,A Kumble,Ac Gilchrist,Rv Uthappa,Ac Gilchrist,1975-10-16
16230,41915600052,419156,52,Lrpl Taylor,3/8/1984,Right-hand Bat,Right-arm Offbreak,New Zealand,Player,Royal Challengers Bangalore,Deccan Chargers,2010,0,26,0,Blank,Blank,A Kumble,Ac Gilchrist,Rv Uthappa,Ac Gilchrist,1984-03-08
16231,41915600081,419156,81,R Vinay Kumar,2/12/1984,Right-hand Bat,Right-arm Medium,India,Player,Royal Challengers Bangalore,Deccan Chargers,2010,0,26,0,Blank,Blank,A Kumble,Ac Gilchrist,Rv Uthappa,Ac Gilchrist,1984-02-12
16232,41915600094,419156,94,Dw Steyn,6/27/1983,Right-hand Bat,Right-arm Fast,South Africa,Player,Royal Challengers Bangalore,Deccan Chargers,2010,0,27,0,Blank,Blank,A Kumble,Ac Gilchrist,Rv Uthappa,Ac Gilchrist,1983-06-27
16234,41915600124,419156,124,A Kumble,10/17/1970,Right-hand Bat,Legbreak Googly,India,Captain,Royal Challengers Bangalore,Deccan Chargers,2010,0,40,0,Blank,Blank,A Kumble,Ac Gilchrist,Rv Uthappa,Ac Gilchrist,1970-10-17
16238,41915700071,419157,71,Dj Bravo,10/7/1983,Right-hand Bat,Right-arm Medium-fast,West Indies,Player,Mumbai Indians,Delhi Daredevils,2010,0,27,1,Blank,Blank,Sr Tendulkar,G Gambhir,C Madan,Kd Karthik,1983-10-07
16241,41915700149,419157,149,Crd Fernando,7/19/1979,Right-hand Bat,Right-arm Fast-medium,Sri Lanka,Player,Mumbai Indians,Delhi Daredevils,2010,0,31,1,Blank,Blank,Sr Tendulkar,G Gambhir,C Madan,Kd Karthik,1979-07-19
16244,41915700221,419157,221,Ka Pollard,5/12/1987,Right-hand Bat,Right-arm Medium-fast,West Indies,Player,Mumbai Indians,Delhi Daredevils,2010,1,23,1,Blank,Blank,Sr Tendulkar,G Gambhir,C Madan,Kd Karthik,1987-05-12
16245,41915700251,419157,251,C Madan,10/15/1982,Right-hand Bat,N/a,India,Keeper,Mumbai Indians,Delhi Daredevils,2010,0,28,1,Blank,Blank,Sr Tendulkar,G Gambhir,C Madan,Kd Karthik,1982-10-15
16247,41915700040,419157,40,G Gambhir,10/14/1981,Left-hand Bat,Legbreak,India,Captain,Delhi Daredevils,Mumbai Indians,2010,0,29,0,Blank,Blank,G Gambhir,Sr Tendulkar,Kd Karthik,C Madan,1981-10-14
16250,41915700088,419157,88,Kd Karthik,6/1/1985,Right-hand Bat,N/a,India,Keeper,Delhi Daredevils,Mumbai Indians,2010,0,25,0,Blank,Blank,G Gambhir,Sr Tendulkar,Kd Karthik,C Madan,1985-06-01
16255,41915700198,419157,198,Ab Mcdonald,6/5/1981,Right-hand Bat,Right-arm Fast-medium,Australia,Player,Delhi Daredevils,Mumbai Indians,2010,0,29,0,Blank,Blank,G Gambhir,Sr Tendulkar,Kd Karthik,C Madan,1981-06-05
16262,41915800109,419158,109,Ja Morkel,6/10/1981,Left-hand Bat,Right-arm Medium-fast,South Africa,Player,Chennai Super Kings,Kolkata Knight Riders,2010,0,29,1,Blank,Blank,Ms Dhoni,Sc Ganguly,Ms Dhoni,Wp Saha,1981-06-10
16264,41915800125,419158,125,S Anirudha,4/14/1987,Right-hand Bat,N/a,India,Player,Chennai Super Kings,Kolkata Knight Riders,2010,0,23,1,Blank,Blank,Ms Dhoni,Sc Ganguly,Ms Dhoni,Wp Saha,1987-04-14
16266,41915800186,419158,186,Sb Jakati,11/27/1980,Left-hand Bat,Slow Left-arm Orthodox,India,Player,Chennai Super Kings,Kolkata Knight Riders,2010,0,30,1,Blank,Blank,Ms Dhoni,Sc Ganguly,Ms Dhoni,Wp Saha,1980-11-27
16270,41915800002,419158,2,Bb Mccullum,9/27/1981,Right-hand Bat,Right-arm Medium,New Zealand,Player,Kolkata Knight Riders,Chennai Super Kings,2010,0,29,0,Blank,Blank,Sc Ganguly,Ms Dhoni,Wp Saha,Ms Dhoni,1981-09-27
16273,41915800063,419158,63,Lr Shukla,5/6/1981,Right-hand Bat,Right-arm Medium,India,Player,Kolkata Knight Riders,Chennai Super Kings,2010,0,29,0,Blank,Blank,Sc Ganguly,Ms Dhoni,Wp Saha,Ms Dhoni,1981-05-06
16275,41915800087,419158,87,Mk Tiwary,11/14/1985,Right-hand Bat,Legbreak Googly,India,Player,Kolkata Knight Riders,Chennai Super Kings,2010,0,25,0,Blank,Blank,Sc Ganguly,Ms Dhoni,Wp Saha,Ms Dhoni,1985-11-14
16277,41915800140,419158,140,Iqbal Abdulla,12/2/1989,Left-hand Bat,Slow Left-arm Orthodox,India,Player,Kolkata Knight Riders,Chennai Super Kings,2010,0,21,0,Blank,Blank,Sc Ganguly,Ms Dhoni,Wp Saha,Ms Dhoni,1989-12-02
16278,41915800162,419158,162,Ch Gayle,9/21/1979,Left-hand Bat,Right-arm Offbreak,West Indies,Player,Kolkata Knight Riders,Chennai Super Kings,2010,0,31,0,Blank,Blank,Sc Ganguly,Ms Dhoni,Wp Saha,Ms Dhoni,1979-09-21
16279,41915800191,419158,191,Ad Mathews,6/2/1987,Right-hand Bat,Right-arm Fast-medium,Sri Lanka,Player,Kolkata Knight Riders,Chennai Super Kings,2010,0,23,0,Blank,Blank,Sc Ganguly,Ms Dhoni,Wp Saha,Ms Dhoni,1987-06-02
16281,41915900032,419159,32,Sr Watson,6/17/1981,Right-hand Bat,Right-arm Fast-medium,Australia,Player,Rajasthan Royals,Royal Challengers Bangalore,2010,0,29,0,Blank,Blank,Sk Warne,A Kumble,Nv Ojha,Rv Uthappa,1981-06-17
16283,41915900039,419159,39,Sk Trivedi,9/4/1982,Right-hand Bat,Right-arm Medium,India,Player,Rajasthan Royals,Royal Challengers Bangalore,2010,0,28,0,Blank,Blank,Sk Warne,A Kumble,Nv Ojha,Rv Uthappa,1982-09-04
16286,41915900183,419159,183,Nv Ojha,7/20/1983,Right-hand Bat,N/a,India,Keeper,Rajasthan Royals,Royal Challengers Bangalore,2010,0,27,0,Blank,Blank,Sk Warne,A Kumble,Nv Ojha,Rv Uthappa,1983-07-20
16293,41915900009,419159,9,Jh Kallis,10/16/1975,Right-hand Bat,Right-arm Fast-medium,South Africa,Player,Royal Challengers Bangalore,Rajasthan Royals,2010,0,35,1,Blank,Blank,A Kumble,Sk Warne,Rv Uthappa,Nv Ojha,1975-10-16
16295,41915900052,419159,52,Lrpl Taylor,3/8/1984,Right-hand Bat,Right-arm Offbreak,New Zealand,Player,Royal Challengers Bangalore,Rajasthan Royals,2010,0,26,1,Blank,Blank,A Kumble,Sk Warne,Rv Uthappa,Nv Ojha,1984-03-08
16297,41915900081,419159,81,R Vinay Kumar,2/12/1984,Right-hand Bat,Right-arm Medium,India,Player,Royal Challengers Bangalore,Rajasthan Royals,2010,0,26,1,Blank,Blank,A Kumble,Sk Warne,Rv Uthappa,Nv Ojha,1984-02-12
16301,41915900158,419159,158,Kp Pietersen,6/27/1980,Right-hand Bat,Right-arm Offbreak,South Africa,Player,Royal Challengers Bangalore,Rajasthan Royals,2010,1,30,1,Blank,Blank,A Kumble,Sk Warne,Rv Uthappa,Nv Ojha,1980-06-27
16306,41916000135,419160,135,Tm Dilshan,10/14/1976,Right-hand Bat,Right-arm Offbreak,Sri Lanka,Player,Delhi Daredevils,Chennai Super Kings,2010,0,34,1,Blank,Blank,G Gambhir,Ms Dhoni,Kd Karthik,Ms Dhoni,1976-10-14
16309,41916000187,419160,187,Da Warner,10/27/1986,Left-hand Bat,Legbreak,Australia,Player,Delhi Daredevils,Chennai Super Kings,2010,0,24,1,Blank,Blank,G Gambhir,Ms Dhoni,Kd Karthik,Ms Dhoni,1986-10-27
16310,41916000223,419160,223,Dp Nannes,5/16/1976,Right-hand Bat,Left-arm Fast,Australia,Player,Delhi Daredevils,Chennai Super Kings,2010,0,34,1,Blank,Blank,G Gambhir,Ms Dhoni,Kd Karthik,Ms Dhoni,1976-05-16
16311,41916000232,419160,232,Ut Yadav,10/25/1987,Right-hand Bat,Right-arm Fast-medium,India,Player,Delhi Daredevils,Chennai Super Kings,2010,0,23,1,Blank,Blank,G Gambhir,Ms Dhoni,Kd Karthik,Ms Dhoni,1987-10-25
16313,41916000018,419160,18,Ml Hayden,10/29/1971,Left-hand Bat,Right-arm Medium,Australia,Player,Chennai Super Kings,Delhi Daredevils,2010,0,39,0,Blank,Blank,Ms Dhoni,G Gambhir,Ms Dhoni,Kd Karthik,1971-10-29
16314,41916000019,419160,19,Mek Hussey,5/27/1975,Left-hand Bat,Right-arm Medium,Australia,Player,Chennai Super Kings,Delhi Daredevils,2010,0,35,0,Blank,Blank,Ms Dhoni,G Gambhir,Ms Dhoni,Kd Karthik,1975-05-27
16317,41916000023,419160,23,S Badrinath,8/30/1980,Right-hand Bat,Right-arm Offbreak,India,Player,Chennai Super Kings,Delhi Daredevils,2010,0,30,0,Blank,Blank,Ms Dhoni,G Gambhir,Ms Dhoni,Kd Karthik,1980-08-30
16320,41916000185,419160,185,M Vijay,4/1/1984,Right-hand Bat,Right-arm Offbreak,India,Player,Chennai Super Kings,Delhi Daredevils,2010,0,26,0,Blank,Blank,Ms Dhoni,G Gambhir,Ms Dhoni,Kd Karthik,1984-04-01
16323,41916000248,419160,248,De Bollinger,7/24/1981,Left-hand Bat,Left-arm Fast-medium,Australia,Player,Chennai Super Kings,Delhi Daredevils,2010,0,29,0,Blank,Blank,Ms Dhoni,G Gambhir,Ms Dhoni,Kd Karthik,1981-07-24
16330,41916100188,419161,188,Rj Harris,10/11/1979,Right-hand Bat,Right-arm Fast,Australia,Player,Deccan Chargers,Kings Xi Punjab,2010,0,31,1,Blank,Blank,Ac Gilchrist,Kc Sangakkara,Ac Gilchrist,Kc Sangakkara,1979-10-11
16338,41916100029,419161,29,Ik Pathan,10/27/1984,Left-hand Bat,Left-arm Medium-fast,India,Player,Kings Xi Punjab,Deccan Chargers,2010,0,26,0,Blank,Blank,Kc Sangakkara,Ac Gilchrist,Kc Sangakkara,Ac Gilchrist,1984-10-27
16343,41916100234,419161,234,Sj Srivastava,9/22/1981,Right-hand Bat,Left-arm Fast-medium,India,Player,Kings Xi Punjab,Deccan Chargers,2010,0,29,0,Blank,Blank,Kc Sangakkara,Ac Gilchrist,Kc Sangakkara,Ac Gilchrist,1981-09-22
16347,41916200048,419162,48,Am Nayar,10/8/1983,Left-hand Bat,Right-arm Medium,India,Player,Mumbai Indians,Royal Challengers Bangalore,2010,0,27,1,Blank,Blank,Sr Tendulkar,A Kumble,Ap Tare,Rv Uthappa,1983-10-08
16349,41916200079,419162,79,Ss Tiwary,12/30/1989,Left-hand Bat,N/a,India,Player,Mumbai Indians,Royal Challengers Bangalore,2010,0,21,1,Blank,Blank,Sr Tendulkar,A Kumble,Ap Tare,Rv Uthappa,1989-12-30
16354,41916200208,419162,208,At Rayudu,9/23/1985,Right-hand Bat,Right-arm Offbreak,India,Player,Mumbai Indians,Royal Challengers Bangalore,2010,0,25,1,Blank,Blank,Sr Tendulkar,A Kumble,Ap Tare,Rv Uthappa,1985-09-23
16358,41916200008,419162,8,V Kohli,11/5/1988,Right-hand Bat,Right-arm Medium,India,Player,Royal Challengers Bangalore,Mumbai Indians,2010,0,22,0,Blank,Blank,A Kumble,Sr Tendulkar,Rv Uthappa,Ap Tare,1988-11-05
16363,41916200081,419162,81,R Vinay Kumar,2/12/1984,Right-hand Bat,Right-arm Medium,India,Player,Royal Challengers Bangalore,Mumbai Indians,2010,0,26,0,Blank,Blank,A Kumble,Sr Tendulkar,Rv Uthappa,Ap Tare,1984-02-12
16364,41916200094,419162,94,Dw Steyn,6/27/1983,Right-hand Bat,Right-arm Fast,South Africa,Player,Royal Challengers Bangalore,Mumbai Indians,2010,0,27,0,Blank,Blank,A Kumble,Sr Tendulkar,Rv Uthappa,Ap Tare,1983-06-27
16366,41916200124,419162,124,A Kumble,10/17/1970,Right-hand Bat,Legbreak Googly,India,Captain,Royal Challengers Bangalore,Mumbai Indians,2010,0,40,0,Blank,Blank,A Kumble,Sr Tendulkar,Rv Uthappa,Ap Tare,1970-10-17
16367,41916200158,419162,158,Kp Pietersen,6/27/1980,Right-hand Bat,Right-arm Offbreak,South Africa,Player,Royal Challengers Bangalore,Mumbai Indians,2010,0,30,0,Blank,Blank,A Kumble,Sr Tendulkar,Rv Uthappa,Ap Tare,1980-06-27
16369,41916300002,419163,2,Bb Mccullum,9/27/1981,Right-hand Bat,Right-arm Medium,New Zealand,Keeper,Kolkata Knight Riders,Rajasthan Royals,2010,0,29,1,Blank,Blank,Sc Ganguly,Sk Warne,Bb Mccullum,Nv Ojha,1981-09-27
16372,41916300087,419163,87,Mk Tiwary,11/14/1985,Right-hand Bat,Legbreak Googly,India,Player,Kolkata Knight Riders,Rajasthan Royals,2010,0,25,1,Blank,Blank,Sc Ganguly,Sk Warne,Bb Mccullum,Nv Ojha,1985-11-14
16375,41916300191,419163,191,Ad Mathews,6/2/1987,Right-hand Bat,Right-arm Fast-medium,Sri Lanka,Player,Kolkata Knight Riders,Rajasthan Royals,2010,0,23,1,Blank,Blank,Sc Ganguly,Sk Warne,Bb Mccullum,Nv Ojha,1987-06-02
16384,41916300169,419163,169,As Raut,3/3/1987,Right-hand Bat,Legbreak Googly,India,Player,Rajasthan Royals,Kolkata Knight Riders,2010,0,23,0,Blank,Blank,Sk Warne,Sc Ganguly,Nv Ojha,Bb Mccullum,1987-03-03
16386,41916300212,419163,212,P Dogra,11/19/1984,Right-hand Bat,Legbreak,India,Player,Rajasthan Royals,Kolkata Knight Riders,2010,0,26,0,Blank,Blank,Sk Warne,Sc Ganguly,Nv Ojha,Bb Mccullum,1984-11-19
16387,41916300229,419163,229,Fy Fazal,9/7/1985,Left-hand Bat,Right-arm Medium,India,Player,Rajasthan Royals,Kolkata Knight Riders,2010,0,25,0,Blank,Blank,Sk Warne,Sc Ganguly,Nv Ojha,Bb Mccullum,1985-09-07
16394,41916400064,419164,64,Dpmd Jayawardene,5/27/1977,Right-hand Bat,Right-arm Medium,Sri Lanka,Player,Kings Xi Punjab,Chennai Super Kings,2010,0,33,0,Blank,Blank,Kc Sangakkara,Ms Dhoni,Kc Sangakkara,Ms Dhoni,1977-05-27
16395,41916400065,419164,65,S Sohal,11/10/1987,Right-hand Bat,Legbreak,India,Player,Kings Xi Punjab,Chennai Super Kings,2010,0,23,0,Blank,Blank,Kc Sangakkara,Ms Dhoni,Kc Sangakkara,Ms Dhoni,1987-11-10
16397,41916400078,419164,78,Vrv Singh,9/17/1984,Right-hand Bat,Right-arm Medium-fast,India,Player,Kings Xi Punjab,Chennai Super Kings,2010,0,26,0,Blank,Blank,Kc Sangakkara,Ms Dhoni,Kc Sangakkara,Ms Dhoni,1984-09-17
16398,41916400100,419164,100,Se Marsh,7/9/1983,Left-hand Bat,Slow Left-arm Orthodox,Australia,Player,Kings Xi Punjab,Chennai Super Kings,2010,0,27,0,Blank,Blank,Kc Sangakkara,Ms Dhoni,Kc Sangakkara,Ms Dhoni,1983-07-09
16401,41916400018,419164,18,Ml Hayden,10/29/1971,Left-hand Bat,Right-arm Medium,Australia,Player,Chennai Super Kings,Kings Xi Punjab,2010,0,39,1,Blank,Blank,Ms Dhoni,Kc Sangakkara,Ms Dhoni,Kc Sangakkara,1971-10-29
16405,41916400109,419164,109,Ja Morkel,6/10/1981,Left-hand Bat,Right-arm Medium-fast,South Africa,Player,Chennai Super Kings,Kings Xi Punjab,2010,0,29,1,Blank,Blank,Ms Dhoni,Kc Sangakkara,Ms Dhoni,Kc Sangakkara,1981-06-10
16406,41916400185,419164,185,M Vijay,4/1/1984,Right-hand Bat,Right-arm Offbreak,India,Player,Chennai Super Kings,Kings Xi Punjab,2010,0,26,1,Blank,Blank,Ms Dhoni,Kc Sangakkara,Ms Dhoni,Kc Sangakkara,1984-04-01
16407,41916400186,419164,186,Sb Jakati,11/27/1980,Left-hand Bat,Slow Left-arm Orthodox,India,Player,Chennai Super Kings,Kings Xi Punjab,2010,0,30,1,Blank,Blank,Ms Dhoni,Kc Sangakkara,Ms Dhoni,Kc Sangakkara,1980-11-27
16411,41916400248,419164,248,De Bollinger,7/24/1981,Left-hand Bat,Left-arm Fast-medium,Australia,Player,Chennai Super Kings,Kings Xi Punjab,2010,0,29,1,Blank,Blank,Ms Dhoni,Kc Sangakkara,Ms Dhoni,Kc Sangakkara,1981-07-24
16414,41916500057,419165,57,Rg Sharma,4/30/1987,Right-hand Bat,Right-arm Offbreak,India,Player,Deccan Chargers,Delhi Daredevils,2010,0,23,1,Blank,Blank,Ac Gilchrist,G Gambhir,Ac Gilchrist,Kd Karthik,1987-04-30
16419,41916500235,419165,235,R Sharma,4/30/1987,Right-hand Bat,Right-arm Offbreak,India,Player,Deccan Chargers,Delhi Daredevils,2010,0,23,1,Blank,Blank,Ac Gilchrist,G Gambhir,Ac Gilchrist,Kd Karthik,1987-04-30
16422,41916500256,419165,256,Harmeet Singh,9/7/1992,Left-hand Bat,Slow Left-arm Orthodox,India,Player,Deccan Chargers,Delhi Daredevils,2010,0,18,1,Blank,Blank,Ac Gilchrist,G Gambhir,Ac Gilchrist,Kd Karthik,1992-09-07
16423,41916500040,419165,40,G Gambhir,10/14/1981,Left-hand Bat,Legbreak,India,Captain,Delhi Daredevils,Deccan Chargers,2010,0,29,0,Blank,Blank,G Gambhir,Ac Gilchrist,Kd Karthik,Ac Gilchrist,1981-10-14
16425,41916500073,419165,73,A Nehra,4/29/1979,Right-hand Bat,Left-arm Medium-fast,India,Player,Delhi Daredevils,Deccan Chargers,2010,0,31,0,Blank,Blank,G Gambhir,Ac Gilchrist,Kd Karthik,Ac Gilchrist,1979-04-29
16429,41916500171,419165,171,M Manhas,10/12/1979,Right-hand Bat,Right-arm Offbreak,India,Player,Delhi Daredevils,Deccan Chargers,2010,0,31,0,Blank,Blank,G Gambhir,Ac Gilchrist,Kd Karthik,Ac Gilchrist,1979-10-12
16430,41916500187,419165,187,Da Warner,10/27/1986,Left-hand Bat,Legbreak,Australia,Player,Delhi Daredevils,Deccan Chargers,2010,0,24,0,Blank,Blank,G Gambhir,Ac Gilchrist,Kd Karthik,Ac Gilchrist,1986-10-27
16432,41916500232,419165,232,Ut Yadav,10/25/1987,Right-hand Bat,Right-arm Fast-medium,India,Player,Delhi Daredevils,Deccan Chargers,2010,0,23,0,Blank,Blank,G Gambhir,Ac Gilchrist,Kd Karthik,Ac Gilchrist,1987-10-25
16435,41916600071,419166,71,Dj Bravo,10/7/1983,Right-hand Bat,Right-arm Medium-fast,West Indies,Captain,Mumbai Indians,Kolkata Knight Riders,2010,0,27,0,Blank,Blank,Dj Bravo,Sc Ganguly,Ap Tare,Wp Saha,1983-10-07
16437,41916600149,419166,149,Crd Fernando,7/19/1979,Right-hand Bat,Right-arm Fast-medium,Sri Lanka,Player,Mumbai Indians,Kolkata Knight Riders,2010,0,31,0,Blank,Blank,Dj Bravo,Sc Ganguly,Ap Tare,Wp Saha,1979-07-19
16438,41916600154,419166,154,Jp Duminy,4/14/1984,Left-hand Bat,Right-arm Offbreak,South Africa,Player,Mumbai Indians,Kolkata Knight Riders,2010,0,26,0,Blank,Blank,Dj Bravo,Sc Ganguly,Ap Tare,Wp Saha,1984-04-14
16441,41916600209,419166,209,R Sathish,1/14/1981,Right-hand Bat,Right-arm Medium,India,Player,Mumbai Indians,Kolkata Knight Riders,2010,0,29,0,Blank,Blank,Dj Bravo,Sc Ganguly,Ap Tare,Wp Saha,1981-01-14
16443,41916600255,419166,255,Str Binny,6/3/1984,Right-hand Bat,Right-arm Medium,India,Player,Mumbai Indians,Kolkata Knight Riders,2010,0,26,0,Blank,Blank,Dj Bravo,Sc Ganguly,Ap Tare,Wp Saha,1984-06-03
16445,41916600001,419166,1,Sc Ganguly,7/8/1972,Left-hand Bat,Right-arm Medium,India,Captain,Kolkata Knight Riders,Mumbai Indians,2010,0,38,1,Blank,Blank,Sc Ganguly,Dj Bravo,Wp Saha,Ap Tare,1972-07-08
16449,41916600083,419166,83,M Kartik,9/11/1976,Left-hand Bat,Slow Left-arm Orthodox,India,Player,Kolkata Knight Riders,Mumbai Indians,2010,1,34,1,Blank,Blank,Sc Ganguly,Dj Bravo,Wp Saha,Ap Tare,1976-09-11
16451,41916600106,419166,106,Ab Dinda,3/25/1984,Right-hand Bat,Right-arm Medium-fast,India,Player,Kolkata Knight Riders,Mumbai Indians,2010,0,26,1,Blank,Blank,Sc Ganguly,Dj Bravo,Wp Saha,Ap Tare,1984-03-25
16453,41916600203,419166,203,Ca Pujara,1/25/1988,Right-hand Bat,Legbreak,India,Player,Kolkata Knight Riders,Mumbai Indians,2010,0,22,1,Blank,Blank,Sc Ganguly,Dj Bravo,Wp Saha,Ap Tare,1988-01-25
16454,41916600220,419166,220,Se Bond,6/7/1975,Right-hand Bat,Right-arm Fast,New Zealand,Player,Kolkata Knight Riders,Mumbai Indians,2010,0,35,1,Blank,Blank,Sc Ganguly,Dj Bravo,Wp Saha,Ap Tare,1975-06-07
16457,41916700042,419167,42,S Dhawan,12/5/1985,Left-hand Bat,Right-arm Offbreak,India,Player,Mumbai Indians,Royal Challengers Bangalore,2010,0,25,1,Blank,Blank,Sr Tendulkar,A Kumble,At Rayudu,Rv Uthappa,1985-12-05
16460,41916700079,419167,79,Ss Tiwary,12/30/1989,Left-hand Bat,N/a,India,Player,Mumbai Indians,Royal Challengers Bangalore,2010,0,21,1,Blank,Blank,Sr Tendulkar,A Kumble,At Rayudu,Rv Uthappa,1989-12-30
16461,41916700133,419167,133,Sr Tendulkar,4/24/1973,Right-hand Bat,Right-arm Offbreak,India,Captain,Mumbai Indians,Royal Challengers Bangalore,2010,0,37,1,Blank,Blank,Sr Tendulkar,A Kumble,At Rayudu,Rv Uthappa,1973-04-24
16462,41916700149,419167,149,Crd Fernando,7/19/1979,Right-hand Bat,Right-arm Fast-medium,Sri Lanka,Player,Mumbai Indians,Royal Challengers Bangalore,2010,0,31,1,Blank,Blank,Sr Tendulkar,A Kumble,At Rayudu,Rv Uthappa,1979-07-19
16464,41916700194,419167,194,Sl Malinga,8/28/1983,Right-hand Bat,Right-arm Fast,Sri Lanka,Player,Mumbai Indians,Royal Challengers Bangalore,2010,0,27,1,Blank,Blank,Sr Tendulkar,A Kumble,At Rayudu,Rv Uthappa,1983-08-28
16465,41916700208,419167,208,At Rayudu,9/23/1985,Right-hand Bat,Right-arm Offbreak,India,Keeper,Mumbai Indians,Royal Challengers Bangalore,2010,0,25,1,Blank,Blank,Sr Tendulkar,A Kumble,At Rayudu,Rv Uthappa,1985-09-23
16467,41916700006,419167,6,R Dravid,1/11/1973,Right-hand Bat,Right-arm Offbreak,India,Player,Royal Challengers Bangalore,Mumbai Indians,2010,0,37,0,Blank,Blank,A Kumble,Sr Tendulkar,Rv Uthappa,At Rayudu,1973-01-11
16468,41916700008,419167,8,V Kohli,11/5/1988,Right-hand Bat,Right-arm Medium,India,Player,Royal Challengers Bangalore,Mumbai Indians,2010,0,22,0,Blank,Blank,A Kumble,Sr Tendulkar,Rv Uthappa,At Rayudu,1988-11-05
16470,41916700014,419167,14,P Kumar,10/2/1986,Right-hand Bat,Right-arm Medium,India,Player,Royal Challengers Bangalore,Mumbai Indians,2010,0,24,0,Blank,Blank,A Kumble,Sr Tendulkar,Rv Uthappa,At Rayudu,1986-10-02
16471,41916700046,419167,46,Rv Uthappa,11/11/1985,Right-hand Bat,Right-arm Medium,India,Keeper,Royal Challengers Bangalore,Mumbai Indians,2010,0,25,0,Blank,Blank,A Kumble,Sr Tendulkar,Rv Uthappa,At Rayudu,1985-11-11
16472,41916700052,419167,52,Lrpl Taylor,3/8/1984,Right-hand Bat,Right-arm Offbreak,New Zealand,Player,Royal Challengers Bangalore,Mumbai Indians,2010,0,26,0,Blank,Blank,A Kumble,Sr Tendulkar,Rv Uthappa,At Rayudu,1984-03-08
16480,41916800057,419168,57,Rg Sharma,4/30/1987,Right-hand Bat,Right-arm Offbreak,India,Player,Deccan Chargers,Chennai Super Kings,2010,0,23,0,Blank,Blank,Ac Gilchrist,Ms Dhoni,Ac Gilchrist,Ms Dhoni,1987-04-30
16481,41916800061,419168,61,Rp Singh,12/6/1985,Right-hand Bat,Left-arm Fast-medium,India,Player,Deccan Chargers,Chennai Super Kings,2010,0,25,0,Blank,Blank,Ac Gilchrist,Ms Dhoni,Ac Gilchrist,Ms Dhoni,1985-12-06
16482,41916800097,419168,97,Hh Gibbs,2/23/1974,Right-hand Bat,Right-arm Bowler,South Africa,Player,Deccan Chargers,Chennai Super Kings,2010,0,36,0,Blank,Blank,Ac Gilchrist,Ms Dhoni,Ac Gilchrist,Ms Dhoni,1974-02-23
16484,41916800178,419168,178,Tl Suman,12/15/1983,Right-hand Bat,Right-arm Offbreak,India,Player,Deccan Chargers,Chennai Super Kings,2010,0,27,0,Blank,Blank,Ac Gilchrist,Ms Dhoni,Ac Gilchrist,Ms Dhoni,1983-12-15
16486,41916800231,419168,231,Md Mishra,2/9/1984,Right-hand Bat,Right-arm Offbreak,India,Player,Deccan Chargers,Chennai Super Kings,2010,0,26,0,Blank,Blank,Ac Gilchrist,Ms Dhoni,Ac Gilchrist,Ms Dhoni,1984-02-09
16487,41916800250,419168,250,B Sumanth,5/10/1988,Right-hand Bat,Right-arm Medium-fast,India,Player,Deccan Chargers,Chennai Super Kings,2010,0,22,0,Blank,Blank,Ac Gilchrist,Ms Dhoni,Ac Gilchrist,Ms Dhoni,1988-05-10
16489,41916800018,419168,18,Ml Hayden,10/29/1971,Left-hand Bat,Right-arm Medium,Australia,Player,Chennai Super Kings,Deccan Chargers,2010,0,39,1,Blank,Blank,Ms Dhoni,Ac Gilchrist,Ms Dhoni,Ac Gilchrist,1971-10-29
16490,41916800020,419168,20,Ms Dhoni,7/7/1981,Right-hand Bat,Right-arm Medium,India,Captainkeeper,Chennai Super Kings,Deccan Chargers,2010,0,29,1,Blank,Blank,Ms Dhoni,Ac Gilchrist,Ms Dhoni,Ac Gilchrist,1981-07-07
16491,41916800021,419168,21,Sk Raina,11/27/1986,Left-hand Bat,Right-arm Offbreak,India,Player,Chennai Super Kings,Deccan Chargers,2010,0,24,1,Blank,Blank,Ms Dhoni,Ac Gilchrist,Ms Dhoni,Ac Gilchrist,1986-11-27
16496,41916800185,419168,185,M Vijay,4/1/1984,Right-hand Bat,Right-arm Offbreak,India,Player,Chennai Super Kings,Deccan Chargers,2010,0,26,1,Blank,Blank,Ms Dhoni,Ac Gilchrist,Ms Dhoni,Ac Gilchrist,1984-04-01
16498,41916800201,419168,201,R Ashwin,9/17/1986,Right-hand Bat,Right-arm Offbreak,India,Player,Chennai Super Kings,Deccan Chargers,2010,0,24,1,Blank,Blank,Ms Dhoni,Ac Gilchrist,Ms Dhoni,Ac Gilchrist,1986-09-17
16499,41916800248,419168,248,De Bollinger,7/24/1981,Left-hand Bat,Left-arm Fast-medium,Australia,Player,Chennai Super Kings,Deccan Chargers,2010,1,29,1,Blank,Blank,Ms Dhoni,Ac Gilchrist,Ms Dhoni,Ac Gilchrist,1981-07-24
16500,41916900053,419169,53,Ac Gilchrist,11/14/1971,Left-hand Bat,Right-arm Offbreak,Australia,Captainkeeper,Deccan Chargers,Royal Challengers Bangalore,2010,0,39,0,Blank,Blank,Ac Gilchrist,A Kumble,Ac Gilchrist,Rv Uthappa,1971-11-14
16501,41916900054,419169,54,Y Venugopal Rao,2/26/1982,Right-hand Bat,Right-arm Offbreak,India,Player,Deccan Chargers,Royal Challengers Bangalore,2010,0,28,0,Blank,Blank,Ac Gilchrist,A Kumble,Ac Gilchrist,Rv Uthappa,1982-02-26
16503,41916900057,419169,57,Rg Sharma,4/30/1987,Right-hand Bat,Right-arm Offbreak,India,Player,Deccan Chargers,Royal Challengers Bangalore,2010,0,23,0,Blank,Blank,Ac Gilchrist,A Kumble,Ac Gilchrist,Rv Uthappa,1987-04-30
16505,41916900147,419169,147,Dr Smith,4/12/1983,Right-hand Bat,Right-arm Medium,West Indies,Player,Deccan Chargers,Royal Challengers Bangalore,2010,0,27,0,Blank,Blank,Ac Gilchrist,A Kumble,Ac Gilchrist,Rv Uthappa,1983-04-12
16507,41916900205,419169,205,Anirudh Singh,8/2/1980,Left-hand Bat,Right-arm Medium,India,Player,Deccan Chargers,Royal Challengers Bangalore,2010,0,30,0,Blank,Blank,Ac Gilchrist,A Kumble,Ac Gilchrist,Rv Uthappa,1980-08-02
16509,41916900235,419169,235,R Sharma,4/30/1987,Right-hand Bat,Right-arm Offbreak,India,Player,Deccan Chargers,Royal Challengers Bangalore,2010,0,23,0,Blank,Blank,Ac Gilchrist,A Kumble,Ac Gilchrist,Rv Uthappa,1987-04-30
16510,41916900256,419169,256,Harmeet Singh,9/7/1992,Left-hand Bat,Slow Left-arm Orthodox,India,Player,Deccan Chargers,Royal Challengers Bangalore,2010,0,18,0,Blank,Blank,Ac Gilchrist,A Kumble,Ac Gilchrist,Rv Uthappa,1992-09-07
16511,41916900006,419169,6,R Dravid,1/11/1973,Right-hand Bat,Right-arm Offbreak,India,Player,Royal Challengers Bangalore,Deccan Chargers,2010,0,37,1,Blank,Blank,A Kumble,Ac Gilchrist,Rv Uthappa,Ac Gilchrist,1973-01-11
16512,41916900008,419169,8,V Kohli,11/5/1988,Right-hand Bat,Right-arm Medium,India,Player,Royal Challengers Bangalore,Deccan Chargers,2010,0,22,1,Blank,Blank,A Kumble,Ac Gilchrist,Rv Uthappa,Ac Gilchrist,1988-11-05
16516,41916900014,419169,14,P Kumar,10/2/1986,Right-hand Bat,Right-arm Medium,India,Player,Royal Challengers Bangalore,Deccan Chargers,2010,0,24,1,Blank,Blank,A Kumble,Ac Gilchrist,Rv Uthappa,Ac Gilchrist,1986-10-02
16517,41916900046,419169,46,Rv Uthappa,11/11/1985,Right-hand Bat,Right-arm Medium,India,Keeper,Royal Challengers Bangalore,Deccan Chargers,2010,0,25,1,Blank,Blank,A Kumble,Ac Gilchrist,Rv Uthappa,Ac Gilchrist,1985-11-11
16519,41916900124,419169,124,A Kumble,10/17/1970,Right-hand Bat,Legbreak Googly,India,Captain,Royal Challengers Bangalore,Deccan Chargers,2010,1,40,1,Blank,Blank,A Kumble,Ac Gilchrist,Rv Uthappa,Ac Gilchrist,1970-10-17
16521,41916900298,419169,298,Nd Doshi,10/6/1978,Right-hand Bat,Slow Left-arm Orthodox,India,Player,Royal Challengers Bangalore,Deccan Chargers,2010,0,32,1,Blank,Blank,A Kumble,Ac Gilchrist,Rv Uthappa,Ac Gilchrist,1978-10-06
16522,41917000015,419170,15,Z Khan,10/7/1978,Right-hand Bat,Left-arm Fast-medium,India,Player,Mumbai Indians,Chennai Super Kings,2010,0,32,0,Blank,Blank,Sr Tendulkar,Ms Dhoni,At Rayudu,Ms Dhoni,1978-10-07
16523,41917000042,419170,42,S Dhawan,12/5/1985,Left-hand Bat,Right-arm Offbreak,India,Player,Mumbai Indians,Chennai Super Kings,2010,0,25,0,Blank,Blank,Sr Tendulkar,Ms Dhoni,At Rayudu,Ms Dhoni,1985-12-05
16524,41917000048,419170,48,Am Nayar,10/8/1983,Left-hand Bat,Right-arm Medium,India,Player,Mumbai Indians,Chennai Super Kings,2010,0,27,0,Blank,Blank,Sr Tendulkar,Ms Dhoni,At Rayudu,Ms Dhoni,1983-10-08
16528,41917000149,419170,149,Crd Fernando,7/19/1979,Right-hand Bat,Right-arm Fast-medium,Sri Lanka,Player,Mumbai Indians,Chennai Super Kings,2010,0,31,0,Blank,Blank,Sr Tendulkar,Ms Dhoni,At Rayudu,Ms Dhoni,1979-07-19
16529,41917000154,419170,154,Jp Duminy,4/14/1984,Left-hand Bat,Right-arm Offbreak,South Africa,Player,Mumbai Indians,Chennai Super Kings,2010,0,26,0,Blank,Blank,Sr Tendulkar,Ms Dhoni,At Rayudu,Ms Dhoni,1984-04-14
16530,41917000194,419170,194,Sl Malinga,8/28/1983,Right-hand Bat,Right-arm Fast,Sri Lanka,Player,Mumbai Indians,Chennai Super Kings,2010,0,27,0,Blank,Blank,Sr Tendulkar,Ms Dhoni,At Rayudu,Ms Dhoni,1983-08-28
16536,41917000023,419170,23,S Badrinath,8/30/1980,Right-hand Bat,Right-arm Offbreak,India,Player,Chennai Super Kings,Mumbai Indians,2010,0,30,1,Blank,Blank,Ms Dhoni,Sr Tendulkar,Ms Dhoni,At Rayudu,1980-08-30
16543,41917000248,419170,248,De Bollinger,7/24/1981,Left-hand Bat,Left-arm Fast-medium,Australia,Player,Chennai Super Kings,Mumbai Indians,2010,0,29,1,Blank,Blank,Ms Dhoni,Sr Tendulkar,Ms Dhoni,At Rayudu,1981-07-24
16547,50120300063,501203,63,Lr Shukla,5/6/1981,Right-hand Bat,Right-arm Medium,India,Player,Kolkata Knight Riders,Chennai Super Kings,2011,0,30,0,Blank,Blank,G Gambhir,Ms Dhoni,Ms Bisla,Ms Dhoni,1981-05-06
16549,50120300089,501203,89,R Bhatia,10/22/1979,Right-hand Bat,Right-arm Medium-fast,India,Player,Kolkata Knight Riders,Chennai Super Kings,2011,0,32,0,Blank,Blank,G Gambhir,Ms Dhoni,Ms Bisla,Ms Dhoni,1979-10-22
16558,50120300058,501203,58,Sb Styris,7/10/1975,Right-hand Bat,Right-arm Medium,New Zealand,Player,Chennai Super Kings,Kolkata Knight Riders,2011,0,36,1,Blank,Blank,Ms Dhoni,G Gambhir,Ms Dhoni,Ms Bisla,1975-07-10
16562,50120300186,501203,186,Sb Jakati,11/27/1980,Left-hand Bat,Slow Left-arm Orthodox,India,Player,Chennai Super Kings,Kolkata Knight Riders,2011,0,31,1,Blank,Blank,Ms Dhoni,G Gambhir,Ms Dhoni,Ms Bisla,1980-11-27
16563,50120300201,501203,201,R Ashwin,9/17/1986,Right-hand Bat,Right-arm Offbreak,India,Player,Chennai Super Kings,Kolkata Knight Riders,2011,0,25,1,Blank,Blank,Ms Dhoni,G Gambhir,Ms Dhoni,Ms Bisla,1986-09-17
16565,50120300377,501203,377,Tg Southee,12/11/1988,Right-hand Bat,Right-arm Medium-fast,New Zealand,Player,Chennai Super Kings,Kolkata Knight Riders,2011,0,23,1,Blank,Blank,Ms Dhoni,G Gambhir,Ms Dhoni,Ms Bisla,1988-12-11
16566,50120400006,501204,6,R Dravid,1/11/1973,Right-hand Bat,Right-arm Offbreak,India,Player,Rajasthan Royals,Deccan Chargers,2011,0,38,1,Blank,Blank,Sk Warne,Kc Sangakkara,Ag Paunikar,Kc Sangakkara,1973-01-11
16567,50120400022,501204,22,Jdp Oram,7/28/1978,Left-hand Bat,Right-arm Fast-medium,New Zealand,Player,Rajasthan Royals,Deccan Chargers,2011,0,33,1,Blank,Blank,Sk Warne,Kc Sangakkara,Ag Paunikar,Kc Sangakkara,1978-07-28
16570,50120400052,501204,52,Lrpl Taylor,3/8/1984,Right-hand Bat,Right-arm Offbreak,New Zealand,Player,Rajasthan Royals,Deccan Chargers,2011,0,27,1,Blank,Blank,Sk Warne,Kc Sangakkara,Ag Paunikar,Kc Sangakkara,1984-03-08
16572,50120400192,501204,192,J Botha,5/2/1982,Right-hand Bat,Right-arm Offbreak,South Africa,Player,Rajasthan Royals,Deccan Chargers,2011,0,29,1,Blank,Blank,Sk Warne,Kc Sangakkara,Ag Paunikar,Kc Sangakkara,1982-05-02
16573,50120400196,501204,196,A Singh,6/21/1981,Right-hand Bat,Right-arm Medium-fast,India,Player,Rajasthan Royals,Deccan Chargers,2011,0,30,1,Blank,Blank,Sk Warne,Kc Sangakkara,Ag Paunikar,Kc Sangakkara,1981-06-21
16574,50120400252,501204,252,Ag Paunikar,4/18/1988,Right-hand Bat,N/a,India,Keeper,Rajasthan Royals,Deccan Chargers,2011,0,23,1,Blank,Blank,Sk Warne,Kc Sangakkara,Ag Paunikar,Kc Sangakkara,1988-04-18
16577,50120400026,501204,26,Kc Sangakkara,10/27/1977,Left-hand Bat,Right-arm Offbreak,Sri Lanka,Captainkeeper,Deccan Chargers,Rajasthan Royals,2011,0,34,0,Blank,Blank,Kc Sangakkara,Sk Warne,Kc Sangakkara,Ag Paunikar,1977-10-27
16578,50120400042,501204,42,S Dhawan,12/5/1985,Left-hand Bat,Right-arm Offbreak,India,Player,Deccan Chargers,Rajasthan Royals,2011,0,26,0,Blank,Blank,Kc Sangakkara,Sk Warne,Kc Sangakkara,Ag Paunikar,1985-12-05
16579,50120400084,501204,84,I Sharma,9/2/1988,Right-hand Bat,Right-arm Fast-medium,India,Player,Deccan Chargers,Rajasthan Royals,2011,0,23,0,Blank,Blank,Kc Sangakkara,Sk Warne,Kc Sangakkara,Ag Paunikar,1988-09-02
16582,50120400112,501204,112,Db Ravi Teja,9/5/1987,Right-hand Bat,Legbreak Googly,India,Player,Deccan Chargers,Rajasthan Royals,2011,0,24,0,Blank,Blank,Kc Sangakkara,Sk Warne,Kc Sangakkara,Ag Paunikar,1987-09-05
16583,50120400131,501204,131,Pp Ojha,9/5/1986,Left-hand Bat,Slow Left-arm Orthodox,India,Player,Deccan Chargers,Rajasthan Royals,2011,0,25,0,Blank,Blank,Kc Sangakkara,Sk Warne,Kc Sangakkara,Ag Paunikar,1986-09-05
16585,50120400154,501204,154,Jp Duminy,4/14/1984,Left-hand Bat,Right-arm Offbreak,South Africa,Player,Deccan Chargers,Rajasthan Royals,2011,0,27,0,Blank,Blank,Kc Sangakkara,Sk Warne,Kc Sangakkara,Ag Paunikar,1984-04-14
16586,50120400257,501204,257,Ir Jaggi,1/27/1989,Right-hand Bat,Legbreak Googly,India,Player,Deccan Chargers,Rajasthan Royals,2011,0,22,0,Blank,Blank,Kc Sangakkara,Sk Warne,Kc Sangakkara,Ag Paunikar,1989-01-27
16589,50120500015,501205,15,Z Khan,10/7/1978,Right-hand Bat,Left-arm Fast-medium,India,Player,Royal Challengers Bangalore,Kochi Tuskers Kerala,2011,0,33,1,Blank,Blank,Dl Vettori,Dpmd Jayawardene,Ab De Villiers,Pa Patel,1978-10-07
16590,50120500079,501205,79,Ss Tiwary,12/30/1989,Left-hand Bat,N/a,India,Player,Royal Challengers Bangalore,Kochi Tuskers Kerala,2011,0,22,1,Blank,Blank,Dl Vettori,Dpmd Jayawardene,Ab De Villiers,Pa Patel,1989-12-30
16591,50120500110,501205,110,Ab De Villiers,2/17/1984,Right-hand Bat,Right-arm Medium,South Africa,Keeper,Royal Challengers Bangalore,Kochi Tuskers Kerala,2011,1,27,1,Blank,Blank,Dl Vettori,Dpmd Jayawardene,Ab De Villiers,Pa Patel,1984-02-17
16592,50120500135,501205,135,Tm Dilshan,10/14/1976,Right-hand Bat,Right-arm Offbreak,Sri Lanka,Player,Royal Challengers Bangalore,Kochi Tuskers Kerala,2011,0,35,1,Blank,Blank,Dl Vettori,Dpmd Jayawardene,Ab De Villiers,Pa Patel,1976-10-14
16596,50120500244,501205,244,A Mithun,10/25/1989,Right-hand Bat,Right-arm Medium,India,Player,Royal Challengers Bangalore,Kochi Tuskers Kerala,2011,0,22,1,Blank,Blank,Dl Vettori,Dpmd Jayawardene,Ab De Villiers,Pa Patel,1989-10-25
16597,50120500260,501205,260,Ma Agarwal,2/16/1991,Right-hand Bat,N/a,India,Player,Royal Challengers Bangalore,Kochi Tuskers Kerala,2011,0,20,1,Blank,Blank,Dl Vettori,Dpmd Jayawardene,Ab De Villiers,Pa Patel,1991-02-16
16603,50120500061,501205,61,Rp Singh,12/6/1985,Right-hand Bat,Left-arm Fast-medium,India,Player,Kochi Tuskers Kerala,Royal Challengers Bangalore,2011,0,26,0,Blank,Blank,Dpmd Jayawardene,Dl Vettori,Pa Patel,Ab De Villiers,1985-12-06
16604,50120500064,501205,64,Dpmd Jayawardene,5/27/1977,Right-hand Bat,Right-arm Medium,Sri Lanka,Captain,Kochi Tuskers Kerala,Royal Challengers Bangalore,2011,0,34,0,Blank,Blank,Dpmd Jayawardene,Dl Vettori,Pa Patel,Ab De Villiers,1977-05-27
16605,50120500077,501205,77,S Sreesanth,2/6/1983,Right-hand Bat,Right-arm Fast-medium,India,Player,Kochi Tuskers Kerala,Royal Challengers Bangalore,2011,0,28,0,Blank,Blank,Dpmd Jayawardene,Dl Vettori,Pa Patel,Ab De Villiers,1983-02-06
16608,50120500121,501205,121,M Muralitharan,4/17/1972,Right-hand Bat,Right-arm Offbreak,Sri Lanka,Player,Kochi Tuskers Kerala,Royal Challengers Bangalore,2011,0,39,0,Blank,Blank,Dpmd Jayawardene,Dl Vettori,Pa Patel,Ab De Villiers,1972-04-17
16609,50120500259,501205,259,Rv Gomez,10/16/1985,Right-hand Bat,Right-arm Medium,India,Player,Kochi Tuskers Kerala,Royal Challengers Bangalore,2011,0,26,0,Blank,Blank,Dpmd Jayawardene,Dl Vettori,Pa Patel,Ab De Villiers,1985-10-16
16612,50120600126,501206,126,Mm Patel,7/12/1983,Right-hand Bat,Right-arm Medium-fast,India,Player,Mumbai Indians,Delhi Daredevils,2011,0,28,1,Blank,Blank,Sr Tendulkar,V Sehwag,Dj Jacobs,Nv Ojha,1983-07-12
16615,50120600208,501206,208,At Rayudu,9/23/1985,Right-hand Bat,Right-arm Offbreak,India,Player,Mumbai Indians,Delhi Daredevils,2011,0,26,1,Blank,Blank,Sr Tendulkar,V Sehwag,Dj Jacobs,Nv Ojha,1985-09-23
16617,50120600221,501206,221,Ka Pollard,5/12/1987,Right-hand Bat,Right-arm Medium-fast,West Indies,Player,Mumbai Indians,Delhi Daredevils,2011,0,24,1,Blank,Blank,Sr Tendulkar,V Sehwag,Dj Jacobs,Nv Ojha,1987-05-12
16619,50120600275,501206,275,Jec Franklin,11/7/1980,Left-hand Bat,Left-arm Medium,New Zealand,Player,Mumbai Indians,Delhi Daredevils,2011,0,31,1,Blank,Blank,Sr Tendulkar,V Sehwag,Dj Jacobs,Nv Ojha,1980-11-07
16622,50120600041,501206,41,V Sehwag,10/20/1978,Right-hand Bat,Right-arm Offbreak,India,Captain,Delhi Daredevils,Mumbai Indians,2011,0,33,0,Blank,Blank,V Sehwag,Sr Tendulkar,Nv Ojha,Dj Jacobs,1978-10-20
16623,50120600054,501206,54,Y Venugopal Rao,2/26/1982,Right-hand Bat,Right-arm Offbreak,India,Player,Delhi Daredevils,Mumbai Indians,2011,0,29,0,Blank,Blank,V Sehwag,Sr Tendulkar,Nv Ojha,Dj Jacobs,1982-02-26
16624,50120600106,501206,106,Ab Dinda,3/25/1984,Right-hand Bat,Right-arm Medium-fast,India,Player,Delhi Daredevils,Mumbai Indians,2011,0,27,0,Blank,Blank,V Sehwag,Sr Tendulkar,Nv Ojha,Dj Jacobs,1984-03-25
16633,50120700048,501207,48,Am Nayar,10/8/1983,Left-hand Bat,Right-arm Medium,India,Player,Kings Xi Punjab,Pune Warriors,2011,0,28,0,Blank,Blank,Ac Gilchrist,Yuvraj Singh,Ac Gilchrist,Rv Uthappa,1983-10-08
16634,50120700053,501207,53,Ac Gilchrist,11/14/1971,Left-hand Bat,Right-arm Offbreak,Australia,Captainkeeper,Kings Xi Punjab,Pune Warriors,2011,0,40,0,Blank,Blank,Ac Gilchrist,Yuvraj Singh,Ac Gilchrist,Rv Uthappa,1971-11-14
16635,50120700067,501207,67,Pp Chawla,12/24/1988,Left-hand Bat,Legbreak,India,Player,Kings Xi Punjab,Pune Warriors,2011,0,23,0,Blank,Blank,Ac Gilchrist,Yuvraj Singh,Ac Gilchrist,Rv Uthappa,1988-12-24
16638,50120700167,501207,167,Pc Valthaty,12/7/1983,Right-hand Bat,Right-arm Medium,India,Player,Kings Xi Punjab,Pune Warriors,2011,0,28,0,Blank,Blank,Ac Gilchrist,Yuvraj Singh,Ac Gilchrist,Rv Uthappa,1983-12-07
16639,50120700210,501207,210,R Mclaren,2/9/1983,Left-hand Bat,Right-arm Medium-fast,South Africa,Player,Kings Xi Punjab,Pune Warriors,2011,0,28,0,Blank,Blank,Ac Gilchrist,Yuvraj Singh,Ac Gilchrist,Rv Uthappa,1983-02-09
16640,50120700264,501207,264,Sunny Singh,12/18/1986,Right-hand Bat,Right-arm Medium-fast,India,Player,Kings Xi Punjab,Pune Warriors,2011,0,25,0,Blank,Blank,Ac Gilchrist,Yuvraj Singh,Ac Gilchrist,Rv Uthappa,1986-12-18
16642,50120700302,501207,302,Ba Bhatt,5/13/1990,Left-hand Bat,Slow Left-arm Orthodox,India,Player,Kings Xi Punjab,Pune Warriors,2011,0,21,0,Blank,Blank,Ac Gilchrist,Yuvraj Singh,Ac Gilchrist,Rv Uthappa,1990-05-13
16643,50120700027,501207,27,Yuvraj Singh,12/12/1981,Left-hand Bat,Slow Left-arm Orthodox,India,Captain,Pune Warriors,Kings Xi Punjab,2011,0,30,1,Blank,Blank,Yuvraj Singh,Ac Gilchrist,Rv Uthappa,Ac Gilchrist,1981-12-12
16644,50120700046,501207,46,Rv Uthappa,11/11/1985,Right-hand Bat,Right-arm Medium,India,Keeper,Pune Warriors,Kings Xi Punjab,2011,0,26,1,Blank,Blank,Yuvraj Singh,Ac Gilchrist,Rv Uthappa,Ac Gilchrist,1985-11-11
16645,50120700074,501207,74,Gc Smith,2/1/1981,Left-hand Bat,Right-arm Offbreak,South Africa,Player,Pune Warriors,Kings Xi Punjab,2011,0,30,1,Blank,Blank,Yuvraj Singh,Ac Gilchrist,Rv Uthappa,Ac Gilchrist,1981-02-01
16649,50120700231,501207,231,Md Mishra,2/9/1984,Right-hand Bat,Right-arm Offbreak,India,Player,Pune Warriors,Kings Xi Punjab,2011,0,27,1,Blank,Blank,Yuvraj Singh,Ac Gilchrist,Rv Uthappa,Ac Gilchrist,1984-02-09
16651,50120700267,501207,267,Wd Parnell,7/30/1989,Left-hand Bat,Left-arm Medium-fast,South Africa,Player,Pune Warriors,Kings Xi Punjab,2011,0,22,1,Blank,Blank,Yuvraj Singh,Ac Gilchrist,Rv Uthappa,Ac Gilchrist,1989-07-30
16652,50120700273,501207,273,Sb Wagh,10/9/1988,Left-hand Bat,Left-arm Medium-fast,India,Player,Pune Warriors,Kings Xi Punjab,2011,1,23,1,Blank,Blank,Yuvraj Singh,Ac Gilchrist,Rv Uthappa,Ac Gilchrist,1988-10-09
16653,50120700274,501207,274,Ac Thomas,2/9/1977,Right-hand Bat,Right-arm Fast-medium,England,Player,Pune Warriors,Kings Xi Punjab,2011,0,34,1,Blank,Blank,Yuvraj Singh,Ac Gilchrist,Rv Uthappa,Ac Gilchrist,1977-02-09
16655,50120800042,501208,42,S Dhawan,12/5/1985,Left-hand Bat,Right-arm Offbreak,India,Player,Deccan Chargers,Kolkata Knight Riders,2011,0,26,0,Blank,Blank,Kc Sangakkara,G Gambhir,Kc Sangakkara,Ms Bisla,1985-12-05
16656,50120800084,501208,84,I Sharma,9/2/1988,Right-hand Bat,Right-arm Fast-medium,India,Player,Deccan Chargers,Kolkata Knight Riders,2011,0,23,0,Blank,Blank,Kc Sangakkara,G Gambhir,Kc Sangakkara,Ms Bisla,1988-09-02
16657,50120800093,501208,93,B Chipli,1/27/1983,Right-hand Bat,Right-arm Medium,India,Player,Deccan Chargers,Kolkata Knight Riders,2011,0,28,0,Blank,Blank,Kc Sangakkara,G Gambhir,Kc Sangakkara,Ms Bisla,1983-01-27
16658,50120800094,501208,94,Dw Steyn,6/27/1983,Right-hand Bat,Right-arm Fast,South Africa,Player,Deccan Chargers,Kolkata Knight Riders,2011,0,28,0,Blank,Blank,Kc Sangakkara,G Gambhir,Kc Sangakkara,Ms Bisla,1983-06-27
16665,50120800009,501208,9,Jh Kallis,10/16/1975,Right-hand Bat,Right-arm Fast-medium,South Africa,Player,Kolkata Knight Riders,Deccan Chargers,2011,1,36,1,Blank,Blank,G Gambhir,Kc Sangakkara,Ms Bisla,Kc Sangakkara,1975-10-16
16668,50120800087,501208,87,Mk Tiwary,11/14/1985,Right-hand Bat,Legbreak Googly,India,Player,Kolkata Knight Riders,Deccan Chargers,2011,0,26,1,Blank,Blank,G Gambhir,Kc Sangakkara,Ms Bisla,Kc Sangakkara,1985-11-14
16670,50120800140,501208,140,Iqbal Abdulla,12/2/1989,Left-hand Bat,Slow Left-arm Orthodox,India,Player,Kolkata Knight Riders,Deccan Chargers,2011,0,22,1,Blank,Blank,G Gambhir,Kc Sangakkara,Ms Bisla,Kc Sangakkara,1989-12-02
16671,50120800151,501208,151,L Balaji,9/27/1981,Right-hand Bat,Right-arm Medium-fast,India,Player,Kolkata Knight Riders,Deccan Chargers,2011,0,30,1,Blank,Blank,G Gambhir,Kc Sangakkara,Ms Bisla,Kc Sangakkara,1981-09-27
16675,50120800346,501208,346,Jd Unadkat,10/18/1991,Right-hand Bat,Left-arm Medium,India,Player,Kolkata Knight Riders,Deccan Chargers,2011,0,20,1,Blank,Blank,G Gambhir,Kc Sangakkara,Ms Bisla,Kc Sangakkara,1991-10-18
16686,50120900266,501209,266,Al Menaria,10/29/1990,Left-hand Bat,Slow Left-arm Orthodox,India,Player,Rajasthan Royals,Delhi Daredevils,2011,0,21,1,Blank,Blank,Sk Warne,V Sehwag,Ag Paunikar,Nv Ojha,1990-10-29
16687,50120900029,501209,29,Ik Pathan,10/27/1984,Left-hand Bat,Left-arm Medium-fast,India,Player,Delhi Daredevils,Rajasthan Royals,2011,0,27,0,Blank,Blank,V Sehwag,Sk Warne,Nv Ojha,Ag Paunikar,1984-10-27
16688,50120900041,501209,41,V Sehwag,10/20/1978,Right-hand Bat,Right-arm Offbreak,India,Captain,Delhi Daredevils,Rajasthan Royals,2011,0,33,0,Blank,Blank,V Sehwag,Sk Warne,Nv Ojha,Ag Paunikar,1978-10-20
16690,50120900106,501209,106,Ab Dinda,3/25/1984,Right-hand Bat,Right-arm Medium-fast,India,Player,Delhi Daredevils,Rajasthan Royals,2011,0,27,0,Blank,Blank,V Sehwag,Sk Warne,Nv Ojha,Ag Paunikar,1984-03-25
16692,50120900183,501209,183,Nv Ojha,7/20/1983,Right-hand Bat,N/a,India,Keeper,Delhi Daredevils,Rajasthan Royals,2011,0,28,0,Blank,Blank,V Sehwag,Sk Warne,Nv Ojha,Ag Paunikar,1983-07-20
16694,50120900190,501209,190,M Morkel,10/6/1984,Left-hand Bat,Right-arm Fast,South Africa,Player,Delhi Daredevils,Rajasthan Royals,2011,0,27,0,Blank,Blank,V Sehwag,Sk Warne,Nv Ojha,Ag Paunikar,1984-10-06
16701,50121000110,501210,110,Ab De Villiers,2/17/1984,Right-hand Bat,Right-arm Medium,South Africa,Keeper,Royal Challengers Bangalore,Mumbai Indians,2011,0,27,0,Blank,Blank,Dl Vettori,Sr Tendulkar,Ab De Villiers,Dj Jacobs,1984-02-17
16706,50121000244,501210,244,A Mithun,10/25/1989,Right-hand Bat,Right-arm Medium,India,Player,Royal Challengers Bangalore,Mumbai Indians,2011,0,22,0,Blank,Blank,Dl Vettori,Sr Tendulkar,Ab De Villiers,Dj Jacobs,1989-10-25
16709,50121000050,501210,50,Harbhajan Singh,7/3/1980,Right-hand Bat,Right-arm Offbreak,India,Player,Mumbai Indians,Royal Challengers Bangalore,2011,0,31,1,Blank,Blank,Sr Tendulkar,Dl Vettori,Dj Jacobs,Ab De Villiers,1980-07-03
16713,50121000194,501210,194,Sl Malinga,8/28/1983,Right-hand Bat,Right-arm Fast,Sri Lanka,Player,Mumbai Indians,Royal Challengers Bangalore,2011,0,28,1,Blank,Blank,Sr Tendulkar,Dl Vettori,Dj Jacobs,Ab De Villiers,1983-08-28
16715,50121000209,501210,209,R Sathish,1/14/1981,Right-hand Bat,Right-arm Medium,India,Player,Mumbai Indians,Royal Challengers Bangalore,2011,0,30,1,Blank,Blank,Sr Tendulkar,Dl Vettori,Dj Jacobs,Ab De Villiers,1981-01-14
16716,50121000221,501210,221,Ka Pollard,5/12/1987,Right-hand Bat,Right-arm Medium-fast,West Indies,Player,Mumbai Indians,Royal Challengers Bangalore,2011,0,24,1,Blank,Blank,Sr Tendulkar,Dl Vettori,Dj Jacobs,Ab De Villiers,1987-05-12
16717,50121000263,501210,263,Dj Jacobs,11/4/1982,Right-hand Bat,Right-arm Medium,South Africa,Keeper,Mumbai Indians,Royal Challengers Bangalore,2011,0,29,1,Blank,Blank,Sr Tendulkar,Dl Vettori,Dj Jacobs,Ab De Villiers,1982-11-04
16718,50121000275,501210,275,Jec Franklin,11/7/1980,Left-hand Bat,Left-arm Medium,New Zealand,Player,Mumbai Indians,Royal Challengers Bangalore,2011,0,31,1,Blank,Blank,Sr Tendulkar,Dl Vettori,Dj Jacobs,Ab De Villiers,1980-11-07
16720,50121100014,501211,14,P Kumar,10/2/1986,Right-hand Bat,Right-arm Medium,India,Player,Kings Xi Punjab,Chennai Super Kings,2011,0,25,1,Blank,Blank,Ac Gilchrist,Ms Dhoni,Ac Gilchrist,Ms Dhoni,1986-10-02
16721,50121100048,501211,48,Am Nayar,10/8/1983,Left-hand Bat,Right-arm Medium,India,Player,Kings Xi Punjab,Chennai Super Kings,2011,0,28,1,Blank,Blank,Ac Gilchrist,Ms Dhoni,Ac Gilchrist,Ms Dhoni,1983-10-08
16723,50121100067,501211,67,Pp Chawla,12/24/1988,Left-hand Bat,Legbreak,India,Player,Kings Xi Punjab,Chennai Super Kings,2011,0,23,1,Blank,Blank,Ac Gilchrist,Ms Dhoni,Ac Gilchrist,Ms Dhoni,1988-12-24
16726,50121100167,501211,167,Pc Valthaty,12/7/1983,Right-hand Bat,Right-arm Medium,India,Player,Kings Xi Punjab,Chennai Super Kings,2011,1,28,1,Blank,Blank,Ac Gilchrist,Ms Dhoni,Ac Gilchrist,Ms Dhoni,1983-12-07
16731,50121100020,501211,20,Ms Dhoni,7/7/1981,Right-hand Bat,Right-arm Medium,India,Captainkeeper,Chennai Super Kings,Kings Xi Punjab,2011,0,30,0,Blank,Blank,Ms Dhoni,Ac Gilchrist,Ms Dhoni,Ac Gilchrist,1981-07-07
16737,50121100185,501211,185,M Vijay,4/1/1984,Right-hand Bat,Right-arm Offbreak,India,Player,Chennai Super Kings,Kings Xi Punjab,2011,0,27,0,Blank,Blank,Ms Dhoni,Ac Gilchrist,Ms Dhoni,Ac Gilchrist,1984-04-01
16738,50121100186,501211,186,Sb Jakati,11/27/1980,Left-hand Bat,Slow Left-arm Orthodox,India,Player,Chennai Super Kings,Kings Xi Punjab,2011,0,31,0,Blank,Blank,Ms Dhoni,Ac Gilchrist,Ms Dhoni,Ac Gilchrist,1980-11-27
16739,50121100201,501211,201,R Ashwin,9/17/1986,Right-hand Bat,Right-arm Offbreak,India,Player,Chennai Super Kings,Kings Xi Punjab,2011,0,25,0,Blank,Blank,Ms Dhoni,Ac Gilchrist,Ms Dhoni,Ac Gilchrist,1986-09-17
16740,50121100278,501211,278,S Randiv,1/30/1985,Right-hand Bat,Right-arm Offbreak,Sri Lanka,Player,Chennai Super Kings,Kings Xi Punjab,2011,0,26,0,Blank,Blank,Ms Dhoni,Ac Gilchrist,Ms Dhoni,Ac Gilchrist,1985-01-30
16748,50121200077,501212,77,S Sreesanth,2/6/1983,Right-hand Bat,Right-arm Fast-medium,India,Player,Kochi Tuskers Kerala,Pune Warriors,2011,0,28,0,Blank,Blank,Dpmd Jayawardene,Yuvraj Singh,Pa Patel,Rv Uthappa,1983-02-06
16749,50121200081,501212,81,R Vinay Kumar,2/12/1984,Right-hand Bat,Right-arm Medium,India,Player,Kochi Tuskers Kerala,Pune Warriors,2011,0,27,0,Blank,Blank,Dpmd Jayawardene,Yuvraj Singh,Pa Patel,Rv Uthappa,1984-02-12
16750,50121200104,501212,104,Bj Hodge,12/29/1974,Right-hand Bat,Right-arm Offbreak,Australia,Player,Kochi Tuskers Kerala,Pune Warriors,2011,0,37,0,Blank,Blank,Dpmd Jayawardene,Yuvraj Singh,Pa Patel,Rv Uthappa,1974-12-29
16752,50121200259,501212,259,Rv Gomez,10/16/1985,Right-hand Bat,Right-arm Medium,India,Player,Kochi Tuskers Kerala,Pune Warriors,2011,0,26,0,Blank,Blank,Dpmd Jayawardene,Yuvraj Singh,Pa Patel,Rv Uthappa,1985-10-16
16753,50121200027,501212,27,Yuvraj Singh,12/12/1981,Left-hand Bat,Slow Left-arm Orthodox,India,Captain,Pune Warriors,Kochi Tuskers Kerala,2011,0,30,1,Blank,Blank,Yuvraj Singh,Dpmd Jayawardene,Rv Uthappa,Pa Patel,1981-12-12
16754,50121200046,501212,46,Rv Uthappa,11/11/1985,Right-hand Bat,Right-arm Medium,India,Keeper,Pune Warriors,Kochi Tuskers Kerala,2011,0,26,1,Blank,Blank,Yuvraj Singh,Dpmd Jayawardene,Rv Uthappa,Pa Patel,1985-11-11
16757,50121200157,501212,157,Jd Ryder,8/6/1984,Left-hand Bat,Right-arm Medium,New Zealand,Player,Pune Warriors,Kochi Tuskers Kerala,2011,0,27,1,Blank,Blank,Yuvraj Singh,Dpmd Jayawardene,Rv Uthappa,Pa Patel,1984-08-06
16758,50121200171,501212,171,M Manhas,10/12/1979,Right-hand Bat,Right-arm Offbreak,India,Player,Pune Warriors,Kochi Tuskers Kerala,2011,0,32,1,Blank,Blank,Yuvraj Singh,Dpmd Jayawardene,Rv Uthappa,Pa Patel,1979-10-12
16760,50121200235,501212,235,R Sharma,4/30/1987,Right-hand Bat,Right-arm Offbreak,India,Player,Pune Warriors,Kochi Tuskers Kerala,2011,0,24,1,Blank,Blank,Yuvraj Singh,Dpmd Jayawardene,Rv Uthappa,Pa Patel,1987-04-30
16761,50121200267,501212,267,Wd Parnell,7/30/1989,Left-hand Bat,Left-arm Medium-fast,South Africa,Player,Pune Warriors,Kochi Tuskers Kerala,2011,0,22,1,Blank,Blank,Yuvraj Singh,Dpmd Jayawardene,Rv Uthappa,Pa Patel,1989-07-30
16767,50121300110,501213,110,Ab De Villiers,2/17/1984,Right-hand Bat,Right-arm Medium,South Africa,Keeper,Royal Challengers Bangalore,Deccan Chargers,2011,0,27,0,Blank,Blank,Dl Vettori,Kc Sangakkara,Ab De Villiers,Kc Sangakkara,1984-02-17
16769,50121300175,501213,175,Dl Vettori,1/27/1979,Left-hand Bat,Slow Left-arm Orthodox,New Zealand,Captain,Royal Challengers Bangalore,Deccan Chargers,2011,0,32,0,Blank,Blank,Dl Vettori,Kc Sangakkara,Ab De Villiers,Kc Sangakkara,1979-01-27
16776,50121300042,501213,42,S Dhawan,12/5/1985,Left-hand Bat,Right-arm Offbreak,India,Player,Deccan Chargers,Royal Challengers Bangalore,2011,0,26,1,Blank,Blank,Kc Sangakkara,Dl Vettori,Kc Sangakkara,Ab De Villiers,1985-12-05
16777,50121300065,501213,65,S Sohal,11/10/1987,Right-hand Bat,Legbreak,India,Player,Deccan Chargers,Royal Challengers Bangalore,2011,0,24,1,Blank,Blank,Kc Sangakkara,Dl Vettori,Kc Sangakkara,Ab De Villiers,1987-11-10
16778,50121300084,501213,84,I Sharma,9/2/1988,Right-hand Bat,Right-arm Fast-medium,India,Player,Deccan Chargers,Royal Challengers Bangalore,2011,0,23,1,Blank,Blank,Kc Sangakkara,Dl Vettori,Kc Sangakkara,Ab De Villiers,1988-09-02
16779,50121300093,501213,93,B Chipli,1/27/1983,Right-hand Bat,Right-arm Medium,India,Player,Deccan Chargers,Royal Challengers Bangalore,2011,0,28,1,Blank,Blank,Kc Sangakkara,Dl Vettori,Kc Sangakkara,Ab De Villiers,1983-01-27
16780,50121300094,501213,94,Dw Steyn,6/27/1983,Right-hand Bat,Right-arm Fast,South Africa,Player,Deccan Chargers,Royal Challengers Bangalore,2011,1,28,1,Blank,Blank,Kc Sangakkara,Dl Vettori,Kc Sangakkara,Ab De Villiers,1983-06-27
16784,50121300154,501213,154,Jp Duminy,4/14/1984,Left-hand Bat,Right-arm Offbreak,South Africa,Player,Deccan Chargers,Royal Challengers Bangalore,2011,0,27,1,Blank,Blank,Kc Sangakkara,Dl Vettori,Kc Sangakkara,Ab De Villiers,1984-04-14
16789,50121400039,501214,39,Sk Trivedi,9/4/1982,Right-hand Bat,Right-arm Medium,India,Player,Rajasthan Royals,Kolkata Knight Riders,2011,0,29,0,Blank,Blank,Sk Warne,G Gambhir,Ag Paunikar,Ms Bisla,1982-09-04
16793,50121400196,501214,196,A Singh,6/21/1981,Right-hand Bat,Right-arm Medium-fast,India,Player,Rajasthan Royals,Kolkata Knight Riders,2011,0,30,0,Blank,Blank,Sk Warne,G Gambhir,Ag Paunikar,Ms Bisla,1981-06-21
16794,50121400252,501214,252,Ag Paunikar,4/18/1988,Right-hand Bat,N/a,India,Keeper,Rajasthan Royals,Kolkata Knight Riders,2011,0,23,0,Blank,Blank,Sk Warne,G Gambhir,Ag Paunikar,Ms Bisla,1988-04-18
16795,50121400266,501214,266,Al Menaria,10/29/1990,Left-hand Bat,Slow Left-arm Orthodox,India,Player,Rajasthan Royals,Kolkata Knight Riders,2011,0,21,0,Blank,Blank,Sk Warne,G Gambhir,Ag Paunikar,Ms Bisla,1990-10-29
16796,50121400298,501214,298,Nd Doshi,10/6/1978,Right-hand Bat,Slow Left-arm Orthodox,India,Player,Rajasthan Royals,Kolkata Knight Riders,2011,0,33,0,Blank,Blank,Sk Warne,G Gambhir,Ag Paunikar,Ms Bisla,1978-10-06
16797,50121400009,501214,9,Jh Kallis,10/16/1975,Right-hand Bat,Right-arm Fast-medium,South Africa,Player,Kolkata Knight Riders,Rajasthan Royals,2011,0,36,1,Blank,Blank,G Gambhir,Sk Warne,Ms Bisla,Ag Paunikar,1975-10-16
16801,50121400087,501214,87,Mk Tiwary,11/14/1985,Right-hand Bat,Legbreak Googly,India,Player,Kolkata Knight Riders,Rajasthan Royals,2011,0,26,1,Blank,Blank,G Gambhir,Sk Warne,Ms Bisla,Ag Paunikar,1985-11-14
16803,50121400140,501214,140,Iqbal Abdulla,12/2/1989,Left-hand Bat,Slow Left-arm Orthodox,India,Player,Kolkata Knight Riders,Rajasthan Royals,2011,0,22,1,Blank,Blank,G Gambhir,Sk Warne,Ms Bisla,Ag Paunikar,1989-12-02
16805,50121400214,501214,214,Ms Bisla,12/27/1984,Right-hand Bat,N/a,India,Keeper,Kolkata Knight Riders,Rajasthan Royals,2011,0,27,1,Blank,Blank,G Gambhir,Sk Warne,Ms Bisla,Ag Paunikar,1984-12-27
16808,50121500050,501215,50,Harbhajan Singh,7/3/1980,Right-hand Bat,Right-arm Offbreak,India,Player,Mumbai Indians,Kochi Tuskers Kerala,2011,0,31,0,Blank,Blank,Sr Tendulkar,Dpmd Jayawardene,Dj Jacobs,Pa Patel,1980-07-03
16809,50121500056,501215,56,A Symonds,6/9/1975,Right-hand Bat,Right-arm Offbreak,Australia,Player,Mumbai Indians,Kochi Tuskers Kerala,2011,0,36,0,Blank,Blank,Sr Tendulkar,Dpmd Jayawardene,Dj Jacobs,Pa Patel,1975-06-09
16810,50121500057,501215,57,Rg Sharma,4/30/1987,Right-hand Bat,Right-arm Offbreak,India,Player,Mumbai Indians,Kochi Tuskers Kerala,2011,0,24,0,Blank,Blank,Sr Tendulkar,Dpmd Jayawardene,Dj Jacobs,Pa Patel,1987-04-30
16813,50121500194,501215,194,Sl Malinga,8/28/1983,Right-hand Bat,Right-arm Fast,Sri Lanka,Player,Mumbai Indians,Kochi Tuskers Kerala,2011,0,28,0,Blank,Blank,Sr Tendulkar,Dpmd Jayawardene,Dj Jacobs,Pa Patel,1983-08-28
16815,50121500209,501215,209,R Sathish,1/14/1981,Right-hand Bat,Right-arm Medium,India,Player,Mumbai Indians,Kochi Tuskers Kerala,2011,0,30,0,Blank,Blank,Sr Tendulkar,Dpmd Jayawardene,Dj Jacobs,Pa Patel,1981-01-14
16816,50121500221,501215,221,Ka Pollard,5/12/1987,Right-hand Bat,Right-arm Medium-fast,West Indies,Player,Mumbai Indians,Kochi Tuskers Kerala,2011,0,24,0,Blank,Blank,Sr Tendulkar,Dpmd Jayawardene,Dj Jacobs,Pa Patel,1987-05-12
16823,50121500064,501215,64,Dpmd Jayawardene,5/27/1977,Right-hand Bat,Right-arm Medium,Sri Lanka,Captain,Kochi Tuskers Kerala,Mumbai Indians,2011,0,34,1,Blank,Blank,Dpmd Jayawardene,Sr Tendulkar,Pa Patel,Dj Jacobs,1977-05-27
16825,50121500104,501215,104,Bj Hodge,12/29/1974,Right-hand Bat,Right-arm Offbreak,Australia,Player,Kochi Tuskers Kerala,Mumbai Indians,2011,0,37,1,Blank,Blank,Dpmd Jayawardene,Sr Tendulkar,Pa Patel,Dj Jacobs,1974-12-29
16828,50121500259,501215,259,Rv Gomez,10/16/1985,Right-hand Bat,Right-arm Medium,India,Player,Kochi Tuskers Kerala,Mumbai Indians,2011,0,26,1,Blank,Blank,Dpmd Jayawardene,Sr Tendulkar,Pa Patel,Dj Jacobs,1985-10-16
16830,50121600008,501216,8,V Kohli,11/5/1988,Right-hand Bat,Right-arm Medium,India,Player,Royal Challengers Bangalore,Chennai Super Kings,2011,0,23,0,Blank,Blank,Dl Vettori,Ms Dhoni,Ab De Villiers,Ms Dhoni,1988-11-05
16832,50121600079,501216,79,Ss Tiwary,12/30/1989,Left-hand Bat,N/a,India,Player,Royal Challengers Bangalore,Chennai Super Kings,2011,0,22,0,Blank,Blank,Dl Vettori,Ms Dhoni,Ab De Villiers,Ms Dhoni,1989-12-30
16835,50121600175,501216,175,Dl Vettori,1/27/1979,Left-hand Bat,Slow Left-arm Orthodox,New Zealand,Captain,Royal Challengers Bangalore,Chennai Super Kings,2011,0,32,0,Blank,Blank,Dl Vettori,Ms Dhoni,Ab De Villiers,Ms Dhoni,1979-01-27
16837,50121600260,501216,260,Ma Agarwal,2/16/1991,Right-hand Bat,N/a,India,Player,Royal Challengers Bangalore,Chennai Super Kings,2011,0,20,0,Blank,Blank,Dl Vettori,Ms Dhoni,Ab De Villiers,Ms Dhoni,1991-02-16
16838,50121600261,501216,261,Auk Pathan,6/17/1984,Right-hand Bat,Right-arm Medium,India,Player,Royal Challengers Bangalore,Chennai Super Kings,2011,0,27,0,Blank,Blank,Dl Vettori,Ms Dhoni,Ab De Villiers,Ms Dhoni,1984-06-17
16840,50121600269,501216,269,R Ninan,11/19/1985,Right-hand Bat,Right-arm Offbreak,India,Player,Royal Challengers Bangalore,Chennai Super Kings,2011,0,26,0,Blank,Blank,Dl Vettori,Ms Dhoni,Ab De Villiers,Ms Dhoni,1985-11-19
16846,50121600125,501216,125,S Anirudha,4/14/1987,Right-hand Bat,N/a,India,Player,Chennai Super Kings,Royal Challengers Bangalore,2011,0,24,1,Blank,Blank,Ms Dhoni,Dl Vettori,Ms Dhoni,Ab De Villiers,1987-04-14
16848,50121600186,501216,186,Sb Jakati,11/27/1980,Left-hand Bat,Slow Left-arm Orthodox,India,Player,Chennai Super Kings,Royal Challengers Bangalore,2011,0,31,1,Blank,Blank,Ms Dhoni,Dl Vettori,Ms Dhoni,Ab De Villiers,1980-11-27
16850,50121600278,501216,278,S Randiv,1/30/1985,Right-hand Bat,Right-arm Offbreak,Sri Lanka,Player,Chennai Super Kings,Royal Challengers Bangalore,2011,0,26,1,Blank,Blank,Ms Dhoni,Dl Vettori,Ms Dhoni,Ab De Villiers,1985-01-30
16851,50121600377,501216,377,Tg Southee,12/11/1988,Right-hand Bat,Right-arm Medium-fast,New Zealand,Player,Chennai Super Kings,Royal Challengers Bangalore,2011,0,23,1,Blank,Blank,Ms Dhoni,Dl Vettori,Ms Dhoni,Ab De Villiers,1988-12-11
16853,50121700048,501217,48,Am Nayar,10/8/1983,Left-hand Bat,Right-arm Medium,India,Player,Kings Xi Punjab,Deccan Chargers,2011,0,28,1,Blank,Blank,Ac Gilchrist,Kc Sangakkara,Ac Gilchrist,Kc Sangakkara,1983-10-08
16854,50121700053,501217,53,Ac Gilchrist,11/14/1971,Left-hand Bat,Right-arm Offbreak,Australia,Captainkeeper,Kings Xi Punjab,Deccan Chargers,2011,0,40,1,Blank,Blank,Ac Gilchrist,Kc Sangakkara,Ac Gilchrist,Kc Sangakkara,1971-11-14
16860,50121700210,501217,210,R Mclaren,2/9/1983,Left-hand Bat,Right-arm Medium-fast,South Africa,Player,Kings Xi Punjab,Deccan Chargers,2011,0,28,1,Blank,Blank,Ac Gilchrist,Kc Sangakkara,Ac Gilchrist,Kc Sangakkara,1983-02-09
16861,50121700243,501217,243,Vs Malik,5/9/1983,Right-hand Bat,Right-arm Medium,India,Player,Kings Xi Punjab,Deccan Chargers,2011,0,28,1,Blank,Blank,Ac Gilchrist,Kc Sangakkara,Ac Gilchrist,Kc Sangakkara,1983-05-09
16863,50121700026,501217,26,Kc Sangakkara,10/27/1977,Left-hand Bat,Right-arm Offbreak,Sri Lanka,Captainkeeper,Deccan Chargers,Kings Xi Punjab,2011,0,34,0,Blank,Blank,Kc Sangakkara,Ac Gilchrist,Kc Sangakkara,Ac Gilchrist,1977-10-27
16866,50121700084,501217,84,I Sharma,9/2/1988,Right-hand Bat,Right-arm Fast-medium,India,Player,Deccan Chargers,Kings Xi Punjab,2011,0,23,0,Blank,Blank,Kc Sangakkara,Ac Gilchrist,Kc Sangakkara,Ac Gilchrist,1988-09-02
16871,50121700136,501217,136,A Mishra,11/24/1982,Right-hand Bat,Legbreak,India,Player,Deccan Chargers,Kings Xi Punjab,2011,0,29,0,Blank,Blank,Kc Sangakkara,Ac Gilchrist,Kc Sangakkara,Ac Gilchrist,1982-11-24
16872,50121700154,501217,154,Jp Duminy,4/14/1984,Left-hand Bat,Right-arm Offbreak,South Africa,Player,Deccan Chargers,Kings Xi Punjab,2011,0,27,0,Blank,Blank,Kc Sangakkara,Ac Gilchrist,Kc Sangakkara,Ac Gilchrist,1984-04-14
16873,50121700258,501217,258,Dt Christian,5/4/1983,Right-hand Bat,Right-arm Fast-medium,Australia,Player,Deccan Chargers,Kings Xi Punjab,2011,0,28,0,Blank,Blank,Kc Sangakkara,Ac Gilchrist,Kc Sangakkara,Ac Gilchrist,1983-05-04
16877,50121800054,501218,54,Y Venugopal Rao,2/26/1982,Right-hand Bat,Right-arm Offbreak,India,Player,Delhi Daredevils,Pune Warriors,2011,0,29,1,Blank,Blank,V Sehwag,Yuvraj Singh,Nv Ojha,Rv Uthappa,1982-02-26
16878,50121800106,501218,106,Ab Dinda,3/25/1984,Right-hand Bat,Right-arm Medium-fast,India,Player,Delhi Daredevils,Pune Warriors,2011,0,27,1,Blank,Blank,V Sehwag,Yuvraj Singh,Nv Ojha,Rv Uthappa,1984-03-25
16879,50121800183,501218,183,Nv Ojha,7/20/1983,Right-hand Bat,N/a,India,Keeper,Delhi Daredevils,Pune Warriors,2011,0,28,1,Blank,Blank,V Sehwag,Yuvraj Singh,Nv Ojha,Rv Uthappa,1983-07-20
16880,50121800187,501218,187,Da Warner,10/27/1986,Left-hand Bat,Legbreak,Australia,Player,Delhi Daredevils,Pune Warriors,2011,0,25,1,Blank,Blank,V Sehwag,Yuvraj Singh,Nv Ojha,Rv Uthappa,1986-10-27
16884,50121800293,501218,293,S Nadeem,8/12/1989,Right-hand Bat,Slow Left-arm Orthodox,India,Player,Delhi Daredevils,Pune Warriors,2011,0,22,1,Blank,Blank,V Sehwag,Yuvraj Singh,Nv Ojha,Rv Uthappa,1989-08-12
16886,50121800046,501218,46,Rv Uthappa,11/11/1985,Right-hand Bat,Right-arm Medium,India,Keeper,Pune Warriors,Delhi Daredevils,2011,0,26,0,Blank,Blank,Yuvraj Singh,V Sehwag,Rv Uthappa,Nv Ojha,1985-11-11
16887,50121800074,501218,74,Gc Smith,2/1/1981,Left-hand Bat,Right-arm Offbreak,South Africa,Player,Pune Warriors,Delhi Daredevils,2011,0,30,0,Blank,Blank,Yuvraj Singh,V Sehwag,Rv Uthappa,Nv Ojha,1981-02-01
16888,50121800157,501218,157,Jd Ryder,8/6/1984,Left-hand Bat,Right-arm Medium,New Zealand,Player,Pune Warriors,Delhi Daredevils,2011,0,27,0,Blank,Blank,Yuvraj Singh,V Sehwag,Rv Uthappa,Nv Ojha,1984-08-06
16891,50121800231,501218,231,Md Mishra,2/9/1984,Right-hand Bat,Right-arm Offbreak,India,Player,Pune Warriors,Delhi Daredevils,2011,0,27,0,Blank,Blank,Yuvraj Singh,V Sehwag,Rv Uthappa,Nv Ojha,1984-02-09
16893,50121800267,501218,267,Wd Parnell,7/30/1989,Left-hand Bat,Left-arm Medium-fast,South Africa,Player,Pune Warriors,Delhi Daredevils,2011,0,22,0,Blank,Blank,Yuvraj Singh,V Sehwag,Rv Uthappa,Nv Ojha,1989-07-30
16894,50121800273,501218,273,Sb Wagh,10/9/1988,Left-hand Bat,Left-arm Medium-fast,India,Player,Pune Warriors,Delhi Daredevils,2011,0,23,0,Blank,Blank,Yuvraj Singh,V Sehwag,Rv Uthappa,Nv Ojha,1988-10-09
16897,50121900038,501219,38,Sk Warne,9/13/1969,Right-hand Bat,Legbreak Googly,Australia,Captain,Rajasthan Royals,Kolkata Knight Riders,2011,0,42,0,Blank,Blank,Sk Warne,G Gambhir,Ag Paunikar,Ms Bisla,1969-09-13
16898,50121900039,501219,39,Sk Trivedi,9/4/1982,Right-hand Bat,Right-arm Medium,India,Player,Rajasthan Royals,Kolkata Knight Riders,2011,0,29,0,Blank,Blank,Sk Warne,G Gambhir,Ag Paunikar,Ms Bisla,1982-09-04
16900,50121900085,501219,85,Am Rahane,6/6/1988,Right-hand Bat,Right-arm Medium,India,Player,Rajasthan Royals,Kolkata Knight Riders,2011,0,23,0,Blank,Blank,Sk Warne,G Gambhir,Ag Paunikar,Ms Bisla,1988-06-06
16907,50121900009,501219,9,Jh Kallis,10/16/1975,Right-hand Bat,Right-arm Fast-medium,South Africa,Player,Kolkata Knight Riders,Rajasthan Royals,2011,0,36,1,Blank,Blank,G Gambhir,Sk Warne,Ms Bisla,Ag Paunikar,1975-10-16
16910,50121900066,501219,66,B Lee,11/8/1976,Right-hand Bat,Right-arm Fast,Australia,Player,Kolkata Knight Riders,Rajasthan Royals,2011,0,35,1,Blank,Blank,G Gambhir,Sk Warne,Ms Bisla,Ag Paunikar,1976-11-08
16916,50121900216,501219,216,Ejg Morgan,9/10/1986,Left-hand Bat,Right-arm Medium,England,Player,Kolkata Knight Riders,Rajasthan Royals,2011,0,25,1,Blank,Blank,G Gambhir,Sk Warne,Ms Bisla,Ag Paunikar,1986-09-10
16918,50122000019,501220,19,Mek Hussey,5/27/1975,Left-hand Bat,Right-arm Medium,Australia,Player,Chennai Super Kings,Kochi Tuskers Kerala,2011,0,36,0,Blank,Blank,Ms Dhoni,Dpmd Jayawardene,Ms Dhoni,Pa Patel,1975-05-27
16920,50122000021,501220,21,Sk Raina,11/27/1986,Left-hand Bat,Right-arm Offbreak,India,Player,Chennai Super Kings,Kochi Tuskers Kerala,2011,0,25,0,Blank,Blank,Ms Dhoni,Dpmd Jayawardene,Ms Dhoni,Pa Patel,1986-11-27
16929,50122000002,501220,2,Bb Mccullum,9/27/1981,Right-hand Bat,Right-arm Medium,New Zealand,Player,Kochi Tuskers Kerala,Chennai Super Kings,2011,1,30,1,Blank,Blank,Dpmd Jayawardene,Ms Dhoni,Pa Patel,Ms Dhoni,1981-09-27
16933,50122000064,501220,64,Dpmd Jayawardene,5/27/1977,Right-hand Bat,Right-arm Medium,Sri Lanka,Captain,Kochi Tuskers Kerala,Chennai Super Kings,2011,0,34,1,Blank,Blank,Dpmd Jayawardene,Ms Dhoni,Pa Patel,Ms Dhoni,1977-05-27
16934,50122000081,501220,81,R Vinay Kumar,2/12/1984,Right-hand Bat,Right-arm Medium,India,Player,Kochi Tuskers Kerala,Chennai Super Kings,2011,0,27,1,Blank,Blank,Dpmd Jayawardene,Ms Dhoni,Pa Patel,Ms Dhoni,1984-02-12
16937,50122000237,501220,237,Km Jadhav,3/26/1985,Right-hand Bat,Right-arm Offbreak,India,Player,Kochi Tuskers Kerala,Chennai Super Kings,2011,0,26,1,Blank,Blank,Dpmd Jayawardene,Ms Dhoni,Pa Patel,Ms Dhoni,1985-03-26
16938,50122000259,501220,259,Rv Gomez,10/16/1985,Right-hand Bat,Right-arm Medium,India,Player,Kochi Tuskers Kerala,Chennai Super Kings,2011,0,26,1,Blank,Blank,Dpmd Jayawardene,Ms Dhoni,Pa Patel,Ms Dhoni,1985-10-16
16940,50122100010,501221,10,Cl White,8/18/1983,Right-hand Bat,Legbreak Googly,Australia,Player,Deccan Chargers,Delhi Daredevils,2011,0,28,1,Blank,Blank,Kc Sangakkara,V Sehwag,Kc Sangakkara,Nv Ojha,1983-08-18
16943,50122100065,501221,65,S Sohal,11/10/1987,Right-hand Bat,Legbreak,India,Player,Deccan Chargers,Delhi Daredevils,2011,1,24,1,Blank,Blank,Kc Sangakkara,V Sehwag,Kc Sangakkara,Nv Ojha,1987-11-10
16944,50122100093,501221,93,B Chipli,1/27/1983,Right-hand Bat,Right-arm Medium,India,Player,Deccan Chargers,Delhi Daredevils,2011,0,28,1,Blank,Blank,Kc Sangakkara,V Sehwag,Kc Sangakkara,Nv Ojha,1983-01-27
16947,50122100131,501221,131,Pp Ojha,9/5/1986,Left-hand Bat,Slow Left-arm Orthodox,India,Player,Deccan Chargers,Delhi Daredevils,2011,0,25,1,Blank,Blank,Kc Sangakkara,V Sehwag,Kc Sangakkara,Nv Ojha,1986-09-05
16948,50122100136,501221,136,A Mishra,11/24/1982,Right-hand Bat,Legbreak,India,Player,Deccan Chargers,Delhi Daredevils,2011,0,29,1,Blank,Blank,Kc Sangakkara,V Sehwag,Kc Sangakkara,Nv Ojha,1982-11-24
16949,50122100256,501221,256,Harmeet Singh,9/7/1992,Left-hand Bat,Slow Left-arm Orthodox,India,Player,Deccan Chargers,Delhi Daredevils,2011,0,19,1,Blank,Blank,Kc Sangakkara,V Sehwag,Kc Sangakkara,Nv Ojha,1992-09-07
16950,50122100258,501221,258,Dt Christian,5/4/1983,Right-hand Bat,Right-arm Fast-medium,Australia,Player,Deccan Chargers,Delhi Daredevils,2011,0,28,1,Blank,Blank,Kc Sangakkara,V Sehwag,Kc Sangakkara,Nv Ojha,1983-05-04
16952,50122100029,501221,29,Ik Pathan,10/27/1984,Left-hand Bat,Left-arm Medium-fast,India,Player,Delhi Daredevils,Deccan Chargers,2011,0,27,0,Blank,Blank,V Sehwag,Kc Sangakkara,Nv Ojha,Kc Sangakkara,1984-10-27
16953,50122100041,501221,41,V Sehwag,10/20/1978,Right-hand Bat,Right-arm Offbreak,India,Captain,Delhi Daredevils,Deccan Chargers,2011,0,33,0,Blank,Blank,V Sehwag,Kc Sangakkara,Nv Ojha,Kc Sangakkara,1978-10-20
16955,50122100106,501221,106,Ab Dinda,3/25/1984,Right-hand Bat,Right-arm Medium-fast,India,Player,Delhi Daredevils,Deccan Chargers,2011,0,27,0,Blank,Blank,V Sehwag,Kc Sangakkara,Nv Ojha,Kc Sangakkara,1984-03-25
16956,50122100183,501221,183,Nv Ojha,7/20/1983,Right-hand Bat,N/a,India,Keeper,Delhi Daredevils,Deccan Chargers,2011,0,28,0,Blank,Blank,V Sehwag,Kc Sangakkara,Nv Ojha,Kc Sangakkara,1983-07-20
16961,50122100293,501221,293,S Nadeem,8/12/1989,Right-hand Bat,Slow Left-arm Orthodox,India,Player,Delhi Daredevils,Deccan Chargers,2011,0,22,0,Blank,Blank,V Sehwag,Kc Sangakkara,Nv Ojha,Kc Sangakkara,1989-08-12
16962,50122300056,501223,56,A Symonds,6/9/1975,Right-hand Bat,Right-arm Offbreak,Australia,Player,Mumbai Indians,Pune Warriors,2011,0,36,1,Blank,Blank,Sr Tendulkar,Yuvraj Singh,At Rayudu,Td Paine,1975-06-09
16970,50122300246,501223,246,An Ahmed,11/5/1988,Right-hand Bat,Right-arm Medium-fast,India,Player,Mumbai Indians,Pune Warriors,2011,0,23,1,Blank,Blank,Sr Tendulkar,Yuvraj Singh,At Rayudu,Td Paine,1988-11-05
16974,50122300046,501223,46,Rv Uthappa,11/11/1985,Right-hand Bat,Right-arm Medium,India,Player,Pune Warriors,Mumbai Indians,2011,0,26,0,Blank,Blank,Yuvraj Singh,Sr Tendulkar,Td Paine,At Rayudu,1985-11-11
16975,50122300083,501223,83,M Kartik,9/11/1976,Left-hand Bat,Slow Left-arm Orthodox,India,Player,Pune Warriors,Mumbai Indians,2011,0,35,0,Blank,Blank,Yuvraj Singh,Sr Tendulkar,Td Paine,At Rayudu,1976-09-11
16977,50122300171,501223,171,M Manhas,10/12/1979,Right-hand Bat,Right-arm Offbreak,India,Player,Pune Warriors,Mumbai Indians,2011,0,32,0,Blank,Blank,Yuvraj Singh,Sr Tendulkar,Td Paine,At Rayudu,1979-10-12
16978,50122300231,501223,231,Md Mishra,2/9/1984,Right-hand Bat,Right-arm Offbreak,India,Player,Pune Warriors,Mumbai Indians,2011,0,27,0,Blank,Blank,Yuvraj Singh,Sr Tendulkar,Td Paine,At Rayudu,1984-02-09
16980,50122300267,501223,267,Wd Parnell,7/30/1989,Left-hand Bat,Left-arm Medium-fast,South Africa,Player,Pune Warriors,Mumbai Indians,2011,0,22,0,Blank,Blank,Yuvraj Singh,Sr Tendulkar,Td Paine,At Rayudu,1989-07-30
16981,50122300272,501223,272,Td Paine,12/8/1984,Right-hand Bat,Right-arm Medium,Australia,Keeper,Pune Warriors,Mumbai Indians,2011,0,27,0,Blank,Blank,Yuvraj Singh,Sr Tendulkar,Td Paine,At Rayudu,1984-12-08
16985,50122400031,501224,31,Yk Pathan,11/17/1982,Right-hand Bat,Right-arm Offbreak,India,Player,Kolkata Knight Riders,Kochi Tuskers Kerala,2011,0,29,0,Blank,Blank,G Gambhir,Dpmd Jayawardene,Ms Bisla,Pa Patel,1982-11-17
16986,50122400040,501224,40,G Gambhir,10/14/1981,Left-hand Bat,Legbreak,India,Captain,Kolkata Knight Riders,Kochi Tuskers Kerala,2011,0,30,0,Blank,Blank,G Gambhir,Dpmd Jayawardene,Ms Bisla,Pa Patel,1981-10-14
16989,50122400089,501224,89,R Bhatia,10/22/1979,Right-hand Bat,Right-arm Medium-fast,India,Player,Kolkata Knight Riders,Kochi Tuskers Kerala,2011,0,32,0,Blank,Blank,G Gambhir,Dpmd Jayawardene,Ms Bisla,Pa Patel,1979-10-22
16990,50122400140,501224,140,Iqbal Abdulla,12/2/1989,Left-hand Bat,Slow Left-arm Orthodox,India,Player,Kolkata Knight Riders,Kochi Tuskers Kerala,2011,0,22,0,Blank,Blank,G Gambhir,Dpmd Jayawardene,Ms Bisla,Pa Patel,1989-12-02
16993,50122400216,501224,216,Ejg Morgan,9/10/1986,Left-hand Bat,Right-arm Medium,England,Player,Kolkata Knight Riders,Kochi Tuskers Kerala,2011,0,25,0,Blank,Blank,G Gambhir,Dpmd Jayawardene,Ms Bisla,Pa Patel,1986-09-10
16995,50122400002,501224,2,Bb Mccullum,9/27/1981,Right-hand Bat,Right-arm Medium,New Zealand,Player,Kochi Tuskers Kerala,Kolkata Knight Riders,2011,0,30,1,Blank,Blank,Dpmd Jayawardene,G Gambhir,Pa Patel,Ms Bisla,1981-09-27
16997,50122400035,501224,35,Ra Jadeja,12/6/1988,Left-hand Bat,Slow Left-arm Orthodox,India,Player,Kochi Tuskers Kerala,Kolkata Knight Riders,2011,0,23,1,Blank,Blank,Dpmd Jayawardene,G Gambhir,Pa Patel,Ms Bisla,1988-12-06
16998,50122400061,501224,61,Rp Singh,12/6/1985,Right-hand Bat,Left-arm Fast-medium,India,Player,Kochi Tuskers Kerala,Kolkata Knight Riders,2011,0,26,1,Blank,Blank,Dpmd Jayawardene,G Gambhir,Pa Patel,Ms Bisla,1985-12-06
17005,50122400259,501224,259,Rv Gomez,10/16/1985,Right-hand Bat,Right-arm Medium,India,Player,Kochi Tuskers Kerala,Kolkata Knight Riders,2011,0,26,1,Blank,Blank,Dpmd Jayawardene,G Gambhir,Pa Patel,Ms Bisla,1985-10-16
17008,50122500053,501225,53,Ac Gilchrist,11/14/1971,Left-hand Bat,Right-arm Offbreak,Australia,Captainkeeper,Kings Xi Punjab,Rajasthan Royals,2011,0,40,1,Blank,Blank,Ac Gilchrist,Sk Warne,Ac Gilchrist,Dh Yagnik,1971-11-14
17013,50122500188,501225,188,Rj Harris,10/11/1979,Right-hand Bat,Right-arm Fast,Australia,Player,Kings Xi Punjab,Rajasthan Royals,2011,0,32,1,Blank,Blank,Ac Gilchrist,Sk Warne,Ac Gilchrist,Dh Yagnik,1979-10-11
17016,50122500302,501225,302,Ba Bhatt,5/13/1990,Left-hand Bat,Slow Left-arm Orthodox,India,Player,Kings Xi Punjab,Rajasthan Royals,2011,0,21,1,Blank,Blank,Ac Gilchrist,Sk Warne,Ac Gilchrist,Dh Yagnik,1990-05-13
17018,50122500032,501225,32,Sr Watson,6/17/1981,Right-hand Bat,Right-arm Fast-medium,Australia,Player,Rajasthan Royals,Kings Xi Punjab,2011,0,30,0,Blank,Blank,Sk Warne,Ac Gilchrist,Dh Yagnik,Ac Gilchrist,1981-06-17
17019,50122500038,501225,38,Sk Warne,9/13/1969,Right-hand Bat,Legbreak Googly,Australia,Captain,Rajasthan Royals,Kings Xi Punjab,2011,0,42,0,Blank,Blank,Sk Warne,Ac Gilchrist,Dh Yagnik,Ac Gilchrist,1969-09-13
17021,50122500052,501225,52,Lrpl Taylor,3/8/1984,Right-hand Bat,Right-arm Offbreak,New Zealand,Player,Rajasthan Royals,Kings Xi Punjab,2011,0,27,0,Blank,Blank,Sk Warne,Ac Gilchrist,Dh Yagnik,Ac Gilchrist,1984-03-08
17024,50122500238,501225,238,Sw Tait,2/22/1983,Right-hand Bat,Right-arm Fast,Australia,Player,Rajasthan Royals,Kings Xi Punjab,2011,0,28,0,Blank,Blank,Sk Warne,Ac Gilchrist,Dh Yagnik,Ac Gilchrist,1983-02-22
17025,50122500255,501225,255,Str Binny,6/3/1984,Right-hand Bat,Right-arm Medium,India,Player,Rajasthan Royals,Kings Xi Punjab,2011,0,27,0,Blank,Blank,Sk Warne,Ac Gilchrist,Dh Yagnik,Ac Gilchrist,1984-06-03
17026,50122500266,501225,266,Al Menaria,10/29/1990,Left-hand Bat,Slow Left-arm Orthodox,India,Player,Rajasthan Royals,Kings Xi Punjab,2011,0,21,0,Blank,Blank,Sk Warne,Ac Gilchrist,Dh Yagnik,Ac Gilchrist,1990-10-29
17027,50122500277,501225,277,Dh Yagnik,6/22/1983,Left-hand Bat,N/a,India,Keeper,Rajasthan Royals,Kings Xi Punjab,2011,0,28,0,Blank,Blank,Sk Warne,Ac Gilchrist,Dh Yagnik,Ac Gilchrist,1983-06-22
17030,50122600057,501226,57,Rg Sharma,4/30/1987,Right-hand Bat,Right-arm Offbreak,India,Player,Mumbai Indians,Chennai Super Kings,2011,0,24,1,Blank,Blank,Sr Tendulkar,Ms Dhoni,At Rayudu,Ms Dhoni,1987-04-30
17036,50122600221,501226,221,Ka Pollard,5/12/1987,Right-hand Bat,Right-arm Medium-fast,West Indies,Player,Mumbai Indians,Chennai Super Kings,2011,0,24,1,Blank,Blank,Sr Tendulkar,Ms Dhoni,At Rayudu,Ms Dhoni,1987-05-12
17038,50122600275,501226,275,Jec Franklin,11/7/1980,Left-hand Bat,Left-arm Medium,New Zealand,Player,Mumbai Indians,Chennai Super Kings,2011,0,31,1,Blank,Blank,Sr Tendulkar,Ms Dhoni,At Rayudu,Ms Dhoni,1980-11-07
17042,50122600023,501226,23,S Badrinath,8/30/1980,Right-hand Bat,Right-arm Offbreak,India,Player,Chennai Super Kings,Mumbai Indians,2011,0,31,0,Blank,Blank,Ms Dhoni,Sr Tendulkar,Ms Dhoni,At Rayudu,1980-08-30
17043,50122600109,501226,109,Ja Morkel,6/10/1981,Left-hand Bat,Right-arm Medium-fast,South Africa,Player,Chennai Super Kings,Mumbai Indians,2011,0,30,0,Blank,Blank,Ms Dhoni,Sr Tendulkar,Ms Dhoni,At Rayudu,1981-06-10
17045,50122600125,501226,125,S Anirudha,4/14/1987,Right-hand Bat,N/a,India,Player,Chennai Super Kings,Mumbai Indians,2011,0,24,0,Blank,Blank,Ms Dhoni,Sr Tendulkar,Ms Dhoni,At Rayudu,1987-04-14
17046,50122600185,501226,185,M Vijay,4/1/1984,Right-hand Bat,Right-arm Offbreak,India,Player,Chennai Super Kings,Mumbai Indians,2011,0,27,0,Blank,Blank,Ms Dhoni,Sr Tendulkar,Ms Dhoni,At Rayudu,1984-04-01
17049,50122600278,501226,278,S Randiv,1/30/1985,Right-hand Bat,Right-arm Offbreak,Sri Lanka,Player,Chennai Super Kings,Mumbai Indians,2011,0,26,0,Blank,Blank,Ms Dhoni,Sr Tendulkar,Ms Dhoni,At Rayudu,1985-01-30
17050,50122700008,501227,8,V Kohli,11/5/1988,Right-hand Bat,Right-arm Medium,India,Player,Royal Challengers Bangalore,Kolkata Knight Riders,2011,0,23,1,Blank,Blank,Dl Vettori,G Gambhir,Ab De Villiers,Bj Haddin,1988-11-05
17051,50122700015,501227,15,Z Khan,10/7/1978,Right-hand Bat,Left-arm Fast-medium,India,Player,Royal Challengers Bangalore,Kolkata Knight Riders,2011,0,33,1,Blank,Blank,Dl Vettori,G Gambhir,Ab De Villiers,Bj Haddin,1978-10-07
17052,50122700079,501227,79,Ss Tiwary,12/30/1989,Left-hand Bat,N/a,India,Player,Royal Challengers Bangalore,Kolkata Knight Riders,2011,0,22,1,Blank,Blank,Dl Vettori,G Gambhir,Ab De Villiers,Bj Haddin,1989-12-30
17054,50122700135,501227,135,Tm Dilshan,10/14/1976,Right-hand Bat,Right-arm Offbreak,Sri Lanka,Player,Royal Challengers Bangalore,Kolkata Knight Riders,2011,0,35,1,Blank,Blank,Dl Vettori,G Gambhir,Ab De Villiers,Bj Haddin,1976-10-14
17056,50122700175,501227,175,Dl Vettori,1/27/1979,Left-hand Bat,Slow Left-arm Orthodox,New Zealand,Captain,Royal Challengers Bangalore,Kolkata Knight Riders,2011,0,32,1,Blank,Blank,Dl Vettori,G Gambhir,Ab De Villiers,Bj Haddin,1979-01-27
17058,50122700261,501227,261,Auk Pathan,6/17/1984,Right-hand Bat,Right-arm Medium,India,Player,Royal Challengers Bangalore,Kolkata Knight Riders,2011,0,27,1,Blank,Blank,Dl Vettori,G Gambhir,Ab De Villiers,Bj Haddin,1984-06-17
17062,50122700031,501227,31,Yk Pathan,11/17/1982,Right-hand Bat,Right-arm Offbreak,India,Player,Kolkata Knight Riders,Royal Challengers Bangalore,2011,0,29,0,Blank,Blank,G Gambhir,Dl Vettori,Bj Haddin,Ab De Villiers,1982-11-17
17065,50122700089,501227,89,R Bhatia,10/22/1979,Right-hand Bat,Right-arm Medium-fast,India,Player,Kolkata Knight Riders,Royal Challengers Bangalore,2011,0,32,0,Blank,Blank,G Gambhir,Dl Vettori,Bj Haddin,Ab De Villiers,1979-10-22
17067,50122700151,501227,151,L Balaji,9/27/1981,Right-hand Bat,Right-arm Medium-fast,India,Player,Kolkata Knight Riders,Royal Challengers Bangalore,2011,0,30,0,Blank,Blank,G Gambhir,Dl Vettori,Bj Haddin,Ab De Villiers,1981-09-27
17070,50122700279,501227,279,Bj Haddin,10/23/1977,Right-hand Bat,N/a,Australia,Keeper,Kolkata Knight Riders,Royal Challengers Bangalore,2011,0,34,0,Blank,Blank,G Gambhir,Dl Vettori,Bj Haddin,Ab De Villiers,1977-10-23
17073,50122800014,501228,14,P Kumar,10/2/1986,Right-hand Bat,Right-arm Medium,India,Player,Kings Xi Punjab,Delhi Daredevils,2011,0,25,0,Blank,Blank,Ac Gilchrist,V Sehwag,Ac Gilchrist,Nv Ojha,1986-10-02
17074,50122800048,501228,48,Am Nayar,10/8/1983,Left-hand Bat,Right-arm Medium,India,Player,Kings Xi Punjab,Delhi Daredevils,2011,0,28,0,Blank,Blank,Ac Gilchrist,V Sehwag,Ac Gilchrist,Nv Ojha,1983-10-08
17075,50122800053,501228,53,Ac Gilchrist,11/14/1971,Left-hand Bat,Right-arm Offbreak,Australia,Captainkeeper,Kings Xi Punjab,Delhi Daredevils,2011,0,40,0,Blank,Blank,Ac Gilchrist,V Sehwag,Ac Gilchrist,Nv Ojha,1971-11-14
17076,50122800067,501228,67,Pp Chawla,12/24/1988,Left-hand Bat,Legbreak,India,Player,Kings Xi Punjab,Delhi Daredevils,2011,0,23,0,Blank,Blank,Ac Gilchrist,V Sehwag,Ac Gilchrist,Nv Ojha,1988-12-24
17077,50122800088,501228,88,Kd Karthik,6/1/1985,Right-hand Bat,N/a,India,Player,Kings Xi Punjab,Delhi Daredevils,2011,0,26,0,Blank,Blank,Ac Gilchrist,V Sehwag,Ac Gilchrist,Nv Ojha,1985-06-01
17078,50122800100,501228,100,Se Marsh,7/9/1983,Left-hand Bat,Slow Left-arm Orthodox,Australia,Player,Kings Xi Punjab,Delhi Daredevils,2011,0,28,0,Blank,Blank,Ac Gilchrist,V Sehwag,Ac Gilchrist,Nv Ojha,1983-07-09
17081,50122800234,501228,234,Sj Srivastava,9/22/1981,Right-hand Bat,Left-arm Fast-medium,India,Player,Kings Xi Punjab,Delhi Daredevils,2011,0,30,0,Blank,Blank,Ac Gilchrist,V Sehwag,Ac Gilchrist,Nv Ojha,1981-09-22
17084,50122800029,501228,29,Ik Pathan,10/27/1984,Left-hand Bat,Left-arm Medium-fast,India,Player,Delhi Daredevils,Kings Xi Punjab,2011,0,27,1,Blank,Blank,V Sehwag,Ac Gilchrist,Nv Ojha,Ac Gilchrist,1984-10-27
17085,50122800041,501228,41,V Sehwag,10/20/1978,Right-hand Bat,Right-arm Offbreak,India,Captain,Delhi Daredevils,Kings Xi Punjab,2011,0,33,1,Blank,Blank,V Sehwag,Ac Gilchrist,Nv Ojha,Ac Gilchrist,1978-10-20
17087,50122800082,501228,82,Ab Agarkar,12/4/1977,Right-hand Bat,Right-arm Fast,India,Player,Delhi Daredevils,Kings Xi Punjab,2011,0,34,1,Blank,Blank,V Sehwag,Ac Gilchrist,Nv Ojha,Ac Gilchrist,1977-12-04
17088,50122800183,501228,183,Nv Ojha,7/20/1983,Right-hand Bat,N/a,India,Keeper,Delhi Daredevils,Kings Xi Punjab,2011,0,28,1,Blank,Blank,V Sehwag,Ac Gilchrist,Nv Ojha,Ac Gilchrist,1983-07-20
17089,50122800187,501228,187,Da Warner,10/27/1986,Left-hand Bat,Legbreak,Australia,Player,Delhi Daredevils,Kings Xi Punjab,2011,1,25,1,Blank,Blank,V Sehwag,Ac Gilchrist,Nv Ojha,Ac Gilchrist,1986-10-27
17090,50122800190,501228,190,M Morkel,10/6/1984,Left-hand Bat,Right-arm Fast,South Africa,Player,Delhi Daredevils,Kings Xi Punjab,2011,0,27,1,Blank,Blank,V Sehwag,Ac Gilchrist,Nv Ojha,Ac Gilchrist,1984-10-06
17091,50122800199,501228,199,Y Nagar,1/6/1990,Right-hand Bat,Right-arm Offbreak,India,Player,Delhi Daredevils,Kings Xi Punjab,2011,0,21,1,Blank,Blank,V Sehwag,Ac Gilchrist,Nv Ojha,Ac Gilchrist,1990-01-06
17092,50122800254,501228,254,Aj Finch,11/17/1986,Right-hand Bat,Slow Left-arm Orthodox,Australia,Player,Delhi Daredevils,Kings Xi Punjab,2011,0,25,1,Blank,Blank,V Sehwag,Ac Gilchrist,Nv Ojha,Ac Gilchrist,1986-11-17
17096,50122900057,501229,57,Rg Sharma,4/30/1987,Right-hand Bat,Right-arm Offbreak,India,Player,Mumbai Indians,Deccan Chargers,2011,0,24,1,Blank,Blank,Sr Tendulkar,Kc Sangakkara,Dj Jacobs,Kc Sangakkara,1987-04-30
17098,50122900133,501229,133,Sr Tendulkar,4/24/1973,Right-hand Bat,Right-arm Offbreak,India,Captain,Mumbai Indians,Deccan Chargers,2011,0,38,1,Blank,Blank,Sr Tendulkar,Kc Sangakkara,Dj Jacobs,Kc Sangakkara,1973-04-24
17100,50122900208,501229,208,At Rayudu,9/23/1985,Right-hand Bat,Right-arm Offbreak,India,Player,Mumbai Indians,Deccan Chargers,2011,0,26,1,Blank,Blank,Sr Tendulkar,Kc Sangakkara,Dj Jacobs,Kc Sangakkara,1985-09-23
17101,50122900209,501229,209,R Sathish,1/14/1981,Right-hand Bat,Right-arm Medium,India,Player,Mumbai Indians,Deccan Chargers,2011,0,30,1,Blank,Blank,Sr Tendulkar,Kc Sangakkara,Dj Jacobs,Kc Sangakkara,1981-01-14
17107,50122900042,501229,42,S Dhawan,12/5/1985,Left-hand Bat,Right-arm Offbreak,India,Player,Deccan Chargers,Mumbai Indians,2011,0,26,0,Blank,Blank,Kc Sangakkara,Sr Tendulkar,Kc Sangakkara,Dj Jacobs,1985-12-05
17112,50122900112,501229,112,Db Ravi Teja,9/5/1987,Right-hand Bat,Legbreak Googly,India,Player,Deccan Chargers,Mumbai Indians,2011,0,24,0,Blank,Blank,Kc Sangakkara,Sr Tendulkar,Kc Sangakkara,Dj Jacobs,1987-09-05
17116,50123000006,501230,6,R Dravid,1/11/1973,Right-hand Bat,Right-arm Offbreak,India,Player,Rajasthan Royals,Kochi Tuskers Kerala,2011,0,38,1,Blank,Blank,Sk Warne,Dpmd Jayawardene,Dh Yagnik,Pa Patel,1973-01-11
17118,50123000038,501230,38,Sk Warne,9/13/1969,Right-hand Bat,Legbreak Googly,Australia,Captain,Rajasthan Royals,Kochi Tuskers Kerala,2011,1,42,1,Blank,Blank,Sk Warne,Dpmd Jayawardene,Dh Yagnik,Pa Patel,1969-09-13
17121,50123000085,501230,85,Am Rahane,6/6/1988,Right-hand Bat,Right-arm Medium,India,Player,Rajasthan Royals,Kochi Tuskers Kerala,2011,0,23,1,Blank,Blank,Sk Warne,Dpmd Jayawardene,Dh Yagnik,Pa Patel,1988-06-06
17122,50123000192,501230,192,J Botha,5/2/1982,Right-hand Bat,Right-arm Offbreak,South Africa,Player,Rajasthan Royals,Kochi Tuskers Kerala,2011,0,29,1,Blank,Blank,Sk Warne,Dpmd Jayawardene,Dh Yagnik,Pa Patel,1982-05-02
17123,50123000196,501230,196,A Singh,6/21/1981,Right-hand Bat,Right-arm Medium-fast,India,Player,Rajasthan Royals,Kochi Tuskers Kerala,2011,0,30,1,Blank,Blank,Sk Warne,Dpmd Jayawardene,Dh Yagnik,Pa Patel,1981-06-21
17127,50123000017,501230,17,Pa Patel,3/9/1985,Left-hand Bat,N/a,India,Keeper,Kochi Tuskers Kerala,Rajasthan Royals,2011,0,26,0,Blank,Blank,Dpmd Jayawardene,Sk Warne,Pa Patel,Dh Yagnik,1985-03-09
17132,50123000081,501230,81,R Vinay Kumar,2/12/1984,Right-hand Bat,Right-arm Medium,India,Player,Kochi Tuskers Kerala,Rajasthan Royals,2011,0,27,0,Blank,Blank,Dpmd Jayawardene,Sk Warne,Pa Patel,Dh Yagnik,1984-02-12
17137,50123000280,501230,280,Nltc Perera,4/3/1989,Left-hand Bat,Right-arm Medium-fast,Sri Lanka,Player,Kochi Tuskers Kerala,Rajasthan Royals,2011,0,22,0,Blank,Blank,Dpmd Jayawardene,Sk Warne,Pa Patel,Dh Yagnik,1989-04-03
17138,50123100019,501231,19,Mek Hussey,5/27/1975,Left-hand Bat,Right-arm Medium,Australia,Player,Chennai Super Kings,Pune Warriors,2011,1,36,1,Blank,Blank,Ms Dhoni,Yuvraj Singh,Ms Dhoni,Rv Uthappa,1975-05-27
17144,50123100185,501231,185,M Vijay,4/1/1984,Right-hand Bat,Right-arm Offbreak,India,Player,Chennai Super Kings,Pune Warriors,2011,0,27,1,Blank,Blank,Ms Dhoni,Yuvraj Singh,Ms Dhoni,Rv Uthappa,1984-04-01
17145,50123100186,501231,186,Sb Jakati,11/27/1980,Left-hand Bat,Slow Left-arm Orthodox,India,Player,Chennai Super Kings,Pune Warriors,2011,0,31,1,Blank,Blank,Ms Dhoni,Yuvraj Singh,Ms Dhoni,Rv Uthappa,1980-11-27
17146,50123100201,501231,201,R Ashwin,9/17/1986,Right-hand Bat,Right-arm Offbreak,India,Player,Chennai Super Kings,Pune Warriors,2011,0,25,1,Blank,Blank,Ms Dhoni,Yuvraj Singh,Ms Dhoni,Rv Uthappa,1986-09-17
17152,50123100096,501231,96,Mk Pandey,9/10/1989,Right-hand Bat,Right-arm Medium,India,Player,Pune Warriors,Chennai Super Kings,2011,0,22,0,Blank,Blank,Yuvraj Singh,Ms Dhoni,Rv Uthappa,Ms Dhoni,1989-09-10
17155,50123100231,501231,231,Md Mishra,2/9/1984,Right-hand Bat,Right-arm Offbreak,India,Player,Pune Warriors,Chennai Super Kings,2011,0,27,0,Blank,Blank,Yuvraj Singh,Ms Dhoni,Rv Uthappa,Ms Dhoni,1984-02-09
17156,50123100235,501231,235,R Sharma,4/30/1987,Right-hand Bat,Right-arm Offbreak,India,Player,Pune Warriors,Chennai Super Kings,2011,0,24,0,Blank,Blank,Yuvraj Singh,Ms Dhoni,Rv Uthappa,Ms Dhoni,1987-04-30
17157,50123100274,501231,274,Ac Thomas,2/9/1977,Right-hand Bat,Right-arm Fast-medium,England,Player,Pune Warriors,Chennai Super Kings,2011,0,34,0,Blank,Blank,Yuvraj Singh,Ms Dhoni,Rv Uthappa,Ms Dhoni,1977-02-09
17158,50123100281,501231,281,Nl Mccullum,9/1/1980,Right-hand Bat,Right-arm Offbreak,New Zealand,Player,Pune Warriors,Chennai Super Kings,2011,0,31,0,Blank,Blank,Yuvraj Singh,Ms Dhoni,Rv Uthappa,Ms Dhoni,1980-09-01
17159,50123100282,501231,282,Je Taylor,6/22/1984,Right-hand Bat,Right-arm Fast,New Zealand,Player,Pune Warriors,Chennai Super Kings,2011,0,27,0,Blank,Blank,Yuvraj Singh,Ms Dhoni,Rv Uthappa,Ms Dhoni,1984-06-22
17163,50123200110,501232,110,Ab De Villiers,2/17/1984,Right-hand Bat,Right-arm Medium,South Africa,Keeper,Royal Challengers Bangalore,Delhi Daredevils,2011,0,27,1,Blank,Blank,Dl Vettori,V Sehwag,Ab De Villiers,Nv Ojha,1984-02-17
17164,50123200135,501232,135,Tm Dilshan,10/14/1976,Right-hand Bat,Right-arm Offbreak,Sri Lanka,Player,Royal Challengers Bangalore,Delhi Daredevils,2011,0,35,1,Blank,Blank,Dl Vettori,V Sehwag,Ab De Villiers,Nv Ojha,1976-10-14
17166,50123200175,501232,175,Dl Vettori,1/27/1979,Left-hand Bat,Slow Left-arm Orthodox,New Zealand,Captain,Royal Challengers Bangalore,Delhi Daredevils,2011,0,32,1,Blank,Blank,Dl Vettori,V Sehwag,Ab De Villiers,Nv Ojha,1979-01-27
17172,50123200029,501232,29,Ik Pathan,10/27/1984,Left-hand Bat,Left-arm Medium-fast,India,Player,Delhi Daredevils,Royal Challengers Bangalore,2011,0,27,0,Blank,Blank,V Sehwag,Dl Vettori,Nv Ojha,Ab De Villiers,1984-10-27
17174,50123200054,501232,54,Y Venugopal Rao,2/26/1982,Right-hand Bat,Right-arm Offbreak,India,Player,Delhi Daredevils,Royal Challengers Bangalore,2011,0,29,0,Blank,Blank,V Sehwag,Dl Vettori,Nv Ojha,Ab De Villiers,1982-02-26
17177,50123200187,501232,187,Da Warner,10/27/1986,Left-hand Bat,Legbreak,Australia,Player,Delhi Daredevils,Royal Challengers Bangalore,2011,0,25,0,Blank,Blank,V Sehwag,Dl Vettori,Nv Ojha,Ab De Villiers,1986-10-27
17180,50123200232,501232,232,Ut Yadav,10/25/1987,Right-hand Bat,Right-arm Fast-medium,India,Player,Delhi Daredevils,Royal Challengers Bangalore,2011,0,24,0,Blank,Blank,V Sehwag,Dl Vettori,Nv Ojha,Ab De Villiers,1987-10-25
17181,50123200271,501232,271,Ms Wade,12/26/1987,Left-hand Bat,Right-arm Medium,Australia,Player,Delhi Daredevils,Royal Challengers Bangalore,2011,0,24,0,Blank,Blank,V Sehwag,Dl Vettori,Nv Ojha,Ab De Villiers,1987-12-26
17183,50123300020,501233,20,Ms Dhoni,7/7/1981,Right-hand Bat,Right-arm Medium,India,Captainkeeper,Chennai Super Kings,Pune Warriors,2011,0,30,1,Blank,Blank,Ms Dhoni,Yuvraj Singh,Ms Dhoni,Rv Uthappa,1981-07-07
17186,50123300125,501233,125,S Anirudha,4/14/1987,Right-hand Bat,N/a,India,Player,Chennai Super Kings,Pune Warriors,2011,0,24,1,Blank,Blank,Ms Dhoni,Yuvraj Singh,Ms Dhoni,Rv Uthappa,1987-04-14
17191,50123300324,501233,324,Kmdn Kulasekara,7/22/1982,Right-hand Bat,Right-arm Fast-medium,Sri Lanka,Player,Chennai Super Kings,Pune Warriors,2011,0,29,1,Blank,Blank,Ms Dhoni,Yuvraj Singh,Ms Dhoni,Rv Uthappa,1982-07-22
17192,50123300377,501233,377,Tg Southee,12/11/1988,Right-hand Bat,Right-arm Medium-fast,New Zealand,Player,Chennai Super Kings,Pune Warriors,2011,0,23,1,Blank,Blank,Ms Dhoni,Yuvraj Singh,Ms Dhoni,Rv Uthappa,1988-12-11
17196,50123300096,501233,96,Mk Pandey,9/10/1989,Right-hand Bat,Right-arm Medium,India,Player,Pune Warriors,Chennai Super Kings,2011,0,22,0,Blank,Blank,Yuvraj Singh,Ms Dhoni,Rv Uthappa,Ms Dhoni,1989-09-10
17207,50123400065,501234,65,S Sohal,11/10/1987,Right-hand Bat,Legbreak,India,Player,Deccan Chargers,Kochi Tuskers Kerala,2011,0,24,1,Blank,Blank,Kc Sangakkara,Dpmd Jayawardene,Kc Sangakkara,Pa Patel,1987-11-10
17210,50123400094,501234,94,Dw Steyn,6/27/1983,Right-hand Bat,Right-arm Fast,South Africa,Player,Deccan Chargers,Kochi Tuskers Kerala,2011,0,28,1,Blank,Blank,Kc Sangakkara,Dpmd Jayawardene,Kc Sangakkara,Pa Patel,1983-06-27
17214,50123400258,501234,258,Dt Christian,5/4/1983,Right-hand Bat,Right-arm Fast-medium,Australia,Player,Deccan Chargers,Kochi Tuskers Kerala,2011,0,28,1,Blank,Blank,Kc Sangakkara,Dpmd Jayawardene,Kc Sangakkara,Pa Patel,1983-05-04
17215,50123400002,501234,2,Bb Mccullum,9/27/1981,Right-hand Bat,Right-arm Medium,New Zealand,Player,Kochi Tuskers Kerala,Deccan Chargers,2011,0,30,0,Blank,Blank,Dpmd Jayawardene,Kc Sangakkara,Pa Patel,Kc Sangakkara,1981-09-27
17219,50123400064,501234,64,Dpmd Jayawardene,5/27/1977,Right-hand Bat,Right-arm Medium,Sri Lanka,Captain,Kochi Tuskers Kerala,Deccan Chargers,2011,0,34,0,Blank,Blank,Dpmd Jayawardene,Kc Sangakkara,Pa Patel,Kc Sangakkara,1977-05-27
17220,50123400077,501234,77,S Sreesanth,2/6/1983,Right-hand Bat,Right-arm Fast-medium,India,Player,Kochi Tuskers Kerala,Deccan Chargers,2011,0,28,0,Blank,Blank,Dpmd Jayawardene,Kc Sangakkara,Pa Patel,Kc Sangakkara,1983-02-06
17222,50123400104,501234,104,Bj Hodge,12/29/1974,Right-hand Bat,Right-arm Offbreak,Australia,Player,Kochi Tuskers Kerala,Deccan Chargers,2011,0,37,0,Blank,Blank,Dpmd Jayawardene,Kc Sangakkara,Pa Patel,Kc Sangakkara,1974-12-29
17225,50123400280,501234,280,Nltc Perera,4/3/1989,Left-hand Bat,Right-arm Medium-fast,Sri Lanka,Player,Kochi Tuskers Kerala,Deccan Chargers,2011,0,22,0,Blank,Blank,Dpmd Jayawardene,Kc Sangakkara,Pa Patel,Kc Sangakkara,1989-04-03
17230,50123500082,501235,82,Ab Agarkar,12/4/1977,Right-hand Bat,Right-arm Fast,India,Player,Delhi Daredevils,Kolkata Knight Riders,2011,0,34,0,Blank,Blank,V Sehwag,G Gambhir,Nv Ojha,Sp Goswami,1977-12-04
17234,50123500199,501235,199,Y Nagar,1/6/1990,Right-hand Bat,Right-arm Offbreak,India,Player,Delhi Daredevils,Kolkata Knight Riders,2011,0,21,0,Blank,Blank,V Sehwag,G Gambhir,Nv Ojha,Sp Goswami,1990-01-06
17236,50123500285,501235,285,Tr Birt,12/9/1981,Left-hand Bat,Right-arm Medium,Australia,Player,Delhi Daredevils,Kolkata Knight Riders,2011,0,30,0,Blank,Blank,V Sehwag,G Gambhir,Nv Ojha,Sp Goswami,1981-12-09
17240,50123500066,501235,66,B Lee,11/8/1976,Right-hand Bat,Right-arm Fast,Australia,Player,Kolkata Knight Riders,Delhi Daredevils,2011,0,35,1,Blank,Blank,G Gambhir,V Sehwag,Sp Goswami,Nv Ojha,1976-11-08
17241,50123500087,501235,87,Mk Tiwary,11/14/1985,Right-hand Bat,Legbreak Googly,India,Player,Kolkata Knight Riders,Delhi Daredevils,2011,1,26,1,Blank,Blank,G Gambhir,V Sehwag,Sp Goswami,Nv Ojha,1985-11-14
17242,50123500132,501235,132,Sp Goswami,5/18/1989,Left-hand Bat,N/a,India,Keeper,Kolkata Knight Riders,Delhi Daredevils,2011,0,22,1,Blank,Blank,G Gambhir,V Sehwag,Sp Goswami,Nv Ojha,1989-05-18
17243,50123500140,501235,140,Iqbal Abdulla,12/2/1989,Left-hand Bat,Slow Left-arm Orthodox,India,Player,Kolkata Knight Riders,Delhi Daredevils,2011,0,22,1,Blank,Blank,G Gambhir,V Sehwag,Sp Goswami,Nv Ojha,1989-12-02
17247,50123500346,501235,346,Jd Unadkat,10/18/1991,Right-hand Bat,Left-arm Medium,India,Player,Kolkata Knight Riders,Delhi Daredevils,2011,0,20,1,Blank,Blank,G Gambhir,V Sehwag,Sp Goswami,Nv Ojha,1991-10-18
17248,50123600006,501236,6,R Dravid,1/11/1973,Right-hand Bat,Right-arm Offbreak,India,Player,Rajasthan Royals,Mumbai Indians,2011,0,38,1,Blank,Blank,Sk Warne,Sr Tendulkar,Dh Yagnik,Dj Jacobs,1973-01-11
17249,50123600032,501236,32,Sr Watson,6/17/1981,Right-hand Bat,Right-arm Fast-medium,Australia,Player,Rajasthan Royals,Mumbai Indians,2011,0,30,1,Blank,Blank,Sk Warne,Sr Tendulkar,Dh Yagnik,Dj Jacobs,1981-06-17
17250,50123600038,501236,38,Sk Warne,9/13/1969,Right-hand Bat,Legbreak Googly,Australia,Captain,Rajasthan Royals,Mumbai Indians,2011,0,42,1,Blank,Blank,Sk Warne,Sr Tendulkar,Dh Yagnik,Dj Jacobs,1969-09-13
17252,50123600052,501236,52,Lrpl Taylor,3/8/1984,Right-hand Bat,Right-arm Offbreak,New Zealand,Player,Rajasthan Royals,Mumbai Indians,2011,0,27,1,Blank,Blank,Sk Warne,Sr Tendulkar,Dh Yagnik,Dj Jacobs,1984-03-08
17254,50123600192,501236,192,J Botha,5/2/1982,Right-hand Bat,Right-arm Offbreak,South Africa,Player,Rajasthan Royals,Mumbai Indians,2011,1,29,1,Blank,Blank,Sk Warne,Sr Tendulkar,Dh Yagnik,Dj Jacobs,1982-05-02
17256,50123600255,501236,255,Str Binny,6/3/1984,Right-hand Bat,Right-arm Medium,India,Player,Rajasthan Royals,Mumbai Indians,2011,0,27,1,Blank,Blank,Sk Warne,Sr Tendulkar,Dh Yagnik,Dj Jacobs,1984-06-03
17257,50123600266,501236,266,Al Menaria,10/29/1990,Left-hand Bat,Slow Left-arm Orthodox,India,Player,Rajasthan Royals,Mumbai Indians,2011,0,21,1,Blank,Blank,Sk Warne,Sr Tendulkar,Dh Yagnik,Dj Jacobs,1990-10-29
17263,50123600133,501236,133,Sr Tendulkar,4/24/1973,Right-hand Bat,Right-arm Offbreak,India,Captain,Mumbai Indians,Rajasthan Royals,2011,0,38,0,Blank,Blank,Sr Tendulkar,Sk Warne,Dj Jacobs,Dh Yagnik,1973-04-24
17265,50123600208,501236,208,At Rayudu,9/23/1985,Right-hand Bat,Right-arm Offbreak,India,Player,Mumbai Indians,Rajasthan Royals,2011,0,26,0,Blank,Blank,Sr Tendulkar,Sk Warne,Dj Jacobs,Dh Yagnik,1985-09-23
17268,50123600263,501236,263,Dj Jacobs,11/4/1982,Right-hand Bat,Right-arm Medium,South Africa,Keeper,Mumbai Indians,Rajasthan Royals,2011,0,29,0,Blank,Blank,Sr Tendulkar,Sk Warne,Dj Jacobs,Dh Yagnik,1982-11-04
17269,50123600286,501236,286,Ag Murtaza,1/1/1990,Left-hand Bat,Slow Left-arm Orthodox,India,Player,Mumbai Indians,Rajasthan Royals,2011,0,21,0,Blank,Blank,Sr Tendulkar,Sk Warne,Dj Jacobs,Dh Yagnik,1990-01-01
17270,50123700008,501237,8,V Kohli,11/5/1988,Right-hand Bat,Right-arm Medium,India,Player,Royal Challengers Bangalore,Pune Warriors,2011,1,23,1,Blank,Blank,Dl Vettori,Yuvraj Singh,Ab De Villiers,Rv Uthappa,1988-11-05
17274,50123700110,501237,110,Ab De Villiers,2/17/1984,Right-hand Bat,Right-arm Medium,South Africa,Keeper,Royal Challengers Bangalore,Pune Warriors,2011,0,27,1,Blank,Blank,Dl Vettori,Yuvraj Singh,Ab De Villiers,Rv Uthappa,1984-02-17
17277,50123700175,501237,175,Dl Vettori,1/27/1979,Left-hand Bat,Slow Left-arm Orthodox,New Zealand,Captain,Royal Challengers Bangalore,Pune Warriors,2011,0,32,1,Blank,Blank,Dl Vettori,Yuvraj Singh,Ab De Villiers,Rv Uthappa,1979-01-27
17278,50123700244,501237,244,A Mithun,10/25/1989,Right-hand Bat,Right-arm Medium,India,Player,Royal Challengers Bangalore,Pune Warriors,2011,0,22,1,Blank,Blank,Dl Vettori,Yuvraj Singh,Ab De Villiers,Rv Uthappa,1989-10-25
17283,50123700096,501237,96,Mk Pandey,9/10/1989,Right-hand Bat,Right-arm Medium,India,Player,Pune Warriors,Royal Challengers Bangalore,2011,0,22,0,Blank,Blank,Yuvraj Singh,Dl Vettori,Rv Uthappa,Ab De Villiers,1989-09-10
17287,50123700235,501237,235,R Sharma,4/30/1987,Right-hand Bat,Right-arm Offbreak,India,Player,Pune Warriors,Royal Challengers Bangalore,2011,0,24,0,Blank,Blank,Yuvraj Singh,Dl Vettori,Rv Uthappa,Ab De Villiers,1987-04-30
17288,50123700272,501237,272,Td Paine,12/8/1984,Right-hand Bat,Right-arm Medium,Australia,Player,Pune Warriors,Royal Challengers Bangalore,2011,0,27,0,Blank,Blank,Yuvraj Singh,Dl Vettori,Rv Uthappa,Ab De Villiers,1984-12-08
17289,50123700274,501237,274,Ac Thomas,2/9/1977,Right-hand Bat,Right-arm Fast-medium,England,Player,Pune Warriors,Royal Challengers Bangalore,2011,0,34,0,Blank,Blank,Yuvraj Singh,Dl Vettori,Rv Uthappa,Ab De Villiers,1977-02-09
17291,50123700287,501237,287,Harpreet Singh,8/11/1991,Left-hand Bat,Right-arm Medium,India,Player,Pune Warriors,Royal Challengers Bangalore,2011,0,20,0,Blank,Blank,Yuvraj Singh,Dl Vettori,Rv Uthappa,Ab De Villiers,1991-08-11
17296,50123800177,501238,177,Re Van Der Merwe,12/31/1984,Right-hand Bat,Slow Left-arm Orthodox,South Africa,Player,Delhi Daredevils,Kochi Tuskers Kerala,2011,0,27,1,Blank,Blank,V Sehwag,Dpmd Jayawardene,Nv Ojha,Pa Patel,1984-12-31
17301,50123800232,501238,232,Ut Yadav,10/25/1987,Right-hand Bat,Right-arm Fast-medium,India,Player,Delhi Daredevils,Kochi Tuskers Kerala,2011,0,24,1,Blank,Blank,V Sehwag,Dpmd Jayawardene,Nv Ojha,Pa Patel,1987-10-25
17302,50123800285,501238,285,Tr Birt,12/9/1981,Left-hand Bat,Right-arm Medium,Australia,Player,Delhi Daredevils,Kochi Tuskers Kerala,2011,0,30,1,Blank,Blank,V Sehwag,Dpmd Jayawardene,Nv Ojha,Pa Patel,1981-12-09
17303,50123800002,501238,2,Bb Mccullum,9/27/1981,Right-hand Bat,Right-arm Medium,New Zealand,Player,Kochi Tuskers Kerala,Delhi Daredevils,2011,0,30,0,Blank,Blank,Dpmd Jayawardene,V Sehwag,Pa Patel,Nv Ojha,1981-09-27
17307,50123800061,501238,61,Rp Singh,12/6/1985,Right-hand Bat,Left-arm Fast-medium,India,Player,Kochi Tuskers Kerala,Delhi Daredevils,2011,0,26,0,Blank,Blank,Dpmd Jayawardene,V Sehwag,Pa Patel,Nv Ojha,1985-12-06
17308,50123800064,501238,64,Dpmd Jayawardene,5/27/1977,Right-hand Bat,Right-arm Medium,Sri Lanka,Captain,Kochi Tuskers Kerala,Delhi Daredevils,2011,0,34,0,Blank,Blank,Dpmd Jayawardene,V Sehwag,Pa Patel,Nv Ojha,1977-05-27
17310,50123800081,501238,81,R Vinay Kumar,2/12/1984,Right-hand Bat,Right-arm Medium,India,Player,Kochi Tuskers Kerala,Delhi Daredevils,2011,0,27,0,Blank,Blank,Dpmd Jayawardene,V Sehwag,Pa Patel,Nv Ojha,1984-02-12
17316,50123900048,501239,48,Am Nayar,10/8/1983,Left-hand Bat,Right-arm Medium,India,Player,Kings Xi Punjab,Kolkata Knight Riders,2011,0,28,0,Blank,Blank,Ac Gilchrist,G Gambhir,Ac Gilchrist,Sp Goswami,1983-10-08
17317,50123900053,501239,53,Ac Gilchrist,11/14/1971,Left-hand Bat,Right-arm Offbreak,Australia,Captainkeeper,Kings Xi Punjab,Kolkata Knight Riders,2011,0,40,0,Blank,Blank,Ac Gilchrist,G Gambhir,Ac Gilchrist,Sp Goswami,1971-11-14
17319,50123900088,501239,88,Kd Karthik,6/1/1985,Right-hand Bat,N/a,India,Player,Kings Xi Punjab,Kolkata Knight Riders,2011,0,26,0,Blank,Blank,Ac Gilchrist,G Gambhir,Ac Gilchrist,Sp Goswami,1985-06-01
17323,50123900228,501239,228,Bipul Sharma,9/28/1983,Left-hand Bat,Slow Left-arm Orthodox,India,Player,Kings Xi Punjab,Kolkata Knight Riders,2011,0,28,0,Blank,Blank,Ac Gilchrist,G Gambhir,Ac Gilchrist,Sp Goswami,1983-09-28
17325,50123900009,501239,9,Jh Kallis,10/16/1975,Right-hand Bat,Right-arm Fast-medium,South Africa,Player,Kolkata Knight Riders,Kings Xi Punjab,2011,0,36,1,Blank,Blank,G Gambhir,Ac Gilchrist,Sp Goswami,Ac Gilchrist,1975-10-16
17328,50123900066,501239,66,B Lee,11/8/1976,Right-hand Bat,Right-arm Fast,Australia,Player,Kolkata Knight Riders,Kings Xi Punjab,2011,0,35,1,Blank,Blank,G Gambhir,Ac Gilchrist,Sp Goswami,Ac Gilchrist,1976-11-08
17329,50123900087,501239,87,Mk Tiwary,11/14/1985,Right-hand Bat,Legbreak Googly,India,Player,Kolkata Knight Riders,Kings Xi Punjab,2011,0,26,1,Blank,Blank,G Gambhir,Ac Gilchrist,Sp Goswami,Ac Gilchrist,1985-11-14
17330,50123900089,501239,89,R Bhatia,10/22/1979,Right-hand Bat,Right-arm Medium-fast,India,Player,Kolkata Knight Riders,Kings Xi Punjab,2011,0,32,1,Blank,Blank,G Gambhir,Ac Gilchrist,Sp Goswami,Ac Gilchrist,1979-10-22
17333,50123900151,501239,151,L Balaji,9/27/1981,Right-hand Bat,Right-arm Medium-fast,India,Player,Kolkata Knight Riders,Kings Xi Punjab,2011,0,30,1,Blank,Blank,G Gambhir,Ac Gilchrist,Sp Goswami,Ac Gilchrist,1981-09-27
17334,50123900216,501239,216,Ejg Morgan,9/10/1986,Left-hand Bat,Right-arm Medium,England,Player,Kolkata Knight Riders,Kings Xi Punjab,2011,0,25,1,Blank,Blank,G Gambhir,Ac Gilchrist,Sp Goswami,Ac Gilchrist,1986-09-10
17335,50123900284,501239,284,Rn Ten Doeschate,6/30/1980,Right-hand Bat,Right-arm Medium-fast,Netherlands,Player,Kolkata Knight Riders,Kings Xi Punjab,2011,0,31,1,Blank,Blank,G Gambhir,Ac Gilchrist,Sp Goswami,Ac Gilchrist,1980-06-30
17339,50124000039,501240,39,Sk Trivedi,9/4/1982,Right-hand Bat,Right-arm Medium,India,Player,Rajasthan Royals,Pune Warriors,2011,0,29,1,Blank,Blank,Sk Warne,Yuvraj Singh,Dh Yagnik,Rv Uthappa,1982-09-04
17343,50124000196,501240,196,A Singh,6/21/1981,Right-hand Bat,Right-arm Medium-fast,India,Player,Rajasthan Royals,Pune Warriors,2011,0,30,1,Blank,Blank,Sk Warne,Yuvraj Singh,Dh Yagnik,Rv Uthappa,1981-06-21
17345,50124000266,501240,266,Al Menaria,10/29/1990,Left-hand Bat,Slow Left-arm Orthodox,India,Player,Rajasthan Royals,Pune Warriors,2011,0,21,1,Blank,Blank,Sk Warne,Yuvraj Singh,Dh Yagnik,Rv Uthappa,1990-10-29
17346,50124000277,501240,277,Dh Yagnik,6/22/1983,Left-hand Bat,N/a,India,Keeper,Rajasthan Royals,Pune Warriors,2011,0,28,1,Blank,Blank,Sk Warne,Yuvraj Singh,Dh Yagnik,Rv Uthappa,1983-06-22
17347,50124000027,501240,27,Yuvraj Singh,12/12/1981,Left-hand Bat,Slow Left-arm Orthodox,India,Captain,Pune Warriors,Rajasthan Royals,2011,0,30,0,Blank,Blank,Yuvraj Singh,Sk Warne,Rv Uthappa,Dh Yagnik,1981-12-12
17348,50124000046,501240,46,Rv Uthappa,11/11/1985,Right-hand Bat,Right-arm Medium,India,Keeper,Pune Warriors,Rajasthan Royals,2011,0,26,0,Blank,Blank,Yuvraj Singh,Sk Warne,Rv Uthappa,Dh Yagnik,1985-11-11
17349,50124000083,501240,83,M Kartik,9/11/1976,Left-hand Bat,Slow Left-arm Orthodox,India,Player,Pune Warriors,Rajasthan Royals,2011,0,35,0,Blank,Blank,Yuvraj Singh,Sk Warne,Rv Uthappa,Dh Yagnik,1976-09-11
17350,50124000096,501240,96,Mk Pandey,9/10/1989,Right-hand Bat,Right-arm Medium,India,Player,Pune Warriors,Rajasthan Royals,2011,0,22,0,Blank,Blank,Yuvraj Singh,Sk Warne,Rv Uthappa,Dh Yagnik,1989-09-10
17353,50124000235,501240,235,R Sharma,4/30/1987,Right-hand Bat,Right-arm Offbreak,India,Player,Pune Warriors,Rajasthan Royals,2011,0,24,0,Blank,Blank,Yuvraj Singh,Sk Warne,Rv Uthappa,Dh Yagnik,1987-04-30
17354,50124000274,501240,274,Ac Thomas,2/9/1977,Right-hand Bat,Right-arm Fast-medium,England,Player,Pune Warriors,Rajasthan Royals,2011,0,34,0,Blank,Blank,Yuvraj Singh,Sk Warne,Rv Uthappa,Dh Yagnik,1977-02-09
17355,50124000281,501240,281,Nl Mccullum,9/1/1980,Right-hand Bat,Right-arm Offbreak,New Zealand,Player,Pune Warriors,Rajasthan Royals,2011,0,31,0,Blank,Blank,Yuvraj Singh,Sk Warne,Rv Uthappa,Dh Yagnik,1980-09-01
17359,50124100026,501241,26,Kc Sangakkara,10/27/1977,Left-hand Bat,Right-arm Offbreak,Sri Lanka,Captainkeeper,Deccan Chargers,Chennai Super Kings,2011,0,34,0,Blank,Blank,Kc Sangakkara,Ms Dhoni,Kc Sangakkara,Ms Dhoni,1977-10-27
17361,50124100065,501241,65,S Sohal,11/10/1987,Right-hand Bat,Legbreak,India,Player,Deccan Chargers,Chennai Super Kings,2011,0,24,0,Blank,Blank,Kc Sangakkara,Ms Dhoni,Kc Sangakkara,Ms Dhoni,1987-11-10
17363,50124100093,501241,93,B Chipli,1/27/1983,Right-hand Bat,Right-arm Medium,India,Player,Deccan Chargers,Chennai Super Kings,2011,0,28,0,Blank,Blank,Kc Sangakkara,Ms Dhoni,Kc Sangakkara,Ms Dhoni,1983-01-27
17364,50124100131,501241,131,Pp Ojha,9/5/1986,Left-hand Bat,Slow Left-arm Orthodox,India,Player,Deccan Chargers,Chennai Super Kings,2011,0,25,0,Blank,Blank,Kc Sangakkara,Ms Dhoni,Kc Sangakkara,Ms Dhoni,1986-09-05
17369,50124100019,501241,19,Mek Hussey,5/27/1975,Left-hand Bat,Right-arm Medium,Australia,Player,Chennai Super Kings,Deccan Chargers,2011,0,36,1,Blank,Blank,Ms Dhoni,Kc Sangakkara,Ms Dhoni,Kc Sangakkara,1975-05-27
17370,50124100020,501241,20,Ms Dhoni,7/7/1981,Right-hand Bat,Right-arm Medium,India,Captainkeeper,Chennai Super Kings,Deccan Chargers,2011,0,30,1,Blank,Blank,Ms Dhoni,Kc Sangakkara,Ms Dhoni,Kc Sangakkara,1981-07-07
17371,50124100021,501241,21,Sk Raina,11/27/1986,Left-hand Bat,Right-arm Offbreak,India,Player,Chennai Super Kings,Deccan Chargers,2011,0,25,1,Blank,Blank,Ms Dhoni,Kc Sangakkara,Ms Dhoni,Kc Sangakkara,1986-11-27
17374,50124100125,501241,125,S Anirudha,4/14/1987,Right-hand Bat,N/a,India,Player,Chennai Super Kings,Deccan Chargers,2011,0,24,1,Blank,Blank,Ms Dhoni,Kc Sangakkara,Ms Dhoni,Kc Sangakkara,1987-04-14
17375,50124100185,501241,185,M Vijay,4/1/1984,Right-hand Bat,Right-arm Offbreak,India,Player,Chennai Super Kings,Deccan Chargers,2011,0,27,1,Blank,Blank,Ms Dhoni,Kc Sangakkara,Ms Dhoni,Kc Sangakkara,1984-04-01
17377,50124100201,501241,201,R Ashwin,9/17/1986,Right-hand Bat,Right-arm Offbreak,India,Player,Chennai Super Kings,Deccan Chargers,2011,0,25,1,Blank,Blank,Ms Dhoni,Kc Sangakkara,Ms Dhoni,Kc Sangakkara,1986-09-17
17378,50124100248,501241,248,De Bollinger,7/24/1981,Left-hand Bat,Left-arm Fast-medium,Australia,Player,Chennai Super Kings,Deccan Chargers,2011,0,30,1,Blank,Blank,Ms Dhoni,Kc Sangakkara,Ms Dhoni,Kc Sangakkara,1981-07-24
17380,50124200004,501242,4,Dj Hussey,7/15/1977,Right-hand Bat,Right-arm Offbreak,Australia,Player,Kings Xi Punjab,Mumbai Indians,2011,0,34,0,Blank,Blank,Ac Gilchrist,Sr Tendulkar,Ac Gilchrist,Dj Jacobs,1977-07-15
17381,50124200014,501242,14,P Kumar,10/2/1986,Right-hand Bat,Right-arm Medium,India,Player,Kings Xi Punjab,Mumbai Indians,2011,0,25,0,Blank,Blank,Ac Gilchrist,Sr Tendulkar,Ac Gilchrist,Dj Jacobs,1986-10-02
17384,50124200067,501242,67,Pp Chawla,12/24/1988,Left-hand Bat,Legbreak,India,Player,Kings Xi Punjab,Mumbai Indians,2011,0,23,0,Blank,Blank,Ac Gilchrist,Sr Tendulkar,Ac Gilchrist,Dj Jacobs,1988-12-24
17385,50124200088,501242,88,Kd Karthik,6/1/1985,Right-hand Bat,N/a,India,Player,Kings Xi Punjab,Mumbai Indians,2011,0,26,0,Blank,Blank,Ac Gilchrist,Sr Tendulkar,Ac Gilchrist,Dj Jacobs,1985-06-01
17387,50124200167,501242,167,Pc Valthaty,12/7/1983,Right-hand Bat,Right-arm Medium,India,Player,Kings Xi Punjab,Mumbai Indians,2011,0,28,0,Blank,Blank,Ac Gilchrist,Sr Tendulkar,Ac Gilchrist,Dj Jacobs,1983-12-07
17389,50124200228,501242,228,Bipul Sharma,9/28/1983,Left-hand Bat,Slow Left-arm Orthodox,India,Player,Kings Xi Punjab,Mumbai Indians,2011,0,28,0,Blank,Blank,Ac Gilchrist,Sr Tendulkar,Ac Gilchrist,Dj Jacobs,1983-09-28
17391,50124200050,501242,50,Harbhajan Singh,7/3/1980,Right-hand Bat,Right-arm Offbreak,India,Player,Mumbai Indians,Kings Xi Punjab,2011,0,31,1,Blank,Blank,Sr Tendulkar,Ac Gilchrist,Dj Jacobs,Ac Gilchrist,1980-07-03
17395,50124200133,501242,133,Sr Tendulkar,4/24/1973,Right-hand Bat,Right-arm Offbreak,India,Captain,Mumbai Indians,Kings Xi Punjab,2011,0,38,1,Blank,Blank,Sr Tendulkar,Ac Gilchrist,Dj Jacobs,Ac Gilchrist,1973-04-24
17404,50124300054,501243,54,Y Venugopal Rao,2/26/1982,Right-hand Bat,Right-arm Offbreak,India,Player,Delhi Daredevils,Kochi Tuskers Kerala,2011,0,29,0,Blank,Blank,V Sehwag,Dpmd Jayawardene,Nv Ojha,Pa Patel,1982-02-26
17405,50124300082,501243,82,Ab Agarkar,12/4/1977,Right-hand Bat,Right-arm Fast,India,Player,Delhi Daredevils,Kochi Tuskers Kerala,2011,0,34,0,Blank,Blank,V Sehwag,Dpmd Jayawardene,Nv Ojha,Pa Patel,1977-12-04
17406,50124300177,501243,177,Re Van Der Merwe,12/31/1984,Right-hand Bat,Slow Left-arm Orthodox,South Africa,Player,Delhi Daredevils,Kochi Tuskers Kerala,2011,0,27,0,Blank,Blank,V Sehwag,Dpmd Jayawardene,Nv Ojha,Pa Patel,1984-12-31
17413,50124300002,501243,2,Bb Mccullum,9/27/1981,Right-hand Bat,Right-arm Medium,New Zealand,Player,Kochi Tuskers Kerala,Delhi Daredevils,2011,0,30,1,Blank,Blank,Dpmd Jayawardene,V Sehwag,Pa Patel,Nv Ojha,1981-09-27
17421,50124300259,501243,259,Rv Gomez,10/16/1985,Right-hand Bat,Right-arm Medium,India,Player,Kochi Tuskers Kerala,Delhi Daredevils,2011,0,26,1,Blank,Blank,Dpmd Jayawardene,V Sehwag,Pa Patel,Nv Ojha,1985-10-16
17423,50124300294,501243,294,P Parameswaran,5/30/1985,Right-hand Bat,Left-arm Medium,India,Player,Kochi Tuskers Kerala,Delhi Daredevils,2011,1,26,1,Blank,Blank,Dpmd Jayawardene,V Sehwag,Pa Patel,Nv Ojha,1985-05-30
17425,50124400026,501244,26,Kc Sangakkara,10/27/1977,Left-hand Bat,Right-arm Offbreak,Sri Lanka,Captainkeeper,Deccan Chargers,Kolkata Knight Riders,2011,0,34,0,Blank,Blank,Kc Sangakkara,G Gambhir,Kc Sangakkara,Mv Boucher,1977-10-27
17427,50124400065,501244,65,S Sohal,11/10/1987,Right-hand Bat,Legbreak,India,Player,Deccan Chargers,Kolkata Knight Riders,2011,0,24,0,Blank,Blank,Kc Sangakkara,G Gambhir,Kc Sangakkara,Mv Boucher,1987-11-10
17430,50124400094,501244,94,Dw Steyn,6/27/1983,Right-hand Bat,Right-arm Fast,South Africa,Player,Deccan Chargers,Kolkata Knight Riders,2011,0,28,0,Blank,Blank,Kc Sangakkara,G Gambhir,Kc Sangakkara,Mv Boucher,1983-06-27
17433,50124400136,501244,136,A Mishra,11/24/1982,Right-hand Bat,Legbreak,India,Player,Deccan Chargers,Kolkata Knight Riders,2011,0,29,0,Blank,Blank,Kc Sangakkara,G Gambhir,Kc Sangakkara,Mv Boucher,1982-11-24
17434,50124400258,501244,258,Dt Christian,5/4/1983,Right-hand Bat,Right-arm Fast-medium,Australia,Player,Deccan Chargers,Kolkata Knight Riders,2011,0,28,0,Blank,Blank,Kc Sangakkara,G Gambhir,Kc Sangakkara,Mv Boucher,1983-05-04
17435,50124400009,501244,9,Jh Kallis,10/16/1975,Right-hand Bat,Right-arm Fast-medium,South Africa,Player,Kolkata Knight Riders,Deccan Chargers,2011,0,36,1,Blank,Blank,G Gambhir,Kc Sangakkara,Mv Boucher,Kc Sangakkara,1975-10-16
17436,50124400011,501244,11,Mv Boucher,12/3/1976,Right-hand Bat,Right-arm Medium,South Africa,Keeper,Kolkata Knight Riders,Deccan Chargers,2011,0,35,1,Blank,Blank,G Gambhir,Kc Sangakkara,Mv Boucher,Kc Sangakkara,1976-12-03
17441,50124400089,501244,89,R Bhatia,10/22/1979,Right-hand Bat,Right-arm Medium-fast,India,Player,Kolkata Knight Riders,Deccan Chargers,2011,0,32,1,Blank,Blank,G Gambhir,Kc Sangakkara,Mv Boucher,Kc Sangakkara,1979-10-22
17443,50124400151,501244,151,L Balaji,9/27/1981,Right-hand Bat,Right-arm Medium-fast,India,Player,Kolkata Knight Riders,Deccan Chargers,2011,0,30,1,Blank,Blank,G Gambhir,Kc Sangakkara,Mv Boucher,Kc Sangakkara,1981-09-27
17444,50124400216,501244,216,Ejg Morgan,9/10/1986,Left-hand Bat,Right-arm Medium,England,Player,Kolkata Knight Riders,Deccan Chargers,2011,0,25,1,Blank,Blank,G Gambhir,Kc Sangakkara,Mv Boucher,Kc Sangakkara,1986-09-10
17445,50124400346,501244,346,Jd Unadkat,10/18/1991,Right-hand Bat,Left-arm Medium,India,Player,Kolkata Knight Riders,Deccan Chargers,2011,0,20,1,Blank,Blank,G Gambhir,Kc Sangakkara,Mv Boucher,Kc Sangakkara,1991-10-18
17447,50124500032,501245,32,Sr Watson,6/17/1981,Right-hand Bat,Right-arm Fast-medium,Australia,Player,Rajasthan Royals,Chennai Super Kings,2011,0,30,0,Blank,Blank,Sk Warne,Ms Dhoni,Dh Yagnik,Ms Dhoni,1981-06-17
17450,50124500052,501245,52,Lrpl Taylor,3/8/1984,Right-hand Bat,Right-arm Offbreak,New Zealand,Player,Rajasthan Royals,Chennai Super Kings,2011,0,27,0,Blank,Blank,Sk Warne,Ms Dhoni,Dh Yagnik,Ms Dhoni,1984-03-08
17454,50124500266,501245,266,Al Menaria,10/29/1990,Left-hand Bat,Slow Left-arm Orthodox,India,Player,Rajasthan Royals,Chennai Super Kings,2011,0,21,0,Blank,Blank,Sk Warne,Ms Dhoni,Dh Yagnik,Ms Dhoni,1990-10-29
17455,50124500277,501245,277,Dh Yagnik,6/22/1983,Left-hand Bat,N/a,India,Keeper,Rajasthan Royals,Chennai Super Kings,2011,0,28,0,Blank,Blank,Sk Warne,Ms Dhoni,Dh Yagnik,Ms Dhoni,1983-06-22
17460,50124500023,501245,23,S Badrinath,8/30/1980,Right-hand Bat,Right-arm Offbreak,India,Player,Chennai Super Kings,Rajasthan Royals,2011,0,31,1,Blank,Blank,Ms Dhoni,Sk Warne,Ms Dhoni,Dh Yagnik,1980-08-30
17462,50124500125,501245,125,S Anirudha,4/14/1987,Right-hand Bat,N/a,India,Player,Chennai Super Kings,Rajasthan Royals,2011,0,24,1,Blank,Blank,Ms Dhoni,Sk Warne,Ms Dhoni,Dh Yagnik,1987-04-14
17464,50124500186,501245,186,Sb Jakati,11/27/1980,Left-hand Bat,Slow Left-arm Orthodox,India,Player,Chennai Super Kings,Rajasthan Royals,2011,0,31,1,Blank,Blank,Ms Dhoni,Sk Warne,Ms Dhoni,Dh Yagnik,1980-11-27
17467,50124500278,501245,278,S Randiv,1/30/1985,Right-hand Bat,Right-arm Offbreak,Sri Lanka,Player,Chennai Super Kings,Rajasthan Royals,2011,0,26,1,Blank,Blank,Ms Dhoni,Sk Warne,Ms Dhoni,Dh Yagnik,1985-01-30
17471,50124600080,501246,80,Ds Kulkarni,12/10/1988,Right-hand Bat,Right-arm Medium,India,Player,Mumbai Indians,Pune Warriors,2011,0,23,1,Blank,Blank,Sr Tendulkar,Yuvraj Singh,At Rayudu,Rv Uthappa,1988-12-10
17472,50124600126,501246,126,Mm Patel,7/12/1983,Right-hand Bat,Right-arm Medium-fast,India,Player,Mumbai Indians,Pune Warriors,2011,0,28,1,Blank,Blank,Sr Tendulkar,Yuvraj Singh,At Rayudu,Rv Uthappa,1983-07-12
17476,50124600208,501246,208,At Rayudu,9/23/1985,Right-hand Bat,Right-arm Offbreak,India,Keeper,Mumbai Indians,Pune Warriors,2011,0,26,1,Blank,Blank,Sr Tendulkar,Yuvraj Singh,At Rayudu,Rv Uthappa,1985-09-23
17481,50124600074,501246,74,Gc Smith,2/1/1981,Left-hand Bat,Right-arm Offbreak,South Africa,Player,Pune Warriors,Mumbai Indians,2011,0,30,0,Blank,Blank,Yuvraj Singh,Sr Tendulkar,Rv Uthappa,At Rayudu,1981-02-01
17486,50124600235,501246,235,R Sharma,4/30/1987,Right-hand Bat,Right-arm Offbreak,India,Player,Pune Warriors,Mumbai Indians,2011,1,24,0,Blank,Blank,Yuvraj Singh,Sr Tendulkar,Rv Uthappa,At Rayudu,1987-04-30
17487,50124600273,501246,273,Sb Wagh,10/9/1988,Left-hand Bat,Left-arm Medium-fast,India,Player,Pune Warriors,Mumbai Indians,2011,0,23,0,Blank,Blank,Yuvraj Singh,Sr Tendulkar,Rv Uthappa,At Rayudu,1988-10-09
17488,50124600274,501246,274,Ac Thomas,2/9/1977,Right-hand Bat,Right-arm Fast-medium,England,Player,Pune Warriors,Mumbai Indians,2011,0,34,0,Blank,Blank,Yuvraj Singh,Sr Tendulkar,Rv Uthappa,At Rayudu,1977-02-09
17490,50124700009,501247,9,Jh Kallis,10/16/1975,Right-hand Bat,Right-arm Fast-medium,South Africa,Player,Kolkata Knight Riders,Kochi Tuskers Kerala,2011,0,36,0,Blank,Blank,G Gambhir,Dpmd Jayawardene,Mv Boucher,Pa Patel,1975-10-16
17493,50124700040,501247,40,G Gambhir,10/14/1981,Left-hand Bat,Legbreak,India,Captain,Kolkata Knight Riders,Kochi Tuskers Kerala,2011,0,30,0,Blank,Blank,G Gambhir,Dpmd Jayawardene,Mv Boucher,Pa Patel,1981-10-14
17494,50124700066,501247,66,B Lee,11/8/1976,Right-hand Bat,Right-arm Fast,Australia,Player,Kolkata Knight Riders,Kochi Tuskers Kerala,2011,0,35,0,Blank,Blank,G Gambhir,Dpmd Jayawardene,Mv Boucher,Pa Patel,1976-11-08
17500,50124700346,501247,346,Jd Unadkat,10/18/1991,Right-hand Bat,Left-arm Medium,India,Player,Kolkata Knight Riders,Kochi Tuskers Kerala,2011,0,20,0,Blank,Blank,G Gambhir,Dpmd Jayawardene,Mv Boucher,Pa Patel,1991-10-18
17501,50124700002,501247,2,Bb Mccullum,9/27/1981,Right-hand Bat,Right-arm Medium,New Zealand,Player,Kochi Tuskers Kerala,Kolkata Knight Riders,2011,0,30,1,Blank,Blank,Dpmd Jayawardene,G Gambhir,Pa Patel,Mv Boucher,1981-09-27
17504,50124700061,501247,61,Rp Singh,12/6/1985,Right-hand Bat,Left-arm Fast-medium,India,Player,Kochi Tuskers Kerala,Kolkata Knight Riders,2011,0,26,1,Blank,Blank,Dpmd Jayawardene,G Gambhir,Pa Patel,Mv Boucher,1985-12-06
17506,50124700077,501247,77,S Sreesanth,2/6/1983,Right-hand Bat,Right-arm Fast-medium,India,Player,Kochi Tuskers Kerala,Kolkata Knight Riders,2011,0,28,1,Blank,Blank,Dpmd Jayawardene,G Gambhir,Pa Patel,Mv Boucher,1983-02-06
17507,50124700081,501247,81,R Vinay Kumar,2/12/1984,Right-hand Bat,Right-arm Medium,India,Player,Kochi Tuskers Kerala,Kolkata Knight Riders,2011,0,27,1,Blank,Blank,Dpmd Jayawardene,G Gambhir,Pa Patel,Mv Boucher,1984-02-12
17509,50124700259,501247,259,Rv Gomez,10/16/1985,Right-hand Bat,Right-arm Medium,India,Player,Kochi Tuskers Kerala,Kolkata Knight Riders,2011,0,26,1,Blank,Blank,Dpmd Jayawardene,G Gambhir,Pa Patel,Mv Boucher,1985-10-16
17510,50124700288,501247,288,M Klinger,7/4/1980,Right-hand Bat,N/a,Australia,Player,Kochi Tuskers Kerala,Kolkata Knight Riders,2011,0,31,1,Blank,Blank,Dpmd Jayawardene,G Gambhir,Pa Patel,Mv Boucher,1980-07-04
17515,50124800084,501248,84,I Sharma,9/2/1988,Right-hand Bat,Right-arm Fast-medium,India,Player,Deccan Chargers,Delhi Daredevils,2011,0,23,0,Blank,Blank,Kc Sangakkara,V Sehwag,Kc Sangakkara,Nv Ojha,1988-09-02
17516,50124800093,501248,93,B Chipli,1/27/1983,Right-hand Bat,Right-arm Medium,India,Player,Deccan Chargers,Delhi Daredevils,2011,0,28,0,Blank,Blank,Kc Sangakkara,V Sehwag,Kc Sangakkara,Nv Ojha,1983-01-27
17522,50124800290,501248,290,I Malhotra,5/23/1984,Right-hand Bat,Right-arm Medium-fast,India,Player,Deccan Chargers,Delhi Daredevils,2011,0,27,0,Blank,Blank,Kc Sangakkara,V Sehwag,Kc Sangakkara,Nv Ojha,1984-05-23
17525,50124800041,501248,41,V Sehwag,10/20/1978,Right-hand Bat,Right-arm Offbreak,India,Captain,Delhi Daredevils,Deccan Chargers,2011,1,33,1,Blank,Blank,V Sehwag,Kc Sangakkara,Nv Ojha,Kc Sangakkara,1978-10-20
17526,50124800054,501248,54,Y Venugopal Rao,2/26/1982,Right-hand Bat,Right-arm Offbreak,India,Player,Delhi Daredevils,Deccan Chargers,2011,0,29,1,Blank,Blank,V Sehwag,Kc Sangakkara,Nv Ojha,Kc Sangakkara,1982-02-26
17527,50124800082,501248,82,Ab Agarkar,12/4/1977,Right-hand Bat,Right-arm Fast,India,Player,Delhi Daredevils,Deccan Chargers,2011,0,34,1,Blank,Blank,V Sehwag,Kc Sangakkara,Nv Ojha,Kc Sangakkara,1977-12-04
17530,50124800199,501248,199,Y Nagar,1/6/1990,Right-hand Bat,Right-arm Offbreak,India,Player,Delhi Daredevils,Deccan Chargers,2011,0,21,1,Blank,Blank,V Sehwag,Kc Sangakkara,Nv Ojha,Kc Sangakkara,1990-01-06
17533,50124800439,501248,439,Am Salvi,10/20/1981,Right-hand Bat,Right-arm Medium,India,Player,Delhi Daredevils,Deccan Chargers,2011,0,30,1,Blank,Blank,V Sehwag,Kc Sangakkara,Nv Ojha,Kc Sangakkara,1981-10-20
17534,50124900008,501249,8,V Kohli,11/5/1988,Right-hand Bat,Right-arm Medium,India,Player,Royal Challengers Bangalore,Kings Xi Punjab,2011,0,23,1,Blank,Blank,Dl Vettori,Ac Gilchrist,Ab De Villiers,Ac Gilchrist,1988-11-05
17535,50124900015,501249,15,Z Khan,10/7/1978,Right-hand Bat,Left-arm Fast-medium,India,Player,Royal Challengers Bangalore,Kings Xi Punjab,2011,0,33,1,Blank,Blank,Dl Vettori,Ac Gilchrist,Ab De Villiers,Ac Gilchrist,1978-10-07
17539,50124900135,501249,135,Tm Dilshan,10/14/1976,Right-hand Bat,Right-arm Offbreak,Sri Lanka,Player,Royal Challengers Bangalore,Kings Xi Punjab,2011,0,35,1,Blank,Blank,Dl Vettori,Ac Gilchrist,Ab De Villiers,Ac Gilchrist,1976-10-14
17541,50124900175,501249,175,Dl Vettori,1/27/1979,Left-hand Bat,Slow Left-arm Orthodox,New Zealand,Captain,Royal Challengers Bangalore,Kings Xi Punjab,2011,0,32,1,Blank,Blank,Dl Vettori,Ac Gilchrist,Ab De Villiers,Ac Gilchrist,1979-01-27
17544,50124900270,501249,270,S Aravind,4/8/1984,Left-hand Bat,Left-arm Medium-fast,India,Player,Royal Challengers Bangalore,Kings Xi Punjab,2011,0,27,1,Blank,Blank,Dl Vettori,Ac Gilchrist,Ab De Villiers,Ac Gilchrist,1984-04-08
17546,50124900048,501249,48,Am Nayar,10/8/1983,Left-hand Bat,Right-arm Medium,India,Player,Kings Xi Punjab,Royal Challengers Bangalore,2011,0,28,0,Blank,Blank,Ac Gilchrist,Dl Vettori,Ac Gilchrist,Ab De Villiers,1983-10-08
17548,50124900067,501249,67,Pp Chawla,12/24/1988,Left-hand Bat,Legbreak,India,Player,Kings Xi Punjab,Royal Challengers Bangalore,2011,0,23,0,Blank,Blank,Ac Gilchrist,Dl Vettori,Ac Gilchrist,Ab De Villiers,1988-12-24
17556,50125000019,501250,19,Mek Hussey,5/27/1975,Left-hand Bat,Right-arm Medium,Australia,Player,Chennai Super Kings,Kolkata Knight Riders,2011,0,36,0,Blank,Blank,Ms Dhoni,G Gambhir,Ms Dhoni,Mv Boucher,1975-05-27
17557,50125000020,501250,20,Ms Dhoni,7/7/1981,Right-hand Bat,Right-arm Medium,India,Captainkeeper,Chennai Super Kings,Kolkata Knight Riders,2011,0,30,0,Blank,Blank,Ms Dhoni,G Gambhir,Ms Dhoni,Mv Boucher,1981-07-07
17558,50125000021,501250,21,Sk Raina,11/27/1986,Left-hand Bat,Right-arm Offbreak,India,Player,Chennai Super Kings,Kolkata Knight Riders,2011,0,25,0,Blank,Blank,Ms Dhoni,G Gambhir,Ms Dhoni,Mv Boucher,1986-11-27
17559,50125000023,501250,23,S Badrinath,8/30/1980,Right-hand Bat,Right-arm Offbreak,India,Player,Chennai Super Kings,Kolkata Knight Riders,2011,0,31,0,Blank,Blank,Ms Dhoni,G Gambhir,Ms Dhoni,Mv Boucher,1980-08-30
17561,50125000109,501250,109,Ja Morkel,6/10/1981,Left-hand Bat,Right-arm Medium-fast,South Africa,Player,Chennai Super Kings,Kolkata Knight Riders,2011,0,30,0,Blank,Blank,Ms Dhoni,G Gambhir,Ms Dhoni,Mv Boucher,1981-06-10
17565,50125000248,501250,248,De Bollinger,7/24/1981,Left-hand Bat,Left-arm Fast-medium,Australia,Player,Chennai Super Kings,Kolkata Knight Riders,2011,0,30,0,Blank,Blank,Ms Dhoni,G Gambhir,Ms Dhoni,Mv Boucher,1981-07-24
17566,50125000278,501250,278,S Randiv,1/30/1985,Right-hand Bat,Right-arm Offbreak,Sri Lanka,Player,Chennai Super Kings,Kolkata Knight Riders,2011,0,26,0,Blank,Blank,Ms Dhoni,G Gambhir,Ms Dhoni,Mv Boucher,1985-01-30
17567,50125000009,501250,9,Jh Kallis,10/16/1975,Right-hand Bat,Right-arm Fast-medium,South Africa,Player,Kolkata Knight Riders,Chennai Super Kings,2011,0,36,1,Blank,Blank,G Gambhir,Ms Dhoni,Mv Boucher,Ms Dhoni,1975-10-16
17568,50125000011,501250,11,Mv Boucher,12/3/1976,Right-hand Bat,Right-arm Medium,South Africa,Keeper,Kolkata Knight Riders,Chennai Super Kings,2011,0,35,1,Blank,Blank,G Gambhir,Ms Dhoni,Mv Boucher,Ms Dhoni,1976-12-03
17571,50125000066,501250,66,B Lee,11/8/1976,Right-hand Bat,Right-arm Fast,Australia,Player,Kolkata Knight Riders,Chennai Super Kings,2011,0,35,1,Blank,Blank,G Gambhir,Ms Dhoni,Mv Boucher,Ms Dhoni,1976-11-08
17572,50125000087,501250,87,Mk Tiwary,11/14/1985,Right-hand Bat,Legbreak Googly,India,Player,Kolkata Knight Riders,Chennai Super Kings,2011,0,26,1,Blank,Blank,G Gambhir,Ms Dhoni,Mv Boucher,Ms Dhoni,1985-11-14
17576,50125000216,501250,216,Ejg Morgan,9/10/1986,Left-hand Bat,Right-arm Medium,England,Player,Kolkata Knight Riders,Chennai Super Kings,2011,0,25,1,Blank,Blank,G Gambhir,Ms Dhoni,Mv Boucher,Ms Dhoni,1986-09-10
17578,50125100050,501251,50,Harbhajan Singh,7/3/1980,Right-hand Bat,Right-arm Offbreak,India,Player,Mumbai Indians,Delhi Daredevils,2011,0,31,1,Blank,Blank,Sr Tendulkar,V Sehwag,At Rayudu,Nv Ojha,1980-07-03
17579,50125100056,501251,56,A Symonds,6/9/1975,Right-hand Bat,Right-arm Offbreak,Australia,Player,Mumbai Indians,Delhi Daredevils,2011,0,36,1,Blank,Blank,Sr Tendulkar,V Sehwag,At Rayudu,Nv Ojha,1975-06-09
17583,50125100133,501251,133,Sr Tendulkar,4/24/1973,Right-hand Bat,Right-arm Offbreak,India,Captain,Mumbai Indians,Delhi Daredevils,2011,0,38,1,Blank,Blank,Sr Tendulkar,V Sehwag,At Rayudu,Nv Ojha,1973-04-24
17584,50125100178,501251,178,Tl Suman,12/15/1983,Right-hand Bat,Right-arm Offbreak,India,Player,Mumbai Indians,Delhi Daredevils,2011,0,28,1,Blank,Blank,Sr Tendulkar,V Sehwag,At Rayudu,Nv Ojha,1983-12-15
17586,50125100208,501251,208,At Rayudu,9/23/1985,Right-hand Bat,Right-arm Offbreak,India,Keeper,Mumbai Indians,Delhi Daredevils,2011,1,26,1,Blank,Blank,Sr Tendulkar,V Sehwag,At Rayudu,Nv Ojha,1985-09-23
17588,50125100289,501251,289,Ac Blizzard,6/27/1984,Left-hand Bat,Left-arm Medium,Australia,Player,Mumbai Indians,Delhi Daredevils,2011,0,27,1,Blank,Blank,Sr Tendulkar,V Sehwag,At Rayudu,Nv Ojha,1984-06-27
17589,50125100025,501251,25,Jr Hopes,10/24/1978,Right-hand Bat,Right-arm Medium,Australia,Player,Delhi Daredevils,Mumbai Indians,2011,0,33,0,Blank,Blank,V Sehwag,Sr Tendulkar,Nv Ojha,At Rayudu,1978-10-24
17594,50125100183,501251,183,Nv Ojha,7/20/1983,Right-hand Bat,N/a,India,Keeper,Delhi Daredevils,Mumbai Indians,2011,0,28,0,Blank,Blank,V Sehwag,Sr Tendulkar,Nv Ojha,At Rayudu,1983-07-20
17595,50125100187,501251,187,Da Warner,10/27/1986,Left-hand Bat,Legbreak,Australia,Player,Delhi Daredevils,Mumbai Indians,2011,0,25,0,Blank,Blank,V Sehwag,Sr Tendulkar,Nv Ojha,At Rayudu,1986-10-27
17599,50125100293,501251,293,S Nadeem,8/12/1989,Right-hand Bat,Slow Left-arm Orthodox,India,Player,Delhi Daredevils,Mumbai Indians,2011,0,22,0,Blank,Blank,V Sehwag,Sr Tendulkar,Nv Ojha,At Rayudu,1989-08-12
17600,50125200008,501252,8,V Kohli,11/5/1988,Right-hand Bat,Right-arm Medium,India,Player,Royal Challengers Bangalore,Kochi Tuskers Kerala,2011,0,23,1,Blank,Blank,Dl Vettori,Dpmd Jayawardene,Ab De Villiers,Pa Patel,1988-11-05
17603,50125200079,501252,79,Ss Tiwary,12/30/1989,Left-hand Bat,N/a,India,Player,Royal Challengers Bangalore,Kochi Tuskers Kerala,2011,0,22,1,Blank,Blank,Dl Vettori,Dpmd Jayawardene,Ab De Villiers,Pa Patel,1989-12-30
17610,50125200270,501252,270,S Aravind,4/8/1984,Left-hand Bat,Left-arm Medium-fast,India,Player,Royal Challengers Bangalore,Kochi Tuskers Kerala,2011,0,27,1,Blank,Blank,Dl Vettori,Dpmd Jayawardene,Ab De Villiers,Pa Patel,1984-04-08
17611,50125200002,501252,2,Bb Mccullum,9/27/1981,Right-hand Bat,Right-arm Medium,New Zealand,Player,Kochi Tuskers Kerala,Royal Challengers Bangalore,2011,0,30,0,Blank,Blank,Dpmd Jayawardene,Dl Vettori,Pa Patel,Ab De Villiers,1981-09-27
17613,50125200035,501252,35,Ra Jadeja,12/6/1988,Left-hand Bat,Slow Left-arm Orthodox,India,Player,Kochi Tuskers Kerala,Royal Challengers Bangalore,2011,0,23,0,Blank,Blank,Dpmd Jayawardene,Dl Vettori,Pa Patel,Ab De Villiers,1988-12-06
17616,50125200081,501252,81,R Vinay Kumar,2/12/1984,Right-hand Bat,Right-arm Medium,India,Player,Kochi Tuskers Kerala,Royal Challengers Bangalore,2011,0,27,0,Blank,Blank,Dpmd Jayawardene,Dl Vettori,Pa Patel,Ab De Villiers,1984-02-12
17620,50125200288,501252,288,M Klinger,7/4/1980,Right-hand Bat,N/a,Australia,Player,Kochi Tuskers Kerala,Royal Challengers Bangalore,2011,0,31,0,Blank,Blank,Dpmd Jayawardene,Dl Vettori,Pa Patel,Ab De Villiers,1980-07-04
17621,50125200294,501252,294,P Parameswaran,5/30/1985,Right-hand Bat,Left-arm Medium,India,Player,Kochi Tuskers Kerala,Royal Challengers Bangalore,2011,0,26,0,Blank,Blank,Dpmd Jayawardene,Dl Vettori,Pa Patel,Ab De Villiers,1985-05-30
17627,50125300148,501253,148,Sd Chitnis,5/6/1987,Right-hand Bat,Right-arm Offbreak,India,Player,Kings Xi Punjab,Pune Warriors,2011,0,24,0,Blank,Blank,Ac Gilchrist,Yuvraj Singh,Ac Gilchrist,Rv Uthappa,1987-05-06
17631,50125300236,501253,236,Mandeep Singh,12/18/1991,Right-hand Bat,Right-arm Medium,India,Player,Kings Xi Punjab,Pune Warriors,2011,0,20,0,Blank,Blank,Ac Gilchrist,Yuvraj Singh,Ac Gilchrist,Rv Uthappa,1991-12-18
17632,50125300302,501253,302,Ba Bhatt,5/13/1990,Left-hand Bat,Slow Left-arm Orthodox,India,Player,Kings Xi Punjab,Pune Warriors,2011,0,21,0,Blank,Blank,Ac Gilchrist,Yuvraj Singh,Ac Gilchrist,Rv Uthappa,1990-05-13
17641,50125300273,501253,273,Sb Wagh,10/9/1988,Left-hand Bat,Left-arm Medium-fast,India,Player,Pune Warriors,Kings Xi Punjab,2011,0,23,1,Blank,Blank,Yuvraj Singh,Ac Gilchrist,Rv Uthappa,Ac Gilchrist,1988-10-09
17642,50125300295,501253,295,Cj Ferguson,11/21/1984,Right-hand Bat,Right-arm Medium,Australia,Player,Pune Warriors,Kings Xi Punjab,2011,0,27,1,Blank,Blank,Yuvraj Singh,Ac Gilchrist,Rv Uthappa,Ac Gilchrist,1984-11-21
17643,50125300299,501253,299,B Kumar,2/5/1990,Right-hand Bat,Right-arm Medium,India,Player,Pune Warriors,Kings Xi Punjab,2011,0,21,1,Blank,Blank,Yuvraj Singh,Ac Gilchrist,Rv Uthappa,Ac Gilchrist,1990-02-05
17648,50125400052,501254,52,Lrpl Taylor,3/8/1984,Right-hand Bat,Right-arm Offbreak,New Zealand,Player,Rajasthan Royals,Chennai Super Kings,2011,0,27,0,Blank,Blank,Sk Warne,Ms Dhoni,Dh Yagnik,Ms Dhoni,1984-03-08
17649,50125400085,501254,85,Am Rahane,6/6/1988,Right-hand Bat,Right-arm Medium,India,Player,Rajasthan Royals,Chennai Super Kings,2011,0,23,0,Blank,Blank,Sk Warne,Ms Dhoni,Dh Yagnik,Ms Dhoni,1988-06-06
17653,50125400266,501254,266,Al Menaria,10/29/1990,Left-hand Bat,Slow Left-arm Orthodox,India,Player,Rajasthan Royals,Chennai Super Kings,2011,0,21,0,Blank,Blank,Sk Warne,Ms Dhoni,Dh Yagnik,Ms Dhoni,1990-10-29
17655,50125400019,501254,19,Mek Hussey,5/27/1975,Left-hand Bat,Right-arm Medium,Australia,Player,Chennai Super Kings,Rajasthan Royals,2011,0,36,1,Blank,Blank,Ms Dhoni,Sk Warne,Ms Dhoni,Dh Yagnik,1975-05-27
17657,50125400021,501254,21,Sk Raina,11/27/1986,Left-hand Bat,Right-arm Offbreak,India,Player,Chennai Super Kings,Rajasthan Royals,2011,0,25,1,Blank,Blank,Ms Dhoni,Sk Warne,Ms Dhoni,Dh Yagnik,1986-11-27
17659,50125400062,501254,62,Wp Saha,10/24/1984,Right-hand Bat,N/a,India,Player,Chennai Super Kings,Rajasthan Royals,2011,0,27,1,Blank,Blank,Ms Dhoni,Sk Warne,Ms Dhoni,Dh Yagnik,1984-10-24
17665,50125400248,501254,248,De Bollinger,7/24/1981,Left-hand Bat,Left-arm Fast-medium,Australia,Player,Chennai Super Kings,Rajasthan Royals,2011,0,30,1,Blank,Blank,Ms Dhoni,Sk Warne,Ms Dhoni,Dh Yagnik,1981-07-24
17667,50125500042,501255,42,S Dhawan,12/5/1985,Left-hand Bat,Right-arm Offbreak,India,Player,Deccan Chargers,Pune Warriors,2011,0,26,0,Blank,Blank,Kc Sangakkara,Yuvraj Singh,Kc Sangakkara,Rv Uthappa,1985-12-05
17668,50125500065,501255,65,S Sohal,11/10/1987,Right-hand Bat,Legbreak,India,Player,Deccan Chargers,Pune Warriors,2011,0,24,0,Blank,Blank,Kc Sangakkara,Yuvraj Singh,Kc Sangakkara,Rv Uthappa,1987-11-10
17671,50125500094,501255,94,Dw Steyn,6/27/1983,Right-hand Bat,Right-arm Fast,South Africa,Player,Deccan Chargers,Pune Warriors,2011,0,28,0,Blank,Blank,Kc Sangakkara,Yuvraj Singh,Kc Sangakkara,Rv Uthappa,1983-06-27
17673,50125500131,501255,131,Pp Ojha,9/5/1986,Left-hand Bat,Slow Left-arm Orthodox,India,Player,Deccan Chargers,Pune Warriors,2011,0,25,0,Blank,Blank,Kc Sangakkara,Yuvraj Singh,Kc Sangakkara,Rv Uthappa,1986-09-05
17675,50125500154,501255,154,Jp Duminy,4/14/1984,Left-hand Bat,Right-arm Offbreak,South Africa,Player,Deccan Chargers,Pune Warriors,2011,0,27,0,Blank,Blank,Kc Sangakkara,Yuvraj Singh,Kc Sangakkara,Rv Uthappa,1984-04-14
17677,50125500001,501255,1,Sc Ganguly,7/8/1972,Left-hand Bat,Right-arm Medium,India,Player,Pune Warriors,Deccan Chargers,2011,0,39,1,Blank,Blank,Yuvraj Singh,Kc Sangakkara,Rv Uthappa,Kc Sangakkara,1972-07-08
17678,50125500027,501255,27,Yuvraj Singh,12/12/1981,Left-hand Bat,Slow Left-arm Orthodox,India,Captain,Pune Warriors,Deccan Chargers,2011,0,30,1,Blank,Blank,Yuvraj Singh,Kc Sangakkara,Rv Uthappa,Kc Sangakkara,1981-12-12
17679,50125500046,501255,46,Rv Uthappa,11/11/1985,Right-hand Bat,Right-arm Medium,India,Keeper,Pune Warriors,Deccan Chargers,2011,0,26,1,Blank,Blank,Yuvraj Singh,Kc Sangakkara,Rv Uthappa,Kc Sangakkara,1985-11-11
17680,50125500096,501255,96,Mk Pandey,9/10/1989,Right-hand Bat,Right-arm Medium,India,Player,Pune Warriors,Deccan Chargers,2011,0,22,1,Blank,Blank,Yuvraj Singh,Kc Sangakkara,Rv Uthappa,Kc Sangakkara,1989-09-10
17684,50125500267,501255,267,Wd Parnell,7/30/1989,Left-hand Bat,Left-arm Medium-fast,South Africa,Player,Pune Warriors,Deccan Chargers,2011,0,22,1,Blank,Blank,Yuvraj Singh,Kc Sangakkara,Rv Uthappa,Kc Sangakkara,1989-07-30
17687,50125500299,501255,299,B Kumar,2/5/1990,Right-hand Bat,Right-arm Medium,India,Player,Pune Warriors,Deccan Chargers,2011,0,21,1,Blank,Blank,Yuvraj Singh,Kc Sangakkara,Rv Uthappa,Kc Sangakkara,1990-02-05
17688,50125600004,501256,4,Dj Hussey,7/15/1977,Right-hand Bat,Right-arm Offbreak,Australia,Player,Kings Xi Punjab,Mumbai Indians,2011,0,34,1,Blank,Blank,Ac Gilchrist,Sr Tendulkar,Ac Gilchrist,At Rayudu,1977-07-15
17693,50125600167,501256,167,Pc Valthaty,12/7/1983,Right-hand Bat,Right-arm Medium,India,Player,Kings Xi Punjab,Mumbai Indians,2011,0,28,1,Blank,Blank,Ac Gilchrist,Sr Tendulkar,Ac Gilchrist,At Rayudu,1983-12-07
17697,50125600236,501256,236,Mandeep Singh,12/18/1991,Right-hand Bat,Right-arm Medium,India,Player,Kings Xi Punjab,Mumbai Indians,2011,0,20,1,Blank,Blank,Ac Gilchrist,Sr Tendulkar,Ac Gilchrist,At Rayudu,1991-12-18
17698,50125600302,501256,302,Ba Bhatt,5/13/1990,Left-hand Bat,Slow Left-arm Orthodox,India,Player,Kings Xi Punjab,Mumbai Indians,2011,1,21,1,Blank,Blank,Ac Gilchrist,Sr Tendulkar,Ac Gilchrist,At Rayudu,1990-05-13
17700,50125600056,501256,56,A Symonds,6/9/1975,Right-hand Bat,Right-arm Offbreak,Australia,Player,Mumbai Indians,Kings Xi Punjab,2011,0,36,0,Blank,Blank,Sr Tendulkar,Ac Gilchrist,At Rayudu,Ac Gilchrist,1975-06-09
17701,50125600057,501256,57,Rg Sharma,4/30/1987,Right-hand Bat,Right-arm Offbreak,India,Player,Mumbai Indians,Kings Xi Punjab,2011,0,24,0,Blank,Blank,Sr Tendulkar,Ac Gilchrist,At Rayudu,Ac Gilchrist,1987-04-30
17704,50125600133,501256,133,Sr Tendulkar,4/24/1973,Right-hand Bat,Right-arm Offbreak,India,Captain,Mumbai Indians,Kings Xi Punjab,2011,0,38,0,Blank,Blank,Sr Tendulkar,Ac Gilchrist,At Rayudu,Ac Gilchrist,1973-04-24
17706,50125600194,501256,194,Sl Malinga,8/28/1983,Right-hand Bat,Right-arm Fast,Sri Lanka,Player,Mumbai Indians,Kings Xi Punjab,2011,0,28,0,Blank,Blank,Sr Tendulkar,Ac Gilchrist,At Rayudu,Ac Gilchrist,1983-08-28
17707,50125600208,501256,208,At Rayudu,9/23/1985,Right-hand Bat,Right-arm Offbreak,India,Keeper,Mumbai Indians,Kings Xi Punjab,2011,0,26,0,Blank,Blank,Sr Tendulkar,Ac Gilchrist,At Rayudu,Ac Gilchrist,1985-09-23
17720,50125700277,501257,277,Dh Yagnik,6/22/1983,Left-hand Bat,N/a,India,Keeper,Rajasthan Royals,Royal Challengers Bangalore,2011,0,28,0,Blank,Blank,Sk Warne,V Kohli,Dh Yagnik,Kb Arun Karthik,1983-06-22
17724,50125700079,501257,79,Ss Tiwary,12/30/1989,Left-hand Bat,N/a,India,Player,Royal Challengers Bangalore,Rajasthan Royals,2011,0,22,1,Blank,Blank,V Kohli,Sk Warne,Kb Arun Karthik,Dh Yagnik,1989-12-30
17726,50125700135,501257,135,Tm Dilshan,10/14/1976,Right-hand Bat,Right-arm Offbreak,Sri Lanka,Player,Royal Challengers Bangalore,Rajasthan Royals,2011,0,35,1,Blank,Blank,V Kohli,Sk Warne,Kb Arun Karthik,Dh Yagnik,1976-10-14
17729,50125700242,501257,242,Ck Langeveldt,12/17/1974,Right-hand Bat,Right-arm Fast-medium,England,Player,Royal Challengers Bangalore,Rajasthan Royals,2011,0,37,1,Blank,Blank,V Kohli,Sk Warne,Kb Arun Karthik,Dh Yagnik,1974-12-17
17733,50125800020,501258,20,Ms Dhoni,7/7/1981,Right-hand Bat,Right-arm Medium,India,Captainkeeper,Chennai Super Kings,Delhi Daredevils,2011,1,30,1,Blank,Blank,Ms Dhoni,Jr Hopes,Ms Dhoni,Nv Ojha,1981-07-07
17734,50125800021,501258,21,Sk Raina,11/27/1986,Left-hand Bat,Right-arm Offbreak,India,Player,Chennai Super Kings,Delhi Daredevils,2011,0,25,1,Blank,Blank,Ms Dhoni,Jr Hopes,Ms Dhoni,Nv Ojha,1986-11-27
17735,50125800023,501258,23,S Badrinath,8/30/1980,Right-hand Bat,Right-arm Offbreak,India,Player,Chennai Super Kings,Delhi Daredevils,2011,0,31,1,Blank,Blank,Ms Dhoni,Jr Hopes,Ms Dhoni,Nv Ojha,1980-08-30
17739,50125800185,501258,185,M Vijay,4/1/1984,Right-hand Bat,Right-arm Offbreak,India,Player,Chennai Super Kings,Delhi Daredevils,2011,0,27,1,Blank,Blank,Ms Dhoni,Jr Hopes,Ms Dhoni,Nv Ojha,1984-04-01
17740,50125800186,501258,186,Sb Jakati,11/27/1980,Left-hand Bat,Slow Left-arm Orthodox,India,Player,Chennai Super Kings,Delhi Daredevils,2011,0,31,1,Blank,Blank,Ms Dhoni,Jr Hopes,Ms Dhoni,Nv Ojha,1980-11-27
17741,50125800201,501258,201,R Ashwin,9/17/1986,Right-hand Bat,Right-arm Offbreak,India,Player,Chennai Super Kings,Delhi Daredevils,2011,0,25,1,Blank,Blank,Ms Dhoni,Jr Hopes,Ms Dhoni,Nv Ojha,1986-09-17
17745,50125800054,501258,54,Y Venugopal Rao,2/26/1982,Right-hand Bat,Right-arm Offbreak,India,Player,Delhi Daredevils,Chennai Super Kings,2011,0,29,0,Blank,Blank,Jr Hopes,Ms Dhoni,Nv Ojha,Ms Dhoni,1982-02-26
17746,50125800082,501258,82,Ab Agarkar,12/4/1977,Right-hand Bat,Right-arm Fast,India,Player,Delhi Daredevils,Chennai Super Kings,2011,0,34,0,Blank,Blank,Jr Hopes,Ms Dhoni,Nv Ojha,Ms Dhoni,1977-12-04
17747,50125800183,501258,183,Nv Ojha,7/20/1983,Right-hand Bat,N/a,India,Keeper,Delhi Daredevils,Chennai Super Kings,2011,0,28,0,Blank,Blank,Jr Hopes,Ms Dhoni,Nv Ojha,Ms Dhoni,1983-07-20
17748,50125800187,501258,187,Da Warner,10/27/1986,Left-hand Bat,Legbreak,Australia,Player,Delhi Daredevils,Chennai Super Kings,2011,0,25,0,Blank,Blank,Jr Hopes,Ms Dhoni,Nv Ojha,Ms Dhoni,1986-10-27
17752,50125800293,501258,293,S Nadeem,8/12/1989,Right-hand Bat,Slow Left-arm Orthodox,India,Player,Delhi Daredevils,Chennai Super Kings,2011,0,22,0,Blank,Blank,Jr Hopes,Ms Dhoni,Nv Ojha,Ms Dhoni,1989-08-12
17753,50125800296,501258,296,Vr Aaron,10/29/1989,Right-hand Bat,Right-arm Fast,India,Player,Delhi Daredevils,Chennai Super Kings,2011,0,22,0,Blank,Blank,Jr Hopes,Ms Dhoni,Nv Ojha,Ms Dhoni,1989-10-29
17756,50125900067,501259,67,Pp Chawla,12/24/1988,Left-hand Bat,Legbreak,India,Player,Kings Xi Punjab,Kochi Tuskers Kerala,2011,0,23,1,Blank,Blank,Ac Gilchrist,Dpmd Jayawardene,Ac Gilchrist,Pa Patel,1988-12-24
17757,50125900088,501259,88,Kd Karthik,6/1/1985,Right-hand Bat,N/a,India,Player,Kings Xi Punjab,Kochi Tuskers Kerala,2011,1,26,1,Blank,Blank,Ac Gilchrist,Dpmd Jayawardene,Ac Gilchrist,Pa Patel,1985-06-01
17759,50125900167,501259,167,Pc Valthaty,12/7/1983,Right-hand Bat,Right-arm Medium,India,Player,Kings Xi Punjab,Kochi Tuskers Kerala,2011,0,28,1,Blank,Blank,Ac Gilchrist,Dpmd Jayawardene,Ac Gilchrist,Pa Patel,1983-12-07
17760,50125900188,501259,188,Rj Harris,10/11/1979,Right-hand Bat,Right-arm Fast,Australia,Player,Kings Xi Punjab,Kochi Tuskers Kerala,2011,0,32,1,Blank,Blank,Ac Gilchrist,Dpmd Jayawardene,Ac Gilchrist,Pa Patel,1979-10-11
17762,50125900234,501259,234,Sj Srivastava,9/22/1981,Right-hand Bat,Left-arm Fast-medium,India,Player,Kings Xi Punjab,Kochi Tuskers Kerala,2011,0,30,1,Blank,Blank,Ac Gilchrist,Dpmd Jayawardene,Ac Gilchrist,Pa Patel,1981-09-22
17766,50125900017,501259,17,Pa Patel,3/9/1985,Left-hand Bat,N/a,India,Keeper,Kochi Tuskers Kerala,Kings Xi Punjab,2011,0,26,0,Blank,Blank,Dpmd Jayawardene,Ac Gilchrist,Pa Patel,Ac Gilchrist,1985-03-09
17768,50125900061,501259,61,Rp Singh,12/6/1985,Right-hand Bat,Left-arm Fast-medium,India,Player,Kochi Tuskers Kerala,Kings Xi Punjab,2011,0,26,0,Blank,Blank,Dpmd Jayawardene,Ac Gilchrist,Pa Patel,Ac Gilchrist,1985-12-06
17770,50125900077,501259,77,S Sreesanth,2/6/1983,Right-hand Bat,Right-arm Fast-medium,India,Player,Kochi Tuskers Kerala,Kings Xi Punjab,2011,0,28,0,Blank,Blank,Dpmd Jayawardene,Ac Gilchrist,Pa Patel,Ac Gilchrist,1983-02-06
17780,50126000110,501260,110,Ab De Villiers,2/17/1984,Right-hand Bat,Right-arm Medium,South Africa,Player,Royal Challengers Bangalore,Kolkata Knight Riders,2011,0,27,1,Blank,Blank,V Kohli,G Gambhir,Kb Arun Karthik,Mv Boucher,1984-02-17
17783,50126000239,501260,239,Kb Arun Karthik,2/15/1986,Right-hand Bat,Legbreak Googly,India,Keeper,Royal Challengers Bangalore,Kolkata Knight Riders,2011,0,25,1,Blank,Blank,V Kohli,G Gambhir,Kb Arun Karthik,Mv Boucher,1986-02-15
17786,50126000270,501260,270,S Aravind,4/8/1984,Left-hand Bat,Left-arm Medium-fast,India,Player,Royal Challengers Bangalore,Kolkata Knight Riders,2011,0,27,1,Blank,Blank,V Kohli,G Gambhir,Kb Arun Karthik,Mv Boucher,1984-04-08
17790,50126000040,501260,40,G Gambhir,10/14/1981,Left-hand Bat,Legbreak,India,Captain,Kolkata Knight Riders,Royal Challengers Bangalore,2011,0,30,0,Blank,Blank,G Gambhir,V Kohli,Mv Boucher,Kb Arun Karthik,1981-10-14
17791,50126000066,501260,66,B Lee,11/8/1976,Right-hand Bat,Right-arm Fast,Australia,Player,Kolkata Knight Riders,Royal Challengers Bangalore,2011,0,35,0,Blank,Blank,G Gambhir,V Kohli,Mv Boucher,Kb Arun Karthik,1976-11-08
17793,50126000089,501260,89,R Bhatia,10/22/1979,Right-hand Bat,Right-arm Medium-fast,India,Player,Kolkata Knight Riders,Royal Challengers Bangalore,2011,0,32,0,Blank,Blank,G Gambhir,V Kohli,Mv Boucher,Kb Arun Karthik,1979-10-22
17794,50126000140,501260,140,Iqbal Abdulla,12/2/1989,Left-hand Bat,Slow Left-arm Orthodox,India,Player,Kolkata Knight Riders,Royal Challengers Bangalore,2011,0,22,0,Blank,Blank,G Gambhir,V Kohli,Mv Boucher,Kb Arun Karthik,1989-12-02
17796,50126000216,501260,216,Ejg Morgan,9/10/1986,Left-hand Bat,Right-arm Medium,England,Player,Kolkata Knight Riders,Royal Challengers Bangalore,2011,0,25,0,Blank,Blank,G Gambhir,V Kohli,Mv Boucher,Kb Arun Karthik,1986-09-10
17800,50126100057,501261,57,Rg Sharma,4/30/1987,Right-hand Bat,Right-arm Offbreak,India,Player,Mumbai Indians,Deccan Chargers,2011,0,24,0,Blank,Blank,Sr Tendulkar,Kc Sangakkara,At Rayudu,Kc Sangakkara,1987-04-30
17801,50126100080,501261,80,Ds Kulkarni,12/10/1988,Right-hand Bat,Right-arm Medium,India,Player,Mumbai Indians,Deccan Chargers,2011,0,23,0,Blank,Blank,Sr Tendulkar,Kc Sangakkara,At Rayudu,Kc Sangakkara,1988-12-10
17802,50126100126,501261,126,Mm Patel,7/12/1983,Right-hand Bat,Right-arm Medium-fast,India,Player,Mumbai Indians,Deccan Chargers,2011,0,28,0,Blank,Blank,Sr Tendulkar,Kc Sangakkara,At Rayudu,Kc Sangakkara,1983-07-12
17805,50126100194,501261,194,Sl Malinga,8/28/1983,Right-hand Bat,Right-arm Fast,Sri Lanka,Player,Mumbai Indians,Deccan Chargers,2011,0,28,0,Blank,Blank,Sr Tendulkar,Kc Sangakkara,At Rayudu,Kc Sangakkara,1983-08-28
17806,50126100208,501261,208,At Rayudu,9/23/1985,Right-hand Bat,Right-arm Offbreak,India,Keeper,Mumbai Indians,Deccan Chargers,2011,0,26,0,Blank,Blank,Sr Tendulkar,Kc Sangakkara,At Rayudu,Kc Sangakkara,1985-09-23
17807,50126100221,501261,221,Ka Pollard,5/12/1987,Right-hand Bat,Right-arm Medium-fast,West Indies,Player,Mumbai Indians,Deccan Chargers,2011,0,24,0,Blank,Blank,Sr Tendulkar,Kc Sangakkara,At Rayudu,Kc Sangakkara,1987-05-12
17813,50126100093,501261,93,B Chipli,1/27/1983,Right-hand Bat,Right-arm Medium,India,Player,Deccan Chargers,Mumbai Indians,2011,0,28,1,Blank,Blank,Kc Sangakkara,Sr Tendulkar,Kc Sangakkara,At Rayudu,1983-01-27
17815,50126100136,501261,136,A Mishra,11/24/1982,Right-hand Bat,Legbreak,India,Player,Deccan Chargers,Mumbai Indians,2011,1,29,1,Blank,Blank,Kc Sangakkara,Sr Tendulkar,Kc Sangakkara,At Rayudu,1982-11-24
17818,50126100258,501261,258,Dt Christian,5/4/1983,Right-hand Bat,Right-arm Fast-medium,Australia,Player,Deccan Chargers,Mumbai Indians,2011,0,28,1,Blank,Blank,Kc Sangakkara,Sr Tendulkar,Kc Sangakkara,At Rayudu,1983-05-04
17819,50126100446,501261,446,Anand Rajan,4/17/1987,Right-hand Bat,Right-arm Medium,India,Player,Deccan Chargers,Mumbai Indians,2011,0,24,1,Blank,Blank,Kc Sangakkara,Sr Tendulkar,Kc Sangakkara,At Rayudu,1987-04-17
17825,50126200100,501262,100,Se Marsh,7/9/1983,Left-hand Bat,Slow Left-arm Orthodox,Australia,Player,Kings Xi Punjab,Delhi Daredevils,2011,0,28,1,Blank,Blank,Ac Gilchrist,Jr Hopes,Ac Gilchrist,Nv Ojha,1983-07-09
17831,50126200025,501262,25,Jr Hopes,10/24/1978,Right-hand Bat,Right-arm Medium,Australia,Captain,Delhi Daredevils,Kings Xi Punjab,2011,0,33,0,Blank,Blank,Jr Hopes,Ac Gilchrist,Nv Ojha,Ac Gilchrist,1978-10-24
17833,50126200054,501262,54,Y Venugopal Rao,2/26/1982,Right-hand Bat,Right-arm Offbreak,India,Player,Delhi Daredevils,Kings Xi Punjab,2011,0,29,0,Blank,Blank,Jr Hopes,Ac Gilchrist,Nv Ojha,Ac Gilchrist,1982-02-26
17835,50126200187,501262,187,Da Warner,10/27/1986,Left-hand Bat,Legbreak,Australia,Player,Delhi Daredevils,Kings Xi Punjab,2011,0,25,0,Blank,Blank,Jr Hopes,Ac Gilchrist,Nv Ojha,Ac Gilchrist,1986-10-27
17840,50126200296,501262,296,Vr Aaron,10/29/1989,Right-hand Bat,Right-arm Fast,India,Player,Delhi Daredevils,Kings Xi Punjab,2011,0,22,0,Blank,Blank,Jr Hopes,Ac Gilchrist,Nv Ojha,Ac Gilchrist,1989-10-29
17841,50126200439,501262,439,Am Salvi,10/20/1981,Right-hand Bat,Right-arm Medium,India,Player,Delhi Daredevils,Kings Xi Punjab,2011,0,30,0,Blank,Blank,Jr Hopes,Ac Gilchrist,Nv Ojha,Ac Gilchrist,1981-10-20
17850,50126300294,501263,294,P Parameswaran,5/30/1985,Right-hand Bat,Left-arm Medium,India,Player,Kochi Tuskers Kerala,Rajasthan Royals,2011,0,26,1,Blank,Blank,Dpmd Jayawardene,Sk Warne,Pa Patel,Pr Shah,1985-05-30
17851,50126300300,501263,300,Y Gnaneswara Rao,8/25/1984,Right-hand Bat,Right-arm Medium,India,Player,Kochi Tuskers Kerala,Rajasthan Royals,2011,0,27,1,Blank,Blank,Dpmd Jayawardene,Sk Warne,Pa Patel,Pr Shah,1984-08-25
17852,50126300447,501263,447,P Prasanth,5/22/1985,Left-hand Bat,Slow Left-arm Orthodox,India,Player,Kochi Tuskers Kerala,Rajasthan Royals,2011,0,26,1,Blank,Blank,Dpmd Jayawardene,Sk Warne,Pa Patel,Pr Shah,1985-05-22
17853,50126300006,501263,6,R Dravid,1/11/1973,Right-hand Bat,Right-arm Offbreak,India,Player,Rajasthan Royals,Kochi Tuskers Kerala,2011,0,38,0,Blank,Blank,Sk Warne,Dpmd Jayawardene,Pr Shah,Pa Patel,1973-01-11
17854,50126300022,501263,22,Jdp Oram,7/28/1978,Left-hand Bat,Right-arm Fast-medium,New Zealand,Player,Rajasthan Royals,Kochi Tuskers Kerala,2011,0,33,0,Blank,Blank,Sk Warne,Dpmd Jayawardene,Pr Shah,Pa Patel,1978-07-28
17855,50126300032,501263,32,Sr Watson,6/17/1981,Right-hand Bat,Right-arm Fast-medium,Australia,Player,Rajasthan Royals,Kochi Tuskers Kerala,2011,0,30,0,Blank,Blank,Sk Warne,Dpmd Jayawardene,Pr Shah,Pa Patel,1981-06-17
17856,50126300038,501263,38,Sk Warne,9/13/1969,Right-hand Bat,Legbreak Googly,Australia,Captain,Rajasthan Royals,Kochi Tuskers Kerala,2011,0,42,0,Blank,Blank,Sk Warne,Dpmd Jayawardene,Pr Shah,Pa Patel,1969-09-13
17861,50126300266,501263,266,Al Menaria,10/29/1990,Left-hand Bat,Slow Left-arm Orthodox,India,Player,Rajasthan Royals,Kochi Tuskers Kerala,2011,0,21,0,Blank,Blank,Sk Warne,Dpmd Jayawardene,Pr Shah,Pa Patel,1990-10-29
17865,50126400042,501264,42,S Dhawan,12/5/1985,Left-hand Bat,Right-arm Offbreak,India,Player,Deccan Chargers,Pune Warriors,2011,0,26,1,Blank,Blank,Kc Sangakkara,Yuvraj Singh,Kc Sangakkara,Rv Uthappa,1985-12-05
17869,50126400094,501264,94,Dw Steyn,6/27/1983,Right-hand Bat,Right-arm Fast,South Africa,Player,Deccan Chargers,Pune Warriors,2011,0,28,1,Blank,Blank,Kc Sangakkara,Yuvraj Singh,Kc Sangakkara,Rv Uthappa,1983-06-27
17870,50126400112,501264,112,Db Ravi Teja,9/5/1987,Right-hand Bat,Legbreak Googly,India,Player,Deccan Chargers,Pune Warriors,2011,0,24,1,Blank,Blank,Kc Sangakkara,Yuvraj Singh,Kc Sangakkara,Rv Uthappa,1987-09-05
17871,50126400131,501264,131,Pp Ojha,9/5/1986,Left-hand Bat,Slow Left-arm Orthodox,India,Player,Deccan Chargers,Pune Warriors,2011,0,25,1,Blank,Blank,Kc Sangakkara,Yuvraj Singh,Kc Sangakkara,Rv Uthappa,1986-09-05
17873,50126400154,501264,154,Jp Duminy,4/14/1984,Left-hand Bat,Right-arm Offbreak,South Africa,Player,Deccan Chargers,Pune Warriors,2011,0,27,1,Blank,Blank,Kc Sangakkara,Yuvraj Singh,Kc Sangakkara,Rv Uthappa,1984-04-14
17875,50126400001,501264,1,Sc Ganguly,7/8/1972,Left-hand Bat,Right-arm Medium,India,Player,Pune Warriors,Deccan Chargers,2011,0,39,0,Blank,Blank,Yuvraj Singh,Kc Sangakkara,Rv Uthappa,Kc Sangakkara,1972-07-08
17879,50126400157,501264,157,Jd Ryder,8/6/1984,Left-hand Bat,Right-arm Medium,New Zealand,Player,Pune Warriors,Deccan Chargers,2011,0,27,0,Blank,Blank,Yuvraj Singh,Kc Sangakkara,Rv Uthappa,Kc Sangakkara,1984-08-06
17883,50126400267,501264,267,Wd Parnell,7/30/1989,Left-hand Bat,Left-arm Medium-fast,South Africa,Player,Pune Warriors,Deccan Chargers,2011,0,22,0,Blank,Blank,Yuvraj Singh,Kc Sangakkara,Rv Uthappa,Kc Sangakkara,1989-07-30
17885,50126400299,501264,299,B Kumar,2/5/1990,Right-hand Bat,Right-arm Medium,India,Player,Pune Warriors,Deccan Chargers,2011,0,21,0,Blank,Blank,Yuvraj Singh,Kc Sangakkara,Rv Uthappa,Kc Sangakkara,1990-02-05
17889,50126500053,501265,53,Ac Gilchrist,11/14/1971,Left-hand Bat,Right-arm Offbreak,Australia,Captainkeeper,Kings Xi Punjab,Royal Challengers Bangalore,2011,1,40,1,Blank,Blank,Ac Gilchrist,V Kohli,Ac Gilchrist,Kb Arun Karthik,1971-11-14
17897,50126500008,501265,8,V Kohli,11/5/1988,Right-hand Bat,Right-arm Medium,India,Captain,Royal Challengers Bangalore,Kings Xi Punjab,2011,0,23,0,Blank,Blank,V Kohli,Ac Gilchrist,Kb Arun Karthik,Ac Gilchrist,1988-11-05
17906,50126500268,501265,268,Jj Van Der Wath,1/10/1978,Right-hand Bat,Right-arm Medium-fast,South Africa,Player,Royal Challengers Bangalore,Kings Xi Punjab,2011,0,33,0,Blank,Blank,V Kohli,Ac Gilchrist,Kb Arun Karthik,Ac Gilchrist,1978-01-10
17907,50126500270,501265,270,S Aravind,4/8/1984,Left-hand Bat,Left-arm Medium-fast,India,Player,Royal Challengers Bangalore,Kings Xi Punjab,2011,0,27,0,Blank,Blank,V Kohli,Ac Gilchrist,Kb Arun Karthik,Ac Gilchrist,1984-04-08
17909,50126600020,501266,20,Ms Dhoni,7/7/1981,Right-hand Bat,Right-arm Medium,India,Captainkeeper,Chennai Super Kings,Kochi Tuskers Kerala,2011,0,30,1,Blank,Blank,Ms Dhoni,Pa Patel,Ms Dhoni,Pa Patel,1981-07-07
17910,50126600021,501266,21,Sk Raina,11/27/1986,Left-hand Bat,Right-arm Offbreak,India,Player,Chennai Super Kings,Kochi Tuskers Kerala,2011,0,25,1,Blank,Blank,Ms Dhoni,Pa Patel,Ms Dhoni,Pa Patel,1986-11-27
17912,50126600062,501266,62,Wp Saha,10/24/1984,Right-hand Bat,N/a,India,Player,Chennai Super Kings,Kochi Tuskers Kerala,2011,1,27,1,Blank,Blank,Ms Dhoni,Pa Patel,Ms Dhoni,Pa Patel,1984-10-24
17918,50126600248,501266,248,De Bollinger,7/24/1981,Left-hand Bat,Left-arm Fast-medium,Australia,Player,Chennai Super Kings,Kochi Tuskers Kerala,2011,0,30,1,Blank,Blank,Ms Dhoni,Pa Patel,Ms Dhoni,Pa Patel,1981-07-24
17926,50126600121,501266,121,M Muralitharan,4/17/1972,Right-hand Bat,Right-arm Offbreak,Sri Lanka,Player,Kochi Tuskers Kerala,Chennai Super Kings,2011,0,39,0,Blank,Blank,Pa Patel,Ms Dhoni,Pa Patel,Ms Dhoni,1972-04-17
17927,50126600204,501266,204,Oa Shah,10/22/1978,Right-hand Bat,Right-arm Offbreak,England,Player,Kochi Tuskers Kerala,Chennai Super Kings,2011,0,33,0,Blank,Blank,Pa Patel,Ms Dhoni,Pa Patel,Ms Dhoni,1978-10-22
17928,50126600237,501266,237,Km Jadhav,3/26/1985,Right-hand Bat,Right-arm Offbreak,India,Player,Kochi Tuskers Kerala,Chennai Super Kings,2011,0,26,0,Blank,Blank,Pa Patel,Ms Dhoni,Pa Patel,Ms Dhoni,1985-03-26
17934,50126700157,501267,157,Jd Ryder,8/6/1984,Left-hand Bat,Right-arm Medium,New Zealand,Player,Pune Warriors,Kolkata Knight Riders,2011,0,27,0,Blank,Blank,Yuvraj Singh,G Gambhir,Rv Uthappa,Sp Goswami,1984-08-06
17935,50126700235,501267,235,R Sharma,4/30/1987,Right-hand Bat,Right-arm Offbreak,India,Player,Pune Warriors,Kolkata Knight Riders,2011,0,24,0,Blank,Blank,Yuvraj Singh,G Gambhir,Rv Uthappa,Sp Goswami,1987-04-30
17940,50126700301,501267,301,S Rana,9/18/1984,Right-hand Bat,Right-arm Medium-fast,India,Player,Pune Warriors,Kolkata Knight Riders,2011,0,27,0,Blank,Blank,Yuvraj Singh,G Gambhir,Rv Uthappa,Sp Goswami,1984-09-18
17941,50126700009,501267,9,Jh Kallis,10/16/1975,Right-hand Bat,Right-arm Fast-medium,South Africa,Player,Kolkata Knight Riders,Pune Warriors,2011,0,36,1,Blank,Blank,G Gambhir,Yuvraj Singh,Sp Goswami,Rv Uthappa,1975-10-16
17943,50126700040,501267,40,G Gambhir,10/14/1981,Left-hand Bat,Legbreak,India,Captain,Kolkata Knight Riders,Pune Warriors,2011,0,30,1,Blank,Blank,G Gambhir,Yuvraj Singh,Sp Goswami,Rv Uthappa,1981-10-14
17944,50126700066,501267,66,B Lee,11/8/1976,Right-hand Bat,Right-arm Fast,Australia,Player,Kolkata Knight Riders,Pune Warriors,2011,0,35,1,Blank,Blank,G Gambhir,Yuvraj Singh,Sp Goswami,Rv Uthappa,1976-11-08
17946,50126700089,501267,89,R Bhatia,10/22/1979,Right-hand Bat,Right-arm Medium-fast,India,Player,Kolkata Knight Riders,Pune Warriors,2011,0,32,1,Blank,Blank,G Gambhir,Yuvraj Singh,Sp Goswami,Rv Uthappa,1979-10-22
17953,50126800056,501268,56,A Symonds,6/9/1975,Right-hand Bat,Right-arm Offbreak,Australia,Player,Mumbai Indians,Rajasthan Royals,2011,0,36,0,Blank,Blank,Sr Tendulkar,Sk Warne,At Rayudu,Pr Shah,1975-06-09
17954,50126800057,501268,57,Rg Sharma,4/30/1987,Right-hand Bat,Right-arm Offbreak,India,Player,Mumbai Indians,Rajasthan Royals,2011,0,24,0,Blank,Blank,Sr Tendulkar,Sk Warne,At Rayudu,Pr Shah,1987-04-30
17960,50126800208,501268,208,At Rayudu,9/23/1985,Right-hand Bat,Right-arm Offbreak,India,Keeper,Mumbai Indians,Rajasthan Royals,2011,0,26,0,Blank,Blank,Sr Tendulkar,Sk Warne,At Rayudu,Pr Shah,1985-09-23
17963,50126800006,501268,6,R Dravid,1/11/1973,Right-hand Bat,Right-arm Offbreak,India,Player,Rajasthan Royals,Mumbai Indians,2011,0,38,1,Blank,Blank,Sk Warne,Sr Tendulkar,Pr Shah,At Rayudu,1973-01-11
17969,50126800085,501268,85,Am Rahane,6/6/1988,Right-hand Bat,Right-arm Medium,India,Player,Rajasthan Royals,Mumbai Indians,2011,0,23,1,Blank,Blank,Sk Warne,Sr Tendulkar,Pr Shah,At Rayudu,1988-06-06
17971,50126800196,501268,196,A Singh,6/21/1981,Right-hand Bat,Right-arm Medium-fast,India,Player,Rajasthan Royals,Mumbai Indians,2011,0,30,1,Blank,Blank,Sk Warne,Sr Tendulkar,Pr Shah,At Rayudu,1981-06-21
17974,50126900014,501269,14,P Kumar,10/2/1986,Right-hand Bat,Right-arm Medium,India,Player,Kings Xi Punjab,Deccan Chargers,2011,0,25,0,Blank,Blank,Ac Gilchrist,Cl White,Ac Gilchrist,Kh Devdhar,1986-10-02
17975,50126900048,501269,48,Am Nayar,10/8/1983,Left-hand Bat,Right-arm Medium,India,Player,Kings Xi Punjab,Deccan Chargers,2011,0,28,0,Blank,Blank,Ac Gilchrist,Cl White,Ac Gilchrist,Kh Devdhar,1983-10-08
17989,50126900112,501269,112,Db Ravi Teja,9/5/1987,Right-hand Bat,Legbreak Googly,India,Player,Deccan Chargers,Kings Xi Punjab,2011,0,24,1,Blank,Blank,Cl White,Ac Gilchrist,Kh Devdhar,Ac Gilchrist,1987-09-05
17990,50126900131,501269,131,Pp Ojha,9/5/1986,Left-hand Bat,Slow Left-arm Orthodox,India,Player,Deccan Chargers,Kings Xi Punjab,2011,0,25,1,Blank,Blank,Cl White,Ac Gilchrist,Kh Devdhar,Ac Gilchrist,1986-09-05
17992,50126900154,501269,154,Jp Duminy,4/14/1984,Left-hand Bat,Right-arm Offbreak,South Africa,Player,Deccan Chargers,Kings Xi Punjab,2011,0,27,1,Blank,Blank,Cl White,Ac Gilchrist,Kh Devdhar,Ac Gilchrist,1984-04-14
17999,50127000106,501270,106,Ab Dinda,3/25/1984,Right-hand Bat,Right-arm Medium-fast,India,Player,Delhi Daredevils,Pune Warriors,2011,0,27,0,Blank,Blank,Jr Hopes,Yuvraj Singh,Nv Ojha,Rv Uthappa,1984-03-25
18000,50127000183,501270,183,Nv Ojha,7/20/1983,Right-hand Bat,N/a,India,Keeper,Delhi Daredevils,Pune Warriors,2011,0,28,0,Blank,Blank,Jr Hopes,Yuvraj Singh,Nv Ojha,Rv Uthappa,1983-07-20
18004,50127000271,501270,271,Ms Wade,12/26/1987,Left-hand Bat,Right-arm Medium,Australia,Player,Delhi Daredevils,Pune Warriors,2011,0,24,0,Blank,Blank,Jr Hopes,Yuvraj Singh,Nv Ojha,Rv Uthappa,1987-12-26
18007,50127000001,501270,1,Sc Ganguly,7/8/1972,Left-hand Bat,Right-arm Medium,India,Player,Pune Warriors,Delhi Daredevils,2011,0,39,0,Blank,Blank,Yuvraj Singh,Jr Hopes,Rv Uthappa,Nv Ojha,1972-07-08
18012,50127000253,501270,253,Mr Marsh,10/20/1991,Right-hand Bat,Right-arm Medium,Australia,Player,Pune Warriors,Delhi Daredevils,2011,0,20,0,Blank,Blank,Yuvraj Singh,Jr Hopes,Rv Uthappa,Nv Ojha,1991-10-20
18014,50127000295,501270,295,Cj Ferguson,11/21/1984,Right-hand Bat,Right-arm Medium,Australia,Player,Pune Warriors,Delhi Daredevils,2011,0,27,0,Blank,Blank,Yuvraj Singh,Jr Hopes,Rv Uthappa,Nv Ojha,1984-11-21
18015,50127000301,501270,301,S Rana,9/18/1984,Right-hand Bat,Right-arm Medium-fast,India,Player,Pune Warriors,Delhi Daredevils,2011,0,27,0,Blank,Blank,Yuvraj Singh,Jr Hopes,Rv Uthappa,Nv Ojha,1984-09-18
18016,50127000310,501270,310,Jp Faulkner,4/29/1990,Right-hand Bat,Left-arm Fast-medium,Australia,Player,Pune Warriors,Delhi Daredevils,2011,0,21,0,Blank,Blank,Yuvraj Singh,Jr Hopes,Rv Uthappa,Nv Ojha,1990-04-29
18018,50127100008,501271,8,V Kohli,11/5/1988,Right-hand Bat,Right-arm Medium,India,Player,Royal Challengers Bangalore,Chennai Super Kings,2011,0,23,1,Blank,Blank,Dl Vettori,Ms Dhoni,Ab De Villiers,Ms Dhoni,1988-11-05
18019,50127100015,501271,15,Z Khan,10/7/1978,Right-hand Bat,Left-arm Fast-medium,India,Player,Royal Challengers Bangalore,Chennai Super Kings,2011,0,33,1,Blank,Blank,Dl Vettori,Ms Dhoni,Ab De Villiers,Ms Dhoni,1978-10-07
18022,50127100110,501271,110,Ab De Villiers,2/17/1984,Right-hand Bat,Right-arm Medium,South Africa,Keeper,Royal Challengers Bangalore,Chennai Super Kings,2011,0,27,1,Blank,Blank,Dl Vettori,Ms Dhoni,Ab De Villiers,Ms Dhoni,1984-02-17
18023,50127100139,501271,139,La Pomersbach,9/28/1984,Left-hand Bat,Right-arm Offbreak,Australia,Player,Royal Challengers Bangalore,Chennai Super Kings,2011,0,27,1,Blank,Blank,Dl Vettori,Ms Dhoni,Ab De Villiers,Ms Dhoni,1984-09-28
18027,50127100260,501271,260,Ma Agarwal,2/16/1991,Right-hand Bat,N/a,India,Player,Royal Challengers Bangalore,Chennai Super Kings,2011,0,20,1,Blank,Blank,Dl Vettori,Ms Dhoni,Ab De Villiers,Ms Dhoni,1991-02-16
18028,50127100270,501271,270,S Aravind,4/8/1984,Left-hand Bat,Left-arm Medium-fast,India,Player,Royal Challengers Bangalore,Chennai Super Kings,2011,0,27,1,Blank,Blank,Dl Vettori,Ms Dhoni,Ab De Villiers,Ms Dhoni,1984-04-08
18029,50127100019,501271,19,Mek Hussey,5/27/1975,Left-hand Bat,Right-arm Medium,Australia,Player,Chennai Super Kings,Royal Challengers Bangalore,2011,0,36,0,Blank,Blank,Ms Dhoni,Dl Vettori,Ms Dhoni,Ab De Villiers,1975-05-27
18034,50127100071,501271,71,Dj Bravo,10/7/1983,Right-hand Bat,Right-arm Medium-fast,West Indies,Player,Chennai Super Kings,Royal Challengers Bangalore,2011,0,28,0,Blank,Blank,Ms Dhoni,Dl Vettori,Ms Dhoni,Ab De Villiers,1983-10-07
18037,50127100186,501271,186,Sb Jakati,11/27/1980,Left-hand Bat,Slow Left-arm Orthodox,India,Player,Chennai Super Kings,Royal Challengers Bangalore,2011,0,31,0,Blank,Blank,Ms Dhoni,Dl Vettori,Ms Dhoni,Ab De Villiers,1980-11-27
18042,50127200133,501272,133,Sr Tendulkar,4/24/1973,Right-hand Bat,Right-arm Offbreak,India,Captain,Mumbai Indians,Kolkata Knight Riders,2011,0,38,1,Blank,Blank,Sr Tendulkar,G Gambhir,At Rayudu,Sp Goswami,1973-04-24
18044,50127200194,501272,194,Sl Malinga,8/28/1983,Right-hand Bat,Right-arm Fast,Sri Lanka,Player,Mumbai Indians,Kolkata Knight Riders,2011,0,28,1,Blank,Blank,Sr Tendulkar,G Gambhir,At Rayudu,Sp Goswami,1983-08-28
18047,50127200221,501272,221,Ka Pollard,5/12/1987,Right-hand Bat,Right-arm Medium-fast,West Indies,Player,Mumbai Indians,Kolkata Knight Riders,2011,0,24,1,Blank,Blank,Sr Tendulkar,G Gambhir,At Rayudu,Sp Goswami,1987-05-12
18050,50127200449,501272,449,Rw Price,6/12/1976,Right-hand Bat,Slow Left-arm Orthodox,Zimbabwea,Player,Mumbai Indians,Kolkata Knight Riders,2011,0,35,1,Blank,Blank,Sr Tendulkar,G Gambhir,At Rayudu,Sp Goswami,1976-06-12
18051,50127200009,501272,9,Jh Kallis,10/16/1975,Right-hand Bat,Right-arm Fast-medium,South Africa,Player,Kolkata Knight Riders,Mumbai Indians,2011,0,36,0,Blank,Blank,G Gambhir,Sr Tendulkar,Sp Goswami,At Rayudu,1975-10-16
18055,50127200087,501272,87,Mk Tiwary,11/14/1985,Right-hand Bat,Legbreak Googly,India,Player,Kolkata Knight Riders,Mumbai Indians,2011,0,26,0,Blank,Blank,G Gambhir,Sr Tendulkar,Sp Goswami,At Rayudu,1985-11-14
18058,50127200140,501272,140,Iqbal Abdulla,12/2/1989,Left-hand Bat,Slow Left-arm Orthodox,India,Player,Kolkata Knight Riders,Mumbai Indians,2011,0,22,0,Blank,Blank,G Gambhir,Sr Tendulkar,Sp Goswami,At Rayudu,1989-12-02
18059,50127200151,501272,151,L Balaji,9/27/1981,Right-hand Bat,Right-arm Medium-fast,India,Player,Kolkata Knight Riders,Mumbai Indians,2011,0,30,0,Blank,Blank,G Gambhir,Sr Tendulkar,Sp Goswami,At Rayudu,1981-09-27
18062,50127300008,501273,8,V Kohli,11/5/1988,Right-hand Bat,Right-arm Medium,India,Player,Royal Challengers Bangalore,Chennai Super Kings,2011,0,23,0,Blank,Blank,Dl Vettori,Ms Dhoni,Ab De Villiers,Ms Dhoni,1988-11-05
18066,50127300110,501273,110,Ab De Villiers,2/17/1984,Right-hand Bat,Right-arm Medium,South Africa,Keeper,Royal Challengers Bangalore,Chennai Super Kings,2011,0,27,0,Blank,Blank,Dl Vettori,Ms Dhoni,Ab De Villiers,Ms Dhoni,1984-02-17
18069,50127300175,501273,175,Dl Vettori,1/27/1979,Left-hand Bat,Slow Left-arm Orthodox,New Zealand,Captain,Royal Challengers Bangalore,Chennai Super Kings,2011,0,32,0,Blank,Blank,Dl Vettori,Ms Dhoni,Ab De Villiers,Ms Dhoni,1979-01-27
18070,50127300244,501273,244,A Mithun,10/25/1989,Right-hand Bat,Right-arm Medium,India,Player,Royal Challengers Bangalore,Chennai Super Kings,2011,0,22,0,Blank,Blank,Dl Vettori,Ms Dhoni,Ab De Villiers,Ms Dhoni,1989-10-25
18071,50127300260,501273,260,Ma Agarwal,2/16/1991,Right-hand Bat,N/a,India,Player,Royal Challengers Bangalore,Chennai Super Kings,2011,0,20,0,Blank,Blank,Dl Vettori,Ms Dhoni,Ab De Villiers,Ms Dhoni,1991-02-16
18073,50127300019,501273,19,Mek Hussey,5/27/1975,Left-hand Bat,Right-arm Medium,Australia,Player,Chennai Super Kings,Royal Challengers Bangalore,2011,0,36,1,Blank,Blank,Ms Dhoni,Dl Vettori,Ms Dhoni,Ab De Villiers,1975-05-27
18075,50127300021,501273,21,Sk Raina,11/27/1986,Left-hand Bat,Right-arm Offbreak,India,Player,Chennai Super Kings,Royal Challengers Bangalore,2011,1,25,1,Blank,Blank,Ms Dhoni,Dl Vettori,Ms Dhoni,Ab De Villiers,1986-11-27
18077,50127300062,501273,62,Wp Saha,10/24/1984,Right-hand Bat,N/a,India,Player,Chennai Super Kings,Royal Challengers Bangalore,2011,0,27,1,Blank,Blank,Ms Dhoni,Dl Vettori,Ms Dhoni,Ab De Villiers,1984-10-24
18082,50127300201,501273,201,R Ashwin,9/17/1986,Right-hand Bat,Right-arm Offbreak,India,Player,Chennai Super Kings,Royal Challengers Bangalore,2011,0,25,1,Blank,Blank,Ms Dhoni,Dl Vettori,Ms Dhoni,Ab De Villiers,1986-09-17
18084,50127400050,501274,50,Harbhajan Singh,7/3/1980,Right-hand Bat,Right-arm Offbreak,India,Player,Mumbai Indians,Kolkata Knight Riders,2011,0,31,1,Blank,Blank,Sr Tendulkar,G Gambhir,At Rayudu,Sp Goswami,1980-07-03
18087,50127400126,501274,126,Mm Patel,7/12/1983,Right-hand Bat,Right-arm Medium-fast,India,Player,Mumbai Indians,Kolkata Knight Riders,2011,1,28,1,Blank,Blank,Sr Tendulkar,G Gambhir,At Rayudu,Sp Goswami,1983-07-12
18090,50127400194,501274,194,Sl Malinga,8/28/1983,Right-hand Bat,Right-arm Fast,Sri Lanka,Player,Mumbai Indians,Kolkata Knight Riders,2011,0,28,1,Blank,Blank,Sr Tendulkar,G Gambhir,At Rayudu,Sp Goswami,1983-08-28
18091,50127400208,501274,208,At Rayudu,9/23/1985,Right-hand Bat,Right-arm Offbreak,India,Keeper,Mumbai Indians,Kolkata Knight Riders,2011,0,26,1,Blank,Blank,Sr Tendulkar,G Gambhir,At Rayudu,Sp Goswami,1985-09-23
18092,50127400221,501274,221,Ka Pollard,5/12/1987,Right-hand Bat,Right-arm Medium-fast,West Indies,Player,Mumbai Indians,Kolkata Knight Riders,2011,0,24,1,Blank,Blank,Sr Tendulkar,G Gambhir,At Rayudu,Sp Goswami,1987-05-12
18100,50127400089,501274,89,R Bhatia,10/22/1979,Right-hand Bat,Right-arm Medium-fast,India,Player,Kolkata Knight Riders,Mumbai Indians,2011,0,32,0,Blank,Blank,G Gambhir,Sr Tendulkar,Sp Goswami,At Rayudu,1979-10-22
18107,50127500015,501275,15,Z Khan,10/7/1978,Right-hand Bat,Left-arm Fast-medium,India,Player,Royal Challengers Bangalore,Mumbai Indians,2011,0,33,1,Blank,Blank,Dl Vettori,Sr Tendulkar,Ab De Villiers,At Rayudu,1978-10-07
18109,50127500110,501275,110,Ab De Villiers,2/17/1984,Right-hand Bat,Right-arm Medium,South Africa,Keeper,Royal Challengers Bangalore,Mumbai Indians,2011,0,27,1,Blank,Blank,Dl Vettori,Sr Tendulkar,Ab De Villiers,At Rayudu,1984-02-17
18111,50127500162,501275,162,Ch Gayle,9/21/1979,Left-hand Bat,Right-arm Offbreak,West Indies,Player,Royal Challengers Bangalore,Mumbai Indians,2011,1,32,1,Blank,Blank,Dl Vettori,Sr Tendulkar,Ab De Villiers,At Rayudu,1979-09-21
18114,50127500260,501275,260,Ma Agarwal,2/16/1991,Right-hand Bat,N/a,India,Player,Royal Challengers Bangalore,Mumbai Indians,2011,0,20,1,Blank,Blank,Dl Vettori,Sr Tendulkar,Ab De Villiers,At Rayudu,1991-02-16
18117,50127500050,501275,50,Harbhajan Singh,7/3/1980,Right-hand Bat,Right-arm Offbreak,India,Player,Mumbai Indians,Royal Challengers Bangalore,2011,0,31,0,Blank,Blank,Sr Tendulkar,Dl Vettori,At Rayudu,Ab De Villiers,1980-07-03
18118,50127500057,501275,57,Rg Sharma,4/30/1987,Right-hand Bat,Right-arm Offbreak,India,Player,Mumbai Indians,Royal Challengers Bangalore,2011,0,24,0,Blank,Blank,Sr Tendulkar,Dl Vettori,At Rayudu,Ab De Villiers,1987-04-30
18121,50127500194,501275,194,Sl Malinga,8/28/1983,Right-hand Bat,Right-arm Fast,Sri Lanka,Player,Mumbai Indians,Royal Challengers Bangalore,2011,0,28,0,Blank,Blank,Sr Tendulkar,Dl Vettori,At Rayudu,Ab De Villiers,1983-08-28
18129,50127600015,501276,15,Z Khan,10/7/1978,Right-hand Bat,Left-arm Fast-medium,India,Player,Royal Challengers Bangalore,Chennai Super Kings,2011,0,33,0,Blank,Blank,Dl Vettori,Ms Dhoni,Ab De Villiers,Ms Dhoni,1978-10-07
18133,50127600162,501276,162,Ch Gayle,9/21/1979,Left-hand Bat,Right-arm Offbreak,West Indies,Player,Royal Challengers Bangalore,Chennai Super Kings,2011,0,32,0,Blank,Blank,Dl Vettori,Ms Dhoni,Ab De Villiers,Ms Dhoni,1979-09-21
18139,50127600019,501276,19,Mek Hussey,5/27/1975,Left-hand Bat,Right-arm Medium,Australia,Player,Chennai Super Kings,Royal Challengers Bangalore,2011,0,36,1,Blank,Blank,Ms Dhoni,Dl Vettori,Ms Dhoni,Ab De Villiers,1975-05-27
18141,50127600021,501276,21,Sk Raina,11/27/1986,Left-hand Bat,Right-arm Offbreak,India,Player,Chennai Super Kings,Royal Challengers Bangalore,2011,0,25,1,Blank,Blank,Ms Dhoni,Dl Vettori,Ms Dhoni,Ab De Villiers,1986-11-27
18143,50127600062,501276,62,Wp Saha,10/24/1984,Right-hand Bat,N/a,India,Player,Chennai Super Kings,Royal Challengers Bangalore,2011,0,27,1,Blank,Blank,Ms Dhoni,Dl Vettori,Ms Dhoni,Ab De Villiers,1984-10-24
18146,50127600185,501276,185,M Vijay,4/1/1984,Right-hand Bat,Right-arm Offbreak,India,Player,Chennai Super Kings,Royal Challengers Bangalore,2011,1,27,1,Blank,Blank,Ms Dhoni,Dl Vettori,Ms Dhoni,Ab De Villiers,1984-04-01
18149,50127600248,501276,248,De Bollinger,7/24/1981,Left-hand Bat,Left-arm Fast-medium,Australia,Player,Chennai Super Kings,Royal Challengers Bangalore,2011,0,30,1,Blank,Blank,Ms Dhoni,Dl Vettori,Ms Dhoni,Ab De Villiers,1981-07-24
18155,54831100194,548311,194,Sl Malinga,8/28/1983,Right-hand Bat,Right-arm Fast,Sri Lanka,Player,Mumbai Indians,Chennai Super Kings,2012,0,29,1,Blank,Blank,Harbhajan Singh,Ms Dhoni,Kd Karthik,Ms Dhoni,1983-08-28
18156,54831100208,548311,208,At Rayudu,9/23/1985,Right-hand Bat,Right-arm Offbreak,India,Player,Mumbai Indians,Chennai Super Kings,2012,0,27,1,Blank,Blank,Harbhajan Singh,Ms Dhoni,Kd Karthik,Ms Dhoni,1985-09-23
18160,54831100304,548311,304,Re Levi,1/14/1988,Right-hand Bat,Right-arm Medium,South Africa,Player,Mumbai Indians,Chennai Super Kings,2012,1,24,1,Blank,Blank,Harbhajan Singh,Ms Dhoni,Kd Karthik,Ms Dhoni,1988-01-14
18163,54831100023,548311,23,S Badrinath,8/30/1980,Right-hand Bat,Right-arm Offbreak,India,Player,Chennai Super Kings,Mumbai Indians,2012,0,32,0,Blank,Blank,Ms Dhoni,Harbhajan Singh,Ms Dhoni,Kd Karthik,1980-08-30
18167,54831100185,548311,185,M Vijay,4/1/1984,Right-hand Bat,Right-arm Offbreak,India,Player,Chennai Super Kings,Mumbai Indians,2012,0,28,0,Blank,Blank,Ms Dhoni,Harbhajan Singh,Ms Dhoni,Kd Karthik,1984-04-01
18170,54831100248,548311,248,De Bollinger,7/24/1981,Left-hand Bat,Left-arm Fast-medium,Australia,Player,Chennai Super Kings,Mumbai Indians,2012,0,31,0,Blank,Blank,Ms Dhoni,Harbhajan Singh,Ms Dhoni,Kd Karthik,1981-07-24
18172,54831200002,548312,2,Bb Mccullum,9/27/1981,Right-hand Bat,Right-arm Medium,New Zealand,Keeper,Kolkata Knight Riders,Delhi Daredevils,2012,0,31,0,Blank,Blank,G Gambhir,V Sehwag,Bb Mccullum,Nv Ojha,1981-09-27
18177,54831200066,548312,66,B Lee,11/8/1976,Right-hand Bat,Right-arm Fast,Australia,Player,Kolkata Knight Riders,Delhi Daredevils,2012,0,36,0,Blank,Blank,G Gambhir,V Sehwag,Bb Mccullum,Nv Ojha,1976-11-08
18181,54831200140,548312,140,Iqbal Abdulla,12/2/1989,Left-hand Bat,Slow Left-arm Orthodox,India,Player,Kolkata Knight Riders,Delhi Daredevils,2012,0,23,0,Blank,Blank,G Gambhir,V Sehwag,Bb Mccullum,Nv Ojha,1989-12-02
18182,54831200389,548312,389,M De Lange,10/13/1990,Right-hand Bat,Right-arm Fast,South Africa,Player,Kolkata Knight Riders,Delhi Daredevils,2012,0,22,0,Blank,Blank,G Gambhir,V Sehwag,Bb Mccullum,Nv Ojha,1990-10-13
18185,54831200054,548312,54,Y Venugopal Rao,2/26/1982,Right-hand Bat,Right-arm Offbreak,India,Player,Delhi Daredevils,Kolkata Knight Riders,2012,0,30,1,Blank,Blank,V Sehwag,G Gambhir,Nv Ojha,Bb Mccullum,1982-02-26
18187,54831200183,548312,183,Nv Ojha,7/20/1983,Right-hand Bat,N/a,India,Keeper,Delhi Daredevils,Kolkata Knight Riders,2012,0,29,1,Blank,Blank,V Sehwag,G Gambhir,Nv Ojha,Bb Mccullum,1983-07-20
18192,54831200293,548312,293,S Nadeem,8/12/1989,Right-hand Bat,Slow Left-arm Orthodox,India,Player,Delhi Daredevils,Kolkata Knight Riders,2012,0,23,1,Blank,Blank,V Sehwag,G Gambhir,Nv Ojha,Bb Mccullum,1989-08-12
18193,54831200305,548312,305,Gj Maxwell,10/14/1988,Right-hand Bat,Right-arm Offbreak,Australia,Player,Delhi Daredevils,Kolkata Knight Riders,2012,0,24,1,Blank,Blank,V Sehwag,G Gambhir,Nv Ojha,Bb Mccullum,1988-10-14
18194,54831300050,548313,50,Harbhajan Singh,7/3/1980,Right-hand Bat,Right-arm Offbreak,India,Captain,Mumbai Indians,Pune Warriors,2012,0,32,0,Blank,Blank,Harbhajan Singh,Sc Ganguly,Kd Karthik,Rv Uthappa,1980-07-03
18198,54831300131,548313,131,Pp Ojha,9/5/1986,Left-hand Bat,Slow Left-arm Orthodox,India,Player,Mumbai Indians,Pune Warriors,2012,0,26,0,Blank,Blank,Harbhajan Singh,Sc Ganguly,Kd Karthik,Rv Uthappa,1986-09-05
18199,54831300194,548313,194,Sl Malinga,8/28/1983,Right-hand Bat,Right-arm Fast,Sri Lanka,Player,Mumbai Indians,Pune Warriors,2012,0,29,0,Blank,Blank,Harbhajan Singh,Sc Ganguly,Kd Karthik,Rv Uthappa,1983-08-28
18203,54831300304,548313,304,Re Levi,1/14/1988,Right-hand Bat,Right-arm Medium,South Africa,Player,Mumbai Indians,Pune Warriors,2012,0,24,0,Blank,Blank,Harbhajan Singh,Sc Ganguly,Kd Karthik,Rv Uthappa,1988-01-14
18206,54831300046,548313,46,Rv Uthappa,11/11/1985,Right-hand Bat,Right-arm Medium,India,Keeper,Pune Warriors,Mumbai Indians,2012,0,27,1,Blank,Blank,Sc Ganguly,Harbhajan Singh,Rv Uthappa,Kd Karthik,1985-11-11
18207,54831300083,548313,83,M Kartik,9/11/1976,Left-hand Bat,Slow Left-arm Orthodox,India,Player,Pune Warriors,Mumbai Indians,2012,0,36,1,Blank,Blank,Sc Ganguly,Harbhajan Singh,Rv Uthappa,Kd Karthik,1976-09-11
18208,54831300096,548313,96,Mk Pandey,9/10/1989,Right-hand Bat,Right-arm Medium,India,Player,Pune Warriors,Mumbai Indians,2012,0,23,1,Blank,Blank,Sc Ganguly,Harbhajan Singh,Rv Uthappa,Kd Karthik,1989-09-10
18214,54831300306,548313,306,Spd Smith,6/2/1989,Right-hand Bat,Legbreak Googly,India,Player,Pune Warriors,Mumbai Indians,2012,1,23,1,Blank,Blank,Sc Ganguly,Harbhajan Singh,Rv Uthappa,Kd Karthik,1989-06-02
18216,54831400004,548314,4,Dj Hussey,7/15/1977,Right-hand Bat,Right-arm Offbreak,Australia,Player,Kings Xi Punjab,Rajasthan Royals,2012,0,35,0,Blank,Blank,Ac Gilchrist,R Dravid,Ac Gilchrist,Sp Goswami,1977-07-15
18217,54831400014,548314,14,P Kumar,10/2/1986,Right-hand Bat,Right-arm Medium,India,Player,Kings Xi Punjab,Rajasthan Royals,2012,0,26,0,Blank,Blank,Ac Gilchrist,R Dravid,Ac Gilchrist,Sp Goswami,1986-10-02
18219,54831400053,548314,53,Ac Gilchrist,11/14/1971,Left-hand Bat,Right-arm Offbreak,Australia,Captainkeeper,Kings Xi Punjab,Rajasthan Royals,2012,0,41,0,Blank,Blank,Ac Gilchrist,R Dravid,Ac Gilchrist,Sp Goswami,1971-11-14
18224,54831400236,548314,236,Mandeep Singh,12/18/1991,Right-hand Bat,Right-arm Medium,India,Player,Kings Xi Punjab,Rajasthan Royals,2012,0,21,0,Blank,Blank,Ac Gilchrist,R Dravid,Ac Gilchrist,Sp Goswami,1991-12-18
18225,54831400256,548314,256,Harmeet Singh,9/7/1992,Left-hand Bat,Slow Left-arm Orthodox,India,Player,Kings Xi Punjab,Rajasthan Royals,2012,0,20,0,Blank,Blank,Ac Gilchrist,R Dravid,Ac Gilchrist,Sp Goswami,1992-09-07
18229,54831400085,548314,85,Am Rahane,6/6/1988,Right-hand Bat,Right-arm Medium,India,Player,Rajasthan Royals,Kings Xi Punjab,2012,1,24,1,Blank,Blank,R Dravid,Ac Gilchrist,Sp Goswami,Ac Gilchrist,1988-06-06
18233,54831400196,548314,196,A Singh,6/21/1981,Right-hand Bat,Right-arm Medium-fast,India,Player,Rajasthan Royals,Kings Xi Punjab,2012,0,31,1,Blank,Blank,R Dravid,Ac Gilchrist,Sp Goswami,Ac Gilchrist,1981-06-21
18236,54831400297,548314,297,Aa Chavan,10/28/1985,Left-hand Bat,Slow Left-arm Orthodox,India,Player,Rajasthan Royals,Kings Xi Punjab,2012,0,27,1,Blank,Blank,R Dravid,Ac Gilchrist,Sp Goswami,Ac Gilchrist,1985-10-28
18239,54831500015,548315,15,Z Khan,10/7/1978,Right-hand Bat,Left-arm Fast-medium,India,Player,Royal Challengers Bangalore,Delhi Daredevils,2012,0,34,1,Blank,Blank,Dl Vettori,V Sehwag,Ab De Villiers,Nv Ojha,1978-10-07
18243,54831500121,548315,121,M Muralitharan,4/17/1972,Right-hand Bat,Right-arm Offbreak,Sri Lanka,Player,Royal Challengers Bangalore,Delhi Daredevils,2012,0,40,1,Blank,Blank,Dl Vettori,V Sehwag,Ab De Villiers,Nv Ojha,1972-04-17
18246,54831500203,548315,203,Ca Pujara,1/25/1988,Right-hand Bat,Legbreak,India,Player,Royal Challengers Bangalore,Delhi Daredevils,2012,0,24,1,Blank,Blank,Dl Vettori,V Sehwag,Ab De Villiers,Nv Ojha,1988-01-25
18247,54831500260,548315,260,Ma Agarwal,2/16/1991,Right-hand Bat,N/a,India,Player,Royal Challengers Bangalore,Delhi Daredevils,2012,0,21,1,Blank,Blank,Dl Vettori,V Sehwag,Ab De Villiers,Nv Ojha,1991-02-16
18250,54831500041,548315,41,V Sehwag,10/20/1978,Right-hand Bat,Right-arm Offbreak,India,Captain,Delhi Daredevils,Royal Challengers Bangalore,2012,0,34,0,Blank,Blank,V Sehwag,Dl Vettori,Nv Ojha,Ab De Villiers,1978-10-20
18252,54831500183,548315,183,Nv Ojha,7/20/1983,Right-hand Bat,N/a,India,Keeper,Delhi Daredevils,Royal Challengers Bangalore,2012,0,29,0,Blank,Blank,V Sehwag,Dl Vettori,Nv Ojha,Ab De Villiers,1983-07-20
18253,54831500190,548315,190,M Morkel,10/6/1984,Left-hand Bat,Right-arm Fast,South Africa,Player,Delhi Daredevils,Royal Challengers Bangalore,2012,0,28,0,Blank,Blank,V Sehwag,Dl Vettori,Nv Ojha,Ab De Villiers,1984-10-06
18255,54831500232,548315,232,Ut Yadav,10/25/1987,Right-hand Bat,Right-arm Fast-medium,India,Player,Delhi Daredevils,Royal Challengers Bangalore,2012,0,25,0,Blank,Blank,V Sehwag,Dl Vettori,Nv Ojha,Ab De Villiers,1987-10-25
18256,54831500254,548315,254,Aj Finch,11/17/1986,Right-hand Bat,Slow Left-arm Orthodox,Australia,Player,Delhi Daredevils,Royal Challengers Bangalore,2012,0,26,0,Blank,Blank,V Sehwag,Dl Vettori,Nv Ojha,Ab De Villiers,1986-11-17
18257,54831500293,548315,293,S Nadeem,8/12/1989,Right-hand Bat,Slow Left-arm Orthodox,India,Player,Delhi Daredevils,Royal Challengers Bangalore,2012,0,23,0,Blank,Blank,V Sehwag,Dl Vettori,Nv Ojha,Ab De Villiers,1989-08-12
18258,54831500305,548315,305,Gj Maxwell,10/14/1988,Right-hand Bat,Right-arm Offbreak,Australia,Player,Delhi Daredevils,Royal Challengers Bangalore,2012,0,24,0,Blank,Blank,V Sehwag,Dl Vettori,Nv Ojha,Ab De Villiers,1988-10-14
18259,54831500312,548315,312,Daj Bracewell,9/28/1990,Right-hand Bat,Right-arm Fast-medium,New Zealand,Player,Delhi Daredevils,Royal Challengers Bangalore,2012,0,22,0,Blank,Blank,V Sehwag,Dl Vettori,Nv Ojha,Ab De Villiers,1990-09-28
18260,54831600020,548316,20,Ms Dhoni,7/7/1981,Right-hand Bat,Right-arm Medium,India,Captainkeeper,Chennai Super Kings,Deccan Chargers,2012,0,31,1,Blank,Blank,Ms Dhoni,Cl White,Ms Dhoni,Pa Patel,1981-07-07
18271,54831600010,548316,10,Cl White,8/18/1983,Right-hand Bat,Legbreak Googly,Australia,Captain,Deccan Chargers,Chennai Super Kings,2012,0,29,0,Blank,Blank,Cl White,Ms Dhoni,Pa Patel,Ms Dhoni,1983-08-18
18273,54831600042,548316,42,S Dhawan,12/5/1985,Left-hand Bat,Right-arm Offbreak,India,Player,Deccan Chargers,Chennai Super Kings,2012,0,27,0,Blank,Blank,Cl White,Ms Dhoni,Pa Patel,Ms Dhoni,1985-12-05
18274,54831600093,548316,93,B Chipli,1/27/1983,Right-hand Bat,Right-arm Medium,India,Player,Deccan Chargers,Chennai Super Kings,2012,0,29,0,Blank,Blank,Cl White,Ms Dhoni,Pa Patel,Ms Dhoni,1983-01-27
18276,54831600112,548316,112,Db Ravi Teja,9/5/1987,Right-hand Bat,Legbreak Googly,India,Player,Deccan Chargers,Chennai Super Kings,2012,0,25,0,Blank,Blank,Cl White,Ms Dhoni,Pa Patel,Ms Dhoni,1987-09-05
18277,54831600120,548316,120,Ms Gony,1/4/1984,Right-hand Bat,Right-arm Medium,India,Player,Deccan Chargers,Chennai Super Kings,2012,0,28,0,Blank,Blank,Cl White,Ms Dhoni,Pa Patel,Ms Dhoni,1984-01-04
18280,54831600314,548316,314,Ankit Sharma,4/20/1991,Left-hand Bat,Slow Left-arm Orthodox,India,Player,Deccan Chargers,Chennai Super Kings,2012,0,21,0,Blank,Blank,Cl White,Ms Dhoni,Pa Patel,Ms Dhoni,1991-04-20
18281,54831600450,548316,450,Tp Sudhindra,4/24/1984,Left-hand Bat,Right-arm Fast,India,Player,Deccan Chargers,Chennai Super Kings,2012,0,28,0,Blank,Blank,Cl White,Ms Dhoni,Pa Patel,Ms Dhoni,1984-04-24
18289,54831700089,548317,89,R Bhatia,10/22/1979,Right-hand Bat,Right-arm Medium-fast,India,Player,Kolkata Knight Riders,Rajasthan Royals,2012,0,33,0,Blank,Blank,G Gambhir,R Dravid,Bb Mccullum,Sp Goswami,1979-10-22
18290,54831700095,548317,95,Db Das,9/22/1986,Right-hand Bat,Legbreak Googly,India,Player,Kolkata Knight Riders,Rajasthan Royals,2012,0,26,0,Blank,Blank,G Gambhir,R Dravid,Bb Mccullum,Sp Goswami,1986-09-22
18291,54831700140,548317,140,Iqbal Abdulla,12/2/1989,Left-hand Bat,Slow Left-arm Orthodox,India,Player,Kolkata Knight Riders,Rajasthan Royals,2012,0,23,0,Blank,Blank,G Gambhir,R Dravid,Bb Mccullum,Sp Goswami,1989-12-02
18293,54831700006,548317,6,R Dravid,1/11/1973,Right-hand Bat,Right-arm Offbreak,India,Captain,Rajasthan Royals,Kolkata Knight Riders,2012,0,39,1,Blank,Blank,R Dravid,G Gambhir,Sp Goswami,Bb Mccullum,1973-01-11
18296,54831700104,548317,104,Bj Hodge,12/29/1974,Right-hand Bat,Right-arm Offbreak,Australia,Player,Rajasthan Royals,Kolkata Knight Riders,2012,1,38,1,Blank,Blank,R Dravid,G Gambhir,Sp Goswami,Bb Mccullum,1974-12-29
18306,54831800048,548318,48,Am Nayar,10/8/1983,Left-hand Bat,Right-arm Medium,India,Player,Kings Xi Punjab,Pune Warriors,2012,0,29,0,Blank,Blank,Ac Gilchrist,Sc Ganguly,Ac Gilchrist,Rv Uthappa,1983-10-08
18307,54831800053,548318,53,Ac Gilchrist,11/14/1971,Left-hand Bat,Right-arm Offbreak,Australia,Captainkeeper,Kings Xi Punjab,Pune Warriors,2012,0,41,0,Blank,Blank,Ac Gilchrist,Sc Ganguly,Ac Gilchrist,Rv Uthappa,1971-11-14
18308,54831800067,548318,67,Pp Chawla,12/24/1988,Left-hand Bat,Legbreak,India,Player,Kings Xi Punjab,Pune Warriors,2012,0,24,0,Blank,Blank,Ac Gilchrist,Sc Ganguly,Ac Gilchrist,Rv Uthappa,1988-12-24
18313,54831800256,548318,256,Harmeet Singh,9/7/1992,Left-hand Bat,Slow Left-arm Orthodox,India,Player,Kings Xi Punjab,Pune Warriors,2012,0,20,0,Blank,Blank,Ac Gilchrist,Sc Ganguly,Ac Gilchrist,Rv Uthappa,1992-09-07
18314,54831800310,548318,310,Jp Faulkner,4/29/1990,Right-hand Bat,Left-arm Fast-medium,Australia,Player,Kings Xi Punjab,Pune Warriors,2012,0,22,0,Blank,Blank,Ac Gilchrist,Sc Ganguly,Ac Gilchrist,Rv Uthappa,1990-04-29
18317,54831800073,548318,73,A Nehra,4/29/1979,Right-hand Bat,Left-arm Medium-fast,India,Player,Pune Warriors,Kings Xi Punjab,2012,0,33,1,Blank,Blank,Sc Ganguly,Ac Gilchrist,Rv Uthappa,Ac Gilchrist,1979-04-29
18324,54831800306,548318,306,Spd Smith,6/2/1989,Right-hand Bat,Legbreak Googly,India,Player,Pune Warriors,Kings Xi Punjab,2012,0,23,1,Blank,Blank,Sc Ganguly,Ac Gilchrist,Rv Uthappa,Ac Gilchrist,1989-06-02
18326,54831900050,548319,50,Harbhajan Singh,7/3/1980,Right-hand Bat,Right-arm Offbreak,India,Captain,Mumbai Indians,Deccan Chargers,2012,0,32,1,Blank,Blank,Harbhajan Singh,Kc Sangakkara,Kd Karthik,Pa Patel,1980-07-03
18331,54831900178,548319,178,Tl Suman,12/15/1983,Right-hand Bat,Right-arm Offbreak,India,Player,Mumbai Indians,Deccan Chargers,2012,0,29,1,Blank,Blank,Harbhajan Singh,Kc Sangakkara,Kd Karthik,Pa Patel,1983-12-15
18332,54831900194,548319,194,Sl Malinga,8/28/1983,Right-hand Bat,Right-arm Fast,Sri Lanka,Player,Mumbai Indians,Deccan Chargers,2012,0,29,1,Blank,Blank,Harbhajan Singh,Kc Sangakkara,Kd Karthik,Pa Patel,1983-08-28
18337,54831900010,548319,10,Cl White,8/18/1983,Right-hand Bat,Legbreak Googly,Australia,Player,Deccan Chargers,Mumbai Indians,2012,0,29,0,Blank,Blank,Kc Sangakkara,Harbhajan Singh,Pa Patel,Kd Karthik,1983-08-18
18340,54831900042,548319,42,S Dhawan,12/5/1985,Left-hand Bat,Right-arm Offbreak,India,Player,Deccan Chargers,Mumbai Indians,2012,0,27,0,Blank,Blank,Kc Sangakkara,Harbhajan Singh,Pa Patel,Kd Karthik,1985-12-05
18341,54831900093,548319,93,B Chipli,1/27/1983,Right-hand Bat,Right-arm Medium,India,Player,Deccan Chargers,Mumbai Indians,2012,0,29,0,Blank,Blank,Kc Sangakkara,Harbhajan Singh,Pa Patel,Kd Karthik,1983-01-27
18342,54831900094,548319,94,Dw Steyn,6/27/1983,Right-hand Bat,Right-arm Fast,South Africa,Player,Deccan Chargers,Mumbai Indians,2012,0,29,0,Blank,Blank,Kc Sangakkara,Harbhajan Singh,Pa Patel,Kd Karthik,1983-06-27
18354,54832000162,548320,162,Ch Gayle,9/21/1979,Left-hand Bat,Right-arm Offbreak,West Indies,Player,Royal Challengers Bangalore,Kolkata Knight Riders,2012,0,33,0,Blank,Blank,Dl Vettori,G Gambhir,Ab De Villiers,Ms Bisla,1979-09-21
18355,54832000175,548320,175,Dl Vettori,1/27/1979,Left-hand Bat,Slow Left-arm Orthodox,New Zealand,Captain,Royal Challengers Bangalore,Kolkata Knight Riders,2012,0,33,0,Blank,Blank,Dl Vettori,G Gambhir,Ab De Villiers,Ms Bisla,1979-01-27
18356,54832000203,548320,203,Ca Pujara,1/25/1988,Right-hand Bat,Legbreak,India,Player,Royal Challengers Bangalore,Kolkata Knight Riders,2012,0,24,0,Blank,Blank,Dl Vettori,G Gambhir,Ab De Villiers,Ms Bisla,1988-01-25
18358,54832000311,548320,311,Hv Patel,11/23/1990,Right-hand Bat,Right-arm Medium,India,Player,Royal Challengers Bangalore,Kolkata Knight Riders,2012,0,22,0,Blank,Blank,Dl Vettori,G Gambhir,Ab De Villiers,Ms Bisla,1990-11-23
18359,54832000009,548320,9,Jh Kallis,10/16/1975,Right-hand Bat,Right-arm Fast-medium,South Africa,Player,Kolkata Knight Riders,Royal Challengers Bangalore,2012,0,37,1,Blank,Blank,G Gambhir,Dl Vettori,Ms Bisla,Ab De Villiers,1975-10-16
18361,54832000040,548320,40,G Gambhir,10/14/1981,Left-hand Bat,Legbreak,India,Captain,Kolkata Knight Riders,Royal Challengers Bangalore,2012,0,31,1,Blank,Blank,G Gambhir,Dl Vettori,Ms Bisla,Ab De Villiers,1981-10-14
18364,54832000087,548320,87,Mk Tiwary,11/14/1985,Right-hand Bat,Legbreak Googly,India,Player,Kolkata Knight Riders,Royal Challengers Bangalore,2012,0,27,1,Blank,Blank,G Gambhir,Dl Vettori,Ms Bisla,Ab De Villiers,1985-11-14
18367,54832000214,548320,214,Ms Bisla,12/27/1984,Right-hand Bat,N/a,India,Keeper,Kolkata Knight Riders,Royal Challengers Bangalore,2012,0,28,1,Blank,Blank,G Gambhir,Dl Vettori,Ms Bisla,Ab De Villiers,1984-12-27
18368,54832000276,548320,276,Shakib Al Hasan,3/24/1987,Left-hand Bat,Slow Left-arm Orthodox,Bangladesh,Player,Kolkata Knight Riders,Royal Challengers Bangalore,2012,0,25,1,Blank,Blank,G Gambhir,Dl Vettori,Ms Bisla,Ab De Villiers,1987-03-24
18370,54832100020,548321,20,Ms Dhoni,7/7/1981,Right-hand Bat,Right-arm Medium,India,Captainkeeper,Chennai Super Kings,Delhi Daredevils,2012,0,31,0,Blank,Blank,Ms Dhoni,V Sehwag,Ms Dhoni,Nv Ojha,1981-07-07
18383,54832100054,548321,54,Y Venugopal Rao,2/26/1982,Right-hand Bat,Right-arm Offbreak,India,Player,Delhi Daredevils,Chennai Super Kings,2012,0,30,1,Blank,Blank,V Sehwag,Ms Dhoni,Nv Ojha,Ms Dhoni,1982-02-26
18384,54832100064,548321,64,Dpmd Jayawardene,5/27/1977,Right-hand Bat,Right-arm Medium,Sri Lanka,Player,Delhi Daredevils,Chennai Super Kings,2012,0,35,1,Blank,Blank,V Sehwag,Ms Dhoni,Nv Ojha,Ms Dhoni,1977-05-27
18385,54832100158,548321,158,Kp Pietersen,6/27/1980,Right-hand Bat,Right-arm Offbreak,South Africa,Player,Delhi Daredevils,Chennai Super Kings,2012,0,32,1,Blank,Blank,V Sehwag,Ms Dhoni,Nv Ojha,Ms Dhoni,1980-06-27
18386,54832100177,548321,177,Re Van Der Merwe,12/31/1984,Right-hand Bat,Slow Left-arm Orthodox,South Africa,Player,Delhi Daredevils,Chennai Super Kings,2012,0,28,1,Blank,Blank,V Sehwag,Ms Dhoni,Nv Ojha,Ms Dhoni,1984-12-31
18388,54832100190,548321,190,M Morkel,10/6/1984,Left-hand Bat,Right-arm Fast,South Africa,Player,Delhi Daredevils,Chennai Super Kings,2012,1,28,1,Blank,Blank,V Sehwag,Ms Dhoni,Nv Ojha,Ms Dhoni,1984-10-06
18389,54832100199,548321,199,Y Nagar,1/6/1990,Right-hand Bat,Right-arm Offbreak,India,Player,Delhi Daredevils,Chennai Super Kings,2012,0,22,1,Blank,Blank,V Sehwag,Ms Dhoni,Nv Ojha,Ms Dhoni,1990-01-06
18392,54832200050,548322,50,Harbhajan Singh,7/3/1980,Right-hand Bat,Right-arm Offbreak,India,Captain,Mumbai Indians,Rajasthan Royals,2012,0,32,1,Blank,Blank,Harbhajan Singh,R Dravid,Kd Karthik,Sp Goswami,1980-07-03
18397,54832200178,548322,178,Tl Suman,12/15/1983,Right-hand Bat,Right-arm Offbreak,India,Player,Mumbai Indians,Rajasthan Royals,2012,0,29,1,Blank,Blank,Harbhajan Singh,R Dravid,Kd Karthik,Sp Goswami,1983-12-15
18398,54832200194,548322,194,Sl Malinga,8/28/1983,Right-hand Bat,Right-arm Fast,Sri Lanka,Player,Mumbai Indians,Rajasthan Royals,2012,0,29,1,Blank,Blank,Harbhajan Singh,R Dravid,Kd Karthik,Sp Goswami,1983-08-28
18400,54832200221,548322,221,Ka Pollard,5/12/1987,Right-hand Bat,Right-arm Medium-fast,West Indies,Player,Mumbai Indians,Rajasthan Royals,2012,1,25,1,Blank,Blank,Harbhajan Singh,R Dravid,Kd Karthik,Sp Goswami,1987-05-12
18401,54832200275,548322,275,Jec Franklin,11/7/1980,Left-hand Bat,Left-arm Medium,New Zealand,Player,Mumbai Indians,Rajasthan Royals,2012,0,32,1,Blank,Blank,Harbhajan Singh,R Dravid,Kd Karthik,Sp Goswami,1980-11-07
18402,54832200304,548322,304,Re Levi,1/14/1988,Right-hand Bat,Right-arm Medium,South Africa,Player,Mumbai Indians,Rajasthan Royals,2012,0,24,1,Blank,Blank,Harbhajan Singh,R Dravid,Kd Karthik,Sp Goswami,1988-01-14
18403,54832200006,548322,6,R Dravid,1/11/1973,Right-hand Bat,Right-arm Offbreak,India,Captain,Rajasthan Royals,Mumbai Indians,2012,0,39,0,Blank,Blank,R Dravid,Harbhajan Singh,Sp Goswami,Kd Karthik,1973-01-11
18409,54832200204,548322,204,Oa Shah,10/22/1978,Right-hand Bat,Right-arm Offbreak,England,Player,Rajasthan Royals,Mumbai Indians,2012,0,34,0,Blank,Blank,R Dravid,Harbhajan Singh,Sp Goswami,Kd Karthik,1978-10-22
18411,54832200297,548322,297,Aa Chavan,10/28/1985,Left-hand Bat,Slow Left-arm Orthodox,India,Player,Rajasthan Royals,Mumbai Indians,2012,0,27,0,Blank,Blank,R Dravid,Harbhajan Singh,Sp Goswami,Kd Karthik,1985-10-28
18414,54832300008,548323,8,V Kohli,11/5/1988,Right-hand Bat,Right-arm Medium,India,Player,Royal Challengers Bangalore,Chennai Super Kings,2012,0,24,0,Blank,Blank,Dl Vettori,Ms Dhoni,Ab De Villiers,Ms Dhoni,1988-11-05
18420,54832300162,548323,162,Ch Gayle,9/21/1979,Left-hand Bat,Right-arm Offbreak,West Indies,Player,Royal Challengers Bangalore,Chennai Super Kings,2012,0,33,0,Blank,Blank,Dl Vettori,Ms Dhoni,Ab De Villiers,Ms Dhoni,1979-09-21
18432,54832300186,548323,186,Sb Jakati,11/27/1980,Left-hand Bat,Slow Left-arm Orthodox,India,Player,Chennai Super Kings,Royal Challengers Bangalore,2012,0,32,1,Blank,Blank,Ms Dhoni,Dl Vettori,Ms Dhoni,Ab De Villiers,1980-11-27
18434,54832300248,548323,248,De Bollinger,7/24/1981,Left-hand Bat,Left-arm Fast-medium,Australia,Player,Chennai Super Kings,Royal Challengers Bangalore,2012,0,31,1,Blank,Blank,Ms Dhoni,Dl Vettori,Ms Dhoni,Ab De Villiers,1981-07-24
18435,54832300303,548323,303,F Du Plessis,7/13/1984,Right-hand Bat,Legbreak,South Africa,Player,Chennai Super Kings,Royal Challengers Bangalore,2012,1,28,1,Blank,Blank,Ms Dhoni,Dl Vettori,Ms Dhoni,Ab De Villiers,1984-07-13
18436,54832400004,548324,4,Dj Hussey,7/15/1977,Right-hand Bat,Right-arm Offbreak,Australia,Player,Kings Xi Punjab,Pune Warriors,2012,0,35,1,Blank,Blank,Ac Gilchrist,Sc Ganguly,Ac Gilchrist,Rv Uthappa,1977-07-15
18438,54832400053,548324,53,Ac Gilchrist,11/14/1971,Left-hand Bat,Right-arm Offbreak,Australia,Captainkeeper,Kings Xi Punjab,Pune Warriors,2012,0,41,1,Blank,Blank,Ac Gilchrist,Sc Ganguly,Ac Gilchrist,Rv Uthappa,1971-11-14
18440,54832400100,548324,100,Se Marsh,7/9/1983,Left-hand Bat,Slow Left-arm Orthodox,Australia,Player,Kings Xi Punjab,Pune Warriors,2012,0,29,1,Blank,Blank,Ac Gilchrist,Sc Ganguly,Ac Gilchrist,Rv Uthappa,1983-07-09
18443,54832400228,548324,228,Bipul Sharma,9/28/1983,Left-hand Bat,Slow Left-arm Orthodox,India,Player,Kings Xi Punjab,Pune Warriors,2012,0,29,1,Blank,Blank,Ac Gilchrist,Sc Ganguly,Ac Gilchrist,Rv Uthappa,1983-09-28
18445,54832400256,548324,256,Harmeet Singh,9/7/1992,Left-hand Bat,Slow Left-arm Orthodox,India,Player,Kings Xi Punjab,Pune Warriors,2012,0,20,1,Blank,Blank,Ac Gilchrist,Sc Ganguly,Ac Gilchrist,Rv Uthappa,1992-09-07
18450,54832400096,548324,96,Mk Pandey,9/10/1989,Right-hand Bat,Right-arm Medium,India,Player,Pune Warriors,Kings Xi Punjab,2012,0,23,0,Blank,Blank,Sc Ganguly,Ac Gilchrist,Rv Uthappa,Ac Gilchrist,1989-09-10
18451,54832400106,548324,106,Ab Dinda,3/25/1984,Right-hand Bat,Right-arm Medium-fast,India,Player,Pune Warriors,Kings Xi Punjab,2012,0,28,0,Blank,Blank,Sc Ganguly,Ac Gilchrist,Rv Uthappa,Ac Gilchrist,1984-03-25
18453,54832400171,548324,171,M Manhas,10/12/1979,Right-hand Bat,Right-arm Offbreak,India,Player,Pune Warriors,Kings Xi Punjab,2012,0,33,0,Blank,Blank,Sc Ganguly,Ac Gilchrist,Rv Uthappa,Ac Gilchrist,1979-10-12
18459,54832500031,548325,31,Yk Pathan,11/17/1982,Right-hand Bat,Right-arm Offbreak,India,Player,Kolkata Knight Riders,Rajasthan Royals,2012,0,30,1,Blank,Blank,G Gambhir,R Dravid,Ms Bisla,Sp Goswami,1982-11-17
18471,54832500085,548325,85,Am Rahane,6/6/1988,Right-hand Bat,Right-arm Medium,India,Player,Rajasthan Royals,Kolkata Knight Riders,2012,0,24,0,Blank,Blank,R Dravid,G Gambhir,Sp Goswami,Ms Bisla,1988-06-06
18473,54832500132,548325,132,Sp Goswami,5/18/1989,Left-hand Bat,N/a,India,Keeper,Rajasthan Royals,Kolkata Knight Riders,2012,0,23,0,Blank,Blank,R Dravid,G Gambhir,Sp Goswami,Ms Bisla,1989-05-18
18475,54832500196,548325,196,A Singh,6/21/1981,Right-hand Bat,Right-arm Medium-fast,India,Player,Rajasthan Royals,Kolkata Knight Riders,2012,0,31,0,Blank,Blank,R Dravid,G Gambhir,Sp Goswami,Ms Bisla,1981-06-21
18476,54832500204,548325,204,Oa Shah,10/22/1978,Right-hand Bat,Right-arm Offbreak,England,Player,Rajasthan Royals,Kolkata Knight Riders,2012,0,34,0,Blank,Blank,R Dravid,G Gambhir,Sp Goswami,Ms Bisla,1978-10-22
18478,54832500297,548325,297,Aa Chavan,10/28/1985,Left-hand Bat,Slow Left-arm Orthodox,India,Player,Rajasthan Royals,Kolkata Knight Riders,2012,0,27,0,Blank,Blank,R Dravid,G Gambhir,Sp Goswami,Ms Bisla,1985-10-28
18480,54832600029,548326,29,Ik Pathan,10/27/1984,Left-hand Bat,Left-arm Medium-fast,India,Player,Delhi Daredevils,Deccan Chargers,2012,0,28,1,Blank,Blank,V Sehwag,Kc Sangakkara,Nv Ojha,Pa Patel,1984-10-27
18483,54832600064,548326,64,Dpmd Jayawardene,5/27/1977,Right-hand Bat,Right-arm Medium,Sri Lanka,Player,Delhi Daredevils,Deccan Chargers,2012,0,35,1,Blank,Blank,V Sehwag,Kc Sangakkara,Nv Ojha,Pa Patel,1977-05-27
18484,54832600082,548326,82,Ab Agarkar,12/4/1977,Right-hand Bat,Right-arm Fast,India,Player,Delhi Daredevils,Deccan Chargers,2012,0,35,1,Blank,Blank,V Sehwag,Kc Sangakkara,Nv Ojha,Pa Patel,1977-12-04
18488,54832600199,548326,199,Y Nagar,1/6/1990,Right-hand Bat,Right-arm Offbreak,India,Player,Delhi Daredevils,Deccan Chargers,2012,0,22,1,Blank,Blank,V Sehwag,Kc Sangakkara,Nv Ojha,Pa Patel,1990-01-06
18499,54832600258,548326,258,Dt Christian,5/4/1983,Right-hand Bat,Right-arm Fast-medium,Australia,Player,Deccan Chargers,Delhi Daredevils,2012,0,29,0,Blank,Blank,Kc Sangakkara,V Sehwag,Pa Patel,Nv Ojha,1983-05-04
18500,54832600314,548326,314,Ankit Sharma,4/20/1991,Left-hand Bat,Slow Left-arm Orthodox,India,Player,Deccan Chargers,Delhi Daredevils,2012,0,21,0,Blank,Blank,Kc Sangakkara,V Sehwag,Pa Patel,Nv Ojha,1991-04-20
18501,54832600326,548326,326,V Pratap Singh,5/3/1992,Right-hand Bat,Right-arm Medium,India,Player,Deccan Chargers,Delhi Daredevils,2012,0,20,0,Blank,Blank,Kc Sangakkara,V Sehwag,Pa Patel,Nv Ojha,1992-05-03
18504,54832700023,548327,23,S Badrinath,8/30/1980,Right-hand Bat,Right-arm Offbreak,India,Player,Chennai Super Kings,Pune Warriors,2012,0,32,0,Blank,Blank,Ms Dhoni,Sc Ganguly,Ms Dhoni,Rv Uthappa,1980-08-30
18507,54832700091,548327,91,Vy Mahesh,12/21/1987,Right-hand Bat,Right-arm Medium-fast,India,Player,Chennai Super Kings,Pune Warriors,2012,0,25,0,Blank,Blank,Ms Dhoni,Sc Ganguly,Ms Dhoni,Rv Uthappa,1987-12-21
18510,54832700201,548327,201,R Ashwin,9/17/1986,Right-hand Bat,Right-arm Offbreak,India,Player,Chennai Super Kings,Pune Warriors,2012,0,26,0,Blank,Blank,Ms Dhoni,Sc Ganguly,Ms Dhoni,Rv Uthappa,1986-09-17
18512,54832700324,548327,324,Kmdn Kulasekara,7/22/1982,Right-hand Bat,Right-arm Fast-medium,Sri Lanka,Player,Chennai Super Kings,Pune Warriors,2012,0,30,0,Blank,Blank,Ms Dhoni,Sc Ganguly,Ms Dhoni,Rv Uthappa,1982-07-22
18513,54832700001,548327,1,Sc Ganguly,7/8/1972,Left-hand Bat,Right-arm Medium,India,Captain,Pune Warriors,Chennai Super Kings,2012,0,40,1,Blank,Blank,Sc Ganguly,Ms Dhoni,Rv Uthappa,Ms Dhoni,1972-07-08
18515,54832700073,548327,73,A Nehra,4/29/1979,Right-hand Bat,Left-arm Medium-fast,India,Player,Pune Warriors,Chennai Super Kings,2012,0,33,1,Blank,Blank,Sc Ganguly,Ms Dhoni,Rv Uthappa,Ms Dhoni,1979-04-29
18516,54832700083,548327,83,M Kartik,9/11/1976,Left-hand Bat,Slow Left-arm Orthodox,India,Player,Pune Warriors,Chennai Super Kings,2012,0,36,1,Blank,Blank,Sc Ganguly,Ms Dhoni,Rv Uthappa,Ms Dhoni,1976-09-11
18520,54832700191,548327,191,Ad Mathews,6/2/1987,Right-hand Bat,Right-arm Fast-medium,Sri Lanka,Player,Pune Warriors,Chennai Super Kings,2012,0,25,1,Blank,Blank,Sc Ganguly,Ms Dhoni,Rv Uthappa,Ms Dhoni,1987-06-02
18521,54832700235,548327,235,R Sharma,4/30/1987,Right-hand Bat,Right-arm Offbreak,India,Player,Pune Warriors,Chennai Super Kings,2012,0,25,1,Blank,Blank,Sc Ganguly,Ms Dhoni,Rv Uthappa,Ms Dhoni,1987-04-30
18522,54832700306,548327,306,Spd Smith,6/2/1989,Right-hand Bat,Legbreak Googly,India,Player,Pune Warriors,Chennai Super Kings,2012,0,23,1,Blank,Blank,Sc Ganguly,Ms Dhoni,Rv Uthappa,Ms Dhoni,1989-06-02
18524,54832800004,548328,4,Dj Hussey,7/15/1977,Right-hand Bat,Right-arm Offbreak,Australia,Player,Kings Xi Punjab,Kolkata Knight Riders,2012,0,35,1,Blank,Blank,Ac Gilchrist,G Gambhir,Ac Gilchrist,Ms Bisla,1977-07-15
18526,54832800053,548328,53,Ac Gilchrist,11/14/1971,Left-hand Bat,Right-arm Offbreak,Australia,Captainkeeper,Kings Xi Punjab,Kolkata Knight Riders,2012,0,41,1,Blank,Blank,Ac Gilchrist,G Gambhir,Ac Gilchrist,Ms Bisla,1971-11-14
18527,54832800067,548328,67,Pp Chawla,12/24/1988,Left-hand Bat,Legbreak,India,Player,Kings Xi Punjab,Kolkata Knight Riders,2012,0,24,1,Blank,Blank,Ac Gilchrist,G Gambhir,Ac Gilchrist,Ms Bisla,1988-12-24
18532,54832800236,548328,236,Mandeep Singh,12/18/1991,Right-hand Bat,Right-arm Medium,India,Player,Kings Xi Punjab,Kolkata Knight Riders,2012,0,21,1,Blank,Blank,Ac Gilchrist,G Gambhir,Ac Gilchrist,Ms Bisla,1991-12-18
18535,54832800009,548328,9,Jh Kallis,10/16/1975,Right-hand Bat,Right-arm Fast-medium,South Africa,Player,Kolkata Knight Riders,Kings Xi Punjab,2012,0,37,0,Blank,Blank,G Gambhir,Ac Gilchrist,Ms Bisla,Ac Gilchrist,1975-10-16
18536,54832800031,548328,31,Yk Pathan,11/17/1982,Right-hand Bat,Right-arm Offbreak,India,Player,Kolkata Knight Riders,Kings Xi Punjab,2012,0,30,0,Blank,Blank,G Gambhir,Ac Gilchrist,Ms Bisla,Ac Gilchrist,1982-11-17
18539,54832800089,548328,89,R Bhatia,10/22/1979,Right-hand Bat,Right-arm Medium-fast,India,Player,Kolkata Knight Riders,Kings Xi Punjab,2012,0,33,0,Blank,Blank,G Gambhir,Ac Gilchrist,Ms Bisla,Ac Gilchrist,1979-10-22
18542,54832800276,548328,276,Shakib Al Hasan,3/24/1987,Left-hand Bat,Slow Left-arm Orthodox,Bangladesh,Player,Kolkata Knight Riders,Kings Xi Punjab,2012,0,25,0,Blank,Blank,G Gambhir,Ac Gilchrist,Ms Bisla,Ac Gilchrist,1987-03-24
18543,54832800284,548328,284,Rn Ten Doeschate,6/30/1980,Right-hand Bat,Right-arm Medium-fast,Netherlands,Player,Kolkata Knight Riders,Kings Xi Punjab,2012,0,32,0,Blank,Blank,G Gambhir,Ac Gilchrist,Ms Bisla,Ac Gilchrist,1980-06-30
18544,54832800315,548328,315,Sp Narine,5/26/1988,Left-hand Bat,Right-arm Offbreak,West Indies,Player,Kolkata Knight Riders,Kings Xi Punjab,2012,1,24,0,Blank,Blank,G Gambhir,Ac Gilchrist,Ms Bisla,Ac Gilchrist,1988-05-26
18549,54832900079,548329,79,Ss Tiwary,12/30/1989,Left-hand Bat,N/a,India,Player,Royal Challengers Bangalore,Rajasthan Royals,2012,0,23,0,Blank,Blank,Dl Vettori,R Dravid,Ab De Villiers,Sp Goswami,1989-12-30
18554,54832900175,548329,175,Dl Vettori,1/27/1979,Left-hand Bat,Slow Left-arm Orthodox,New Zealand,Captain,Royal Challengers Bangalore,Rajasthan Royals,2012,0,33,0,Blank,Blank,Dl Vettori,R Dravid,Ab De Villiers,Sp Goswami,1979-01-27
18557,54832900006,548329,6,R Dravid,1/11/1973,Right-hand Bat,Right-arm Offbreak,India,Captain,Rajasthan Royals,Royal Challengers Bangalore,2012,0,39,1,Blank,Blank,R Dravid,Dl Vettori,Sp Goswami,Ab De Villiers,1973-01-11
18564,54832900196,548329,196,A Singh,6/21/1981,Right-hand Bat,Right-arm Medium-fast,India,Player,Rajasthan Royals,Royal Challengers Bangalore,2012,0,31,1,Blank,Blank,R Dravid,Dl Vettori,Sp Goswami,Ab De Villiers,1981-06-21
18569,54833000057,548330,57,Rg Sharma,4/30/1987,Right-hand Bat,Right-arm Offbreak,India,Player,Mumbai Indians,Delhi Daredevils,2012,0,25,0,Blank,Blank,Harbhajan Singh,V Sehwag,Kd Karthik,Nv Ojha,1987-04-30
18570,54833000061,548330,61,Rp Singh,12/6/1985,Right-hand Bat,Left-arm Fast-medium,India,Player,Mumbai Indians,Delhi Daredevils,2012,0,27,0,Blank,Blank,Harbhajan Singh,V Sehwag,Kd Karthik,Nv Ojha,1985-12-06
18574,54833000208,548330,208,At Rayudu,9/23/1985,Right-hand Bat,Right-arm Offbreak,India,Player,Mumbai Indians,Delhi Daredevils,2012,0,27,0,Blank,Blank,Harbhajan Singh,V Sehwag,Kd Karthik,Nv Ojha,1985-09-23
18575,54833000221,548330,221,Ka Pollard,5/12/1987,Right-hand Bat,Right-arm Medium-fast,West Indies,Player,Mumbai Indians,Delhi Daredevils,2012,0,25,0,Blank,Blank,Harbhajan Singh,V Sehwag,Kd Karthik,Nv Ojha,1987-05-12
18578,54833000318,548330,318,Cj Mckay,2/20/1983,Right-hand Bat,Right-arm Fast-medium,Australia,Player,Mumbai Indians,Delhi Daredevils,2012,0,29,0,Blank,Blank,Harbhajan Singh,V Sehwag,Kd Karthik,Nv Ojha,1983-02-20
18581,54833000052,548330,52,Lrpl Taylor,3/8/1984,Right-hand Bat,Right-arm Offbreak,New Zealand,Player,Delhi Daredevils,Mumbai Indians,2012,0,28,1,Blank,Blank,V Sehwag,Harbhajan Singh,Nv Ojha,Kd Karthik,1984-03-08
18583,54833000082,548330,82,Ab Agarkar,12/4/1977,Right-hand Bat,Right-arm Fast,India,Player,Delhi Daredevils,Mumbai Indians,2012,0,35,1,Blank,Blank,V Sehwag,Harbhajan Singh,Nv Ojha,Kd Karthik,1977-12-04
18584,54833000158,548330,158,Kp Pietersen,6/27/1980,Right-hand Bat,Right-arm Offbreak,South Africa,Player,Delhi Daredevils,Mumbai Indians,2012,0,32,1,Blank,Blank,V Sehwag,Harbhajan Singh,Nv Ojha,Kd Karthik,1980-06-27
18586,54833000190,548330,190,M Morkel,10/6/1984,Left-hand Bat,Right-arm Fast,South Africa,Player,Delhi Daredevils,Mumbai Indians,2012,0,28,1,Blank,Blank,V Sehwag,Harbhajan Singh,Nv Ojha,Kd Karthik,1984-10-06
18590,54833100006,548331,6,R Dravid,1/11/1973,Right-hand Bat,Right-arm Offbreak,India,Captain,Rajasthan Royals,Deccan Chargers,2012,0,39,1,Blank,Blank,R Dravid,Kc Sangakkara,Dh Yagnik,Kc Sangakkara,1973-01-11
18592,54833100075,548331,75,Pankaj Singh,5/6/1985,Right-hand Bat,Right-arm Medium-fast,India,Player,Rajasthan Royals,Deccan Chargers,2012,0,27,1,Blank,Blank,R Dravid,Kc Sangakkara,Dh Yagnik,Kc Sangakkara,1985-05-06
18594,54833100104,548331,104,Bj Hodge,12/29/1974,Right-hand Bat,Right-arm Offbreak,Australia,Player,Rajasthan Royals,Deccan Chargers,2012,1,38,1,Blank,Blank,R Dravid,Kc Sangakkara,Dh Yagnik,Kc Sangakkara,1974-12-29
18596,54833100196,548331,196,A Singh,6/21/1981,Right-hand Bat,Right-arm Medium-fast,India,Player,Rajasthan Royals,Deccan Chargers,2012,0,31,1,Blank,Blank,R Dravid,Kc Sangakkara,Dh Yagnik,Kc Sangakkara,1981-06-21
18598,54833100266,548331,266,Al Menaria,10/29/1990,Left-hand Bat,Slow Left-arm Orthodox,India,Player,Rajasthan Royals,Deccan Chargers,2012,0,22,1,Blank,Blank,R Dravid,Kc Sangakkara,Dh Yagnik,Kc Sangakkara,1990-10-29
18601,54833100026,548331,26,Kc Sangakkara,10/27/1977,Left-hand Bat,Right-arm Offbreak,Sri Lanka,Captainkeeper,Deccan Chargers,Rajasthan Royals,2012,0,35,0,Blank,Blank,Kc Sangakkara,R Dravid,Kc Sangakkara,Dh Yagnik,1977-10-27
18603,54833100093,548331,93,B Chipli,1/27/1983,Right-hand Bat,Right-arm Medium,India,Player,Deccan Chargers,Rajasthan Royals,2012,0,29,0,Blank,Blank,Kc Sangakkara,R Dravid,Kc Sangakkara,Dh Yagnik,1983-01-27
18606,54833100154,548331,154,Jp Duminy,4/14/1984,Left-hand Bat,Right-arm Offbreak,South Africa,Player,Deccan Chargers,Rajasthan Royals,2012,0,28,0,Blank,Blank,Kc Sangakkara,R Dravid,Kc Sangakkara,Dh Yagnik,1984-04-14
18607,54833100211,548331,211,Aa Jhunjhunwala,12/1/1982,Right-hand Bat,Right-arm Offbreak,India,Player,Deccan Chargers,Rajasthan Royals,2012,0,30,0,Blank,Blank,Kc Sangakkara,R Dravid,Kc Sangakkara,Dh Yagnik,1982-12-01
18611,54833100469,548331,469,T Mishra,12/22/1986,Right-hand Bat,Right-arm Fast-medium,India,Player,Deccan Chargers,Rajasthan Royals,2012,0,26,0,Blank,Blank,Kc Sangakkara,R Dravid,Kc Sangakkara,Dh Yagnik,1986-12-22
18618,54833200162,548332,162,Ch Gayle,9/21/1979,Left-hand Bat,Right-arm Offbreak,West Indies,Player,Royal Challengers Bangalore,Pune Warriors,2012,1,33,1,Blank,Blank,Dl Vettori,Sc Ganguly,Ab De Villiers,Rv Uthappa,1979-09-21
18622,54833200311,548332,311,Hv Patel,11/23/1990,Right-hand Bat,Right-arm Medium,India,Player,Royal Challengers Bangalore,Pune Warriors,2012,0,22,1,Blank,Blank,Dl Vettori,Sc Ganguly,Ab De Villiers,Rv Uthappa,1990-11-23
18624,54833200046,548332,46,Rv Uthappa,11/11/1985,Right-hand Bat,Right-arm Medium,India,Keeper,Pune Warriors,Royal Challengers Bangalore,2012,0,27,0,Blank,Blank,Sc Ganguly,Dl Vettori,Rv Uthappa,Ab De Villiers,1985-11-11
18627,54833200157,548332,157,Jd Ryder,8/6/1984,Left-hand Bat,Right-arm Medium,New Zealand,Player,Pune Warriors,Royal Challengers Bangalore,2012,0,28,0,Blank,Blank,Sc Ganguly,Dl Vettori,Rv Uthappa,Ab De Villiers,1984-08-06
18628,54833200171,548332,171,M Manhas,10/12/1979,Right-hand Bat,Right-arm Offbreak,India,Player,Pune Warriors,Royal Challengers Bangalore,2012,0,33,0,Blank,Blank,Sc Ganguly,Dl Vettori,Rv Uthappa,Ab De Villiers,1979-10-12
18629,54833200191,548332,191,Ad Mathews,6/2/1987,Right-hand Bat,Right-arm Fast-medium,Sri Lanka,Player,Pune Warriors,Royal Challengers Bangalore,2012,0,25,0,Blank,Blank,Sc Ganguly,Dl Vettori,Rv Uthappa,Ab De Villiers,1987-06-02
18632,54833200306,548332,306,Spd Smith,6/2/1989,Right-hand Bat,Legbreak Googly,India,Player,Pune Warriors,Royal Challengers Bangalore,2012,0,23,0,Blank,Blank,Sc Ganguly,Dl Vettori,Rv Uthappa,Ab De Villiers,1989-06-02
18633,54833200307,548332,307,Mn Samuels,2/5/1981,Right-hand Bat,Right-arm Offbreak,West Indies,Player,Pune Warriors,Royal Challengers Bangalore,2012,0,31,0,Blank,Blank,Sc Ganguly,Dl Vettori,Rv Uthappa,Ab De Villiers,1981-02-05
18634,54833300004,548333,4,Dj Hussey,7/15/1977,Right-hand Bat,Right-arm Offbreak,Australia,Player,Kings Xi Punjab,Kolkata Knight Riders,2012,0,35,0,Blank,Blank,Ac Gilchrist,G Gambhir,Ac Gilchrist,Ms Bisla,1977-07-15
18635,54833300014,548333,14,P Kumar,10/2/1986,Right-hand Bat,Right-arm Medium,India,Player,Kings Xi Punjab,Kolkata Knight Riders,2012,0,26,0,Blank,Blank,Ac Gilchrist,G Gambhir,Ac Gilchrist,Ms Bisla,1986-10-02
18636,54833300053,548333,53,Ac Gilchrist,11/14/1971,Left-hand Bat,Right-arm Offbreak,Australia,Captainkeeper,Kings Xi Punjab,Kolkata Knight Riders,2012,0,41,0,Blank,Blank,Ac Gilchrist,G Gambhir,Ac Gilchrist,Ms Bisla,1971-11-14
18637,54833300067,548333,67,Pp Chawla,12/24/1988,Left-hand Bat,Legbreak,India,Player,Kings Xi Punjab,Kolkata Knight Riders,2012,0,24,0,Blank,Blank,Ac Gilchrist,G Gambhir,Ac Gilchrist,Ms Bisla,1988-12-24
18638,54833300100,548333,100,Se Marsh,7/9/1983,Left-hand Bat,Slow Left-arm Orthodox,Australia,Player,Kings Xi Punjab,Kolkata Knight Riders,2012,0,29,0,Blank,Blank,Ac Gilchrist,G Gambhir,Ac Gilchrist,Ms Bisla,1983-07-09
18639,54833300137,548333,137,Ad Mascarenhas,10/30/1977,Right-hand Bat,Right-arm Fast-medium,England,Player,Kings Xi Punjab,Kolkata Knight Riders,2012,0,35,0,Blank,Blank,Ac Gilchrist,G Gambhir,Ac Gilchrist,Ms Bisla,1977-10-30
18640,54833300167,548333,167,Pc Valthaty,12/7/1983,Right-hand Bat,Right-arm Medium,India,Player,Kings Xi Punjab,Kolkata Knight Riders,2012,0,29,0,Blank,Blank,Ac Gilchrist,G Gambhir,Ac Gilchrist,Ms Bisla,1983-12-07
18644,54833300302,548333,302,Ba Bhatt,5/13/1990,Left-hand Bat,Slow Left-arm Orthodox,India,Player,Kings Xi Punjab,Kolkata Knight Riders,2012,0,22,0,Blank,Blank,Ac Gilchrist,G Gambhir,Ac Gilchrist,Ms Bisla,1990-05-13
18645,54833300002,548333,2,Bb Mccullum,9/27/1981,Right-hand Bat,Right-arm Medium,New Zealand,Player,Kolkata Knight Riders,Kings Xi Punjab,2012,0,31,1,Blank,Blank,G Gambhir,Ac Gilchrist,Ms Bisla,Ac Gilchrist,1981-09-27
18646,54833300009,548333,9,Jh Kallis,10/16/1975,Right-hand Bat,Right-arm Fast-medium,South Africa,Player,Kolkata Knight Riders,Kings Xi Punjab,2012,0,37,1,Blank,Blank,G Gambhir,Ac Gilchrist,Ms Bisla,Ac Gilchrist,1975-10-16
18647,54833300031,548333,31,Yk Pathan,11/17/1982,Right-hand Bat,Right-arm Offbreak,India,Player,Kolkata Knight Riders,Kings Xi Punjab,2012,0,30,1,Blank,Blank,G Gambhir,Ac Gilchrist,Ms Bisla,Ac Gilchrist,1982-11-17
18648,54833300040,548333,40,G Gambhir,10/14/1981,Left-hand Bat,Legbreak,India,Captain,Kolkata Knight Riders,Kings Xi Punjab,2012,1,31,1,Blank,Blank,G Gambhir,Ac Gilchrist,Ms Bisla,Ac Gilchrist,1981-10-14
18649,54833300066,548333,66,B Lee,11/8/1976,Right-hand Bat,Right-arm Fast,Australia,Player,Kolkata Knight Riders,Kings Xi Punjab,2012,0,36,1,Blank,Blank,G Gambhir,Ac Gilchrist,Ms Bisla,Ac Gilchrist,1976-11-08
18650,54833300087,548333,87,Mk Tiwary,11/14/1985,Right-hand Bat,Legbreak Googly,India,Player,Kolkata Knight Riders,Kings Xi Punjab,2012,0,27,1,Blank,Blank,G Gambhir,Ac Gilchrist,Ms Bisla,Ac Gilchrist,1985-11-14
18651,54833300089,548333,89,R Bhatia,10/22/1979,Right-hand Bat,Right-arm Medium-fast,India,Player,Kolkata Knight Riders,Kings Xi Punjab,2012,0,33,1,Blank,Blank,G Gambhir,Ac Gilchrist,Ms Bisla,Ac Gilchrist,1979-10-22
18653,54833300151,548333,151,L Balaji,9/27/1981,Right-hand Bat,Right-arm Medium-fast,India,Player,Kolkata Knight Riders,Kings Xi Punjab,2012,0,31,1,Blank,Blank,G Gambhir,Ac Gilchrist,Ms Bisla,Ac Gilchrist,1981-09-27
18658,54833400054,548334,54,Y Venugopal Rao,2/26/1982,Right-hand Bat,Right-arm Offbreak,India,Player,Delhi Daredevils,Deccan Chargers,2012,0,30,1,Blank,Blank,V Sehwag,Kc Sangakkara,Nv Ojha,Pa Patel,1982-02-26
18661,54833400187,548334,187,Da Warner,10/27/1986,Left-hand Bat,Legbreak,Australia,Player,Delhi Daredevils,Deccan Chargers,2012,1,26,1,Blank,Blank,V Sehwag,Kc Sangakkara,Nv Ojha,Pa Patel,1986-10-27
18662,54833400190,548334,190,M Morkel,10/6/1984,Left-hand Bat,Right-arm Fast,South Africa,Player,Delhi Daredevils,Deccan Chargers,2012,0,28,1,Blank,Blank,V Sehwag,Kc Sangakkara,Nv Ojha,Pa Patel,1984-10-06
18663,54833400199,548334,199,Y Nagar,1/6/1990,Right-hand Bat,Right-arm Offbreak,India,Player,Delhi Daredevils,Deccan Chargers,2012,0,22,1,Blank,Blank,V Sehwag,Kc Sangakkara,Nv Ojha,Pa Patel,1990-01-06
18668,54833400017,548334,17,Pa Patel,3/9/1985,Left-hand Bat,N/a,India,Keeper,Deccan Chargers,Delhi Daredevils,2012,0,27,0,Blank,Blank,Kc Sangakkara,V Sehwag,Pa Patel,Nv Ojha,1985-03-09
18669,54833400026,548334,26,Kc Sangakkara,10/27/1977,Left-hand Bat,Right-arm Offbreak,Sri Lanka,Captain,Deccan Chargers,Delhi Daredevils,2012,0,35,0,Blank,Blank,Kc Sangakkara,V Sehwag,Pa Patel,Nv Ojha,1977-10-27
18673,54833400154,548334,154,Jp Duminy,4/14/1984,Left-hand Bat,Right-arm Offbreak,South Africa,Player,Deccan Chargers,Delhi Daredevils,2012,0,28,0,Blank,Blank,Kc Sangakkara,V Sehwag,Pa Patel,Nv Ojha,1984-04-14
18675,54833400314,548334,314,Ankit Sharma,4/20/1991,Left-hand Bat,Slow Left-arm Orthodox,India,Player,Deccan Chargers,Delhi Daredevils,2012,0,21,0,Blank,Blank,Kc Sangakkara,V Sehwag,Pa Patel,Nv Ojha,1991-04-20
18676,54833400325,548334,325,A Ashish Reddy,2/24/1991,Right-hand Bat,Right-arm Medium,India,Player,Deccan Chargers,Delhi Daredevils,2012,0,21,0,Blank,Blank,Kc Sangakkara,V Sehwag,Pa Patel,Nv Ojha,1991-02-24
18677,54833400450,548334,450,Tp Sudhindra,4/24/1984,Left-hand Bat,Right-arm Fast,India,Player,Deccan Chargers,Delhi Daredevils,2012,0,28,0,Blank,Blank,Kc Sangakkara,V Sehwag,Pa Patel,Nv Ojha,1984-04-24
18682,54833500062,548335,62,Wp Saha,10/24/1984,Right-hand Bat,N/a,India,Player,Chennai Super Kings,Pune Warriors,2012,0,28,1,Blank,Blank,Ms Dhoni,Sc Ganguly,Ms Dhoni,Rv Uthappa,1984-10-24
18683,54833500071,548335,71,Dj Bravo,10/7/1983,Right-hand Bat,Right-arm Medium-fast,West Indies,Player,Chennai Super Kings,Pune Warriors,2012,0,29,1,Blank,Blank,Ms Dhoni,Sc Ganguly,Ms Dhoni,Rv Uthappa,1983-10-07
18686,54833500248,548335,248,De Bollinger,7/24/1981,Left-hand Bat,Left-arm Fast-medium,Australia,Player,Chennai Super Kings,Pune Warriors,2012,0,31,1,Blank,Blank,Ms Dhoni,Sc Ganguly,Ms Dhoni,Rv Uthappa,1981-07-24
18689,54833500001,548335,1,Sc Ganguly,7/8/1972,Left-hand Bat,Right-arm Medium,India,Captain,Pune Warriors,Chennai Super Kings,2012,0,40,0,Blank,Blank,Sc Ganguly,Ms Dhoni,Rv Uthappa,Ms Dhoni,1972-07-08
18691,54833500073,548335,73,A Nehra,4/29/1979,Right-hand Bat,Left-arm Medium-fast,India,Player,Pune Warriors,Chennai Super Kings,2012,0,33,0,Blank,Blank,Sc Ganguly,Ms Dhoni,Rv Uthappa,Ms Dhoni,1979-04-29
18694,54833500157,548335,157,Jd Ryder,8/6/1984,Left-hand Bat,Right-arm Medium,New Zealand,Player,Pune Warriors,Chennai Super Kings,2012,0,28,0,Blank,Blank,Sc Ganguly,Ms Dhoni,Rv Uthappa,Ms Dhoni,1984-08-06
18695,54833500191,548335,191,Ad Mathews,6/2/1987,Right-hand Bat,Right-arm Fast-medium,Sri Lanka,Player,Pune Warriors,Chennai Super Kings,2012,0,25,0,Blank,Blank,Sc Ganguly,Ms Dhoni,Rv Uthappa,Ms Dhoni,1987-06-02
18697,54833500299,548335,299,B Kumar,2/5/1990,Right-hand Bat,Right-arm Medium,India,Player,Pune Warriors,Chennai Super Kings,2012,0,22,0,Blank,Blank,Sc Ganguly,Ms Dhoni,Rv Uthappa,Ms Dhoni,1990-02-05
18698,54833500306,548335,306,Spd Smith,6/2/1989,Right-hand Bat,Legbreak Googly,India,Player,Pune Warriors,Chennai Super Kings,2012,0,23,0,Blank,Blank,Sc Ganguly,Ms Dhoni,Rv Uthappa,Ms Dhoni,1989-06-02
18701,54833600015,548336,15,Z Khan,10/7/1978,Right-hand Bat,Left-arm Fast-medium,India,Player,Royal Challengers Bangalore,Kings Xi Punjab,2012,0,34,1,Blank,Blank,Dl Vettori,Dj Hussey,Kb Arun Karthik,N Saini,1978-10-07
18703,54833600081,548336,81,R Vinay Kumar,2/12/1984,Right-hand Bat,Right-arm Medium,India,Player,Royal Challengers Bangalore,Kings Xi Punjab,2012,0,28,1,Blank,Blank,Dl Vettori,Dj Hussey,Kb Arun Karthik,N Saini,1984-02-12
18707,54833600198,548336,198,Ab Mcdonald,6/5/1981,Right-hand Bat,Right-arm Fast-medium,Australia,Player,Royal Challengers Bangalore,Kings Xi Punjab,2012,0,31,1,Blank,Blank,Dl Vettori,Dj Hussey,Kb Arun Karthik,N Saini,1981-06-05
18710,54833600311,548336,311,Hv Patel,11/23/1990,Right-hand Bat,Right-arm Medium,India,Player,Royal Challengers Bangalore,Kings Xi Punjab,2012,0,22,1,Blank,Blank,Dl Vettori,Dj Hussey,Kb Arun Karthik,N Saini,1990-11-23
18711,54833600004,548336,4,Dj Hussey,7/15/1977,Right-hand Bat,Right-arm Offbreak,Australia,Captain,Kings Xi Punjab,Royal Challengers Bangalore,2012,0,35,0,Blank,Blank,Dj Hussey,Dl Vettori,N Saini,Kb Arun Karthik,1977-07-15
18713,54833600067,548336,67,Pp Chawla,12/24/1988,Left-hand Bat,Legbreak,India,Player,Kings Xi Punjab,Royal Challengers Bangalore,2012,0,24,0,Blank,Blank,Dj Hussey,Dl Vettori,N Saini,Kb Arun Karthik,1988-12-24
18714,54833600100,548336,100,Se Marsh,7/9/1983,Left-hand Bat,Slow Left-arm Orthodox,Australia,Player,Kings Xi Punjab,Royal Challengers Bangalore,2012,0,29,0,Blank,Blank,Dj Hussey,Dl Vettori,N Saini,Kb Arun Karthik,1983-07-09
18718,54833600319,548336,319,N Saini,10/28/1988,Right-hand Bat,N/a,India,Keeper,Kings Xi Punjab,Royal Challengers Bangalore,2012,0,24,0,Blank,Blank,Dj Hussey,Dl Vettori,N Saini,Kb Arun Karthik,1988-10-28
18720,54833600321,548336,321,Azhar Mahmood,2/28/1975,Right-hand Bat,Right-arm Fast-medium,Pakistan,Player,Kings Xi Punjab,Royal Challengers Bangalore,2012,0,37,0,Blank,Blank,Dj Hussey,Dl Vettori,N Saini,Kb Arun Karthik,1975-02-28
18721,54833600333,548336,333,P Awana,7/19/1986,Right-hand Bat,Right-arm Medium,India,Player,Kings Xi Punjab,Royal Challengers Bangalore,2012,0,26,0,Blank,Blank,Dj Hussey,Dl Vettori,N Saini,Kb Arun Karthik,1986-07-19
18724,54833700023,548337,23,S Badrinath,8/30/1980,Right-hand Bat,Right-arm Offbreak,India,Player,Chennai Super Kings,Rajasthan Royals,2012,0,32,1,Blank,Blank,Ms Dhoni,R Dravid,Ms Dhoni,Sp Goswami,1980-08-30
18726,54833700062,548337,62,Wp Saha,10/24/1984,Right-hand Bat,N/a,India,Player,Chennai Super Kings,Rajasthan Royals,2012,0,28,1,Blank,Blank,Ms Dhoni,R Dravid,Ms Dhoni,Sp Goswami,1984-10-24
18727,54833700071,548337,71,Dj Bravo,10/7/1983,Right-hand Bat,Right-arm Medium-fast,West Indies,Player,Chennai Super Kings,Rajasthan Royals,2012,0,29,1,Blank,Blank,Ms Dhoni,R Dravid,Ms Dhoni,Sp Goswami,1983-10-07
18730,54833700248,548337,248,De Bollinger,7/24/1981,Left-hand Bat,Left-arm Fast-medium,Australia,Player,Chennai Super Kings,Rajasthan Royals,2012,0,31,1,Blank,Blank,Ms Dhoni,R Dravid,Ms Dhoni,Sp Goswami,1981-07-24
18735,54833700085,548337,85,Am Rahane,6/6/1988,Right-hand Bat,Right-arm Medium,India,Player,Rajasthan Royals,Chennai Super Kings,2012,0,24,0,Blank,Blank,R Dravid,Ms Dhoni,Sp Goswami,Ms Dhoni,1988-06-06
18737,54833700132,548337,132,Sp Goswami,5/18/1989,Left-hand Bat,N/a,India,Keeper,Rajasthan Royals,Chennai Super Kings,2012,0,23,0,Blank,Blank,R Dravid,Ms Dhoni,Sp Goswami,Ms Dhoni,1989-05-18
18738,54833700196,548337,196,A Singh,6/21/1981,Right-hand Bat,Right-arm Medium-fast,India,Player,Rajasthan Royals,Chennai Super Kings,2012,0,31,0,Blank,Blank,R Dravid,Ms Dhoni,Sp Goswami,Ms Dhoni,1981-06-21
18739,54833700204,548337,204,Oa Shah,10/22/1978,Right-hand Bat,Right-arm Offbreak,England,Player,Rajasthan Royals,Chennai Super Kings,2012,0,34,0,Blank,Blank,R Dravid,Ms Dhoni,Sp Goswami,Ms Dhoni,1978-10-22
18741,54833700266,548337,266,Al Menaria,10/29/1990,Left-hand Bat,Slow Left-arm Orthodox,India,Player,Rajasthan Royals,Chennai Super Kings,2012,0,22,0,Blank,Blank,R Dravid,Ms Dhoni,Sp Goswami,Ms Dhoni,1990-10-29
18743,54833700316,548337,316,Gb Hogg,2/6/1971,Left-hand Bat,Slow Left-arm Chinaman,Australia,Player,Rajasthan Royals,Chennai Super Kings,2012,0,41,0,Blank,Blank,R Dravid,Ms Dhoni,Sp Goswami,Ms Dhoni,1971-02-06
18745,54833800041,548338,41,V Sehwag,10/20/1978,Right-hand Bat,Right-arm Offbreak,India,Captain,Delhi Daredevils,Pune Warriors,2012,0,34,0,Blank,Blank,V Sehwag,Sc Ganguly,Nv Ojha,Rv Uthappa,1978-10-20
18746,54833800052,548338,52,Lrpl Taylor,3/8/1984,Right-hand Bat,Right-arm Offbreak,New Zealand,Player,Delhi Daredevils,Pune Warriors,2012,0,28,0,Blank,Blank,V Sehwag,Sc Ganguly,Nv Ojha,Rv Uthappa,1984-03-08
18747,54833800064,548338,64,Dpmd Jayawardene,5/27/1977,Right-hand Bat,Right-arm Medium,Sri Lanka,Player,Delhi Daredevils,Pune Warriors,2012,0,35,0,Blank,Blank,V Sehwag,Sc Ganguly,Nv Ojha,Rv Uthappa,1977-05-27
18749,54833800183,548338,183,Nv Ojha,7/20/1983,Right-hand Bat,N/a,India,Keeper,Delhi Daredevils,Pune Warriors,2012,0,29,0,Blank,Blank,V Sehwag,Sc Ganguly,Nv Ojha,Rv Uthappa,1983-07-20
18752,54833800232,548338,232,Ut Yadav,10/25/1987,Right-hand Bat,Right-arm Fast-medium,India,Player,Delhi Daredevils,Pune Warriors,2012,0,25,0,Blank,Blank,V Sehwag,Sc Ganguly,Nv Ojha,Rv Uthappa,1987-10-25
18758,54833800083,548338,83,M Kartik,9/11/1976,Left-hand Bat,Slow Left-arm Orthodox,India,Player,Pune Warriors,Delhi Daredevils,2012,0,36,1,Blank,Blank,Sc Ganguly,V Sehwag,Rv Uthappa,Nv Ojha,1976-09-11
18763,54833800235,548338,235,R Sharma,4/30/1987,Right-hand Bat,Right-arm Offbreak,India,Player,Pune Warriors,Delhi Daredevils,2012,0,25,1,Blank,Blank,Sc Ganguly,V Sehwag,Rv Uthappa,Nv Ojha,1987-04-30
18767,54833900057,548339,57,Rg Sharma,4/30/1987,Right-hand Bat,Right-arm Offbreak,India,Player,Mumbai Indians,Kings Xi Punjab,2012,0,25,0,Blank,Blank,Harbhajan Singh,Dj Hussey,Kd Karthik,N Saini,1987-04-30
18773,54833900208,548339,208,At Rayudu,9/23/1985,Right-hand Bat,Right-arm Offbreak,India,Player,Mumbai Indians,Kings Xi Punjab,2012,0,27,0,Blank,Blank,Harbhajan Singh,Dj Hussey,Kd Karthik,N Saini,1985-09-23
18776,54833900280,548339,280,Nltc Perera,4/3/1989,Left-hand Bat,Right-arm Medium-fast,Sri Lanka,Player,Mumbai Indians,Kings Xi Punjab,2012,0,23,0,Blank,Blank,Harbhajan Singh,Dj Hussey,Kd Karthik,N Saini,1989-04-03
18778,54833900014,548339,14,P Kumar,10/2/1986,Right-hand Bat,Right-arm Medium,India,Player,Kings Xi Punjab,Mumbai Indians,2012,0,26,1,Blank,Blank,Dj Hussey,Harbhajan Singh,N Saini,Kd Karthik,1986-10-02
18780,54833900100,548339,100,Se Marsh,7/9/1983,Left-hand Bat,Slow Left-arm Orthodox,Australia,Player,Kings Xi Punjab,Mumbai Indians,2012,1,29,1,Blank,Blank,Dj Hussey,Harbhajan Singh,N Saini,Kd Karthik,1983-07-09
18785,54833900320,548339,320,Da Miller,6/10/1989,Left-hand Bat,Right-arm Offbreak,South Africa,Player,Kings Xi Punjab,Mumbai Indians,2012,0,23,1,Blank,Blank,Dj Hussey,Harbhajan Singh,N Saini,Kd Karthik,1989-06-10
18787,54833900333,548339,333,P Awana,7/19/1986,Right-hand Bat,Right-arm Medium,India,Player,Kings Xi Punjab,Mumbai Indians,2012,0,26,1,Blank,Blank,Dj Hussey,Harbhajan Singh,N Saini,Kd Karthik,1986-07-19
18788,54834000002,548340,2,Bb Mccullum,9/27/1981,Right-hand Bat,Right-arm Medium,New Zealand,Player,Kolkata Knight Riders,Deccan Chargers,2012,0,31,1,Blank,Blank,G Gambhir,Kc Sangakkara,Ms Bisla,Pa Patel,1981-09-27
18789,54834000009,548340,9,Jh Kallis,10/16/1975,Right-hand Bat,Right-arm Fast-medium,South Africa,Player,Kolkata Knight Riders,Deccan Chargers,2012,0,37,1,Blank,Blank,G Gambhir,Kc Sangakkara,Ms Bisla,Pa Patel,1975-10-16
18790,54834000031,548340,31,Yk Pathan,11/17/1982,Right-hand Bat,Right-arm Offbreak,India,Player,Kolkata Knight Riders,Deccan Chargers,2012,0,30,1,Blank,Blank,G Gambhir,Kc Sangakkara,Ms Bisla,Pa Patel,1982-11-17
18802,54834000042,548340,42,S Dhawan,12/5/1985,Left-hand Bat,Right-arm Offbreak,India,Player,Deccan Chargers,Kolkata Knight Riders,2012,0,27,0,Blank,Blank,Kc Sangakkara,G Gambhir,Pa Patel,Ms Bisla,1985-12-05
18803,54834000094,548340,94,Dw Steyn,6/27/1983,Right-hand Bat,Right-arm Fast,South Africa,Player,Deccan Chargers,Kolkata Knight Riders,2012,0,29,0,Blank,Blank,Kc Sangakkara,G Gambhir,Pa Patel,Ms Bisla,1983-06-27
18808,54834000326,548340,326,V Pratap Singh,5/3/1992,Right-hand Bat,Right-arm Medium,India,Player,Deccan Chargers,Kolkata Knight Riders,2012,0,20,0,Blank,Blank,Kc Sangakkara,G Gambhir,Pa Patel,Ms Bisla,1992-05-03
18813,54834100081,548341,81,R Vinay Kumar,2/12/1984,Right-hand Bat,Right-arm Medium,India,Player,Royal Challengers Bangalore,Rajasthan Royals,2012,0,28,1,Blank,Blank,Dl Vettori,R Dravid,Ab De Villiers,Sp Goswami,1984-02-12
18817,54834100175,548341,175,Dl Vettori,1/27/1979,Left-hand Bat,Slow Left-arm Orthodox,New Zealand,Captain,Royal Challengers Bangalore,Rajasthan Royals,2012,0,33,1,Blank,Blank,Dl Vettori,R Dravid,Ab De Villiers,Sp Goswami,1979-01-27
18825,54834100104,548341,104,Bj Hodge,12/29/1974,Right-hand Bat,Right-arm Offbreak,Australia,Player,Rajasthan Royals,Royal Challengers Bangalore,2012,0,38,0,Blank,Blank,R Dravid,Dl Vettori,Sp Goswami,Ab De Villiers,1974-12-29
18826,54834100132,548341,132,Sp Goswami,5/18/1989,Left-hand Bat,N/a,India,Keeper,Rajasthan Royals,Royal Challengers Bangalore,2012,0,23,0,Blank,Blank,R Dravid,Dl Vettori,Sp Goswami,Ab De Villiers,1989-05-18
18830,54834100316,548341,316,Gb Hogg,2/6/1971,Left-hand Bat,Slow Left-arm Chinaman,Australia,Player,Rajasthan Royals,Royal Challengers Bangalore,2012,0,41,0,Blank,Blank,R Dravid,Dl Vettori,Sp Goswami,Ab De Villiers,1971-02-06
18832,54834200029,548342,29,Ik Pathan,10/27/1984,Left-hand Bat,Left-arm Medium-fast,India,Player,Delhi Daredevils,Pune Warriors,2012,0,28,1,Blank,Blank,V Sehwag,Sc Ganguly,Nv Ojha,Rv Uthappa,1984-10-27
18833,54834200041,548342,41,V Sehwag,10/20/1978,Right-hand Bat,Right-arm Offbreak,India,Captain,Delhi Daredevils,Pune Warriors,2012,1,34,1,Blank,Blank,V Sehwag,Sc Ganguly,Nv Ojha,Rv Uthappa,1978-10-20
18835,54834200064,548342,64,Dpmd Jayawardene,5/27/1977,Right-hand Bat,Right-arm Medium,Sri Lanka,Player,Delhi Daredevils,Pune Warriors,2012,0,35,1,Blank,Blank,V Sehwag,Sc Ganguly,Nv Ojha,Rv Uthappa,1977-05-27
18837,54834200183,548342,183,Nv Ojha,7/20/1983,Right-hand Bat,N/a,India,Keeper,Delhi Daredevils,Pune Warriors,2012,0,29,1,Blank,Blank,V Sehwag,Sc Ganguly,Nv Ojha,Rv Uthappa,1983-07-20
18839,54834200199,548342,199,Y Nagar,1/6/1990,Right-hand Bat,Right-arm Offbreak,India,Player,Delhi Daredevils,Pune Warriors,2012,0,22,1,Blank,Blank,V Sehwag,Sc Ganguly,Nv Ojha,Rv Uthappa,1990-01-06
