player_match_sk,playermatch_key,match_id,player_id,player_name,dob,batting_hand,bowling_skill,country_name,role_desc,player_team,opposit_team,season_year,is_manofthematch,age_as_on_match,isplayers_team_won,batting_status,bowling_status,player_captain,opposit_captain,player_keeper,opposit_keeper,dob_cleaned
-1,-1.0000000000,-1,-1,N/a,,Blank,Blank,Blank,Blank,Blank,Blank,,,,,Blank,Blank,Blank,Blank,Blank,Blank,
12694,,335987,6,R Dravid,1/11/1973,Right-hand Bat,Right-arm Offbreak,India,Captain,Royal Challengers Bangalore,Kolkata Knight Riders,2008,,35,,Blank,Blank,R Dravid,Sc Ganguly,Mv Boucher,Wp Saha,1973-01-11
12702,,335987,14,P Kumar,10/2/1986,Right-hand Bat,Right-arm Medium,India,Player,Royal Challengers Bangalore,Kolkata Knight Riders,2008,,22,,Blank,Blank,R Dravid,Sc Ganguly,Mv Boucher,Wp Saha,1986-10-02
12704,,335987,16,Sb Joshi,6/6/1970,Left-hand Bat,Slow Left-arm Orthodox,India,Player,Royal Challengers Bangalore,Kolkata Knight Riders,2008,,38,,Blank,Blank,R Dravid,Sc Ganguly,Mv Boucher,Wp Saha,1970-06-06
12705,,335987,1,Sc Ganguly,7/8/1972,Left-hand Bat,Right-arm Medium,India,Captain,Kolkata Knight Riders,Royal Challengers Bangalore,2008,,36,,Blank,Blank,Sc Ganguly,R Dravid,Wp Saha,Mv Boucher,1972-07-08
12706,,335987,2,Bb Mccullum,9/27/1981,Right-hand Bat,Right-arm Medium,New Zealand,Player,Kolkata Knight Riders,Royal Challengers Bangalore,2008,,27,,Blank,Blank,Sc Ganguly,R Dravid,Wp Saha,Mv Boucher,1981-09-27
12708,,335987,4,Dj Hussey,7/15/1977,Right-hand Bat,Right-arm Offbreak,Australia,Player,Kolkata Knight Riders,Royal Challengers Bangalore,2008,,31,,Blank,Blank,Sc Ganguly,R Dravid,Wp Saha,Mv Boucher,1977-07-15
12709,,335987,5,Mohammad Hafeez,10/17/1980,Right-hand Bat,Right-arm Offbreak,Pakistan,Player,Kolkata Knight Riders,Royal Challengers Bangalore,2008,,28,,Blank,Blank,Sc Ganguly,R Dravid,Wp Saha,Mv Boucher,1980-10-17
12711,,335987,63,Lr Shukla,5/6/1981,Right-hand Bat,Right-arm Medium,India,Player,Kolkata Knight Riders,Royal Challengers Bangalore,2008,,27,,Blank,Blank,Sc Ganguly,R Dravid,Wp Saha,Mv Boucher,1981-05-06
12712,,335987,82,Ab Agarkar,12/4/1977,Right-hand Bat,Right-arm Fast,India,Player,Kolkata Knight Riders,Royal Challengers Bangalore,2008,,31,,Blank,Blank,Sc Ganguly,R Dravid,Wp Saha,Mv Boucher,1977-12-04
12713,,335987,83,M Kartik,9/11/1976,Left-hand Bat,Slow Left-arm Orthodox,India,Player,Kolkata Knight Riders,Royal Challengers Bangalore,2008,,32,,Blank,Blank,Sc Ganguly,R Dravid,Wp Saha,Mv Boucher,1976-09-11
12715,,335987,106,Ab Dinda,3/25/1984,Right-hand Bat,Right-arm Medium-fast,India,Player,Kolkata Knight Riders,Royal Challengers Bangalore,2008,,24,,Blank,Blank,Sc Ganguly,R Dravid,Wp Saha,Mv Boucher,1984-03-25
12717,,335988,25,Jr Hopes,10/24/1978,Right-hand Bat,Right-arm Medium,Australia,Player,Kings Xi Punjab,Chennai Super Kings,2008,,30,,Blank,Blank,Yuvraj Singh,Ms Dhoni,Kc Sangakkara,Ms Dhoni,1978-10-24
12719,,335988,27,Yuvraj Singh,12/12/1981,Left-hand Bat,Slow Left-arm Orthodox,India,Captain,Kings Xi Punjab,Chennai Super Kings,2008,,27,,Blank,Blank,Yuvraj Singh,Ms Dhoni,Kc Sangakkara,Ms Dhoni,1981-12-12
12722,,335988,66,B Lee,11/8/1976,Right-hand Bat,Right-arm Fast,Australia,Player,Kings Xi Punjab,Chennai Super Kings,2008,,32,,Blank,Blank,Yuvraj Singh,Ms Dhoni,Kc Sangakkara,Ms Dhoni,1976-11-08
12723,,335988,67,Pp Chawla,12/24/1988,Left-hand Bat,Legbreak,India,Player,Kings Xi Punjab,Chennai Super Kings,2008,,20,,Blank,Blank,Yuvraj Singh,Ms Dhoni,Kc Sangakkara,Ms Dhoni,1988-12-24
12725,,335988,77,S Sreesanth,2/6/1983,Right-hand Bat,Right-arm Fast-medium,India,Player,Kings Xi Punjab,Chennai Super Kings,2008,,25,,Blank,Blank,Yuvraj Singh,Ms Dhoni,Kc Sangakkara,Ms Dhoni,1983-02-06
12727,,335988,17,Pa Patel,3/9/1985,Left-hand Bat,N/a,India,Player,Chennai Super Kings,Kings Xi Punjab,2008,,23,,Blank,Blank,Ms Dhoni,Yuvraj Singh,Ms Dhoni,Kc Sangakkara,1985-03-09
12729,,335988,19,Mek Hussey,5/27/1975,Left-hand Bat,Right-arm Medium,Australia,Player,Chennai Super Kings,Kings Xi Punjab,2008,,33,,Blank,Blank,Ms Dhoni,Yuvraj Singh,Ms Dhoni,Kc Sangakkara,1975-05-27
12731,,335988,21,Sk Raina,11/27/1986,Left-hand Bat,Right-arm Offbreak,India,Player,Chennai Super Kings,Kings Xi Punjab,2008,,22,,Blank,Blank,Ms Dhoni,Yuvraj Singh,Ms Dhoni,Kc Sangakkara,1986-11-27
12737,,335988,435,P Amarnath,6/1/1982,Right-hand Bat,Right-arm Medium,India,Player,Chennai Super Kings,Kings Xi Punjab,2008,,26,,Blank,Blank,Ms Dhoni,Yuvraj Singh,Ms Dhoni,Kc Sangakkara,1982-06-01
12738,,335989,40,G Gambhir,10/14/1981,Left-hand Bat,Legbreak,India,Player,Delhi Daredevils,Rajasthan Royals,2008,,27,,Blank,Blank,V Sehwag,Sk Warne,Kd Karthik,M Rawat,1981-10-14
12743,,335989,89,R Bhatia,10/22/1979,Right-hand Bat,Right-arm Medium-fast,India,Player,Delhi Daredevils,Rajasthan Royals,2008,,29,,Blank,Blank,V Sehwag,Sk Warne,Kd Karthik,M Rawat,1979-10-22
12744,,335989,90,Mf Maharoof,9/7/1984,Right-hand Bat,Right-arm Fast-medium,India,Player,Delhi Daredevils,Rajasthan Royals,2008,,24,,Blank,Blank,V Sehwag,Sk Warne,Kd Karthik,M Rawat,1984-09-07
12749,,335989,30,T Kohli,12/17/1988,Right-hand Bat,Right-arm Medium,India,Player,Rajasthan Royals,Delhi Daredevils,2008,,20,,Blank,Blank,Sk Warne,V Sehwag,M Rawat,Kd Karthik,1988-12-17
12750,,335989,31,Yk Pathan,11/17/1982,Right-hand Bat,Right-arm Offbreak,India,Player,Rajasthan Royals,Delhi Daredevils,2008,,26,,Blank,Blank,Sk Warne,V Sehwag,M Rawat,Kd Karthik,1982-11-17
12751,,335989,32,Sr Watson,6/17/1981,Right-hand Bat,Right-arm Fast-medium,Australia,Player,Rajasthan Royals,Delhi Daredevils,2008,,27,,Blank,Blank,Sk Warne,V Sehwag,M Rawat,Kd Karthik,1981-06-17
12755,,335989,36,M Rawat,10/25/1985,Right-hand Bat,N/a,India,Keeper,Rajasthan Royals,Delhi Daredevils,2008,,23,,Blank,Blank,Sk Warne,V Sehwag,M Rawat,Kd Karthik,1985-10-25
12757,,335989,38,Sk Warne,9/13/1969,Right-hand Bat,Legbreak Googly,Australia,Captain,Rajasthan Royals,Delhi Daredevils,2008,,39,,Blank,Blank,Sk Warne,V Sehwag,M Rawat,Kd Karthik,1969-09-13
12761,,335990,44,St Jayasuriya,6/30/1969,Left-hand Bat,Slow Left-arm Orthodox,Sri Lanka,Player,Mumbai Indians,Royal Challengers Bangalore,2008,,39,,Blank,Blank,Harbhajan Singh,R Dravid,L Ronchi,Mv Boucher,1969-06-30
12762,,335990,45,Dj Thornely,10/1/1978,Right-hand Bat,Right-arm Medium,Australia,Player,Mumbai Indians,Royal Challengers Bangalore,2008,,30,,Blank,Blank,Harbhajan Singh,R Dravid,L Ronchi,Mv Boucher,1978-10-01
12765,,335990,48,Am Nayar,10/8/1983,Left-hand Bat,Right-arm Medium,India,Player,Mumbai Indians,Royal Challengers Bangalore,2008,,25,,Blank,Blank,Harbhajan Singh,R Dravid,L Ronchi,Mv Boucher,1983-10-08
12766,,335990,49,Sm Pollock,7/16/1973,Right-hand Bat,Right-arm Fast-medium,South Africa,Player,Mumbai Indians,Royal Challengers Bangalore,2008,,35,,Blank,Blank,Harbhajan Singh,R Dravid,L Ronchi,Mv Boucher,1973-07-16
12767,,335990,50,Harbhajan Singh,7/3/1980,Right-hand Bat,Right-arm Offbreak,India,Captain,Mumbai Indians,Royal Challengers Bangalore,2008,,28,,Blank,Blank,Harbhajan Singh,R Dravid,L Ronchi,Mv Boucher,1980-07-03
12768,,335990,72,Ma Khote,4/22/1980,Right-hand Bat,Right-arm Medium,India,Player,Mumbai Indians,Royal Challengers Bangalore,2008,,28,,Blank,Blank,Harbhajan Singh,R Dravid,L Ronchi,Mv Boucher,1980-04-22
12770,,335990,80,Ds Kulkarni,12/10/1988,Right-hand Bat,Right-arm Medium,India,Player,Mumbai Indians,Royal Challengers Bangalore,2008,,20,,Blank,Blank,Harbhajan Singh,R Dravid,L Ronchi,Mv Boucher,1988-12-10
12775,,335990,12,B Akhil,10/7/1977,Right-hand Bat,Right-arm Medium-fast,India,Player,Royal Challengers Bangalore,Mumbai Indians,2008,,31,,Blank,Blank,R Dravid,Harbhajan Singh,Mv Boucher,L Ronchi,1977-10-07
12777,,335990,15,Z Khan,10/7/1978,Right-hand Bat,Left-arm Fast-medium,India,Player,Royal Challengers Bangalore,Mumbai Indians,2008,,30,,Blank,Blank,R Dravid,Harbhajan Singh,Mv Boucher,L Ronchi,1978-10-07
12780,,335990,52,Lrpl Taylor,3/8/1984,Right-hand Bat,Right-arm Offbreak,New Zealand,Player,Royal Challengers Bangalore,Mumbai Indians,2008,,24,,Blank,Blank,R Dravid,Harbhajan Singh,Mv Boucher,L Ronchi,1984-03-08
12782,,335991,53,Ac Gilchrist,11/14/1971,Left-hand Bat,Right-arm Offbreak,Australia,Keeper,Deccan Chargers,Kolkata Knight Riders,2008,,37,,Blank,Blank,Vvs Laxman,Sc Ganguly,Ac Gilchrist,Wp Saha,1971-11-14
12791,,335991,131,Pp Ojha,9/5/1986,Left-hand Bat,Slow Left-arm Orthodox,India,Player,Deccan Chargers,Kolkata Knight Riders,2008,,22,,Blank,Blank,Vvs Laxman,Sc Ganguly,Ac Gilchrist,Wp Saha,1986-09-05
12796,,335991,4,Dj Hussey,7/15/1977,Right-hand Bat,Right-arm Offbreak,Australia,Player,Kolkata Knight Riders,Deccan Chargers,2008,,31,,Blank,Blank,Sc Ganguly,Vvs Laxman,Wp Saha,Ac Gilchrist,1977-07-15
12797,,335991,5,Mohammad Hafeez,10/17/1980,Right-hand Bat,Right-arm Offbreak,Pakistan,Player,Kolkata Knight Riders,Deccan Chargers,2008,,28,,Blank,Blank,Sc Ganguly,Vvs Laxman,Wp Saha,Ac Gilchrist,1980-10-17
12799,,335991,63,Lr Shukla,5/6/1981,Right-hand Bat,Right-arm Medium,India,Player,Kolkata Knight Riders,Deccan Chargers,2008,,27,,Blank,Blank,Sc Ganguly,Vvs Laxman,Wp Saha,Ac Gilchrist,1981-05-06
12801,,335991,83,M Kartik,9/11/1976,Left-hand Bat,Slow Left-arm Orthodox,India,Player,Kolkata Knight Riders,Deccan Chargers,2008,,32,,Blank,Blank,Sc Ganguly,Vvs Laxman,Wp Saha,Ac Gilchrist,1976-09-11
12804,,335992,31,Yk Pathan,11/17/1982,Right-hand Bat,Right-arm Offbreak,India,Player,Rajasthan Royals,Kings Xi Punjab,2008,,26,,Blank,Blank,Sk Warne,Yuvraj Singh,Kamran Akmal,Kc Sangakkara,1982-11-17
12806,,335992,33,M Kaif,12/1/1980,Right-hand Bat,Right-arm Offbreak,India,Player,Rajasthan Royals,Kings Xi Punjab,2008,,28,,Blank,Blank,Sk Warne,Yuvraj Singh,Kamran Akmal,Kc Sangakkara,1980-12-01
12808,,335992,35,Ra Jadeja,12/6/1988,Left-hand Bat,Slow Left-arm Orthodox,India,Player,Rajasthan Royals,Kings Xi Punjab,2008,,20,,Blank,Blank,Sk Warne,Yuvraj Singh,Kamran Akmal,Kc Sangakkara,1988-12-06
12815,,335992,24,K Goel,12/24/1986,Left-hand Bat,Right-arm Offbreak,India,Player,Kings Xi Punjab,Rajasthan Royals,2008,,22,,Blank,Blank,Yuvraj Singh,Sk Warne,Kc Sangakkara,Kamran Akmal,1986-12-24
12817,,335992,26,Kc Sangakkara,10/27/1977,Left-hand Bat,Right-arm Offbreak,Sri Lanka,Keeper,Kings Xi Punjab,Rajasthan Royals,2008,,31,,Blank,Blank,Yuvraj Singh,Sk Warne,Kc Sangakkara,Kamran Akmal,1977-10-27
12821,,335992,65,S Sohal,11/10/1987,Right-hand Bat,Legbreak,India,Player,Kings Xi Punjab,Rajasthan Royals,2008,,21,,Blank,Blank,Yuvraj Singh,Sk Warne,Kc Sangakkara,Kamran Akmal,1987-11-10
12824,,335992,68,Wa Mota,9/20/1981,Right-hand Bat,Right-arm Medium,India,Player,Kings Xi Punjab,Rajasthan Royals,2008,,27,,Blank,Blank,Yuvraj Singh,Sk Warne,Kc Sangakkara,Kamran Akmal,1981-09-20
12827,,335993,54,Y Venugopal Rao,2/26/1982,Right-hand Bat,Right-arm Offbreak,India,Player,Deccan Chargers,Delhi Daredevils,2008,,26,,Blank,Blank,Vvs Laxman,V Sehwag,Ac Gilchrist,Kd Karthik,1982-02-26
12828,,335993,55,Vvs Laxman,11/1/1974,Right-hand Bat,Right-arm Offbreak,India,Captain,Deccan Chargers,Delhi Daredevils,2008,,34,,Blank,Blank,Vvs Laxman,V Sehwag,Ac Gilchrist,Kd Karthik,1974-11-01
12830,,335993,57,Rg Sharma,4/30/1987,Right-hand Bat,Right-arm Offbreak,India,Player,Deccan Chargers,Delhi Daredevils,2008,,21,,Blank,Blank,Vvs Laxman,V Sehwag,Ac Gilchrist,Kd Karthik,1987-04-30
12834,,335993,70,Shahid Afridi,3/1/1980,Right-hand Bat,Legbreak Googly,Pakistan,Player,Deccan Chargers,Delhi Daredevils,2008,,28,,Blank,Blank,Vvs Laxman,V Sehwag,Ac Gilchrist,Kd Karthik,1980-03-01
12836,,335993,232,Ut Yadav,10/25/1987,Right-hand Bat,Right-arm Fast-medium,India,Player,Deccan Chargers,Delhi Daredevils,2008,,21,,Blank,Blank,Vvs Laxman,V Sehwag,Ac Gilchrist,Kd Karthik,1987-10-25
12837,,335993,40,G Gambhir,10/14/1981,Left-hand Bat,Legbreak,India,Player,Delhi Daredevils,Deccan Chargers,2008,,27,,Blank,Blank,V Sehwag,Vvs Laxman,Kd Karthik,Ac Gilchrist,1981-10-14
12839,,335993,42,S Dhawan,12/5/1985,Left-hand Bat,Right-arm Offbreak,India,Player,Delhi Daredevils,Deccan Chargers,2008,,23,,Blank,Blank,V Sehwag,Vvs Laxman,Kd Karthik,Ac Gilchrist,1985-12-05
12841,,335993,87,Mk Tiwary,11/14/1985,Right-hand Bat,Legbreak Googly,India,Player,Delhi Daredevils,Deccan Chargers,2008,,23,,Blank,Blank,V Sehwag,Vvs Laxman,Kd Karthik,Ac Gilchrist,1985-11-14
12849,,335994,44,St Jayasuriya,6/30/1969,Left-hand Bat,Slow Left-arm Orthodox,Sri Lanka,Player,Mumbai Indians,Chennai Super Kings,2008,,39,,Blank,Blank,Harbhajan Singh,Ms Dhoni,L Ronchi,Ms Dhoni,1969-06-30
12850,,335994,46,Rv Uthappa,11/11/1985,Right-hand Bat,Right-arm Medium,India,Player,Mumbai Indians,Chennai Super Kings,2008,,23,,Blank,Blank,Harbhajan Singh,Ms Dhoni,L Ronchi,Ms Dhoni,1985-11-11
12853,,335994,50,Harbhajan Singh,7/3/1980,Right-hand Bat,Right-arm Offbreak,India,Captain,Mumbai Indians,Chennai Super Kings,2008,,28,,Blank,Blank,Harbhajan Singh,Ms Dhoni,L Ronchi,Ms Dhoni,1980-07-03
12854,,335994,71,Dj Bravo,10/7/1983,Right-hand Bat,Right-arm Medium-fast,West Indies,Player,Mumbai Indians,Chennai Super Kings,2008,,25,,Blank,Blank,Harbhajan Singh,Ms Dhoni,L Ronchi,Ms Dhoni,1983-10-07
12857,,335994,80,Ds Kulkarni,12/10/1988,Right-hand Bat,Right-arm Medium,India,Player,Mumbai Indians,Chennai Super Kings,2008,,20,,Blank,Blank,Harbhajan Singh,Ms Dhoni,L Ronchi,Ms Dhoni,1988-12-10
12859,,335994,17,Pa Patel,3/9/1985,Left-hand Bat,N/a,India,Player,Chennai Super Kings,Mumbai Indians,2008,,23,,Blank,Blank,Ms Dhoni,Harbhajan Singh,Ms Dhoni,L Ronchi,1985-03-09
12861,,335994,19,Mek Hussey,5/27/1975,Left-hand Bat,Right-arm Medium,Australia,Player,Chennai Super Kings,Mumbai Indians,2008,,33,,Blank,Blank,Ms Dhoni,Harbhajan Singh,Ms Dhoni,L Ronchi,1975-05-27
12862,,335994,20,Ms Dhoni,7/7/1981,Right-hand Bat,Right-arm Medium,India,Captainkeeper,Chennai Super Kings,Mumbai Indians,2008,,27,,Blank,Blank,Ms Dhoni,Harbhajan Singh,Ms Dhoni,L Ronchi,1981-07-07
12863,,335994,21,Sk Raina,11/27/1986,Left-hand Bat,Right-arm Offbreak,India,Player,Chennai Super Kings,Mumbai Indians,2008,,22,,Blank,Blank,Ms Dhoni,Harbhajan Singh,Ms Dhoni,L Ronchi,1986-11-27
12865,,335994,23,S Badrinath,8/30/1980,Right-hand Bat,Right-arm Offbreak,India,Player,Chennai Super Kings,Mumbai Indians,2008,,28,,Blank,Blank,Ms Dhoni,Harbhajan Singh,Ms Dhoni,L Ronchi,1980-08-30
12867,,335994,120,Ms Gony,1/4/1984,Right-hand Bat,Right-arm Medium,India,Player,Chennai Super Kings,Mumbai Indians,2008,,24,,Blank,Blank,Ms Dhoni,Harbhajan Singh,Ms Dhoni,L Ronchi,1984-01-04
12868,,335994,121,M Muralitharan,4/17/1972,Right-hand Bat,Right-arm Offbreak,Sri Lanka,Player,Chennai Super Kings,Mumbai Indians,2008,,36,,Blank,Blank,Ms Dhoni,Harbhajan Singh,Ms Dhoni,L Ronchi,1972-04-17
12870,,335995,53,Ac Gilchrist,11/14/1971,Left-hand Bat,Right-arm Offbreak,Australia,Keeper,Deccan Chargers,Rajasthan Royals,2008,,37,,Blank,Blank,Vvs Laxman,Sk Warne,Ac Gilchrist,Kamran Akmal,1971-11-14
12871,,335995,55,Vvs Laxman,11/1/1974,Right-hand Bat,Right-arm Offbreak,India,Captain,Deccan Chargers,Rajasthan Royals,2008,,34,,Blank,Blank,Vvs Laxman,Sk Warne,Ac Gilchrist,Kamran Akmal,1974-11-01
12873,,335995,57,Rg Sharma,4/30/1987,Right-hand Bat,Right-arm Offbreak,India,Player,Deccan Chargers,Rajasthan Royals,2008,,21,,Blank,Blank,Vvs Laxman,Sk Warne,Ac Gilchrist,Kamran Akmal,1987-04-30
12875,,335995,60,Wpujc Vaas,1/27/1974,Left-hand Bat,Left-arm Fast-medium,Sri Lanka,Player,Deccan Chargers,Rajasthan Royals,2008,,34,,Blank,Blank,Vvs Laxman,Sk Warne,Ac Gilchrist,Kamran Akmal,1974-01-27
12877,,335995,70,Shahid Afridi,3/1/1980,Right-hand Bat,Legbreak Googly,Pakistan,Player,Deccan Chargers,Rajasthan Royals,2008,,28,,Blank,Blank,Vvs Laxman,Sk Warne,Ac Gilchrist,Kamran Akmal,1980-03-01
12879,,335995,131,Pp Ojha,9/5/1986,Left-hand Bat,Slow Left-arm Orthodox,India,Player,Deccan Chargers,Rajasthan Royals,2008,,22,,Blank,Blank,Vvs Laxman,Sk Warne,Ac Gilchrist,Kamran Akmal,1986-09-05
12880,,335995,232,Ut Yadav,10/25/1987,Right-hand Bat,Right-arm Fast-medium,India,Player,Deccan Chargers,Rajasthan Royals,2008,,21,,Blank,Blank,Vvs Laxman,Sk Warne,Ac Gilchrist,Kamran Akmal,1987-10-25
12881,,335995,31,Yk Pathan,11/17/1982,Right-hand Bat,Right-arm Offbreak,India,Player,Rajasthan Royals,Deccan Chargers,2008,,26,,Blank,Blank,Sk Warne,Vvs Laxman,Kamran Akmal,Ac Gilchrist,1982-11-17
12882,,335995,32,Sr Watson,6/17/1981,Right-hand Bat,Right-arm Fast-medium,Australia,Player,Rajasthan Royals,Deccan Chargers,2008,,27,,Blank,Blank,Sk Warne,Vvs Laxman,Kamran Akmal,Ac Gilchrist,1981-06-17
12885,,335995,37,D Salunkhe,11/12/1982,Right-hand Bat,Legbreak,India,Player,Rajasthan Royals,Deccan Chargers,2008,,26,,Blank,Blank,Sk Warne,Vvs Laxman,Kamran Akmal,Ac Gilchrist,1982-11-12
12888,,335995,69,Kamran Akmal,1/13/1982,Right-hand Bat,N/a,Pakistan,Keeper,Rajasthan Royals,Deccan Chargers,2008,,26,,Blank,Blank,Sk Warne,Vvs Laxman,Kamran Akmal,Ac Gilchrist,1982-01-13
12889,,335995,74,Gc Smith,2/1/1981,Left-hand Bat,Right-arm Offbreak,South Africa,Player,Rajasthan Royals,Deccan Chargers,2008,,27,,Blank,Blank,Sk Warne,Vvs Laxman,Kamran Akmal,Ac Gilchrist,1981-02-01
12893,,335996,26,Kc Sangakkara,10/27/1977,Left-hand Bat,Right-arm Offbreak,Sri Lanka,Keeper,Kings Xi Punjab,Mumbai Indians,2008,,31,,Blank,Blank,Yuvraj Singh,Harbhajan Singh,Kc Sangakkara,L Ronchi,1977-10-27
12894,,335996,27,Yuvraj Singh,12/12/1981,Left-hand Bat,Slow Left-arm Orthodox,India,Captain,Kings Xi Punjab,Mumbai Indians,2008,,27,,Blank,Blank,Yuvraj Singh,Harbhajan Singh,Kc Sangakkara,L Ronchi,1981-12-12
12895,,335996,29,Ik Pathan,10/27/1984,Left-hand Bat,Left-arm Medium-fast,India,Player,Kings Xi Punjab,Mumbai Indians,2008,,24,,Blank,Blank,Yuvraj Singh,Harbhajan Singh,Kc Sangakkara,L Ronchi,1984-10-27
12896,,335996,64,Dpmd Jayawardene,5/27/1977,Right-hand Bat,Right-arm Medium,Sri Lanka,Player,Kings Xi Punjab,Mumbai Indians,2008,,31,,Blank,Blank,Yuvraj Singh,Harbhajan Singh,Kc Sangakkara,L Ronchi,1977-05-27
12903,,335996,43,L Ronchi,4/23/1981,Right-hand Bat,N/a,Australia,Keeper,Mumbai Indians,Kings Xi Punjab,2008,,27,,Blank,Blank,Harbhajan Singh,Yuvraj Singh,L Ronchi,Kc Sangakkara,1981-04-23
12904,,335996,44,St Jayasuriya,6/30/1969,Left-hand Bat,Slow Left-arm Orthodox,Sri Lanka,Player,Mumbai Indians,Kings Xi Punjab,2008,,39,,Blank,Blank,Harbhajan Singh,Yuvraj Singh,L Ronchi,Kc Sangakkara,1969-06-30
12909,,335996,71,Dj Bravo,10/7/1983,Right-hand Bat,Right-arm Medium-fast,West Indies,Player,Mumbai Indians,Kings Xi Punjab,2008,,25,,Blank,Blank,Harbhajan Singh,Yuvraj Singh,L Ronchi,Kc Sangakkara,1983-10-07
12910,,335996,72,Ma Khote,4/22/1980,Right-hand Bat,Right-arm Medium,India,Player,Mumbai Indians,Kings Xi Punjab,2008,,28,,Blank,Blank,Harbhajan Singh,Yuvraj Singh,L Ronchi,Kc Sangakkara,1980-04-22
12913,,335996,80,Ds Kulkarni,12/10/1988,Right-hand Bat,Right-arm Medium,India,Player,Mumbai Indians,Kings Xi Punjab,2008,,20,,Blank,Blank,Harbhajan Singh,Yuvraj Singh,L Ronchi,Kc Sangakkara,1988-12-10
12914,,335997,31,Yk Pathan,11/17/1982,Right-hand Bat,Right-arm Offbreak,India,Player,Rajasthan Royals,Royal Challengers Bangalore,2008,,26,,Blank,Blank,Sk Warne,R Dravid,M Rawat,Mv Boucher,1982-11-17
12917,,335997,35,Ra Jadeja,12/6/1988,Left-hand Bat,Slow Left-arm Orthodox,India,Player,Rajasthan Royals,Royal Challengers Bangalore,2008,,20,,Blank,Blank,Sk Warne,R Dravid,M Rawat,Mv Boucher,1988-12-06
12919,,335997,37,D Salunkhe,11/12/1982,Right-hand Bat,Legbreak,India,Player,Rajasthan Royals,Royal Challengers Bangalore,2008,,26,,Blank,Blank,Sk Warne,R Dravid,M Rawat,Mv Boucher,1982-11-12
12921,,335997,39,Sk Trivedi,9/4/1982,Right-hand Bat,Right-arm Medium,India,Player,Rajasthan Royals,Royal Challengers Bangalore,2008,,26,,Blank,Blank,Sk Warne,R Dravid,M Rawat,Mv Boucher,1982-09-04
12925,,335997,6,R Dravid,1/11/1973,Right-hand Bat,Right-arm Offbreak,India,Captain,Royal Challengers Bangalore,Rajasthan Royals,2008,,35,,Blank,Blank,R Dravid,Sk Warne,Mv Boucher,M Rawat,1973-01-11
12926,,335997,8,V Kohli,11/5/1988,Right-hand Bat,Right-arm Medium,India,Player,Royal Challengers Bangalore,Rajasthan Royals,2008,,20,,Blank,Blank,R Dravid,Sk Warne,Mv Boucher,M Rawat,1988-11-05
12929,,335997,14,P Kumar,10/2/1986,Right-hand Bat,Right-arm Medium,India,Player,Royal Challengers Bangalore,Rajasthan Royals,2008,,22,,Blank,Blank,R Dravid,Sk Warne,Mv Boucher,M Rawat,1986-10-02
12934,,335997,81,R Vinay Kumar,2/12/1984,Right-hand Bat,Right-arm Medium,India,Player,Royal Challengers Bangalore,Rajasthan Royals,2008,,24,,Blank,Blank,R Dravid,Sk Warne,Mv Boucher,M Rawat,1984-02-12
12935,,335997,124,A Kumble,10/17/1970,Right-hand Bat,Legbreak Googly,India,Player,Royal Challengers Bangalore,Rajasthan Royals,2008,,38,,Blank,Blank,R Dravid,Sk Warne,Mv Boucher,M Rawat,1970-10-17
12936,,335998,1,Sc Ganguly,7/8/1972,Left-hand Bat,Right-arm Medium,India,Captain,Kolkata Knight Riders,Chennai Super Kings,2008,,36,,Blank,Blank,Sc Ganguly,Ms Dhoni,Bb Mccullum,Ms Dhoni,1972-07-08
12937,,335998,2,Bb Mccullum,9/27/1981,Right-hand Bat,Right-arm Medium,New Zealand,Keeper,Kolkata Knight Riders,Chennai Super Kings,2008,,27,,Blank,Blank,Sc Ganguly,Ms Dhoni,Bb Mccullum,Ms Dhoni,1981-09-27
12940,,335998,5,Mohammad Hafeez,10/17/1980,Right-hand Bat,Right-arm Offbreak,Pakistan,Player,Kolkata Knight Riders,Chennai Super Kings,2008,,28,,Blank,Blank,Sc Ganguly,Ms Dhoni,Bb Mccullum,Ms Dhoni,1980-10-17
12943,,335998,82,Ab Agarkar,12/4/1977,Right-hand Bat,Right-arm Fast,India,Player,Kolkata Knight Riders,Chennai Super Kings,2008,,31,,Blank,Blank,Sc Ganguly,Ms Dhoni,Bb Mccullum,Ms Dhoni,1977-12-04
12946,,335998,106,Ab Dinda,3/25/1984,Right-hand Bat,Right-arm Medium-fast,India,Player,Kolkata Knight Riders,Chennai Super Kings,2008,,24,,Blank,Blank,Sc Ganguly,Ms Dhoni,Bb Mccullum,Ms Dhoni,1984-03-25
12948,,335998,18,Ml Hayden,10/29/1971,Left-hand Bat,Right-arm Medium,Australia,Player,Chennai Super Kings,Kolkata Knight Riders,2008,,37,,Blank,Blank,Ms Dhoni,Sc Ganguly,Ms Dhoni,Bb Mccullum,1971-10-29
12951,,335998,21,Sk Raina,11/27/1986,Left-hand Bat,Right-arm Offbreak,India,Player,Chennai Super Kings,Kolkata Knight Riders,2008,,22,,Blank,Blank,Ms Dhoni,Sc Ganguly,Ms Dhoni,Bb Mccullum,1986-11-27
12954,,335998,119,Joginder Sharma,10/23/1983,Right-hand Bat,Right-arm Fast-medium,India,Player,Chennai Super Kings,Kolkata Knight Riders,2008,,25,,Blank,Blank,Ms Dhoni,Sc Ganguly,Ms Dhoni,Bb Mccullum,1983-10-23
12955,,335998,120,Ms Gony,1/4/1984,Right-hand Bat,Right-arm Medium,India,Player,Chennai Super Kings,Kolkata Knight Riders,2008,,24,,Blank,Blank,Ms Dhoni,Sc Ganguly,Ms Dhoni,Bb Mccullum,1984-01-04
12956,,335998,121,M Muralitharan,4/17/1972,Right-hand Bat,Right-arm Offbreak,Sri Lanka,Player,Chennai Super Kings,Kolkata Knight Riders,2008,,36,,Blank,Blank,Ms Dhoni,Sc Ganguly,Ms Dhoni,Bb Mccullum,1972-04-17
12959,,335999,55,Vvs Laxman,11/1/1974,Right-hand Bat,Right-arm Offbreak,India,Captain,Deccan Chargers,Mumbai Indians,2008,,34,,Blank,Blank,Vvs Laxman,Sm Pollock,Ac Gilchrist,L Ronchi,1974-11-01
12961,,335999,57,Rg Sharma,4/30/1987,Right-hand Bat,Right-arm Offbreak,India,Player,Deccan Chargers,Mumbai Indians,2008,,21,,Blank,Blank,Vvs Laxman,Sm Pollock,Ac Gilchrist,L Ronchi,1987-04-30
12962,,335999,59,Sb Bangar,10/11/1972,Right-hand Bat,Right-arm Medium-fast,India,Player,Deccan Chargers,Mumbai Indians,2008,,36,,Blank,Blank,Vvs Laxman,Sm Pollock,Ac Gilchrist,L Ronchi,1972-10-11
12964,,335999,70,Shahid Afridi,3/1/1980,Right-hand Bat,Legbreak Googly,Pakistan,Player,Deccan Chargers,Mumbai Indians,2008,,28,,Blank,Blank,Vvs Laxman,Sm Pollock,Ac Gilchrist,L Ronchi,1980-03-01
12965,,335999,98,Dnt Zoysa,5/13/1978,Left-hand Bat,Left-arm Fast-medium,Sri Lanka,Player,Deccan Chargers,Mumbai Indians,2008,,30,,Blank,Blank,Vvs Laxman,Sm Pollock,Ac Gilchrist,L Ronchi,1978-05-13
12966,,335999,99,D Kalyankrishna,12/16/1983,Right-hand Bat,Right-arm Medium-fast,India,Player,Deccan Chargers,Mumbai Indians,2008,,25,,Blank,Blank,Vvs Laxman,Sm Pollock,Ac Gilchrist,L Ronchi,1983-12-16
12972,,335999,48,Am Nayar,10/8/1983,Left-hand Bat,Right-arm Medium,India,Player,Mumbai Indians,Deccan Chargers,2008,,25,,Blank,Blank,Sm Pollock,Vvs Laxman,L Ronchi,Ac Gilchrist,1983-10-08
12974,,335999,71,Dj Bravo,10/7/1983,Right-hand Bat,Right-arm Medium-fast,West Indies,Player,Mumbai Indians,Deccan Chargers,2008,,25,,Blank,Blank,Sm Pollock,Vvs Laxman,L Ronchi,Ac Gilchrist,1983-10-07
12978,,335999,85,Am Rahane,6/6/1988,Right-hand Bat,Right-arm Medium,India,Player,Mumbai Indians,Deccan Chargers,2008,,20,,Blank,Blank,Sm Pollock,Vvs Laxman,L Ronchi,Ac Gilchrist,1988-06-06
12980,,336000,24,K Goel,12/24/1986,Left-hand Bat,Right-arm Offbreak,India,Player,Kings Xi Punjab,Delhi Daredevils,2008,,22,,Blank,Blank,Yuvraj Singh,V Sehwag,Kc Sangakkara,Kd Karthik,1986-12-24
12981,,336000,26,Kc Sangakkara,10/27/1977,Left-hand Bat,Right-arm Offbreak,Sri Lanka,Keeper,Kings Xi Punjab,Delhi Daredevils,2008,,31,,Blank,Blank,Yuvraj Singh,V Sehwag,Kc Sangakkara,Kd Karthik,1977-10-27
12983,,336000,28,Sm Katich,8/21/1975,Left-hand Bat,Slow Left-arm Chinaman,Australia,Player,Kings Xi Punjab,Delhi Daredevils,2008,,33,,Blank,Blank,Yuvraj Singh,V Sehwag,Kc Sangakkara,Kd Karthik,1975-08-21
12986,,336000,66,B Lee,11/8/1976,Right-hand Bat,Right-arm Fast,Australia,Player,Kings Xi Punjab,Delhi Daredevils,2008,,32,,Blank,Blank,Yuvraj Singh,V Sehwag,Kc Sangakkara,Kd Karthik,1976-11-08
12989,,336000,78,Vrv Singh,9/17/1984,Right-hand Bat,Right-arm Medium-fast,India,Player,Kings Xi Punjab,Delhi Daredevils,2008,,24,,Blank,Blank,Yuvraj Singh,V Sehwag,Kc Sangakkara,Kd Karthik,1984-09-17
12992,,336000,41,V Sehwag,10/20/1978,Right-hand Bat,Right-arm Offbreak,India,Captain,Delhi Daredevils,Kings Xi Punjab,2008,,30,,Blank,Blank,V Sehwag,Yuvraj Singh,Kd Karthik,Kc Sangakkara,1978-10-20
12993,,336000,42,S Dhawan,12/5/1985,Left-hand Bat,Right-arm Offbreak,India,Player,Delhi Daredevils,Kings Xi Punjab,2008,,23,,Blank,Blank,V Sehwag,Yuvraj Singh,Kd Karthik,Kc Sangakkara,1985-12-05
12994,,336000,86,Shoaib Malik,2/1/1982,Right-hand Bat,Right-arm Offbreak,Pakistan,Player,Delhi Daredevils,Kings Xi Punjab,2008,,26,,Blank,Blank,V Sehwag,Yuvraj Singh,Kd Karthik,Kc Sangakkara,1982-02-01
12996,,336000,88,Kd Karthik,6/1/1985,Right-hand Bat,N/a,India,Keeper,Delhi Daredevils,Kings Xi Punjab,2008,,23,,Blank,Blank,V Sehwag,Yuvraj Singh,Kd Karthik,Kc Sangakkara,1985-06-01
12998,,336000,90,Mf Maharoof,9/7/1984,Right-hand Bat,Right-arm Fast-medium,India,Player,Delhi Daredevils,Kings Xi Punjab,2008,,24,,Blank,Blank,V Sehwag,Yuvraj Singh,Kd Karthik,Kc Sangakkara,1984-09-07
13000,,336000,117,Mohammad Asif,12/20/1982,Left-hand Bat,Right-arm Fast-medium,Pakistan,Player,Delhi Daredevils,Kings Xi Punjab,2008,,26,,Blank,Blank,V Sehwag,Yuvraj Singh,Kd Karthik,Kc Sangakkara,1982-12-20
13003,,336001,18,Ml Hayden,10/29/1971,Left-hand Bat,Right-arm Medium,Australia,Player,Chennai Super Kings,Royal Challengers Bangalore,2008,,37,,Blank,Blank,Ms Dhoni,R Dravid,Ms Dhoni,Mv Boucher,1971-10-29
13004,,336001,19,Mek Hussey,5/27/1975,Left-hand Bat,Right-arm Medium,Australia,Player,Chennai Super Kings,Royal Challengers Bangalore,2008,,33,,Blank,Blank,Ms Dhoni,R Dravid,Ms Dhoni,Mv Boucher,1975-05-27
13008,,336001,23,S Badrinath,8/30/1980,Right-hand Bat,Right-arm Offbreak,India,Player,Chennai Super Kings,Royal Challengers Bangalore,2008,,28,,Blank,Blank,Ms Dhoni,R Dravid,Ms Dhoni,Mv Boucher,1980-08-30
13009,,336001,109,Ja Morkel,6/10/1981,Left-hand Bat,Right-arm Medium-fast,South Africa,Player,Chennai Super Kings,Royal Challengers Bangalore,2008,,27,,Blank,Blank,Ms Dhoni,R Dravid,Ms Dhoni,Mv Boucher,1981-06-10
13015,,336001,8,V Kohli,11/5/1988,Right-hand Bat,Right-arm Medium,India,Player,Royal Challengers Bangalore,Chennai Super Kings,2008,,20,,Blank,Blank,R Dravid,Ms Dhoni,Mv Boucher,Ms Dhoni,1988-11-05
13016,,336001,9,Jh Kallis,10/16/1975,Right-hand Bat,Right-arm Fast-medium,South Africa,Player,Royal Challengers Bangalore,Chennai Super Kings,2008,,33,,Blank,Blank,R Dravid,Ms Dhoni,Mv Boucher,Ms Dhoni,1975-10-16
13017,,336001,11,Mv Boucher,12/3/1976,Right-hand Bat,Right-arm Medium,South Africa,Keeper,Royal Challengers Bangalore,Chennai Super Kings,2008,,32,,Blank,Blank,R Dravid,Ms Dhoni,Mv Boucher,Ms Dhoni,1976-12-03
13022,,336001,93,B Chipli,1/27/1983,Right-hand Bat,Right-arm Medium,India,Player,Royal Challengers Bangalore,Chennai Super Kings,2008,,25,,Blank,Blank,R Dravid,Ms Dhoni,Mv Boucher,Ms Dhoni,1983-01-27
13024,,336002,1,Sc Ganguly,7/8/1972,Left-hand Bat,Right-arm Medium,India,Captain,Kolkata Knight Riders,Mumbai Indians,2008,,36,,Blank,Blank,Sc Ganguly,Sm Pollock,Bb Mccullum,Pr Shah,1972-07-08
13026,,336002,3,Rt Ponting,12/19/1974,Right-hand Bat,Right-arm Medium,Australia,Player,Kolkata Knight Riders,Mumbai Indians,2008,,34,,Blank,Blank,Sc Ganguly,Sm Pollock,Bb Mccullum,Pr Shah,1974-12-19
13027,,336002,4,Dj Hussey,7/15/1977,Right-hand Bat,Right-arm Offbreak,Australia,Player,Kolkata Knight Riders,Mumbai Indians,2008,,31,,Blank,Blank,Sc Ganguly,Sm Pollock,Bb Mccullum,Pr Shah,1977-07-15
13029,,336002,63,Lr Shukla,5/6/1981,Right-hand Bat,Right-arm Medium,India,Player,Kolkata Knight Riders,Mumbai Indians,2008,,27,,Blank,Blank,Sc Ganguly,Sm Pollock,Bb Mccullum,Pr Shah,1981-05-06
13030,,336002,82,Ab Agarkar,12/4/1977,Right-hand Bat,Right-arm Fast,India,Player,Kolkata Knight Riders,Mumbai Indians,2008,,31,,Blank,Blank,Sc Ganguly,Sm Pollock,Bb Mccullum,Pr Shah,1977-12-04
13034,,336002,106,Ab Dinda,3/25/1984,Right-hand Bat,Right-arm Medium-fast,India,Player,Kolkata Knight Riders,Mumbai Indians,2008,,24,,Blank,Blank,Sc Ganguly,Sm Pollock,Bb Mccullum,Pr Shah,1984-03-25
13036,,336002,46,Rv Uthappa,11/11/1985,Right-hand Bat,Right-arm Medium,India,Player,Mumbai Indians,Kolkata Knight Riders,2008,,23,,Blank,Blank,Sm Pollock,Sc Ganguly,Pr Shah,Bb Mccullum,1985-11-11
13038,,336002,48,Am Nayar,10/8/1983,Left-hand Bat,Right-arm Medium,India,Player,Mumbai Indians,Kolkata Knight Riders,2008,,25,,Blank,Blank,Sm Pollock,Sc Ganguly,Pr Shah,Bb Mccullum,1983-10-08
13040,,336002,71,Dj Bravo,10/7/1983,Right-hand Bat,Right-arm Medium-fast,West Indies,Player,Mumbai Indians,Kolkata Knight Riders,2008,,25,,Blank,Blank,Sm Pollock,Sc Ganguly,Pr Shah,Bb Mccullum,1983-10-07
13044,,336002,96,Mk Pandey,9/10/1989,Right-hand Bat,Right-arm Medium,India,Player,Mumbai Indians,Kolkata Knight Riders,2008,,19,,Blank,Blank,Sm Pollock,Sc Ganguly,Pr Shah,Bb Mccullum,1989-09-10
13045,,336002,149,Crd Fernando,7/19/1979,Right-hand Bat,Right-arm Fast-medium,Sri Lanka,Player,Mumbai Indians,Kolkata Knight Riders,2008,,29,,Blank,Blank,Sm Pollock,Sc Ganguly,Pr Shah,Bb Mccullum,1979-07-19
13046,,336003,40,G Gambhir,10/14/1981,Left-hand Bat,Legbreak,India,Player,Delhi Daredevils,Royal Challengers Bangalore,2008,,27,,Blank,Blank,V Sehwag,R Dravid,Kd Karthik,Mv Boucher,1981-10-14
13047,,336003,41,V Sehwag,10/20/1978,Right-hand Bat,Right-arm Offbreak,India,Captain,Delhi Daredevils,Royal Challengers Bangalore,2008,,30,,Blank,Blank,V Sehwag,R Dravid,Kd Karthik,Mv Boucher,1978-10-20
13049,,336003,86,Shoaib Malik,2/1/1982,Right-hand Bat,Right-arm Offbreak,Pakistan,Player,Delhi Daredevils,Royal Challengers Bangalore,2008,,26,,Blank,Blank,V Sehwag,R Dravid,Kd Karthik,Mv Boucher,1982-02-01
13050,,336003,87,Mk Tiwary,11/14/1985,Right-hand Bat,Legbreak Googly,India,Player,Delhi Daredevils,Royal Challengers Bangalore,2008,,23,,Blank,Blank,V Sehwag,R Dravid,Kd Karthik,Mv Boucher,1985-11-14
13051,,336003,88,Kd Karthik,6/1/1985,Right-hand Bat,N/a,India,Keeper,Delhi Daredevils,Royal Challengers Bangalore,2008,,23,,Blank,Blank,V Sehwag,R Dravid,Kd Karthik,Mv Boucher,1985-06-01
13052,,336003,89,R Bhatia,10/22/1979,Right-hand Bat,Right-arm Medium-fast,India,Player,Delhi Daredevils,Royal Challengers Bangalore,2008,,29,,Blank,Blank,V Sehwag,R Dravid,Kd Karthik,Mv Boucher,1979-10-22
13054,,336003,117,Mohammad Asif,12/20/1982,Left-hand Bat,Right-arm Fast-medium,Pakistan,Player,Delhi Daredevils,Royal Challengers Bangalore,2008,,26,,Blank,Blank,V Sehwag,R Dravid,Kd Karthik,Mv Boucher,1982-12-20
13057,,336003,6,R Dravid,1/11/1973,Right-hand Bat,Right-arm Offbreak,India,Captain,Royal Challengers Bangalore,Delhi Daredevils,2008,,35,,Blank,Blank,R Dravid,V Sehwag,Mv Boucher,Kd Karthik,1973-01-11
13060,,336003,9,Jh Kallis,10/16/1975,Right-hand Bat,Right-arm Fast-medium,South Africa,Player,Royal Challengers Bangalore,Delhi Daredevils,2008,,33,,Blank,Blank,R Dravid,V Sehwag,Mv Boucher,Kd Karthik,1975-10-16
13063,,336003,15,Z Khan,10/7/1978,Right-hand Bat,Left-arm Fast-medium,India,Player,Royal Challengers Bangalore,Delhi Daredevils,2008,,30,,Blank,Blank,R Dravid,V Sehwag,Mv Boucher,Kd Karthik,1978-10-07
13065,,336003,52,Lrpl Taylor,3/8/1984,Right-hand Bat,Right-arm Offbreak,New Zealand,Player,Royal Challengers Bangalore,Delhi Daredevils,2008,,24,,Blank,Blank,R Dravid,V Sehwag,Mv Boucher,Kd Karthik,1984-03-08
13066,,336003,81,R Vinay Kumar,2/12/1984,Right-hand Bat,Right-arm Medium,India,Player,Royal Challengers Bangalore,Delhi Daredevils,2008,,24,,Blank,Blank,R Dravid,V Sehwag,Mv Boucher,Kd Karthik,1984-02-12
13067,,336003,94,Dw Steyn,6/27/1983,Right-hand Bat,Right-arm Fast,South Africa,Player,Royal Challengers Bangalore,Delhi Daredevils,2008,,25,,Blank,Blank,R Dravid,V Sehwag,Mv Boucher,Kd Karthik,1983-06-27
13073,,336004,61,Rp Singh,12/6/1985,Right-hand Bat,Left-arm Fast-medium,India,Player,Deccan Chargers,Kings Xi Punjab,2008,,23,,Blank,Blank,Vvs Laxman,Yuvraj Singh,Ac Gilchrist,Kc Sangakkara,1985-12-06
13076,,336004,98,Dnt Zoysa,5/13/1978,Left-hand Bat,Left-arm Fast-medium,Sri Lanka,Player,Deccan Chargers,Kings Xi Punjab,2008,,30,,Blank,Blank,Vvs Laxman,Yuvraj Singh,Ac Gilchrist,Kc Sangakkara,1978-05-13
13081,,336004,27,Yuvraj Singh,12/12/1981,Left-hand Bat,Slow Left-arm Orthodox,India,Captain,Kings Xi Punjab,Deccan Chargers,2008,,27,,Blank,Blank,Yuvraj Singh,Vvs Laxman,Kc Sangakkara,Ac Gilchrist,1981-12-12
13085,,336004,76,Rr Sarwan,6/23/1980,Right-hand Bat,Legbreak,West Indies,Player,Kings Xi Punjab,Deccan Chargers,2008,,28,,Blank,Blank,Yuvraj Singh,Vvs Laxman,Kc Sangakkara,Ac Gilchrist,1980-06-23
13087,,336004,78,Vrv Singh,9/17/1984,Right-hand Bat,Right-arm Medium-fast,India,Player,Kings Xi Punjab,Deccan Chargers,2008,,24,,Blank,Blank,Yuvraj Singh,Vvs Laxman,Kc Sangakkara,Ac Gilchrist,1984-09-17
13088,,336004,100,Se Marsh,7/9/1983,Left-hand Bat,Slow Left-arm Orthodox,Australia,Player,Kings Xi Punjab,Deccan Chargers,2008,,25,,Blank,Blank,Yuvraj Singh,Vvs Laxman,Kc Sangakkara,Ac Gilchrist,1983-07-09
13093,,336005,35,Ra Jadeja,12/6/1988,Left-hand Bat,Slow Left-arm Orthodox,India,Player,Rajasthan Royals,Kolkata Knight Riders,2008,,20,,Blank,Blank,Sk Warne,Sc Ganguly,M Rawat,Wp Saha,1988-12-06
13094,,336005,36,M Rawat,10/25/1985,Right-hand Bat,N/a,India,Keeper,Rajasthan Royals,Kolkata Knight Riders,2008,,23,,Blank,Blank,Sk Warne,Sc Ganguly,M Rawat,Wp Saha,1985-10-25
13097,,336005,74,Gc Smith,2/1/1981,Left-hand Bat,Right-arm Offbreak,South Africa,Player,Rajasthan Royals,Kolkata Knight Riders,2008,,27,,Blank,Blank,Sk Warne,Sc Ganguly,M Rawat,Wp Saha,1981-02-01
13098,,336005,101,Sa Asnodkar,3/29/1984,Right-hand Bat,Right-arm Offbreak,India,Player,Rajasthan Royals,Kolkata Knight Riders,2008,,24,,Blank,Blank,Sk Warne,Sc Ganguly,M Rawat,Wp Saha,1984-03-29
13099,,336005,102,Sohail Tanvir,12/12/1984,Left-hand Bat,Left-arm Medium-fast,Pakistan,Player,Rajasthan Royals,Kolkata Knight Riders,2008,,24,,Blank,Blank,Sk Warne,Sc Ganguly,M Rawat,Wp Saha,1984-12-12
13101,,336005,1,Sc Ganguly,7/8/1972,Left-hand Bat,Right-arm Medium,India,Captain,Kolkata Knight Riders,Rajasthan Royals,2008,,36,,Blank,Blank,Sc Ganguly,Sk Warne,Wp Saha,M Rawat,1972-07-08
13104,,336005,63,Lr Shukla,5/6/1981,Right-hand Bat,Right-arm Medium,India,Player,Kolkata Knight Riders,Rajasthan Royals,2008,,27,,Blank,Blank,Sc Ganguly,Sk Warne,Wp Saha,M Rawat,1981-05-06
13106,,336005,84,I Sharma,9/2/1988,Right-hand Bat,Right-arm Fast-medium,India,Player,Kolkata Knight Riders,Rajasthan Royals,2008,,20,,Blank,Blank,Sc Ganguly,Sk Warne,Wp Saha,M Rawat,1988-09-02
13109,,336005,104,Bj Hodge,12/29/1974,Right-hand Bat,Right-arm Offbreak,Australia,Player,Kolkata Knight Riders,Rajasthan Royals,2008,,34,,Blank,Blank,Sc Ganguly,Sk Warne,Wp Saha,M Rawat,1974-12-29
13111,,336005,106,Ab Dinda,3/25/1984,Right-hand Bat,Right-arm Medium-fast,India,Player,Kolkata Knight Riders,Rajasthan Royals,2008,,24,,Blank,Blank,Sc Ganguly,Sk Warne,Wp Saha,M Rawat,1984-03-25
13117,,336006,89,R Bhatia,10/22/1979,Right-hand Bat,Right-arm Medium-fast,India,Player,Delhi Daredevils,Chennai Super Kings,2008,,29,,Blank,Blank,V Sehwag,Ms Dhoni,Kd Karthik,Ms Dhoni,1979-10-22
13118,,336006,91,Vy Mahesh,12/21/1987,Right-hand Bat,Right-arm Medium-fast,India,Player,Delhi Daredevils,Chennai Super Kings,2008,,21,,Blank,Blank,V Sehwag,Ms Dhoni,Kd Karthik,Ms Dhoni,1987-12-21
13119,,336006,110,Ab De Villiers,2/17/1984,Right-hand Bat,Right-arm Medium,South Africa,Player,Delhi Daredevils,Chennai Super Kings,2008,,24,,Blank,Blank,V Sehwag,Ms Dhoni,Kd Karthik,Ms Dhoni,1984-02-17
13120,,336006,116,Pj Sangwan,11/5/1990,Right-hand Bat,Left-arm Medium,India,Player,Delhi Daredevils,Chennai Super Kings,2008,,18,,Blank,Blank,V Sehwag,Ms Dhoni,Kd Karthik,Ms Dhoni,1990-11-05
13122,,336006,118,Gd Mcgrath,2/9/1970,Right-hand Bat,Right-arm Fast-medium,Australia,Player,Delhi Daredevils,Chennai Super Kings,2008,,38,,Blank,Blank,V Sehwag,Ms Dhoni,Kd Karthik,Ms Dhoni,1970-02-09
13123,,336006,17,Pa Patel,3/9/1985,Left-hand Bat,N/a,India,Player,Chennai Super Kings,Delhi Daredevils,2008,,23,,Blank,Blank,Ms Dhoni,V Sehwag,Ms Dhoni,Kd Karthik,1985-03-09
13125,,336006,21,Sk Raina,11/27/1986,Left-hand Bat,Right-arm Offbreak,India,Player,Chennai Super Kings,Delhi Daredevils,2008,,22,,Blank,Blank,Ms Dhoni,V Sehwag,Ms Dhoni,Kd Karthik,1986-11-27
13132,,336006,121,M Muralitharan,4/17/1972,Right-hand Bat,Right-arm Offbreak,Sri Lanka,Player,Chennai Super Kings,Delhi Daredevils,2008,,36,,Blank,Blank,Ms Dhoni,V Sehwag,Ms Dhoni,Kd Karthik,1972-04-17
13133,,336006,122,M Ntini,7/6/1977,Right-hand Bat,Right-arm Fast,South Africa,Player,Chennai Super Kings,Delhi Daredevils,2008,,31,,Blank,Blank,Ms Dhoni,V Sehwag,Ms Dhoni,Kd Karthik,1977-07-06
13134,,336007,53,Ac Gilchrist,11/14/1971,Left-hand Bat,Right-arm Offbreak,Australia,Captainkeeper,Deccan Chargers,Royal Challengers Bangalore,2008,,37,,Blank,Blank,Ac Gilchrist,R Dravid,Ac Gilchrist,Sp Goswami,1971-11-14
13136,,336007,57,Rg Sharma,4/30/1987,Right-hand Bat,Right-arm Offbreak,India,Player,Deccan Chargers,Royal Challengers Bangalore,2008,,21,,Blank,Blank,Ac Gilchrist,R Dravid,Ac Gilchrist,Sp Goswami,1987-04-30
13139,,336007,61,Rp Singh,12/6/1985,Right-hand Bat,Left-arm Fast-medium,India,Player,Deccan Chargers,Royal Challengers Bangalore,2008,,23,,Blank,Blank,Ac Gilchrist,R Dravid,Ac Gilchrist,Sp Goswami,1985-12-06
13146,,336007,7,W Jaffer,2/16/1978,Right-hand Bat,Right-arm Offbreak,India,Player,Royal Challengers Bangalore,Deccan Chargers,2008,,30,,Blank,Blank,R Dravid,Ac Gilchrist,Sp Goswami,Ac Gilchrist,1978-02-16
13148,,336007,9,Jh Kallis,10/16/1975,Right-hand Bat,Right-arm Fast-medium,South Africa,Player,Royal Challengers Bangalore,Deccan Chargers,2008,,33,,Blank,Blank,R Dravid,Ac Gilchrist,Sp Goswami,Ac Gilchrist,1975-10-16
13154,,336007,124,A Kumble,10/17/1970,Right-hand Bat,Legbreak Googly,India,Player,Royal Challengers Bangalore,Deccan Chargers,2008,,38,,Blank,Blank,R Dravid,Ac Gilchrist,Sp Goswami,Ac Gilchrist,1970-10-17
13157,,336008,25,Jr Hopes,10/24/1978,Right-hand Bat,Right-arm Medium,Australia,Player,Kings Xi Punjab,Kolkata Knight Riders,2008,,30,,Blank,Blank,Yuvraj Singh,Sc Ganguly,Kc Sangakkara,Wp Saha,1978-10-24
13166,,336008,437,Gagandeep Singh,10/3/1981,Right-hand Bat,Right-arm Medium-fast,India,Player,Kings Xi Punjab,Kolkata Knight Riders,2008,,27,,Blank,Blank,Yuvraj Singh,Sc Ganguly,Kc Sangakkara,Wp Saha,1981-10-03
13168,,336008,4,Dj Hussey,7/15/1977,Right-hand Bat,Right-arm Offbreak,Australia,Player,Kolkata Knight Riders,Kings Xi Punjab,2008,,31,,Blank,Blank,Sc Ganguly,Yuvraj Singh,Wp Saha,Kc Sangakkara,1977-07-15
13170,,336008,62,Wp Saha,10/24/1984,Right-hand Bat,N/a,India,Keeper,Kolkata Knight Riders,Kings Xi Punjab,2008,,24,,Blank,Blank,Sc Ganguly,Yuvraj Singh,Wp Saha,Kc Sangakkara,1984-10-24
13172,,336008,82,Ab Agarkar,12/4/1977,Right-hand Bat,Right-arm Fast,India,Player,Kolkata Knight Riders,Kings Xi Punjab,2008,,31,,Blank,Blank,Sc Ganguly,Yuvraj Singh,Wp Saha,Kc Sangakkara,1977-12-04
13177,,336008,106,Ab Dinda,3/25/1984,Right-hand Bat,Right-arm Medium-fast,India,Player,Kolkata Knight Riders,Kings Xi Punjab,2008,,24,,Blank,Blank,Sc Ganguly,Yuvraj Singh,Wp Saha,Kc Sangakkara,1984-03-25
13179,,336009,41,V Sehwag,10/20/1978,Right-hand Bat,Right-arm Offbreak,India,Captain,Delhi Daredevils,Mumbai Indians,2008,,30,,Blank,Blank,V Sehwag,Sm Pollock,Kd Karthik,Yv Takawale,1978-10-20
13180,,336009,42,S Dhawan,12/5/1985,Left-hand Bat,Right-arm Offbreak,India,Player,Delhi Daredevils,Mumbai Indians,2008,,23,,Blank,Blank,V Sehwag,Sm Pollock,Kd Karthik,Yv Takawale,1985-12-05
13182,,336009,88,Kd Karthik,6/1/1985,Right-hand Bat,N/a,India,Keeper,Delhi Daredevils,Mumbai Indians,2008,,23,,Blank,Blank,V Sehwag,Sm Pollock,Kd Karthik,Yv Takawale,1985-06-01
13188,,336009,118,Gd Mcgrath,2/9/1970,Right-hand Bat,Right-arm Fast-medium,Australia,Player,Delhi Daredevils,Mumbai Indians,2008,,38,,Blank,Blank,V Sehwag,Sm Pollock,Kd Karthik,Yv Takawale,1970-02-09
13191,,336009,46,Rv Uthappa,11/11/1985,Right-hand Bat,Right-arm Medium,India,Player,Mumbai Indians,Delhi Daredevils,2008,,23,,Blank,Blank,Sm Pollock,V Sehwag,Yv Takawale,Kd Karthik,1985-11-11
13193,,336009,49,Sm Pollock,7/16/1973,Right-hand Bat,Right-arm Fast-medium,South Africa,Captain,Mumbai Indians,Delhi Daredevils,2008,,35,,Blank,Blank,Sm Pollock,V Sehwag,Yv Takawale,Kd Karthik,1973-07-16
13195,,336009,73,A Nehra,4/29/1979,Right-hand Bat,Left-arm Medium-fast,India,Player,Mumbai Indians,Delhi Daredevils,2008,,29,,Blank,Blank,Sm Pollock,V Sehwag,Yv Takawale,Kd Karthik,1979-04-29
13199,,336009,115,Rr Raje,9/3/1986,Right-hand Bat,Right-arm Fast-medium,India,Player,Mumbai Indians,Delhi Daredevils,2008,,22,,Blank,Blank,Sm Pollock,V Sehwag,Yv Takawale,Kd Karthik,1986-09-03
13200,,336010,31,Yk Pathan,11/17/1982,Right-hand Bat,Right-arm Offbreak,India,Player,Rajasthan Royals,Chennai Super Kings,2008,,26,,Blank,Blank,Sk Warne,Ms Dhoni,M Rawat,Ms Dhoni,1982-11-17
13206,,336010,39,Sk Trivedi,9/4/1982,Right-hand Bat,Right-arm Medium,India,Player,Rajasthan Royals,Chennai Super Kings,2008,,26,,Blank,Blank,Sk Warne,Ms Dhoni,M Rawat,Ms Dhoni,1982-09-04
13207,,336010,74,Gc Smith,2/1/1981,Left-hand Bat,Right-arm Offbreak,South Africa,Player,Rajasthan Royals,Chennai Super Kings,2008,,27,,Blank,Blank,Sk Warne,Ms Dhoni,M Rawat,Ms Dhoni,1981-02-01
13210,,336010,126,Mm Patel,7/12/1983,Right-hand Bat,Right-arm Medium-fast,India,Player,Rajasthan Royals,Chennai Super Kings,2008,,25,,Blank,Blank,Sk Warne,Ms Dhoni,M Rawat,Ms Dhoni,1983-07-12
13213,,336010,21,Sk Raina,11/27/1986,Left-hand Bat,Right-arm Offbreak,India,Player,Chennai Super Kings,Rajasthan Royals,2008,,22,,Blank,Blank,Ms Dhoni,Sk Warne,Ms Dhoni,M Rawat,1986-11-27
13214,,336010,23,S Badrinath,8/30/1980,Right-hand Bat,Right-arm Offbreak,India,Player,Chennai Super Kings,Rajasthan Royals,2008,,28,,Blank,Blank,Ms Dhoni,Sk Warne,Ms Dhoni,M Rawat,1980-08-30
13215,,336010,107,Sp Fleming,4/1/1973,Left-hand Bat,N/a,New Zealand,Player,Chennai Super Kings,Rajasthan Royals,2008,,35,,Blank,Blank,Ms Dhoni,Sk Warne,Ms Dhoni,M Rawat,1973-04-01
13216,,336010,108,S Vidyut,12/3/1981,Left-hand Bat,Slow Left-arm Orthodox,India,Player,Chennai Super Kings,Rajasthan Royals,2008,,27,,Blank,Blank,Ms Dhoni,Sk Warne,Ms Dhoni,M Rawat,1981-12-03
13219,,336010,120,Ms Gony,1/4/1984,Right-hand Bat,Right-arm Medium,India,Player,Chennai Super Kings,Rajasthan Royals,2008,,24,,Blank,Blank,Ms Dhoni,Sk Warne,Ms Dhoni,M Rawat,1984-01-04
13220,,336010,121,M Muralitharan,4/17/1972,Right-hand Bat,Right-arm Offbreak,Sri Lanka,Player,Chennai Super Kings,Rajasthan Royals,2008,,36,,Blank,Blank,Ms Dhoni,Sk Warne,Ms Dhoni,M Rawat,1972-04-17
13221,,336010,122,M Ntini,7/6/1977,Right-hand Bat,Right-arm Fast,South Africa,Player,Chennai Super Kings,Rajasthan Royals,2008,,31,,Blank,Blank,Ms Dhoni,Sk Warne,Ms Dhoni,M Rawat,1977-07-06
13225,,336011,9,Jh Kallis,10/16/1975,Right-hand Bat,Right-arm Fast-medium,South Africa,Player,Royal Challengers Bangalore,Kings Xi Punjab,2008,,33,,Blank,Blank,R Dravid,Yuvraj Singh,Dt Patil,U Kaul,1975-10-16
13226,,336011,10,Cl White,8/18/1983,Right-hand Bat,Legbreak Googly,Australia,Player,Royal Challengers Bangalore,Kings Xi Punjab,2008,,25,,Blank,Blank,R Dravid,Yuvraj Singh,Dt Patil,U Kaul,1983-08-18
13228,,336011,15,Z Khan,10/7/1978,Right-hand Bat,Left-arm Fast-medium,India,Player,Royal Challengers Bangalore,Kings Xi Punjab,2008,,30,,Blank,Blank,R Dravid,Yuvraj Singh,Dt Patil,U Kaul,1978-10-07
13229,,336011,94,Dw Steyn,6/27/1983,Right-hand Bat,Right-arm Fast,South Africa,Player,Royal Challengers Bangalore,Kings Xi Punjab,2008,,25,,Blank,Blank,R Dravid,Yuvraj Singh,Dt Patil,U Kaul,1983-06-27
13236,,336011,64,Dpmd Jayawardene,5/27/1977,Right-hand Bat,Right-arm Medium,Sri Lanka,Player,Kings Xi Punjab,Royal Challengers Bangalore,2008,,31,,Blank,Blank,Yuvraj Singh,R Dravid,U Kaul,Dt Patil,1977-05-27
13239,,336011,77,S Sreesanth,2/6/1983,Right-hand Bat,Right-arm Fast-medium,India,Player,Kings Xi Punjab,Royal Challengers Bangalore,2008,,25,,Blank,Blank,Yuvraj Singh,R Dravid,U Kaul,Dt Patil,1983-02-06
13242,,336011,134,U Kaul,12/2/1987,Left-hand Bat,N/a,India,Keeper,Kings Xi Punjab,Royal Challengers Bangalore,2008,,21,,Blank,Blank,Yuvraj Singh,R Dravid,U Kaul,Dt Patil,1987-12-02
13247,,336012,58,Sb Styris,7/10/1975,Right-hand Bat,Right-arm Medium,New Zealand,Player,Deccan Chargers,Chennai Super Kings,2008,,33,,Blank,Blank,Ac Gilchrist,Ms Dhoni,Ac Gilchrist,Ms Dhoni,1975-07-10
13248,,336012,59,Sb Bangar,10/11/1972,Right-hand Bat,Right-arm Medium-fast,India,Player,Deccan Chargers,Chennai Super Kings,2008,,36,,Blank,Blank,Ac Gilchrist,Ms Dhoni,Ac Gilchrist,Ms Dhoni,1972-10-11
13249,,336012,61,Rp Singh,12/6/1985,Right-hand Bat,Left-arm Fast-medium,India,Player,Deccan Chargers,Chennai Super Kings,2008,,23,,Blank,Blank,Ac Gilchrist,Ms Dhoni,Ac Gilchrist,Ms Dhoni,1985-12-06
13250,,336012,70,Shahid Afridi,3/1/1980,Right-hand Bat,Legbreak Googly,Pakistan,Player,Deccan Chargers,Chennai Super Kings,2008,,28,,Blank,Blank,Ac Gilchrist,Ms Dhoni,Ac Gilchrist,Ms Dhoni,1980-03-01
13251,,336012,97,Hh Gibbs,2/23/1974,Right-hand Bat,Right-arm Bowler,South Africa,Player,Deccan Chargers,Chennai Super Kings,2008,,34,,Blank,Blank,Ac Gilchrist,Ms Dhoni,Ac Gilchrist,Ms Dhoni,1974-02-23
13255,,336012,17,Pa Patel,3/9/1985,Left-hand Bat,N/a,India,Player,Chennai Super Kings,Deccan Chargers,2008,,23,,Blank,Blank,Ms Dhoni,Ac Gilchrist,Ms Dhoni,Ac Gilchrist,1985-03-09
13256,,336012,20,Ms Dhoni,7/7/1981,Right-hand Bat,Right-arm Medium,India,Captainkeeper,Chennai Super Kings,Deccan Chargers,2008,,27,,Blank,Blank,Ms Dhoni,Ac Gilchrist,Ms Dhoni,Ac Gilchrist,1981-07-07
13257,,336012,21,Sk Raina,11/27/1986,Left-hand Bat,Right-arm Offbreak,India,Player,Chennai Super Kings,Deccan Chargers,2008,,22,,Blank,Blank,Ms Dhoni,Ac Gilchrist,Ms Dhoni,Ac Gilchrist,1986-11-27
13260,,336012,109,Ja Morkel,6/10/1981,Left-hand Bat,Right-arm Medium-fast,South Africa,Player,Chennai Super Kings,Deccan Chargers,2008,,27,,Blank,Blank,Ms Dhoni,Ac Gilchrist,Ms Dhoni,Ac Gilchrist,1981-06-10
13261,,336012,119,Joginder Sharma,10/23/1983,Right-hand Bat,Right-arm Fast-medium,India,Player,Chennai Super Kings,Deccan Chargers,2008,,25,,Blank,Blank,Ms Dhoni,Ac Gilchrist,Ms Dhoni,Ac Gilchrist,1983-10-23
13264,,336012,122,M Ntini,7/6/1977,Right-hand Bat,Right-arm Fast,South Africa,Player,Chennai Super Kings,Deccan Chargers,2008,,31,,Blank,Blank,Ms Dhoni,Ac Gilchrist,Ms Dhoni,Ac Gilchrist,1977-07-06
13267,,336013,32,Sr Watson,6/17/1981,Right-hand Bat,Right-arm Fast-medium,Australia,Player,Rajasthan Royals,Mumbai Indians,2008,,27,,Blank,Blank,Sk Warne,Sm Pollock,M Rawat,Yv Takawale,1981-06-17
13271,,336013,38,Sk Warne,9/13/1969,Right-hand Bat,Legbreak Googly,Australia,Captain,Rajasthan Royals,Mumbai Indians,2008,,39,,Blank,Blank,Sk Warne,Sm Pollock,M Rawat,Yv Takawale,1969-09-13
13275,,336013,102,Sohail Tanvir,12/12/1984,Left-hand Bat,Left-arm Medium-fast,Pakistan,Player,Rajasthan Royals,Mumbai Indians,2008,,24,,Blank,Blank,Sk Warne,Sm Pollock,M Rawat,Yv Takawale,1984-12-12
13279,,336013,46,Rv Uthappa,11/11/1985,Right-hand Bat,Right-arm Medium,India,Player,Mumbai Indians,Rajasthan Royals,2008,,23,,Blank,Blank,Sm Pollock,Sk Warne,Yv Takawale,M Rawat,1985-11-11
13282,,336013,71,Dj Bravo,10/7/1983,Right-hand Bat,Right-arm Medium-fast,West Indies,Player,Mumbai Indians,Rajasthan Royals,2008,,25,,Blank,Blank,Sm Pollock,Sk Warne,Yv Takawale,M Rawat,1983-10-07
13285,,336013,80,Ds Kulkarni,12/10/1988,Right-hand Bat,Right-arm Medium,India,Player,Mumbai Indians,Rajasthan Royals,2008,,20,,Blank,Blank,Sm Pollock,Sk Warne,Yv Takawale,M Rawat,1988-12-10
13287,,336013,115,Rr Raje,9/3/1986,Right-hand Bat,Right-arm Fast-medium,India,Player,Mumbai Indians,Rajasthan Royals,2008,,22,,Blank,Blank,Sm Pollock,Sk Warne,Yv Takawale,M Rawat,1986-09-03
13288,,336014,40,G Gambhir,10/14/1981,Left-hand Bat,Legbreak,India,Player,Delhi Daredevils,Chennai Super Kings,2008,,27,,Blank,Blank,V Sehwag,Ms Dhoni,Kd Karthik,Ms Dhoni,1981-10-14
13289,,336014,41,V Sehwag,10/20/1978,Right-hand Bat,Right-arm Offbreak,India,Captain,Delhi Daredevils,Chennai Super Kings,2008,,30,,Blank,Blank,V Sehwag,Ms Dhoni,Kd Karthik,Ms Dhoni,1978-10-20
13290,,336014,42,S Dhawan,12/5/1985,Left-hand Bat,Right-arm Offbreak,India,Player,Delhi Daredevils,Chennai Super Kings,2008,,23,,Blank,Blank,V Sehwag,Ms Dhoni,Kd Karthik,Ms Dhoni,1985-12-05
13291,,336014,86,Shoaib Malik,2/1/1982,Right-hand Bat,Right-arm Offbreak,Pakistan,Player,Delhi Daredevils,Chennai Super Kings,2008,,26,,Blank,Blank,V Sehwag,Ms Dhoni,Kd Karthik,Ms Dhoni,1982-02-01
13295,,336014,110,Ab De Villiers,2/17/1984,Right-hand Bat,Right-arm Medium,South Africa,Player,Delhi Daredevils,Chennai Super Kings,2008,,24,,Blank,Blank,V Sehwag,Ms Dhoni,Kd Karthik,Ms Dhoni,1984-02-17
13297,,336014,117,Mohammad Asif,12/20/1982,Left-hand Bat,Right-arm Fast-medium,Pakistan,Player,Delhi Daredevils,Chennai Super Kings,2008,,26,,Blank,Blank,V Sehwag,Ms Dhoni,Kd Karthik,Ms Dhoni,1982-12-20
13300,,336014,21,Sk Raina,11/27/1986,Left-hand Bat,Right-arm Offbreak,India,Player,Chennai Super Kings,Delhi Daredevils,2008,,22,,Blank,Blank,Ms Dhoni,V Sehwag,Ms Dhoni,Kd Karthik,1986-11-27
13301,,336014,23,S Badrinath,8/30/1980,Right-hand Bat,Right-arm Offbreak,India,Player,Chennai Super Kings,Delhi Daredevils,2008,,28,,Blank,Blank,Ms Dhoni,V Sehwag,Ms Dhoni,Kd Karthik,1980-08-30
13302,,336014,107,Sp Fleming,4/1/1973,Left-hand Bat,N/a,New Zealand,Player,Chennai Super Kings,Delhi Daredevils,2008,,35,,Blank,Blank,Ms Dhoni,V Sehwag,Ms Dhoni,Kd Karthik,1973-04-01
13303,,336014,108,S Vidyut,12/3/1981,Left-hand Bat,Slow Left-arm Orthodox,India,Player,Chennai Super Kings,Delhi Daredevils,2008,,27,,Blank,Blank,Ms Dhoni,V Sehwag,Ms Dhoni,Kd Karthik,1981-12-03
13305,,336014,120,Ms Gony,1/4/1984,Right-hand Bat,Right-arm Medium,India,Player,Chennai Super Kings,Delhi Daredevils,2008,,24,,Blank,Blank,Ms Dhoni,V Sehwag,Ms Dhoni,Kd Karthik,1984-01-04
13312,,336015,10,Cl White,8/18/1983,Right-hand Bat,Legbreak Googly,Australia,Player,Royal Challengers Bangalore,Kolkata Knight Riders,2008,,25,,Blank,Blank,R Dravid,Sc Ganguly,Mv Boucher,Wp Saha,1983-08-18
13313,,336015,11,Mv Boucher,12/3/1976,Right-hand Bat,Right-arm Medium,South Africa,Keeper,Royal Challengers Bangalore,Kolkata Knight Riders,2008,,32,,Blank,Blank,R Dravid,Sc Ganguly,Mv Boucher,Wp Saha,1976-12-03
13314,,336015,14,P Kumar,10/2/1986,Right-hand Bat,Right-arm Medium,India,Player,Royal Challengers Bangalore,Kolkata Knight Riders,2008,,22,,Blank,Blank,R Dravid,Sc Ganguly,Mv Boucher,Wp Saha,1986-10-02
13316,,336015,51,S Chanderpaul,8/16/1974,Left-hand Bat,Legbreak,West Indies,Player,Royal Challengers Bangalore,Kolkata Knight Riders,2008,,34,,Blank,Blank,R Dravid,Sc Ganguly,Mv Boucher,Wp Saha,1974-08-16
13318,,336015,94,Dw Steyn,6/27/1983,Right-hand Bat,Right-arm Fast,South Africa,Player,Royal Challengers Bangalore,Kolkata Knight Riders,2008,,25,,Blank,Blank,R Dravid,Sc Ganguly,Mv Boucher,Wp Saha,1983-06-27
13321,,336015,1,Sc Ganguly,7/8/1972,Left-hand Bat,Right-arm Medium,India,Captain,Kolkata Knight Riders,Royal Challengers Bangalore,2008,,36,,Blank,Blank,Sc Ganguly,R Dravid,Wp Saha,Mv Boucher,1972-07-08
13326,,336015,84,I Sharma,9/2/1988,Right-hand Bat,Right-arm Fast-medium,India,Player,Kolkata Knight Riders,Royal Challengers Bangalore,2008,,20,,Blank,Blank,Sc Ganguly,R Dravid,Wp Saha,Mv Boucher,1988-09-02
13328,,336015,105,Umar Gul,4/14/1984,Right-hand Bat,Right-arm Fast-medium,Pakistan,Player,Kolkata Knight Riders,Royal Challengers Bangalore,2008,,24,,Blank,Blank,Sc Ganguly,R Dravid,Wp Saha,Mv Boucher,1984-04-14
13329,,336015,106,Ab Dinda,3/25/1984,Right-hand Bat,Right-arm Medium-fast,India,Player,Kolkata Knight Riders,Royal Challengers Bangalore,2008,,24,,Blank,Blank,Sc Ganguly,R Dravid,Wp Saha,Mv Boucher,1984-03-25
13331,,336015,129,T Taibu,5/14/1983,Right-hand Bat,Right-arm Medium,Zimbabwea,Player,Kolkata Knight Riders,Royal Challengers Bangalore,2008,,25,,Blank,Blank,Sc Ganguly,R Dravid,Wp Saha,Mv Boucher,1983-05-14
13339,,336016,97,Hh Gibbs,2/23/1974,Right-hand Bat,Right-arm Bowler,South Africa,Player,Deccan Chargers,Rajasthan Royals,2008,,34,,Blank,Blank,Ac Gilchrist,Sk Warne,Ac Gilchrist,M Rawat,1974-02-23
13341,,336016,131,Pp Ojha,9/5/1986,Left-hand Bat,Slow Left-arm Orthodox,India,Player,Deccan Chargers,Rajasthan Royals,2008,,22,,Blank,Blank,Ac Gilchrist,Sk Warne,Ac Gilchrist,M Rawat,1986-09-05
13342,,336016,143,Dp Vijaykumar,10/20/1986,Right-hand Bat,Right-arm Medium,India,Player,Deccan Chargers,Rajasthan Royals,2008,,22,,Blank,Blank,Ac Gilchrist,Sk Warne,Ac Gilchrist,M Rawat,1986-10-20
13344,,336016,32,Sr Watson,6/17/1981,Right-hand Bat,Right-arm Fast-medium,Australia,Player,Rajasthan Royals,Deccan Chargers,2008,,27,,Blank,Blank,Sk Warne,Ac Gilchrist,M Rawat,Ac Gilchrist,1981-06-17
13345,,336016,33,M Kaif,12/1/1980,Right-hand Bat,Right-arm Offbreak,India,Player,Rajasthan Royals,Deccan Chargers,2008,,28,,Blank,Blank,Sk Warne,Ac Gilchrist,M Rawat,Ac Gilchrist,1980-12-01
13346,,336016,35,Ra Jadeja,12/6/1988,Left-hand Bat,Slow Left-arm Orthodox,India,Player,Rajasthan Royals,Deccan Chargers,2008,,20,,Blank,Blank,Sk Warne,Ac Gilchrist,M Rawat,Ac Gilchrist,1988-12-06
13347,,336016,36,M Rawat,10/25/1985,Right-hand Bat,N/a,India,Keeper,Rajasthan Royals,Deccan Chargers,2008,,23,,Blank,Blank,Sk Warne,Ac Gilchrist,M Rawat,Ac Gilchrist,1985-10-25
13351,,336016,102,Sohail Tanvir,12/12/1984,Left-hand Bat,Left-arm Medium-fast,Pakistan,Player,Rajasthan Royals,Deccan Chargers,2008,,24,,Blank,Blank,Sk Warne,Ac Gilchrist,M Rawat,Ac Gilchrist,1984-12-12
13355,,336017,8,V Kohli,11/5/1988,Right-hand Bat,Right-arm Medium,India,Player,Royal Challengers Bangalore,Mumbai Indians,2008,,20,,Blank,Blank,R Dravid,Sr Tendulkar,Sp Goswami,Yv Takawale,1988-11-05
13356,,336017,10,Cl White,8/18/1983,Right-hand Bat,Legbreak Googly,Australia,Player,Royal Challengers Bangalore,Mumbai Indians,2008,,25,,Blank,Blank,R Dravid,Sr Tendulkar,Sp Goswami,Yv Takawale,1983-08-18
13357,,336017,11,Mv Boucher,12/3/1976,Right-hand Bat,Right-arm Medium,South Africa,Player,Royal Challengers Bangalore,Mumbai Indians,2008,,32,,Blank,Blank,R Dravid,Sr Tendulkar,Sp Goswami,Yv Takawale,1976-12-03
13368,,336017,49,Sm Pollock,7/16/1973,Right-hand Bat,Right-arm Fast-medium,South Africa,Player,Mumbai Indians,Royal Challengers Bangalore,2008,,35,,Blank,Blank,Sr Tendulkar,R Dravid,Yv Takawale,Sp Goswami,1973-07-16
13369,,336017,73,A Nehra,4/29/1979,Right-hand Bat,Left-arm Medium-fast,India,Player,Mumbai Indians,Royal Challengers Bangalore,2008,,29,,Blank,Blank,Sr Tendulkar,R Dravid,Yv Takawale,Sp Goswami,1979-04-29
13371,,336017,96,Mk Pandey,9/10/1989,Right-hand Bat,Right-arm Medium,India,Player,Mumbai Indians,Royal Challengers Bangalore,2008,,19,,Blank,Blank,Sr Tendulkar,R Dravid,Yv Takawale,Sp Goswami,1989-09-10
13372,,336017,114,Yv Takawale,11/5/1984,Right-hand Bat,N/a,India,Keeper,Mumbai Indians,Royal Challengers Bangalore,2008,,24,,Blank,Blank,Sr Tendulkar,R Dravid,Yv Takawale,Sp Goswami,1984-11-05
13374,,336017,147,Dr Smith,4/12/1983,Right-hand Bat,Right-arm Medium,West Indies,Player,Mumbai Indians,Royal Challengers Bangalore,2008,,25,,Blank,Blank,Sr Tendulkar,R Dravid,Yv Takawale,Sp Goswami,1983-04-12
13375,,336017,149,Crd Fernando,7/19/1979,Right-hand Bat,Right-arm Fast-medium,Sri Lanka,Player,Mumbai Indians,Royal Challengers Bangalore,2008,,29,,Blank,Blank,Sr Tendulkar,R Dravid,Yv Takawale,Sp Goswami,1979-07-19
13377,,336018,21,Sk Raina,11/27/1986,Left-hand Bat,Right-arm Offbreak,India,Player,Chennai Super Kings,Kings Xi Punjab,2008,,22,,Blank,Blank,Ms Dhoni,Yuvraj Singh,Ms Dhoni,U Kaul,1986-11-27
13378,,336018,23,S Badrinath,8/30/1980,Right-hand Bat,Right-arm Offbreak,India,Player,Chennai Super Kings,Kings Xi Punjab,2008,,28,,Blank,Blank,Ms Dhoni,Yuvraj Singh,Ms Dhoni,U Kaul,1980-08-30
13381,,336018,109,Ja Morkel,6/10/1981,Left-hand Bat,Right-arm Medium-fast,South Africa,Player,Chennai Super Kings,Kings Xi Punjab,2008,,27,,Blank,Blank,Ms Dhoni,Yuvraj Singh,Ms Dhoni,U Kaul,1981-06-10
13384,,336018,127,Ck Kapugedera,2/24/1987,Right-hand Bat,Right-arm Medium,Sri Lanka,Player,Chennai Super Kings,Kings Xi Punjab,2008,,21,,Blank,Blank,Ms Dhoni,Yuvraj Singh,Ms Dhoni,U Kaul,1987-02-24
13388,,336018,25,Jr Hopes,10/24/1978,Right-hand Bat,Right-arm Medium,Australia,Player,Kings Xi Punjab,Chennai Super Kings,2008,,30,,Blank,Blank,Yuvraj Singh,Ms Dhoni,U Kaul,Ms Dhoni,1978-10-24
13390,,336018,29,Ik Pathan,10/27/1984,Left-hand Bat,Left-arm Medium-fast,India,Player,Kings Xi Punjab,Chennai Super Kings,2008,,24,,Blank,Blank,Yuvraj Singh,Ms Dhoni,U Kaul,Ms Dhoni,1984-10-27
13397,,336018,134,U Kaul,12/2/1987,Left-hand Bat,N/a,India,Keeper,Kings Xi Punjab,Chennai Super Kings,2008,,21,,Blank,Blank,Yuvraj Singh,Ms Dhoni,U Kaul,Ms Dhoni,1987-12-02
13398,,336019,53,Ac Gilchrist,11/14/1971,Left-hand Bat,Right-arm Offbreak,Australia,Captainkeeper,Deccan Chargers,Kolkata Knight Riders,2008,,37,,Blank,Blank,Ac Gilchrist,Sc Ganguly,Ac Gilchrist,Wp Saha,1971-11-14
13399,,336019,54,Y Venugopal Rao,2/26/1982,Right-hand Bat,Right-arm Offbreak,India,Player,Deccan Chargers,Kolkata Knight Riders,2008,,26,,Blank,Blank,Ac Gilchrist,Sc Ganguly,Ac Gilchrist,Wp Saha,1982-02-26
13401,,336019,58,Sb Styris,7/10/1975,Right-hand Bat,Right-arm Medium,New Zealand,Player,Deccan Chargers,Kolkata Knight Riders,2008,,33,,Blank,Blank,Ac Gilchrist,Sc Ganguly,Ac Gilchrist,Wp Saha,1975-07-10
13403,,336019,60,Wpujc Vaas,1/27/1974,Left-hand Bat,Left-arm Fast-medium,Sri Lanka,Player,Deccan Chargers,Kolkata Knight Riders,2008,,34,,Blank,Blank,Ac Gilchrist,Sc Ganguly,Ac Gilchrist,Wp Saha,1974-01-27
13406,,336019,112,Db Ravi Teja,9/5/1987,Right-hand Bat,Legbreak Googly,India,Player,Deccan Chargers,Kolkata Knight Riders,2008,,21,,Blank,Blank,Ac Gilchrist,Sc Ganguly,Ac Gilchrist,Wp Saha,1987-09-05
13407,,336019,131,Pp Ojha,9/5/1986,Left-hand Bat,Slow Left-arm Orthodox,India,Player,Deccan Chargers,Kolkata Knight Riders,2008,,22,,Blank,Blank,Ac Gilchrist,Sc Ganguly,Ac Gilchrist,Wp Saha,1986-09-05
13408,,336019,143,Dp Vijaykumar,10/20/1986,Right-hand Bat,Right-arm Medium,India,Player,Deccan Chargers,Kolkata Knight Riders,2008,,22,,Blank,Blank,Ac Gilchrist,Sc Ganguly,Ac Gilchrist,Wp Saha,1986-10-20
13409,,336019,1,Sc Ganguly,7/8/1972,Left-hand Bat,Right-arm Medium,India,Captain,Kolkata Knight Riders,Deccan Chargers,2008,,36,,Blank,Blank,Sc Ganguly,Ac Gilchrist,Wp Saha,Ac Gilchrist,1972-07-08
13412,,336019,63,Lr Shukla,5/6/1981,Right-hand Bat,Right-arm Medium,India,Player,Kolkata Knight Riders,Deccan Chargers,2008,,27,,Blank,Blank,Sc Ganguly,Ac Gilchrist,Wp Saha,Ac Gilchrist,1981-05-06
13415,,336019,103,Salman Butt,10/7/1984,Left-hand Bat,Right-arm Offbreak,Pakistan,Player,Kolkata Knight Riders,Deccan Chargers,2008,,24,,Blank,Blank,Sc Ganguly,Ac Gilchrist,Wp Saha,Ac Gilchrist,1984-10-07
13416,,336019,105,Umar Gul,4/14/1984,Right-hand Bat,Right-arm Fast-medium,Pakistan,Player,Kolkata Knight Riders,Deccan Chargers,2008,,24,,Blank,Blank,Sc Ganguly,Ac Gilchrist,Wp Saha,Ac Gilchrist,1984-04-14
13417,,336019,106,Ab Dinda,3/25/1984,Right-hand Bat,Right-arm Medium-fast,India,Player,Kolkata Knight Riders,Deccan Chargers,2008,,24,,Blank,Blank,Sc Ganguly,Ac Gilchrist,Wp Saha,Ac Gilchrist,1984-03-25
13418,,336019,128,A Chopra,9/19/1977,Right-hand Bat,Right-arm Offbreak,India,Player,Kolkata Knight Riders,Deccan Chargers,2008,,31,,Blank,Blank,Sc Ganguly,Ac Gilchrist,Wp Saha,Ac Gilchrist,1977-09-19
13422,,336020,42,S Dhawan,12/5/1985,Left-hand Bat,Right-arm Offbreak,India,Player,Delhi Daredevils,Rajasthan Royals,2008,,23,,Blank,Blank,V Sehwag,Sk Warne,Kd Karthik,M Rawat,1985-12-05
13423,,336020,88,Kd Karthik,6/1/1985,Right-hand Bat,N/a,India,Keeper,Delhi Daredevils,Rajasthan Royals,2008,,23,,Blank,Blank,V Sehwag,Sk Warne,Kd Karthik,M Rawat,1985-06-01
13424,,336020,90,Mf Maharoof,9/7/1984,Right-hand Bat,Right-arm Fast-medium,India,Player,Delhi Daredevils,Rajasthan Royals,2008,,24,,Blank,Blank,V Sehwag,Sk Warne,Kd Karthik,M Rawat,1984-09-07
13426,,336020,110,Ab De Villiers,2/17/1984,Right-hand Bat,Right-arm Medium,South Africa,Player,Delhi Daredevils,Rajasthan Royals,2008,,24,,Blank,Blank,V Sehwag,Sk Warne,Kd Karthik,M Rawat,1984-02-17
13428,,336020,118,Gd Mcgrath,2/9/1970,Right-hand Bat,Right-arm Fast-medium,Australia,Player,Delhi Daredevils,Rajasthan Royals,2008,,38,,Blank,Blank,V Sehwag,Sk Warne,Kd Karthik,M Rawat,1970-02-09
13430,,336020,136,A Mishra,11/24/1982,Right-hand Bat,Legbreak,India,Player,Delhi Daredevils,Rajasthan Royals,2008,,26,,Blank,Blank,V Sehwag,Sk Warne,Kd Karthik,M Rawat,1982-11-24
13431,,336020,31,Yk Pathan,11/17/1982,Right-hand Bat,Right-arm Offbreak,India,Player,Rajasthan Royals,Delhi Daredevils,2008,,26,,Blank,Blank,Sk Warne,V Sehwag,M Rawat,Kd Karthik,1982-11-17
13439,,336020,126,Mm Patel,7/12/1983,Right-hand Bat,Right-arm Medium-fast,India,Player,Rajasthan Royals,Delhi Daredevils,2008,,25,,Blank,Blank,Sk Warne,V Sehwag,M Rawat,Kd Karthik,1983-07-12
13440,,336020,137,Ad Mascarenhas,10/30/1977,Right-hand Bat,Right-arm Fast-medium,England,Player,Rajasthan Royals,Delhi Daredevils,2008,,31,,Blank,Blank,Sk Warne,V Sehwag,M Rawat,Kd Karthik,1977-10-30
13442,,336021,6,R Dravid,1/11/1973,Right-hand Bat,Right-arm Offbreak,India,Captain,Royal Challengers Bangalore,Kings Xi Punjab,2008,,35,,Blank,Blank,R Dravid,Yuvraj Singh,Mv Boucher,U Kaul,1973-01-11
13443,,336021,8,V Kohli,11/5/1988,Right-hand Bat,Right-arm Medium,India,Player,Royal Challengers Bangalore,Kings Xi Punjab,2008,,20,,Blank,Blank,R Dravid,Yuvraj Singh,Mv Boucher,U Kaul,1988-11-05
13447,,336021,15,Z Khan,10/7/1978,Right-hand Bat,Left-arm Fast-medium,India,Player,Royal Challengers Bangalore,Kings Xi Punjab,2008,,30,,Blank,Blank,R Dravid,Yuvraj Singh,Mv Boucher,U Kaul,1978-10-07
13449,,336021,94,Dw Steyn,6/27/1983,Right-hand Bat,Right-arm Fast,South Africa,Player,Royal Challengers Bangalore,Kings Xi Punjab,2008,,25,,Blank,Blank,R Dravid,Yuvraj Singh,Mv Boucher,U Kaul,1983-06-27
13452,,336021,130,J Arunkumar,1/18/1975,Right-hand Bat,Right-arm Offbreak,India,Player,Royal Challengers Bangalore,Kings Xi Punjab,2008,,33,,Blank,Blank,R Dravid,Yuvraj Singh,Mv Boucher,U Kaul,1975-01-18
13453,,336021,25,Jr Hopes,10/24/1978,Right-hand Bat,Right-arm Medium,Australia,Player,Kings Xi Punjab,Royal Challengers Bangalore,2008,,30,,Blank,Blank,Yuvraj Singh,R Dravid,U Kaul,Mv Boucher,1978-10-24
13456,,336021,64,Dpmd Jayawardene,5/27/1977,Right-hand Bat,Right-arm Medium,Sri Lanka,Player,Kings Xi Punjab,Royal Challengers Bangalore,2008,,31,,Blank,Blank,Yuvraj Singh,R Dravid,U Kaul,Mv Boucher,1977-05-27
13458,,336021,77,S Sreesanth,2/6/1983,Right-hand Bat,Right-arm Fast-medium,India,Player,Kings Xi Punjab,Royal Challengers Bangalore,2008,,25,,Blank,Blank,Yuvraj Singh,R Dravid,U Kaul,Mv Boucher,1983-02-06
13459,,336021,78,Vrv Singh,9/17/1984,Right-hand Bat,Right-arm Medium-fast,India,Player,Kings Xi Punjab,Royal Challengers Bangalore,2008,,24,,Blank,Blank,Yuvraj Singh,R Dravid,U Kaul,Mv Boucher,1984-09-17
13460,,336021,92,Tm Srivastava,11/7/1989,Left-hand Bat,Right-arm Medium,India,Player,Kings Xi Punjab,Royal Challengers Bangalore,2008,,19,,Blank,Blank,Yuvraj Singh,R Dravid,U Kaul,Mv Boucher,1989-11-07
13461,,336021,100,Se Marsh,7/9/1983,Left-hand Bat,Slow Left-arm Orthodox,Australia,Player,Kings Xi Punjab,Royal Challengers Bangalore,2008,,25,,Blank,Blank,Yuvraj Singh,R Dravid,U Kaul,Mv Boucher,1983-07-09
13465,,336022,41,V Sehwag,10/20/1978,Right-hand Bat,Right-arm Offbreak,India,Captain,Delhi Daredevils,Kolkata Knight Riders,2008,,30,,Blank,Blank,V Sehwag,Sc Ganguly,Ab De Villiers,Wp Saha,1978-10-20
13466,,336022,42,S Dhawan,12/5/1985,Left-hand Bat,Right-arm Offbreak,India,Player,Delhi Daredevils,Kolkata Knight Riders,2008,,23,,Blank,Blank,V Sehwag,Sc Ganguly,Ab De Villiers,Wp Saha,1985-12-05
13468,,336022,90,Mf Maharoof,9/7/1984,Right-hand Bat,Right-arm Fast-medium,India,Player,Delhi Daredevils,Kolkata Knight Riders,2008,,24,,Blank,Blank,V Sehwag,Sc Ganguly,Ab De Villiers,Wp Saha,1984-09-07
13469,,336022,91,Vy Mahesh,12/21/1987,Right-hand Bat,Right-arm Medium-fast,India,Player,Delhi Daredevils,Kolkata Knight Riders,2008,,21,,Blank,Blank,V Sehwag,Sc Ganguly,Ab De Villiers,Wp Saha,1987-12-21
13470,,336022,110,Ab De Villiers,2/17/1984,Right-hand Bat,Right-arm Medium,South Africa,Keeper,Delhi Daredevils,Kolkata Knight Riders,2008,,24,,Blank,Blank,V Sehwag,Sc Ganguly,Ab De Villiers,Wp Saha,1984-02-17
13471,,336022,116,Pj Sangwan,11/5/1990,Right-hand Bat,Left-arm Medium,India,Player,Delhi Daredevils,Kolkata Knight Riders,2008,,18,,Blank,Blank,V Sehwag,Sc Ganguly,Ab De Villiers,Wp Saha,1990-11-05
13477,,336022,62,Wp Saha,10/24/1984,Right-hand Bat,N/a,India,Keeper,Kolkata Knight Riders,Delhi Daredevils,2008,,24,,Blank,Blank,Sc Ganguly,V Sehwag,Wp Saha,Ab De Villiers,1984-10-24
13478,,336022,63,Lr Shukla,5/6/1981,Right-hand Bat,Right-arm Medium,India,Player,Kolkata Knight Riders,Delhi Daredevils,2008,,27,,Blank,Blank,Sc Ganguly,V Sehwag,Wp Saha,Ab De Villiers,1981-05-06
13483,,336022,129,T Taibu,5/14/1983,Right-hand Bat,Right-arm Medium,Zimbabwea,Player,Kolkata Knight Riders,Delhi Daredevils,2008,,25,,Blank,Blank,Sc Ganguly,V Sehwag,Wp Saha,Ab De Villiers,1983-05-14
13485,,336022,144,Shoaib Akhtar,8/13/1975,Right-hand Bat,Right-arm Fast,Pakistan,Player,Kolkata Knight Riders,Delhi Daredevils,2008,,33,,Blank,Blank,Sc Ganguly,V Sehwag,Wp Saha,Ab De Villiers,1975-08-13
13488,,336023,23,S Badrinath,8/30/1980,Right-hand Bat,Right-arm Offbreak,India,Player,Chennai Super Kings,Mumbai Indians,2008,,28,,Blank,Blank,Ms Dhoni,Sr Tendulkar,Ms Dhoni,Yv Takawale,1980-08-30
13489,,336023,107,Sp Fleming,4/1/1973,Left-hand Bat,N/a,New Zealand,Player,Chennai Super Kings,Mumbai Indians,2008,,35,,Blank,Blank,Ms Dhoni,Sr Tendulkar,Ms Dhoni,Yv Takawale,1973-04-01
13493,,336023,120,Ms Gony,1/4/1984,Right-hand Bat,Right-arm Medium,India,Player,Chennai Super Kings,Mumbai Indians,2008,,24,,Blank,Blank,Ms Dhoni,Sr Tendulkar,Ms Dhoni,Yv Takawale,1984-01-04
13494,,336023,121,M Muralitharan,4/17/1972,Right-hand Bat,Right-arm Offbreak,Sri Lanka,Player,Chennai Super Kings,Mumbai Indians,2008,,36,,Blank,Blank,Ms Dhoni,Sr Tendulkar,Ms Dhoni,Yv Takawale,1972-04-17
13496,,336023,151,L Balaji,9/27/1981,Right-hand Bat,Right-arm Medium-fast,India,Player,Chennai Super Kings,Mumbai Indians,2008,,27,,Blank,Blank,Ms Dhoni,Sr Tendulkar,Ms Dhoni,Yv Takawale,1981-09-27
13497,,336023,44,St Jayasuriya,6/30/1969,Left-hand Bat,Slow Left-arm Orthodox,Sri Lanka,Player,Mumbai Indians,Chennai Super Kings,2008,,39,,Blank,Blank,Sr Tendulkar,Ms Dhoni,Yv Takawale,Ms Dhoni,1969-06-30
13498,,336023,45,Dj Thornely,10/1/1978,Right-hand Bat,Right-arm Medium,Australia,Player,Mumbai Indians,Chennai Super Kings,2008,,30,,Blank,Blank,Sr Tendulkar,Ms Dhoni,Yv Takawale,Ms Dhoni,1978-10-01
13500,,336023,48,Am Nayar,10/8/1983,Left-hand Bat,Right-arm Medium,India,Player,Mumbai Indians,Chennai Super Kings,2008,,25,,Blank,Blank,Sr Tendulkar,Ms Dhoni,Yv Takawale,Ms Dhoni,1983-10-08
13504,,336023,80,Ds Kulkarni,12/10/1988,Right-hand Bat,Right-arm Medium,India,Player,Mumbai Indians,Chennai Super Kings,2008,,20,,Blank,Blank,Sr Tendulkar,Ms Dhoni,Yv Takawale,Ms Dhoni,1988-12-10
13508,,336024,31,Yk Pathan,11/17/1982,Right-hand Bat,Right-arm Offbreak,India,Player,Rajasthan Royals,Kings Xi Punjab,2008,,26,,Blank,Blank,Sr Watson,Yuvraj Singh,Kamran Akmal,Kc Sangakkara,1982-11-17
13509,,336024,32,Sr Watson,6/17/1981,Right-hand Bat,Right-arm Fast-medium,Australia,Captain,Rajasthan Royals,Kings Xi Punjab,2008,,27,,Blank,Blank,Sr Watson,Yuvraj Singh,Kamran Akmal,Kc Sangakkara,1981-06-17
13510,,336024,33,M Kaif,12/1/1980,Right-hand Bat,Right-arm Offbreak,India,Player,Rajasthan Royals,Kings Xi Punjab,2008,,28,,Blank,Blank,Sr Watson,Yuvraj Singh,Kamran Akmal,Kc Sangakkara,1980-12-01
13511,,336024,36,M Rawat,10/25/1985,Right-hand Bat,N/a,India,Player,Rajasthan Royals,Kings Xi Punjab,2008,,23,,Blank,Blank,Sr Watson,Yuvraj Singh,Kamran Akmal,Kc Sangakkara,1985-10-25
13514,,336024,69,Kamran Akmal,1/13/1982,Right-hand Bat,N/a,Pakistan,Keeper,Rajasthan Royals,Kings Xi Punjab,2008,,26,,Blank,Blank,Sr Watson,Yuvraj Singh,Kamran Akmal,Kc Sangakkara,1982-01-13
13516,,336024,126,Mm Patel,7/12/1983,Right-hand Bat,Right-arm Medium-fast,India,Player,Rajasthan Royals,Kings Xi Punjab,2008,,25,,Blank,Blank,Sr Watson,Yuvraj Singh,Kamran Akmal,Kc Sangakkara,1983-07-12
13517,,336024,138,Nk Patel,3/26/1981,Left-hand Bat,N/a,India,Player,Rajasthan Royals,Kings Xi Punjab,2008,,27,,Blank,Blank,Sr Watson,Yuvraj Singh,Kamran Akmal,Kc Sangakkara,1981-03-26
13518,,336024,141,Younis Khan,11/29/1977,Right-hand Bat,Right-arm Medium,Pakistan,Player,Rajasthan Royals,Kings Xi Punjab,2008,,31,,Blank,Blank,Sr Watson,Yuvraj Singh,Kamran Akmal,Kc Sangakkara,1977-11-29
13521,,336024,27,Yuvraj Singh,12/12/1981,Left-hand Bat,Slow Left-arm Orthodox,India,Captain,Kings Xi Punjab,Rajasthan Royals,2008,,27,,Blank,Blank,Yuvraj Singh,Sr Watson,Kc Sangakkara,Kamran Akmal,1981-12-12
13523,,336024,67,Pp Chawla,12/24/1988,Left-hand Bat,Legbreak,India,Player,Kings Xi Punjab,Rajasthan Royals,2008,,20,,Blank,Blank,Yuvraj Singh,Sr Watson,Kc Sangakkara,Kamran Akmal,1988-12-24
13524,,336024,68,Wa Mota,9/20/1981,Right-hand Bat,Right-arm Medium,India,Player,Kings Xi Punjab,Rajasthan Royals,2008,,27,,Blank,Blank,Yuvraj Singh,Sr Watson,Kc Sangakkara,Kamran Akmal,1981-09-20
13528,,336024,139,La Pomersbach,9/28/1984,Left-hand Bat,Right-arm Offbreak,Australia,Player,Kings Xi Punjab,Rajasthan Royals,2008,,24,,Blank,Blank,Yuvraj Singh,Sr Watson,Kc Sangakkara,Kamran Akmal,1984-09-28
13529,,336024,153,Rr Powar,5/20/1978,Right-hand Bat,Right-arm Offbreak,India,Player,Kings Xi Punjab,Rajasthan Royals,2008,,30,,Blank,Blank,Yuvraj Singh,Sr Watson,Kc Sangakkara,Kamran Akmal,1978-05-20
13531,,336025,54,Y Venugopal Rao,2/26/1982,Right-hand Bat,Right-arm Offbreak,India,Player,Deccan Chargers,Delhi Daredevils,2008,,26,,Blank,Blank,Ac Gilchrist,V Sehwag,Ac Gilchrist,Kd Karthik,1982-02-26
13533,,336025,58,Sb Styris,7/10/1975,Right-hand Bat,Right-arm Medium,New Zealand,Player,Deccan Chargers,Delhi Daredevils,2008,,33,,Blank,Blank,Ac Gilchrist,V Sehwag,Ac Gilchrist,Kd Karthik,1975-07-10
13542,,336025,41,V Sehwag,10/20/1978,Right-hand Bat,Right-arm Offbreak,India,Captain,Delhi Daredevils,Deccan Chargers,2008,,30,,Blank,Blank,V Sehwag,Ac Gilchrist,Kd Karthik,Ac Gilchrist,1978-10-20
13544,,336025,87,Mk Tiwary,11/14/1985,Right-hand Bat,Legbreak Googly,India,Player,Delhi Daredevils,Deccan Chargers,2008,,23,,Blank,Blank,V Sehwag,Ac Gilchrist,Kd Karthik,Ac Gilchrist,1985-11-14
13545,,336025,88,Kd Karthik,6/1/1985,Right-hand Bat,N/a,India,Keeper,Delhi Daredevils,Deccan Chargers,2008,,23,,Blank,Blank,V Sehwag,Ac Gilchrist,Kd Karthik,Ac Gilchrist,1985-06-01
13547,,336025,90,Mf Maharoof,9/7/1984,Right-hand Bat,Right-arm Fast-medium,India,Player,Delhi Daredevils,Deccan Chargers,2008,,24,,Blank,Blank,V Sehwag,Ac Gilchrist,Kd Karthik,Ac Gilchrist,1984-09-07
13549,,336025,118,Gd Mcgrath,2/9/1970,Right-hand Bat,Right-arm Fast-medium,Australia,Player,Delhi Daredevils,Deccan Chargers,2008,,38,,Blank,Blank,V Sehwag,Ac Gilchrist,Kd Karthik,Ac Gilchrist,1970-02-09
13552,,336026,1,Sc Ganguly,7/8/1972,Left-hand Bat,Right-arm Medium,India,Captain,Kolkata Knight Riders,Mumbai Indians,2008,,36,,Blank,Blank,Sc Ganguly,Sr Tendulkar,Wp Saha,Yv Takawale,1972-07-08
13553,,336026,4,Dj Hussey,7/15/1977,Right-hand Bat,Right-arm Offbreak,Australia,Player,Kolkata Knight Riders,Mumbai Indians,2008,,31,,Blank,Blank,Sc Ganguly,Sr Tendulkar,Wp Saha,Yv Takawale,1977-07-15
13554,,336026,5,Mohammad Hafeez,10/17/1980,Right-hand Bat,Right-arm Offbreak,Pakistan,Player,Kolkata Knight Riders,Mumbai Indians,2008,,28,,Blank,Blank,Sc Ganguly,Sr Tendulkar,Wp Saha,Yv Takawale,1980-10-17
13556,,336026,63,Lr Shukla,5/6/1981,Right-hand Bat,Right-arm Medium,India,Player,Kolkata Knight Riders,Mumbai Indians,2008,,27,,Blank,Blank,Sc Ganguly,Sr Tendulkar,Wp Saha,Yv Takawale,1981-05-06
13558,,336026,84,I Sharma,9/2/1988,Right-hand Bat,Right-arm Fast-medium,India,Player,Kolkata Knight Riders,Mumbai Indians,2008,,20,,Blank,Blank,Sc Ganguly,Sr Tendulkar,Wp Saha,Yv Takawale,1988-09-02
13562,,336026,144,Shoaib Akhtar,8/13/1975,Right-hand Bat,Right-arm Fast,Pakistan,Player,Kolkata Knight Riders,Mumbai Indians,2008,,33,,Blank,Blank,Sc Ganguly,Sr Tendulkar,Wp Saha,Yv Takawale,1975-08-13
13568,,336026,71,Dj Bravo,10/7/1983,Right-hand Bat,Right-arm Medium-fast,West Indies,Player,Mumbai Indians,Kolkata Knight Riders,2008,,25,,Blank,Blank,Sr Tendulkar,Sc Ganguly,Yv Takawale,Wp Saha,1983-10-07
13571,,336026,115,Rr Raje,9/3/1986,Right-hand Bat,Right-arm Fast-medium,India,Player,Mumbai Indians,Kolkata Knight Riders,2008,,22,,Blank,Blank,Sr Tendulkar,Sc Ganguly,Yv Takawale,Wp Saha,1986-09-03
13574,,336027,40,G Gambhir,10/14/1981,Left-hand Bat,Legbreak,India,Player,Delhi Daredevils,Kings Xi Punjab,2008,,27,,Blank,Blank,V Sehwag,Yuvraj Singh,Kd Karthik,U Kaul,1981-10-14
13575,,336027,41,V Sehwag,10/20/1978,Right-hand Bat,Right-arm Offbreak,India,Captain,Delhi Daredevils,Kings Xi Punjab,2008,,30,,Blank,Blank,V Sehwag,Yuvraj Singh,Kd Karthik,U Kaul,1978-10-20
13577,,336027,86,Shoaib Malik,2/1/1982,Right-hand Bat,Right-arm Offbreak,Pakistan,Player,Delhi Daredevils,Kings Xi Punjab,2008,,26,,Blank,Blank,V Sehwag,Yuvraj Singh,Kd Karthik,U Kaul,1982-02-01
13579,,336027,89,R Bhatia,10/22/1979,Right-hand Bat,Right-arm Medium-fast,India,Player,Delhi Daredevils,Kings Xi Punjab,2008,,29,,Blank,Blank,V Sehwag,Yuvraj Singh,Kd Karthik,U Kaul,1979-10-22
13581,,336027,116,Pj Sangwan,11/5/1990,Right-hand Bat,Left-arm Medium,India,Player,Delhi Daredevils,Kings Xi Punjab,2008,,18,,Blank,Blank,V Sehwag,Yuvraj Singh,Kd Karthik,U Kaul,1990-11-05
13583,,336027,135,Tm Dilshan,10/14/1976,Right-hand Bat,Right-arm Offbreak,Sri Lanka,Player,Delhi Daredevils,Kings Xi Punjab,2008,,32,,Blank,Blank,V Sehwag,Yuvraj Singh,Kd Karthik,U Kaul,1976-10-14
13584,,336027,136,A Mishra,11/24/1982,Right-hand Bat,Legbreak,India,Player,Delhi Daredevils,Kings Xi Punjab,2008,,26,,Blank,Blank,V Sehwag,Yuvraj Singh,Kd Karthik,U Kaul,1982-11-24
13586,,336027,27,Yuvraj Singh,12/12/1981,Left-hand Bat,Slow Left-arm Orthodox,India,Captain,Kings Xi Punjab,Delhi Daredevils,2008,,27,,Blank,Blank,Yuvraj Singh,V Sehwag,U Kaul,Kd Karthik,1981-12-12
13589,,336027,67,Pp Chawla,12/24/1988,Left-hand Bat,Legbreak,India,Player,Kings Xi Punjab,Delhi Daredevils,2008,,20,,Blank,Blank,Yuvraj Singh,V Sehwag,U Kaul,Kd Karthik,1988-12-24
13594,,336027,139,La Pomersbach,9/28/1984,Left-hand Bat,Right-arm Offbreak,Australia,Player,Kings Xi Punjab,Delhi Daredevils,2008,,24,,Blank,Blank,Yuvraj Singh,V Sehwag,U Kaul,Kd Karthik,1984-09-28
13596,,336028,6,R Dravid,1/11/1973,Right-hand Bat,Right-arm Offbreak,India,Captain,Royal Challengers Bangalore,Rajasthan Royals,2008,,35,,Blank,Blank,R Dravid,Sk Warne,Dt Patil,M Rawat,1973-01-11
13597,,336028,8,V Kohli,11/5/1988,Right-hand Bat,Right-arm Medium,India,Player,Royal Challengers Bangalore,Rajasthan Royals,2008,,20,,Blank,Blank,R Dravid,Sk Warne,Dt Patil,M Rawat,1988-11-05
13601,,336028,15,Z Khan,10/7/1978,Right-hand Bat,Left-arm Fast-medium,India,Player,Royal Challengers Bangalore,Rajasthan Royals,2008,,30,,Blank,Blank,R Dravid,Sk Warne,Dt Patil,M Rawat,1978-10-07
13615,,336028,101,Sa Asnodkar,3/29/1984,Right-hand Bat,Right-arm Offbreak,India,Player,Rajasthan Royals,Royal Challengers Bangalore,2008,,24,,Blank,Blank,Sk Warne,R Dravid,M Rawat,Dt Patil,1984-03-29
13616,,336028,102,Sohail Tanvir,12/12/1984,Left-hand Bat,Left-arm Medium-fast,Pakistan,Player,Rajasthan Royals,Royal Challengers Bangalore,2008,,24,,Blank,Blank,Sk Warne,R Dravid,M Rawat,Dt Patil,1984-12-12
13619,,336029,54,Y Venugopal Rao,2/26/1982,Right-hand Bat,Right-arm Offbreak,India,Player,Deccan Chargers,Mumbai Indians,2008,,26,,Blank,Blank,Ac Gilchrist,Sr Tendulkar,Ac Gilchrist,Yv Takawale,1982-02-26
13621,,336029,61,Rp Singh,12/6/1985,Right-hand Bat,Left-arm Fast-medium,India,Player,Deccan Chargers,Mumbai Indians,2008,,23,,Blank,Blank,Ac Gilchrist,Sr Tendulkar,Ac Gilchrist,Yv Takawale,1985-12-06
13622,,336029,70,Shahid Afridi,3/1/1980,Right-hand Bat,Legbreak Googly,Pakistan,Player,Deccan Chargers,Mumbai Indians,2008,,28,,Blank,Blank,Ac Gilchrist,Sr Tendulkar,Ac Gilchrist,Yv Takawale,1980-03-01
13623,,336029,98,Dnt Zoysa,5/13/1978,Left-hand Bat,Left-arm Fast-medium,Sri Lanka,Player,Deccan Chargers,Mumbai Indians,2008,,30,,Blank,Blank,Ac Gilchrist,Sr Tendulkar,Ac Gilchrist,Yv Takawale,1978-05-13
13624,,336029,111,Lpc Silva,12/14/1979,Right-hand Bat,Legbreak,Sri Lanka,Player,Deccan Chargers,Mumbai Indians,2008,,29,,Blank,Blank,Ac Gilchrist,Sr Tendulkar,Ac Gilchrist,Yv Takawale,1979-12-14
13629,,336029,44,St Jayasuriya,6/30/1969,Left-hand Bat,Slow Left-arm Orthodox,Sri Lanka,Player,Mumbai Indians,Deccan Chargers,2008,,39,,Blank,Blank,Sr Tendulkar,Ac Gilchrist,Yv Takawale,Ac Gilchrist,1969-06-30
13630,,336029,45,Dj Thornely,10/1/1978,Right-hand Bat,Right-arm Medium,Australia,Player,Mumbai Indians,Deccan Chargers,2008,,30,,Blank,Blank,Sr Tendulkar,Ac Gilchrist,Yv Takawale,Ac Gilchrist,1978-10-01
13633,,336029,48,Am Nayar,10/8/1983,Left-hand Bat,Right-arm Medium,India,Player,Mumbai Indians,Deccan Chargers,2008,,25,,Blank,Blank,Sr Tendulkar,Ac Gilchrist,Yv Takawale,Ac Gilchrist,1983-10-08
13634,,336029,71,Dj Bravo,10/7/1983,Right-hand Bat,Right-arm Medium-fast,West Indies,Player,Mumbai Indians,Deccan Chargers,2008,,25,,Blank,Blank,Sr Tendulkar,Ac Gilchrist,Yv Takawale,Ac Gilchrist,1983-10-07
13641,,336030,20,Ms Dhoni,7/7/1981,Right-hand Bat,Right-arm Medium,India,Captainkeeper,Chennai Super Kings,Kolkata Knight Riders,2008,,27,,Blank,Blank,Ms Dhoni,Sc Ganguly,Ms Dhoni,Wp Saha,1981-07-07
13643,,336030,23,S Badrinath,8/30/1980,Right-hand Bat,Right-arm Offbreak,India,Player,Chennai Super Kings,Kolkata Knight Riders,2008,,28,,Blank,Blank,Ms Dhoni,Sc Ganguly,Ms Dhoni,Wp Saha,1980-08-30
13644,,336030,107,Sp Fleming,4/1/1973,Left-hand Bat,N/a,New Zealand,Player,Chennai Super Kings,Kolkata Knight Riders,2008,,35,,Blank,Blank,Ms Dhoni,Sc Ganguly,Ms Dhoni,Wp Saha,1973-04-01
13648,,336030,121,M Muralitharan,4/17/1972,Right-hand Bat,Right-arm Offbreak,Sri Lanka,Player,Chennai Super Kings,Kolkata Knight Riders,2008,,36,,Blank,Blank,Ms Dhoni,Sc Ganguly,Ms Dhoni,Wp Saha,1972-04-17
13650,,336030,151,L Balaji,9/27/1981,Right-hand Bat,Right-arm Medium-fast,India,Player,Chennai Super Kings,Kolkata Knight Riders,2008,,27,,Blank,Blank,Ms Dhoni,Sc Ganguly,Ms Dhoni,Wp Saha,1981-09-27
13652,,336030,4,Dj Hussey,7/15/1977,Right-hand Bat,Right-arm Offbreak,Australia,Player,Kolkata Knight Riders,Chennai Super Kings,2008,,31,,Blank,Blank,Sc Ganguly,Ms Dhoni,Wp Saha,Ms Dhoni,1977-07-15
13654,,336030,62,Wp Saha,10/24/1984,Right-hand Bat,N/a,India,Keeper,Kolkata Knight Riders,Chennai Super Kings,2008,,24,,Blank,Blank,Sc Ganguly,Ms Dhoni,Wp Saha,Ms Dhoni,1984-10-24
13655,,336030,63,Lr Shukla,5/6/1981,Right-hand Bat,Right-arm Medium,India,Player,Kolkata Knight Riders,Chennai Super Kings,2008,,27,,Blank,Blank,Sc Ganguly,Ms Dhoni,Wp Saha,Ms Dhoni,1981-05-06
13657,,336030,84,I Sharma,9/2/1988,Right-hand Bat,Right-arm Fast-medium,India,Player,Kolkata Knight Riders,Chennai Super Kings,2008,,20,,Blank,Blank,Sc Ganguly,Ms Dhoni,Wp Saha,Ms Dhoni,1988-09-02
13659,,336030,103,Salman Butt,10/7/1984,Left-hand Bat,Right-arm Offbreak,Pakistan,Player,Kolkata Knight Riders,Chennai Super Kings,2008,,24,,Blank,Blank,Sc Ganguly,Ms Dhoni,Wp Saha,Ms Dhoni,1984-10-07
13661,,336030,144,Shoaib Akhtar,8/13/1975,Right-hand Bat,Right-arm Fast,Pakistan,Player,Kolkata Knight Riders,Chennai Super Kings,2008,,33,,Blank,Blank,Sc Ganguly,Ms Dhoni,Wp Saha,Ms Dhoni,1975-08-13
13665,,336031,88,Kd Karthik,6/1/1985,Right-hand Bat,N/a,India,Keeper,Delhi Daredevils,Royal Challengers Bangalore,2008,,23,,Blank,Blank,V Sehwag,R Dravid,Kd Karthik,Sp Goswami,1985-06-01
13670,,336031,116,Pj Sangwan,11/5/1990,Right-hand Bat,Left-arm Medium,India,Player,Delhi Daredevils,Royal Challengers Bangalore,2008,,18,,Blank,Blank,V Sehwag,R Dravid,Kd Karthik,Sp Goswami,1990-11-05
13674,,336031,9,Jh Kallis,10/16/1975,Right-hand Bat,Right-arm Fast-medium,South Africa,Player,Royal Challengers Bangalore,Delhi Daredevils,2008,,33,,Blank,Blank,R Dravid,V Sehwag,Sp Goswami,Kd Karthik,1975-10-16
13675,,336031,10,Cl White,8/18/1983,Right-hand Bat,Legbreak Googly,Australia,Player,Royal Challengers Bangalore,Delhi Daredevils,2008,,25,,Blank,Blank,R Dravid,V Sehwag,Sp Goswami,Kd Karthik,1983-08-18
13676,,336031,12,B Akhil,10/7/1977,Right-hand Bat,Right-arm Medium-fast,India,Player,Royal Challengers Bangalore,Delhi Daredevils,2008,,31,,Blank,Blank,R Dravid,V Sehwag,Sp Goswami,Kd Karthik,1977-10-07
13677,,336031,14,P Kumar,10/2/1986,Right-hand Bat,Right-arm Medium,India,Player,Royal Challengers Bangalore,Delhi Daredevils,2008,,22,,Blank,Blank,R Dravid,V Sehwag,Sp Goswami,Kd Karthik,1986-10-02
13680,,336031,94,Dw Steyn,6/27/1983,Right-hand Bat,Right-arm Fast,South Africa,Player,Royal Challengers Bangalore,Delhi Daredevils,2008,,25,,Blank,Blank,R Dravid,V Sehwag,Sp Goswami,Kd Karthik,1983-06-27
13681,,336031,113,Misbah-ul-haq,5/28/1974,Right-hand Bat,Legbreak,Pakistan,Player,Royal Challengers Bangalore,Delhi Daredevils,2008,,34,,Blank,Blank,R Dravid,V Sehwag,Sp Goswami,Kd Karthik,1974-05-28
13682,,336031,124,A Kumble,10/17/1970,Right-hand Bat,Legbreak Googly,India,Player,Royal Challengers Bangalore,Delhi Daredevils,2008,,38,,Blank,Blank,R Dravid,V Sehwag,Sp Goswami,Kd Karthik,1970-10-17
13685,,336032,32,Sr Watson,6/17/1981,Right-hand Bat,Right-arm Fast-medium,Australia,Player,Rajasthan Royals,Kolkata Knight Riders,2008,,27,,Blank,Blank,Sk Warne,Sc Ganguly,M Rawat,Wp Saha,1981-06-17
13688,,336032,36,M Rawat,10/25/1985,Right-hand Bat,N/a,India,Keeper,Rajasthan Royals,Kolkata Knight Riders,2008,,23,,Blank,Blank,Sk Warne,Sc Ganguly,M Rawat,Wp Saha,1985-10-25
13689,,336032,38,Sk Warne,9/13/1969,Right-hand Bat,Legbreak Googly,Australia,Captain,Rajasthan Royals,Kolkata Knight Riders,2008,,39,,Blank,Blank,Sk Warne,Sc Ganguly,M Rawat,Wp Saha,1969-09-13
13690,,336032,39,Sk Trivedi,9/4/1982,Right-hand Bat,Right-arm Medium,India,Player,Rajasthan Royals,Kolkata Knight Riders,2008,,26,,Blank,Blank,Sk Warne,Sc Ganguly,M Rawat,Wp Saha,1982-09-04
13691,,336032,74,Gc Smith,2/1/1981,Left-hand Bat,Right-arm Offbreak,South Africa,Player,Rajasthan Royals,Kolkata Knight Riders,2008,,27,,Blank,Blank,Sk Warne,Sc Ganguly,M Rawat,Wp Saha,1981-02-01
13694,,336032,126,Mm Patel,7/12/1983,Right-hand Bat,Right-arm Medium-fast,India,Player,Rajasthan Royals,Kolkata Knight Riders,2008,,25,,Blank,Blank,Sk Warne,Sc Ganguly,M Rawat,Wp Saha,1983-07-12
13696,,336032,4,Dj Hussey,7/15/1977,Right-hand Bat,Right-arm Offbreak,Australia,Player,Kolkata Knight Riders,Rajasthan Royals,2008,,31,,Blank,Blank,Sc Ganguly,Sk Warne,Wp Saha,M Rawat,1977-07-15
13698,,336032,62,Wp Saha,10/24/1984,Right-hand Bat,N/a,India,Keeper,Kolkata Knight Riders,Rajasthan Royals,2008,,24,,Blank,Blank,Sc Ganguly,Sk Warne,Wp Saha,M Rawat,1984-10-24
13701,,336032,84,I Sharma,9/2/1988,Right-hand Bat,Right-arm Fast-medium,India,Player,Kolkata Knight Riders,Rajasthan Royals,2008,,20,,Blank,Blank,Sc Ganguly,Sk Warne,Wp Saha,M Rawat,1988-09-02
13702,,336032,95,Db Das,9/22/1986,Right-hand Bat,Legbreak Googly,India,Player,Kolkata Knight Riders,Rajasthan Royals,2008,,22,,Blank,Blank,Sc Ganguly,Sk Warne,Wp Saha,M Rawat,1986-09-22
13703,,336032,103,Salman Butt,10/7/1984,Left-hand Bat,Right-arm Offbreak,Pakistan,Player,Kolkata Knight Riders,Rajasthan Royals,2008,,24,,Blank,Blank,Sc Ganguly,Sk Warne,Wp Saha,M Rawat,1984-10-07
13707,,336033,46,Rv Uthappa,11/11/1985,Right-hand Bat,Right-arm Medium,India,Player,Mumbai Indians,Kings Xi Punjab,2008,,23,,Blank,Blank,Sr Tendulkar,Yuvraj Singh,Pr Shah,U Kaul,1985-11-11
13711,,336033,73,A Nehra,4/29/1979,Right-hand Bat,Left-arm Medium-fast,India,Player,Mumbai Indians,Kings Xi Punjab,2008,,29,,Blank,Blank,Sr Tendulkar,Yuvraj Singh,Pr Shah,U Kaul,1979-04-29
13712,,336033,133,Sr Tendulkar,4/24/1973,Right-hand Bat,Right-arm Offbreak,India,Captain,Mumbai Indians,Kings Xi Punjab,2008,,35,,Blank,Blank,Sr Tendulkar,Yuvraj Singh,Pr Shah,U Kaul,1973-04-24
13713,,336033,147,Dr Smith,4/12/1983,Right-hand Bat,Right-arm Medium,West Indies,Player,Mumbai Indians,Kings Xi Punjab,2008,,25,,Blank,Blank,Sr Tendulkar,Yuvraj Singh,Pr Shah,U Kaul,1983-04-12
13714,,336033,148,Sd Chitnis,5/6/1987,Right-hand Bat,Right-arm Offbreak,India,Player,Mumbai Indians,Kings Xi Punjab,2008,,21,,Blank,Blank,Sr Tendulkar,Yuvraj Singh,Pr Shah,U Kaul,1987-05-06
13717,,336033,25,Jr Hopes,10/24/1978,Right-hand Bat,Right-arm Medium,Australia,Player,Kings Xi Punjab,Mumbai Indians,2008,,30,,Blank,Blank,Yuvraj Singh,Sr Tendulkar,U Kaul,Pr Shah,1978-10-24
13720,,336033,64,Dpmd Jayawardene,5/27/1977,Right-hand Bat,Right-arm Medium,Sri Lanka,Player,Kings Xi Punjab,Mumbai Indians,2008,,31,,Blank,Blank,Yuvraj Singh,Sr Tendulkar,U Kaul,Pr Shah,1977-05-27
13721,,336033,67,Pp Chawla,12/24/1988,Left-hand Bat,Legbreak,India,Player,Kings Xi Punjab,Mumbai Indians,2008,,20,,Blank,Blank,Yuvraj Singh,Sr Tendulkar,U Kaul,Pr Shah,1988-12-24
13722,,336033,77,S Sreesanth,2/6/1983,Right-hand Bat,Right-arm Fast-medium,India,Player,Kings Xi Punjab,Mumbai Indians,2008,,25,,Blank,Blank,Yuvraj Singh,Sr Tendulkar,U Kaul,Pr Shah,1983-02-06
13726,,336033,134,U Kaul,12/2/1987,Left-hand Bat,N/a,India,Keeper,Kings Xi Punjab,Mumbai Indians,2008,,21,,Blank,Blank,Yuvraj Singh,Sr Tendulkar,U Kaul,Pr Shah,1987-12-02
13730,,336034,9,Jh Kallis,10/16/1975,Right-hand Bat,Right-arm Fast-medium,South Africa,Player,Royal Challengers Bangalore,Chennai Super Kings,2008,,33,,Blank,Blank,R Dravid,Ms Dhoni,Mv Boucher,Pa Patel,1975-10-16
13734,,336034,81,R Vinay Kumar,2/12/1984,Right-hand Bat,Right-arm Medium,India,Player,Royal Challengers Bangalore,Chennai Super Kings,2008,,24,,Blank,Blank,R Dravid,Ms Dhoni,Mv Boucher,Pa Patel,1984-02-12
13737,,336034,124,A Kumble,10/17/1970,Right-hand Bat,Legbreak Googly,India,Player,Royal Challengers Bangalore,Chennai Super Kings,2008,,38,,Blank,Blank,R Dravid,Ms Dhoni,Mv Boucher,Pa Patel,1970-10-17
13738,,336034,132,Sp Goswami,5/18/1989,Left-hand Bat,N/a,India,Player,Royal Challengers Bangalore,Chennai Super Kings,2008,,19,,Blank,Blank,R Dravid,Ms Dhoni,Mv Boucher,Pa Patel,1989-05-18
13743,,336034,107,Sp Fleming,4/1/1973,Left-hand Bat,N/a,New Zealand,Player,Chennai Super Kings,Royal Challengers Bangalore,2008,,35,,Blank,Blank,Ms Dhoni,R Dravid,Pa Patel,Mv Boucher,1973-04-01
13745,,336034,109,Ja Morkel,6/10/1981,Left-hand Bat,Right-arm Medium-fast,South Africa,Player,Chennai Super Kings,Royal Challengers Bangalore,2008,,27,,Blank,Blank,Ms Dhoni,R Dravid,Pa Patel,Mv Boucher,1981-06-10
13746,,336034,120,Ms Gony,1/4/1984,Right-hand Bat,Right-arm Medium,India,Player,Chennai Super Kings,Royal Challengers Bangalore,2008,,24,,Blank,Blank,Ms Dhoni,R Dravid,Pa Patel,Mv Boucher,1984-01-04
13748,,336034,122,M Ntini,7/6/1977,Right-hand Bat,Right-arm Fast,South Africa,Player,Chennai Super Kings,Royal Challengers Bangalore,2008,,31,,Blank,Blank,Ms Dhoni,R Dravid,Pa Patel,Mv Boucher,1977-07-06
13749,,336034,151,L Balaji,9/27/1981,Right-hand Bat,Right-arm Medium-fast,India,Player,Chennai Super Kings,Royal Challengers Bangalore,2008,,27,,Blank,Blank,Ms Dhoni,R Dravid,Pa Patel,Mv Boucher,1981-09-27
13751,,336036,54,Y Venugopal Rao,2/26/1982,Right-hand Bat,Right-arm Offbreak,India,Player,Deccan Chargers,Kings Xi Punjab,2008,,26,,Blank,Blank,Ac Gilchrist,Yuvraj Singh,Ac Gilchrist,Kc Sangakkara,1982-02-26
13752,,336036,57,Rg Sharma,4/30/1987,Right-hand Bat,Right-arm Offbreak,India,Player,Deccan Chargers,Kings Xi Punjab,2008,,21,,Blank,Blank,Ac Gilchrist,Yuvraj Singh,Ac Gilchrist,Kc Sangakkara,1987-04-30
13757,,336036,111,Lpc Silva,12/14/1979,Right-hand Bat,Legbreak,Sri Lanka,Player,Deccan Chargers,Kings Xi Punjab,2008,,29,,Blank,Blank,Ac Gilchrist,Yuvraj Singh,Ac Gilchrist,Kc Sangakkara,1979-12-14
13761,,336036,26,Kc Sangakkara,10/27/1977,Left-hand Bat,Right-arm Offbreak,Sri Lanka,Keeper,Kings Xi Punjab,Deccan Chargers,2008,,31,,Blank,Blank,Yuvraj Singh,Ac Gilchrist,Kc Sangakkara,Ac Gilchrist,1977-10-27
13765,,336036,77,S Sreesanth,2/6/1983,Right-hand Bat,Right-arm Fast-medium,India,Player,Kings Xi Punjab,Deccan Chargers,2008,,25,,Blank,Blank,Yuvraj Singh,Ac Gilchrist,Kc Sangakkara,Ac Gilchrist,1983-02-06
13766,,336036,78,Vrv Singh,9/17/1984,Right-hand Bat,Right-arm Medium-fast,India,Player,Kings Xi Punjab,Deccan Chargers,2008,,24,,Blank,Blank,Yuvraj Singh,Ac Gilchrist,Kc Sangakkara,Ac Gilchrist,1984-09-17
13767,,336036,92,Tm Srivastava,11/7/1989,Left-hand Bat,Right-arm Medium,India,Player,Kings Xi Punjab,Deccan Chargers,2008,,19,,Blank,Blank,Yuvraj Singh,Ac Gilchrist,Kc Sangakkara,Ac Gilchrist,1989-11-07
13768,,336036,100,Se Marsh,7/9/1983,Left-hand Bat,Slow Left-arm Orthodox,Australia,Player,Kings Xi Punjab,Deccan Chargers,2008,,25,,Blank,Blank,Yuvraj Singh,Ac Gilchrist,Kc Sangakkara,Ac Gilchrist,1983-07-09
13772,,336037,40,G Gambhir,10/14/1981,Left-hand Bat,Legbreak,India,Player,Delhi Daredevils,Mumbai Indians,2008,,27,,Blank,Blank,V Sehwag,Sr Tendulkar,Kd Karthik,Pr Shah,1981-10-14
13775,,336037,87,Mk Tiwary,11/14/1985,Right-hand Bat,Legbreak Googly,India,Player,Delhi Daredevils,Mumbai Indians,2008,,23,,Blank,Blank,V Sehwag,Sr Tendulkar,Kd Karthik,Pr Shah,1985-11-14
13779,,336037,118,Gd Mcgrath,2/9/1970,Right-hand Bat,Right-arm Fast-medium,Australia,Player,Delhi Daredevils,Mumbai Indians,2008,,38,,Blank,Blank,V Sehwag,Sr Tendulkar,Kd Karthik,Pr Shah,1970-02-09
13781,,336037,136,A Mishra,11/24/1982,Right-hand Bat,Legbreak,India,Player,Delhi Daredevils,Mumbai Indians,2008,,26,,Blank,Blank,V Sehwag,Sr Tendulkar,Kd Karthik,Pr Shah,1982-11-24
13782,,336037,436,B Geeves,6/13/1982,Right-hand Bat,Right-arm Fast-medium,Australia,Player,Delhi Daredevils,Mumbai Indians,2008,,26,,Blank,Blank,V Sehwag,Sr Tendulkar,Kd Karthik,Pr Shah,1982-06-13
13783,,336037,44,St Jayasuriya,6/30/1969,Left-hand Bat,Slow Left-arm Orthodox,Sri Lanka,Player,Mumbai Indians,Delhi Daredevils,2008,,39,,Blank,Blank,Sr Tendulkar,V Sehwag,Pr Shah,Kd Karthik,1969-06-30
13784,,336037,46,Rv Uthappa,11/11/1985,Right-hand Bat,Right-arm Medium,India,Player,Mumbai Indians,Delhi Daredevils,2008,,23,,Blank,Blank,Sr Tendulkar,V Sehwag,Pr Shah,Kd Karthik,1985-11-11
13786,,336037,48,Am Nayar,10/8/1983,Left-hand Bat,Right-arm Medium,India,Player,Mumbai Indians,Delhi Daredevils,2008,,25,,Blank,Blank,Sr Tendulkar,V Sehwag,Pr Shah,Kd Karthik,1983-10-08
13789,,336037,80,Ds Kulkarni,12/10/1988,Right-hand Bat,Right-arm Medium,India,Player,Mumbai Indians,Delhi Daredevils,2008,,20,,Blank,Blank,Sr Tendulkar,V Sehwag,Pr Shah,Kd Karthik,1988-12-10
13791,,336037,147,Dr Smith,4/12/1983,Right-hand Bat,Right-arm Medium,West Indies,Player,Mumbai Indians,Delhi Daredevils,2008,,25,,Blank,Blank,Sr Tendulkar,V Sehwag,Pr Shah,Kd Karthik,1983-04-12
13792,,336037,148,Sd Chitnis,5/6/1987,Right-hand Bat,Right-arm Offbreak,India,Player,Mumbai Indians,Delhi Daredevils,2008,,21,,Blank,Blank,Sr Tendulkar,V Sehwag,Pr Shah,Kd Karthik,1987-05-06
13794,,336038,30,T Kohli,12/17/1988,Right-hand Bat,Right-arm Medium,India,Player,Rajasthan Royals,Chennai Super Kings,2008,,20,,Blank,Blank,Sk Warne,Ms Dhoni,Kamran Akmal,Pa Patel,1988-12-17
13795,,336038,31,Yk Pathan,11/17/1982,Right-hand Bat,Right-arm Offbreak,India,Player,Rajasthan Royals,Chennai Super Kings,2008,,26,,Blank,Blank,Sk Warne,Ms Dhoni,Kamran Akmal,Pa Patel,1982-11-17
13800,,336038,74,Gc Smith,2/1/1981,Left-hand Bat,Right-arm Offbreak,South Africa,Player,Rajasthan Royals,Chennai Super Kings,2008,,27,,Blank,Blank,Sk Warne,Ms Dhoni,Kamran Akmal,Pa Patel,1981-02-01
13801,,336038,75,Pankaj Singh,5/6/1985,Right-hand Bat,Right-arm Medium-fast,India,Player,Rajasthan Royals,Chennai Super Kings,2008,,23,,Blank,Blank,Sk Warne,Ms Dhoni,Kamran Akmal,Pa Patel,1985-05-06
13802,,336038,101,Sa Asnodkar,3/29/1984,Right-hand Bat,Right-arm Offbreak,India,Player,Rajasthan Royals,Chennai Super Kings,2008,,24,,Blank,Blank,Sk Warne,Ms Dhoni,Kamran Akmal,Pa Patel,1984-03-29
13803,,336038,102,Sohail Tanvir,12/12/1984,Left-hand Bat,Left-arm Medium-fast,Pakistan,Player,Rajasthan Royals,Chennai Super Kings,2008,,24,,Blank,Blank,Sk Warne,Ms Dhoni,Kamran Akmal,Pa Patel,1984-12-12
13805,,336038,17,Pa Patel,3/9/1985,Left-hand Bat,N/a,India,Keeper,Chennai Super Kings,Rajasthan Royals,2008,,23,,Blank,Blank,Ms Dhoni,Sk Warne,Pa Patel,Kamran Akmal,1985-03-09
13807,,336038,21,Sk Raina,11/27/1986,Left-hand Bat,Right-arm Offbreak,India,Player,Chennai Super Kings,Rajasthan Royals,2008,,22,,Blank,Blank,Ms Dhoni,Sk Warne,Pa Patel,Kamran Akmal,1986-11-27
13810,,336038,109,Ja Morkel,6/10/1981,Left-hand Bat,Right-arm Medium-fast,South Africa,Player,Chennai Super Kings,Rajasthan Royals,2008,,27,,Blank,Blank,Ms Dhoni,Sk Warne,Pa Patel,Kamran Akmal,1981-06-10
13811,,336038,120,Ms Gony,1/4/1984,Right-hand Bat,Right-arm Medium,India,Player,Chennai Super Kings,Rajasthan Royals,2008,,24,,Blank,Blank,Ms Dhoni,Sk Warne,Pa Patel,Kamran Akmal,1984-01-04
13812,,336038,121,M Muralitharan,4/17/1972,Right-hand Bat,Right-arm Offbreak,Sri Lanka,Player,Chennai Super Kings,Rajasthan Royals,2008,,36,,Blank,Blank,Ms Dhoni,Sk Warne,Pa Patel,Kamran Akmal,1972-04-17
13825,,336039,143,Dp Vijaykumar,10/20/1986,Right-hand Bat,Right-arm Medium,India,Player,Deccan Chargers,Royal Challengers Bangalore,2008,,22,,Blank,Blank,Vvs Laxman,R Dravid,Ac Gilchrist,Mv Boucher,1986-10-20
13827,,336039,6,R Dravid,1/11/1973,Right-hand Bat,Right-arm Offbreak,India,Captain,Royal Challengers Bangalore,Deccan Chargers,2008,,35,,Blank,Blank,R Dravid,Vvs Laxman,Mv Boucher,Ac Gilchrist,1973-01-11
13829,,336039,8,V Kohli,11/5/1988,Right-hand Bat,Right-arm Medium,India,Player,Royal Challengers Bangalore,Deccan Chargers,2008,,20,,Blank,Blank,R Dravid,Vvs Laxman,Mv Boucher,Ac Gilchrist,1988-11-05
13830,,336039,9,Jh Kallis,10/16/1975,Right-hand Bat,Right-arm Fast-medium,South Africa,Player,Royal Challengers Bangalore,Deccan Chargers,2008,,33,,Blank,Blank,R Dravid,Vvs Laxman,Mv Boucher,Ac Gilchrist,1975-10-16
13832,,336039,14,P Kumar,10/2/1986,Right-hand Bat,Right-arm Medium,India,Player,Royal Challengers Bangalore,Deccan Chargers,2008,,22,,Blank,Blank,R Dravid,Vvs Laxman,Mv Boucher,Ac Gilchrist,1986-10-02
13836,,336039,113,Misbah-ul-haq,5/28/1974,Right-hand Bat,Legbreak,Pakistan,Player,Royal Challengers Bangalore,Deccan Chargers,2008,,34,,Blank,Blank,R Dravid,Vvs Laxman,Mv Boucher,Ac Gilchrist,1974-05-28
13838,,336040,25,Jr Hopes,10/24/1978,Right-hand Bat,Right-arm Medium,Australia,Player,Kings Xi Punjab,Kolkata Knight Riders,2008,,30,,Blank,Blank,Yuvraj Singh,Sc Ganguly,Kc Sangakkara,Wp Saha,1978-10-24
13840,,336040,27,Yuvraj Singh,12/12/1981,Left-hand Bat,Slow Left-arm Orthodox,India,Captain,Kings Xi Punjab,Kolkata Knight Riders,2008,,27,,Blank,Blank,Yuvraj Singh,Sc Ganguly,Kc Sangakkara,Wp Saha,1981-12-12
13844,,336040,77,S Sreesanth,2/6/1983,Right-hand Bat,Right-arm Fast-medium,India,Player,Kings Xi Punjab,Kolkata Knight Riders,2008,,25,,Blank,Blank,Yuvraj Singh,Sc Ganguly,Kc Sangakkara,Wp Saha,1983-02-06
13847,,336040,100,Se Marsh,7/9/1983,Left-hand Bat,Slow Left-arm Orthodox,Australia,Player,Kings Xi Punjab,Kolkata Knight Riders,2008,,25,,Blank,Blank,Yuvraj Singh,Sc Ganguly,Kc Sangakkara,Wp Saha,1983-07-09
13855,,336040,103,Salman Butt,10/7/1984,Left-hand Bat,Right-arm Offbreak,Pakistan,Player,Kolkata Knight Riders,Kings Xi Punjab,2008,,24,,Blank,Blank,Sc Ganguly,Yuvraj Singh,Wp Saha,Kc Sangakkara,1984-10-07
13856,,336040,105,Umar Gul,4/14/1984,Right-hand Bat,Right-arm Fast-medium,Pakistan,Player,Kolkata Knight Riders,Kings Xi Punjab,2008,,24,,Blank,Blank,Sc Ganguly,Yuvraj Singh,Wp Saha,Kc Sangakkara,1984-04-14
13858,,336040,128,A Chopra,9/19/1977,Right-hand Bat,Right-arm Offbreak,India,Player,Kolkata Knight Riders,Kings Xi Punjab,2008,,31,,Blank,Blank,Sc Ganguly,Yuvraj Singh,Wp Saha,Kc Sangakkara,1977-09-19
13859,,336040,174,Baw Mendis,3/11/1985,Right-hand Bat,Right-arm Offbreak,Sri Lanka,Player,Kolkata Knight Riders,Kings Xi Punjab,2008,,23,,Blank,Blank,Sc Ganguly,Yuvraj Singh,Wp Saha,Kc Sangakkara,1985-03-11
13868,,336041,101,Sa Asnodkar,3/29/1984,Right-hand Bat,Right-arm Offbreak,India,Player,Rajasthan Royals,Mumbai Indians,2008,,24,,Blank,Blank,Sk Warne,Sr Tendulkar,Kamran Akmal,Yv Takawale,1984-03-29
13869,,336041,102,Sohail Tanvir,12/12/1984,Left-hand Bat,Left-arm Medium-fast,Pakistan,Player,Rajasthan Royals,Mumbai Indians,2008,,24,,Blank,Blank,Sk Warne,Sr Tendulkar,Kamran Akmal,Yv Takawale,1984-12-12
13873,,336041,48,Am Nayar,10/8/1983,Left-hand Bat,Right-arm Medium,India,Player,Mumbai Indians,Rajasthan Royals,2008,,25,,Blank,Blank,Sr Tendulkar,Sk Warne,Yv Takawale,Kamran Akmal,1983-10-08
13875,,336041,73,A Nehra,4/29/1979,Right-hand Bat,Left-arm Medium-fast,India,Player,Mumbai Indians,Rajasthan Royals,2008,,29,,Blank,Blank,Sr Tendulkar,Sk Warne,Yv Takawale,Kamran Akmal,1979-04-29
13878,,336041,115,Rr Raje,9/3/1986,Right-hand Bat,Right-arm Fast-medium,India,Player,Mumbai Indians,Rajasthan Royals,2008,,22,,Blank,Blank,Sr Tendulkar,Sk Warne,Yv Takawale,Kamran Akmal,1986-09-03
13879,,336041,133,Sr Tendulkar,4/24/1973,Right-hand Bat,Right-arm Offbreak,India,Captain,Mumbai Indians,Rajasthan Royals,2008,,35,,Blank,Blank,Sr Tendulkar,Sk Warne,Yv Takawale,Kamran Akmal,1973-04-24
13880,,336041,147,Dr Smith,4/12/1983,Right-hand Bat,Right-arm Medium,West Indies,Player,Mumbai Indians,Rajasthan Royals,2008,,25,,Blank,Blank,Sr Tendulkar,Sk Warne,Yv Takawale,Kamran Akmal,1983-04-12
13884,,336042,58,Sb Styris,7/10/1975,Right-hand Bat,Right-arm Medium,New Zealand,Player,Deccan Chargers,Chennai Super Kings,2008,,33,,Blank,Blank,Ac Gilchrist,Ms Dhoni,Ac Gilchrist,Pa Patel,1975-07-10
13886,,336042,70,Shahid Afridi,3/1/1980,Right-hand Bat,Legbreak Googly,Pakistan,Player,Deccan Chargers,Chennai Super Kings,2008,,28,,Blank,Blank,Ac Gilchrist,Ms Dhoni,Ac Gilchrist,Pa Patel,1980-03-01
13887,,336042,97,Hh Gibbs,2/23/1974,Right-hand Bat,Right-arm Bowler,South Africa,Player,Deccan Chargers,Chennai Super Kings,2008,,34,,Blank,Blank,Ac Gilchrist,Ms Dhoni,Ac Gilchrist,Pa Patel,1974-02-23
13890,,336042,142,Pm Sarvesh Kumar,4/26/1989,Right-hand Bat,Right-arm Medium,India,Player,Deccan Chargers,Chennai Super Kings,2008,,19,,Blank,Blank,Ac Gilchrist,Ms Dhoni,Ac Gilchrist,Pa Patel,1989-04-26
13892,,336042,232,Ut Yadav,10/25/1987,Right-hand Bat,Right-arm Fast-medium,India,Player,Deccan Chargers,Chennai Super Kings,2008,,21,,Blank,Blank,Ac Gilchrist,Ms Dhoni,Ac Gilchrist,Pa Patel,1987-10-25
13895,,336042,21,Sk Raina,11/27/1986,Left-hand Bat,Right-arm Offbreak,India,Player,Chennai Super Kings,Deccan Chargers,2008,,22,,Blank,Blank,Ms Dhoni,Ac Gilchrist,Pa Patel,Ac Gilchrist,1986-11-27
13897,,336042,107,Sp Fleming,4/1/1973,Left-hand Bat,N/a,New Zealand,Player,Chennai Super Kings,Deccan Chargers,2008,,35,,Blank,Blank,Ms Dhoni,Ac Gilchrist,Pa Patel,Ac Gilchrist,1973-04-01
13898,,336042,109,Ja Morkel,6/10/1981,Left-hand Bat,Right-arm Medium-fast,South Africa,Player,Chennai Super Kings,Deccan Chargers,2008,,27,,Blank,Blank,Ms Dhoni,Ac Gilchrist,Pa Patel,Ac Gilchrist,1981-06-10
13902,,336042,151,L Balaji,9/27/1981,Right-hand Bat,Right-arm Medium-fast,India,Player,Chennai Super Kings,Deccan Chargers,2008,,27,,Blank,Blank,Ms Dhoni,Ac Gilchrist,Pa Patel,Ac Gilchrist,1981-09-27
13903,,336042,152,A Mukund,1/6/1990,Left-hand Bat,Legbreak Googly,India,Player,Chennai Super Kings,Deccan Chargers,2008,,18,,Blank,Blank,Ms Dhoni,Ac Gilchrist,Pa Patel,Ac Gilchrist,1990-01-06
13904,,336043,40,G Gambhir,10/14/1981,Left-hand Bat,Legbreak,India,Player,Delhi Daredevils,Rajasthan Royals,2008,,27,,Blank,Blank,V Sehwag,Sk Warne,Kd Karthik,M Rawat,1981-10-14
13908,,336043,88,Kd Karthik,6/1/1985,Right-hand Bat,N/a,India,Keeper,Delhi Daredevils,Rajasthan Royals,2008,,23,,Blank,Blank,V Sehwag,Sk Warne,Kd Karthik,M Rawat,1985-06-01
13910,,336043,91,Vy Mahesh,12/21/1987,Right-hand Bat,Right-arm Medium-fast,India,Player,Delhi Daredevils,Rajasthan Royals,2008,,21,,Blank,Blank,V Sehwag,Sk Warne,Kd Karthik,M Rawat,1987-12-21
13911,,336043,117,Mohammad Asif,12/20/1982,Left-hand Bat,Right-arm Fast-medium,Pakistan,Player,Delhi Daredevils,Rajasthan Royals,2008,,26,,Blank,Blank,V Sehwag,Sk Warne,Kd Karthik,M Rawat,1982-12-20
13914,,336043,136,A Mishra,11/24/1982,Right-hand Bat,Legbreak,India,Player,Delhi Daredevils,Rajasthan Royals,2008,,26,,Blank,Blank,V Sehwag,Sk Warne,Kd Karthik,M Rawat,1982-11-24
13915,,336043,31,Yk Pathan,11/17/1982,Right-hand Bat,Right-arm Offbreak,India,Player,Rajasthan Royals,Delhi Daredevils,2008,,26,,Blank,Blank,Sk Warne,V Sehwag,M Rawat,Kd Karthik,1982-11-17
13916,,336043,32,Sr Watson,6/17/1981,Right-hand Bat,Right-arm Fast-medium,Australia,Player,Rajasthan Royals,Delhi Daredevils,2008,,27,,Blank,Blank,Sk Warne,V Sehwag,M Rawat,Kd Karthik,1981-06-17
13917,,336043,33,M Kaif,12/1/1980,Right-hand Bat,Right-arm Offbreak,India,Player,Rajasthan Royals,Delhi Daredevils,2008,,28,,Blank,Blank,Sk Warne,V Sehwag,M Rawat,Kd Karthik,1980-12-01
13919,,336043,36,M Rawat,10/25/1985,Right-hand Bat,N/a,India,Keeper,Rajasthan Royals,Delhi Daredevils,2008,,23,,Blank,Blank,Sk Warne,V Sehwag,M Rawat,Kd Karthik,1985-10-25
13921,,336043,39,Sk Trivedi,9/4/1982,Right-hand Bat,Right-arm Medium,India,Player,Rajasthan Royals,Delhi Daredevils,2008,,26,,Blank,Blank,Sk Warne,V Sehwag,M Rawat,Kd Karthik,1982-09-04
13923,,336043,101,Sa Asnodkar,3/29/1984,Right-hand Bat,Right-arm Offbreak,India,Player,Rajasthan Royals,Delhi Daredevils,2008,,24,,Blank,Blank,Sk Warne,V Sehwag,M Rawat,Kd Karthik,1984-03-29
13927,,336044,26,Kc Sangakkara,10/27/1977,Left-hand Bat,Right-arm Offbreak,Sri Lanka,Keeper,Kings Xi Punjab,Chennai Super Kings,2008,,31,,Blank,Blank,Yuvraj Singh,Ms Dhoni,Kc Sangakkara,Pa Patel,1977-10-27
13939,,336044,21,Sk Raina,11/27/1986,Left-hand Bat,Right-arm Offbreak,India,Player,Chennai Super Kings,Kings Xi Punjab,2008,,22,,Blank,Blank,Ms Dhoni,Yuvraj Singh,Pa Patel,Kc Sangakkara,1986-11-27
13945,,336044,122,M Ntini,7/6/1977,Right-hand Bat,Right-arm Fast,South Africa,Player,Chennai Super Kings,Kings Xi Punjab,2008,,31,,Blank,Blank,Ms Dhoni,Yuvraj Singh,Pa Patel,Kc Sangakkara,1977-07-06
13946,,336044,127,Ck Kapugedera,2/24/1987,Right-hand Bat,Right-arm Medium,Sri Lanka,Player,Chennai Super Kings,Kings Xi Punjab,2008,,21,,Blank,Blank,Ms Dhoni,Yuvraj Singh,Pa Patel,Kc Sangakkara,1987-02-24
13948,,336045,31,Yk Pathan,11/17/1982,Right-hand Bat,Right-arm Offbreak,India,Player,Rajasthan Royals,Chennai Super Kings,2008,,26,,Blank,Blank,Sk Warne,Ms Dhoni,Kamran Akmal,Pa Patel,1982-11-17
13951,,336045,35,Ra Jadeja,12/6/1988,Left-hand Bat,Slow Left-arm Orthodox,India,Player,Rajasthan Royals,Chennai Super Kings,2008,,20,,Blank,Blank,Sk Warne,Ms Dhoni,Kamran Akmal,Pa Patel,1988-12-06
13955,,336045,101,Sa Asnodkar,3/29/1984,Right-hand Bat,Right-arm Offbreak,India,Player,Rajasthan Royals,Chennai Super Kings,2008,,24,,Blank,Blank,Sk Warne,Ms Dhoni,Kamran Akmal,Pa Patel,1984-03-29
13958,,336045,138,Nk Patel,3/26/1981,Left-hand Bat,N/a,India,Player,Rajasthan Royals,Chennai Super Kings,2008,,27,,Blank,Blank,Sk Warne,Ms Dhoni,Kamran Akmal,Pa Patel,1981-03-26
13959,,336045,17,Pa Patel,3/9/1985,Left-hand Bat,N/a,India,Keeper,Chennai Super Kings,Rajasthan Royals,2008,,23,,Blank,Blank,Ms Dhoni,Sk Warne,Pa Patel,Kamran Akmal,1985-03-09
13960,,336045,20,Ms Dhoni,7/7/1981,Right-hand Bat,Right-arm Medium,India,Captain,Chennai Super Kings,Rajasthan Royals,2008,,27,,Blank,Blank,Ms Dhoni,Sk Warne,Pa Patel,Kamran Akmal,1981-07-07
13961,,336045,21,Sk Raina,11/27/1986,Left-hand Bat,Right-arm Offbreak,India,Player,Chennai Super Kings,Rajasthan Royals,2008,,22,,Blank,Blank,Ms Dhoni,Sk Warne,Pa Patel,Kamran Akmal,1986-11-27
13965,,336045,120,Ms Gony,1/4/1984,Right-hand Bat,Right-arm Medium,India,Player,Chennai Super Kings,Rajasthan Royals,2008,,24,,Blank,Blank,Ms Dhoni,Sk Warne,Pa Patel,Kamran Akmal,1984-01-04
13967,,336045,122,M Ntini,7/6/1977,Right-hand Bat,Right-arm Fast,South Africa,Player,Chennai Super Kings,Rajasthan Royals,2008,,31,,Blank,Blank,Ms Dhoni,Sk Warne,Pa Patel,Kamran Akmal,1977-07-06
13975,,392186,23,S Badrinath,8/30/1980,Right-hand Bat,Right-arm Offbreak,India,Player,Chennai Super Kings,Mumbai Indians,2009,,29,,Blank,Blank,Ms Dhoni,Sr Tendulkar,Pa Patel,Pr Shah,1980-08-30
13980,,392186,201,R Ashwin,9/17/1986,Right-hand Bat,Right-arm Offbreak,India,Player,Chennai Super Kings,Mumbai Indians,2009,,23,,Blank,Blank,Ms Dhoni,Sr Tendulkar,Pa Patel,Pr Shah,1986-09-17
13982,,392186,42,S Dhawan,12/5/1985,Left-hand Bat,Right-arm Offbreak,India,Player,Mumbai Indians,Chennai Super Kings,2009,,24,,Blank,Blank,Sr Tendulkar,Ms Dhoni,Pr Shah,Pa Patel,1985-12-05
13983,,392186,44,St Jayasuriya,6/30/1969,Left-hand Bat,Slow Left-arm Orthodox,Sri Lanka,Player,Mumbai Indians,Chennai Super Kings,2009,,40,,Blank,Blank,Sr Tendulkar,Ms Dhoni,Pr Shah,Pa Patel,1969-06-30
13988,,392186,115,Rr Raje,9/3/1986,Right-hand Bat,Right-arm Fast-medium,India,Player,Mumbai Indians,Chennai Super Kings,2009,,23,,Blank,Blank,Sr Tendulkar,Ms Dhoni,Pr Shah,Pa Patel,1986-09-03
13991,,392186,194,Sl Malinga,8/28/1983,Right-hand Bat,Right-arm Fast,Sri Lanka,Player,Mumbai Indians,Chennai Super Kings,2009,,26,,Blank,Blank,Sr Tendulkar,Ms Dhoni,Pr Shah,Pa Patel,1983-08-28
13992,,392187,31,Yk Pathan,11/17/1982,Right-hand Bat,Right-arm Offbreak,India,Player,Rajasthan Royals,Royal Challengers Bangalore,2009,,27,,Blank,Blank,Sk Warne,Kp Pietersen,M Rawat,Rv Uthappa,1982-11-17
13993,,392187,35,Ra Jadeja,12/6/1988,Left-hand Bat,Slow Left-arm Orthodox,India,Player,Rajasthan Royals,Royal Challengers Bangalore,2009,,21,,Blank,Blank,Sk Warne,Kp Pietersen,M Rawat,Rv Uthappa,1988-12-06
13994,,392187,36,M Rawat,10/25/1985,Right-hand Bat,N/a,India,Keeper,Rajasthan Royals,Royal Challengers Bangalore,2009,,24,,Blank,Blank,Sk Warne,Kp Pietersen,M Rawat,Rv Uthappa,1985-10-25
13996,,392187,74,Gc Smith,2/1/1981,Left-hand Bat,Right-arm Offbreak,South Africa,Player,Rajasthan Royals,Royal Challengers Bangalore,2009,,28,,Blank,Blank,Sk Warne,Kp Pietersen,M Rawat,Rv Uthappa,1981-02-01
13997,,392187,101,Sa Asnodkar,3/29/1984,Right-hand Bat,Right-arm Offbreak,India,Player,Rajasthan Royals,Royal Challengers Bangalore,2009,,25,,Blank,Blank,Sk Warne,Kp Pietersen,M Rawat,Rv Uthappa,1984-03-29
14001,,392187,159,T Henderson,8/1/1974,Right-hand Bat,Right-arm Fast-medium,South Africa,Player,Rajasthan Royals,Royal Challengers Bangalore,2009,,35,,Blank,Blank,Sk Warne,Kp Pietersen,M Rawat,Rv Uthappa,1974-08-01
14003,,392187,6,R Dravid,1/11/1973,Right-hand Bat,Right-arm Offbreak,India,Player,Royal Challengers Bangalore,Rajasthan Royals,2009,,36,,Blank,Blank,Kp Pietersen,Sk Warne,Rv Uthappa,M Rawat,1973-01-11
14004,,392187,8,V Kohli,11/5/1988,Right-hand Bat,Right-arm Medium,India,Player,Royal Challengers Bangalore,Rajasthan Royals,2009,,21,,Blank,Blank,Kp Pietersen,Sk Warne,Rv Uthappa,M Rawat,1988-11-05
14006,,392187,14,P Kumar,10/2/1986,Right-hand Bat,Right-arm Medium,India,Player,Royal Challengers Bangalore,Rajasthan Royals,2009,,23,,Blank,Blank,Kp Pietersen,Sk Warne,Rv Uthappa,M Rawat,1986-10-02
14008,,392187,52,Lrpl Taylor,3/8/1984,Right-hand Bat,Right-arm Offbreak,New Zealand,Player,Royal Challengers Bangalore,Rajasthan Royals,2009,,25,,Blank,Blank,Kp Pietersen,Sk Warne,Rv Uthappa,M Rawat,1984-03-08
14010,,392187,94,Dw Steyn,6/27/1983,Right-hand Bat,Right-arm Fast,South Africa,Player,Royal Challengers Bangalore,Rajasthan Royals,2009,,26,,Blank,Blank,Kp Pietersen,Sk Warne,Rv Uthappa,M Rawat,1983-06-27
14013,,392187,158,Kp Pietersen,6/27/1980,Right-hand Bat,Right-arm Offbreak,South Africa,Captain,Royal Challengers Bangalore,Rajasthan Royals,2009,,29,,Blank,Blank,Kp Pietersen,Sk Warne,Rv Uthappa,M Rawat,1980-06-27
14020,,392188,67,Pp Chawla,12/24/1988,Left-hand Bat,Legbreak,India,Player,Kings Xi Punjab,Delhi Daredevils,2009,,21,,Blank,Blank,Yuvraj Singh,V Sehwag,Kc Sangakkara,Kd Karthik,1988-12-24
14025,,392188,40,G Gambhir,10/14/1981,Left-hand Bat,Legbreak,India,Player,Delhi Daredevils,Kings Xi Punjab,2009,,28,,Blank,Blank,V Sehwag,Yuvraj Singh,Kd Karthik,Kc Sangakkara,1981-10-14
14030,,392188,110,Ab De Villiers,2/17/1984,Right-hand Bat,Right-arm Medium,South Africa,Player,Delhi Daredevils,Kings Xi Punjab,2009,,25,,Blank,Blank,V Sehwag,Yuvraj Singh,Kd Karthik,Kc Sangakkara,1984-02-17
14031,,392188,116,Pj Sangwan,11/5/1990,Right-hand Bat,Left-arm Medium,India,Player,Delhi Daredevils,Kings Xi Punjab,2009,,19,,Blank,Blank,V Sehwag,Yuvraj Singh,Kd Karthik,Kc Sangakkara,1990-11-05
14032,,392188,135,Tm Dilshan,10/14/1976,Right-hand Bat,Right-arm Offbreak,Sri Lanka,Player,Delhi Daredevils,Kings Xi Punjab,2009,,33,,Blank,Blank,V Sehwag,Yuvraj Singh,Kd Karthik,Kc Sangakkara,1976-10-14
14034,,392188,223,Dp Nannes,5/16/1976,Right-hand Bat,Left-arm Fast,Australia,Player,Delhi Daredevils,Kings Xi Punjab,2009,,33,,Blank,Blank,V Sehwag,Yuvraj Singh,Kd Karthik,Kc Sangakkara,1976-05-16
14035,,392188,439,Am Salvi,10/20/1981,Right-hand Bat,Right-arm Medium,India,Player,Delhi Daredevils,Kings Xi Punjab,2009,,28,,Blank,Blank,V Sehwag,Yuvraj Singh,Kd Karthik,Kc Sangakkara,1981-10-20
14036,,392189,53,Ac Gilchrist,11/14/1971,Left-hand Bat,Right-arm Offbreak,Australia,Captainkeeper,Deccan Chargers,Kolkata Knight Riders,2009,,38,,Blank,Blank,Ac Gilchrist,Bb Mccullum,Ac Gilchrist,Bb Mccullum,1971-11-14
14037,,392189,54,Y Venugopal Rao,2/26/1982,Right-hand Bat,Right-arm Offbreak,India,Player,Deccan Chargers,Kolkata Knight Riders,2009,,27,,Blank,Blank,Ac Gilchrist,Bb Mccullum,Ac Gilchrist,Bb Mccullum,1982-02-26
14038,,392189,55,Vvs Laxman,11/1/1974,Right-hand Bat,Right-arm Offbreak,India,Player,Deccan Chargers,Kolkata Knight Riders,2009,,35,,Blank,Blank,Ac Gilchrist,Bb Mccullum,Ac Gilchrist,Bb Mccullum,1974-11-01
14040,,392189,58,Sb Styris,7/10/1975,Right-hand Bat,Right-arm Medium,New Zealand,Player,Deccan Chargers,Kolkata Knight Riders,2009,,34,,Blank,Blank,Ac Gilchrist,Bb Mccullum,Ac Gilchrist,Bb Mccullum,1975-07-10
14041,,392189,61,Rp Singh,12/6/1985,Right-hand Bat,Left-arm Fast-medium,India,Player,Deccan Chargers,Kolkata Knight Riders,2009,,24,,Blank,Blank,Ac Gilchrist,Bb Mccullum,Ac Gilchrist,Bb Mccullum,1985-12-06
14044,,392189,131,Pp Ojha,9/5/1986,Left-hand Bat,Slow Left-arm Orthodox,India,Player,Deccan Chargers,Kolkata Knight Riders,2009,,23,,Blank,Blank,Ac Gilchrist,Bb Mccullum,Ac Gilchrist,Bb Mccullum,1986-09-05
14051,,392189,83,M Kartik,9/11/1976,Left-hand Bat,Slow Left-arm Orthodox,India,Player,Kolkata Knight Riders,Deccan Chargers,2009,,33,,Blank,Blank,Bb Mccullum,Ac Gilchrist,Bb Mccullum,Ac Gilchrist,1976-09-11
14052,,392189,84,I Sharma,9/2/1988,Right-hand Bat,Right-arm Fast-medium,India,Player,Kolkata Knight Riders,Deccan Chargers,2009,,21,,Blank,Blank,Bb Mccullum,Ac Gilchrist,Bb Mccullum,Ac Gilchrist,1988-09-02
14054,,392189,106,Ab Dinda,3/25/1984,Right-hand Bat,Right-arm Medium-fast,India,Player,Kolkata Knight Riders,Deccan Chargers,2009,,25,,Blank,Blank,Bb Mccullum,Ac Gilchrist,Bb Mccullum,Ac Gilchrist,1984-03-25
14056,,392189,162,Ch Gayle,9/21/1979,Left-hand Bat,Right-arm Offbreak,West Indies,Player,Kolkata Knight Riders,Deccan Chargers,2009,,30,,Blank,Blank,Bb Mccullum,Ac Gilchrist,Bb Mccullum,Ac Gilchrist,1979-09-21
14058,,392190,17,Pa Patel,3/9/1985,Left-hand Bat,N/a,India,Player,Chennai Super Kings,Royal Challengers Bangalore,2009,,24,,Blank,Blank,Ms Dhoni,Kp Pietersen,Ms Dhoni,Rv Uthappa,1985-03-09
14060,,392190,20,Ms Dhoni,7/7/1981,Right-hand Bat,Right-arm Medium,India,Captainkeeper,Chennai Super Kings,Royal Challengers Bangalore,2009,,28,,Blank,Blank,Ms Dhoni,Kp Pietersen,Ms Dhoni,Rv Uthappa,1981-07-07
14062,,392190,23,S Badrinath,8/30/1980,Right-hand Bat,Right-arm Offbreak,India,Player,Chennai Super Kings,Royal Challengers Bangalore,2009,,29,,Blank,Blank,Ms Dhoni,Kp Pietersen,Ms Dhoni,Rv Uthappa,1980-08-30
14064,,392190,119,Joginder Sharma,10/23/1983,Right-hand Bat,Right-arm Fast-medium,India,Player,Chennai Super Kings,Royal Challengers Bangalore,2009,,26,,Blank,Blank,Ms Dhoni,Kp Pietersen,Ms Dhoni,Rv Uthappa,1983-10-23
14065,,392190,120,Ms Gony,1/4/1984,Right-hand Bat,Right-arm Medium,India,Player,Chennai Super Kings,Royal Challengers Bangalore,2009,,25,,Blank,Blank,Ms Dhoni,Kp Pietersen,Ms Dhoni,Rv Uthappa,1984-01-04
14066,,392190,121,M Muralitharan,4/17/1972,Right-hand Bat,Right-arm Offbreak,Sri Lanka,Player,Chennai Super Kings,Royal Challengers Bangalore,2009,,37,,Blank,Blank,Ms Dhoni,Kp Pietersen,Ms Dhoni,Rv Uthappa,1972-04-17
14069,,392190,6,R Dravid,1/11/1973,Right-hand Bat,Right-arm Offbreak,India,Player,Royal Challengers Bangalore,Chennai Super Kings,2009,,36,,Blank,Blank,Kp Pietersen,Ms Dhoni,Rv Uthappa,Ms Dhoni,1973-01-11
14070,,392190,8,V Kohli,11/5/1988,Right-hand Bat,Right-arm Medium,India,Player,Royal Challengers Bangalore,Chennai Super Kings,2009,,21,,Blank,Blank,Kp Pietersen,Ms Dhoni,Rv Uthappa,Ms Dhoni,1988-11-05
14075,,392190,81,R Vinay Kumar,2/12/1984,Right-hand Bat,Right-arm Medium,India,Player,Royal Challengers Bangalore,Chennai Super Kings,2009,,25,,Blank,Blank,Kp Pietersen,Ms Dhoni,Rv Uthappa,Ms Dhoni,1984-02-12
14077,,392190,124,A Kumble,10/17/1970,Right-hand Bat,Legbreak Googly,India,Player,Royal Challengers Bangalore,Chennai Super Kings,2009,,39,,Blank,Blank,Kp Pietersen,Ms Dhoni,Rv Uthappa,Ms Dhoni,1970-10-17
14079,,392190,164,R Bishnoi,10/8/1987,Right-hand Bat,Right-arm Medium-fast,India,Player,Royal Challengers Bangalore,Chennai Super Kings,2009,,22,,Blank,Blank,Kp Pietersen,Ms Dhoni,Rv Uthappa,Ms Dhoni,1987-10-08
14080,,392191,1,Sc Ganguly,7/8/1972,Left-hand Bat,Right-arm Medium,India,Player,Kolkata Knight Riders,Kings Xi Punjab,2009,,37,,Blank,Blank,Bb Mccullum,Yuvraj Singh,Bb Mccullum,Kc Sangakkara,1972-07-08
14082,,392191,63,Lr Shukla,5/6/1981,Right-hand Bat,Right-arm Medium,India,Player,Kolkata Knight Riders,Kings Xi Punjab,2009,,28,,Blank,Blank,Bb Mccullum,Yuvraj Singh,Bb Mccullum,Kc Sangakkara,1981-05-06
14084,,392191,84,I Sharma,9/2/1988,Right-hand Bat,Right-arm Fast-medium,India,Player,Kolkata Knight Riders,Kings Xi Punjab,2009,,21,,Blank,Blank,Bb Mccullum,Yuvraj Singh,Bb Mccullum,Kc Sangakkara,1988-09-02
14085,,392191,104,Bj Hodge,12/29/1974,Right-hand Bat,Right-arm Offbreak,Australia,Player,Kolkata Knight Riders,Kings Xi Punjab,2009,,35,,Blank,Blank,Bb Mccullum,Yuvraj Singh,Bb Mccullum,Kc Sangakkara,1974-12-29
14088,,392191,162,Ch Gayle,9/21/1979,Left-hand Bat,Right-arm Offbreak,West Indies,Player,Kolkata Knight Riders,Kings Xi Punjab,2009,,30,,Blank,Blank,Bb Mccullum,Yuvraj Singh,Bb Mccullum,Kc Sangakkara,1979-09-21
14089,,392191,163,Mc Henriques,2/1/1987,Right-hand Bat,Right-arm Fast-medium,Australia,Player,Kolkata Knight Riders,Kings Xi Punjab,2009,,22,,Blank,Blank,Bb Mccullum,Yuvraj Singh,Bb Mccullum,Kc Sangakkara,1987-02-01
14095,,392191,30,T Kohli,12/17/1988,Right-hand Bat,Right-arm Medium,India,Player,Kings Xi Punjab,Kolkata Knight Riders,2009,,21,,Blank,Blank,Yuvraj Singh,Bb Mccullum,Kc Sangakkara,Bb Mccullum,1988-12-17
14096,,392191,64,Dpmd Jayawardene,5/27/1977,Right-hand Bat,Right-arm Medium,Sri Lanka,Player,Kings Xi Punjab,Kolkata Knight Riders,2009,,32,,Blank,Blank,Yuvraj Singh,Bb Mccullum,Kc Sangakkara,Bb Mccullum,1977-05-27
14099,,392191,161,Rs Bopara,5/4/1985,Right-hand Bat,Right-arm Medium,England,Player,Kings Xi Punjab,Kolkata Knight Riders,2009,,24,,Blank,Blank,Yuvraj Singh,Bb Mccullum,Kc Sangakkara,Bb Mccullum,1985-05-04
14101,,392191,243,Vs Malik,5/9/1983,Right-hand Bat,Right-arm Medium,India,Player,Kings Xi Punjab,Kolkata Knight Riders,2009,,26,,Blank,Blank,Yuvraj Singh,Bb Mccullum,Kc Sangakkara,Bb Mccullum,1983-05-09
14102,,392193,53,Ac Gilchrist,11/14/1971,Left-hand Bat,Right-arm Offbreak,Australia,Captainkeeper,Deccan Chargers,Royal Challengers Bangalore,2009,,38,,Blank,Blank,Ac Gilchrist,Kp Pietersen,Ac Gilchrist,Rv Uthappa,1971-11-14
14104,,392193,55,Vvs Laxman,11/1/1974,Right-hand Bat,Right-arm Offbreak,India,Player,Deccan Chargers,Royal Challengers Bangalore,2009,,35,,Blank,Blank,Ac Gilchrist,Kp Pietersen,Ac Gilchrist,Rv Uthappa,1974-11-01
14105,,392193,57,Rg Sharma,4/30/1987,Right-hand Bat,Right-arm Offbreak,India,Player,Deccan Chargers,Royal Challengers Bangalore,2009,,22,,Blank,Blank,Ac Gilchrist,Kp Pietersen,Ac Gilchrist,Rv Uthappa,1987-04-30
14108,,392193,97,Hh Gibbs,2/23/1974,Right-hand Bat,Right-arm Bowler,South Africa,Player,Deccan Chargers,Royal Challengers Bangalore,2009,,35,,Blank,Blank,Ac Gilchrist,Kp Pietersen,Ac Gilchrist,Rv Uthappa,1974-02-23
14111,,392193,165,Fh Edwards,2/6/1982,Right-hand Bat,Right-arm Fast,West Indies,Player,Deccan Chargers,Royal Challengers Bangalore,2009,,27,,Blank,Blank,Ac Gilchrist,Kp Pietersen,Ac Gilchrist,Rv Uthappa,1982-02-06
14112,,392193,256,Harmeet Singh,9/7/1992,Left-hand Bat,Slow Left-arm Orthodox,India,Player,Deccan Chargers,Royal Challengers Bangalore,2009,,17,,Blank,Blank,Ac Gilchrist,Kp Pietersen,Ac Gilchrist,Rv Uthappa,1992-09-07
14113,,392193,6,R Dravid,1/11/1973,Right-hand Bat,Right-arm Offbreak,India,Player,Royal Challengers Bangalore,Deccan Chargers,2009,,36,,Blank,Blank,Kp Pietersen,Ac Gilchrist,Rv Uthappa,Ac Gilchrist,1973-01-11
14117,,392193,46,Rv Uthappa,11/11/1985,Right-hand Bat,Right-arm Medium,India,Keeper,Royal Challengers Bangalore,Deccan Chargers,2009,,24,,Blank,Blank,Kp Pietersen,Ac Gilchrist,Rv Uthappa,Ac Gilchrist,1985-11-11
14124,,392194,40,G Gambhir,10/14/1981,Left-hand Bat,Legbreak,India,Player,Delhi Daredevils,Chennai Super Kings,2009,,28,,Blank,Blank,V Sehwag,Ms Dhoni,Kd Karthik,Ms Dhoni,1981-10-14
14126,,392194,73,A Nehra,4/29/1979,Right-hand Bat,Left-arm Medium-fast,India,Player,Delhi Daredevils,Chennai Super Kings,2009,,30,,Blank,Blank,V Sehwag,Ms Dhoni,Kd Karthik,Ms Dhoni,1979-04-29
14128,,392194,88,Kd Karthik,6/1/1985,Right-hand Bat,N/a,India,Keeper,Delhi Daredevils,Chennai Super Kings,2009,,24,,Blank,Blank,V Sehwag,Ms Dhoni,Kd Karthik,Ms Dhoni,1985-06-01
14131,,392194,135,Tm Dilshan,10/14/1976,Right-hand Bat,Right-arm Offbreak,Sri Lanka,Player,Delhi Daredevils,Chennai Super Kings,2009,,33,,Blank,Blank,V Sehwag,Ms Dhoni,Kd Karthik,Ms Dhoni,1976-10-14
14132,,392194,175,Dl Vettori,1/27/1979,Left-hand Bat,Slow Left-arm Orthodox,New Zealand,Player,Delhi Daredevils,Chennai Super Kings,2009,,30,,Blank,Blank,V Sehwag,Ms Dhoni,Kd Karthik,Ms Dhoni,1979-01-27
14134,,392194,439,Am Salvi,10/20/1981,Right-hand Bat,Right-arm Medium,India,Player,Delhi Daredevils,Chennai Super Kings,2009,,28,,Blank,Blank,V Sehwag,Ms Dhoni,Kd Karthik,Ms Dhoni,1981-10-20
14135,,392194,17,Pa Patel,3/9/1985,Left-hand Bat,N/a,India,Player,Chennai Super Kings,Delhi Daredevils,2009,,24,,Blank,Blank,Ms Dhoni,V Sehwag,Ms Dhoni,Kd Karthik,1985-03-09
14137,,392194,20,Ms Dhoni,7/7/1981,Right-hand Bat,Right-arm Medium,India,Captainkeeper,Chennai Super Kings,Delhi Daredevils,2009,,28,,Blank,Blank,Ms Dhoni,V Sehwag,Ms Dhoni,Kd Karthik,1981-07-07
14139,,392194,23,S Badrinath,8/30/1980,Right-hand Bat,Right-arm Offbreak,India,Player,Chennai Super Kings,Delhi Daredevils,2009,,29,,Blank,Blank,Ms Dhoni,V Sehwag,Ms Dhoni,Kd Karthik,1980-08-30
14140,,392194,109,Ja Morkel,6/10/1981,Left-hand Bat,Right-arm Medium-fast,South Africa,Player,Chennai Super Kings,Delhi Daredevils,2009,,28,,Blank,Blank,Ms Dhoni,V Sehwag,Ms Dhoni,Kd Karthik,1981-06-10
14141,,392194,119,Joginder Sharma,10/23/1983,Right-hand Bat,Right-arm Fast-medium,India,Player,Chennai Super Kings,Delhi Daredevils,2009,,26,,Blank,Blank,Ms Dhoni,V Sehwag,Ms Dhoni,Kd Karthik,1983-10-23
14143,,392194,121,M Muralitharan,4/17/1972,Right-hand Bat,Right-arm Offbreak,Sri Lanka,Player,Chennai Super Kings,Delhi Daredevils,2009,,37,,Blank,Blank,Ms Dhoni,V Sehwag,Ms Dhoni,Kd Karthik,1972-04-17
14144,,392194,151,L Balaji,9/27/1981,Right-hand Bat,Right-arm Medium-fast,India,Player,Chennai Super Kings,Delhi Daredevils,2009,,28,,Blank,Blank,Ms Dhoni,V Sehwag,Ms Dhoni,Kd Karthik,1981-09-27
14145,,392194,155,A Flintoff,12/6/1977,Right-hand Bat,Right-arm Fast-medium,England,Player,Chennai Super Kings,Delhi Daredevils,2009,,32,,Blank,Blank,Ms Dhoni,V Sehwag,Ms Dhoni,Kd Karthik,1977-12-06
14148,,392195,59,Sb Bangar,10/11/1972,Right-hand Bat,Right-arm Medium-fast,India,Player,Kolkata Knight Riders,Rajasthan Royals,2009,,37,,Blank,Blank,Bb Mccullum,Sk Warne,Bb Mccullum,M Rawat,1972-10-11
14150,,392195,82,Ab Agarkar,12/4/1977,Right-hand Bat,Right-arm Fast,India,Player,Kolkata Knight Riders,Rajasthan Royals,2009,,32,,Blank,Blank,Bb Mccullum,Sk Warne,Bb Mccullum,M Rawat,1977-12-04
14151,,392195,84,I Sharma,9/2/1988,Right-hand Bat,Right-arm Fast-medium,India,Player,Kolkata Knight Riders,Rajasthan Royals,2009,,21,,Blank,Blank,Bb Mccullum,Sk Warne,Bb Mccullum,M Rawat,1988-09-02
14152,,392195,104,Bj Hodge,12/29/1974,Right-hand Bat,Right-arm Offbreak,Australia,Player,Kolkata Knight Riders,Rajasthan Royals,2009,,35,,Blank,Blank,Bb Mccullum,Sk Warne,Bb Mccullum,M Rawat,1974-12-29
14153,,392195,162,Ch Gayle,9/21/1979,Left-hand Bat,Right-arm Offbreak,West Indies,Player,Kolkata Knight Riders,Rajasthan Royals,2009,,30,,Blank,Blank,Bb Mccullum,Sk Warne,Bb Mccullum,M Rawat,1979-09-21
14154,,392195,170,Yashpal Singh,11/27/1981,Right-hand Bat,Right-arm Medium,India,Player,Kolkata Knight Riders,Rajasthan Royals,2009,,28,,Blank,Blank,Bb Mccullum,Sk Warne,Bb Mccullum,M Rawat,1981-11-27
14156,,392195,395,Anureet Singh,3/2/1988,Right-hand Bat,Right-arm Medium,India,Player,Kolkata Knight Riders,Rajasthan Royals,2009,,21,,Blank,Blank,Bb Mccullum,Sk Warne,Bb Mccullum,M Rawat,1988-03-02
14158,,392195,35,Ra Jadeja,12/6/1988,Left-hand Bat,Slow Left-arm Orthodox,India,Player,Rajasthan Royals,Kolkata Knight Riders,2009,,21,,Blank,Blank,Sk Warne,Bb Mccullum,M Rawat,Bb Mccullum,1988-12-06
14160,,392195,38,Sk Warne,9/13/1969,Right-hand Bat,Legbreak Googly,Australia,Captain,Rajasthan Royals,Kolkata Knight Riders,2009,,40,,Blank,Blank,Sk Warne,Bb Mccullum,M Rawat,Bb Mccullum,1969-09-13
14163,,392195,137,Ad Mascarenhas,10/30/1977,Right-hand Bat,Right-arm Fast-medium,England,Player,Rajasthan Royals,Kolkata Knight Riders,2009,,32,,Blank,Blank,Sk Warne,Bb Mccullum,M Rawat,Bb Mccullum,1977-10-30
14165,,392195,167,Pc Valthaty,12/7/1983,Right-hand Bat,Right-arm Medium,India,Player,Rajasthan Royals,Kolkata Knight Riders,2009,,26,,Blank,Blank,Sk Warne,Bb Mccullum,M Rawat,Bb Mccullum,1983-12-07
14166,,392195,168,Rj Quiney,8/20/1982,Left-hand Bat,Right-arm Medium,Australia,Player,Rajasthan Royals,Kolkata Knight Riders,2009,,27,,Blank,Blank,Sk Warne,Bb Mccullum,M Rawat,Bb Mccullum,1982-08-20
14172,,392196,64,Dpmd Jayawardene,5/27/1977,Right-hand Bat,Right-arm Medium,Sri Lanka,Player,Kings Xi Punjab,Royal Challengers Bangalore,2009,,32,,Blank,Blank,Yuvraj Singh,Kp Pietersen,Kc Sangakkara,Rv Uthappa,1977-05-27
14177,,392196,215,Ya Abdulla,1/17/1983,Left-hand Bat,Left-arm Fast-medium,India,Player,Kings Xi Punjab,Royal Challengers Bangalore,2009,,26,,Blank,Blank,Yuvraj Singh,Kp Pietersen,Kc Sangakkara,Rv Uthappa,1983-01-17
14180,,392196,8,V Kohli,11/5/1988,Right-hand Bat,Right-arm Medium,India,Player,Royal Challengers Bangalore,Kings Xi Punjab,2009,,21,,Blank,Blank,Kp Pietersen,Yuvraj Singh,Rv Uthappa,Kc Sangakkara,1988-11-05
14183,,392196,46,Rv Uthappa,11/11/1985,Right-hand Bat,Right-arm Medium,India,Keeper,Royal Challengers Bangalore,Kings Xi Punjab,2009,,24,,Blank,Blank,Kp Pietersen,Yuvraj Singh,Rv Uthappa,Kc Sangakkara,1985-11-11
14192,,392197,55,Vvs Laxman,11/1/1974,Right-hand Bat,Right-arm Offbreak,India,Player,Deccan Chargers,Mumbai Indians,2009,,35,,Blank,Blank,Ac Gilchrist,Sr Tendulkar,Ac Gilchrist,Pr Shah,1974-11-01
14193,,392197,57,Rg Sharma,4/30/1987,Right-hand Bat,Right-arm Offbreak,India,Player,Deccan Chargers,Mumbai Indians,2009,,22,,Blank,Blank,Ac Gilchrist,Sr Tendulkar,Ac Gilchrist,Pr Shah,1987-04-30
14195,,392197,97,Hh Gibbs,2/23/1974,Right-hand Bat,Right-arm Bowler,South Africa,Player,Deccan Chargers,Mumbai Indians,2009,,35,,Blank,Blank,Ac Gilchrist,Sr Tendulkar,Ac Gilchrist,Pr Shah,1974-02-23
14197,,392197,131,Pp Ojha,9/5/1986,Left-hand Bat,Slow Left-arm Orthodox,India,Player,Deccan Chargers,Mumbai Indians,2009,,23,,Blank,Blank,Ac Gilchrist,Sr Tendulkar,Ac Gilchrist,Pr Shah,1986-09-05
14198,,392197,147,Dr Smith,4/12/1983,Right-hand Bat,Right-arm Medium,West Indies,Player,Deccan Chargers,Mumbai Indians,2009,,26,,Blank,Blank,Ac Gilchrist,Sr Tendulkar,Ac Gilchrist,Pr Shah,1983-04-12
14202,,392197,42,S Dhawan,12/5/1985,Left-hand Bat,Right-arm Offbreak,India,Player,Mumbai Indians,Deccan Chargers,2009,,24,,Blank,Blank,Sr Tendulkar,Ac Gilchrist,Pr Shah,Ac Gilchrist,1985-12-05
14204,,392197,47,Pr Shah,11/3/1987,Right-hand Bat,N/a,India,Keeper,Mumbai Indians,Deccan Chargers,2009,,22,,Blank,Blank,Sr Tendulkar,Ac Gilchrist,Pr Shah,Ac Gilchrist,1987-11-03
14205,,392197,48,Am Nayar,10/8/1983,Left-hand Bat,Right-arm Medium,India,Player,Mumbai Indians,Deccan Chargers,2009,,26,,Blank,Blank,Sr Tendulkar,Ac Gilchrist,Pr Shah,Ac Gilchrist,1983-10-08
14207,,392197,71,Dj Bravo,10/7/1983,Right-hand Bat,Right-arm Medium-fast,West Indies,Player,Mumbai Indians,Deccan Chargers,2009,,26,,Blank,Blank,Sr Tendulkar,Ac Gilchrist,Pr Shah,Ac Gilchrist,1983-10-07
14208,,392197,80,Ds Kulkarni,12/10/1988,Right-hand Bat,Right-arm Medium,India,Player,Mumbai Indians,Deccan Chargers,2009,,21,,Blank,Blank,Sr Tendulkar,Ac Gilchrist,Pr Shah,Ac Gilchrist,1988-12-10
14209,,392197,133,Sr Tendulkar,4/24/1973,Right-hand Bat,Right-arm Offbreak,India,Captain,Mumbai Indians,Deccan Chargers,2009,,36,,Blank,Blank,Sr Tendulkar,Ac Gilchrist,Pr Shah,Ac Gilchrist,1973-04-24
14210,,392197,154,Jp Duminy,4/14/1984,Left-hand Bat,Right-arm Offbreak,South Africa,Player,Mumbai Indians,Deccan Chargers,2009,,25,,Blank,Blank,Sr Tendulkar,Ac Gilchrist,Pr Shah,Ac Gilchrist,1984-04-14
14213,,392199,41,V Sehwag,10/20/1978,Right-hand Bat,Right-arm Offbreak,India,Captain,Delhi Daredevils,Royal Challengers Bangalore,2009,,31,,Blank,Blank,V Sehwag,Kp Pietersen,Kd Karthik,Mv Boucher,1978-10-20
14214,,392199,73,A Nehra,4/29/1979,Right-hand Bat,Left-arm Medium-fast,India,Player,Delhi Daredevils,Royal Challengers Bangalore,2009,,30,,Blank,Blank,V Sehwag,Kp Pietersen,Kd Karthik,Mv Boucher,1979-04-29
14216,,392199,110,Ab De Villiers,2/17/1984,Right-hand Bat,Right-arm Medium,South Africa,Player,Delhi Daredevils,Royal Challengers Bangalore,2009,,25,,Blank,Blank,V Sehwag,Kp Pietersen,Kd Karthik,Mv Boucher,1984-02-17
14217,,392199,116,Pj Sangwan,11/5/1990,Right-hand Bat,Left-arm Medium,India,Player,Delhi Daredevils,Royal Challengers Bangalore,2009,,19,,Blank,Blank,V Sehwag,Kp Pietersen,Kd Karthik,Mv Boucher,1990-11-05
14219,,392199,136,A Mishra,11/24/1982,Right-hand Bat,Legbreak,India,Player,Delhi Daredevils,Royal Challengers Bangalore,2009,,27,,Blank,Blank,V Sehwag,Kp Pietersen,Kd Karthik,Mv Boucher,1982-11-24
14225,,392199,11,Mv Boucher,12/3/1976,Right-hand Bat,Right-arm Medium,South Africa,Keeper,Royal Challengers Bangalore,Delhi Daredevils,2009,,33,,Blank,Blank,Kp Pietersen,V Sehwag,Mv Boucher,Kd Karthik,1976-12-03
14228,,392199,52,Lrpl Taylor,3/8/1984,Right-hand Bat,Right-arm Offbreak,New Zealand,Player,Royal Challengers Bangalore,Delhi Daredevils,2009,,25,,Blank,Blank,Kp Pietersen,V Sehwag,Mv Boucher,Kd Karthik,1984-03-08
14230,,392199,81,R Vinay Kumar,2/12/1984,Right-hand Bat,Right-arm Medium,India,Player,Royal Challengers Bangalore,Delhi Daredevils,2009,,25,,Blank,Blank,Kp Pietersen,V Sehwag,Mv Boucher,Kd Karthik,1984-02-12
14234,,392200,24,K Goel,12/24/1986,Left-hand Bat,Right-arm Offbreak,India,Player,Kings Xi Punjab,Rajasthan Royals,2009,,23,,Blank,Blank,Yuvraj Singh,Sk Warne,Kc Sangakkara,M Rawat,1986-12-24
14237,,392200,29,Ik Pathan,10/27/1984,Left-hand Bat,Left-arm Medium-fast,India,Player,Kings Xi Punjab,Rajasthan Royals,2009,,25,,Blank,Blank,Yuvraj Singh,Sk Warne,Kc Sangakkara,M Rawat,1984-10-27
14242,,392200,153,Rr Powar,5/20/1978,Right-hand Bat,Right-arm Offbreak,India,Player,Kings Xi Punjab,Rajasthan Royals,2009,,31,,Blank,Blank,Yuvraj Singh,Sk Warne,Kc Sangakkara,M Rawat,1978-05-20
14244,,392200,215,Ya Abdulla,1/17/1983,Left-hand Bat,Left-arm Fast-medium,India,Player,Kings Xi Punjab,Rajasthan Royals,2009,,26,,Blank,Blank,Yuvraj Singh,Sk Warne,Kc Sangakkara,M Rawat,1983-01-17
14245,,392200,31,Yk Pathan,11/17/1982,Right-hand Bat,Right-arm Offbreak,India,Player,Rajasthan Royals,Kings Xi Punjab,2009,,27,,Blank,Blank,Sk Warne,Yuvraj Singh,M Rawat,Kc Sangakkara,1982-11-17
14246,,392200,35,Ra Jadeja,12/6/1988,Left-hand Bat,Slow Left-arm Orthodox,India,Player,Rajasthan Royals,Kings Xi Punjab,2009,,21,,Blank,Blank,Sk Warne,Yuvraj Singh,M Rawat,Kc Sangakkara,1988-12-06
14248,,392200,38,Sk Warne,9/13/1969,Right-hand Bat,Legbreak Googly,Australia,Captain,Rajasthan Royals,Kings Xi Punjab,2009,,40,,Blank,Blank,Sk Warne,Yuvraj Singh,M Rawat,Kc Sangakkara,1969-09-13
14254,,392200,168,Rj Quiney,8/20/1982,Left-hand Bat,Right-arm Medium,Australia,Player,Rajasthan Royals,Kings Xi Punjab,2009,,27,,Blank,Blank,Sk Warne,Yuvraj Singh,M Rawat,Kc Sangakkara,1982-08-20
14257,,392201,54,Y Venugopal Rao,2/26/1982,Right-hand Bat,Right-arm Offbreak,India,Player,Deccan Chargers,Chennai Super Kings,2009,,27,,Blank,Blank,Ac Gilchrist,Ms Dhoni,Ac Gilchrist,Ms Dhoni,1982-02-26
14264,,392201,165,Fh Edwards,2/6/1982,Right-hand Bat,Right-arm Fast,West Indies,Player,Deccan Chargers,Chennai Super Kings,2009,,27,,Blank,Blank,Ac Gilchrist,Ms Dhoni,Ac Gilchrist,Ms Dhoni,1982-02-06
14266,,392201,179,Shoaib Ahmed,8/17/1990,Right-hand Bat,Right-arm Fast-medium,Pakistan,Player,Deccan Chargers,Chennai Super Kings,2009,,19,,Blank,Blank,Ac Gilchrist,Ms Dhoni,Ac Gilchrist,Ms Dhoni,1990-08-17
14273,,392201,109,Ja Morkel,6/10/1981,Left-hand Bat,Right-arm Medium-fast,South Africa,Player,Chennai Super Kings,Deccan Chargers,2009,,28,,Blank,Blank,Ms Dhoni,Ac Gilchrist,Ms Dhoni,Ac Gilchrist,1981-06-10
14274,,392201,119,Joginder Sharma,10/23/1983,Right-hand Bat,Right-arm Fast-medium,India,Player,Chennai Super Kings,Deccan Chargers,2009,,26,,Blank,Blank,Ms Dhoni,Ac Gilchrist,Ms Dhoni,Ac Gilchrist,1983-10-23
14275,,392201,120,Ms Gony,1/4/1984,Right-hand Bat,Right-arm Medium,India,Player,Chennai Super Kings,Deccan Chargers,2009,,25,,Blank,Blank,Ms Dhoni,Ac Gilchrist,Ms Dhoni,Ac Gilchrist,1984-01-04
14276,,392201,121,M Muralitharan,4/17/1972,Right-hand Bat,Right-arm Offbreak,Sri Lanka,Player,Chennai Super Kings,Deccan Chargers,2009,,37,,Blank,Blank,Ms Dhoni,Ac Gilchrist,Ms Dhoni,Ac Gilchrist,1972-04-17
14278,,392202,1,Sc Ganguly,7/8/1972,Left-hand Bat,Right-arm Medium,India,Player,Kolkata Knight Riders,Mumbai Indians,2009,,37,,Blank,Blank,Bb Mccullum,Sr Tendulkar,Bb Mccullum,Pr Shah,1972-07-08
14280,,392202,63,Lr Shukla,5/6/1981,Right-hand Bat,Right-arm Medium,India,Player,Kolkata Knight Riders,Mumbai Indians,2009,,28,,Blank,Blank,Bb Mccullum,Sr Tendulkar,Bb Mccullum,Pr Shah,1981-05-06
14281,,392202,84,I Sharma,9/2/1988,Right-hand Bat,Right-arm Fast-medium,India,Player,Kolkata Knight Riders,Mumbai Indians,2009,,21,,Blank,Blank,Bb Mccullum,Sr Tendulkar,Bb Mccullum,Pr Shah,1988-09-02
14282,,392202,104,Bj Hodge,12/29/1974,Right-hand Bat,Right-arm Offbreak,Australia,Player,Kolkata Knight Riders,Mumbai Indians,2009,,35,,Blank,Blank,Bb Mccullum,Sr Tendulkar,Bb Mccullum,Pr Shah,1974-12-29
14283,,392202,106,Ab Dinda,3/25/1984,Right-hand Bat,Right-arm Medium-fast,India,Player,Kolkata Knight Riders,Mumbai Indians,2009,,25,,Blank,Blank,Bb Mccullum,Sr Tendulkar,Bb Mccullum,Pr Shah,1984-03-25
14284,,392202,162,Ch Gayle,9/21/1979,Left-hand Bat,Right-arm Offbreak,West Indies,Player,Kolkata Knight Riders,Mumbai Indians,2009,,30,,Blank,Blank,Bb Mccullum,Sr Tendulkar,Bb Mccullum,Pr Shah,1979-09-21
14287,,392202,174,Baw Mendis,3/11/1985,Right-hand Bat,Right-arm Offbreak,Sri Lanka,Player,Kolkata Knight Riders,Mumbai Indians,2009,,24,,Blank,Blank,Bb Mccullum,Sr Tendulkar,Bb Mccullum,Pr Shah,1985-03-11
14289,,392202,15,Z Khan,10/7/1978,Right-hand Bat,Left-arm Fast-medium,India,Player,Mumbai Indians,Kolkata Knight Riders,2009,,31,,Blank,Blank,Sr Tendulkar,Bb Mccullum,Pr Shah,Bb Mccullum,1978-10-07
14290,,392202,42,S Dhawan,12/5/1985,Left-hand Bat,Right-arm Offbreak,India,Player,Mumbai Indians,Kolkata Knight Riders,2009,,24,,Blank,Blank,Sr Tendulkar,Bb Mccullum,Pr Shah,Bb Mccullum,1985-12-05
14291,,392202,44,St Jayasuriya,6/30/1969,Left-hand Bat,Slow Left-arm Orthodox,Sri Lanka,Player,Mumbai Indians,Kolkata Knight Riders,2009,,40,,Blank,Blank,Sr Tendulkar,Bb Mccullum,Pr Shah,Bb Mccullum,1969-06-30
14292,,392202,47,Pr Shah,11/3/1987,Right-hand Bat,N/a,India,Keeper,Mumbai Indians,Kolkata Knight Riders,2009,,22,,Blank,Blank,Sr Tendulkar,Bb Mccullum,Pr Shah,Bb Mccullum,1987-11-03
14297,,392202,133,Sr Tendulkar,4/24/1973,Right-hand Bat,Right-arm Offbreak,India,Captain,Mumbai Indians,Kolkata Knight Riders,2009,,36,,Blank,Blank,Sr Tendulkar,Bb Mccullum,Pr Shah,Bb Mccullum,1973-04-24
14302,,392203,73,A Nehra,4/29/1979,Right-hand Bat,Left-arm Medium-fast,India,Player,Delhi Daredevils,Rajasthan Royals,2009,,30,,Blank,Blank,V Sehwag,Sk Warne,Kd Karthik,M Rawat,1979-04-29
14308,,392203,171,M Manhas,10/12/1979,Right-hand Bat,Right-arm Offbreak,India,Player,Delhi Daredevils,Rajasthan Royals,2009,,30,,Blank,Blank,V Sehwag,Sk Warne,Kd Karthik,M Rawat,1979-10-12
14311,,392203,31,Yk Pathan,11/17/1982,Right-hand Bat,Right-arm Offbreak,India,Player,Rajasthan Royals,Delhi Daredevils,2009,,27,,Blank,Blank,Sk Warne,V Sehwag,M Rawat,Kd Karthik,1982-11-17
14315,,392203,74,Gc Smith,2/1/1981,Left-hand Bat,Right-arm Offbreak,South Africa,Player,Rajasthan Royals,Delhi Daredevils,2009,,28,,Blank,Blank,Sk Warne,V Sehwag,M Rawat,Kd Karthik,1981-02-01
14317,,392203,126,Mm Patel,7/12/1983,Right-hand Bat,Right-arm Medium-fast,India,Player,Rajasthan Royals,Delhi Daredevils,2009,,26,,Blank,Blank,Sk Warne,V Sehwag,M Rawat,Kd Karthik,1983-07-12
14318,,392203,137,Ad Mascarenhas,10/30/1977,Right-hand Bat,Right-arm Fast-medium,England,Player,Rajasthan Royals,Delhi Daredevils,2009,,32,,Blank,Blank,Sk Warne,V Sehwag,M Rawat,Kd Karthik,1977-10-30
14324,,392204,62,Wp Saha,10/24/1984,Right-hand Bat,N/a,India,Player,Kolkata Knight Riders,Royal Challengers Bangalore,2009,,25,,Blank,Blank,Bb Mccullum,Kp Pietersen,Mn Van Wyk,Mv Boucher,1984-10-24
14326,,392204,82,Ab Agarkar,12/4/1977,Right-hand Bat,Right-arm Fast,India,Player,Kolkata Knight Riders,Royal Challengers Bangalore,2009,,32,,Blank,Blank,Bb Mccullum,Kp Pietersen,Mn Van Wyk,Mv Boucher,1977-12-04
14327,,392204,83,M Kartik,9/11/1976,Left-hand Bat,Slow Left-arm Orthodox,India,Player,Kolkata Knight Riders,Royal Challengers Bangalore,2009,,33,,Blank,Blank,Bb Mccullum,Kp Pietersen,Mn Van Wyk,Mv Boucher,1976-09-11
14328,,392204,84,I Sharma,9/2/1988,Right-hand Bat,Right-arm Fast-medium,India,Player,Kolkata Knight Riders,Royal Challengers Bangalore,2009,,21,,Blank,Blank,Bb Mccullum,Kp Pietersen,Mn Van Wyk,Mv Boucher,1988-09-02
14332,,392204,176,Mn Van Wyk,3/20/1979,Right-hand Bat,Slow Left-arm Orthodox,South Africa,Keeper,Kolkata Knight Riders,Royal Challengers Bangalore,2009,,30,,Blank,Blank,Bb Mccullum,Kp Pietersen,Mn Van Wyk,Mv Boucher,1979-03-20
14333,,392204,8,V Kohli,11/5/1988,Right-hand Bat,Right-arm Medium,India,Player,Royal Challengers Bangalore,Kolkata Knight Riders,2009,,21,,Blank,Blank,Kp Pietersen,Bb Mccullum,Mv Boucher,Mn Van Wyk,1988-11-05
14334,,392204,9,Jh Kallis,10/16/1975,Right-hand Bat,Right-arm Fast-medium,South Africa,Player,Royal Challengers Bangalore,Kolkata Knight Riders,2009,,34,,Blank,Blank,Kp Pietersen,Bb Mccullum,Mv Boucher,Mn Van Wyk,1975-10-16
14336,,392204,14,P Kumar,10/2/1986,Right-hand Bat,Right-arm Medium,India,Player,Royal Challengers Bangalore,Kolkata Knight Riders,2009,,23,,Blank,Blank,Kp Pietersen,Bb Mccullum,Mv Boucher,Mn Van Wyk,1986-10-02
14337,,392204,75,Pankaj Singh,5/6/1985,Right-hand Bat,Right-arm Medium-fast,India,Player,Royal Challengers Bangalore,Kolkata Knight Riders,2009,,24,,Blank,Blank,Kp Pietersen,Bb Mccullum,Mv Boucher,Mn Van Wyk,1985-05-06
14338,,392204,96,Mk Pandey,9/10/1989,Right-hand Bat,Right-arm Medium,India,Player,Royal Challengers Bangalore,Kolkata Knight Riders,2009,,20,,Blank,Blank,Kp Pietersen,Bb Mccullum,Mv Boucher,Mn Van Wyk,1989-09-10
14339,,392204,124,A Kumble,10/17/1970,Right-hand Bat,Legbreak Googly,India,Player,Royal Challengers Bangalore,Kolkata Knight Riders,2009,,39,,Blank,Blank,Kp Pietersen,Bb Mccullum,Mv Boucher,Mn Van Wyk,1970-10-17
14345,,392205,26,Kc Sangakkara,10/27/1977,Left-hand Bat,Right-arm Offbreak,Sri Lanka,Keeper,Kings Xi Punjab,Mumbai Indians,2009,,32,,Blank,Blank,Yuvraj Singh,Sr Tendulkar,Kc Sangakkara,Pr Shah,1977-10-27
14347,,392205,29,Ik Pathan,10/27/1984,Left-hand Bat,Left-arm Medium-fast,India,Player,Kings Xi Punjab,Mumbai Indians,2009,,25,,Blank,Blank,Yuvraj Singh,Sr Tendulkar,Kc Sangakkara,Pr Shah,1984-10-27
14348,,392205,64,Dpmd Jayawardene,5/27/1977,Right-hand Bat,Right-arm Medium,Sri Lanka,Player,Kings Xi Punjab,Mumbai Indians,2009,,32,,Blank,Blank,Yuvraj Singh,Sr Tendulkar,Kc Sangakkara,Pr Shah,1977-05-27
14349,,392205,67,Pp Chawla,12/24/1988,Left-hand Bat,Legbreak,India,Player,Kings Xi Punjab,Mumbai Indians,2009,,21,,Blank,Blank,Yuvraj Singh,Sr Tendulkar,Kc Sangakkara,Pr Shah,1988-12-24
14350,,392205,68,Wa Mota,9/20/1981,Right-hand Bat,Right-arm Medium,India,Player,Kings Xi Punjab,Mumbai Indians,2009,,28,,Blank,Blank,Yuvraj Singh,Sr Tendulkar,Kc Sangakkara,Pr Shah,1981-09-20
14351,,392205,153,Rr Powar,5/20/1978,Right-hand Bat,Right-arm Offbreak,India,Player,Kings Xi Punjab,Mumbai Indians,2009,,31,,Blank,Blank,Yuvraj Singh,Sr Tendulkar,Kc Sangakkara,Pr Shah,1978-05-20
14353,,392205,215,Ya Abdulla,1/17/1983,Left-hand Bat,Left-arm Fast-medium,India,Player,Kings Xi Punjab,Mumbai Indians,2009,,26,,Blank,Blank,Yuvraj Singh,Sr Tendulkar,Kc Sangakkara,Pr Shah,1983-01-17
14354,,392205,243,Vs Malik,5/9/1983,Right-hand Bat,Right-arm Medium,India,Player,Kings Xi Punjab,Mumbai Indians,2009,,26,,Blank,Blank,Yuvraj Singh,Sr Tendulkar,Kc Sangakkara,Pr Shah,1983-05-09
14355,,392205,15,Z Khan,10/7/1978,Right-hand Bat,Left-arm Fast-medium,India,Player,Mumbai Indians,Kings Xi Punjab,2009,,31,,Blank,Blank,Sr Tendulkar,Yuvraj Singh,Pr Shah,Kc Sangakkara,1978-10-07
14359,,392205,48,Am Nayar,10/8/1983,Left-hand Bat,Right-arm Medium,India,Player,Mumbai Indians,Kings Xi Punjab,2009,,26,,Blank,Blank,Sr Tendulkar,Yuvraj Singh,Pr Shah,Kc Sangakkara,1983-10-08
14363,,392205,133,Sr Tendulkar,4/24/1973,Right-hand Bat,Right-arm Offbreak,India,Captain,Mumbai Indians,Kings Xi Punjab,2009,,36,,Blank,Blank,Sr Tendulkar,Yuvraj Singh,Pr Shah,Kc Sangakkara,1973-04-24
14364,,392205,154,Jp Duminy,4/14/1984,Left-hand Bat,Right-arm Offbreak,South Africa,Player,Mumbai Indians,Kings Xi Punjab,2009,,25,,Blank,Blank,Sr Tendulkar,Yuvraj Singh,Pr Shah,Kc Sangakkara,1984-04-14
14365,,392205,194,Sl Malinga,8/28/1983,Right-hand Bat,Right-arm Fast,Sri Lanka,Player,Mumbai Indians,Kings Xi Punjab,2009,,26,,Blank,Blank,Sr Tendulkar,Yuvraj Singh,Pr Shah,Kc Sangakkara,1983-08-28
14367,,392206,54,Y Venugopal Rao,2/26/1982,Right-hand Bat,Right-arm Offbreak,India,Player,Deccan Chargers,Delhi Daredevils,2009,,27,,Blank,Blank,Ac Gilchrist,V Sehwag,Ac Gilchrist,Kd Karthik,1982-02-26
14370,,392206,97,Hh Gibbs,2/23/1974,Right-hand Bat,Right-arm Bowler,South Africa,Player,Deccan Chargers,Delhi Daredevils,2009,,35,,Blank,Blank,Ac Gilchrist,V Sehwag,Ac Gilchrist,Kd Karthik,1974-02-23
14375,,392206,178,Tl Suman,12/15/1983,Right-hand Bat,Right-arm Offbreak,India,Player,Deccan Chargers,Delhi Daredevils,2009,,26,,Blank,Blank,Ac Gilchrist,V Sehwag,Ac Gilchrist,Kd Karthik,1983-12-15
14377,,392206,40,G Gambhir,10/14/1981,Left-hand Bat,Legbreak,India,Player,Delhi Daredevils,Deccan Chargers,2009,,28,,Blank,Blank,V Sehwag,Ac Gilchrist,Kd Karthik,Ac Gilchrist,1981-10-14
14382,,392206,116,Pj Sangwan,11/5/1990,Right-hand Bat,Left-arm Medium,India,Player,Delhi Daredevils,Deccan Chargers,2009,,19,,Blank,Blank,V Sehwag,Ac Gilchrist,Kd Karthik,Ac Gilchrist,1990-11-05
14385,,392206,171,M Manhas,10/12/1979,Right-hand Bat,Right-arm Offbreak,India,Player,Delhi Daredevils,Deccan Chargers,2009,,30,,Blank,Blank,V Sehwag,Ac Gilchrist,Kd Karthik,Ac Gilchrist,1979-10-12
14387,,392206,223,Dp Nannes,5/16/1976,Right-hand Bat,Left-arm Fast,Australia,Player,Delhi Daredevils,Deccan Chargers,2009,,33,,Blank,Blank,V Sehwag,Ac Gilchrist,Kd Karthik,Ac Gilchrist,1976-05-16
14389,,392207,35,Ra Jadeja,12/6/1988,Left-hand Bat,Slow Left-arm Orthodox,India,Player,Rajasthan Royals,Chennai Super Kings,2009,,21,,Blank,Blank,Sk Warne,Ms Dhoni,M Rawat,Ms Dhoni,1988-12-06
14391,,392207,38,Sk Warne,9/13/1969,Right-hand Bat,Legbreak Googly,Australia,Captain,Rajasthan Royals,Chennai Super Kings,2009,,40,,Blank,Blank,Sk Warne,Ms Dhoni,M Rawat,Ms Dhoni,1969-09-13
14396,,392207,137,Ad Mascarenhas,10/30/1977,Right-hand Bat,Right-arm Fast-medium,England,Player,Rajasthan Royals,Chennai Super Kings,2009,,32,,Blank,Blank,Sk Warne,Ms Dhoni,M Rawat,Ms Dhoni,1977-10-30
14399,,392207,17,Pa Patel,3/9/1985,Left-hand Bat,N/a,India,Player,Chennai Super Kings,Rajasthan Royals,2009,,24,,Blank,Blank,Ms Dhoni,Sk Warne,Ms Dhoni,M Rawat,1985-03-09
14402,,392207,21,Sk Raina,11/27/1986,Left-hand Bat,Right-arm Offbreak,India,Player,Chennai Super Kings,Rajasthan Royals,2009,,23,,Blank,Blank,Ms Dhoni,Sk Warne,Ms Dhoni,M Rawat,1986-11-27
14403,,392207,22,Jdp Oram,7/28/1978,Left-hand Bat,Right-arm Fast-medium,New Zealand,Player,Chennai Super Kings,Rajasthan Royals,2009,,31,,Blank,Blank,Ms Dhoni,Sk Warne,Ms Dhoni,M Rawat,1978-07-28
14404,,392207,23,S Badrinath,8/30/1980,Right-hand Bat,Right-arm Offbreak,India,Player,Chennai Super Kings,Rajasthan Royals,2009,,29,,Blank,Blank,Ms Dhoni,Sk Warne,Ms Dhoni,M Rawat,1980-08-30
14407,,392207,151,L Balaji,9/27/1981,Right-hand Bat,Right-arm Medium-fast,India,Player,Chennai Super Kings,Rajasthan Royals,2009,,28,,Blank,Blank,Ms Dhoni,Sk Warne,Ms Dhoni,M Rawat,1981-09-27
14408,,392207,186,Sb Jakati,11/27/1980,Left-hand Bat,Slow Left-arm Orthodox,India,Player,Chennai Super Kings,Rajasthan Royals,2009,,29,,Blank,Blank,Ms Dhoni,Sk Warne,Ms Dhoni,M Rawat,1980-11-27
14410,,392208,1,Sc Ganguly,7/8/1972,Left-hand Bat,Right-arm Medium,India,Player,Kolkata Knight Riders,Mumbai Indians,2009,,37,,Blank,Blank,Bb Mccullum,Sr Tendulkar,Mn Van Wyk,Pr Shah,1972-07-08
14414,,392208,82,Ab Agarkar,12/4/1977,Right-hand Bat,Right-arm Fast,India,Player,Kolkata Knight Riders,Mumbai Indians,2009,,32,,Blank,Blank,Bb Mccullum,Sr Tendulkar,Mn Van Wyk,Pr Shah,1977-12-04
14415,,392208,83,M Kartik,9/11/1976,Left-hand Bat,Slow Left-arm Orthodox,India,Player,Kolkata Knight Riders,Mumbai Indians,2009,,33,,Blank,Blank,Bb Mccullum,Sr Tendulkar,Mn Van Wyk,Pr Shah,1976-09-11
14416,,392208,84,I Sharma,9/2/1988,Right-hand Bat,Right-arm Fast-medium,India,Player,Kolkata Knight Riders,Mumbai Indians,2009,,21,,Blank,Blank,Bb Mccullum,Sr Tendulkar,Mn Van Wyk,Pr Shah,1988-09-02
14417,,392208,104,Bj Hodge,12/29/1974,Right-hand Bat,Right-arm Offbreak,Australia,Player,Kolkata Knight Riders,Mumbai Indians,2009,,35,,Blank,Blank,Bb Mccullum,Sr Tendulkar,Mn Van Wyk,Pr Shah,1974-12-29
14419,,392208,162,Ch Gayle,9/21/1979,Left-hand Bat,Right-arm Offbreak,West Indies,Player,Kolkata Knight Riders,Mumbai Indians,2009,,30,,Blank,Blank,Bb Mccullum,Sr Tendulkar,Mn Van Wyk,Pr Shah,1979-09-21
14420,,392208,176,Mn Van Wyk,3/20/1979,Right-hand Bat,Slow Left-arm Orthodox,South Africa,Keeper,Kolkata Knight Riders,Mumbai Indians,2009,,30,,Blank,Blank,Bb Mccullum,Sr Tendulkar,Mn Van Wyk,Pr Shah,1979-03-20
14422,,392208,44,St Jayasuriya,6/30/1969,Left-hand Bat,Slow Left-arm Orthodox,Sri Lanka,Player,Mumbai Indians,Kolkata Knight Riders,2009,,40,,Blank,Blank,Sr Tendulkar,Bb Mccullum,Pr Shah,Mn Van Wyk,1969-06-30
14423,,392208,47,Pr Shah,11/3/1987,Right-hand Bat,N/a,India,Keeper,Mumbai Indians,Kolkata Knight Riders,2009,,22,,Blank,Blank,Sr Tendulkar,Bb Mccullum,Pr Shah,Mn Van Wyk,1987-11-03
14425,,392208,50,Harbhajan Singh,7/3/1980,Right-hand Bat,Right-arm Offbreak,India,Player,Mumbai Indians,Kolkata Knight Riders,2009,,29,,Blank,Blank,Sr Tendulkar,Bb Mccullum,Pr Shah,Mn Van Wyk,1980-07-03
14429,,392208,154,Jp Duminy,4/14/1984,Left-hand Bat,Right-arm Offbreak,South Africa,Player,Mumbai Indians,Kolkata Knight Riders,2009,,25,,Blank,Blank,Sr Tendulkar,Bb Mccullum,Pr Shah,Mn Van Wyk,1984-04-14
14430,,392208,180,Gr Napier,1/6/1980,Right-hand Bat,Right-arm Medium,England,Player,Mumbai Indians,Kolkata Knight Riders,2009,,29,,Blank,Blank,Sr Tendulkar,Bb Mccullum,Pr Shah,Mn Van Wyk,1980-01-06
14431,,392208,194,Sl Malinga,8/28/1983,Right-hand Bat,Right-arm Fast,Sri Lanka,Player,Mumbai Indians,Kolkata Knight Riders,2009,,26,,Blank,Blank,Sr Tendulkar,Bb Mccullum,Pr Shah,Mn Van Wyk,1983-08-28
14434,,392209,27,Yuvraj Singh,12/12/1981,Left-hand Bat,Slow Left-arm Orthodox,India,Captain,Kings Xi Punjab,Royal Challengers Bangalore,2009,,28,,Blank,Blank,Yuvraj Singh,A Kumble,Kc Sangakkara,Mv Boucher,1981-12-12
14436,,392209,29,Ik Pathan,10/27/1984,Left-hand Bat,Left-arm Medium-fast,India,Player,Kings Xi Punjab,Royal Challengers Bangalore,2009,,25,,Blank,Blank,Yuvraj Singh,A Kumble,Kc Sangakkara,Mv Boucher,1984-10-27
14437,,392209,64,Dpmd Jayawardene,5/27/1977,Right-hand Bat,Right-arm Medium,Sri Lanka,Player,Kings Xi Punjab,Royal Challengers Bangalore,2009,,32,,Blank,Blank,Yuvraj Singh,A Kumble,Kc Sangakkara,Mv Boucher,1977-05-27
14439,,392209,92,Tm Srivastava,11/7/1989,Left-hand Bat,Right-arm Medium,India,Player,Kings Xi Punjab,Royal Challengers Bangalore,2009,,20,,Blank,Blank,Yuvraj Singh,A Kumble,Kc Sangakkara,Mv Boucher,1989-11-07
14444,,392209,9,Jh Kallis,10/16/1975,Right-hand Bat,Right-arm Fast-medium,South Africa,Player,Royal Challengers Bangalore,Kings Xi Punjab,2009,,34,,Blank,Blank,A Kumble,Yuvraj Singh,Mv Boucher,Kc Sangakkara,1975-10-16
14445,,392209,11,Mv Boucher,12/3/1976,Right-hand Bat,Right-arm Medium,South Africa,Keeper,Royal Challengers Bangalore,Kings Xi Punjab,2009,,33,,Blank,Blank,A Kumble,Yuvraj Singh,Mv Boucher,Kc Sangakkara,1976-12-03
14448,,392209,124,A Kumble,10/17/1970,Right-hand Bat,Legbreak Googly,India,Captain,Royal Challengers Bangalore,Kings Xi Punjab,2009,,39,,Blank,Blank,A Kumble,Yuvraj Singh,Mv Boucher,Kc Sangakkara,1970-10-17
14450,,392209,157,Jd Ryder,8/6/1984,Left-hand Bat,Right-arm Medium,New Zealand,Player,Royal Challengers Bangalore,Kings Xi Punjab,2009,,25,,Blank,Blank,A Kumble,Yuvraj Singh,Mv Boucher,Kc Sangakkara,1984-08-06
14451,,392209,164,R Bishnoi,10/8/1987,Right-hand Bat,Right-arm Medium-fast,India,Player,Royal Challengers Bangalore,Kings Xi Punjab,2009,,22,,Blank,Blank,A Kumble,Yuvraj Singh,Mv Boucher,Kc Sangakkara,1987-10-08
14452,,392209,177,Re Van Der Merwe,12/31/1984,Right-hand Bat,Slow Left-arm Orthodox,South Africa,Player,Royal Challengers Bangalore,Kings Xi Punjab,2009,,25,,Blank,Blank,A Kumble,Yuvraj Singh,Mv Boucher,Kc Sangakkara,1984-12-31
14453,,392209,181,Kp Appanna,12/20/1988,Right-hand Bat,Slow Left-arm Orthodox,India,Player,Royal Challengers Bangalore,Kings Xi Punjab,2009,,21,,Blank,Blank,A Kumble,Yuvraj Singh,Mv Boucher,Kc Sangakkara,1988-12-20
14454,,392210,53,Ac Gilchrist,11/14/1971,Left-hand Bat,Right-arm Offbreak,Australia,Captainkeeper,Deccan Chargers,Rajasthan Royals,2009,,38,,Blank,Blank,Ac Gilchrist,Sk Warne,Ac Gilchrist,Nv Ojha,1971-11-14
14455,,392210,54,Y Venugopal Rao,2/26/1982,Right-hand Bat,Right-arm Offbreak,India,Player,Deccan Chargers,Rajasthan Royals,2009,,27,,Blank,Blank,Ac Gilchrist,Sk Warne,Ac Gilchrist,Nv Ojha,1982-02-26
14458,,392210,97,Hh Gibbs,2/23/1974,Right-hand Bat,Right-arm Bowler,South Africa,Player,Deccan Chargers,Rajasthan Royals,2009,,35,,Blank,Blank,Ac Gilchrist,Sk Warne,Ac Gilchrist,Nv Ojha,1974-02-23
14462,,392210,172,Aa Bilakhia,5/31/1986,Right-hand Bat,Right-arm Medium,India,Player,Deccan Chargers,Rajasthan Royals,2009,,23,,Blank,Blank,Ac Gilchrist,Sk Warne,Ac Gilchrist,Nv Ojha,1986-05-31
14465,,392210,31,Yk Pathan,11/17/1982,Right-hand Bat,Right-arm Offbreak,India,Player,Rajasthan Royals,Deccan Chargers,2009,,27,,Blank,Blank,Sk Warne,Ac Gilchrist,Nv Ojha,Ac Gilchrist,1982-11-17
14470,,392210,101,Sa Asnodkar,3/29/1984,Right-hand Bat,Right-arm Offbreak,India,Player,Rajasthan Royals,Deccan Chargers,2009,,25,,Blank,Blank,Sk Warne,Ac Gilchrist,Nv Ojha,Ac Gilchrist,1984-03-29
14472,,392210,169,As Raut,3/3/1987,Right-hand Bat,Legbreak Googly,India,Player,Rajasthan Royals,Deccan Chargers,2009,,22,,Blank,Blank,Sk Warne,Ac Gilchrist,Nv Ojha,Ac Gilchrist,1987-03-03
14473,,392210,182,La Carseldine,11/17/1975,Left-hand Bat,Left-arm Medium,Australia,Player,Rajasthan Royals,Deccan Chargers,2009,,34,,Blank,Blank,Sk Warne,Ac Gilchrist,Nv Ojha,Ac Gilchrist,1975-11-17
14474,,392210,183,Nv Ojha,7/20/1983,Right-hand Bat,N/a,India,Keeper,Rajasthan Royals,Deccan Chargers,2009,,26,,Blank,Blank,Sk Warne,Ac Gilchrist,Nv Ojha,Ac Gilchrist,1983-07-20
14475,,392210,184,Sm Harwood,3/1/1974,Right-hand Bat,Right-arm Fast-medium,Australia,Player,Rajasthan Royals,Deccan Chargers,2009,,35,,Blank,Blank,Sk Warne,Ac Gilchrist,Nv Ojha,Ac Gilchrist,1974-03-01
14476,,392211,40,G Gambhir,10/14/1981,Left-hand Bat,Legbreak,India,Captain,Delhi Daredevils,Chennai Super Kings,2009,,28,,Blank,Blank,G Gambhir,Ms Dhoni,Kd Karthik,Ms Dhoni,1981-10-14
14477,,392211,73,A Nehra,4/29/1979,Right-hand Bat,Left-arm Medium-fast,India,Player,Delhi Daredevils,Chennai Super Kings,2009,,30,,Blank,Blank,G Gambhir,Ms Dhoni,Kd Karthik,Ms Dhoni,1979-04-29
14482,,392211,135,Tm Dilshan,10/14/1976,Right-hand Bat,Right-arm Offbreak,Sri Lanka,Player,Delhi Daredevils,Chennai Super Kings,2009,,33,,Blank,Blank,G Gambhir,Ms Dhoni,Kd Karthik,Ms Dhoni,1976-10-14
14483,,392211,136,A Mishra,11/24/1982,Right-hand Bat,Legbreak,India,Player,Delhi Daredevils,Chennai Super Kings,2009,,27,,Blank,Blank,G Gambhir,Ms Dhoni,Kd Karthik,Ms Dhoni,1982-11-24
14486,,392211,223,Dp Nannes,5/16/1976,Right-hand Bat,Left-arm Fast,Australia,Player,Delhi Daredevils,Chennai Super Kings,2009,,33,,Blank,Blank,G Gambhir,Ms Dhoni,Kd Karthik,Ms Dhoni,1976-05-16
14488,,392211,20,Ms Dhoni,7/7/1981,Right-hand Bat,Right-arm Medium,India,Captainkeeper,Chennai Super Kings,Delhi Daredevils,2009,,28,,Blank,Blank,Ms Dhoni,G Gambhir,Ms Dhoni,Kd Karthik,1981-07-07
14495,,392211,185,M Vijay,4/1/1984,Right-hand Bat,Right-arm Offbreak,India,Player,Chennai Super Kings,Delhi Daredevils,2009,,25,,Blank,Blank,Ms Dhoni,G Gambhir,Ms Dhoni,Kd Karthik,1984-04-01
14496,,392211,186,Sb Jakati,11/27/1980,Left-hand Bat,Slow Left-arm Orthodox,India,Player,Chennai Super Kings,Delhi Daredevils,2009,,29,,Blank,Blank,Ms Dhoni,G Gambhir,Ms Dhoni,Kd Karthik,1980-11-27
14499,,392212,27,Yuvraj Singh,12/12/1981,Left-hand Bat,Slow Left-arm Orthodox,India,Captain,Kings Xi Punjab,Kolkata Knight Riders,2009,,28,,Blank,Blank,Yuvraj Singh,Bb Mccullum,Kc Sangakkara,Mn Van Wyk,1981-12-12
14500,,392212,28,Sm Katich,8/21/1975,Left-hand Bat,Slow Left-arm Chinaman,Australia,Player,Kings Xi Punjab,Kolkata Knight Riders,2009,,34,,Blank,Blank,Yuvraj Singh,Bb Mccullum,Kc Sangakkara,Mn Van Wyk,1975-08-21
14501,,392212,29,Ik Pathan,10/27/1984,Left-hand Bat,Left-arm Medium-fast,India,Player,Kings Xi Punjab,Kolkata Knight Riders,2009,,25,,Blank,Blank,Yuvraj Singh,Bb Mccullum,Kc Sangakkara,Mn Van Wyk,1984-10-27
14507,,392212,215,Ya Abdulla,1/17/1983,Left-hand Bat,Left-arm Fast-medium,India,Player,Kings Xi Punjab,Kolkata Knight Riders,2009,,26,,Blank,Blank,Yuvraj Singh,Bb Mccullum,Kc Sangakkara,Mn Van Wyk,1983-01-17
14508,,392212,243,Vs Malik,5/9/1983,Right-hand Bat,Right-arm Medium,India,Player,Kings Xi Punjab,Kolkata Knight Riders,2009,,26,,Blank,Blank,Yuvraj Singh,Bb Mccullum,Kc Sangakkara,Mn Van Wyk,1983-05-09
14510,,392212,2,Bb Mccullum,9/27/1981,Right-hand Bat,Right-arm Medium,New Zealand,Captain,Kolkata Knight Riders,Kings Xi Punjab,2009,,28,,Blank,Blank,Bb Mccullum,Yuvraj Singh,Mn Van Wyk,Kc Sangakkara,1981-09-27
14513,,392212,82,Ab Agarkar,12/4/1977,Right-hand Bat,Right-arm Fast,India,Player,Kolkata Knight Riders,Kings Xi Punjab,2009,,32,,Blank,Blank,Bb Mccullum,Yuvraj Singh,Mn Van Wyk,Kc Sangakkara,1977-12-04
14514,,392212,83,M Kartik,9/11/1976,Left-hand Bat,Slow Left-arm Orthodox,India,Player,Kolkata Knight Riders,Kings Xi Punjab,2009,,33,,Blank,Blank,Bb Mccullum,Yuvraj Singh,Mn Van Wyk,Kc Sangakkara,1976-09-11
14516,,392212,104,Bj Hodge,12/29/1974,Right-hand Bat,Right-arm Offbreak,Australia,Player,Kolkata Knight Riders,Kings Xi Punjab,2009,,35,,Blank,Blank,Bb Mccullum,Yuvraj Singh,Mn Van Wyk,Kc Sangakkara,1974-12-29
14518,,392212,162,Ch Gayle,9/21/1979,Left-hand Bat,Right-arm Offbreak,West Indies,Player,Kolkata Knight Riders,Kings Xi Punjab,2009,,30,,Blank,Blank,Bb Mccullum,Yuvraj Singh,Mn Van Wyk,Kc Sangakkara,1979-09-21
14522,,392213,8,V Kohli,11/5/1988,Right-hand Bat,Right-arm Medium,India,Player,Royal Challengers Bangalore,Mumbai Indians,2009,,21,,Blank,Blank,A Kumble,Sr Tendulkar,Mv Boucher,Pr Shah,1988-11-05
14523,,392213,9,Jh Kallis,10/16/1975,Right-hand Bat,Right-arm Fast-medium,South Africa,Player,Royal Challengers Bangalore,Mumbai Indians,2009,,34,,Blank,Blank,A Kumble,Sr Tendulkar,Mv Boucher,Pr Shah,1975-10-16
14524,,392213,11,Mv Boucher,12/3/1976,Right-hand Bat,Right-arm Medium,South Africa,Keeper,Royal Challengers Bangalore,Mumbai Indians,2009,,33,,Blank,Blank,A Kumble,Sr Tendulkar,Mv Boucher,Pr Shah,1976-12-03
14525,,392213,14,P Kumar,10/2/1986,Right-hand Bat,Right-arm Medium,India,Player,Royal Challengers Bangalore,Mumbai Indians,2009,,23,,Blank,Blank,A Kumble,Sr Tendulkar,Mv Boucher,Pr Shah,1986-10-02
14527,,392213,81,R Vinay Kumar,2/12/1984,Right-hand Bat,Right-arm Medium,India,Player,Royal Challengers Bangalore,Mumbai Indians,2009,,25,,Blank,Blank,A Kumble,Sr Tendulkar,Mv Boucher,Pr Shah,1984-02-12
14531,,392213,15,Z Khan,10/7/1978,Right-hand Bat,Left-arm Fast-medium,India,Player,Mumbai Indians,Royal Challengers Bangalore,2009,,31,,Blank,Blank,Sr Tendulkar,A Kumble,Pr Shah,Mv Boucher,1978-10-07
14532,,392213,42,S Dhawan,12/5/1985,Left-hand Bat,Right-arm Offbreak,India,Player,Mumbai Indians,Royal Challengers Bangalore,2009,,24,,Blank,Blank,Sr Tendulkar,A Kumble,Pr Shah,Mv Boucher,1985-12-05
14533,,392213,44,St Jayasuriya,6/30/1969,Left-hand Bat,Slow Left-arm Orthodox,Sri Lanka,Player,Mumbai Indians,Royal Challengers Bangalore,2009,,40,,Blank,Blank,Sr Tendulkar,A Kumble,Pr Shah,Mv Boucher,1969-06-30
14534,,392213,47,Pr Shah,11/3/1987,Right-hand Bat,N/a,India,Keeper,Mumbai Indians,Royal Challengers Bangalore,2009,,22,,Blank,Blank,Sr Tendulkar,A Kumble,Pr Shah,Mv Boucher,1987-11-03
14535,,392213,48,Am Nayar,10/8/1983,Left-hand Bat,Right-arm Medium,India,Player,Mumbai Indians,Royal Challengers Bangalore,2009,,26,,Blank,Blank,Sr Tendulkar,A Kumble,Pr Shah,Mv Boucher,1983-10-08
14536,,392213,50,Harbhajan Singh,7/3/1980,Right-hand Bat,Right-arm Offbreak,India,Player,Mumbai Indians,Royal Challengers Bangalore,2009,,29,,Blank,Blank,Sr Tendulkar,A Kumble,Pr Shah,Mv Boucher,1980-07-03
14538,,392213,85,Am Rahane,6/6/1988,Right-hand Bat,Right-arm Medium,India,Player,Mumbai Indians,Royal Challengers Bangalore,2009,,21,,Blank,Blank,Sr Tendulkar,A Kumble,Pr Shah,Mv Boucher,1988-06-06
14540,,392213,154,Jp Duminy,4/14/1984,Left-hand Bat,Right-arm Offbreak,South Africa,Player,Mumbai Indians,Royal Challengers Bangalore,2009,,25,,Blank,Blank,Sr Tendulkar,A Kumble,Pr Shah,Mv Boucher,1984-04-14
14541,,392213,194,Sl Malinga,8/28/1983,Right-hand Bat,Right-arm Fast,Sri Lanka,Player,Mumbai Indians,Royal Challengers Bangalore,2009,,26,,Blank,Blank,Sr Tendulkar,A Kumble,Pr Shah,Mv Boucher,1983-08-28
14542,,392214,53,Ac Gilchrist,11/14/1971,Left-hand Bat,Right-arm Offbreak,Australia,Captainkeeper,Deccan Chargers,Chennai Super Kings,2009,,38,,Blank,Blank,Ac Gilchrist,Ms Dhoni,Ac Gilchrist,Ms Dhoni,1971-11-14
14547,,392214,97,Hh Gibbs,2/23/1974,Right-hand Bat,Right-arm Bowler,South Africa,Player,Deccan Chargers,Chennai Super Kings,2009,,35,,Blank,Blank,Ac Gilchrist,Ms Dhoni,Ac Gilchrist,Ms Dhoni,1974-02-23
14548,,392214,131,Pp Ojha,9/5/1986,Left-hand Bat,Slow Left-arm Orthodox,India,Player,Deccan Chargers,Chennai Super Kings,2009,,23,,Blank,Blank,Ac Gilchrist,Ms Dhoni,Ac Gilchrist,Ms Dhoni,1986-09-05
14551,,392214,179,Shoaib Ahmed,8/17/1990,Right-hand Bat,Right-arm Fast-medium,Pakistan,Player,Deccan Chargers,Chennai Super Kings,2009,,19,,Blank,Blank,Ac Gilchrist,Ms Dhoni,Ac Gilchrist,Ms Dhoni,1990-08-17
14554,,392214,20,Ms Dhoni,7/7/1981,Right-hand Bat,Right-arm Medium,India,Captainkeeper,Chennai Super Kings,Deccan Chargers,2009,,28,,Blank,Blank,Ms Dhoni,Ac Gilchrist,Ms Dhoni,Ac Gilchrist,1981-07-07
14555,,392214,21,Sk Raina,11/27/1986,Left-hand Bat,Right-arm Offbreak,India,Player,Chennai Super Kings,Deccan Chargers,2009,,23,,Blank,Blank,Ms Dhoni,Ac Gilchrist,Ms Dhoni,Ac Gilchrist,1986-11-27
14556,,392214,22,Jdp Oram,7/28/1978,Left-hand Bat,Right-arm Fast-medium,New Zealand,Player,Chennai Super Kings,Deccan Chargers,2009,,31,,Blank,Blank,Ms Dhoni,Ac Gilchrist,Ms Dhoni,Ac Gilchrist,1978-07-28
14558,,392214,109,Ja Morkel,6/10/1981,Left-hand Bat,Right-arm Medium-fast,South Africa,Player,Chennai Super Kings,Deccan Chargers,2009,,28,,Blank,Blank,Ms Dhoni,Ac Gilchrist,Ms Dhoni,Ac Gilchrist,1981-06-10
14564,,392215,24,K Goel,12/24/1986,Left-hand Bat,Right-arm Offbreak,India,Player,Kings Xi Punjab,Rajasthan Royals,2009,,23,,Blank,Blank,Yuvraj Singh,Sk Warne,Kc Sangakkara,Nv Ojha,1986-12-24
14565,,392215,26,Kc Sangakkara,10/27/1977,Left-hand Bat,Right-arm Offbreak,Sri Lanka,Keeper,Kings Xi Punjab,Rajasthan Royals,2009,,32,,Blank,Blank,Yuvraj Singh,Sk Warne,Kc Sangakkara,Nv Ojha,1977-10-27
14567,,392215,28,Sm Katich,8/21/1975,Left-hand Bat,Slow Left-arm Chinaman,Australia,Player,Kings Xi Punjab,Rajasthan Royals,2009,,34,,Blank,Blank,Yuvraj Singh,Sk Warne,Kc Sangakkara,Nv Ojha,1975-08-21
14570,,392215,65,S Sohal,11/10/1987,Right-hand Bat,Legbreak,India,Player,Kings Xi Punjab,Rajasthan Royals,2009,,22,,Blank,Blank,Yuvraj Singh,Sk Warne,Kc Sangakkara,Nv Ojha,1987-11-10
14571,,392215,67,Pp Chawla,12/24/1988,Left-hand Bat,Legbreak,India,Player,Kings Xi Punjab,Rajasthan Royals,2009,,21,,Blank,Blank,Yuvraj Singh,Sk Warne,Kc Sangakkara,Nv Ojha,1988-12-24
14574,,392215,215,Ya Abdulla,1/17/1983,Left-hand Bat,Left-arm Fast-medium,India,Player,Kings Xi Punjab,Rajasthan Royals,2009,,26,,Blank,Blank,Yuvraj Singh,Sk Warne,Kc Sangakkara,Nv Ojha,1983-01-17
14575,,392215,31,Yk Pathan,11/17/1982,Right-hand Bat,Right-arm Offbreak,India,Player,Rajasthan Royals,Kings Xi Punjab,2009,,27,,Blank,Blank,Sk Warne,Yuvraj Singh,Nv Ojha,Kc Sangakkara,1982-11-17
14578,,392215,39,Sk Trivedi,9/4/1982,Right-hand Bat,Right-arm Medium,India,Player,Rajasthan Royals,Kings Xi Punjab,2009,,27,,Blank,Blank,Sk Warne,Yuvraj Singh,Nv Ojha,Kc Sangakkara,1982-09-04
14579,,392215,74,Gc Smith,2/1/1981,Left-hand Bat,Right-arm Offbreak,South Africa,Player,Rajasthan Royals,Kings Xi Punjab,2009,,28,,Blank,Blank,Sk Warne,Yuvraj Singh,Nv Ojha,Kc Sangakkara,1981-02-01
14580,,392215,138,Nk Patel,3/26/1981,Left-hand Bat,N/a,India,Player,Rajasthan Royals,Kings Xi Punjab,2009,,28,,Blank,Blank,Sk Warne,Yuvraj Singh,Nv Ojha,Kc Sangakkara,1981-03-26
14584,,392215,184,Sm Harwood,3/1/1974,Right-hand Bat,Right-arm Fast-medium,Australia,Player,Rajasthan Royals,Kings Xi Punjab,2009,,35,,Blank,Blank,Sk Warne,Yuvraj Singh,Nv Ojha,Kc Sangakkara,1974-03-01
14585,,392215,196,A Singh,6/21/1981,Right-hand Bat,Right-arm Medium-fast,India,Player,Rajasthan Royals,Kings Xi Punjab,2009,,28,,Blank,Blank,Sk Warne,Yuvraj Singh,Nv Ojha,Kc Sangakkara,1981-06-21
14586,,392216,40,G Gambhir,10/14/1981,Left-hand Bat,Legbreak,India,Captain,Delhi Daredevils,Kolkata Knight Riders,2009,,28,,Blank,Blank,G Gambhir,Bb Mccullum,Kd Karthik,Mn Van Wyk,1981-10-14
14587,,392216,73,A Nehra,4/29/1979,Right-hand Bat,Left-arm Medium-fast,India,Player,Delhi Daredevils,Kolkata Knight Riders,2009,,30,,Blank,Blank,G Gambhir,Bb Mccullum,Kd Karthik,Mn Van Wyk,1979-04-29
14588,,392216,88,Kd Karthik,6/1/1985,Right-hand Bat,N/a,India,Keeper,Delhi Daredevils,Kolkata Knight Riders,2009,,24,,Blank,Blank,G Gambhir,Bb Mccullum,Kd Karthik,Mn Van Wyk,1985-06-01
14589,,392216,89,R Bhatia,10/22/1979,Right-hand Bat,Right-arm Medium-fast,India,Player,Delhi Daredevils,Kolkata Knight Riders,2009,,30,,Blank,Blank,G Gambhir,Bb Mccullum,Kd Karthik,Mn Van Wyk,1979-10-22
14591,,392216,116,Pj Sangwan,11/5/1990,Right-hand Bat,Left-arm Medium,India,Player,Delhi Daredevils,Kolkata Knight Riders,2009,,19,,Blank,Blank,G Gambhir,Bb Mccullum,Kd Karthik,Mn Van Wyk,1990-11-05
14596,,392216,223,Dp Nannes,5/16/1976,Right-hand Bat,Left-arm Fast,Australia,Player,Delhi Daredevils,Kolkata Knight Riders,2009,,33,,Blank,Blank,G Gambhir,Bb Mccullum,Kd Karthik,Mn Van Wyk,1976-05-16
14598,,392216,2,Bb Mccullum,9/27/1981,Right-hand Bat,Right-arm Medium,New Zealand,Captain,Kolkata Knight Riders,Delhi Daredevils,2009,,28,,Blank,Blank,Bb Mccullum,G Gambhir,Mn Van Wyk,Kd Karthik,1981-09-27
14600,,392216,82,Ab Agarkar,12/4/1977,Right-hand Bat,Right-arm Fast,India,Player,Kolkata Knight Riders,Delhi Daredevils,2009,,32,,Blank,Blank,Bb Mccullum,G Gambhir,Mn Van Wyk,Kd Karthik,1977-12-04
14603,,392216,104,Bj Hodge,12/29/1974,Right-hand Bat,Right-arm Offbreak,Australia,Player,Kolkata Knight Riders,Delhi Daredevils,2009,,35,,Blank,Blank,Bb Mccullum,G Gambhir,Mn Van Wyk,Kd Karthik,1974-12-29
14606,,392216,170,Yashpal Singh,11/27/1981,Right-hand Bat,Right-arm Medium,India,Player,Kolkata Knight Riders,Delhi Daredevils,2009,,28,,Blank,Blank,Bb Mccullum,G Gambhir,Mn Van Wyk,Kd Karthik,1981-11-27
14608,,392217,53,Ac Gilchrist,11/14/1971,Left-hand Bat,Right-arm Offbreak,Australia,Captainkeeper,Deccan Chargers,Mumbai Indians,2009,,38,,Blank,Blank,Ac Gilchrist,Sr Tendulkar,Ac Gilchrist,Pr Shah,1971-11-14
14610,,392217,57,Rg Sharma,4/30/1987,Right-hand Bat,Right-arm Offbreak,India,Player,Deccan Chargers,Mumbai Indians,2009,,22,,Blank,Blank,Ac Gilchrist,Sr Tendulkar,Ac Gilchrist,Pr Shah,1987-04-30
14615,,392217,178,Tl Suman,12/15/1983,Right-hand Bat,Right-arm Offbreak,India,Player,Deccan Chargers,Mumbai Indians,2009,,26,,Blank,Blank,Ac Gilchrist,Sr Tendulkar,Ac Gilchrist,Pr Shah,1983-12-15
14616,,392217,179,Shoaib Ahmed,8/17/1990,Right-hand Bat,Right-arm Fast-medium,Pakistan,Player,Deccan Chargers,Mumbai Indians,2009,,19,,Blank,Blank,Ac Gilchrist,Sr Tendulkar,Ac Gilchrist,Pr Shah,1990-08-17
14618,,392217,256,Harmeet Singh,9/7/1992,Left-hand Bat,Slow Left-arm Orthodox,India,Player,Deccan Chargers,Mumbai Indians,2009,,17,,Blank,Blank,Ac Gilchrist,Sr Tendulkar,Ac Gilchrist,Pr Shah,1992-09-07
14619,,392217,44,St Jayasuriya,6/30/1969,Left-hand Bat,Slow Left-arm Orthodox,Sri Lanka,Player,Mumbai Indians,Deccan Chargers,2009,,40,,Blank,Blank,Sr Tendulkar,Ac Gilchrist,Pr Shah,Ac Gilchrist,1969-06-30
14620,,392217,47,Pr Shah,11/3/1987,Right-hand Bat,N/a,India,Keeper,Mumbai Indians,Deccan Chargers,2009,,22,,Blank,Blank,Sr Tendulkar,Ac Gilchrist,Pr Shah,Ac Gilchrist,1987-11-03
14624,,392217,79,Ss Tiwary,12/30/1989,Left-hand Bat,N/a,India,Player,Mumbai Indians,Deccan Chargers,2009,,20,,Blank,Blank,Sr Tendulkar,Ac Gilchrist,Pr Shah,Ac Gilchrist,1989-12-30
14628,,392217,154,Jp Duminy,4/14/1984,Left-hand Bat,Right-arm Offbreak,South Africa,Player,Mumbai Indians,Deccan Chargers,2009,,25,,Blank,Blank,Sr Tendulkar,Ac Gilchrist,Pr Shah,Ac Gilchrist,1984-04-14
14637,,392218,81,R Vinay Kumar,2/12/1984,Right-hand Bat,Right-arm Medium,India,Player,Royal Challengers Bangalore,Rajasthan Royals,2009,,25,,Blank,Blank,A Kumble,Sk Warne,Mv Boucher,Nv Ojha,1984-02-12
14638,,392218,124,A Kumble,10/17/1970,Right-hand Bat,Legbreak Googly,India,Captain,Royal Challengers Bangalore,Rajasthan Royals,2009,,39,,Blank,Blank,A Kumble,Sk Warne,Mv Boucher,Nv Ojha,1970-10-17
14640,,392218,189,D Du Preez,11/8/1981,Right-hand Bat,Right-arm Fast-medium,South Africa,Player,Royal Challengers Bangalore,Rajasthan Royals,2009,,28,,Blank,Blank,A Kumble,Sk Warne,Mv Boucher,Nv Ojha,1981-11-08
14642,,392218,35,Ra Jadeja,12/6/1988,Left-hand Bat,Slow Left-arm Orthodox,India,Player,Rajasthan Royals,Royal Challengers Bangalore,2009,,21,,Blank,Blank,Sk Warne,A Kumble,Nv Ojha,Mv Boucher,1988-12-06
14643,,392218,38,Sk Warne,9/13/1969,Right-hand Bat,Legbreak Googly,Australia,Captain,Rajasthan Royals,Royal Challengers Bangalore,2009,,40,,Blank,Blank,Sk Warne,A Kumble,Nv Ojha,Mv Boucher,1969-09-13
14644,,392218,74,Gc Smith,2/1/1981,Left-hand Bat,Right-arm Offbreak,South Africa,Player,Rajasthan Royals,Royal Challengers Bangalore,2009,,28,,Blank,Blank,Sk Warne,A Kumble,Nv Ojha,Mv Boucher,1981-02-01
14645,,392218,126,Mm Patel,7/12/1983,Right-hand Bat,Right-arm Medium-fast,India,Player,Rajasthan Royals,Royal Challengers Bangalore,2009,,26,,Blank,Blank,Sk Warne,A Kumble,Nv Ojha,Mv Boucher,1983-07-12
14647,,392218,169,As Raut,3/3/1987,Right-hand Bat,Legbreak Googly,India,Player,Rajasthan Royals,Royal Challengers Bangalore,2009,,22,,Blank,Blank,Sk Warne,A Kumble,Nv Ojha,Mv Boucher,1987-03-03
14648,,392218,182,La Carseldine,11/17/1975,Left-hand Bat,Left-arm Medium,Australia,Player,Rajasthan Royals,Royal Challengers Bangalore,2009,,34,,Blank,Blank,Sk Warne,A Kumble,Nv Ojha,Mv Boucher,1975-11-17
14649,,392218,183,Nv Ojha,7/20/1983,Right-hand Bat,N/a,India,Keeper,Rajasthan Royals,Royal Challengers Bangalore,2009,,26,,Blank,Blank,Sk Warne,A Kumble,Nv Ojha,Mv Boucher,1983-07-20
14654,,392219,27,Yuvraj Singh,12/12/1981,Left-hand Bat,Slow Left-arm Orthodox,India,Captain,Kings Xi Punjab,Chennai Super Kings,2009,,28,,Blank,Blank,Yuvraj Singh,Ms Dhoni,Kc Sangakkara,Ms Dhoni,1981-12-12
14656,,392219,29,Ik Pathan,10/27/1984,Left-hand Bat,Left-arm Medium-fast,India,Player,Kings Xi Punjab,Chennai Super Kings,2009,,25,,Blank,Blank,Yuvraj Singh,Ms Dhoni,Kc Sangakkara,Ms Dhoni,1984-10-27
14657,,392219,64,Dpmd Jayawardene,5/27/1977,Right-hand Bat,Right-arm Medium,Sri Lanka,Player,Kings Xi Punjab,Chennai Super Kings,2009,,32,,Blank,Blank,Yuvraj Singh,Ms Dhoni,Kc Sangakkara,Ms Dhoni,1977-05-27
14658,,392219,65,S Sohal,11/10/1987,Right-hand Bat,Legbreak,India,Player,Kings Xi Punjab,Chennai Super Kings,2009,,22,,Blank,Blank,Yuvraj Singh,Ms Dhoni,Kc Sangakkara,Ms Dhoni,1987-11-10
14660,,392219,77,S Sreesanth,2/6/1983,Right-hand Bat,Right-arm Fast-medium,India,Player,Kings Xi Punjab,Chennai Super Kings,2009,,26,,Blank,Blank,Yuvraj Singh,Ms Dhoni,Kc Sangakkara,Ms Dhoni,1983-02-06
14662,,392219,215,Ya Abdulla,1/17/1983,Left-hand Bat,Left-arm Fast-medium,India,Player,Kings Xi Punjab,Chennai Super Kings,2009,,26,,Blank,Blank,Yuvraj Singh,Ms Dhoni,Kc Sangakkara,Ms Dhoni,1983-01-17
14669,,392219,121,M Muralitharan,4/17/1972,Right-hand Bat,Right-arm Offbreak,Sri Lanka,Player,Chennai Super Kings,Kings Xi Punjab,2009,,37,,Blank,Blank,Ms Dhoni,Yuvraj Singh,Ms Dhoni,Kc Sangakkara,1972-04-17
14671,,392219,186,Sb Jakati,11/27/1980,Left-hand Bat,Slow Left-arm Orthodox,India,Player,Chennai Super Kings,Kings Xi Punjab,2009,,29,,Blank,Blank,Ms Dhoni,Yuvraj Singh,Ms Dhoni,Kc Sangakkara,1980-11-27
14675,,392220,73,A Nehra,4/29/1979,Right-hand Bat,Left-arm Medium-fast,India,Player,Delhi Daredevils,Mumbai Indians,2009,,30,,Blank,Blank,G Gambhir,Sr Tendulkar,Kd Karthik,Pr Shah,1979-04-29
14676,,392220,88,Kd Karthik,6/1/1985,Right-hand Bat,N/a,India,Keeper,Delhi Daredevils,Mumbai Indians,2009,,24,,Blank,Blank,G Gambhir,Sr Tendulkar,Kd Karthik,Pr Shah,1985-06-01
14680,,392220,135,Tm Dilshan,10/14/1976,Right-hand Bat,Right-arm Offbreak,Sri Lanka,Player,Delhi Daredevils,Mumbai Indians,2009,,33,,Blank,Blank,G Gambhir,Sr Tendulkar,Kd Karthik,Pr Shah,1976-10-14
14681,,392220,136,A Mishra,11/24/1982,Right-hand Bat,Legbreak,India,Player,Delhi Daredevils,Mumbai Indians,2009,,27,,Blank,Blank,G Gambhir,Sr Tendulkar,Kd Karthik,Pr Shah,1982-11-24
14685,,392220,43,L Ronchi,4/23/1981,Right-hand Bat,N/a,Australia,Player,Mumbai Indians,Delhi Daredevils,2009,,28,,Blank,Blank,Sr Tendulkar,G Gambhir,Pr Shah,Kd Karthik,1981-04-23
14687,,392220,48,Am Nayar,10/8/1983,Left-hand Bat,Right-arm Medium,India,Player,Mumbai Indians,Delhi Daredevils,2009,,26,,Blank,Blank,Sr Tendulkar,G Gambhir,Pr Shah,Kd Karthik,1983-10-08
14703,,392221,131,Pp Ojha,9/5/1986,Left-hand Bat,Slow Left-arm Orthodox,India,Player,Deccan Chargers,Kings Xi Punjab,2009,,23,,Blank,Blank,Ac Gilchrist,Yuvraj Singh,Ac Gilchrist,Kc Sangakkara,1986-09-05
14706,,392221,188,Rj Harris,10/11/1979,Right-hand Bat,Right-arm Fast,Australia,Player,Deccan Chargers,Kings Xi Punjab,2009,,30,,Blank,Blank,Ac Gilchrist,Yuvraj Singh,Ac Gilchrist,Kc Sangakkara,1979-10-11
14709,,392221,28,Sm Katich,8/21/1975,Left-hand Bat,Slow Left-arm Chinaman,Australia,Player,Kings Xi Punjab,Deccan Chargers,2009,,34,,Blank,Blank,Yuvraj Singh,Ac Gilchrist,Kc Sangakkara,Ac Gilchrist,1975-08-21
14713,,392221,66,B Lee,11/8/1976,Right-hand Bat,Right-arm Fast,Australia,Player,Kings Xi Punjab,Deccan Chargers,2009,,33,,Blank,Blank,Yuvraj Singh,Ac Gilchrist,Kc Sangakkara,Ac Gilchrist,1976-11-08
14714,,392221,67,Pp Chawla,12/24/1988,Left-hand Bat,Legbreak,India,Player,Kings Xi Punjab,Deccan Chargers,2009,,21,,Blank,Blank,Yuvraj Singh,Ac Gilchrist,Kc Sangakkara,Ac Gilchrist,1988-12-24
14715,,392221,68,Wa Mota,9/20/1981,Right-hand Bat,Right-arm Medium,India,Player,Kings Xi Punjab,Deccan Chargers,2009,,28,,Blank,Blank,Yuvraj Singh,Ac Gilchrist,Kc Sangakkara,Ac Gilchrist,1981-09-20
14716,,392221,77,S Sreesanth,2/6/1983,Right-hand Bat,Right-arm Fast-medium,India,Player,Kings Xi Punjab,Deccan Chargers,2009,,26,,Blank,Blank,Yuvraj Singh,Ac Gilchrist,Kc Sangakkara,Ac Gilchrist,1983-02-06
14717,,392221,153,Rr Powar,5/20/1978,Right-hand Bat,Right-arm Offbreak,India,Player,Kings Xi Punjab,Deccan Chargers,2009,,31,,Blank,Blank,Yuvraj Singh,Ac Gilchrist,Kc Sangakkara,Ac Gilchrist,1978-05-20
14720,,392222,21,Sk Raina,11/27/1986,Left-hand Bat,Right-arm Offbreak,India,Player,Chennai Super Kings,Rajasthan Royals,2009,,23,,Blank,Blank,Ms Dhoni,Sk Warne,Ms Dhoni,Nv Ojha,1986-11-27
14724,,392222,121,M Muralitharan,4/17/1972,Right-hand Bat,Right-arm Offbreak,Sri Lanka,Player,Chennai Super Kings,Rajasthan Royals,2009,,37,,Blank,Blank,Ms Dhoni,Sk Warne,Ms Dhoni,Nv Ojha,1972-04-17
14725,,392222,151,L Balaji,9/27/1981,Right-hand Bat,Right-arm Medium-fast,India,Player,Chennai Super Kings,Rajasthan Royals,2009,,28,,Blank,Blank,Ms Dhoni,Sk Warne,Ms Dhoni,Nv Ojha,1981-09-27
14730,,392222,35,Ra Jadeja,12/6/1988,Left-hand Bat,Slow Left-arm Orthodox,India,Player,Rajasthan Royals,Chennai Super Kings,2009,,21,,Blank,Blank,Sk Warne,Ms Dhoni,Nv Ojha,Ms Dhoni,1988-12-06
14733,,392222,74,Gc Smith,2/1/1981,Left-hand Bat,Right-arm Offbreak,South Africa,Player,Rajasthan Royals,Chennai Super Kings,2009,,28,,Blank,Blank,Sk Warne,Ms Dhoni,Nv Ojha,Ms Dhoni,1981-02-01
14735,,392222,169,As Raut,3/3/1987,Right-hand Bat,Legbreak Googly,India,Player,Rajasthan Royals,Chennai Super Kings,2009,,22,,Blank,Blank,Sk Warne,Ms Dhoni,Nv Ojha,Ms Dhoni,1987-03-03
14743,,392223,11,Mv Boucher,12/3/1976,Right-hand Bat,Right-arm Medium,South Africa,Keeper,Royal Challengers Bangalore,Mumbai Indians,2009,,33,,Blank,Blank,A Kumble,Sr Tendulkar,Mv Boucher,Yv Takawale,1976-12-03
14746,,392223,81,R Vinay Kumar,2/12/1984,Right-hand Bat,Right-arm Medium,India,Player,Royal Challengers Bangalore,Mumbai Indians,2009,,25,,Blank,Blank,A Kumble,Sr Tendulkar,Mv Boucher,Yv Takawale,1984-02-12
14752,,392223,48,Am Nayar,10/8/1983,Left-hand Bat,Right-arm Medium,India,Player,Mumbai Indians,Royal Challengers Bangalore,2009,,26,,Blank,Blank,Sr Tendulkar,A Kumble,Yv Takawale,Mv Boucher,1983-10-08
14757,,392223,114,Yv Takawale,11/5/1984,Right-hand Bat,N/a,India,Keeper,Mumbai Indians,Royal Challengers Bangalore,2009,,25,,Blank,Blank,Sr Tendulkar,A Kumble,Yv Takawale,Mv Boucher,1984-11-05
14760,,392223,193,C Nanda,3/29/1979,Right-hand Bat,Legbreak,India,Player,Mumbai Indians,Royal Challengers Bangalore,2009,,30,,Blank,Blank,Sr Tendulkar,A Kumble,Yv Takawale,Mv Boucher,1979-03-29
14770,,392224,171,M Manhas,10/12/1979,Right-hand Bat,Right-arm Offbreak,India,Player,Delhi Daredevils,Kolkata Knight Riders,2009,,30,,Blank,Blank,G Gambhir,Bb Mccullum,Kd Karthik,Mn Van Wyk,1979-10-12
14771,,392224,187,Da Warner,10/27/1986,Left-hand Bat,Legbreak,Australia,Player,Delhi Daredevils,Kolkata Knight Riders,2009,,23,,Blank,Blank,G Gambhir,Bb Mccullum,Kd Karthik,Mn Van Wyk,1986-10-27
14774,,392224,2,Bb Mccullum,9/27/1981,Right-hand Bat,Right-arm Medium,New Zealand,Captain,Kolkata Knight Riders,Delhi Daredevils,2009,,28,,Blank,Blank,Bb Mccullum,G Gambhir,Mn Van Wyk,Kd Karthik,1981-09-27
14775,,392224,62,Wp Saha,10/24/1984,Right-hand Bat,N/a,India,Player,Kolkata Knight Riders,Delhi Daredevils,2009,,25,,Blank,Blank,Bb Mccullum,G Gambhir,Mn Van Wyk,Kd Karthik,1984-10-24
14776,,392224,82,Ab Agarkar,12/4/1977,Right-hand Bat,Right-arm Fast,India,Player,Kolkata Knight Riders,Delhi Daredevils,2009,,32,,Blank,Blank,Bb Mccullum,G Gambhir,Mn Van Wyk,Kd Karthik,1977-12-04
14779,,392224,104,Bj Hodge,12/29/1974,Right-hand Bat,Right-arm Offbreak,Australia,Player,Kolkata Knight Riders,Delhi Daredevils,2009,,35,,Blank,Blank,Bb Mccullum,G Gambhir,Mn Van Wyk,Kd Karthik,1974-12-29
14783,,392224,441,Ss Sarkar,12/15/1984,Right-hand Bat,Right-arm Medium,India,Player,Kolkata Knight Riders,Delhi Daredevils,2009,,25,,Blank,Blank,Bb Mccullum,G Gambhir,Mn Van Wyk,Kd Karthik,1984-12-15
14785,,392225,54,Y Venugopal Rao,2/26/1982,Right-hand Bat,Right-arm Offbreak,India,Player,Deccan Chargers,Rajasthan Royals,2009,,27,,Blank,Blank,Ac Gilchrist,Sk Warne,Ac Gilchrist,Nv Ojha,1982-02-26
14786,,392225,56,A Symonds,6/9/1975,Right-hand Bat,Right-arm Offbreak,Australia,Player,Deccan Chargers,Rajasthan Royals,2009,,34,,Blank,Blank,Ac Gilchrist,Sk Warne,Ac Gilchrist,Nv Ojha,1975-06-09
14793,,392225,178,Tl Suman,12/15/1983,Right-hand Bat,Right-arm Offbreak,India,Player,Deccan Chargers,Rajasthan Royals,2009,,26,,Blank,Blank,Ac Gilchrist,Sk Warne,Ac Gilchrist,Nv Ojha,1983-12-15
14799,,392225,74,Gc Smith,2/1/1981,Left-hand Bat,Right-arm Offbreak,South Africa,Player,Rajasthan Royals,Deccan Chargers,2009,,28,,Blank,Blank,Sk Warne,Ac Gilchrist,Nv Ojha,Ac Gilchrist,1981-02-01
14800,,392225,101,Sa Asnodkar,3/29/1984,Right-hand Bat,Right-arm Offbreak,India,Player,Rajasthan Royals,Deccan Chargers,2009,,25,,Blank,Blank,Sk Warne,Ac Gilchrist,Nv Ojha,Ac Gilchrist,1984-03-29
14801,,392225,126,Mm Patel,7/12/1983,Right-hand Bat,Right-arm Medium-fast,India,Player,Rajasthan Royals,Deccan Chargers,2009,,26,,Blank,Blank,Sk Warne,Ac Gilchrist,Nv Ojha,Ac Gilchrist,1983-07-12
14804,,392225,183,Nv Ojha,7/20/1983,Right-hand Bat,N/a,India,Keeper,Rajasthan Royals,Deccan Chargers,2009,,26,,Blank,Blank,Sk Warne,Ac Gilchrist,Nv Ojha,Ac Gilchrist,1983-07-20
14808,,392226,9,Jh Kallis,10/16/1975,Right-hand Bat,Right-arm Fast-medium,South Africa,Player,Royal Challengers Bangalore,Kolkata Knight Riders,2009,,34,,Blank,Blank,A Kumble,Bb Mccullum,Mv Boucher,Wp Saha,1975-10-16
14809,,392226,11,Mv Boucher,12/3/1976,Right-hand Bat,Right-arm Medium,South Africa,Keeper,Royal Challengers Bangalore,Kolkata Knight Riders,2009,,33,,Blank,Blank,A Kumble,Bb Mccullum,Mv Boucher,Wp Saha,1976-12-03
14811,,392226,46,Rv Uthappa,11/11/1985,Right-hand Bat,Right-arm Medium,India,Player,Royal Challengers Bangalore,Kolkata Knight Riders,2009,,24,,Blank,Blank,A Kumble,Bb Mccullum,Mv Boucher,Wp Saha,1985-11-11
14812,,392226,52,Lrpl Taylor,3/8/1984,Right-hand Bat,Right-arm Offbreak,New Zealand,Player,Royal Challengers Bangalore,Kolkata Knight Riders,2009,,25,,Blank,Blank,A Kumble,Bb Mccullum,Mv Boucher,Wp Saha,1984-03-08
14813,,392226,81,R Vinay Kumar,2/12/1984,Right-hand Bat,Right-arm Medium,India,Player,Royal Challengers Bangalore,Kolkata Knight Riders,2009,,25,,Blank,Blank,A Kumble,Bb Mccullum,Mv Boucher,Wp Saha,1984-02-12
14814,,392226,124,A Kumble,10/17/1970,Right-hand Bat,Legbreak Googly,India,Captain,Royal Challengers Bangalore,Kolkata Knight Riders,2009,,39,,Blank,Blank,A Kumble,Bb Mccullum,Mv Boucher,Wp Saha,1970-10-17
14815,,392226,157,Jd Ryder,8/6/1984,Left-hand Bat,Right-arm Medium,New Zealand,Player,Royal Challengers Bangalore,Kolkata Knight Riders,2009,,25,,Blank,Blank,A Kumble,Bb Mccullum,Mv Boucher,Wp Saha,1984-08-06
14818,,392226,2,Bb Mccullum,9/27/1981,Right-hand Bat,Right-arm Medium,New Zealand,Captain,Kolkata Knight Riders,Royal Challengers Bangalore,2009,,28,,Blank,Blank,Bb Mccullum,A Kumble,Wp Saha,Mv Boucher,1981-09-27
14823,,392226,84,I Sharma,9/2/1988,Right-hand Bat,Right-arm Fast-medium,India,Player,Kolkata Knight Riders,Royal Challengers Bangalore,2009,,21,,Blank,Blank,Bb Mccullum,A Kumble,Wp Saha,Mv Boucher,1988-09-02
14824,,392226,170,Yashpal Singh,11/27/1981,Right-hand Bat,Right-arm Medium,India,Player,Kolkata Knight Riders,Royal Challengers Bangalore,2009,,28,,Blank,Blank,Bb Mccullum,A Kumble,Wp Saha,Mv Boucher,1981-11-27
14825,,392226,173,An Ghosh,10/19/1986,Right-hand Bat,Right-arm Medium,India,Player,Kolkata Knight Riders,Royal Challengers Bangalore,2009,,23,,Blank,Blank,Bb Mccullum,A Kumble,Wp Saha,Mv Boucher,1986-10-19
14826,,392226,174,Baw Mendis,3/11/1985,Right-hand Bat,Right-arm Offbreak,Sri Lanka,Player,Kolkata Knight Riders,Royal Challengers Bangalore,2009,,24,,Blank,Blank,Bb Mccullum,A Kumble,Wp Saha,Mv Boucher,1985-03-11
14828,,392227,24,K Goel,12/24/1986,Left-hand Bat,Right-arm Offbreak,India,Player,Kings Xi Punjab,Mumbai Indians,2009,,23,,Blank,Blank,Yuvraj Singh,Sr Tendulkar,Kc Sangakkara,Yv Takawale,1986-12-24
14830,,392227,27,Yuvraj Singh,12/12/1981,Left-hand Bat,Slow Left-arm Orthodox,India,Captain,Kings Xi Punjab,Mumbai Indians,2009,,28,,Blank,Blank,Yuvraj Singh,Sr Tendulkar,Kc Sangakkara,Yv Takawale,1981-12-12
14831,,392227,28,Sm Katich,8/21/1975,Left-hand Bat,Slow Left-arm Chinaman,Australia,Player,Kings Xi Punjab,Mumbai Indians,2009,,34,,Blank,Blank,Yuvraj Singh,Sr Tendulkar,Kc Sangakkara,Yv Takawale,1975-08-21
14832,,392227,29,Ik Pathan,10/27/1984,Left-hand Bat,Left-arm Medium-fast,India,Player,Kings Xi Punjab,Mumbai Indians,2009,,25,,Blank,Blank,Yuvraj Singh,Sr Tendulkar,Kc Sangakkara,Yv Takawale,1984-10-27
14833,,392227,65,S Sohal,11/10/1987,Right-hand Bat,Legbreak,India,Player,Kings Xi Punjab,Mumbai Indians,2009,,22,,Blank,Blank,Yuvraj Singh,Sr Tendulkar,Kc Sangakkara,Yv Takawale,1987-11-10
14837,,392227,77,S Sreesanth,2/6/1983,Right-hand Bat,Right-arm Fast-medium,India,Player,Kings Xi Punjab,Mumbai Indians,2009,,26,,Blank,Blank,Yuvraj Singh,Sr Tendulkar,Kc Sangakkara,Yv Takawale,1983-02-06
14838,,392227,139,La Pomersbach,9/28/1984,Left-hand Bat,Right-arm Offbreak,Australia,Player,Kings Xi Punjab,Mumbai Indians,2009,,25,,Blank,Blank,Yuvraj Singh,Sr Tendulkar,Kc Sangakkara,Yv Takawale,1984-09-28
14841,,392227,50,Harbhajan Singh,7/3/1980,Right-hand Bat,Right-arm Offbreak,India,Player,Mumbai Indians,Kings Xi Punjab,2009,,29,,Blank,Blank,Sr Tendulkar,Yuvraj Singh,Yv Takawale,Kc Sangakkara,1980-07-03
14845,,392227,114,Yv Takawale,11/5/1984,Right-hand Bat,N/a,India,Keeper,Mumbai Indians,Kings Xi Punjab,2009,,25,,Blank,Blank,Sr Tendulkar,Yuvraj Singh,Yv Takawale,Kc Sangakkara,1984-11-05
14846,,392227,115,Rr Raje,9/3/1986,Right-hand Bat,Right-arm Fast-medium,India,Player,Mumbai Indians,Kings Xi Punjab,2009,,23,,Blank,Blank,Sr Tendulkar,Yuvraj Singh,Yv Takawale,Kc Sangakkara,1986-09-03
14847,,392227,133,Sr Tendulkar,4/24/1973,Right-hand Bat,Right-arm Offbreak,India,Captain,Mumbai Indians,Kings Xi Punjab,2009,,36,,Blank,Blank,Sr Tendulkar,Yuvraj Singh,Yv Takawale,Kc Sangakkara,1973-04-24
14852,,392228,56,A Symonds,6/9/1975,Right-hand Bat,Right-arm Offbreak,Australia,Player,Deccan Chargers,Delhi Daredevils,2009,,34,,Blank,Blank,Ac Gilchrist,V Sehwag,Ac Gilchrist,Kd Karthik,1975-06-09
14853,,392228,57,Rg Sharma,4/30/1987,Right-hand Bat,Right-arm Offbreak,India,Player,Deccan Chargers,Delhi Daredevils,2009,,22,,Blank,Blank,Ac Gilchrist,V Sehwag,Ac Gilchrist,Kd Karthik,1987-04-30
14854,,392228,60,Wpujc Vaas,1/27/1974,Left-hand Bat,Left-arm Fast-medium,Sri Lanka,Player,Deccan Chargers,Delhi Daredevils,2009,,35,,Blank,Blank,Ac Gilchrist,V Sehwag,Ac Gilchrist,Kd Karthik,1974-01-27
14855,,392228,61,Rp Singh,12/6/1985,Right-hand Bat,Left-arm Fast-medium,India,Player,Deccan Chargers,Delhi Daredevils,2009,,24,,Blank,Blank,Ac Gilchrist,V Sehwag,Ac Gilchrist,Kd Karthik,1985-12-06
14860,,392228,179,Shoaib Ahmed,8/17/1990,Right-hand Bat,Right-arm Fast-medium,Pakistan,Player,Deccan Chargers,Delhi Daredevils,2009,,19,,Blank,Blank,Ac Gilchrist,V Sehwag,Ac Gilchrist,Kd Karthik,1990-08-17
14861,,392228,40,G Gambhir,10/14/1981,Left-hand Bat,Legbreak,India,Player,Delhi Daredevils,Deccan Chargers,2009,,28,,Blank,Blank,V Sehwag,Ac Gilchrist,Kd Karthik,Ac Gilchrist,1981-10-14
14862,,392228,41,V Sehwag,10/20/1978,Right-hand Bat,Right-arm Offbreak,India,Captain,Delhi Daredevils,Deccan Chargers,2009,,31,,Blank,Blank,V Sehwag,Ac Gilchrist,Kd Karthik,Ac Gilchrist,1978-10-20
14864,,392228,88,Kd Karthik,6/1/1985,Right-hand Bat,N/a,India,Keeper,Delhi Daredevils,Deccan Chargers,2009,,24,,Blank,Blank,V Sehwag,Ac Gilchrist,Kd Karthik,Ac Gilchrist,1985-06-01
14870,,392228,187,Da Warner,10/27/1986,Left-hand Bat,Legbreak,Australia,Player,Delhi Daredevils,Deccan Chargers,2009,,23,,Blank,Blank,V Sehwag,Ac Gilchrist,Kd Karthik,Ac Gilchrist,1986-10-27
14871,,392228,223,Dp Nannes,5/16/1976,Right-hand Bat,Left-arm Fast,Australia,Player,Delhi Daredevils,Deccan Chargers,2009,,33,,Blank,Blank,V Sehwag,Ac Gilchrist,Kd Karthik,Ac Gilchrist,1976-05-16
14872,,392229,18,Ml Hayden,10/29/1971,Left-hand Bat,Right-arm Medium,Australia,Player,Chennai Super Kings,Royal Challengers Bangalore,2009,,38,,Blank,Blank,Ms Dhoni,A Kumble,Ms Dhoni,Mv Boucher,1971-10-29
14874,,392229,21,Sk Raina,11/27/1986,Left-hand Bat,Right-arm Offbreak,India,Player,Chennai Super Kings,Royal Challengers Bangalore,2009,,23,,Blank,Blank,Ms Dhoni,A Kumble,Ms Dhoni,Mv Boucher,1986-11-27
14876,,392229,23,S Badrinath,8/30/1980,Right-hand Bat,Right-arm Offbreak,India,Player,Chennai Super Kings,Royal Challengers Bangalore,2009,,29,,Blank,Blank,Ms Dhoni,A Kumble,Ms Dhoni,Mv Boucher,1980-08-30
14880,,392229,185,M Vijay,4/1/1984,Right-hand Bat,Right-arm Offbreak,India,Player,Chennai Super Kings,Royal Challengers Bangalore,2009,,25,,Blank,Blank,Ms Dhoni,A Kumble,Ms Dhoni,Mv Boucher,1984-04-01
14882,,392229,218,S Tyagi,9/17/1987,Right-hand Bat,Right-arm Medium,India,Player,Chennai Super Kings,Royal Challengers Bangalore,2009,,22,,Blank,Blank,Ms Dhoni,A Kumble,Ms Dhoni,Mv Boucher,1987-09-17
14887,,392229,12,B Akhil,10/7/1977,Right-hand Bat,Right-arm Medium-fast,India,Player,Royal Challengers Bangalore,Chennai Super Kings,2009,,32,,Blank,Blank,A Kumble,Ms Dhoni,Mv Boucher,Ms Dhoni,1977-10-07
14888,,392229,14,P Kumar,10/2/1986,Right-hand Bat,Right-arm Medium,India,Player,Royal Challengers Bangalore,Chennai Super Kings,2009,,23,,Blank,Blank,A Kumble,Ms Dhoni,Mv Boucher,Ms Dhoni,1986-10-02
14889,,392229,46,Rv Uthappa,11/11/1985,Right-hand Bat,Right-arm Medium,India,Player,Royal Challengers Bangalore,Chennai Super Kings,2009,,24,,Blank,Blank,A Kumble,Ms Dhoni,Mv Boucher,Ms Dhoni,1985-11-11
14890,,392229,52,Lrpl Taylor,3/8/1984,Right-hand Bat,Right-arm Offbreak,New Zealand,Player,Royal Challengers Bangalore,Chennai Super Kings,2009,,25,,Blank,Blank,A Kumble,Ms Dhoni,Mv Boucher,Ms Dhoni,1984-03-08
14891,,392229,81,R Vinay Kumar,2/12/1984,Right-hand Bat,Right-arm Medium,India,Player,Royal Challengers Bangalore,Chennai Super Kings,2009,,25,,Blank,Blank,A Kumble,Ms Dhoni,Mv Boucher,Ms Dhoni,1984-02-12
14896,,392230,38,Sk Warne,9/13/1969,Right-hand Bat,Legbreak Googly,Australia,Captain,Rajasthan Royals,Mumbai Indians,2009,,40,,Blank,Blank,Sk Warne,Sr Tendulkar,Nv Ojha,Yv Takawale,1969-09-13
14903,,392230,183,Nv Ojha,7/20/1983,Right-hand Bat,N/a,India,Keeper,Rajasthan Royals,Mumbai Indians,2009,,26,,Blank,Blank,Sk Warne,Sr Tendulkar,Nv Ojha,Yv Takawale,1983-07-20
14904,,392230,192,J Botha,5/2/1982,Right-hand Bat,Right-arm Offbreak,South Africa,Player,Rajasthan Royals,Mumbai Indians,2009,,27,,Blank,Blank,Sk Warne,Sr Tendulkar,Nv Ojha,Yv Takawale,1982-05-02
14905,,392230,44,St Jayasuriya,6/30/1969,Left-hand Bat,Slow Left-arm Orthodox,Sri Lanka,Player,Mumbai Indians,Rajasthan Royals,2009,,40,,Blank,Blank,Sr Tendulkar,Sk Warne,Yv Takawale,Nv Ojha,1969-06-30
14906,,392230,48,Am Nayar,10/8/1983,Left-hand Bat,Right-arm Medium,India,Player,Mumbai Indians,Rajasthan Royals,2009,,26,,Blank,Blank,Sr Tendulkar,Sk Warne,Yv Takawale,Nv Ojha,1983-10-08
14914,,392230,193,C Nanda,3/29/1979,Right-hand Bat,Legbreak,India,Player,Mumbai Indians,Rajasthan Royals,2009,,30,,Blank,Blank,Sr Tendulkar,Sk Warne,Yv Takawale,Nv Ojha,1979-03-29
14917,,392231,27,Yuvraj Singh,12/12/1981,Left-hand Bat,Slow Left-arm Orthodox,India,Captain,Kings Xi Punjab,Delhi Daredevils,2009,,28,,Blank,Blank,Yuvraj Singh,V Sehwag,Kc Sangakkara,Kd Karthik,1981-12-12
14918,,392231,28,Sm Katich,8/21/1975,Left-hand Bat,Slow Left-arm Chinaman,Australia,Player,Kings Xi Punjab,Delhi Daredevils,2009,,34,,Blank,Blank,Yuvraj Singh,V Sehwag,Kc Sangakkara,Kd Karthik,1975-08-21
14930,,392231,88,Kd Karthik,6/1/1985,Right-hand Bat,N/a,India,Keeper,Delhi Daredevils,Kings Xi Punjab,2009,,24,,Blank,Blank,V Sehwag,Yuvraj Singh,Kd Karthik,Kc Sangakkara,1985-06-01
14931,,392231,89,R Bhatia,10/22/1979,Right-hand Bat,Right-arm Medium-fast,India,Player,Delhi Daredevils,Kings Xi Punjab,2009,,30,,Blank,Blank,V Sehwag,Yuvraj Singh,Kd Karthik,Kc Sangakkara,1979-10-22
14932,,392231,90,Mf Maharoof,9/7/1984,Right-hand Bat,Right-arm Fast-medium,India,Player,Delhi Daredevils,Kings Xi Punjab,2009,,25,,Blank,Blank,V Sehwag,Yuvraj Singh,Kd Karthik,Kc Sangakkara,1984-09-07
14935,,392231,135,Tm Dilshan,10/14/1976,Right-hand Bat,Right-arm Offbreak,Sri Lanka,Player,Delhi Daredevils,Kings Xi Punjab,2009,,33,,Blank,Blank,V Sehwag,Yuvraj Singh,Kd Karthik,Kc Sangakkara,1976-10-14
14941,,392232,21,Sk Raina,11/27/1986,Left-hand Bat,Right-arm Offbreak,India,Player,Chennai Super Kings,Mumbai Indians,2009,,23,,Blank,Blank,Ms Dhoni,Sr Tendulkar,Ms Dhoni,Yv Takawale,1986-11-27
14942,,392232,22,Jdp Oram,7/28/1978,Left-hand Bat,Right-arm Fast-medium,New Zealand,Player,Chennai Super Kings,Mumbai Indians,2009,,31,,Blank,Blank,Ms Dhoni,Sr Tendulkar,Ms Dhoni,Yv Takawale,1978-07-28
14943,,392232,23,S Badrinath,8/30/1980,Right-hand Bat,Right-arm Offbreak,India,Player,Chennai Super Kings,Mumbai Indians,2009,,29,,Blank,Blank,Ms Dhoni,Sr Tendulkar,Ms Dhoni,Yv Takawale,1980-08-30
14944,,392232,109,Ja Morkel,6/10/1981,Left-hand Bat,Right-arm Medium-fast,South Africa,Player,Chennai Super Kings,Mumbai Indians,2009,,28,,Blank,Blank,Ms Dhoni,Sr Tendulkar,Ms Dhoni,Yv Takawale,1981-06-10
14945,,392232,121,M Muralitharan,4/17/1972,Right-hand Bat,Right-arm Offbreak,Sri Lanka,Player,Chennai Super Kings,Mumbai Indians,2009,,37,,Blank,Blank,Ms Dhoni,Sr Tendulkar,Ms Dhoni,Yv Takawale,1972-04-17
14949,,392232,44,St Jayasuriya,6/30/1969,Left-hand Bat,Slow Left-arm Orthodox,Sri Lanka,Player,Mumbai Indians,Chennai Super Kings,2009,,40,,Blank,Blank,Sr Tendulkar,Ms Dhoni,Yv Takawale,Ms Dhoni,1969-06-30
14952,,392232,71,Dj Bravo,10/7/1983,Right-hand Bat,Right-arm Medium-fast,West Indies,Player,Mumbai Indians,Chennai Super Kings,2009,,26,,Blank,Blank,Sr Tendulkar,Ms Dhoni,Yv Takawale,Ms Dhoni,1983-10-07
14954,,392232,85,Am Rahane,6/6/1988,Right-hand Bat,Right-arm Medium,India,Player,Mumbai Indians,Chennai Super Kings,2009,,21,,Blank,Blank,Sr Tendulkar,Ms Dhoni,Yv Takawale,Ms Dhoni,1988-06-06
14958,,392232,193,C Nanda,3/29/1979,Right-hand Bat,Legbreak,India,Player,Mumbai Indians,Chennai Super Kings,2009,,30,,Blank,Blank,Sr Tendulkar,Ms Dhoni,Yv Takawale,Ms Dhoni,1979-03-29
14961,,392233,54,Y Venugopal Rao,2/26/1982,Right-hand Bat,Right-arm Offbreak,India,Player,Deccan Chargers,Kolkata Knight Riders,2009,,27,,Blank,Blank,Ac Gilchrist,Bb Mccullum,Ac Gilchrist,Wp Saha,1982-02-26
14967,,392233,131,Pp Ojha,9/5/1986,Left-hand Bat,Slow Left-arm Orthodox,India,Player,Deccan Chargers,Kolkata Knight Riders,2009,,23,,Blank,Blank,Ac Gilchrist,Bb Mccullum,Ac Gilchrist,Wp Saha,1986-09-05
14968,,392233,178,Tl Suman,12/15/1983,Right-hand Bat,Right-arm Offbreak,India,Player,Deccan Chargers,Kolkata Knight Riders,2009,,26,,Blank,Blank,Ac Gilchrist,Bb Mccullum,Ac Gilchrist,Wp Saha,1983-12-15
14970,,392233,256,Harmeet Singh,9/7/1992,Left-hand Bat,Slow Left-arm Orthodox,India,Player,Deccan Chargers,Kolkata Knight Riders,2009,,17,,Blank,Blank,Ac Gilchrist,Bb Mccullum,Ac Gilchrist,Wp Saha,1992-09-07
14972,,392233,2,Bb Mccullum,9/27/1981,Right-hand Bat,Right-arm Medium,New Zealand,Captain,Kolkata Knight Riders,Deccan Chargers,2009,,28,,Blank,Blank,Bb Mccullum,Ac Gilchrist,Wp Saha,Ac Gilchrist,1981-09-27
14975,,392233,82,Ab Agarkar,12/4/1977,Right-hand Bat,Right-arm Fast,India,Player,Kolkata Knight Riders,Deccan Chargers,2009,,32,,Blank,Blank,Bb Mccullum,Ac Gilchrist,Wp Saha,Ac Gilchrist,1977-12-04
14977,,392233,84,I Sharma,9/2/1988,Right-hand Bat,Right-arm Fast-medium,India,Player,Kolkata Knight Riders,Deccan Chargers,2009,,21,,Blank,Blank,Bb Mccullum,Ac Gilchrist,Wp Saha,Ac Gilchrist,1988-09-02
14978,,392233,104,Bj Hodge,12/29/1974,Right-hand Bat,Right-arm Offbreak,Australia,Player,Kolkata Knight Riders,Deccan Chargers,2009,,35,,Blank,Blank,Bb Mccullum,Ac Gilchrist,Wp Saha,Ac Gilchrist,1974-12-29
14979,,392233,170,Yashpal Singh,11/27/1981,Right-hand Bat,Right-arm Medium,India,Player,Kolkata Knight Riders,Deccan Chargers,2009,,28,,Blank,Blank,Bb Mccullum,Ac Gilchrist,Wp Saha,Ac Gilchrist,1981-11-27
14980,,392233,195,Mashrafe Mortaza,10/5/1983,Right-hand Bat,Right-arm Fast-medium,Bangladesh,Player,Kolkata Knight Riders,Deccan Chargers,2009,,26,,Blank,Blank,Bb Mccullum,Ac Gilchrist,Wp Saha,Ac Gilchrist,1983-10-05
14988,,392234,112,Db Ravi Teja,9/5/1987,Right-hand Bat,Legbreak Googly,India,Player,Deccan Chargers,Kings Xi Punjab,2009,,22,,Blank,Blank,Ac Gilchrist,Yuvraj Singh,Ac Gilchrist,Kc Sangakkara,1987-09-05
14989,,392234,131,Pp Ojha,9/5/1986,Left-hand Bat,Slow Left-arm Orthodox,India,Player,Deccan Chargers,Kings Xi Punjab,2009,,23,,Blank,Blank,Ac Gilchrist,Yuvraj Singh,Ac Gilchrist,Kc Sangakkara,1986-09-05
14990,,392234,178,Tl Suman,12/15/1983,Right-hand Bat,Right-arm Offbreak,India,Player,Deccan Chargers,Kings Xi Punjab,2009,,26,,Blank,Blank,Ac Gilchrist,Yuvraj Singh,Ac Gilchrist,Kc Sangakkara,1983-12-15
14997,,392234,65,S Sohal,11/10/1987,Right-hand Bat,Legbreak,India,Player,Kings Xi Punjab,Deccan Chargers,2009,,22,,Blank,Blank,Yuvraj Singh,Ac Gilchrist,Kc Sangakkara,Ac Gilchrist,1987-11-10
14998,,392234,66,B Lee,11/8/1976,Right-hand Bat,Right-arm Fast,Australia,Player,Kings Xi Punjab,Deccan Chargers,2009,,33,,Blank,Blank,Yuvraj Singh,Ac Gilchrist,Kc Sangakkara,Ac Gilchrist,1976-11-08
14999,,392234,67,Pp Chawla,12/24/1988,Left-hand Bat,Legbreak,India,Player,Kings Xi Punjab,Deccan Chargers,2009,,21,,Blank,Blank,Yuvraj Singh,Ac Gilchrist,Kc Sangakkara,Ac Gilchrist,1988-12-24
15002,,392234,139,La Pomersbach,9/28/1984,Left-hand Bat,Right-arm Offbreak,Australia,Player,Kings Xi Punjab,Deccan Chargers,2009,,25,,Blank,Blank,Yuvraj Singh,Ac Gilchrist,Kc Sangakkara,Ac Gilchrist,1984-09-28
15003,,392234,153,Rr Powar,5/20/1978,Right-hand Bat,Right-arm Offbreak,India,Player,Kings Xi Punjab,Deccan Chargers,2009,,31,,Blank,Blank,Yuvraj Singh,Ac Gilchrist,Kc Sangakkara,Ac Gilchrist,1978-05-20
15004,,392235,40,G Gambhir,10/14/1981,Left-hand Bat,Legbreak,India,Player,Delhi Daredevils,Rajasthan Royals,2009,,28,,Blank,Blank,V Sehwag,Sk Warne,Kd Karthik,Nv Ojha,1981-10-14
15010,,392235,135,Tm Dilshan,10/14/1976,Right-hand Bat,Right-arm Offbreak,Sri Lanka,Player,Delhi Daredevils,Rajasthan Royals,2009,,33,,Blank,Blank,V Sehwag,Sk Warne,Kd Karthik,Nv Ojha,1976-10-14
15012,,392235,171,M Manhas,10/12/1979,Right-hand Bat,Right-arm Offbreak,India,Player,Delhi Daredevils,Rajasthan Royals,2009,,30,,Blank,Blank,V Sehwag,Sk Warne,Kd Karthik,Nv Ojha,1979-10-12
15013,,392235,223,Dp Nannes,5/16/1976,Right-hand Bat,Left-arm Fast,Australia,Player,Delhi Daredevils,Rajasthan Royals,2009,,33,,Blank,Blank,V Sehwag,Sk Warne,Kd Karthik,Nv Ojha,1976-05-16
15014,,392235,439,Am Salvi,10/20/1981,Right-hand Bat,Right-arm Medium,India,Player,Delhi Daredevils,Rajasthan Royals,2009,,28,,Blank,Blank,V Sehwag,Sk Warne,Kd Karthik,Nv Ojha,1981-10-20
15018,,392235,39,Sk Trivedi,9/4/1982,Right-hand Bat,Right-arm Medium,India,Player,Rajasthan Royals,Delhi Daredevils,2009,,27,,Blank,Blank,Sk Warne,V Sehwag,Nv Ojha,Kd Karthik,1982-09-04
15023,,392235,183,Nv Ojha,7/20/1983,Right-hand Bat,N/a,India,Keeper,Rajasthan Royals,Delhi Daredevils,2009,,26,,Blank,Blank,Sk Warne,V Sehwag,Nv Ojha,Kd Karthik,1983-07-20
15024,,392235,192,J Botha,5/2/1982,Right-hand Bat,Right-arm Offbreak,South Africa,Player,Rajasthan Royals,Delhi Daredevils,2009,,27,,Blank,Blank,Sk Warne,V Sehwag,Nv Ojha,Kd Karthik,1982-05-02
15026,,392236,17,Pa Patel,3/9/1985,Left-hand Bat,N/a,India,Player,Chennai Super Kings,Kolkata Knight Riders,2009,,24,,Blank,Blank,Ms Dhoni,Bb Mccullum,Ms Dhoni,Wp Saha,1985-03-09
15027,,392236,20,Ms Dhoni,7/7/1981,Right-hand Bat,Right-arm Medium,India,Captainkeeper,Chennai Super Kings,Kolkata Knight Riders,2009,,28,,Blank,Blank,Ms Dhoni,Bb Mccullum,Ms Dhoni,Wp Saha,1981-07-07
15028,,392236,21,Sk Raina,11/27/1986,Left-hand Bat,Right-arm Offbreak,India,Player,Chennai Super Kings,Kolkata Knight Riders,2009,,23,,Blank,Blank,Ms Dhoni,Bb Mccullum,Ms Dhoni,Wp Saha,1986-11-27
15029,,392236,22,Jdp Oram,7/28/1978,Left-hand Bat,Right-arm Fast-medium,New Zealand,Player,Chennai Super Kings,Kolkata Knight Riders,2009,,31,,Blank,Blank,Ms Dhoni,Bb Mccullum,Ms Dhoni,Wp Saha,1978-07-28
15031,,392236,109,Ja Morkel,6/10/1981,Left-hand Bat,Right-arm Medium-fast,South Africa,Player,Chennai Super Kings,Kolkata Knight Riders,2009,,28,,Blank,Blank,Ms Dhoni,Bb Mccullum,Ms Dhoni,Wp Saha,1981-06-10
15034,,392236,186,Sb Jakati,11/27/1980,Left-hand Bat,Slow Left-arm Orthodox,India,Player,Chennai Super Kings,Kolkata Knight Riders,2009,,29,,Blank,Blank,Ms Dhoni,Bb Mccullum,Ms Dhoni,Wp Saha,1980-11-27
15038,,392236,2,Bb Mccullum,9/27/1981,Right-hand Bat,Right-arm Medium,New Zealand,Captain,Kolkata Knight Riders,Chennai Super Kings,2009,,28,,Blank,Blank,Bb Mccullum,Ms Dhoni,Wp Saha,Ms Dhoni,1981-09-27
15039,,392236,4,Dj Hussey,7/15/1977,Right-hand Bat,Right-arm Offbreak,Australia,Player,Kolkata Knight Riders,Chennai Super Kings,2009,,32,,Blank,Blank,Bb Mccullum,Ms Dhoni,Wp Saha,Ms Dhoni,1977-07-15
15040,,392236,62,Wp Saha,10/24/1984,Right-hand Bat,N/a,India,Keeper,Kolkata Knight Riders,Chennai Super Kings,2009,,25,,Blank,Blank,Bb Mccullum,Ms Dhoni,Wp Saha,Ms Dhoni,1984-10-24
15043,,392236,83,M Kartik,9/11/1976,Left-hand Bat,Slow Left-arm Orthodox,India,Player,Kolkata Knight Riders,Chennai Super Kings,2009,,33,,Blank,Blank,Bb Mccullum,Ms Dhoni,Wp Saha,Ms Dhoni,1976-09-11
15044,,392236,104,Bj Hodge,12/29/1974,Right-hand Bat,Right-arm Offbreak,Australia,Player,Kolkata Knight Riders,Chennai Super Kings,2009,,35,,Blank,Blank,Bb Mccullum,Ms Dhoni,Wp Saha,Ms Dhoni,1974-12-29
15046,,392236,174,Baw Mendis,3/11/1985,Right-hand Bat,Right-arm Offbreak,Sri Lanka,Player,Kolkata Knight Riders,Chennai Super Kings,2009,,24,,Blank,Blank,Bb Mccullum,Ms Dhoni,Wp Saha,Ms Dhoni,1985-03-11
15049,,392237,41,V Sehwag,10/20/1978,Right-hand Bat,Right-arm Offbreak,India,Captain,Delhi Daredevils,Royal Challengers Bangalore,2009,,31,,Blank,Blank,V Sehwag,A Kumble,Kd Karthik,Mv Boucher,1978-10-20
15050,,392237,73,A Nehra,4/29/1979,Right-hand Bat,Left-arm Medium-fast,India,Player,Delhi Daredevils,Royal Challengers Bangalore,2009,,30,,Blank,Blank,V Sehwag,A Kumble,Kd Karthik,Mv Boucher,1979-04-29
15051,,392237,88,Kd Karthik,6/1/1985,Right-hand Bat,N/a,India,Keeper,Delhi Daredevils,Royal Challengers Bangalore,2009,,24,,Blank,Blank,V Sehwag,A Kumble,Kd Karthik,Mv Boucher,1985-06-01
15053,,392237,110,Ab De Villiers,2/17/1984,Right-hand Bat,Right-arm Medium,South Africa,Player,Delhi Daredevils,Royal Challengers Bangalore,2009,,25,,Blank,Blank,V Sehwag,A Kumble,Kd Karthik,Mv Boucher,1984-02-17
15057,,392237,199,Y Nagar,1/6/1990,Right-hand Bat,Right-arm Offbreak,India,Player,Delhi Daredevils,Royal Challengers Bangalore,2009,,19,,Blank,Blank,V Sehwag,A Kumble,Kd Karthik,Mv Boucher,1990-01-06
15058,,392237,439,Am Salvi,10/20/1981,Right-hand Bat,Right-arm Medium,India,Player,Delhi Daredevils,Royal Challengers Bangalore,2009,,28,,Blank,Blank,V Sehwag,A Kumble,Kd Karthik,Mv Boucher,1981-10-20
15059,,392237,6,R Dravid,1/11/1973,Right-hand Bat,Right-arm Offbreak,India,Player,Royal Challengers Bangalore,Delhi Daredevils,2009,,36,,Blank,Blank,A Kumble,V Sehwag,Mv Boucher,Kd Karthik,1973-01-11
15060,,392237,8,V Kohli,11/5/1988,Right-hand Bat,Right-arm Medium,India,Player,Royal Challengers Bangalore,Delhi Daredevils,2009,,21,,Blank,Blank,A Kumble,V Sehwag,Mv Boucher,Kd Karthik,1988-11-05
15061,,392237,9,Jh Kallis,10/16/1975,Right-hand Bat,Right-arm Fast-medium,South Africa,Player,Royal Challengers Bangalore,Delhi Daredevils,2009,,34,,Blank,Blank,A Kumble,V Sehwag,Mv Boucher,Kd Karthik,1975-10-16
15062,,392237,11,Mv Boucher,12/3/1976,Right-hand Bat,Right-arm Medium,South Africa,Keeper,Royal Challengers Bangalore,Delhi Daredevils,2009,,33,,Blank,Blank,A Kumble,V Sehwag,Mv Boucher,Kd Karthik,1976-12-03
15064,,392237,14,P Kumar,10/2/1986,Right-hand Bat,Right-arm Medium,India,Player,Royal Challengers Bangalore,Delhi Daredevils,2009,,23,,Blank,Blank,A Kumble,V Sehwag,Mv Boucher,Kd Karthik,1986-10-02
15066,,392237,52,Lrpl Taylor,3/8/1984,Right-hand Bat,Right-arm Offbreak,New Zealand,Player,Royal Challengers Bangalore,Delhi Daredevils,2009,,25,,Blank,Blank,A Kumble,V Sehwag,Mv Boucher,Kd Karthik,1984-03-08
15070,,392238,31,Yk Pathan,11/17/1982,Right-hand Bat,Right-arm Offbreak,India,Player,Rajasthan Royals,Kolkata Knight Riders,2009,,27,,Blank,Blank,Sk Warne,Bb Mccullum,Nv Ojha,Ss Shaikh,1982-11-17
15071,,392238,35,Ra Jadeja,12/6/1988,Left-hand Bat,Slow Left-arm Orthodox,India,Player,Rajasthan Royals,Kolkata Knight Riders,2009,,21,,Blank,Blank,Sk Warne,Bb Mccullum,Nv Ojha,Ss Shaikh,1988-12-06
15073,,392238,101,Sa Asnodkar,3/29/1984,Right-hand Bat,Right-arm Offbreak,India,Player,Rajasthan Royals,Kolkata Knight Riders,2009,,25,,Blank,Blank,Sk Warne,Bb Mccullum,Nv Ojha,Ss Shaikh,1984-03-29
15074,,392238,126,Mm Patel,7/12/1983,Right-hand Bat,Right-arm Medium-fast,India,Player,Rajasthan Royals,Kolkata Knight Riders,2009,,26,,Blank,Blank,Sk Warne,Bb Mccullum,Nv Ojha,Ss Shaikh,1983-07-12
15075,,392238,138,Nk Patel,3/26/1981,Left-hand Bat,N/a,India,Player,Rajasthan Royals,Kolkata Knight Riders,2009,,28,,Blank,Blank,Sk Warne,Bb Mccullum,Nv Ojha,Ss Shaikh,1981-03-26
15076,,392238,159,T Henderson,8/1/1974,Right-hand Bat,Right-arm Fast-medium,South Africa,Player,Rajasthan Royals,Kolkata Knight Riders,2009,,35,,Blank,Blank,Sk Warne,Bb Mccullum,Nv Ojha,Ss Shaikh,1974-08-01
15083,,392238,4,Dj Hussey,7/15/1977,Right-hand Bat,Right-arm Offbreak,Australia,Player,Kolkata Knight Riders,Rajasthan Royals,2009,,32,,Blank,Blank,Bb Mccullum,Sk Warne,Ss Shaikh,Nv Ojha,1977-07-15
15085,,392238,82,Ab Agarkar,12/4/1977,Right-hand Bat,Right-arm Fast,India,Player,Kolkata Knight Riders,Rajasthan Royals,2009,,32,,Blank,Blank,Bb Mccullum,Sk Warne,Ss Shaikh,Nv Ojha,1977-12-04
15086,,392238,104,Bj Hodge,12/29/1974,Right-hand Bat,Right-arm Offbreak,Australia,Player,Kolkata Knight Riders,Rajasthan Royals,2009,,35,,Blank,Blank,Bb Mccullum,Sk Warne,Ss Shaikh,Nv Ojha,1974-12-29
15091,,392238,441,Ss Sarkar,12/15/1984,Right-hand Bat,Right-arm Medium,India,Player,Kolkata Knight Riders,Rajasthan Royals,2009,,25,,Blank,Blank,Bb Mccullum,Sk Warne,Ss Shaikh,Nv Ojha,1984-12-15
15093,,392239,27,Yuvraj Singh,12/12/1981,Left-hand Bat,Slow Left-arm Orthodox,India,Captain,Kings Xi Punjab,Chennai Super Kings,2009,,28,,Blank,Blank,Yuvraj Singh,Ms Dhoni,Kc Sangakkara,Ms Dhoni,1981-12-12
15096,,392239,65,S Sohal,11/10/1987,Right-hand Bat,Legbreak,India,Player,Kings Xi Punjab,Chennai Super Kings,2009,,22,,Blank,Blank,Yuvraj Singh,Ms Dhoni,Kc Sangakkara,Ms Dhoni,1987-11-10
15097,,392239,66,B Lee,11/8/1976,Right-hand Bat,Right-arm Fast,Australia,Player,Kings Xi Punjab,Chennai Super Kings,2009,,33,,Blank,Blank,Yuvraj Singh,Ms Dhoni,Kc Sangakkara,Ms Dhoni,1976-11-08
15098,,392239,67,Pp Chawla,12/24/1988,Left-hand Bat,Legbreak,India,Player,Kings Xi Punjab,Chennai Super Kings,2009,,21,,Blank,Blank,Yuvraj Singh,Ms Dhoni,Kc Sangakkara,Ms Dhoni,1988-12-24
15100,,392239,77,S Sreesanth,2/6/1983,Right-hand Bat,Right-arm Fast-medium,India,Player,Kings Xi Punjab,Chennai Super Kings,2009,,26,,Blank,Blank,Yuvraj Singh,Ms Dhoni,Kc Sangakkara,Ms Dhoni,1983-02-06
15105,,392239,21,Sk Raina,11/27/1986,Left-hand Bat,Right-arm Offbreak,India,Player,Chennai Super Kings,Kings Xi Punjab,2009,,23,,Blank,Blank,Ms Dhoni,Yuvraj Singh,Ms Dhoni,Kc Sangakkara,1986-11-27
15106,,392239,22,Jdp Oram,7/28/1978,Left-hand Bat,Right-arm Fast-medium,New Zealand,Player,Chennai Super Kings,Kings Xi Punjab,2009,,31,,Blank,Blank,Ms Dhoni,Yuvraj Singh,Ms Dhoni,Kc Sangakkara,1978-07-28
15108,,392239,120,Ms Gony,1/4/1984,Right-hand Bat,Right-arm Medium,India,Player,Chennai Super Kings,Kings Xi Punjab,2009,,25,,Blank,Blank,Ms Dhoni,Yuvraj Singh,Ms Dhoni,Kc Sangakkara,1984-01-04
15110,,392239,151,L Balaji,9/27/1981,Right-hand Bat,Right-arm Medium-fast,India,Player,Chennai Super Kings,Kings Xi Punjab,2009,,28,,Blank,Blank,Ms Dhoni,Yuvraj Singh,Ms Dhoni,Kc Sangakkara,1981-09-27
15111,,392239,156,T Thushara,3/1/1981,Left-hand Bat,Left-arm Fast-medium,Sri Lanka,Player,Chennai Super Kings,Kings Xi Punjab,2009,,28,,Blank,Blank,Ms Dhoni,Yuvraj Singh,Ms Dhoni,Kc Sangakkara,1981-03-01
15112,,392239,197,Gj Bailey,9/7/1982,Right-hand Bat,Right-arm Medium,Australia,Player,Chennai Super Kings,Kings Xi Punjab,2009,,27,,Blank,Blank,Ms Dhoni,Yuvraj Singh,Ms Dhoni,Kc Sangakkara,1982-09-07
15113,,392239,201,R Ashwin,9/17/1986,Right-hand Bat,Right-arm Offbreak,India,Player,Chennai Super Kings,Kings Xi Punjab,2009,,23,,Blank,Blank,Ms Dhoni,Yuvraj Singh,Ms Dhoni,Kc Sangakkara,1986-09-17
15114,,392240,40,G Gambhir,10/14/1981,Left-hand Bat,Legbreak,India,Player,Delhi Daredevils,Mumbai Indians,2009,,28,,Blank,Blank,V Sehwag,Sr Tendulkar,Kd Karthik,Pr Shah,1981-10-14
15115,,392240,41,V Sehwag,10/20/1978,Right-hand Bat,Right-arm Offbreak,India,Captain,Delhi Daredevils,Mumbai Indians,2009,,31,,Blank,Blank,V Sehwag,Sr Tendulkar,Kd Karthik,Pr Shah,1978-10-20
15116,,392240,88,Kd Karthik,6/1/1985,Right-hand Bat,N/a,India,Keeper,Delhi Daredevils,Mumbai Indians,2009,,24,,Blank,Blank,V Sehwag,Sr Tendulkar,Kd Karthik,Pr Shah,1985-06-01
15117,,392240,89,R Bhatia,10/22/1979,Right-hand Bat,Right-arm Medium-fast,India,Player,Delhi Daredevils,Mumbai Indians,2009,,30,,Blank,Blank,V Sehwag,Sr Tendulkar,Kd Karthik,Pr Shah,1979-10-22
15128,,392240,50,Harbhajan Singh,7/3/1980,Right-hand Bat,Right-arm Offbreak,India,Player,Mumbai Indians,Delhi Daredevils,2009,,29,,Blank,Blank,Sr Tendulkar,V Sehwag,Pr Shah,Kd Karthik,1980-07-03
15129,,392240,80,Ds Kulkarni,12/10/1988,Right-hand Bat,Right-arm Medium,India,Player,Mumbai Indians,Delhi Daredevils,2009,,21,,Blank,Blank,Sr Tendulkar,V Sehwag,Pr Shah,Kd Karthik,1988-12-10
15130,,392240,85,Am Rahane,6/6/1988,Right-hand Bat,Right-arm Medium,India,Player,Mumbai Indians,Delhi Daredevils,2009,,21,,Blank,Blank,Sr Tendulkar,V Sehwag,Pr Shah,Kd Karthik,1988-06-06
15132,,392240,154,Jp Duminy,4/14/1984,Left-hand Bat,Right-arm Offbreak,South Africa,Player,Mumbai Indians,Delhi Daredevils,2009,,25,,Blank,Blank,Sr Tendulkar,V Sehwag,Pr Shah,Kd Karthik,1984-04-14
15133,,392240,194,Sl Malinga,8/28/1983,Right-hand Bat,Right-arm Fast,Sri Lanka,Player,Mumbai Indians,Delhi Daredevils,2009,,26,,Blank,Blank,Sr Tendulkar,V Sehwag,Pr Shah,Kd Karthik,1983-08-28
15138,,392241,56,A Symonds,6/9/1975,Right-hand Bat,Right-arm Offbreak,Australia,Player,Deccan Chargers,Royal Challengers Bangalore,2009,,34,,Blank,Blank,Ac Gilchrist,A Kumble,Ac Gilchrist,Mv Boucher,1975-06-09
15145,,392241,188,Rj Harris,10/11/1979,Right-hand Bat,Right-arm Fast,Australia,Player,Deccan Chargers,Royal Challengers Bangalore,2009,,30,,Blank,Blank,Ac Gilchrist,A Kumble,Ac Gilchrist,Mv Boucher,1979-10-11
15146,,392241,206,Jaskaran Singh,9/4/1989,Right-hand Bat,Right-arm Medium,India,Player,Deccan Chargers,Royal Challengers Bangalore,2009,,20,,Blank,Blank,Ac Gilchrist,A Kumble,Ac Gilchrist,Mv Boucher,1989-09-04
15151,,392241,12,B Akhil,10/7/1977,Right-hand Bat,Right-arm Medium-fast,India,Player,Royal Challengers Bangalore,Deccan Chargers,2009,,32,,Blank,Blank,A Kumble,Ac Gilchrist,Mv Boucher,Ac Gilchrist,1977-10-07
15152,,392241,14,P Kumar,10/2/1986,Right-hand Bat,Right-arm Medium,India,Player,Royal Challengers Bangalore,Deccan Chargers,2009,,23,,Blank,Blank,A Kumble,Ac Gilchrist,Mv Boucher,Ac Gilchrist,1986-10-02
15157,,392241,177,Re Van Der Merwe,12/31/1984,Right-hand Bat,Slow Left-arm Orthodox,South Africa,Player,Royal Challengers Bangalore,Deccan Chargers,2009,,25,,Blank,Blank,A Kumble,Ac Gilchrist,Mv Boucher,Ac Gilchrist,1984-12-31
15159,,392242,54,Y Venugopal Rao,2/26/1982,Right-hand Bat,Right-arm Offbreak,India,Player,Deccan Chargers,Delhi Daredevils,2009,,27,,Blank,Blank,Ac Gilchrist,V Sehwag,Ac Gilchrist,Kd Karthik,1982-02-26
15161,,392242,57,Rg Sharma,4/30/1987,Right-hand Bat,Right-arm Offbreak,India,Player,Deccan Chargers,Delhi Daredevils,2009,,22,,Blank,Blank,Ac Gilchrist,V Sehwag,Ac Gilchrist,Kd Karthik,1987-04-30
15162,,392242,61,Rp Singh,12/6/1985,Right-hand Bat,Left-arm Fast-medium,India,Player,Deccan Chargers,Delhi Daredevils,2009,,24,,Blank,Blank,Ac Gilchrist,V Sehwag,Ac Gilchrist,Kd Karthik,1985-12-06
15163,,392242,97,Hh Gibbs,2/23/1974,Right-hand Bat,Right-arm Bowler,South Africa,Player,Deccan Chargers,Delhi Daredevils,2009,,35,,Blank,Blank,Ac Gilchrist,V Sehwag,Ac Gilchrist,Kd Karthik,1974-02-23
15164,,392242,131,Pp Ojha,9/5/1986,Left-hand Bat,Slow Left-arm Orthodox,India,Player,Deccan Chargers,Delhi Daredevils,2009,,23,,Blank,Blank,Ac Gilchrist,V Sehwag,Ac Gilchrist,Kd Karthik,1986-09-05
15169,,392242,40,G Gambhir,10/14/1981,Left-hand Bat,Legbreak,India,Player,Delhi Daredevils,Deccan Chargers,2009,,28,,Blank,Blank,V Sehwag,Ac Gilchrist,Kd Karthik,Ac Gilchrist,1981-10-14
15171,,392242,73,A Nehra,4/29/1979,Right-hand Bat,Left-arm Medium-fast,India,Player,Delhi Daredevils,Deccan Chargers,2009,,30,,Blank,Blank,V Sehwag,Ac Gilchrist,Kd Karthik,Ac Gilchrist,1979-04-29
15172,,392242,88,Kd Karthik,6/1/1985,Right-hand Bat,N/a,India,Keeper,Delhi Daredevils,Deccan Chargers,2009,,24,,Blank,Blank,V Sehwag,Ac Gilchrist,Kd Karthik,Ac Gilchrist,1985-06-01
15173,,392242,89,R Bhatia,10/22/1979,Right-hand Bat,Right-arm Medium-fast,India,Player,Delhi Daredevils,Deccan Chargers,2009,,30,,Blank,Blank,V Sehwag,Ac Gilchrist,Kd Karthik,Ac Gilchrist,1979-10-22
15174,,392242,110,Ab De Villiers,2/17/1984,Right-hand Bat,Right-arm Medium,South Africa,Player,Delhi Daredevils,Deccan Chargers,2009,,25,,Blank,Blank,V Sehwag,Ac Gilchrist,Kd Karthik,Ac Gilchrist,1984-02-17
15175,,392242,116,Pj Sangwan,11/5/1990,Right-hand Bat,Left-arm Medium,India,Player,Delhi Daredevils,Deccan Chargers,2009,,19,,Blank,Blank,V Sehwag,Ac Gilchrist,Kd Karthik,Ac Gilchrist,1990-11-05
15183,,392243,21,Sk Raina,11/27/1986,Left-hand Bat,Right-arm Offbreak,India,Player,Chennai Super Kings,Royal Challengers Bangalore,2009,,23,,Blank,Blank,Ms Dhoni,A Kumble,Ms Dhoni,Mv Boucher,1986-11-27
15186,,392243,109,Ja Morkel,6/10/1981,Left-hand Bat,Right-arm Medium-fast,South Africa,Player,Chennai Super Kings,Royal Challengers Bangalore,2009,,28,,Blank,Blank,Ms Dhoni,A Kumble,Ms Dhoni,Mv Boucher,1981-06-10
15188,,392243,121,M Muralitharan,4/17/1972,Right-hand Bat,Right-arm Offbreak,Sri Lanka,Player,Chennai Super Kings,Royal Challengers Bangalore,2009,,37,,Blank,Blank,Ms Dhoni,A Kumble,Ms Dhoni,Mv Boucher,1972-04-17
15189,,392243,151,L Balaji,9/27/1981,Right-hand Bat,Right-arm Medium-fast,India,Player,Chennai Super Kings,Royal Challengers Bangalore,2009,,28,,Blank,Blank,Ms Dhoni,A Kumble,Ms Dhoni,Mv Boucher,1981-09-27
15190,,392243,186,Sb Jakati,11/27/1980,Left-hand Bat,Slow Left-arm Orthodox,India,Player,Chennai Super Kings,Royal Challengers Bangalore,2009,,29,,Blank,Blank,Ms Dhoni,A Kumble,Ms Dhoni,Mv Boucher,1980-11-27
15191,,392243,6,R Dravid,1/11/1973,Right-hand Bat,Right-arm Offbreak,India,Player,Royal Challengers Bangalore,Chennai Super Kings,2009,,36,,Blank,Blank,A Kumble,Ms Dhoni,Mv Boucher,Ms Dhoni,1973-01-11
15194,,392243,11,Mv Boucher,12/3/1976,Right-hand Bat,Right-arm Medium,South Africa,Keeper,Royal Challengers Bangalore,Chennai Super Kings,2009,,33,,Blank,Blank,A Kumble,Ms Dhoni,Mv Boucher,Ms Dhoni,1976-12-03
15196,,392243,46,Rv Uthappa,11/11/1985,Right-hand Bat,Right-arm Medium,India,Player,Royal Challengers Bangalore,Chennai Super Kings,2009,,24,,Blank,Blank,A Kumble,Ms Dhoni,Mv Boucher,Ms Dhoni,1985-11-11
15199,,392243,96,Mk Pandey,9/10/1989,Right-hand Bat,Right-arm Medium,India,Player,Royal Challengers Bangalore,Chennai Super Kings,2009,,20,,Blank,Blank,A Kumble,Ms Dhoni,Mv Boucher,Ms Dhoni,1989-09-10
15200,,392243,124,A Kumble,10/17/1970,Right-hand Bat,Legbreak Googly,India,Captain,Royal Challengers Bangalore,Chennai Super Kings,2009,,39,,Blank,Blank,A Kumble,Ms Dhoni,Mv Boucher,Ms Dhoni,1970-10-17
15202,,392244,53,Ac Gilchrist,11/14/1971,Left-hand Bat,Right-arm Offbreak,Australia,Captainkeeper,Deccan Chargers,Royal Challengers Bangalore,2009,,38,,Blank,Blank,Ac Gilchrist,A Kumble,Ac Gilchrist,Mv Boucher,1971-11-14
15203,,392244,54,Y Venugopal Rao,2/26/1982,Right-hand Bat,Right-arm Offbreak,India,Player,Deccan Chargers,Royal Challengers Bangalore,2009,,27,,Blank,Blank,Ac Gilchrist,A Kumble,Ac Gilchrist,Mv Boucher,1982-02-26
15204,,392244,56,A Symonds,6/9/1975,Right-hand Bat,Right-arm Offbreak,Australia,Player,Deccan Chargers,Royal Challengers Bangalore,2009,,34,,Blank,Blank,Ac Gilchrist,A Kumble,Ac Gilchrist,Mv Boucher,1975-06-09
15206,,392244,61,Rp Singh,12/6/1985,Right-hand Bat,Left-arm Fast-medium,India,Player,Deccan Chargers,Royal Challengers Bangalore,2009,,24,,Blank,Blank,Ac Gilchrist,A Kumble,Ac Gilchrist,Mv Boucher,1985-12-06
15207,,392244,97,Hh Gibbs,2/23/1974,Right-hand Bat,Right-arm Bowler,South Africa,Player,Deccan Chargers,Royal Challengers Bangalore,2009,,35,,Blank,Blank,Ac Gilchrist,A Kumble,Ac Gilchrist,Mv Boucher,1974-02-23
15208,,392244,131,Pp Ojha,9/5/1986,Left-hand Bat,Slow Left-arm Orthodox,India,Player,Deccan Chargers,Royal Challengers Bangalore,2009,,23,,Blank,Blank,Ac Gilchrist,A Kumble,Ac Gilchrist,Mv Boucher,1986-09-05
15216,,392244,11,Mv Boucher,12/3/1976,Right-hand Bat,Right-arm Medium,South Africa,Keeper,Royal Challengers Bangalore,Deccan Chargers,2009,,33,,Blank,Blank,A Kumble,Ac Gilchrist,Mv Boucher,Ac Gilchrist,1976-12-03
15218,,392244,46,Rv Uthappa,11/11/1985,Right-hand Bat,Right-arm Medium,India,Player,Royal Challengers Bangalore,Deccan Chargers,2009,,24,,Blank,Blank,A Kumble,Ac Gilchrist,Mv Boucher,Ac Gilchrist,1985-11-11
15219,,392244,52,Lrpl Taylor,3/8/1984,Right-hand Bat,Right-arm Offbreak,New Zealand,Player,Royal Challengers Bangalore,Deccan Chargers,2009,,25,,Blank,Blank,A Kumble,Ac Gilchrist,Mv Boucher,Ac Gilchrist,1984-03-08
15221,,392244,96,Mk Pandey,9/10/1989,Right-hand Bat,Right-arm Medium,India,Player,Royal Challengers Bangalore,Deccan Chargers,2009,,20,,Blank,Blank,A Kumble,Ac Gilchrist,Mv Boucher,Ac Gilchrist,1989-09-10
15223,,392244,177,Re Van Der Merwe,12/31/1984,Right-hand Bat,Slow Left-arm Orthodox,South Africa,Player,Royal Challengers Bangalore,Deccan Chargers,2009,,25,,Blank,Blank,A Kumble,Ac Gilchrist,Mv Boucher,Ac Gilchrist,1984-12-31
15224,,419111,53,Ac Gilchrist,11/14/1971,Left-hand Bat,Right-arm Offbreak,Australia,Captainkeeper,Deccan Chargers,Kolkata Knight Riders,2010,,39,,Blank,Blank,Ac Gilchrist,Sc Ganguly,Ac Gilchrist,Wp Saha,1971-11-14
15228,,419111,60,Wpujc Vaas,1/27/1974,Left-hand Bat,Left-arm Fast-medium,Sri Lanka,Player,Deccan Chargers,Kolkata Knight Riders,2010,,36,,Blank,Blank,Ac Gilchrist,Sc Ganguly,Ac Gilchrist,Wp Saha,1974-01-27
15230,,419111,97,Hh Gibbs,2/23/1974,Right-hand Bat,Right-arm Bowler,South Africa,Player,Deccan Chargers,Kolkata Knight Riders,2010,,36,,Blank,Blank,Ac Gilchrist,Sc Ganguly,Ac Gilchrist,Wp Saha,1974-02-23
15231,,419111,131,Pp Ojha,9/5/1986,Left-hand Bat,Slow Left-arm Orthodox,India,Player,Deccan Chargers,Kolkata Knight Riders,2010,,24,,Blank,Blank,Ac Gilchrist,Sc Ganguly,Ac Gilchrist,Wp Saha,1986-09-05
15232,,419111,178,Tl Suman,12/15/1983,Right-hand Bat,Right-arm Offbreak,India,Player,Deccan Chargers,Kolkata Knight Riders,2010,,27,,Blank,Blank,Ac Gilchrist,Sc Ganguly,Ac Gilchrist,Wp Saha,1983-12-15
15234,,419111,206,Jaskaran Singh,9/4/1989,Right-hand Bat,Right-arm Medium,India,Player,Deccan Chargers,Kolkata Knight Riders,2010,,21,,Blank,Blank,Ac Gilchrist,Sc Ganguly,Ac Gilchrist,Wp Saha,1989-09-04
15236,,419111,62,Wp Saha,10/24/1984,Right-hand Bat,N/a,India,Keeper,Kolkata Knight Riders,Deccan Chargers,2010,,26,,Blank,Blank,Sc Ganguly,Ac Gilchrist,Wp Saha,Ac Gilchrist,1984-10-24
15237,,419111,63,Lr Shukla,5/6/1981,Right-hand Bat,Right-arm Medium,India,Player,Kolkata Knight Riders,Deccan Chargers,2010,,29,,Blank,Blank,Sc Ganguly,Ac Gilchrist,Wp Saha,Ac Gilchrist,1981-05-06
15238,,419111,83,M Kartik,9/11/1976,Left-hand Bat,Slow Left-arm Orthodox,India,Player,Kolkata Knight Riders,Deccan Chargers,2010,,34,,Blank,Blank,Sc Ganguly,Ac Gilchrist,Wp Saha,Ac Gilchrist,1976-09-11
15241,,419111,104,Bj Hodge,12/29/1974,Right-hand Bat,Right-arm Offbreak,Australia,Player,Kolkata Knight Riders,Deccan Chargers,2010,,36,,Blank,Blank,Sc Ganguly,Ac Gilchrist,Wp Saha,Ac Gilchrist,1974-12-29
15242,,419111,191,Ad Mathews,6/2/1987,Right-hand Bat,Right-arm Fast-medium,Sri Lanka,Player,Kolkata Knight Riders,Deccan Chargers,2010,,23,,Blank,Blank,Sc Ganguly,Ac Gilchrist,Wp Saha,Ac Gilchrist,1987-06-02
15243,,419111,203,Ca Pujara,1/25/1988,Right-hand Bat,Legbreak,India,Player,Kolkata Knight Riders,Deccan Chargers,2010,,22,,Blank,Blank,Sc Ganguly,Ac Gilchrist,Wp Saha,Ac Gilchrist,1988-01-25
15245,,419111,242,Ck Langeveldt,12/17/1974,Right-hand Bat,Right-arm Fast-medium,England,Player,Kolkata Knight Riders,Deccan Chargers,2010,,36,,Blank,Blank,Sc Ganguly,Ac Gilchrist,Wp Saha,Ac Gilchrist,1974-12-17
15247,,419112,44,St Jayasuriya,6/30/1969,Left-hand Bat,Slow Left-arm Orthodox,Sri Lanka,Player,Mumbai Indians,Rajasthan Royals,2010,,41,,Blank,Blank,Sr Tendulkar,Sk Warne,Ap Tare,Nv Ojha,1969-06-30
15252,,419112,207,Ap Tare,11/7/1987,Right-hand Bat,N/a,India,Keeper,Mumbai Indians,Rajasthan Royals,2010,,23,,Blank,Blank,Sr Tendulkar,Sk Warne,Ap Tare,Nv Ojha,1987-11-07
15253,,419112,208,At Rayudu,9/23/1985,Right-hand Bat,Right-arm Offbreak,India,Player,Mumbai Indians,Rajasthan Royals,2010,,25,,Blank,Blank,Sr Tendulkar,Sk Warne,Ap Tare,Nv Ojha,1985-09-23
15254,,419112,209,R Sathish,1/14/1981,Right-hand Bat,Right-arm Medium,India,Player,Mumbai Indians,Rajasthan Royals,2010,,29,,Blank,Blank,Sr Tendulkar,Sk Warne,Ap Tare,Nv Ojha,1981-01-14
15259,,419112,74,Gc Smith,2/1/1981,Left-hand Bat,Right-arm Offbreak,South Africa,Player,Rajasthan Royals,Mumbai Indians,2010,,29,,Blank,Blank,Sk Warne,Sr Tendulkar,Nv Ojha,Ap Tare,1981-02-01
15260,,419112,101,Sa Asnodkar,3/29/1984,Right-hand Bat,Right-arm Offbreak,India,Player,Rajasthan Royals,Mumbai Indians,2010,,26,,Blank,Blank,Sk Warne,Sr Tendulkar,Nv Ojha,Ap Tare,1984-03-29
15262,,419112,160,Kamran Khan,3/10/1991,Left-hand Bat,Left-arm Medium-fast,India,Player,Rajasthan Royals,Mumbai Indians,2010,,19,,Blank,Blank,Sk Warne,Sr Tendulkar,Nv Ojha,Ap Tare,1991-03-10
15263,,419112,183,Nv Ojha,7/20/1983,Right-hand Bat,N/a,India,Keeper,Rajasthan Royals,Mumbai Indians,2010,,27,,Blank,Blank,Sk Warne,Sr Tendulkar,Nv Ojha,Ap Tare,1983-07-20
15264,,419112,211,Aa Jhunjhunwala,12/1/1982,Right-hand Bat,Right-arm Offbreak,India,Player,Rajasthan Royals,Mumbai Indians,2010,,28,,Blank,Blank,Sk Warne,Sr Tendulkar,Nv Ojha,Ap Tare,1982-12-01
15267,,419112,238,Sw Tait,2/22/1983,Right-hand Bat,Right-arm Fast,Australia,Player,Rajasthan Royals,Mumbai Indians,2010,,27,,Blank,Blank,Sk Warne,Sr Tendulkar,Nv Ojha,Ap Tare,1983-02-22
15270,,419113,29,Ik Pathan,10/27/1984,Left-hand Bat,Left-arm Medium-fast,India,Player,Kings Xi Punjab,Delhi Daredevils,2010,,26,,Blank,Blank,Kc Sangakkara,G Gambhir,Kc Sangakkara,Kd Karthik,1984-10-27
15276,,419113,161,Rs Bopara,5/4/1985,Right-hand Bat,Right-arm Medium,England,Player,Kings Xi Punjab,Delhi Daredevils,2010,,25,,Blank,Blank,Kc Sangakkara,G Gambhir,Kc Sangakkara,Kd Karthik,1985-05-04
15277,,419113,214,Ms Bisla,12/27/1984,Right-hand Bat,N/a,India,Player,Kings Xi Punjab,Delhi Daredevils,2010,,26,,Blank,Blank,Kc Sangakkara,G Gambhir,Kc Sangakkara,Kd Karthik,1984-12-27
15280,,419113,41,V Sehwag,10/20/1978,Right-hand Bat,Right-arm Offbreak,India,Player,Delhi Daredevils,Kings Xi Punjab,2010,,32,,Blank,Blank,G Gambhir,Kc Sangakkara,Kd Karthik,Kc Sangakkara,1978-10-20
15283,,419113,91,Vy Mahesh,12/21/1987,Right-hand Bat,Right-arm Medium-fast,India,Player,Delhi Daredevils,Kings Xi Punjab,2010,,23,,Blank,Blank,G Gambhir,Kc Sangakkara,Kd Karthik,Kc Sangakkara,1987-12-21
15292,,419114,9,Jh Kallis,10/16/1975,Right-hand Bat,Right-arm Fast-medium,South Africa,Player,Royal Challengers Bangalore,Kolkata Knight Riders,2010,,35,,Blank,Blank,A Kumble,Sc Ganguly,Sp Goswami,Wp Saha,1975-10-16
15296,,419114,96,Mk Pandey,9/10/1989,Right-hand Bat,Right-arm Medium,India,Player,Royal Challengers Bangalore,Kolkata Knight Riders,2010,,21,,Blank,Blank,A Kumble,Sc Ganguly,Sp Goswami,Wp Saha,1989-09-10
15302,,419114,62,Wp Saha,10/24/1984,Right-hand Bat,N/a,India,Keeper,Kolkata Knight Riders,Royal Challengers Bangalore,2010,,26,,Blank,Blank,Sc Ganguly,A Kumble,Wp Saha,Sp Goswami,1984-10-24
15304,,419114,84,I Sharma,9/2/1988,Right-hand Bat,Right-arm Fast-medium,India,Player,Kolkata Knight Riders,Royal Challengers Bangalore,2010,,22,,Blank,Blank,Sc Ganguly,A Kumble,Wp Saha,Sp Goswami,1988-09-02
15305,,419114,87,Mk Tiwary,11/14/1985,Right-hand Bat,Legbreak Googly,India,Player,Kolkata Knight Riders,Royal Challengers Bangalore,2010,,25,,Blank,Blank,Sc Ganguly,A Kumble,Wp Saha,Sp Goswami,1985-11-14
15307,,419114,191,Ad Mathews,6/2/1987,Right-hand Bat,Right-arm Fast-medium,Sri Lanka,Player,Kolkata Knight Riders,Royal Challengers Bangalore,2010,,23,,Blank,Blank,Sc Ganguly,A Kumble,Wp Saha,Sp Goswami,1987-06-02
15311,,419114,242,Ck Langeveldt,12/17/1974,Right-hand Bat,Right-arm Fast-medium,England,Player,Kolkata Knight Riders,Royal Challengers Bangalore,2010,,36,,Blank,Blank,Sc Ganguly,A Kumble,Wp Saha,Sp Goswami,1974-12-17
15314,,419115,56,A Symonds,6/9/1975,Right-hand Bat,Right-arm Offbreak,Australia,Player,Deccan Chargers,Chennai Super Kings,2010,,35,,Blank,Blank,Ac Gilchrist,Ms Dhoni,Ac Gilchrist,Ms Dhoni,1975-06-09
15319,,419115,131,Pp Ojha,9/5/1986,Left-hand Bat,Slow Left-arm Orthodox,India,Player,Deccan Chargers,Chennai Super Kings,2010,,24,,Blank,Blank,Ac Gilchrist,Ms Dhoni,Ac Gilchrist,Ms Dhoni,1986-09-05
15322,,419115,206,Jaskaran Singh,9/4/1989,Right-hand Bat,Right-arm Medium,India,Player,Deccan Chargers,Chennai Super Kings,2010,,21,,Blank,Blank,Ac Gilchrist,Ms Dhoni,Ac Gilchrist,Ms Dhoni,1989-09-04
15325,,419115,21,Sk Raina,11/27/1986,Left-hand Bat,Right-arm Offbreak,India,Player,Chennai Super Kings,Deccan Chargers,2010,,24,,Blank,Blank,Ms Dhoni,Ac Gilchrist,Ms Dhoni,Ac Gilchrist,1986-11-27
15327,,419115,109,Ja Morkel,6/10/1981,Left-hand Bat,Right-arm Medium-fast,South Africa,Player,Chennai Super Kings,Deccan Chargers,2010,,29,,Blank,Blank,Ms Dhoni,Ac Gilchrist,Ms Dhoni,Ac Gilchrist,1981-06-10
15329,,419115,151,L Balaji,9/27/1981,Right-hand Bat,Right-arm Medium-fast,India,Player,Chennai Super Kings,Deccan Chargers,2010,,29,,Blank,Blank,Ms Dhoni,Ac Gilchrist,Ms Dhoni,Ac Gilchrist,1981-09-27
15330,,419115,185,M Vijay,4/1/1984,Right-hand Bat,Right-arm Offbreak,India,Player,Chennai Super Kings,Deccan Chargers,2010,,26,,Blank,Blank,Ms Dhoni,Ac Gilchrist,Ms Dhoni,Ac Gilchrist,1984-04-01
15332,,419115,217,Jm Kemp,10/2/1977,Right-hand Bat,Right-arm Fast-medium,South Africa,Player,Chennai Super Kings,Deccan Chargers,2010,,33,,Blank,Blank,Ms Dhoni,Ac Gilchrist,Ms Dhoni,Ac Gilchrist,1977-10-02
15333,,419115,218,S Tyagi,9/17/1987,Right-hand Bat,Right-arm Medium,India,Player,Chennai Super Kings,Deccan Chargers,2010,,23,,Blank,Blank,Ms Dhoni,Ac Gilchrist,Ms Dhoni,Ac Gilchrist,1987-09-17
15336,,419116,88,Kd Karthik,6/1/1985,Right-hand Bat,N/a,India,Keeper,Delhi Daredevils,Rajasthan Royals,2010,,25,,Blank,Blank,G Gambhir,Sk Warne,Kd Karthik,Nv Ojha,1985-06-01
15338,,419116,110,Ab De Villiers,2/17/1984,Right-hand Bat,Right-arm Medium,South Africa,Player,Delhi Daredevils,Rajasthan Royals,2010,,26,,Blank,Blank,G Gambhir,Sk Warne,Kd Karthik,Nv Ojha,1984-02-17
15339,,419116,116,Pj Sangwan,11/5/1990,Right-hand Bat,Left-arm Medium,India,Player,Delhi Daredevils,Rajasthan Royals,2010,,20,,Blank,Blank,G Gambhir,Sk Warne,Kd Karthik,Nv Ojha,1990-11-05
15342,,419116,171,M Manhas,10/12/1979,Right-hand Bat,Right-arm Offbreak,India,Player,Delhi Daredevils,Rajasthan Royals,2010,,31,,Blank,Blank,G Gambhir,Sk Warne,Kd Karthik,Nv Ojha,1979-10-12
15345,,419116,31,Yk Pathan,11/17/1982,Right-hand Bat,Right-arm Offbreak,India,Player,Rajasthan Royals,Delhi Daredevils,2010,,28,,Blank,Blank,Sk Warne,G Gambhir,Nv Ojha,Kd Karthik,1982-11-17
15347,,419116,74,Gc Smith,2/1/1981,Left-hand Bat,Right-arm Offbreak,South Africa,Player,Rajasthan Royals,Delhi Daredevils,2010,,29,,Blank,Blank,Sk Warne,G Gambhir,Nv Ojha,Kd Karthik,1981-02-01
15348,,419116,101,Sa Asnodkar,3/29/1984,Right-hand Bat,Right-arm Offbreak,India,Player,Rajasthan Royals,Delhi Daredevils,2010,,26,,Blank,Blank,Sk Warne,G Gambhir,Nv Ojha,Kd Karthik,1984-03-29
15353,,419116,212,P Dogra,11/19/1984,Right-hand Bat,Legbreak,India,Player,Rajasthan Royals,Delhi Daredevils,2010,,26,,Blank,Blank,Sk Warne,G Gambhir,Nv Ojha,Kd Karthik,1984-11-19
15354,,419116,213,A Uniyal,11/21/1981,Left-hand Bat,Left-arm Medium,India,Player,Rajasthan Royals,Delhi Daredevils,2010,,29,,Blank,Blank,Sk Warne,G Gambhir,Nv Ojha,Kd Karthik,1981-11-21
15355,,419116,238,Sw Tait,2/22/1983,Right-hand Bat,Right-arm Fast,Australia,Player,Rajasthan Royals,Delhi Daredevils,2010,,27,,Blank,Blank,Sk Warne,G Gambhir,Nv Ojha,Kd Karthik,1983-02-22
15357,,419117,27,Yuvraj Singh,12/12/1981,Left-hand Bat,Slow Left-arm Orthodox,India,Player,Kings Xi Punjab,Royal Challengers Bangalore,2010,,29,,Blank,Blank,Kc Sangakkara,A Kumble,Kc Sangakkara,Mv Boucher,1981-12-12
15359,,419117,33,M Kaif,12/1/1980,Right-hand Bat,Right-arm Offbreak,India,Player,Kings Xi Punjab,Royal Challengers Bangalore,2010,,30,,Blank,Blank,Kc Sangakkara,A Kumble,Kc Sangakkara,Mv Boucher,1980-12-01
15363,,419117,161,Rs Bopara,5/4/1985,Right-hand Bat,Right-arm Medium,England,Player,Kings Xi Punjab,Royal Challengers Bangalore,2010,,25,,Blank,Blank,Kc Sangakkara,A Kumble,Kc Sangakkara,Mv Boucher,1985-05-04
15364,,419117,214,Ms Bisla,12/27/1984,Right-hand Bat,N/a,India,Player,Kings Xi Punjab,Royal Challengers Bangalore,2010,,26,,Blank,Blank,Kc Sangakkara,A Kumble,Kc Sangakkara,Mv Boucher,1984-12-27
15365,,419117,215,Ya Abdulla,1/17/1983,Left-hand Bat,Left-arm Fast-medium,India,Player,Kings Xi Punjab,Royal Challengers Bangalore,2010,,27,,Blank,Blank,Kc Sangakkara,A Kumble,Kc Sangakkara,Mv Boucher,1983-01-17
15367,,419117,6,R Dravid,1/11/1973,Right-hand Bat,Right-arm Offbreak,India,Player,Royal Challengers Bangalore,Kings Xi Punjab,2010,,37,,Blank,Blank,A Kumble,Kc Sangakkara,Mv Boucher,Kc Sangakkara,1973-01-11
15370,,419117,11,Mv Boucher,12/3/1976,Right-hand Bat,Right-arm Medium,South Africa,Keeper,Royal Challengers Bangalore,Kings Xi Punjab,2010,,34,,Blank,Blank,A Kumble,Kc Sangakkara,Mv Boucher,Kc Sangakkara,1976-12-03
15374,,419117,94,Dw Steyn,6/27/1983,Right-hand Bat,Right-arm Fast,South Africa,Player,Royal Challengers Bangalore,Kings Xi Punjab,2010,,27,,Blank,Blank,A Kumble,Kc Sangakkara,Mv Boucher,Kc Sangakkara,1983-06-27
15379,,419118,20,Ms Dhoni,7/7/1981,Right-hand Bat,Right-arm Medium,India,Captainkeeper,Chennai Super Kings,Kolkata Knight Riders,2010,,29,,Blank,Blank,Ms Dhoni,Sc Ganguly,Ms Dhoni,Wp Saha,1981-07-07
15382,,419118,109,Ja Morkel,6/10/1981,Left-hand Bat,Right-arm Medium-fast,South Africa,Player,Chennai Super Kings,Kolkata Knight Riders,2010,,29,,Blank,Blank,Ms Dhoni,Sc Ganguly,Ms Dhoni,Wp Saha,1981-06-10
15386,,419118,185,M Vijay,4/1/1984,Right-hand Bat,Right-arm Offbreak,India,Player,Chennai Super Kings,Kolkata Knight Riders,2010,,26,,Blank,Blank,Ms Dhoni,Sc Ganguly,Ms Dhoni,Wp Saha,1984-04-01
15387,,419118,201,R Ashwin,9/17/1986,Right-hand Bat,Right-arm Offbreak,India,Player,Chennai Super Kings,Kolkata Knight Riders,2010,,24,,Blank,Blank,Ms Dhoni,Sc Ganguly,Ms Dhoni,Wp Saha,1986-09-17
15388,,419118,217,Jm Kemp,10/2/1977,Right-hand Bat,Right-arm Fast-medium,South Africa,Player,Chennai Super Kings,Kolkata Knight Riders,2010,,33,,Blank,Blank,Ms Dhoni,Sc Ganguly,Ms Dhoni,Wp Saha,1977-10-02
15393,,419118,84,I Sharma,9/2/1988,Right-hand Bat,Right-arm Fast-medium,India,Player,Kolkata Knight Riders,Chennai Super Kings,2010,,22,,Blank,Blank,Sc Ganguly,Ms Dhoni,Wp Saha,Ms Dhoni,1988-09-02
15394,,419118,87,Mk Tiwary,11/14/1985,Right-hand Bat,Legbreak Googly,India,Player,Kolkata Knight Riders,Chennai Super Kings,2010,,25,,Blank,Blank,Sc Ganguly,Ms Dhoni,Wp Saha,Ms Dhoni,1985-11-14
15398,,419118,219,Rs Gavaskar,2/20/1976,Left-hand Bat,Slow Left-arm Orthodox,India,Player,Kolkata Knight Riders,Chennai Super Kings,2010,,34,,Blank,Blank,Sc Ganguly,Ms Dhoni,Wp Saha,Ms Dhoni,1976-02-20
15400,,419119,15,Z Khan,10/7/1978,Right-hand Bat,Left-arm Fast-medium,India,Player,Mumbai Indians,Delhi Daredevils,2010,,32,,Blank,Blank,Sr Tendulkar,G Gambhir,Ap Tare,Kd Karthik,1978-10-07
15401,,419119,44,St Jayasuriya,6/30/1969,Left-hand Bat,Slow Left-arm Orthodox,Sri Lanka,Player,Mumbai Indians,Delhi Daredevils,2010,,41,,Blank,Blank,Sr Tendulkar,G Gambhir,Ap Tare,Kd Karthik,1969-06-30
15403,,419119,71,Dj Bravo,10/7/1983,Right-hand Bat,Right-arm Medium-fast,West Indies,Player,Mumbai Indians,Delhi Daredevils,2010,,27,,Blank,Blank,Sr Tendulkar,G Gambhir,Ap Tare,Kd Karthik,1983-10-07
15404,,419119,79,Ss Tiwary,12/30/1989,Left-hand Bat,N/a,India,Player,Mumbai Indians,Delhi Daredevils,2010,,21,,Blank,Blank,Sr Tendulkar,G Gambhir,Ap Tare,Kd Karthik,1989-12-30
15405,,419119,133,Sr Tendulkar,4/24/1973,Right-hand Bat,Right-arm Offbreak,India,Captain,Mumbai Indians,Delhi Daredevils,2010,,37,,Blank,Blank,Sr Tendulkar,G Gambhir,Ap Tare,Kd Karthik,1973-04-24
15408,,419119,208,At Rayudu,9/23/1985,Right-hand Bat,Right-arm Offbreak,India,Player,Mumbai Indians,Delhi Daredevils,2010,,25,,Blank,Blank,Sr Tendulkar,G Gambhir,Ap Tare,Kd Karthik,1985-09-23
15409,,419119,209,R Sathish,1/14/1981,Right-hand Bat,Right-arm Medium,India,Player,Mumbai Indians,Delhi Daredevils,2010,,29,,Blank,Blank,Sr Tendulkar,G Gambhir,Ap Tare,Kd Karthik,1981-01-14
15410,,419119,221,Ka Pollard,5/12/1987,Right-hand Bat,Right-arm Medium-fast,West Indies,Player,Mumbai Indians,Delhi Daredevils,2010,,23,,Blank,Blank,Sr Tendulkar,G Gambhir,Ap Tare,Kd Karthik,1987-05-12
15413,,419119,88,Kd Karthik,6/1/1985,Right-hand Bat,N/a,India,Keeper,Delhi Daredevils,Mumbai Indians,2010,,25,,Blank,Blank,G Gambhir,Sr Tendulkar,Kd Karthik,Ap Tare,1985-06-01
15415,,419119,110,Ab De Villiers,2/17/1984,Right-hand Bat,Right-arm Medium,South Africa,Player,Delhi Daredevils,Mumbai Indians,2010,,26,,Blank,Blank,G Gambhir,Sr Tendulkar,Kd Karthik,Ap Tare,1984-02-17
15419,,419119,171,M Manhas,10/12/1979,Right-hand Bat,Right-arm Offbreak,India,Player,Delhi Daredevils,Mumbai Indians,2010,,31,,Blank,Blank,G Gambhir,Sr Tendulkar,Kd Karthik,Ap Tare,1979-10-12
15426,,419120,14,P Kumar,10/2/1986,Right-hand Bat,Right-arm Medium,India,Player,Royal Challengers Bangalore,Rajasthan Royals,2010,,24,,Blank,Blank,A Kumble,Sk Warne,Mv Boucher,Nv Ojha,1986-10-02
15429,,419120,94,Dw Steyn,6/27/1983,Right-hand Bat,Right-arm Fast,South Africa,Player,Royal Challengers Bangalore,Rajasthan Royals,2010,,27,,Blank,Blank,A Kumble,Sk Warne,Mv Boucher,Nv Ojha,1983-06-27
15431,,419120,124,A Kumble,10/17/1970,Right-hand Bat,Legbreak Googly,India,Captain,Royal Challengers Bangalore,Rajasthan Royals,2010,,40,,Blank,Blank,A Kumble,Sk Warne,Mv Boucher,Nv Ojha,1970-10-17
15432,,419120,216,Ejg Morgan,9/10/1986,Left-hand Bat,Right-arm Medium,England,Player,Royal Challengers Bangalore,Rajasthan Royals,2010,,24,,Blank,Blank,A Kumble,Sk Warne,Mv Boucher,Nv Ojha,1986-09-10
15435,,419120,39,Sk Trivedi,9/4/1982,Right-hand Bat,Right-arm Medium,India,Player,Rajasthan Royals,Royal Challengers Bangalore,2010,,28,,Blank,Blank,Sk Warne,A Kumble,Nv Ojha,Mv Boucher,1982-09-04
15438,,419120,190,M Morkel,10/6/1984,Left-hand Bat,Right-arm Fast,South Africa,Player,Rajasthan Royals,Royal Challengers Bangalore,2010,,26,,Blank,Blank,Sk Warne,A Kumble,Nv Ojha,Mv Boucher,1984-10-06
15439,,419120,211,Aa Jhunjhunwala,12/1/1982,Right-hand Bat,Right-arm Offbreak,India,Player,Rajasthan Royals,Royal Challengers Bangalore,2010,,28,,Blank,Blank,Sk Warne,A Kumble,Nv Ojha,Mv Boucher,1982-12-01
15440,,419120,212,P Dogra,11/19/1984,Right-hand Bat,Legbreak,India,Player,Rajasthan Royals,Royal Challengers Bangalore,2010,,26,,Blank,Blank,Sk Warne,A Kumble,Nv Ojha,Mv Boucher,1984-11-19
15441,,419120,224,Mj Lumb,2/12/1980,Left-hand Bat,Right-arm Medium,England,Player,Rajasthan Royals,Royal Challengers Bangalore,2010,,30,,Blank,Blank,Sk Warne,A Kumble,Nv Ojha,Mv Boucher,1980-02-12
15443,,419120,226,S Narwal,4/16/1982,Left-hand Bat,Right-arm Medium,India,Player,Rajasthan Royals,Royal Challengers Bangalore,2010,,28,,Blank,Blank,Sk Warne,A Kumble,Nv Ojha,Mv Boucher,1982-04-16
15447,,419121,110,Ab De Villiers,2/17/1984,Right-hand Bat,Right-arm Medium,South Africa,Player,Delhi Daredevils,Chennai Super Kings,2010,,26,,Blank,Blank,Kd Karthik,Sk Raina,Kd Karthik,Pa Patel,1984-02-17
15451,,419121,171,M Manhas,10/12/1979,Right-hand Bat,Right-arm Offbreak,India,Player,Delhi Daredevils,Chennai Super Kings,2010,,31,,Blank,Blank,Kd Karthik,Sk Raina,Kd Karthik,Pa Patel,1979-10-12
15452,,419121,187,Da Warner,10/27/1986,Left-hand Bat,Legbreak,Australia,Player,Delhi Daredevils,Chennai Super Kings,2010,,24,,Blank,Blank,Kd Karthik,Sk Raina,Kd Karthik,Pa Patel,1986-10-27
15454,,419121,232,Ut Yadav,10/25/1987,Right-hand Bat,Right-arm Fast-medium,India,Player,Delhi Daredevils,Chennai Super Kings,2010,,23,,Blank,Blank,Kd Karthik,Sk Raina,Kd Karthik,Pa Patel,1987-10-25
15457,,419121,21,Sk Raina,11/27/1986,Left-hand Bat,Right-arm Offbreak,India,Captain,Chennai Super Kings,Delhi Daredevils,2010,,24,,Blank,Blank,Sk Raina,Kd Karthik,Pa Patel,Kd Karthik,1986-11-27
15458,,419121,23,S Badrinath,8/30/1980,Right-hand Bat,Right-arm Offbreak,India,Player,Chennai Super Kings,Delhi Daredevils,2010,,30,,Blank,Blank,Sk Raina,Kd Karthik,Pa Patel,Kd Karthik,1980-08-30
15460,,419121,119,Joginder Sharma,10/23/1983,Right-hand Bat,Right-arm Fast-medium,India,Player,Chennai Super Kings,Delhi Daredevils,2010,,27,,Blank,Blank,Sk Raina,Kd Karthik,Pa Patel,Kd Karthik,1983-10-23
15462,,419121,151,L Balaji,9/27/1981,Right-hand Bat,Right-arm Medium-fast,India,Player,Chennai Super Kings,Delhi Daredevils,2010,,29,,Blank,Blank,Sk Raina,Kd Karthik,Pa Patel,Kd Karthik,1981-09-27
15463,,419121,185,M Vijay,4/1/1984,Right-hand Bat,Right-arm Offbreak,India,Player,Chennai Super Kings,Delhi Daredevils,2010,,26,,Blank,Blank,Sk Raina,Kd Karthik,Pa Patel,Kd Karthik,1984-04-01
15464,,419121,201,R Ashwin,9/17/1986,Right-hand Bat,Right-arm Offbreak,India,Player,Chennai Super Kings,Delhi Daredevils,2010,,24,,Blank,Blank,Sk Raina,Kd Karthik,Pa Patel,Kd Karthik,1986-09-17
15465,,419121,217,Jm Kemp,10/2/1977,Right-hand Bat,Right-arm Fast-medium,South Africa,Player,Chennai Super Kings,Delhi Daredevils,2010,,33,,Blank,Blank,Sk Raina,Kd Karthik,Pa Patel,Kd Karthik,1977-10-02
15466,,419122,53,Ac Gilchrist,11/14/1971,Left-hand Bat,Right-arm Offbreak,Australia,Captainkeeper,Deccan Chargers,Kings Xi Punjab,2010,,39,,Blank,Blank,Ac Gilchrist,Kc Sangakkara,Ac Gilchrist,Kc Sangakkara,1971-11-14
15468,,419122,56,A Symonds,6/9/1975,Right-hand Bat,Right-arm Offbreak,Australia,Player,Deccan Chargers,Kings Xi Punjab,2010,,35,,Blank,Blank,Ac Gilchrist,Kc Sangakkara,Ac Gilchrist,Kc Sangakkara,1975-06-09
15469,,419122,57,Rg Sharma,4/30/1987,Right-hand Bat,Right-arm Offbreak,India,Player,Deccan Chargers,Kings Xi Punjab,2010,,23,,Blank,Blank,Ac Gilchrist,Kc Sangakkara,Ac Gilchrist,Kc Sangakkara,1987-04-30
15470,,419122,60,Wpujc Vaas,1/27/1974,Left-hand Bat,Left-arm Fast-medium,Sri Lanka,Player,Deccan Chargers,Kings Xi Punjab,2010,,36,,Blank,Blank,Ac Gilchrist,Kc Sangakkara,Ac Gilchrist,Kc Sangakkara,1974-01-27
15471,,419122,61,Rp Singh,12/6/1985,Right-hand Bat,Left-arm Fast-medium,India,Player,Deccan Chargers,Kings Xi Punjab,2010,,25,,Blank,Blank,Ac Gilchrist,Kc Sangakkara,Ac Gilchrist,Kc Sangakkara,1985-12-06
15473,,419122,131,Pp Ojha,9/5/1986,Left-hand Bat,Slow Left-arm Orthodox,India,Player,Deccan Chargers,Kings Xi Punjab,2010,,24,,Blank,Blank,Ac Gilchrist,Kc Sangakkara,Ac Gilchrist,Kc Sangakkara,1986-09-05
15474,,419122,178,Tl Suman,12/15/1983,Right-hand Bat,Right-arm Offbreak,India,Player,Deccan Chargers,Kings Xi Punjab,2010,,27,,Blank,Blank,Ac Gilchrist,Kc Sangakkara,Ac Gilchrist,Kc Sangakkara,1983-12-15
15476,,419122,206,Jaskaran Singh,9/4/1989,Right-hand Bat,Right-arm Medium,India,Player,Deccan Chargers,Kings Xi Punjab,2010,,21,,Blank,Blank,Ac Gilchrist,Kc Sangakkara,Ac Gilchrist,Kc Sangakkara,1989-09-04
15478,,419122,27,Yuvraj Singh,12/12/1981,Left-hand Bat,Slow Left-arm Orthodox,India,Player,Kings Xi Punjab,Deccan Chargers,2010,,29,,Blank,Blank,Kc Sangakkara,Ac Gilchrist,Kc Sangakkara,Ac Gilchrist,1981-12-12
15479,,419122,29,Ik Pathan,10/27/1984,Left-hand Bat,Left-arm Medium-fast,India,Player,Kings Xi Punjab,Deccan Chargers,2010,,26,,Blank,Blank,Kc Sangakkara,Ac Gilchrist,Kc Sangakkara,Ac Gilchrist,1984-10-27
15482,,419122,77,S Sreesanth,2/6/1983,Right-hand Bat,Right-arm Fast-medium,India,Player,Kings Xi Punjab,Deccan Chargers,2010,,27,,Blank,Blank,Kc Sangakkara,Ac Gilchrist,Kc Sangakkara,Ac Gilchrist,1983-02-06
15485,,419122,227,Ab Barath,4/14/1990,Right-hand Bat,Right-arm Offbreak,India,Player,Kings Xi Punjab,Deccan Chargers,2010,,20,,Blank,Blank,Kc Sangakkara,Ac Gilchrist,Kc Sangakkara,Ac Gilchrist,1990-04-14
15491,,419123,126,Mm Patel,7/12/1983,Right-hand Bat,Right-arm Medium-fast,India,Player,Rajasthan Royals,Kolkata Knight Riders,2010,,27,,Blank,Blank,Sk Warne,Sc Ganguly,Nv Ojha,Wp Saha,1983-07-12
15495,,419123,224,Mj Lumb,2/12/1980,Left-hand Bat,Right-arm Medium,England,Player,Rajasthan Royals,Kolkata Knight Riders,2010,,30,,Blank,Blank,Sk Warne,Sc Ganguly,Nv Ojha,Wp Saha,1980-02-12
15497,,419123,230,Ac Voges,10/4/1979,Right-hand Bat,Slow Left-arm Orthodox,Australia,Player,Rajasthan Royals,Kolkata Knight Riders,2010,,31,,Blank,Blank,Sk Warne,Sc Ganguly,Nv Ojha,Wp Saha,1979-10-04
15501,,419123,83,M Kartik,9/11/1976,Left-hand Bat,Slow Left-arm Orthodox,India,Player,Kolkata Knight Riders,Rajasthan Royals,2010,,34,,Blank,Blank,Sc Ganguly,Sk Warne,Wp Saha,Nv Ojha,1976-09-11
15503,,419123,87,Mk Tiwary,11/14/1985,Right-hand Bat,Legbreak Googly,India,Player,Kolkata Knight Riders,Rajasthan Royals,2010,,25,,Blank,Blank,Sc Ganguly,Sk Warne,Wp Saha,Nv Ojha,1985-11-14
15504,,419123,104,Bj Hodge,12/29/1974,Right-hand Bat,Right-arm Offbreak,Australia,Player,Kolkata Knight Riders,Rajasthan Royals,2010,,36,,Blank,Blank,Sc Ganguly,Sk Warne,Wp Saha,Nv Ojha,1974-12-29
15505,,419123,106,Ab Dinda,3/25/1984,Right-hand Bat,Right-arm Medium-fast,India,Player,Kolkata Knight Riders,Rajasthan Royals,2010,,26,,Blank,Blank,Sc Ganguly,Sk Warne,Wp Saha,Nv Ojha,1984-03-25
15506,,419123,191,Ad Mathews,6/2/1987,Right-hand Bat,Right-arm Fast-medium,Sri Lanka,Player,Kolkata Knight Riders,Rajasthan Royals,2010,,23,,Blank,Blank,Sc Ganguly,Sk Warne,Wp Saha,Nv Ojha,1987-06-02
15508,,419123,204,Oa Shah,10/22/1978,Right-hand Bat,Right-arm Offbreak,England,Player,Kolkata Knight Riders,Rajasthan Royals,2010,,32,,Blank,Blank,Sc Ganguly,Sk Warne,Wp Saha,Nv Ojha,1978-10-22
15509,,419123,220,Se Bond,6/7/1975,Right-hand Bat,Right-arm Fast,New Zealand,Player,Kolkata Knight Riders,Rajasthan Royals,2010,,35,,Blank,Blank,Sc Ganguly,Sk Warne,Wp Saha,Nv Ojha,1975-06-07
15511,,419124,44,St Jayasuriya,6/30/1969,Left-hand Bat,Slow Left-arm Orthodox,Sri Lanka,Player,Mumbai Indians,Royal Challengers Bangalore,2010,,41,,Blank,Blank,Sr Tendulkar,A Kumble,Ap Tare,Mv Boucher,1969-06-30
15514,,419124,79,Ss Tiwary,12/30/1989,Left-hand Bat,N/a,India,Player,Mumbai Indians,Royal Challengers Bangalore,2010,,21,,Blank,Blank,Sr Tendulkar,A Kumble,Ap Tare,Mv Boucher,1989-12-30
15516,,419124,194,Sl Malinga,8/28/1983,Right-hand Bat,Right-arm Fast,Sri Lanka,Player,Mumbai Indians,Royal Challengers Bangalore,2010,,27,,Blank,Blank,Sr Tendulkar,A Kumble,Ap Tare,Mv Boucher,1983-08-28
15518,,419124,208,At Rayudu,9/23/1985,Right-hand Bat,Right-arm Offbreak,India,Player,Mumbai Indians,Royal Challengers Bangalore,2010,,25,,Blank,Blank,Sr Tendulkar,A Kumble,Ap Tare,Mv Boucher,1985-09-23
15519,,419124,209,R Sathish,1/14/1981,Right-hand Bat,Right-arm Medium,India,Player,Mumbai Indians,Royal Challengers Bangalore,2010,,29,,Blank,Blank,Sr Tendulkar,A Kumble,Ap Tare,Mv Boucher,1981-01-14
15530,,419124,124,A Kumble,10/17/1970,Right-hand Bat,Legbreak Googly,India,Captain,Royal Challengers Bangalore,Mumbai Indians,2010,,40,,Blank,Blank,A Kumble,Sr Tendulkar,Mv Boucher,Ap Tare,1970-10-17
15531,,419124,216,Ejg Morgan,9/10/1986,Left-hand Bat,Right-arm Medium,England,Player,Royal Challengers Bangalore,Mumbai Indians,2010,,24,,Blank,Blank,A Kumble,Sr Tendulkar,Mv Boucher,Ap Tare,1986-09-10
15532,,419125,53,Ac Gilchrist,11/14/1971,Left-hand Bat,Right-arm Offbreak,Australia,Captainkeeper,Deccan Chargers,Delhi Daredevils,2010,,39,,Blank,Blank,Ac Gilchrist,Kd Karthik,Ac Gilchrist,Kd Karthik,1971-11-14
15535,,419125,57,Rg Sharma,4/30/1987,Right-hand Bat,Right-arm Offbreak,India,Player,Deccan Chargers,Delhi Daredevils,2010,,23,,Blank,Blank,Ac Gilchrist,Kd Karthik,Ac Gilchrist,Kd Karthik,1987-04-30
15537,,419125,61,Rp Singh,12/6/1985,Right-hand Bat,Left-arm Fast-medium,India,Player,Deccan Chargers,Delhi Daredevils,2010,,25,,Blank,Blank,Ac Gilchrist,Kd Karthik,Ac Gilchrist,Kd Karthik,1985-12-06
15538,,419125,97,Hh Gibbs,2/23/1974,Right-hand Bat,Right-arm Bowler,South Africa,Player,Deccan Chargers,Delhi Daredevils,2010,,36,,Blank,Blank,Ac Gilchrist,Kd Karthik,Ac Gilchrist,Kd Karthik,1974-02-23
15540,,419125,178,Tl Suman,12/15/1983,Right-hand Bat,Right-arm Offbreak,India,Player,Deccan Chargers,Delhi Daredevils,2010,,27,,Blank,Blank,Ac Gilchrist,Kd Karthik,Ac Gilchrist,Kd Karthik,1983-12-15
15543,,419125,41,V Sehwag,10/20/1978,Right-hand Bat,Right-arm Offbreak,India,Player,Delhi Daredevils,Deccan Chargers,2010,,32,,Blank,Blank,Kd Karthik,Ac Gilchrist,Kd Karthik,Ac Gilchrist,1978-10-20
15544,,419125,88,Kd Karthik,6/1/1985,Right-hand Bat,N/a,India,Captainkeeper,Delhi Daredevils,Deccan Chargers,2010,,25,,Blank,Blank,Kd Karthik,Ac Gilchrist,Kd Karthik,Ac Gilchrist,1985-06-01
15546,,419125,136,A Mishra,11/24/1982,Right-hand Bat,Legbreak,India,Player,Delhi Daredevils,Deccan Chargers,2010,,28,,Blank,Blank,Kd Karthik,Ac Gilchrist,Kd Karthik,Ac Gilchrist,1982-11-24
15547,,419125,163,Mc Henriques,2/1/1987,Right-hand Bat,Right-arm Fast-medium,Australia,Player,Delhi Daredevils,Deccan Chargers,2010,,23,,Blank,Blank,Kd Karthik,Ac Gilchrist,Kd Karthik,Ac Gilchrist,1987-02-01
15548,,419125,171,M Manhas,10/12/1979,Right-hand Bat,Right-arm Offbreak,India,Player,Delhi Daredevils,Deccan Chargers,2010,,31,,Blank,Blank,Kd Karthik,Ac Gilchrist,Kd Karthik,Ac Gilchrist,1979-10-12
15549,,419125,187,Da Warner,10/27/1986,Left-hand Bat,Legbreak,Australia,Player,Delhi Daredevils,Deccan Chargers,2010,,24,,Blank,Blank,Kd Karthik,Ac Gilchrist,Kd Karthik,Ac Gilchrist,1986-10-27
15557,,419126,33,M Kaif,12/1/1980,Right-hand Bat,Right-arm Offbreak,India,Player,Kings Xi Punjab,Chennai Super Kings,2010,,30,,Blank,Blank,Kc Sangakkara,Sk Raina,Kc Sangakkara,Pa Patel,1980-12-01
15558,,419126,64,Dpmd Jayawardene,5/27/1977,Right-hand Bat,Right-arm Medium,Sri Lanka,Player,Kings Xi Punjab,Chennai Super Kings,2010,,33,,Blank,Blank,Kc Sangakkara,Sk Raina,Kc Sangakkara,Pa Patel,1977-05-27
15559,,419126,67,Pp Chawla,12/24/1988,Left-hand Bat,Legbreak,India,Player,Kings Xi Punjab,Chennai Super Kings,2010,,22,,Blank,Blank,Kc Sangakkara,Sk Raina,Kc Sangakkara,Pa Patel,1988-12-24
15560,,419126,153,Rr Powar,5/20/1978,Right-hand Bat,Right-arm Offbreak,India,Player,Kings Xi Punjab,Chennai Super Kings,2010,,32,,Blank,Blank,Kc Sangakkara,Sk Raina,Kc Sangakkara,Pa Patel,1978-05-20
15562,,419126,214,Ms Bisla,12/27/1984,Right-hand Bat,N/a,India,Player,Kings Xi Punjab,Chennai Super Kings,2010,,26,,Blank,Blank,Kc Sangakkara,Sk Raina,Kc Sangakkara,Pa Patel,1984-12-27
15563,,419126,233,J Theron,7/24/1985,Right-hand Bat,Right-arm Medium-fast,South Africa,Player,Kings Xi Punjab,Chennai Super Kings,2010,,25,,Blank,Blank,Kc Sangakkara,Sk Raina,Kc Sangakkara,Pa Patel,1985-07-24
15566,,419126,18,Ml Hayden,10/29/1971,Left-hand Bat,Right-arm Medium,Australia,Player,Chennai Super Kings,Kings Xi Punjab,2010,,39,,Blank,Blank,Sk Raina,Kc Sangakkara,Pa Patel,Kc Sangakkara,1971-10-29
15567,,419126,21,Sk Raina,11/27/1986,Left-hand Bat,Right-arm Offbreak,India,Captain,Chennai Super Kings,Kings Xi Punjab,2010,,24,,Blank,Blank,Sk Raina,Kc Sangakkara,Pa Patel,Kc Sangakkara,1986-11-27
15570,,419126,120,Ms Gony,1/4/1984,Right-hand Bat,Right-arm Medium,India,Player,Chennai Super Kings,Kings Xi Punjab,2010,,26,,Blank,Blank,Sk Raina,Kc Sangakkara,Pa Patel,Kc Sangakkara,1984-01-04
15575,,419126,217,Jm Kemp,10/2/1977,Right-hand Bat,Right-arm Fast-medium,South Africa,Player,Chennai Super Kings,Kings Xi Punjab,2010,,33,,Blank,Blank,Sk Raina,Kc Sangakkara,Pa Patel,Kc Sangakkara,1977-10-02
15580,,419127,79,Ss Tiwary,12/30/1989,Left-hand Bat,N/a,India,Player,Mumbai Indians,Kolkata Knight Riders,2010,,21,,Blank,Blank,Sr Tendulkar,Sc Ganguly,Ap Tare,Wp Saha,1989-12-30
15582,,419127,194,Sl Malinga,8/28/1983,Right-hand Bat,Right-arm Fast,Sri Lanka,Player,Mumbai Indians,Kolkata Knight Riders,2010,,27,,Blank,Blank,Sr Tendulkar,Sc Ganguly,Ap Tare,Wp Saha,1983-08-28
15583,,419127,207,Ap Tare,11/7/1987,Right-hand Bat,N/a,India,Keeper,Mumbai Indians,Kolkata Knight Riders,2010,,23,,Blank,Blank,Sr Tendulkar,Sc Ganguly,Ap Tare,Wp Saha,1987-11-07
15584,,419127,209,R Sathish,1/14/1981,Right-hand Bat,Right-arm Medium,India,Player,Mumbai Indians,Kolkata Knight Riders,2010,,29,,Blank,Blank,Sr Tendulkar,Sc Ganguly,Ap Tare,Wp Saha,1981-01-14
15585,,419127,210,R Mclaren,2/9/1983,Left-hand Bat,Right-arm Medium-fast,South Africa,Player,Mumbai Indians,Kolkata Knight Riders,2010,,27,,Blank,Blank,Sr Tendulkar,Sc Ganguly,Ap Tare,Wp Saha,1983-02-09
15587,,419127,1,Sc Ganguly,7/8/1972,Left-hand Bat,Right-arm Medium,India,Captain,Kolkata Knight Riders,Mumbai Indians,2010,,38,,Blank,Blank,Sc Ganguly,Sr Tendulkar,Wp Saha,Ap Tare,1972-07-08
15588,,419127,62,Wp Saha,10/24/1984,Right-hand Bat,N/a,India,Keeper,Kolkata Knight Riders,Mumbai Indians,2010,,26,,Blank,Blank,Sc Ganguly,Sr Tendulkar,Wp Saha,Ap Tare,1984-10-24
15590,,419127,84,I Sharma,9/2/1988,Right-hand Bat,Right-arm Fast-medium,India,Player,Kolkata Knight Riders,Mumbai Indians,2010,,22,,Blank,Blank,Sc Ganguly,Sr Tendulkar,Wp Saha,Ap Tare,1988-09-02
15593,,419127,203,Ca Pujara,1/25/1988,Right-hand Bat,Legbreak,India,Player,Kolkata Knight Riders,Mumbai Indians,2010,,22,,Blank,Blank,Sc Ganguly,Sr Tendulkar,Wp Saha,Ap Tare,1988-01-25
15594,,419127,204,Oa Shah,10/22/1978,Right-hand Bat,Right-arm Offbreak,England,Player,Kolkata Knight Riders,Mumbai Indians,2010,,32,,Blank,Blank,Sc Ganguly,Sr Tendulkar,Wp Saha,Ap Tare,1978-10-22
15599,,419128,8,V Kohli,11/5/1988,Right-hand Bat,Right-arm Medium,India,Player,Royal Challengers Bangalore,Chennai Super Kings,2010,,22,,Blank,Blank,A Kumble,Sk Raina,Mv Boucher,Pa Patel,1988-11-05
15602,,419128,14,P Kumar,10/2/1986,Right-hand Bat,Right-arm Medium,India,Player,Royal Challengers Bangalore,Chennai Super Kings,2010,,24,,Blank,Blank,A Kumble,Sk Raina,Mv Boucher,Pa Patel,1986-10-02
15604,,419128,81,R Vinay Kumar,2/12/1984,Right-hand Bat,Right-arm Medium,India,Player,Royal Challengers Bangalore,Chennai Super Kings,2010,,26,,Blank,Blank,A Kumble,Sk Raina,Mv Boucher,Pa Patel,1984-02-12
15607,,419128,124,A Kumble,10/17/1970,Right-hand Bat,Legbreak Googly,India,Captain,Royal Challengers Bangalore,Chennai Super Kings,2010,,40,,Blank,Blank,A Kumble,Sk Raina,Mv Boucher,Pa Patel,1970-10-17
15613,,419128,109,Ja Morkel,6/10/1981,Left-hand Bat,Right-arm Medium-fast,South Africa,Player,Chennai Super Kings,Royal Challengers Bangalore,2010,,29,,Blank,Blank,Sk Raina,A Kumble,Pa Patel,Mv Boucher,1981-06-10
15614,,419128,121,M Muralitharan,4/17/1972,Right-hand Bat,Right-arm Offbreak,Sri Lanka,Player,Chennai Super Kings,Royal Challengers Bangalore,2010,,38,,Blank,Blank,Sk Raina,A Kumble,Pa Patel,Mv Boucher,1972-04-17
15617,,419128,197,Gj Bailey,9/7/1982,Right-hand Bat,Right-arm Medium,Australia,Player,Chennai Super Kings,Royal Challengers Bangalore,2010,,28,,Blank,Blank,Sk Raina,A Kumble,Pa Patel,Mv Boucher,1982-09-07
15618,,419128,201,R Ashwin,9/17/1986,Right-hand Bat,Right-arm Offbreak,India,Player,Chennai Super Kings,Royal Challengers Bangalore,2010,,24,,Blank,Blank,Sk Raina,A Kumble,Pa Patel,Mv Boucher,1986-09-17
15619,,419128,218,S Tyagi,9/17/1987,Right-hand Bat,Right-arm Medium,India,Player,Chennai Super Kings,Royal Challengers Bangalore,2010,,23,,Blank,Blank,Sk Raina,A Kumble,Pa Patel,Mv Boucher,1987-09-17
15621,,419129,27,Yuvraj Singh,12/12/1981,Left-hand Bat,Slow Left-arm Orthodox,India,Player,Kings Xi Punjab,Rajasthan Royals,2010,,29,,Blank,Blank,Kc Sangakkara,Sk Warne,Kc Sangakkara,Nv Ojha,1981-12-12
15626,,419129,77,S Sreesanth,2/6/1983,Right-hand Bat,Right-arm Fast-medium,India,Player,Kings Xi Punjab,Rajasthan Royals,2010,,27,,Blank,Blank,Kc Sangakkara,Sk Warne,Kc Sangakkara,Nv Ojha,1983-02-06
15628,,419129,214,Ms Bisla,12/27/1984,Right-hand Bat,N/a,India,Player,Kings Xi Punjab,Rajasthan Royals,2010,,26,,Blank,Blank,Kc Sangakkara,Sk Warne,Kc Sangakkara,Nv Ojha,1984-12-27
15631,,419129,31,Yk Pathan,11/17/1982,Right-hand Bat,Right-arm Offbreak,India,Player,Rajasthan Royals,Kings Xi Punjab,2010,,28,,Blank,Blank,Sk Warne,Kc Sangakkara,Nv Ojha,Kc Sangakkara,1982-11-17
15632,,419129,38,Sk Warne,9/13/1969,Right-hand Bat,Legbreak Googly,Australia,Captain,Rajasthan Royals,Kings Xi Punjab,2010,,41,,Blank,Blank,Sk Warne,Kc Sangakkara,Nv Ojha,Kc Sangakkara,1969-09-13
15633,,419129,39,Sk Trivedi,9/4/1982,Right-hand Bat,Right-arm Medium,India,Player,Rajasthan Royals,Kings Xi Punjab,2010,,28,,Blank,Blank,Sk Warne,Kc Sangakkara,Nv Ojha,Kc Sangakkara,1982-09-04
15634,,419129,126,Mm Patel,7/12/1983,Right-hand Bat,Right-arm Medium-fast,India,Player,Rajasthan Royals,Kings Xi Punjab,2010,,27,,Blank,Blank,Sk Warne,Kc Sangakkara,Nv Ojha,Kc Sangakkara,1983-07-12
15635,,419129,183,Nv Ojha,7/20/1983,Right-hand Bat,N/a,India,Keeper,Rajasthan Royals,Kings Xi Punjab,2010,,27,,Blank,Blank,Sk Warne,Kc Sangakkara,Nv Ojha,Kc Sangakkara,1983-07-20
15636,,419129,211,Aa Jhunjhunwala,12/1/1982,Right-hand Bat,Right-arm Offbreak,India,Player,Rajasthan Royals,Kings Xi Punjab,2010,,28,,Blank,Blank,Sk Warne,Kc Sangakkara,Nv Ojha,Kc Sangakkara,1982-12-01
15637,,419129,212,P Dogra,11/19/1984,Right-hand Bat,Legbreak,India,Player,Rajasthan Royals,Kings Xi Punjab,2010,,26,,Blank,Blank,Sk Warne,Kc Sangakkara,Nv Ojha,Kc Sangakkara,1984-11-19
15638,,419129,224,Mj Lumb,2/12/1980,Left-hand Bat,Right-arm Medium,England,Player,Rajasthan Royals,Kings Xi Punjab,2010,,30,,Blank,Blank,Sk Warne,Kc Sangakkara,Nv Ojha,Kc Sangakkara,1980-02-12
15639,,419129,229,Fy Fazal,9/7/1985,Left-hand Bat,Right-arm Medium,India,Player,Rajasthan Royals,Kings Xi Punjab,2010,,25,,Blank,Blank,Sk Warne,Kc Sangakkara,Nv Ojha,Kc Sangakkara,1985-09-07
15646,,419130,79,Ss Tiwary,12/30/1989,Left-hand Bat,N/a,India,Player,Mumbai Indians,Chennai Super Kings,2010,,21,,Blank,Blank,Sr Tendulkar,Ms Dhoni,Ap Tare,Ms Dhoni,1989-12-30
15647,,419130,133,Sr Tendulkar,4/24/1973,Right-hand Bat,Right-arm Offbreak,India,Captain,Mumbai Indians,Chennai Super Kings,2010,,37,,Blank,Blank,Sr Tendulkar,Ms Dhoni,Ap Tare,Ms Dhoni,1973-04-24
15648,,419130,194,Sl Malinga,8/28/1983,Right-hand Bat,Right-arm Fast,Sri Lanka,Player,Mumbai Indians,Chennai Super Kings,2010,,27,,Blank,Blank,Sr Tendulkar,Ms Dhoni,Ap Tare,Ms Dhoni,1983-08-28
15649,,419130,207,Ap Tare,11/7/1987,Right-hand Bat,N/a,India,Keeper,Mumbai Indians,Chennai Super Kings,2010,,23,,Blank,Blank,Sr Tendulkar,Ms Dhoni,Ap Tare,Ms Dhoni,1987-11-07
15652,,419130,221,Ka Pollard,5/12/1987,Right-hand Bat,Right-arm Medium-fast,West Indies,Player,Mumbai Indians,Chennai Super Kings,2010,,23,,Blank,Blank,Sr Tendulkar,Ms Dhoni,Ap Tare,Ms Dhoni,1987-05-12
15655,,419130,20,Ms Dhoni,7/7/1981,Right-hand Bat,Right-arm Medium,India,Captainkeeper,Chennai Super Kings,Mumbai Indians,2010,,29,,Blank,Blank,Ms Dhoni,Sr Tendulkar,Ms Dhoni,Ap Tare,1981-07-07
15658,,419130,109,Ja Morkel,6/10/1981,Left-hand Bat,Right-arm Medium-fast,South Africa,Player,Chennai Super Kings,Mumbai Indians,2010,,29,,Blank,Blank,Ms Dhoni,Sr Tendulkar,Ms Dhoni,Ap Tare,1981-06-10
15662,,419130,186,Sb Jakati,11/27/1980,Left-hand Bat,Slow Left-arm Orthodox,India,Player,Chennai Super Kings,Mumbai Indians,2010,,30,,Blank,Blank,Ms Dhoni,Sr Tendulkar,Ms Dhoni,Ap Tare,1980-11-27
15666,,419131,55,Vvs Laxman,11/1/1974,Right-hand Bat,Right-arm Offbreak,India,Player,Deccan Chargers,Rajasthan Royals,2010,,36,,Blank,Blank,Ac Gilchrist,Sk Warne,Ac Gilchrist,Nv Ojha,1974-11-01
15667,,419131,56,A Symonds,6/9/1975,Right-hand Bat,Right-arm Offbreak,Australia,Player,Deccan Chargers,Rajasthan Royals,2010,,35,,Blank,Blank,Ac Gilchrist,Sk Warne,Ac Gilchrist,Nv Ojha,1975-06-09
15668,,419131,57,Rg Sharma,4/30/1987,Right-hand Bat,Right-arm Offbreak,India,Player,Deccan Chargers,Rajasthan Royals,2010,,23,,Blank,Blank,Ac Gilchrist,Sk Warne,Ac Gilchrist,Nv Ojha,1987-04-30
15670,,419131,61,Rp Singh,12/6/1985,Right-hand Bat,Left-arm Fast-medium,India,Player,Deccan Chargers,Rajasthan Royals,2010,,25,,Blank,Blank,Ac Gilchrist,Sk Warne,Ac Gilchrist,Nv Ojha,1985-12-06
15684,,419131,230,Ac Voges,10/4/1979,Right-hand Bat,Slow Left-arm Orthodox,Australia,Player,Rajasthan Royals,Deccan Chargers,2010,,31,,Blank,Blank,Sk Warne,Ac Gilchrist,Nv Ojha,Ac Gilchrist,1979-10-04
15688,,419132,27,Yuvraj Singh,12/12/1981,Left-hand Bat,Slow Left-arm Orthodox,India,Player,Kings Xi Punjab,Kolkata Knight Riders,2010,,29,,Blank,Blank,Kc Sangakkara,Sc Ganguly,Kc Sangakkara,Wp Saha,1981-12-12
15689,,419132,29,Ik Pathan,10/27/1984,Left-hand Bat,Left-arm Medium-fast,India,Player,Kings Xi Punjab,Kolkata Knight Riders,2010,,26,,Blank,Blank,Kc Sangakkara,Sc Ganguly,Kc Sangakkara,Wp Saha,1984-10-27
15695,,419132,234,Sj Srivastava,9/22/1981,Right-hand Bat,Left-arm Fast-medium,India,Player,Kings Xi Punjab,Kolkata Knight Riders,2010,,29,,Blank,Blank,Kc Sangakkara,Sc Ganguly,Kc Sangakkara,Wp Saha,1981-09-22
15696,,419132,243,Vs Malik,5/9/1983,Right-hand Bat,Right-arm Medium,India,Player,Kings Xi Punjab,Kolkata Knight Riders,2010,,27,,Blank,Blank,Kc Sangakkara,Sc Ganguly,Kc Sangakkara,Wp Saha,1983-05-09
15700,,419132,82,Ab Agarkar,12/4/1977,Right-hand Bat,Right-arm Fast,India,Player,Kolkata Knight Riders,Kings Xi Punjab,2010,,33,,Blank,Blank,Sc Ganguly,Kc Sangakkara,Wp Saha,Kc Sangakkara,1977-12-04
15701,,419132,87,Mk Tiwary,11/14/1985,Right-hand Bat,Legbreak Googly,India,Player,Kolkata Knight Riders,Kings Xi Punjab,2010,,25,,Blank,Blank,Sc Ganguly,Kc Sangakkara,Wp Saha,Kc Sangakkara,1985-11-14
15702,,419132,106,Ab Dinda,3/25/1984,Right-hand Bat,Right-arm Medium-fast,India,Player,Kolkata Knight Riders,Kings Xi Punjab,2010,,26,,Blank,Blank,Sc Ganguly,Kc Sangakkara,Wp Saha,Kc Sangakkara,1984-03-25
15704,,419132,162,Ch Gayle,9/21/1979,Left-hand Bat,Right-arm Offbreak,West Indies,Player,Kolkata Knight Riders,Kings Xi Punjab,2010,,31,,Blank,Blank,Sc Ganguly,Kc Sangakkara,Wp Saha,Kc Sangakkara,1979-09-21
15716,,419133,223,Dp Nannes,5/16/1976,Right-hand Bat,Left-arm Fast,Australia,Player,Delhi Daredevils,Royal Challengers Bangalore,2010,,34,,Blank,Blank,Kd Karthik,A Kumble,Kd Karthik,Mv Boucher,1976-05-16
15719,,419133,6,R Dravid,1/11/1973,Right-hand Bat,Right-arm Offbreak,India,Player,Royal Challengers Bangalore,Delhi Daredevils,2010,,37,,Blank,Blank,A Kumble,Kd Karthik,Mv Boucher,Kd Karthik,1973-01-11
15724,,419133,46,Rv Uthappa,11/11/1985,Right-hand Bat,Right-arm Medium,India,Player,Royal Challengers Bangalore,Delhi Daredevils,2010,,25,,Blank,Blank,A Kumble,Kd Karthik,Mv Boucher,Kd Karthik,1985-11-11
15725,,419133,81,R Vinay Kumar,2/12/1984,Right-hand Bat,Right-arm Medium,India,Player,Royal Challengers Bangalore,Delhi Daredevils,2010,,26,,Blank,Blank,A Kumble,Kd Karthik,Mv Boucher,Kd Karthik,1984-02-12
15727,,419133,96,Mk Pandey,9/10/1989,Right-hand Bat,Right-arm Medium,India,Player,Royal Challengers Bangalore,Delhi Daredevils,2010,,21,,Blank,Blank,A Kumble,Kd Karthik,Mv Boucher,Kd Karthik,1989-09-10
15733,,419134,23,S Badrinath,8/30/1980,Right-hand Bat,Right-arm Offbreak,India,Player,Chennai Super Kings,Rajasthan Royals,2010,,30,,Blank,Blank,Ms Dhoni,Sk Warne,Ms Dhoni,Nv Ojha,1980-08-30
15735,,419134,119,Joginder Sharma,10/23/1983,Right-hand Bat,Right-arm Fast-medium,India,Player,Chennai Super Kings,Rajasthan Royals,2010,,27,,Blank,Blank,Ms Dhoni,Sk Warne,Ms Dhoni,Nv Ojha,1983-10-23
15738,,419134,185,M Vijay,4/1/1984,Right-hand Bat,Right-arm Offbreak,India,Player,Chennai Super Kings,Rajasthan Royals,2010,,26,,Blank,Blank,Ms Dhoni,Sk Warne,Ms Dhoni,Nv Ojha,1984-04-01
15740,,419134,239,Kb Arun Karthik,2/15/1986,Right-hand Bat,Legbreak Googly,India,Player,Chennai Super Kings,Rajasthan Royals,2010,,24,,Blank,Blank,Ms Dhoni,Sk Warne,Ms Dhoni,Nv Ojha,1986-02-15
15742,,419134,38,Sk Warne,9/13/1969,Right-hand Bat,Legbreak Googly,Australia,Captain,Rajasthan Royals,Chennai Super Kings,2010,,41,,Blank,Blank,Sk Warne,Ms Dhoni,Nv Ojha,Ms Dhoni,1969-09-13
15746,,419134,212,P Dogra,11/19/1984,Right-hand Bat,Legbreak,India,Player,Rajasthan Royals,Chennai Super Kings,2010,,26,,Blank,Blank,Sk Warne,Ms Dhoni,Nv Ojha,Ms Dhoni,1984-11-19
15747,,419134,224,Mj Lumb,2/12/1980,Left-hand Bat,Right-arm Medium,England,Player,Rajasthan Royals,Chennai Super Kings,2010,,30,,Blank,Blank,Sk Warne,Ms Dhoni,Nv Ojha,Ms Dhoni,1980-02-12
15750,,419134,230,Ac Voges,10/4/1979,Right-hand Bat,Slow Left-arm Orthodox,Australia,Player,Rajasthan Royals,Chennai Super Kings,2010,,31,,Blank,Blank,Sk Warne,Ms Dhoni,Nv Ojha,Ms Dhoni,1979-10-04
15752,,419135,53,Ac Gilchrist,11/14/1971,Left-hand Bat,Right-arm Offbreak,Australia,Captainkeeper,Deccan Chargers,Mumbai Indians,2010,,39,,Blank,Blank,Ac Gilchrist,Sr Tendulkar,Ac Gilchrist,At Rayudu,1971-11-14
15753,,419135,54,Y Venugopal Rao,2/26/1982,Right-hand Bat,Right-arm Offbreak,India,Player,Deccan Chargers,Mumbai Indians,2010,,28,,Blank,Blank,Ac Gilchrist,Sr Tendulkar,Ac Gilchrist,At Rayudu,1982-02-26
15755,,419135,57,Rg Sharma,4/30/1987,Right-hand Bat,Right-arm Offbreak,India,Player,Deccan Chargers,Mumbai Indians,2010,,23,,Blank,Blank,Ac Gilchrist,Sr Tendulkar,Ac Gilchrist,At Rayudu,1987-04-30
15760,,419135,206,Jaskaran Singh,9/4/1989,Right-hand Bat,Right-arm Medium,India,Player,Deccan Chargers,Mumbai Indians,2010,,21,,Blank,Blank,Ac Gilchrist,Sr Tendulkar,Ac Gilchrist,At Rayudu,1989-09-04
15764,,419135,42,S Dhawan,12/5/1985,Left-hand Bat,Right-arm Offbreak,India,Player,Mumbai Indians,Deccan Chargers,2010,,25,,Blank,Blank,Sr Tendulkar,Ac Gilchrist,At Rayudu,Ac Gilchrist,1985-12-05
15766,,419135,71,Dj Bravo,10/7/1983,Right-hand Bat,Right-arm Medium-fast,West Indies,Player,Mumbai Indians,Deccan Chargers,2010,,27,,Blank,Blank,Sr Tendulkar,Ac Gilchrist,At Rayudu,Ac Gilchrist,1983-10-07
15769,,419135,194,Sl Malinga,8/28/1983,Right-hand Bat,Right-arm Fast,Sri Lanka,Player,Mumbai Indians,Deccan Chargers,2010,,27,,Blank,Blank,Sr Tendulkar,Ac Gilchrist,At Rayudu,Ac Gilchrist,1983-08-28
15778,,419136,136,A Mishra,11/24/1982,Right-hand Bat,Legbreak,India,Player,Delhi Daredevils,Kolkata Knight Riders,2010,,28,,Blank,Blank,G Gambhir,Sc Ganguly,Kd Karthik,Wp Saha,1982-11-24
15781,,419136,223,Dp Nannes,5/16/1976,Right-hand Bat,Left-arm Fast,Australia,Player,Delhi Daredevils,Kolkata Knight Riders,2010,,34,,Blank,Blank,G Gambhir,Sc Ganguly,Kd Karthik,Wp Saha,1976-05-16
15783,,419136,237,Km Jadhav,3/26/1985,Right-hand Bat,Right-arm Offbreak,India,Player,Delhi Daredevils,Kolkata Knight Riders,2010,,25,,Blank,Blank,G Gambhir,Sc Ganguly,Kd Karthik,Wp Saha,1985-03-26
15784,,419136,241,Pd Collingwood,5/26/1976,Right-hand Bat,Right-arm Medium,England,Player,Delhi Daredevils,Kolkata Knight Riders,2010,,34,,Blank,Blank,G Gambhir,Sc Ganguly,Kd Karthik,Wp Saha,1976-05-26
15785,,419136,1,Sc Ganguly,7/8/1972,Left-hand Bat,Right-arm Medium,India,Captain,Kolkata Knight Riders,Delhi Daredevils,2010,,38,,Blank,Blank,Sc Ganguly,G Gambhir,Wp Saha,Kd Karthik,1972-07-08
15786,,419136,4,Dj Hussey,7/15/1977,Right-hand Bat,Right-arm Offbreak,Australia,Player,Kolkata Knight Riders,Delhi Daredevils,2010,,33,,Blank,Blank,Sc Ganguly,G Gambhir,Wp Saha,Kd Karthik,1977-07-15
15790,,419136,84,I Sharma,9/2/1988,Right-hand Bat,Right-arm Fast-medium,India,Player,Kolkata Knight Riders,Delhi Daredevils,2010,,22,,Blank,Blank,Sc Ganguly,G Gambhir,Wp Saha,Kd Karthik,1988-09-02
15792,,419136,162,Ch Gayle,9/21/1979,Left-hand Bat,Right-arm Offbreak,West Indies,Player,Kolkata Knight Riders,Delhi Daredevils,2010,,31,,Blank,Blank,Sc Ganguly,G Gambhir,Wp Saha,Kd Karthik,1979-09-21
15795,,419136,242,Ck Langeveldt,12/17/1974,Right-hand Bat,Right-arm Fast-medium,England,Player,Kolkata Knight Riders,Delhi Daredevils,2010,,36,,Blank,Blank,Sc Ganguly,G Gambhir,Wp Saha,Kd Karthik,1974-12-17
15797,,419137,42,S Dhawan,12/5/1985,Left-hand Bat,Right-arm Offbreak,India,Player,Mumbai Indians,Kings Xi Punjab,2010,,25,,Blank,Blank,Sr Tendulkar,Dpmd Jayawardene,At Rayudu,Ms Bisla,1985-12-05
15801,,419137,133,Sr Tendulkar,4/24/1973,Right-hand Bat,Right-arm Offbreak,India,Captain,Mumbai Indians,Kings Xi Punjab,2010,,37,,Blank,Blank,Sr Tendulkar,Dpmd Jayawardene,At Rayudu,Ms Bisla,1973-04-24
15806,,419137,221,Ka Pollard,5/12/1987,Right-hand Bat,Right-arm Medium-fast,West Indies,Player,Mumbai Indians,Kings Xi Punjab,2010,,23,,Blank,Blank,Sr Tendulkar,Dpmd Jayawardene,At Rayudu,Ms Bisla,1987-05-12
15809,,419137,29,Ik Pathan,10/27/1984,Left-hand Bat,Left-arm Medium-fast,India,Player,Kings Xi Punjab,Mumbai Indians,2010,,26,,Blank,Blank,Dpmd Jayawardene,Sr Tendulkar,Ms Bisla,At Rayudu,1984-10-27
15811,,419137,66,B Lee,11/8/1976,Right-hand Bat,Right-arm Fast,Australia,Player,Kings Xi Punjab,Mumbai Indians,2010,,34,,Blank,Blank,Dpmd Jayawardene,Sr Tendulkar,Ms Bisla,At Rayudu,1976-11-08
15812,,419137,67,Pp Chawla,12/24/1988,Left-hand Bat,Legbreak,India,Player,Kings Xi Punjab,Mumbai Indians,2010,,22,,Blank,Blank,Dpmd Jayawardene,Sr Tendulkar,Ms Bisla,At Rayudu,1988-12-24
15814,,419137,161,Rs Bopara,5/4/1985,Right-hand Bat,Right-arm Medium,England,Player,Kings Xi Punjab,Mumbai Indians,2010,,25,,Blank,Blank,Dpmd Jayawardene,Sr Tendulkar,Ms Bisla,At Rayudu,1985-05-04
15815,,419137,214,Ms Bisla,12/27/1984,Right-hand Bat,N/a,India,Keeper,Kings Xi Punjab,Mumbai Indians,2010,,26,,Blank,Blank,Dpmd Jayawardene,Sr Tendulkar,Ms Bisla,At Rayudu,1984-12-27
15818,,419138,18,Ml Hayden,10/29/1971,Left-hand Bat,Right-arm Medium,Australia,Player,Chennai Super Kings,Royal Challengers Bangalore,2010,,39,,Blank,Blank,Ms Dhoni,A Kumble,Ms Dhoni,Rv Uthappa,1971-10-29
15823,,419138,120,Ms Gony,1/4/1984,Right-hand Bat,Right-arm Medium,India,Player,Chennai Super Kings,Royal Challengers Bangalore,2010,,26,,Blank,Blank,Ms Dhoni,A Kumble,Ms Dhoni,Rv Uthappa,1984-01-04
15825,,419138,156,T Thushara,3/1/1981,Left-hand Bat,Left-arm Fast-medium,Sri Lanka,Player,Chennai Super Kings,Royal Challengers Bangalore,2010,,29,,Blank,Blank,Ms Dhoni,A Kumble,Ms Dhoni,Rv Uthappa,1981-03-01
15827,,419138,186,Sb Jakati,11/27/1980,Left-hand Bat,Slow Left-arm Orthodox,India,Player,Chennai Super Kings,Royal Challengers Bangalore,2010,,30,,Blank,Blank,Ms Dhoni,A Kumble,Ms Dhoni,Rv Uthappa,1980-11-27
15829,,419138,6,R Dravid,1/11/1973,Right-hand Bat,Right-arm Offbreak,India,Player,Royal Challengers Bangalore,Chennai Super Kings,2010,,37,,Blank,Blank,A Kumble,Ms Dhoni,Rv Uthappa,Ms Dhoni,1973-01-11
15832,,419138,10,Cl White,8/18/1983,Right-hand Bat,Legbreak Googly,Australia,Player,Royal Challengers Bangalore,Chennai Super Kings,2010,,27,,Blank,Blank,A Kumble,Ms Dhoni,Rv Uthappa,Ms Dhoni,1983-08-18
15833,,419138,14,P Kumar,10/2/1986,Right-hand Bat,Right-arm Medium,India,Player,Royal Challengers Bangalore,Chennai Super Kings,2010,,24,,Blank,Blank,A Kumble,Ms Dhoni,Rv Uthappa,Ms Dhoni,1986-10-02
15834,,419138,46,Rv Uthappa,11/11/1985,Right-hand Bat,Right-arm Medium,India,Keeper,Royal Challengers Bangalore,Chennai Super Kings,2010,,25,,Blank,Blank,A Kumble,Ms Dhoni,Rv Uthappa,Ms Dhoni,1985-11-11
15835,,419138,81,R Vinay Kumar,2/12/1984,Right-hand Bat,Right-arm Medium,India,Player,Royal Challengers Bangalore,Chennai Super Kings,2010,,26,,Blank,Blank,A Kumble,Ms Dhoni,Rv Uthappa,Ms Dhoni,1984-02-12
15840,,419139,40,G Gambhir,10/14/1981,Left-hand Bat,Legbreak,India,Captain,Delhi Daredevils,Rajasthan Royals,2010,,29,,Blank,Blank,G Gambhir,Sk Warne,Kd Karthik,Nv Ojha,1981-10-14
15841,,419139,41,V Sehwag,10/20/1978,Right-hand Bat,Right-arm Offbreak,India,Player,Delhi Daredevils,Rajasthan Royals,2010,,32,,Blank,Blank,G Gambhir,Sk Warne,Kd Karthik,Nv Ojha,1978-10-20
15844,,419139,136,A Mishra,11/24/1982,Right-hand Bat,Legbreak,India,Player,Delhi Daredevils,Rajasthan Royals,2010,,28,,Blank,Blank,G Gambhir,Sk Warne,Kd Karthik,Nv Ojha,1982-11-24
15846,,419139,198,Ab Mcdonald,6/5/1981,Right-hand Bat,Right-arm Fast-medium,Australia,Player,Delhi Daredevils,Rajasthan Royals,2010,,29,,Blank,Blank,G Gambhir,Sk Warne,Kd Karthik,Nv Ojha,1981-06-05
15849,,419139,237,Km Jadhav,3/26/1985,Right-hand Bat,Right-arm Offbreak,India,Player,Delhi Daredevils,Rajasthan Royals,2010,,25,,Blank,Blank,G Gambhir,Sk Warne,Kd Karthik,Nv Ojha,1985-03-26
15850,,419139,241,Pd Collingwood,5/26/1976,Right-hand Bat,Right-arm Medium,England,Player,Delhi Daredevils,Rajasthan Royals,2010,,34,,Blank,Blank,G Gambhir,Sk Warne,Kd Karthik,Nv Ojha,1976-05-26
15852,,419139,38,Sk Warne,9/13/1969,Right-hand Bat,Legbreak Googly,Australia,Captain,Rajasthan Royals,Delhi Daredevils,2010,,41,,Blank,Blank,Sk Warne,G Gambhir,Nv Ojha,Kd Karthik,1969-09-13
15853,,419139,39,Sk Trivedi,9/4/1982,Right-hand Bat,Right-arm Medium,India,Player,Rajasthan Royals,Delhi Daredevils,2010,,28,,Blank,Blank,Sk Warne,G Gambhir,Nv Ojha,Kd Karthik,1982-09-04
15855,,419139,211,Aa Jhunjhunwala,12/1/1982,Right-hand Bat,Right-arm Offbreak,India,Player,Rajasthan Royals,Delhi Daredevils,2010,,28,,Blank,Blank,Sk Warne,G Gambhir,Nv Ojha,Kd Karthik,1982-12-01
15856,,419139,212,P Dogra,11/19/1984,Right-hand Bat,Legbreak,India,Player,Rajasthan Royals,Delhi Daredevils,2010,,26,,Blank,Blank,Sk Warne,G Gambhir,Nv Ojha,Kd Karthik,1984-11-19
15862,,419140,53,Ac Gilchrist,11/14/1971,Left-hand Bat,Right-arm Offbreak,Australia,Captainkeeper,Deccan Chargers,Kolkata Knight Riders,2010,,39,,Blank,Blank,Ac Gilchrist,Sc Ganguly,Ac Gilchrist,Wp Saha,1971-11-14
15865,,419140,57,Rg Sharma,4/30/1987,Right-hand Bat,Right-arm Offbreak,India,Player,Deccan Chargers,Kolkata Knight Riders,2010,,23,,Blank,Blank,Ac Gilchrist,Sc Ganguly,Ac Gilchrist,Wp Saha,1987-04-30
15870,,419140,231,Md Mishra,2/9/1984,Right-hand Bat,Right-arm Offbreak,India,Player,Deccan Chargers,Kolkata Knight Riders,2010,,26,,Blank,Blank,Ac Gilchrist,Sc Ganguly,Ac Gilchrist,Wp Saha,1984-02-09
15871,,419140,240,Kaj Roach,6/30/1988,Right-hand Bat,Right-arm Fast,West Indies,Player,Deccan Chargers,Kolkata Knight Riders,2010,,22,,Blank,Blank,Ac Gilchrist,Sc Ganguly,Ac Gilchrist,Wp Saha,1988-06-30
15873,,419140,1,Sc Ganguly,7/8/1972,Left-hand Bat,Right-arm Medium,India,Captain,Kolkata Knight Riders,Deccan Chargers,2010,,38,,Blank,Blank,Sc Ganguly,Ac Gilchrist,Wp Saha,Ac Gilchrist,1972-07-08
15876,,419140,82,Ab Agarkar,12/4/1977,Right-hand Bat,Right-arm Fast,India,Player,Kolkata Knight Riders,Deccan Chargers,2010,,33,,Blank,Blank,Sc Ganguly,Ac Gilchrist,Wp Saha,Ac Gilchrist,1977-12-04
15877,,419140,83,M Kartik,9/11/1976,Left-hand Bat,Slow Left-arm Orthodox,India,Player,Kolkata Knight Riders,Deccan Chargers,2010,,34,,Blank,Blank,Sc Ganguly,Ac Gilchrist,Wp Saha,Ac Gilchrist,1976-09-11
15882,,419140,220,Se Bond,6/7/1975,Right-hand Bat,Right-arm Fast,New Zealand,Player,Kolkata Knight Riders,Deccan Chargers,2010,,35,,Blank,Blank,Sc Ganguly,Ac Gilchrist,Wp Saha,Ac Gilchrist,1975-06-07
15884,,419141,26,Kc Sangakkara,10/27/1977,Left-hand Bat,Right-arm Offbreak,Sri Lanka,Captainkeeper,Kings Xi Punjab,Royal Challengers Bangalore,2010,,33,,Blank,Blank,Kc Sangakkara,A Kumble,Kc Sangakkara,Rv Uthappa,1977-10-27
15885,,419141,27,Yuvraj Singh,12/12/1981,Left-hand Bat,Slow Left-arm Orthodox,India,Player,Kings Xi Punjab,Royal Challengers Bangalore,2010,,29,,Blank,Blank,Kc Sangakkara,A Kumble,Kc Sangakkara,Rv Uthappa,1981-12-12
15889,,419141,77,S Sreesanth,2/6/1983,Right-hand Bat,Right-arm Fast-medium,India,Player,Kings Xi Punjab,Royal Challengers Bangalore,2010,,27,,Blank,Blank,Kc Sangakkara,A Kumble,Kc Sangakkara,Rv Uthappa,1983-02-06
15893,,419141,228,Bipul Sharma,9/28/1983,Left-hand Bat,Slow Left-arm Orthodox,India,Player,Kings Xi Punjab,Royal Challengers Bangalore,2010,,27,,Blank,Blank,Kc Sangakkara,A Kumble,Kc Sangakkara,Rv Uthappa,1983-09-28
15894,,419141,234,Sj Srivastava,9/22/1981,Right-hand Bat,Left-arm Fast-medium,India,Player,Kings Xi Punjab,Royal Challengers Bangalore,2010,,29,,Blank,Blank,Kc Sangakkara,A Kumble,Kc Sangakkara,Rv Uthappa,1981-09-22
15895,,419141,6,R Dravid,1/11/1973,Right-hand Bat,Right-arm Offbreak,India,Player,Royal Challengers Bangalore,Kings Xi Punjab,2010,,37,,Blank,Blank,A Kumble,Kc Sangakkara,Rv Uthappa,Kc Sangakkara,1973-01-11
15896,,419141,8,V Kohli,11/5/1988,Right-hand Bat,Right-arm Medium,India,Player,Royal Challengers Bangalore,Kings Xi Punjab,2010,,22,,Blank,Blank,A Kumble,Kc Sangakkara,Rv Uthappa,Kc Sangakkara,1988-11-05
15901,,419141,81,R Vinay Kumar,2/12/1984,Right-hand Bat,Right-arm Medium,India,Player,Royal Challengers Bangalore,Kings Xi Punjab,2010,,26,,Blank,Blank,A Kumble,Kc Sangakkara,Rv Uthappa,Kc Sangakkara,1984-02-12
15902,,419141,94,Dw Steyn,6/27/1983,Right-hand Bat,Right-arm Fast,South Africa,Player,Royal Challengers Bangalore,Kings Xi Punjab,2010,,27,,Blank,Blank,A Kumble,Kc Sangakkara,Rv Uthappa,Kc Sangakkara,1983-06-27
15904,,419141,124,A Kumble,10/17/1970,Right-hand Bat,Legbreak Googly,India,Captain,Royal Challengers Bangalore,Kings Xi Punjab,2010,,40,,Blank,Blank,A Kumble,Kc Sangakkara,Rv Uthappa,Kc Sangakkara,1970-10-17
15905,,419141,158,Kp Pietersen,6/27/1980,Right-hand Bat,Right-arm Offbreak,South Africa,Player,Royal Challengers Bangalore,Kings Xi Punjab,2010,,30,,Blank,Blank,A Kumble,Kc Sangakkara,Rv Uthappa,Kc Sangakkara,1980-06-27
15906,,419142,18,Ml Hayden,10/29/1971,Left-hand Bat,Right-arm Medium,Australia,Player,Chennai Super Kings,Rajasthan Royals,2010,,39,,Blank,Blank,Ms Dhoni,Sk Warne,Ms Dhoni,Nv Ojha,1971-10-29
15909,,419142,23,S Badrinath,8/30/1980,Right-hand Bat,Right-arm Offbreak,India,Player,Chennai Super Kings,Rajasthan Royals,2010,,30,,Blank,Blank,Ms Dhoni,Sk Warne,Ms Dhoni,Nv Ojha,1980-08-30
15914,,419142,186,Sb Jakati,11/27/1980,Left-hand Bat,Slow Left-arm Orthodox,India,Player,Chennai Super Kings,Rajasthan Royals,2010,,30,,Blank,Blank,Ms Dhoni,Sk Warne,Ms Dhoni,Nv Ojha,1980-11-27
15916,,419142,248,De Bollinger,7/24/1981,Left-hand Bat,Left-arm Fast-medium,Australia,Player,Chennai Super Kings,Rajasthan Royals,2010,,29,,Blank,Blank,Ms Dhoni,Sk Warne,Ms Dhoni,Nv Ojha,1981-07-24
15918,,419142,32,Sr Watson,6/17/1981,Right-hand Bat,Right-arm Fast-medium,Australia,Player,Rajasthan Royals,Chennai Super Kings,2010,,29,,Blank,Blank,Sk Warne,Ms Dhoni,Nv Ojha,Ms Dhoni,1981-06-17
15920,,419142,169,As Raut,3/3/1987,Right-hand Bat,Legbreak Googly,India,Player,Rajasthan Royals,Chennai Super Kings,2010,,23,,Blank,Blank,Sk Warne,Ms Dhoni,Nv Ojha,Ms Dhoni,1987-03-03
15922,,419142,211,Aa Jhunjhunwala,12/1/1982,Right-hand Bat,Right-arm Offbreak,India,Player,Rajasthan Royals,Chennai Super Kings,2010,,28,,Blank,Blank,Sk Warne,Ms Dhoni,Nv Ojha,Ms Dhoni,1982-12-01
15923,,419142,224,Mj Lumb,2/12/1980,Left-hand Bat,Right-arm Medium,England,Player,Rajasthan Royals,Chennai Super Kings,2010,,30,,Blank,Blank,Sk Warne,Ms Dhoni,Nv Ojha,Ms Dhoni,1980-02-12
15925,,419142,229,Fy Fazal,9/7/1985,Left-hand Bat,Right-arm Medium,India,Player,Rajasthan Royals,Chennai Super Kings,2010,,25,,Blank,Blank,Sk Warne,Ms Dhoni,Nv Ojha,Ms Dhoni,1985-09-07
15927,,419142,273,Sb Wagh,10/9/1988,Left-hand Bat,Left-arm Medium-fast,India,Player,Rajasthan Royals,Chennai Super Kings,2010,,22,,Blank,Blank,Sk Warne,Ms Dhoni,Nv Ojha,Ms Dhoni,1988-10-09
15928,,419143,53,Ac Gilchrist,11/14/1971,Left-hand Bat,Right-arm Offbreak,Australia,Captainkeeper,Deccan Chargers,Mumbai Indians,2010,,39,,Blank,Blank,Ac Gilchrist,Sr Tendulkar,Ac Gilchrist,At Rayudu,1971-11-14
15929,,419143,55,Vvs Laxman,11/1/1974,Right-hand Bat,Right-arm Offbreak,India,Player,Deccan Chargers,Mumbai Indians,2010,,36,,Blank,Blank,Ac Gilchrist,Sr Tendulkar,Ac Gilchrist,At Rayudu,1974-11-01
15930,,419143,56,A Symonds,6/9/1975,Right-hand Bat,Right-arm Offbreak,Australia,Player,Deccan Chargers,Mumbai Indians,2010,,35,,Blank,Blank,Ac Gilchrist,Sr Tendulkar,Ac Gilchrist,At Rayudu,1975-06-09
15931,,419143,57,Rg Sharma,4/30/1987,Right-hand Bat,Right-arm Offbreak,India,Player,Deccan Chargers,Mumbai Indians,2010,,23,,Blank,Blank,Ac Gilchrist,Sr Tendulkar,Ac Gilchrist,At Rayudu,1987-04-30
15934,,419143,178,Tl Suman,12/15/1983,Right-hand Bat,Right-arm Offbreak,India,Player,Deccan Chargers,Mumbai Indians,2010,,27,,Blank,Blank,Ac Gilchrist,Sr Tendulkar,Ac Gilchrist,At Rayudu,1983-12-15
15938,,419143,235,R Sharma,4/30/1987,Right-hand Bat,Right-arm Offbreak,India,Player,Deccan Chargers,Mumbai Indians,2010,,23,,Blank,Blank,Ac Gilchrist,Sr Tendulkar,Ac Gilchrist,At Rayudu,1987-04-30
15939,,419143,15,Z Khan,10/7/1978,Right-hand Bat,Left-arm Fast-medium,India,Player,Mumbai Indians,Deccan Chargers,2010,,32,,Blank,Blank,Sr Tendulkar,Ac Gilchrist,At Rayudu,Ac Gilchrist,1978-10-07
15940,,419143,42,S Dhawan,12/5/1985,Left-hand Bat,Right-arm Offbreak,India,Player,Mumbai Indians,Deccan Chargers,2010,,25,,Blank,Blank,Sr Tendulkar,Ac Gilchrist,At Rayudu,Ac Gilchrist,1985-12-05
15942,,419143,71,Dj Bravo,10/7/1983,Right-hand Bat,Right-arm Medium-fast,West Indies,Player,Mumbai Indians,Deccan Chargers,2010,,27,,Blank,Blank,Sr Tendulkar,Ac Gilchrist,At Rayudu,Ac Gilchrist,1983-10-07
15947,,419143,209,R Sathish,1/14/1981,Right-hand Bat,Right-arm Medium,India,Player,Mumbai Indians,Deccan Chargers,2010,,29,,Blank,Blank,Sr Tendulkar,Ac Gilchrist,At Rayudu,Ac Gilchrist,1981-01-14
15950,,419144,26,Kc Sangakkara,10/27/1977,Left-hand Bat,Right-arm Offbreak,Sri Lanka,Captain,Kings Xi Punjab,Kolkata Knight Riders,2010,,33,,Blank,Blank,Kc Sangakkara,Sc Ganguly,Ms Bisla,Wp Saha,1977-10-27
15953,,419144,64,Dpmd Jayawardene,5/27/1977,Right-hand Bat,Right-arm Medium,Sri Lanka,Player,Kings Xi Punjab,Kolkata Knight Riders,2010,,33,,Blank,Blank,Kc Sangakkara,Sc Ganguly,Ms Bisla,Wp Saha,1977-05-27
15956,,419144,161,Rs Bopara,5/4/1985,Right-hand Bat,Right-arm Medium,England,Player,Kings Xi Punjab,Kolkata Knight Riders,2010,,25,,Blank,Blank,Kc Sangakkara,Sc Ganguly,Ms Bisla,Wp Saha,1985-05-04
15957,,419144,214,Ms Bisla,12/27/1984,Right-hand Bat,N/a,India,Keeper,Kings Xi Punjab,Kolkata Knight Riders,2010,,26,,Blank,Blank,Kc Sangakkara,Sc Ganguly,Ms Bisla,Wp Saha,1984-12-27
15958,,419144,228,Bipul Sharma,9/28/1983,Left-hand Bat,Slow Left-arm Orthodox,India,Player,Kings Xi Punjab,Kolkata Knight Riders,2010,,27,,Blank,Blank,Kc Sangakkara,Sc Ganguly,Ms Bisla,Wp Saha,1983-09-28
15960,,419144,234,Sj Srivastava,9/22/1981,Right-hand Bat,Left-arm Fast-medium,India,Player,Kings Xi Punjab,Kolkata Knight Riders,2010,,29,,Blank,Blank,Kc Sangakkara,Sc Ganguly,Ms Bisla,Wp Saha,1981-09-22
15961,,419144,1,Sc Ganguly,7/8/1972,Left-hand Bat,Right-arm Medium,India,Captain,Kolkata Knight Riders,Kings Xi Punjab,2010,,38,,Blank,Blank,Sc Ganguly,Kc Sangakkara,Wp Saha,Ms Bisla,1972-07-08
15962,,419144,4,Dj Hussey,7/15/1977,Right-hand Bat,Right-arm Offbreak,Australia,Player,Kolkata Knight Riders,Kings Xi Punjab,2010,,33,,Blank,Blank,Sc Ganguly,Kc Sangakkara,Wp Saha,Ms Bisla,1977-07-15
15963,,419144,62,Wp Saha,10/24/1984,Right-hand Bat,N/a,India,Keeper,Kolkata Knight Riders,Kings Xi Punjab,2010,,26,,Blank,Blank,Sc Ganguly,Kc Sangakkara,Wp Saha,Ms Bisla,1984-10-24
15964,,419144,82,Ab Agarkar,12/4/1977,Right-hand Bat,Right-arm Fast,India,Player,Kolkata Knight Riders,Kings Xi Punjab,2010,,33,,Blank,Blank,Sc Ganguly,Kc Sangakkara,Wp Saha,Ms Bisla,1977-12-04
15966,,419144,87,Mk Tiwary,11/14/1985,Right-hand Bat,Legbreak Googly,India,Player,Kolkata Knight Riders,Kings Xi Punjab,2010,,25,,Blank,Blank,Sc Ganguly,Kc Sangakkara,Wp Saha,Ms Bisla,1985-11-14
15967,,419144,162,Ch Gayle,9/21/1979,Left-hand Bat,Right-arm Offbreak,West Indies,Player,Kolkata Knight Riders,Kings Xi Punjab,2010,,31,,Blank,Blank,Sc Ganguly,Kc Sangakkara,Wp Saha,Ms Bisla,1979-09-21
15968,,419144,191,Ad Mathews,6/2/1987,Right-hand Bat,Right-arm Fast-medium,Sri Lanka,Player,Kolkata Knight Riders,Kings Xi Punjab,2010,,23,,Blank,Blank,Sc Ganguly,Kc Sangakkara,Wp Saha,Ms Bisla,1987-06-02
15973,,419145,41,V Sehwag,10/20/1978,Right-hand Bat,Right-arm Offbreak,India,Player,Delhi Daredevils,Royal Challengers Bangalore,2010,,32,,Blank,Blank,G Gambhir,A Kumble,Kd Karthik,Rv Uthappa,1978-10-20
15974,,419145,88,Kd Karthik,6/1/1985,Right-hand Bat,N/a,India,Keeper,Delhi Daredevils,Royal Challengers Bangalore,2010,,25,,Blank,Blank,G Gambhir,A Kumble,Kd Karthik,Rv Uthappa,1985-06-01
15977,,419145,116,Pj Sangwan,11/5/1990,Right-hand Bat,Left-arm Medium,India,Player,Delhi Daredevils,Royal Challengers Bangalore,2010,,20,,Blank,Blank,G Gambhir,A Kumble,Kd Karthik,Rv Uthappa,1990-11-05
15983,,419145,6,R Dravid,1/11/1973,Right-hand Bat,Right-arm Offbreak,India,Player,Royal Challengers Bangalore,Delhi Daredevils,2010,,37,,Blank,Blank,A Kumble,G Gambhir,Rv Uthappa,Kd Karthik,1973-01-11
15984,,419145,8,V Kohli,11/5/1988,Right-hand Bat,Right-arm Medium,India,Player,Royal Challengers Bangalore,Delhi Daredevils,2010,,22,,Blank,Blank,A Kumble,G Gambhir,Rv Uthappa,Kd Karthik,1988-11-05
15987,,419145,46,Rv Uthappa,11/11/1985,Right-hand Bat,Right-arm Medium,India,Keeper,Royal Challengers Bangalore,Delhi Daredevils,2010,,25,,Blank,Blank,A Kumble,G Gambhir,Rv Uthappa,Kd Karthik,1985-11-11
15991,,419145,158,Kp Pietersen,6/27/1980,Right-hand Bat,Right-arm Offbreak,South Africa,Player,Royal Challengers Bangalore,Delhi Daredevils,2010,,30,,Blank,Blank,A Kumble,G Gambhir,Rv Uthappa,Kd Karthik,1980-06-27
15995,,419146,55,Vvs Laxman,11/1/1974,Right-hand Bat,Right-arm Offbreak,India,Player,Deccan Chargers,Rajasthan Royals,2010,,36,,Blank,Blank,Ac Gilchrist,Sk Warne,Ac Gilchrist,Nv Ojha,1974-11-01
15996,,419146,56,A Symonds,6/9/1975,Right-hand Bat,Right-arm Offbreak,Australia,Player,Deccan Chargers,Rajasthan Royals,2010,,35,,Blank,Blank,Ac Gilchrist,Sk Warne,Ac Gilchrist,Nv Ojha,1975-06-09
15997,,419146,57,Rg Sharma,4/30/1987,Right-hand Bat,Right-arm Offbreak,India,Player,Deccan Chargers,Rajasthan Royals,2010,,23,,Blank,Blank,Ac Gilchrist,Sk Warne,Ac Gilchrist,Nv Ojha,1987-04-30
16000,,419146,147,Dr Smith,4/12/1983,Right-hand Bat,Right-arm Medium,West Indies,Player,Deccan Chargers,Rajasthan Royals,2010,,27,,Blank,Blank,Ac Gilchrist,Sk Warne,Ac Gilchrist,Nv Ojha,1983-04-12
16001,,419146,172,Aa Bilakhia,5/31/1986,Right-hand Bat,Right-arm Medium,India,Player,Deccan Chargers,Rajasthan Royals,2010,,24,,Blank,Blank,Ac Gilchrist,Sk Warne,Ac Gilchrist,Nv Ojha,1986-05-31
16002,,419146,188,Rj Harris,10/11/1979,Right-hand Bat,Right-arm Fast,Australia,Player,Deccan Chargers,Rajasthan Royals,2010,,31,,Blank,Blank,Ac Gilchrist,Sk Warne,Ac Gilchrist,Nv Ojha,1979-10-11
16006,,419146,32,Sr Watson,6/17/1981,Right-hand Bat,Right-arm Fast-medium,Australia,Player,Rajasthan Royals,Deccan Chargers,2010,,29,,Blank,Blank,Sk Warne,Ac Gilchrist,Nv Ojha,Ac Gilchrist,1981-06-17
16011,,419146,190,M Morkel,10/6/1984,Left-hand Bat,Right-arm Fast,South Africa,Player,Rajasthan Royals,Deccan Chargers,2010,,26,,Blank,Blank,Sk Warne,Ac Gilchrist,Nv Ojha,Ac Gilchrist,1984-10-06
16012,,419146,211,Aa Jhunjhunwala,12/1/1982,Right-hand Bat,Right-arm Offbreak,India,Player,Rajasthan Royals,Deccan Chargers,2010,,28,,Blank,Blank,Sk Warne,Ac Gilchrist,Nv Ojha,Ac Gilchrist,1982-12-01
16014,,419146,229,Fy Fazal,9/7/1985,Left-hand Bat,Right-arm Medium,India,Player,Rajasthan Royals,Deccan Chargers,2010,,25,,Blank,Blank,Sk Warne,Ac Gilchrist,Nv Ojha,Ac Gilchrist,1985-09-07
16015,,419146,245,Ap Dole,10/9/1987,Right-hand Bat,Right-arm Medium-fast,India,Player,Rajasthan Royals,Deccan Chargers,2010,,23,,Blank,Blank,Sk Warne,Ac Gilchrist,Nv Ojha,Ac Gilchrist,1987-10-09
16016,,419147,42,S Dhawan,12/5/1985,Left-hand Bat,Right-arm Offbreak,India,Player,Mumbai Indians,Chennai Super Kings,2010,,25,,Blank,Blank,Sr Tendulkar,Ms Dhoni,At Rayudu,Ms Dhoni,1985-12-05
16018,,419147,71,Dj Bravo,10/7/1983,Right-hand Bat,Right-arm Medium-fast,West Indies,Player,Mumbai Indians,Chennai Super Kings,2010,,27,,Blank,Blank,Sr Tendulkar,Ms Dhoni,At Rayudu,Ms Dhoni,1983-10-07
16020,,419147,133,Sr Tendulkar,4/24/1973,Right-hand Bat,Right-arm Offbreak,India,Captain,Mumbai Indians,Chennai Super Kings,2010,,37,,Blank,Blank,Sr Tendulkar,Ms Dhoni,At Rayudu,Ms Dhoni,1973-04-24
16024,,419147,210,R Mclaren,2/9/1983,Left-hand Bat,Right-arm Medium-fast,South Africa,Player,Mumbai Indians,Chennai Super Kings,2010,,27,,Blank,Blank,Sr Tendulkar,Ms Dhoni,At Rayudu,Ms Dhoni,1983-02-09
16027,,419147,18,Ml Hayden,10/29/1971,Left-hand Bat,Right-arm Medium,Australia,Player,Chennai Super Kings,Mumbai Indians,2010,,39,,Blank,Blank,Ms Dhoni,Sr Tendulkar,Ms Dhoni,At Rayudu,1971-10-29
16031,,419147,23,S Badrinath,8/30/1980,Right-hand Bat,Right-arm Offbreak,India,Player,Chennai Super Kings,Mumbai Indians,2010,,30,,Blank,Blank,Ms Dhoni,Sr Tendulkar,Ms Dhoni,At Rayudu,1980-08-30
16032,,419147,156,T Thushara,3/1/1981,Left-hand Bat,Left-arm Fast-medium,Sri Lanka,Player,Chennai Super Kings,Mumbai Indians,2010,,29,,Blank,Blank,Ms Dhoni,Sr Tendulkar,Ms Dhoni,At Rayudu,1981-03-01
16038,,419148,26,Kc Sangakkara,10/27/1977,Left-hand Bat,Right-arm Offbreak,Sri Lanka,Captain,Kings Xi Punjab,Rajasthan Royals,2010,,33,,Blank,Blank,Kc Sangakkara,Sk Warne,Ms Bisla,Nv Ojha,1977-10-27
16043,,419148,77,S Sreesanth,2/6/1983,Right-hand Bat,Right-arm Fast-medium,India,Player,Kings Xi Punjab,Rajasthan Royals,2010,,27,,Blank,Blank,Kc Sangakkara,Sk Warne,Ms Bisla,Nv Ojha,1983-02-06
16047,,419148,228,Bipul Sharma,9/28/1983,Left-hand Bat,Slow Left-arm Orthodox,India,Player,Kings Xi Punjab,Rajasthan Royals,2010,,27,,Blank,Blank,Kc Sangakkara,Sk Warne,Ms Bisla,Nv Ojha,1983-09-28
16048,,419148,233,J Theron,7/24/1985,Right-hand Bat,Right-arm Medium-fast,South Africa,Player,Kings Xi Punjab,Rajasthan Royals,2010,,25,,Blank,Blank,Kc Sangakkara,Sk Warne,Ms Bisla,Nv Ojha,1985-07-24
16052,,419148,39,Sk Trivedi,9/4/1982,Right-hand Bat,Right-arm Medium,India,Player,Rajasthan Royals,Kings Xi Punjab,2010,,28,,Blank,Blank,Sk Warne,Kc Sangakkara,Nv Ojha,Ms Bisla,1982-09-04
16053,,419148,169,As Raut,3/3/1987,Right-hand Bat,Legbreak Googly,India,Player,Rajasthan Royals,Kings Xi Punjab,2010,,23,,Blank,Blank,Sk Warne,Kc Sangakkara,Nv Ojha,Ms Bisla,1987-03-03
16055,,419148,211,Aa Jhunjhunwala,12/1/1982,Right-hand Bat,Right-arm Offbreak,India,Player,Rajasthan Royals,Kings Xi Punjab,2010,,28,,Blank,Blank,Sk Warne,Kc Sangakkara,Nv Ojha,Ms Bisla,1982-12-01
16056,,419148,224,Mj Lumb,2/12/1980,Left-hand Bat,Right-arm Medium,England,Player,Rajasthan Royals,Kings Xi Punjab,2010,,30,,Blank,Blank,Sk Warne,Kc Sangakkara,Nv Ojha,Ms Bisla,1980-02-12
16057,,419148,229,Fy Fazal,9/7/1985,Left-hand Bat,Right-arm Medium,India,Player,Rajasthan Royals,Kings Xi Punjab,2010,,25,,Blank,Blank,Sk Warne,Kc Sangakkara,Nv Ojha,Ms Bisla,1985-09-07
16061,,419149,41,V Sehwag,10/20/1978,Right-hand Bat,Right-arm Offbreak,India,Player,Delhi Daredevils,Kolkata Knight Riders,2010,,32,,Blank,Blank,G Gambhir,Sc Ganguly,Kd Karthik,Wp Saha,1978-10-20
16064,,419149,90,Mf Maharoof,9/7/1984,Right-hand Bat,Right-arm Fast-medium,India,Player,Delhi Daredevils,Kolkata Knight Riders,2010,,26,,Blank,Blank,G Gambhir,Sc Ganguly,Kd Karthik,Wp Saha,1984-09-07
16069,,419149,237,Km Jadhav,3/26/1985,Right-hand Bat,Right-arm Offbreak,India,Player,Delhi Daredevils,Kolkata Knight Riders,2010,,25,,Blank,Blank,G Gambhir,Sc Ganguly,Kd Karthik,Wp Saha,1985-03-26
16070,,419149,241,Pd Collingwood,5/26/1976,Right-hand Bat,Right-arm Medium,England,Player,Delhi Daredevils,Kolkata Knight Riders,2010,,34,,Blank,Blank,G Gambhir,Sc Ganguly,Kd Karthik,Wp Saha,1976-05-26
16073,,419149,62,Wp Saha,10/24/1984,Right-hand Bat,N/a,India,Keeper,Kolkata Knight Riders,Delhi Daredevils,2010,,26,,Blank,Blank,Sc Ganguly,G Gambhir,Wp Saha,Kd Karthik,1984-10-24
16075,,419149,87,Mk Tiwary,11/14/1985,Right-hand Bat,Legbreak Googly,India,Player,Kolkata Knight Riders,Delhi Daredevils,2010,,25,,Blank,Blank,Sc Ganguly,G Gambhir,Wp Saha,Kd Karthik,1985-11-14
16076,,419149,106,Ab Dinda,3/25/1984,Right-hand Bat,Right-arm Medium-fast,India,Player,Kolkata Knight Riders,Delhi Daredevils,2010,,26,,Blank,Blank,Sc Ganguly,G Gambhir,Wp Saha,Kd Karthik,1984-03-25
16078,,419149,162,Ch Gayle,9/21/1979,Left-hand Bat,Right-arm Offbreak,West Indies,Player,Kolkata Knight Riders,Delhi Daredevils,2010,,31,,Blank,Blank,Sc Ganguly,G Gambhir,Wp Saha,Kd Karthik,1979-09-21
16080,,419149,191,Ad Mathews,6/2/1987,Right-hand Bat,Right-arm Fast-medium,Sri Lanka,Player,Kolkata Knight Riders,Delhi Daredevils,2010,,23,,Blank,Blank,Sc Ganguly,G Gambhir,Wp Saha,Kd Karthik,1987-06-02
16081,,419149,203,Ca Pujara,1/25/1988,Right-hand Bat,Legbreak,India,Player,Kolkata Knight Riders,Delhi Daredevils,2010,,22,,Blank,Blank,Sc Ganguly,G Gambhir,Wp Saha,Kd Karthik,1988-01-25
16082,,419150,53,Ac Gilchrist,11/14/1971,Left-hand Bat,Right-arm Offbreak,Australia,Captainkeeper,Deccan Chargers,Royal Challengers Bangalore,2010,,39,,Blank,Blank,Ac Gilchrist,A Kumble,Ac Gilchrist,Rv Uthappa,1971-11-14
16088,,419150,178,Tl Suman,12/15/1983,Right-hand Bat,Right-arm Offbreak,India,Player,Deccan Chargers,Royal Challengers Bangalore,2010,,27,,Blank,Blank,Ac Gilchrist,A Kumble,Ac Gilchrist,Rv Uthappa,1983-12-15
16094,,419150,8,V Kohli,11/5/1988,Right-hand Bat,Right-arm Medium,India,Player,Royal Challengers Bangalore,Deccan Chargers,2010,,22,,Blank,Blank,A Kumble,Ac Gilchrist,Rv Uthappa,Ac Gilchrist,1988-11-05
16098,,419150,46,Rv Uthappa,11/11/1985,Right-hand Bat,Right-arm Medium,India,Keeper,Royal Challengers Bangalore,Deccan Chargers,2010,,25,,Blank,Blank,A Kumble,Ac Gilchrist,Rv Uthappa,Ac Gilchrist,1985-11-11
16099,,419150,52,Lrpl Taylor,3/8/1984,Right-hand Bat,Right-arm Offbreak,New Zealand,Player,Royal Challengers Bangalore,Deccan Chargers,2010,,26,,Blank,Blank,A Kumble,Ac Gilchrist,Rv Uthappa,Ac Gilchrist,1984-03-08
16104,,419151,15,Z Khan,10/7/1978,Right-hand Bat,Left-arm Fast-medium,India,Player,Mumbai Indians,Kings Xi Punjab,2010,,32,,Blank,Blank,Sr Tendulkar,Kc Sangakkara,At Rayudu,Kc Sangakkara,1978-10-07
16113,,419151,210,R Mclaren,2/9/1983,Left-hand Bat,Right-arm Medium-fast,South Africa,Player,Mumbai Indians,Kings Xi Punjab,2010,,27,,Blank,Blank,Sr Tendulkar,Kc Sangakkara,At Rayudu,Kc Sangakkara,1983-02-09
16114,,419151,221,Ka Pollard,5/12/1987,Right-hand Bat,Right-arm Medium-fast,West Indies,Player,Mumbai Indians,Kings Xi Punjab,2010,,23,,Blank,Blank,Sr Tendulkar,Kc Sangakkara,At Rayudu,Kc Sangakkara,1987-05-12
16116,,419151,26,Kc Sangakkara,10/27/1977,Left-hand Bat,Right-arm Offbreak,Sri Lanka,Captainkeeper,Kings Xi Punjab,Mumbai Indians,2010,,33,,Blank,Blank,Kc Sangakkara,Sr Tendulkar,Kc Sangakkara,At Rayudu,1977-10-27
16117,,419151,27,Yuvraj Singh,12/12/1981,Left-hand Bat,Slow Left-arm Orthodox,India,Player,Kings Xi Punjab,Mumbai Indians,2010,,29,,Blank,Blank,Kc Sangakkara,Sr Tendulkar,Kc Sangakkara,At Rayudu,1981-12-12
16119,,419151,64,Dpmd Jayawardene,5/27/1977,Right-hand Bat,Right-arm Medium,Sri Lanka,Player,Kings Xi Punjab,Mumbai Indians,2010,,33,,Blank,Blank,Kc Sangakkara,Sr Tendulkar,Kc Sangakkara,At Rayudu,1977-05-27
16120,,419151,66,B Lee,11/8/1976,Right-hand Bat,Right-arm Fast,Australia,Player,Kings Xi Punjab,Mumbai Indians,2010,,34,,Blank,Blank,Kc Sangakkara,Sr Tendulkar,Kc Sangakkara,At Rayudu,1976-11-08
16122,,419151,153,Rr Powar,5/20/1978,Right-hand Bat,Right-arm Offbreak,India,Player,Kings Xi Punjab,Mumbai Indians,2010,,32,,Blank,Blank,Kc Sangakkara,Sr Tendulkar,Kc Sangakkara,At Rayudu,1978-05-20
16125,,419151,291,L Ablish,12/3/1982,Right-hand Bat,Right-arm Medium-fast,India,Player,Kings Xi Punjab,Mumbai Indians,2010,,28,,Blank,Blank,Kc Sangakkara,Sr Tendulkar,Kc Sangakkara,At Rayudu,1982-12-03
16129,,419152,61,Rp Singh,12/6/1985,Right-hand Bat,Left-arm Fast-medium,India,Player,Deccan Chargers,Chennai Super Kings,2010,,25,,Blank,Blank,Ac Gilchrist,Ms Dhoni,Ac Gilchrist,Ms Dhoni,1985-12-06
16131,,419152,147,Dr Smith,4/12/1983,Right-hand Bat,Right-arm Medium,West Indies,Player,Deccan Chargers,Chennai Super Kings,2010,,27,,Blank,Blank,Ac Gilchrist,Ms Dhoni,Ac Gilchrist,Ms Dhoni,1983-04-12
16133,,419152,188,Rj Harris,10/11/1979,Right-hand Bat,Right-arm Fast,Australia,Player,Deccan Chargers,Chennai Super Kings,2010,,31,,Blank,Blank,Ac Gilchrist,Ms Dhoni,Ac Gilchrist,Ms Dhoni,1979-10-11
16134,,419152,231,Md Mishra,2/9/1984,Right-hand Bat,Right-arm Offbreak,India,Player,Deccan Chargers,Chennai Super Kings,2010,,26,,Blank,Blank,Ac Gilchrist,Ms Dhoni,Ac Gilchrist,Ms Dhoni,1984-02-09
16137,,419152,18,Ml Hayden,10/29/1971,Left-hand Bat,Right-arm Medium,Australia,Player,Chennai Super Kings,Deccan Chargers,2010,,39,,Blank,Blank,Ms Dhoni,Ac Gilchrist,Ms Dhoni,Ac Gilchrist,1971-10-29
16138,,419152,19,Mek Hussey,5/27/1975,Left-hand Bat,Right-arm Medium,Australia,Player,Chennai Super Kings,Deccan Chargers,2010,,35,,Blank,Blank,Ms Dhoni,Ac Gilchrist,Ms Dhoni,Ac Gilchrist,1975-05-27
16142,,419152,156,T Thushara,3/1/1981,Left-hand Bat,Left-arm Fast-medium,Sri Lanka,Player,Chennai Super Kings,Deccan Chargers,2010,,29,,Blank,Blank,Ms Dhoni,Ac Gilchrist,Ms Dhoni,Ac Gilchrist,1981-03-01
16145,,419152,201,R Ashwin,9/17/1986,Right-hand Bat,Right-arm Offbreak,India,Player,Chennai Super Kings,Deccan Chargers,2010,,24,,Blank,Blank,Ms Dhoni,Ac Gilchrist,Ms Dhoni,Ac Gilchrist,1986-09-17
16146,,419152,218,S Tyagi,9/17/1987,Right-hand Bat,Right-arm Medium,India,Player,Chennai Super Kings,Deccan Chargers,2010,,23,,Blank,Blank,Ms Dhoni,Ac Gilchrist,Ms Dhoni,Ac Gilchrist,1987-09-17
16147,,419152,248,De Bollinger,7/24/1981,Left-hand Bat,Left-arm Fast-medium,Australia,Player,Chennai Super Kings,Deccan Chargers,2010,,29,,Blank,Blank,Ms Dhoni,Ac Gilchrist,Ms Dhoni,Ac Gilchrist,1981-07-24
16148,,419153,6,R Dravid,1/11/1973,Right-hand Bat,Right-arm Offbreak,India,Player,Royal Challengers Bangalore,Kolkata Knight Riders,2010,,37,,Blank,Blank,A Kumble,Sc Ganguly,Rv Uthappa,Wp Saha,1973-01-11
16150,,419153,9,Jh Kallis,10/16/1975,Right-hand Bat,Right-arm Fast-medium,South Africa,Player,Royal Challengers Bangalore,Kolkata Knight Riders,2010,,35,,Blank,Blank,A Kumble,Sc Ganguly,Rv Uthappa,Wp Saha,1975-10-16
16155,,419153,81,R Vinay Kumar,2/12/1984,Right-hand Bat,Right-arm Medium,India,Player,Royal Challengers Bangalore,Kolkata Knight Riders,2010,,26,,Blank,Blank,A Kumble,Sc Ganguly,Rv Uthappa,Wp Saha,1984-02-12
16158,,419153,249,S Sriram,2/21/1976,Left-hand Bat,Slow Left-arm Orthodox,India,Player,Royal Challengers Bangalore,Kolkata Knight Riders,2010,,34,,Blank,Blank,A Kumble,Sc Ganguly,Rv Uthappa,Wp Saha,1976-02-21
16159,,419153,1,Sc Ganguly,7/8/1972,Left-hand Bat,Right-arm Medium,India,Captain,Kolkata Knight Riders,Royal Challengers Bangalore,2010,,38,,Blank,Blank,Sc Ganguly,A Kumble,Wp Saha,Rv Uthappa,1972-07-08
16165,,419153,106,Ab Dinda,3/25/1984,Right-hand Bat,Right-arm Medium-fast,India,Player,Kolkata Knight Riders,Royal Challengers Bangalore,2010,,26,,Blank,Blank,Sc Ganguly,A Kumble,Wp Saha,Rv Uthappa,1984-03-25
16168,,419153,191,Ad Mathews,6/2/1987,Right-hand Bat,Right-arm Fast-medium,Sri Lanka,Player,Kolkata Knight Riders,Royal Challengers Bangalore,2010,,23,,Blank,Blank,Sc Ganguly,A Kumble,Wp Saha,Rv Uthappa,1987-06-02
16175,,419154,67,Pp Chawla,12/24/1988,Left-hand Bat,Legbreak,India,Player,Kings Xi Punjab,Delhi Daredevils,2010,,22,,Blank,Blank,Kc Sangakkara,G Gambhir,Kc Sangakkara,Kd Karthik,1988-12-24
16176,,419154,153,Rr Powar,5/20/1978,Right-hand Bat,Right-arm Offbreak,India,Player,Kings Xi Punjab,Delhi Daredevils,2010,,32,,Blank,Blank,Kc Sangakkara,G Gambhir,Kc Sangakkara,Kd Karthik,1978-05-20
16178,,419154,233,J Theron,7/24/1985,Right-hand Bat,Right-arm Medium-fast,South Africa,Player,Kings Xi Punjab,Delhi Daredevils,2010,,25,,Blank,Blank,Kc Sangakkara,G Gambhir,Kc Sangakkara,Kd Karthik,1985-07-24
16185,,419154,89,R Bhatia,10/22/1979,Right-hand Bat,Right-arm Medium-fast,India,Player,Delhi Daredevils,Kings Xi Punjab,2010,,31,,Blank,Blank,G Gambhir,Kc Sangakkara,Kd Karthik,Kc Sangakkara,1979-10-22
16187,,419154,136,A Mishra,11/24/1982,Right-hand Bat,Legbreak,India,Player,Delhi Daredevils,Kings Xi Punjab,2010,,28,,Blank,Blank,G Gambhir,Kc Sangakkara,Kd Karthik,Kc Sangakkara,1982-11-24
16189,,419154,175,Dl Vettori,1/27/1979,Left-hand Bat,Slow Left-arm Orthodox,New Zealand,Player,Delhi Daredevils,Kings Xi Punjab,2010,,31,,Blank,Blank,G Gambhir,Kc Sangakkara,Kd Karthik,Kc Sangakkara,1979-01-27
16191,,419154,241,Pd Collingwood,5/26/1976,Right-hand Bat,Right-arm Medium,England,Player,Delhi Daredevils,Kings Xi Punjab,2010,,34,,Blank,Blank,G Gambhir,Kc Sangakkara,Kd Karthik,Kc Sangakkara,1976-05-26
16192,,419155,15,Z Khan,10/7/1978,Right-hand Bat,Left-arm Fast-medium,India,Player,Mumbai Indians,Rajasthan Royals,2010,,32,,Blank,Blank,Sr Tendulkar,Sk Warne,At Rayudu,Nv Ojha,1978-10-07
16197,,419155,133,Sr Tendulkar,4/24/1973,Right-hand Bat,Right-arm Offbreak,India,Captain,Mumbai Indians,Rajasthan Royals,2010,,37,,Blank,Blank,Sr Tendulkar,Sk Warne,At Rayudu,Nv Ojha,1973-04-24
16201,,419155,209,R Sathish,1/14/1981,Right-hand Bat,Right-arm Medium,India,Player,Mumbai Indians,Rajasthan Royals,2010,,29,,Blank,Blank,Sr Tendulkar,Sk Warne,At Rayudu,Nv Ojha,1981-01-14
16204,,419155,32,Sr Watson,6/17/1981,Right-hand Bat,Right-arm Fast-medium,Australia,Player,Rajasthan Royals,Mumbai Indians,2010,,29,,Blank,Blank,Sk Warne,Sr Tendulkar,Nv Ojha,At Rayudu,1981-06-17
16214,,419156,53,Ac Gilchrist,11/14/1971,Left-hand Bat,Right-arm Offbreak,Australia,Captainkeeper,Deccan Chargers,Royal Challengers Bangalore,2010,,39,,Blank,Blank,Ac Gilchrist,A Kumble,Ac Gilchrist,Rv Uthappa,1971-11-14
16218,,419156,97,Hh Gibbs,2/23/1974,Right-hand Bat,Right-arm Bowler,South Africa,Player,Deccan Chargers,Royal Challengers Bangalore,2010,,36,,Blank,Blank,Ac Gilchrist,A Kumble,Ac Gilchrist,Rv Uthappa,1974-02-23
16219,,419156,131,Pp Ojha,9/5/1986,Left-hand Bat,Slow Left-arm Orthodox,India,Player,Deccan Chargers,Royal Challengers Bangalore,2010,,24,,Blank,Blank,Ac Gilchrist,A Kumble,Ac Gilchrist,Rv Uthappa,1986-09-05
16220,,419156,178,Tl Suman,12/15/1983,Right-hand Bat,Right-arm Offbreak,India,Player,Deccan Chargers,Royal Challengers Bangalore,2010,,27,,Blank,Blank,Ac Gilchrist,A Kumble,Ac Gilchrist,Rv Uthappa,1983-12-15
16221,,419156,188,Rj Harris,10/11/1979,Right-hand Bat,Right-arm Fast,Australia,Player,Deccan Chargers,Royal Challengers Bangalore,2010,,31,,Blank,Blank,Ac Gilchrist,A Kumble,Ac Gilchrist,Rv Uthappa,1979-10-11
16224,,419156,256,Harmeet Singh,9/7/1992,Left-hand Bat,Slow Left-arm Orthodox,India,Player,Deccan Chargers,Royal Challengers Bangalore,2010,,18,,Blank,Blank,Ac Gilchrist,A Kumble,Ac Gilchrist,Rv Uthappa,1992-09-07
16226,,419156,8,V Kohli,11/5/1988,Right-hand Bat,Right-arm Medium,India,Player,Royal Challengers Bangalore,Deccan Chargers,2010,,22,,Blank,Blank,A Kumble,Ac Gilchrist,Rv Uthappa,Ac Gilchrist,1988-11-05
16230,,419156,52,Lrpl Taylor,3/8/1984,Right-hand Bat,Right-arm Offbreak,New Zealand,Player,Royal Challengers Bangalore,Deccan Chargers,2010,,26,,Blank,Blank,A Kumble,Ac Gilchrist,Rv Uthappa,Ac Gilchrist,1984-03-08
16232,,419156,94,Dw Steyn,6/27/1983,Right-hand Bat,Right-arm Fast,South Africa,Player,Royal Challengers Bangalore,Deccan Chargers,2010,,27,,Blank,Blank,A Kumble,Ac Gilchrist,Rv Uthappa,Ac Gilchrist,1983-06-27
16234,,419156,124,A Kumble,10/17/1970,Right-hand Bat,Legbreak Googly,India,Captain,Royal Challengers Bangalore,Deccan Chargers,2010,,40,,Blank,Blank,A Kumble,Ac Gilchrist,Rv Uthappa,Ac Gilchrist,1970-10-17
16235,,419156,181,Kp Appanna,12/20/1988,Right-hand Bat,Slow Left-arm Orthodox,India,Player,Royal Challengers Bangalore,Deccan Chargers,2010,,22,,Blank,Blank,A Kumble,Ac Gilchrist,Rv Uthappa,Ac Gilchrist,1988-12-20
16236,,419157,15,Z Khan,10/7/1978,Right-hand Bat,Left-arm Fast-medium,India,Player,Mumbai Indians,Delhi Daredevils,2010,,32,,Blank,Blank,Sr Tendulkar,G Gambhir,C Madan,Kd Karthik,1978-10-07
16240,,419157,133,Sr Tendulkar,4/24/1973,Right-hand Bat,Right-arm Offbreak,India,Captain,Mumbai Indians,Delhi Daredevils,2010,,37,,Blank,Blank,Sr Tendulkar,G Gambhir,C Madan,Kd Karthik,1973-04-24
16242,,419157,154,Jp Duminy,4/14/1984,Left-hand Bat,Right-arm Offbreak,South Africa,Player,Mumbai Indians,Delhi Daredevils,2010,,26,,Blank,Blank,Sr Tendulkar,G Gambhir,C Madan,Kd Karthik,1984-04-14
16243,,419157,208,At Rayudu,9/23/1985,Right-hand Bat,Right-arm Offbreak,India,Player,Mumbai Indians,Delhi Daredevils,2010,,25,,Blank,Blank,Sr Tendulkar,G Gambhir,C Madan,Kd Karthik,1985-09-23
16244,,419157,221,Ka Pollard,5/12/1987,Right-hand Bat,Right-arm Medium-fast,West Indies,Player,Mumbai Indians,Delhi Daredevils,2010,,23,,Blank,Blank,Sr Tendulkar,G Gambhir,C Madan,Kd Karthik,1987-05-12
16247,,419157,40,G Gambhir,10/14/1981,Left-hand Bat,Legbreak,India,Captain,Delhi Daredevils,Mumbai Indians,2010,,29,,Blank,Blank,G Gambhir,Sr Tendulkar,Kd Karthik,C Madan,1981-10-14
16251,,419157,110,Ab De Villiers,2/17/1984,Right-hand Bat,Right-arm Medium,South Africa,Player,Delhi Daredevils,Mumbai Indians,2010,,26,,Blank,Blank,G Gambhir,Sr Tendulkar,Kd Karthik,C Madan,1984-02-17
16253,,419157,136,A Mishra,11/24/1982,Right-hand Bat,Legbreak,India,Player,Delhi Daredevils,Mumbai Indians,2010,,28,,Blank,Blank,G Gambhir,Sr Tendulkar,Kd Karthik,C Madan,1982-11-24
16255,,419157,198,Ab Mcdonald,6/5/1981,Right-hand Bat,Right-arm Fast-medium,Australia,Player,Delhi Daredevils,Mumbai Indians,2010,,29,,Blank,Blank,G Gambhir,Sr Tendulkar,Kd Karthik,C Madan,1981-06-05
16257,,419157,241,Pd Collingwood,5/26/1976,Right-hand Bat,Right-arm Medium,England,Player,Delhi Daredevils,Mumbai Indians,2010,,34,,Blank,Blank,G Gambhir,Sr Tendulkar,Kd Karthik,C Madan,1976-05-26
16264,,419158,125,S Anirudha,4/14/1987,Right-hand Bat,N/a,India,Player,Chennai Super Kings,Kolkata Knight Riders,2010,,23,,Blank,Blank,Ms Dhoni,Sc Ganguly,Ms Dhoni,Wp Saha,1987-04-14
16265,,419158,185,M Vijay,4/1/1984,Right-hand Bat,Right-arm Offbreak,India,Player,Chennai Super Kings,Kolkata Knight Riders,2010,,26,,Blank,Blank,Ms Dhoni,Sc Ganguly,Ms Dhoni,Wp Saha,1984-04-01
16266,,419158,186,Sb Jakati,11/27/1980,Left-hand Bat,Slow Left-arm Orthodox,India,Player,Chennai Super Kings,Kolkata Knight Riders,2010,,30,,Blank,Blank,Ms Dhoni,Sc Ganguly,Ms Dhoni,Wp Saha,1980-11-27
16272,,419158,62,Wp Saha,10/24/1984,Right-hand Bat,N/a,India,Keeper,Kolkata Knight Riders,Chennai Super Kings,2010,,26,,Blank,Blank,Sc Ganguly,Ms Dhoni,Wp Saha,Ms Dhoni,1984-10-24
16273,,419158,63,Lr Shukla,5/6/1981,Right-hand Bat,Right-arm Medium,India,Player,Kolkata Knight Riders,Chennai Super Kings,2010,,29,,Blank,Blank,Sc Ganguly,Ms Dhoni,Wp Saha,Ms Dhoni,1981-05-06
16274,,419158,82,Ab Agarkar,12/4/1977,Right-hand Bat,Right-arm Fast,India,Player,Kolkata Knight Riders,Chennai Super Kings,2010,,33,,Blank,Blank,Sc Ganguly,Ms Dhoni,Wp Saha,Ms Dhoni,1977-12-04
16278,,419158,162,Ch Gayle,9/21/1979,Left-hand Bat,Right-arm Offbreak,West Indies,Player,Kolkata Knight Riders,Chennai Super Kings,2010,,31,,Blank,Blank,Sc Ganguly,Ms Dhoni,Wp Saha,Ms Dhoni,1979-09-21
16283,,419159,39,Sk Trivedi,9/4/1982,Right-hand Bat,Right-arm Medium,India,Player,Rajasthan Royals,Royal Challengers Bangalore,2010,,28,,Blank,Blank,Sk Warne,A Kumble,Nv Ojha,Rv Uthappa,1982-09-04
16284,,419159,160,Kamran Khan,3/10/1991,Left-hand Bat,Left-arm Medium-fast,India,Player,Rajasthan Royals,Royal Challengers Bangalore,2010,,19,,Blank,Blank,Sk Warne,A Kumble,Nv Ojha,Rv Uthappa,1991-03-10
16285,,419159,169,As Raut,3/3/1987,Right-hand Bat,Legbreak Googly,India,Player,Rajasthan Royals,Royal Challengers Bangalore,2010,,23,,Blank,Blank,Sk Warne,A Kumble,Nv Ojha,Rv Uthappa,1987-03-03
16288,,419159,224,Mj Lumb,2/12/1980,Left-hand Bat,Right-arm Medium,England,Player,Rajasthan Royals,Royal Challengers Bangalore,2010,,30,,Blank,Blank,Sk Warne,A Kumble,Nv Ojha,Rv Uthappa,1980-02-12
16289,,419159,230,Ac Voges,10/4/1979,Right-hand Bat,Slow Left-arm Orthodox,Australia,Player,Rajasthan Royals,Royal Challengers Bangalore,2010,,31,,Blank,Blank,Sk Warne,A Kumble,Nv Ojha,Rv Uthappa,1979-10-04
16292,,419159,8,V Kohli,11/5/1988,Right-hand Bat,Right-arm Medium,India,Player,Royal Challengers Bangalore,Rajasthan Royals,2010,,22,,Blank,Blank,A Kumble,Sk Warne,Rv Uthappa,Nv Ojha,1988-11-05
16295,,419159,52,Lrpl Taylor,3/8/1984,Right-hand Bat,Right-arm Offbreak,New Zealand,Player,Royal Challengers Bangalore,Rajasthan Royals,2010,,26,,Blank,Blank,A Kumble,Sk Warne,Rv Uthappa,Nv Ojha,1984-03-08
16296,,419159,75,Pankaj Singh,5/6/1985,Right-hand Bat,Right-arm Medium-fast,India,Player,Royal Challengers Bangalore,Rajasthan Royals,2010,,25,,Blank,Blank,A Kumble,Sk Warne,Rv Uthappa,Nv Ojha,1985-05-06
16297,,419159,81,R Vinay Kumar,2/12/1984,Right-hand Bat,Right-arm Medium,India,Player,Royal Challengers Bangalore,Rajasthan Royals,2010,,26,,Blank,Blank,A Kumble,Sk Warne,Rv Uthappa,Nv Ojha,1984-02-12
16299,,419159,96,Mk Pandey,9/10/1989,Right-hand Bat,Right-arm Medium,India,Player,Royal Challengers Bangalore,Rajasthan Royals,2010,,21,,Blank,Blank,A Kumble,Sk Warne,Rv Uthappa,Nv Ojha,1989-09-10
16300,,419159,124,A Kumble,10/17/1970,Right-hand Bat,Legbreak Googly,India,Captain,Royal Challengers Bangalore,Rajasthan Royals,2010,,40,,Blank,Blank,A Kumble,Sk Warne,Rv Uthappa,Nv Ojha,1970-10-17
16303,,419160,41,V Sehwag,10/20/1978,Right-hand Bat,Right-arm Offbreak,India,Player,Delhi Daredevils,Chennai Super Kings,2010,,32,,Blank,Blank,G Gambhir,Ms Dhoni,Kd Karthik,Ms Dhoni,1978-10-20
16305,,419160,88,Kd Karthik,6/1/1985,Right-hand Bat,N/a,India,Keeper,Delhi Daredevils,Chennai Super Kings,2010,,25,,Blank,Blank,G Gambhir,Ms Dhoni,Kd Karthik,Ms Dhoni,1985-06-01
16311,,419160,232,Ut Yadav,10/25/1987,Right-hand Bat,Right-arm Fast-medium,India,Player,Delhi Daredevils,Chennai Super Kings,2010,,23,,Blank,Blank,G Gambhir,Ms Dhoni,Kd Karthik,Ms Dhoni,1987-10-25
16314,,419160,19,Mek Hussey,5/27/1975,Left-hand Bat,Right-arm Medium,Australia,Player,Chennai Super Kings,Delhi Daredevils,2010,,35,,Blank,Blank,Ms Dhoni,G Gambhir,Ms Dhoni,Kd Karthik,1975-05-27
16315,,419160,20,Ms Dhoni,7/7/1981,Right-hand Bat,Right-arm Medium,India,Captainkeeper,Chennai Super Kings,Delhi Daredevils,2010,,29,,Blank,Blank,Ms Dhoni,G Gambhir,Ms Dhoni,Kd Karthik,1981-07-07
16316,,419160,21,Sk Raina,11/27/1986,Left-hand Bat,Right-arm Offbreak,India,Player,Chennai Super Kings,Delhi Daredevils,2010,,24,,Blank,Blank,Ms Dhoni,G Gambhir,Ms Dhoni,Kd Karthik,1986-11-27
16317,,419160,23,S Badrinath,8/30/1980,Right-hand Bat,Right-arm Offbreak,India,Player,Chennai Super Kings,Delhi Daredevils,2010,,30,,Blank,Blank,Ms Dhoni,G Gambhir,Ms Dhoni,Kd Karthik,1980-08-30
16319,,419160,151,L Balaji,9/27/1981,Right-hand Bat,Right-arm Medium-fast,India,Player,Chennai Super Kings,Delhi Daredevils,2010,,29,,Blank,Blank,Ms Dhoni,G Gambhir,Ms Dhoni,Kd Karthik,1981-09-27
16323,,419160,248,De Bollinger,7/24/1981,Left-hand Bat,Left-arm Fast-medium,Australia,Player,Chennai Super Kings,Delhi Daredevils,2010,,29,,Blank,Blank,Ms Dhoni,G Gambhir,Ms Dhoni,Kd Karthik,1981-07-24
16326,,419161,57,Rg Sharma,4/30/1987,Right-hand Bat,Right-arm Offbreak,India,Player,Deccan Chargers,Kings Xi Punjab,2010,,23,,Blank,Blank,Ac Gilchrist,Kc Sangakkara,Ac Gilchrist,Kc Sangakkara,1987-04-30
16327,,419161,61,Rp Singh,12/6/1985,Right-hand Bat,Left-arm Fast-medium,India,Player,Deccan Chargers,Kings Xi Punjab,2010,,25,,Blank,Blank,Ac Gilchrist,Kc Sangakkara,Ac Gilchrist,Kc Sangakkara,1985-12-06
16328,,419161,131,Pp Ojha,9/5/1986,Left-hand Bat,Slow Left-arm Orthodox,India,Player,Deccan Chargers,Kings Xi Punjab,2010,,24,,Blank,Blank,Ac Gilchrist,Kc Sangakkara,Ac Gilchrist,Kc Sangakkara,1986-09-05
16331,,419161,231,Md Mishra,2/9/1984,Right-hand Bat,Right-arm Offbreak,India,Player,Deccan Chargers,Kings Xi Punjab,2010,,26,,Blank,Blank,Ac Gilchrist,Kc Sangakkara,Ac Gilchrist,Kc Sangakkara,1984-02-09
16333,,419161,250,B Sumanth,5/10/1988,Right-hand Bat,Right-arm Medium-fast,India,Player,Deccan Chargers,Kings Xi Punjab,2010,,22,,Blank,Blank,Ac Gilchrist,Kc Sangakkara,Ac Gilchrist,Kc Sangakkara,1988-05-10
16336,,419161,26,Kc Sangakkara,10/27/1977,Left-hand Bat,Right-arm Offbreak,Sri Lanka,Captainkeeper,Kings Xi Punjab,Deccan Chargers,2010,,33,,Blank,Blank,Kc Sangakkara,Ac Gilchrist,Kc Sangakkara,Ac Gilchrist,1977-10-27
16338,,419161,29,Ik Pathan,10/27/1984,Left-hand Bat,Left-arm Medium-fast,India,Player,Kings Xi Punjab,Deccan Chargers,2010,,26,,Blank,Blank,Kc Sangakkara,Ac Gilchrist,Kc Sangakkara,Ac Gilchrist,1984-10-27
16339,,419161,64,Dpmd Jayawardene,5/27/1977,Right-hand Bat,Right-arm Medium,Sri Lanka,Player,Kings Xi Punjab,Deccan Chargers,2010,,33,,Blank,Blank,Kc Sangakkara,Ac Gilchrist,Kc Sangakkara,Ac Gilchrist,1977-05-27
16341,,419161,100,Se Marsh,7/9/1983,Left-hand Bat,Slow Left-arm Orthodox,Australia,Player,Kings Xi Punjab,Deccan Chargers,2010,,27,,Blank,Blank,Kc Sangakkara,Ac Gilchrist,Kc Sangakkara,Ac Gilchrist,1983-07-09
16348,,419162,50,Harbhajan Singh,7/3/1980,Right-hand Bat,Right-arm Offbreak,India,Player,Mumbai Indians,Royal Challengers Bangalore,2010,,30,,Blank,Blank,Sr Tendulkar,A Kumble,Ap Tare,Rv Uthappa,1980-07-03
16351,,419162,149,Crd Fernando,7/19/1979,Right-hand Bat,Right-arm Fast-medium,Sri Lanka,Player,Mumbai Indians,Royal Challengers Bangalore,2010,,31,,Blank,Blank,Sr Tendulkar,A Kumble,Ap Tare,Rv Uthappa,1979-07-19
16352,,419162,154,Jp Duminy,4/14/1984,Left-hand Bat,Right-arm Offbreak,South Africa,Player,Mumbai Indians,Royal Challengers Bangalore,2010,,26,,Blank,Blank,Sr Tendulkar,A Kumble,Ap Tare,Rv Uthappa,1984-04-14
16353,,419162,207,Ap Tare,11/7/1987,Right-hand Bat,N/a,India,Keeper,Mumbai Indians,Royal Challengers Bangalore,2010,,23,,Blank,Blank,Sr Tendulkar,A Kumble,Ap Tare,Rv Uthappa,1987-11-07
16355,,419162,210,R Mclaren,2/9/1983,Left-hand Bat,Right-arm Medium-fast,South Africa,Player,Mumbai Indians,Royal Challengers Bangalore,2010,,27,,Blank,Blank,Sr Tendulkar,A Kumble,Ap Tare,Rv Uthappa,1983-02-09
16358,,419162,8,V Kohli,11/5/1988,Right-hand Bat,Right-arm Medium,India,Player,Royal Challengers Bangalore,Mumbai Indians,2010,,22,,Blank,Blank,A Kumble,Sr Tendulkar,Rv Uthappa,Ap Tare,1988-11-05
16366,,419162,124,A Kumble,10/17/1970,Right-hand Bat,Legbreak Googly,India,Captain,Royal Challengers Bangalore,Mumbai Indians,2010,,40,,Blank,Blank,A Kumble,Sr Tendulkar,Rv Uthappa,Ap Tare,1970-10-17
16369,,419163,2,Bb Mccullum,9/27/1981,Right-hand Bat,Right-arm Medium,New Zealand,Keeper,Kolkata Knight Riders,Rajasthan Royals,2010,,29,,Blank,Blank,Sc Ganguly,Sk Warne,Bb Mccullum,Nv Ojha,1981-09-27
16370,,419163,63,Lr Shukla,5/6/1981,Right-hand Bat,Right-arm Medium,India,Player,Kolkata Knight Riders,Rajasthan Royals,2010,,29,,Blank,Blank,Sc Ganguly,Sk Warne,Bb Mccullum,Nv Ojha,1981-05-06
16371,,419163,83,M Kartik,9/11/1976,Left-hand Bat,Slow Left-arm Orthodox,India,Player,Kolkata Knight Riders,Rajasthan Royals,2010,,34,,Blank,Blank,Sc Ganguly,Sk Warne,Bb Mccullum,Nv Ojha,1976-09-11
16372,,419163,87,Mk Tiwary,11/14/1985,Right-hand Bat,Legbreak Googly,India,Player,Kolkata Knight Riders,Rajasthan Royals,2010,,25,,Blank,Blank,Sc Ganguly,Sk Warne,Bb Mccullum,Nv Ojha,1985-11-14
16375,,419163,191,Ad Mathews,6/2/1987,Right-hand Bat,Right-arm Fast-medium,Sri Lanka,Player,Kolkata Knight Riders,Rajasthan Royals,2010,,23,,Blank,Blank,Sc Ganguly,Sk Warne,Bb Mccullum,Nv Ojha,1987-06-02
16377,,419163,220,Se Bond,6/7/1975,Right-hand Bat,Right-arm Fast,New Zealand,Player,Kolkata Knight Riders,Rajasthan Royals,2010,,35,,Blank,Blank,Sc Ganguly,Sk Warne,Bb Mccullum,Nv Ojha,1975-06-07
16383,,419163,160,Kamran Khan,3/10/1991,Left-hand Bat,Left-arm Medium-fast,India,Player,Rajasthan Royals,Kolkata Knight Riders,2010,,19,,Blank,Blank,Sk Warne,Sc Ganguly,Nv Ojha,Bb Mccullum,1991-03-10
16386,,419163,212,P Dogra,11/19/1984,Right-hand Bat,Legbreak,India,Player,Rajasthan Royals,Kolkata Knight Riders,2010,,26,,Blank,Blank,Sk Warne,Sc Ganguly,Nv Ojha,Bb Mccullum,1984-11-19
16387,,419163,229,Fy Fazal,9/7/1985,Left-hand Bat,Right-arm Medium,India,Player,Rajasthan Royals,Kolkata Knight Riders,2010,,25,,Blank,Blank,Sk Warne,Sc Ganguly,Nv Ojha,Bb Mccullum,1985-09-07
16389,,419163,254,Aj Finch,11/17/1986,Right-hand Bat,Slow Left-arm Orthodox,Australia,Player,Rajasthan Royals,Kolkata Knight Riders,2010,,24,,Blank,Blank,Sk Warne,Sc Ganguly,Nv Ojha,Bb Mccullum,1986-11-17
16390,,419164,24,K Goel,12/24/1986,Left-hand Bat,Right-arm Offbreak,India,Player,Kings Xi Punjab,Chennai Super Kings,2010,,24,,Blank,Blank,Kc Sangakkara,Ms Dhoni,Kc Sangakkara,Ms Dhoni,1986-12-24
16391,,419164,26,Kc Sangakkara,10/27/1977,Left-hand Bat,Right-arm Offbreak,Sri Lanka,Captainkeeper,Kings Xi Punjab,Chennai Super Kings,2010,,33,,Blank,Blank,Kc Sangakkara,Ms Dhoni,Kc Sangakkara,Ms Dhoni,1977-10-27
16393,,419164,29,Ik Pathan,10/27/1984,Left-hand Bat,Left-arm Medium-fast,India,Player,Kings Xi Punjab,Chennai Super Kings,2010,,26,,Blank,Blank,Kc Sangakkara,Ms Dhoni,Kc Sangakkara,Ms Dhoni,1984-10-27
16394,,419164,64,Dpmd Jayawardene,5/27/1977,Right-hand Bat,Right-arm Medium,Sri Lanka,Player,Kings Xi Punjab,Chennai Super Kings,2010,,33,,Blank,Blank,Kc Sangakkara,Ms Dhoni,Kc Sangakkara,Ms Dhoni,1977-05-27
16395,,419164,65,S Sohal,11/10/1987,Right-hand Bat,Legbreak,India,Player,Kings Xi Punjab,Chennai Super Kings,2010,,23,,Blank,Blank,Kc Sangakkara,Ms Dhoni,Kc Sangakkara,Ms Dhoni,1987-11-10
16396,,419164,67,Pp Chawla,12/24/1988,Left-hand Bat,Legbreak,India,Player,Kings Xi Punjab,Chennai Super Kings,2010,,22,,Blank,Blank,Kc Sangakkara,Ms Dhoni,Kc Sangakkara,Ms Dhoni,1988-12-24
16400,,419164,233,J Theron,7/24/1985,Right-hand Bat,Right-arm Medium-fast,South Africa,Player,Kings Xi Punjab,Chennai Super Kings,2010,,25,,Blank,Blank,Kc Sangakkara,Ms Dhoni,Kc Sangakkara,Ms Dhoni,1985-07-24
16401,,419164,18,Ml Hayden,10/29/1971,Left-hand Bat,Right-arm Medium,Australia,Player,Chennai Super Kings,Kings Xi Punjab,2010,,39,,Blank,Blank,Ms Dhoni,Kc Sangakkara,Ms Dhoni,Kc Sangakkara,1971-10-29
16402,,419164,20,Ms Dhoni,7/7/1981,Right-hand Bat,Right-arm Medium,India,Captainkeeper,Chennai Super Kings,Kings Xi Punjab,2010,,29,,Blank,Blank,Ms Dhoni,Kc Sangakkara,Ms Dhoni,Kc Sangakkara,1981-07-07
16406,,419164,185,M Vijay,4/1/1984,Right-hand Bat,Right-arm Offbreak,India,Player,Chennai Super Kings,Kings Xi Punjab,2010,,26,,Blank,Blank,Ms Dhoni,Kc Sangakkara,Ms Dhoni,Kc Sangakkara,1984-04-01
16411,,419164,248,De Bollinger,7/24/1981,Left-hand Bat,Left-arm Fast-medium,Australia,Player,Chennai Super Kings,Kings Xi Punjab,2010,,29,,Blank,Blank,Ms Dhoni,Kc Sangakkara,Ms Dhoni,Kc Sangakkara,1981-07-24
16413,,419165,56,A Symonds,6/9/1975,Right-hand Bat,Right-arm Offbreak,Australia,Player,Deccan Chargers,Delhi Daredevils,2010,,35,,Blank,Blank,Ac Gilchrist,G Gambhir,Ac Gilchrist,Kd Karthik,1975-06-09
16416,,419165,131,Pp Ojha,9/5/1986,Left-hand Bat,Slow Left-arm Orthodox,India,Player,Deccan Chargers,Delhi Daredevils,2010,,24,,Blank,Blank,Ac Gilchrist,G Gambhir,Ac Gilchrist,Kd Karthik,1986-09-05
16419,,419165,235,R Sharma,4/30/1987,Right-hand Bat,Right-arm Offbreak,India,Player,Deccan Chargers,Delhi Daredevils,2010,,23,,Blank,Blank,Ac Gilchrist,G Gambhir,Ac Gilchrist,Kd Karthik,1987-04-30
16420,,419165,250,B Sumanth,5/10/1988,Right-hand Bat,Right-arm Medium-fast,India,Player,Deccan Chargers,Delhi Daredevils,2010,,22,,Blank,Blank,Ac Gilchrist,G Gambhir,Ac Gilchrist,Kd Karthik,1988-05-10
16424,,419165,41,V Sehwag,10/20/1978,Right-hand Bat,Right-arm Offbreak,India,Player,Delhi Daredevils,Deccan Chargers,2010,,32,,Blank,Blank,G Gambhir,Ac Gilchrist,Kd Karthik,Ac Gilchrist,1978-10-20
16429,,419165,171,M Manhas,10/12/1979,Right-hand Bat,Right-arm Offbreak,India,Player,Delhi Daredevils,Deccan Chargers,2010,,31,,Blank,Blank,G Gambhir,Ac Gilchrist,Kd Karthik,Ac Gilchrist,1979-10-12
16431,,419165,223,Dp Nannes,5/16/1976,Right-hand Bat,Left-arm Fast,Australia,Player,Delhi Daredevils,Deccan Chargers,2010,,34,,Blank,Blank,G Gambhir,Ac Gilchrist,Kd Karthik,Ac Gilchrist,1976-05-16
16443,,419166,255,Str Binny,6/3/1984,Right-hand Bat,Right-arm Medium,India,Player,Mumbai Indians,Kolkata Knight Riders,2010,,26,,Blank,Blank,Dj Bravo,Sc Ganguly,Ap Tare,Wp Saha,1984-06-03
16445,,419166,1,Sc Ganguly,7/8/1972,Left-hand Bat,Right-arm Medium,India,Captain,Kolkata Knight Riders,Mumbai Indians,2010,,38,,Blank,Blank,Sc Ganguly,Dj Bravo,Wp Saha,Ap Tare,1972-07-08
16446,,419166,2,Bb Mccullum,9/27/1981,Right-hand Bat,Right-arm Medium,New Zealand,Player,Kolkata Knight Riders,Mumbai Indians,2010,,29,,Blank,Blank,Sc Ganguly,Dj Bravo,Wp Saha,Ap Tare,1981-09-27
16450,,419166,87,Mk Tiwary,11/14/1985,Right-hand Bat,Legbreak Googly,India,Player,Kolkata Knight Riders,Mumbai Indians,2010,,25,,Blank,Blank,Sc Ganguly,Dj Bravo,Wp Saha,Ap Tare,1985-11-14
16452,,419166,191,Ad Mathews,6/2/1987,Right-hand Bat,Right-arm Fast-medium,Sri Lanka,Player,Kolkata Knight Riders,Mumbai Indians,2010,,23,,Blank,Blank,Sc Ganguly,Dj Bravo,Wp Saha,Ap Tare,1987-06-02
16455,,419166,346,Jd Unadkat,10/18/1991,Right-hand Bat,Left-arm Medium,India,Player,Kolkata Knight Riders,Mumbai Indians,2010,,19,,Blank,Blank,Sc Ganguly,Dj Bravo,Wp Saha,Ap Tare,1991-10-18
16457,,419167,42,S Dhawan,12/5/1985,Left-hand Bat,Right-arm Offbreak,India,Player,Mumbai Indians,Royal Challengers Bangalore,2010,,25,,Blank,Blank,Sr Tendulkar,A Kumble,At Rayudu,Rv Uthappa,1985-12-05
16458,,419167,48,Am Nayar,10/8/1983,Left-hand Bat,Right-arm Medium,India,Player,Mumbai Indians,Royal Challengers Bangalore,2010,,27,,Blank,Blank,Sr Tendulkar,A Kumble,At Rayudu,Rv Uthappa,1983-10-08
16459,,419167,50,Harbhajan Singh,7/3/1980,Right-hand Bat,Right-arm Offbreak,India,Player,Mumbai Indians,Royal Challengers Bangalore,2010,,30,,Blank,Blank,Sr Tendulkar,A Kumble,At Rayudu,Rv Uthappa,1980-07-03
16460,,419167,79,Ss Tiwary,12/30/1989,Left-hand Bat,N/a,India,Player,Mumbai Indians,Royal Challengers Bangalore,2010,,21,,Blank,Blank,Sr Tendulkar,A Kumble,At Rayudu,Rv Uthappa,1989-12-30
16461,,419167,133,Sr Tendulkar,4/24/1973,Right-hand Bat,Right-arm Offbreak,India,Captain,Mumbai Indians,Royal Challengers Bangalore,2010,,37,,Blank,Blank,Sr Tendulkar,A Kumble,At Rayudu,Rv Uthappa,1973-04-24
16464,,419167,194,Sl Malinga,8/28/1983,Right-hand Bat,Right-arm Fast,Sri Lanka,Player,Mumbai Indians,Royal Challengers Bangalore,2010,,27,,Blank,Blank,Sr Tendulkar,A Kumble,At Rayudu,Rv Uthappa,1983-08-28
16467,,419167,6,R Dravid,1/11/1973,Right-hand Bat,Right-arm Offbreak,India,Player,Royal Challengers Bangalore,Mumbai Indians,2010,,37,,Blank,Blank,A Kumble,Sr Tendulkar,Rv Uthappa,At Rayudu,1973-01-11
16469,,419167,9,Jh Kallis,10/16/1975,Right-hand Bat,Right-arm Fast-medium,South Africa,Player,Royal Challengers Bangalore,Mumbai Indians,2010,,35,,Blank,Blank,A Kumble,Sr Tendulkar,Rv Uthappa,At Rayudu,1975-10-16
16470,,419167,14,P Kumar,10/2/1986,Right-hand Bat,Right-arm Medium,India,Player,Royal Challengers Bangalore,Mumbai Indians,2010,,24,,Blank,Blank,A Kumble,Sr Tendulkar,Rv Uthappa,At Rayudu,1986-10-02
16473,,419167,81,R Vinay Kumar,2/12/1984,Right-hand Bat,Right-arm Medium,India,Player,Royal Challengers Bangalore,Mumbai Indians,2010,,26,,Blank,Blank,A Kumble,Sr Tendulkar,Rv Uthappa,At Rayudu,1984-02-12
16475,,419167,96,Mk Pandey,9/10/1989,Right-hand Bat,Right-arm Medium,India,Player,Royal Challengers Bangalore,Mumbai Indians,2010,,21,,Blank,Blank,A Kumble,Sr Tendulkar,Rv Uthappa,At Rayudu,1989-09-10
16476,,419167,124,A Kumble,10/17/1970,Right-hand Bat,Legbreak Googly,India,Captain,Royal Challengers Bangalore,Mumbai Indians,2010,,40,,Blank,Blank,A Kumble,Sr Tendulkar,Rv Uthappa,At Rayudu,1970-10-17
16483,,419168,131,Pp Ojha,9/5/1986,Left-hand Bat,Slow Left-arm Orthodox,India,Player,Deccan Chargers,Chennai Super Kings,2010,,24,,Blank,Blank,Ac Gilchrist,Ms Dhoni,Ac Gilchrist,Ms Dhoni,1986-09-05
16491,,419168,21,Sk Raina,11/27/1986,Left-hand Bat,Right-arm Offbreak,India,Player,Chennai Super Kings,Deccan Chargers,2010,,24,,Blank,Blank,Ms Dhoni,Ac Gilchrist,Ms Dhoni,Ac Gilchrist,1986-11-27
16495,,419168,125,S Anirudha,4/14/1987,Right-hand Bat,N/a,India,Player,Chennai Super Kings,Deccan Chargers,2010,,23,,Blank,Blank,Ms Dhoni,Ac Gilchrist,Ms Dhoni,Ac Gilchrist,1987-04-14
16500,,419169,53,Ac Gilchrist,11/14/1971,Left-hand Bat,Right-arm Offbreak,Australia,Captainkeeper,Deccan Chargers,Royal Challengers Bangalore,2010,,39,,Blank,Blank,Ac Gilchrist,A Kumble,Ac Gilchrist,Rv Uthappa,1971-11-14
16503,,419169,57,Rg Sharma,4/30/1987,Right-hand Bat,Right-arm Offbreak,India,Player,Deccan Chargers,Royal Challengers Bangalore,2010,,23,,Blank,Blank,Ac Gilchrist,A Kumble,Ac Gilchrist,Rv Uthappa,1987-04-30
16505,,419169,147,Dr Smith,4/12/1983,Right-hand Bat,Right-arm Medium,West Indies,Player,Deccan Chargers,Royal Challengers Bangalore,2010,,27,,Blank,Blank,Ac Gilchrist,A Kumble,Ac Gilchrist,Rv Uthappa,1983-04-12
16506,,419169,188,Rj Harris,10/11/1979,Right-hand Bat,Right-arm Fast,Australia,Player,Deccan Chargers,Royal Challengers Bangalore,2010,,31,,Blank,Blank,Ac Gilchrist,A Kumble,Ac Gilchrist,Rv Uthappa,1979-10-11
16507,,419169,205,Anirudh Singh,8/2/1980,Left-hand Bat,Right-arm Medium,India,Player,Deccan Chargers,Royal Challengers Bangalore,2010,,30,,Blank,Blank,Ac Gilchrist,A Kumble,Ac Gilchrist,Rv Uthappa,1980-08-02
16509,,419169,235,R Sharma,4/30/1987,Right-hand Bat,Right-arm Offbreak,India,Player,Deccan Chargers,Royal Challengers Bangalore,2010,,23,,Blank,Blank,Ac Gilchrist,A Kumble,Ac Gilchrist,Rv Uthappa,1987-04-30
16510,,419169,256,Harmeet Singh,9/7/1992,Left-hand Bat,Slow Left-arm Orthodox,India,Player,Deccan Chargers,Royal Challengers Bangalore,2010,,18,,Blank,Blank,Ac Gilchrist,A Kumble,Ac Gilchrist,Rv Uthappa,1992-09-07
16512,,419169,8,V Kohli,11/5/1988,Right-hand Bat,Right-arm Medium,India,Player,Royal Challengers Bangalore,Deccan Chargers,2010,,22,,Blank,Blank,A Kumble,Ac Gilchrist,Rv Uthappa,Ac Gilchrist,1988-11-05
16513,,419169,9,Jh Kallis,10/16/1975,Right-hand Bat,Right-arm Fast-medium,South Africa,Player,Royal Challengers Bangalore,Deccan Chargers,2010,,35,,Blank,Blank,A Kumble,Ac Gilchrist,Rv Uthappa,Ac Gilchrist,1975-10-16
16515,,419169,12,B Akhil,10/7/1977,Right-hand Bat,Right-arm Medium-fast,India,Player,Royal Challengers Bangalore,Deccan Chargers,2010,,33,,Blank,Blank,A Kumble,Ac Gilchrist,Rv Uthappa,Ac Gilchrist,1977-10-07
16516,,419169,14,P Kumar,10/2/1986,Right-hand Bat,Right-arm Medium,India,Player,Royal Challengers Bangalore,Deccan Chargers,2010,,24,,Blank,Blank,A Kumble,Ac Gilchrist,Rv Uthappa,Ac Gilchrist,1986-10-02
16526,,419170,79,Ss Tiwary,12/30/1989,Left-hand Bat,N/a,India,Player,Mumbai Indians,Chennai Super Kings,2010,,21,,Blank,Blank,Sr Tendulkar,Ms Dhoni,At Rayudu,Ms Dhoni,1989-12-30
16532,,419170,221,Ka Pollard,5/12/1987,Right-hand Bat,Right-arm Medium-fast,West Indies,Player,Mumbai Indians,Chennai Super Kings,2010,,23,,Blank,Blank,Sr Tendulkar,Ms Dhoni,At Rayudu,Ms Dhoni,1987-05-12
16533,,419170,18,Ml Hayden,10/29/1971,Left-hand Bat,Right-arm Medium,Australia,Player,Chennai Super Kings,Mumbai Indians,2010,,39,,Blank,Blank,Ms Dhoni,Sr Tendulkar,Ms Dhoni,At Rayudu,1971-10-29
16534,,419170,20,Ms Dhoni,7/7/1981,Right-hand Bat,Right-arm Medium,India,Captainkeeper,Chennai Super Kings,Mumbai Indians,2010,,29,,Blank,Blank,Ms Dhoni,Sr Tendulkar,Ms Dhoni,At Rayudu,1981-07-07
16536,,419170,23,S Badrinath,8/30/1980,Right-hand Bat,Right-arm Offbreak,India,Player,Chennai Super Kings,Mumbai Indians,2010,,30,,Blank,Blank,Ms Dhoni,Sr Tendulkar,Ms Dhoni,At Rayudu,1980-08-30
16539,,419170,125,S Anirudha,4/14/1987,Right-hand Bat,N/a,India,Player,Chennai Super Kings,Mumbai Indians,2010,,23,,Blank,Blank,Ms Dhoni,Sr Tendulkar,Ms Dhoni,At Rayudu,1987-04-14
16540,,419170,185,M Vijay,4/1/1984,Right-hand Bat,Right-arm Offbreak,India,Player,Chennai Super Kings,Mumbai Indians,2010,,26,,Blank,Blank,Ms Dhoni,Sr Tendulkar,Ms Dhoni,At Rayudu,1984-04-01
16541,,419170,186,Sb Jakati,11/27/1980,Left-hand Bat,Slow Left-arm Orthodox,India,Player,Chennai Super Kings,Mumbai Indians,2010,,30,,Blank,Blank,Ms Dhoni,Sr Tendulkar,Ms Dhoni,At Rayudu,1980-11-27
16543,,419170,248,De Bollinger,7/24/1981,Left-hand Bat,Left-arm Fast-medium,Australia,Player,Chennai Super Kings,Mumbai Indians,2010,,29,,Blank,Blank,Ms Dhoni,Sr Tendulkar,Ms Dhoni,At Rayudu,1981-07-24
16544,,501203,9,Jh Kallis,10/16/1975,Right-hand Bat,Right-arm Fast-medium,South Africa,Player,Kolkata Knight Riders,Chennai Super Kings,2011,,36,,Blank,Blank,G Gambhir,Ms Dhoni,Ms Bisla,Ms Dhoni,1975-10-16
16545,,501203,31,Yk Pathan,11/17/1982,Right-hand Bat,Right-arm Offbreak,India,Player,Kolkata Knight Riders,Chennai Super Kings,2011,,29,,Blank,Blank,G Gambhir,Ms Dhoni,Ms Bisla,Ms Dhoni,1982-11-17
16547,,501203,63,Lr Shukla,5/6/1981,Right-hand Bat,Right-arm Medium,India,Player,Kolkata Knight Riders,Chennai Super Kings,2011,,30,,Blank,Blank,G Gambhir,Ms Dhoni,Ms Bisla,Ms Dhoni,1981-05-06
16549,,501203,89,R Bhatia,10/22/1979,Right-hand Bat,Right-arm Medium-fast,India,Player,Kolkata Knight Riders,Chennai Super Kings,2011,,32,,Blank,Blank,G Gambhir,Ms Dhoni,Ms Bisla,Ms Dhoni,1979-10-22
16552,,501203,214,Ms Bisla,12/27/1984,Right-hand Bat,N/a,India,Keeper,Kolkata Knight Riders,Chennai Super Kings,2011,,27,,Blank,Blank,G Gambhir,Ms Dhoni,Ms Bisla,Ms Dhoni,1984-12-27
16553,,501203,216,Ejg Morgan,9/10/1986,Left-hand Bat,Right-arm Medium,England,Player,Kolkata Knight Riders,Chennai Super Kings,2011,,25,,Blank,Blank,G Gambhir,Ms Dhoni,Ms Bisla,Ms Dhoni,1986-09-10
16554,,501203,222,S Ladda,7/10/1986,Right-hand Bat,Legbreak,India,Player,Kolkata Knight Riders,Chennai Super Kings,2011,,25,,Blank,Blank,G Gambhir,Ms Dhoni,Ms Bisla,Ms Dhoni,1986-07-10
16558,,501203,58,Sb Styris,7/10/1975,Right-hand Bat,Right-arm Medium,New Zealand,Player,Chennai Super Kings,Kolkata Knight Riders,2011,,36,,Blank,Blank,Ms Dhoni,G Gambhir,Ms Dhoni,Ms Bisla,1975-07-10
16561,,501203,185,M Vijay,4/1/1984,Right-hand Bat,Right-arm Offbreak,India,Player,Chennai Super Kings,Kolkata Knight Riders,2011,,27,,Blank,Blank,Ms Dhoni,G Gambhir,Ms Dhoni,Ms Bisla,1984-04-01
16564,,501203,278,S Randiv,1/30/1985,Right-hand Bat,Right-arm Offbreak,Sri Lanka,Player,Chennai Super Kings,Kolkata Knight Riders,2011,,26,,Blank,Blank,Ms Dhoni,G Gambhir,Ms Dhoni,Ms Bisla,1985-01-30
16565,,501203,377,Tg Southee,12/11/1988,Right-hand Bat,Right-arm Medium-fast,New Zealand,Player,Chennai Super Kings,Kolkata Knight Riders,2011,,23,,Blank,Blank,Ms Dhoni,G Gambhir,Ms Dhoni,Ms Bisla,1988-12-11
16571,,501204,169,As Raut,3/3/1987,Right-hand Bat,Legbreak Googly,India,Player,Rajasthan Royals,Deccan Chargers,2011,,24,,Blank,Blank,Sk Warne,Kc Sangakkara,Ag Paunikar,Kc Sangakkara,1987-03-03
16573,,501204,196,A Singh,6/21/1981,Right-hand Bat,Right-arm Medium-fast,India,Player,Rajasthan Royals,Deccan Chargers,2011,,30,,Blank,Blank,Sk Warne,Kc Sangakkara,Ag Paunikar,Kc Sangakkara,1981-06-21
16574,,501204,252,Ag Paunikar,4/18/1988,Right-hand Bat,N/a,India,Keeper,Rajasthan Royals,Deccan Chargers,2011,,23,,Blank,Blank,Sk Warne,Kc Sangakkara,Ag Paunikar,Kc Sangakkara,1988-04-18
16576,,501204,266,Al Menaria,10/29/1990,Left-hand Bat,Slow Left-arm Orthodox,India,Player,Rajasthan Royals,Deccan Chargers,2011,,21,,Blank,Blank,Sk Warne,Kc Sangakkara,Ag Paunikar,Kc Sangakkara,1990-10-29
16578,,501204,42,S Dhawan,12/5/1985,Left-hand Bat,Right-arm Offbreak,India,Player,Deccan Chargers,Rajasthan Royals,2011,,26,,Blank,Blank,Kc Sangakkara,Sk Warne,Kc Sangakkara,Ag Paunikar,1985-12-05
16580,,501204,93,B Chipli,1/27/1983,Right-hand Bat,Right-arm Medium,India,Player,Deccan Chargers,Rajasthan Royals,2011,,28,,Blank,Blank,Kc Sangakkara,Sk Warne,Kc Sangakkara,Ag Paunikar,1983-01-27
16584,,501204,136,A Mishra,11/24/1982,Right-hand Bat,Legbreak,India,Player,Deccan Chargers,Rajasthan Royals,2011,,29,,Blank,Blank,Kc Sangakkara,Sk Warne,Kc Sangakkara,Ag Paunikar,1982-11-24
16587,,501204,258,Dt Christian,5/4/1983,Right-hand Bat,Right-arm Fast-medium,Australia,Player,Deccan Chargers,Rajasthan Royals,2011,,28,,Blank,Blank,Kc Sangakkara,Sk Warne,Kc Sangakkara,Ag Paunikar,1983-05-04
16591,,501205,110,Ab De Villiers,2/17/1984,Right-hand Bat,Right-arm Medium,South Africa,Keeper,Royal Challengers Bangalore,Kochi Tuskers Kerala,2011,,27,,Blank,Blank,Dl Vettori,Dpmd Jayawardene,Ab De Villiers,Pa Patel,1984-02-17
16592,,501205,135,Tm Dilshan,10/14/1976,Right-hand Bat,Right-arm Offbreak,Sri Lanka,Player,Royal Challengers Bangalore,Kochi Tuskers Kerala,2011,,35,,Blank,Blank,Dl Vettori,Dpmd Jayawardene,Ab De Villiers,Pa Patel,1976-10-14
16595,,501205,223,Dp Nannes,5/16/1976,Right-hand Bat,Left-arm Fast,Australia,Player,Royal Challengers Bangalore,Kochi Tuskers Kerala,2011,,35,,Blank,Blank,Dl Vettori,Dpmd Jayawardene,Ab De Villiers,Pa Patel,1976-05-16
16597,,501205,260,Ma Agarwal,2/16/1991,Right-hand Bat,N/a,India,Player,Royal Challengers Bangalore,Kochi Tuskers Kerala,2011,,20,,Blank,Blank,Dl Vettori,Dpmd Jayawardene,Ab De Villiers,Pa Patel,1991-02-16
16601,,501205,35,Ra Jadeja,12/6/1988,Left-hand Bat,Slow Left-arm Orthodox,India,Player,Kochi Tuskers Kerala,Royal Challengers Bangalore,2011,,23,,Blank,Blank,Dpmd Jayawardene,Dl Vettori,Pa Patel,Ab De Villiers,1988-12-06
16605,,501205,77,S Sreesanth,2/6/1983,Right-hand Bat,Right-arm Fast-medium,India,Player,Kochi Tuskers Kerala,Royal Challengers Bangalore,2011,,28,,Blank,Blank,Dpmd Jayawardene,Dl Vettori,Pa Patel,Ab De Villiers,1983-02-06
16608,,501205,121,M Muralitharan,4/17/1972,Right-hand Bat,Right-arm Offbreak,Sri Lanka,Player,Kochi Tuskers Kerala,Royal Challengers Bangalore,2011,,39,,Blank,Blank,Dpmd Jayawardene,Dl Vettori,Pa Patel,Ab De Villiers,1972-04-17
16609,,501205,259,Rv Gomez,10/16/1985,Right-hand Bat,Right-arm Medium,India,Player,Kochi Tuskers Kerala,Royal Challengers Bangalore,2011,,26,,Blank,Blank,Dpmd Jayawardene,Dl Vettori,Pa Patel,Ab De Villiers,1985-10-16
16610,,501206,50,Harbhajan Singh,7/3/1980,Right-hand Bat,Right-arm Offbreak,India,Player,Mumbai Indians,Delhi Daredevils,2011,,31,,Blank,Blank,Sr Tendulkar,V Sehwag,Dj Jacobs,Nv Ojha,1980-07-03
16612,,501206,126,Mm Patel,7/12/1983,Right-hand Bat,Right-arm Medium-fast,India,Player,Mumbai Indians,Delhi Daredevils,2011,,28,,Blank,Blank,Sr Tendulkar,V Sehwag,Dj Jacobs,Nv Ojha,1983-07-12
16613,,501206,133,Sr Tendulkar,4/24/1973,Right-hand Bat,Right-arm Offbreak,India,Captain,Mumbai Indians,Delhi Daredevils,2011,,38,,Blank,Blank,Sr Tendulkar,V Sehwag,Dj Jacobs,Nv Ojha,1973-04-24
16622,,501206,41,V Sehwag,10/20/1978,Right-hand Bat,Right-arm Offbreak,India,Captain,Delhi Daredevils,Mumbai Indians,2011,,33,,Blank,Blank,V Sehwag,Sr Tendulkar,Nv Ojha,Dj Jacobs,1978-10-20
16626,,501206,183,Nv Ojha,7/20/1983,Right-hand Bat,N/a,India,Keeper,Delhi Daredevils,Mumbai Indians,2011,,28,,Blank,Blank,V Sehwag,Sr Tendulkar,Nv Ojha,Dj Jacobs,1983-07-20
16627,,501206,187,Da Warner,10/27/1986,Left-hand Bat,Legbreak,Australia,Player,Delhi Daredevils,Mumbai Indians,2011,,25,,Blank,Blank,V Sehwag,Sr Tendulkar,Nv Ojha,Dj Jacobs,1986-10-27
16628,,501206,190,M Morkel,10/6/1984,Left-hand Bat,Right-arm Fast,South Africa,Player,Delhi Daredevils,Mumbai Indians,2011,,27,,Blank,Blank,V Sehwag,Sr Tendulkar,Nv Ojha,Dj Jacobs,1984-10-06
16631,,501206,262,Ubt Chand,3/26/1993,Right-hand Bat,Right-arm Offbreak,India,Player,Delhi Daredevils,Mumbai Indians,2011,,18,,Blank,Blank,V Sehwag,Sr Tendulkar,Nv Ojha,Dj Jacobs,1993-03-26
16634,,501207,53,Ac Gilchrist,11/14/1971,Left-hand Bat,Right-arm Offbreak,Australia,Captainkeeper,Kings Xi Punjab,Pune Warriors,2011,,40,,Blank,Blank,Ac Gilchrist,Yuvraj Singh,Ac Gilchrist,Rv Uthappa,1971-11-14
16637,,501207,100,Se Marsh,7/9/1983,Left-hand Bat,Slow Left-arm Orthodox,Australia,Player,Kings Xi Punjab,Pune Warriors,2011,,28,,Blank,Blank,Ac Gilchrist,Yuvraj Singh,Ac Gilchrist,Rv Uthappa,1983-07-09
16640,,501207,264,Sunny Singh,12/18/1986,Right-hand Bat,Right-arm Medium-fast,India,Player,Kings Xi Punjab,Pune Warriors,2011,,25,,Blank,Blank,Ac Gilchrist,Yuvraj Singh,Ac Gilchrist,Rv Uthappa,1986-12-18
16643,,501207,27,Yuvraj Singh,12/12/1981,Left-hand Bat,Slow Left-arm Orthodox,India,Captain,Pune Warriors,Kings Xi Punjab,2011,,30,,Blank,Blank,Yuvraj Singh,Ac Gilchrist,Rv Uthappa,Ac Gilchrist,1981-12-12
16645,,501207,74,Gc Smith,2/1/1981,Left-hand Bat,Right-arm Offbreak,South Africa,Player,Pune Warriors,Kings Xi Punjab,2011,,30,,Blank,Blank,Yuvraj Singh,Ac Gilchrist,Rv Uthappa,Ac Gilchrist,1981-02-01
16648,,501207,171,M Manhas,10/12/1979,Right-hand Bat,Right-arm Offbreak,India,Player,Pune Warriors,Kings Xi Punjab,2011,,32,,Blank,Blank,Yuvraj Singh,Ac Gilchrist,Rv Uthappa,Ac Gilchrist,1979-10-12
16649,,501207,231,Md Mishra,2/9/1984,Right-hand Bat,Right-arm Offbreak,India,Player,Pune Warriors,Kings Xi Punjab,2011,,27,,Blank,Blank,Yuvraj Singh,Ac Gilchrist,Rv Uthappa,Ac Gilchrist,1984-02-09
16653,,501207,274,Ac Thomas,2/9/1977,Right-hand Bat,Right-arm Fast-medium,England,Player,Pune Warriors,Kings Xi Punjab,2011,,34,,Blank,Blank,Yuvraj Singh,Ac Gilchrist,Rv Uthappa,Ac Gilchrist,1977-02-09
16655,,501208,42,S Dhawan,12/5/1985,Left-hand Bat,Right-arm Offbreak,India,Player,Deccan Chargers,Kolkata Knight Riders,2011,,26,,Blank,Blank,Kc Sangakkara,G Gambhir,Kc Sangakkara,Ms Bisla,1985-12-05
16657,,501208,93,B Chipli,1/27/1983,Right-hand Bat,Right-arm Medium,India,Player,Deccan Chargers,Kolkata Knight Riders,2011,,28,,Blank,Blank,Kc Sangakkara,G Gambhir,Kc Sangakkara,Ms Bisla,1983-01-27
16664,,501208,258,Dt Christian,5/4/1983,Right-hand Bat,Right-arm Fast-medium,Australia,Player,Deccan Chargers,Kolkata Knight Riders,2011,,28,,Blank,Blank,Kc Sangakkara,G Gambhir,Kc Sangakkara,Ms Bisla,1983-05-04
16666,,501208,31,Yk Pathan,11/17/1982,Right-hand Bat,Right-arm Offbreak,India,Player,Kolkata Knight Riders,Deccan Chargers,2011,,29,,Blank,Blank,G Gambhir,Kc Sangakkara,Ms Bisla,Kc Sangakkara,1982-11-17
16668,,501208,87,Mk Tiwary,11/14/1985,Right-hand Bat,Legbreak Googly,India,Player,Kolkata Knight Riders,Deccan Chargers,2011,,26,,Blank,Blank,G Gambhir,Kc Sangakkara,Ms Bisla,Kc Sangakkara,1985-11-14
16671,,501208,151,L Balaji,9/27/1981,Right-hand Bat,Right-arm Medium-fast,India,Player,Kolkata Knight Riders,Deccan Chargers,2011,,30,,Blank,Blank,G Gambhir,Kc Sangakkara,Ms Bisla,Kc Sangakkara,1981-09-27
16678,,501209,39,Sk Trivedi,9/4/1982,Right-hand Bat,Right-arm Medium,India,Player,Rajasthan Royals,Delhi Daredevils,2011,,29,,Blank,Blank,Sk Warne,V Sehwag,Ag Paunikar,Nv Ojha,1982-09-04
16680,,501209,85,Am Rahane,6/6/1988,Right-hand Bat,Right-arm Medium,India,Player,Rajasthan Royals,Delhi Daredevils,2011,,23,,Blank,Blank,Sk Warne,V Sehwag,Ag Paunikar,Nv Ojha,1988-06-06
16682,,501209,192,J Botha,5/2/1982,Right-hand Bat,Right-arm Offbreak,South Africa,Player,Rajasthan Royals,Delhi Daredevils,2011,,29,,Blank,Blank,Sk Warne,V Sehwag,Ag Paunikar,Nv Ojha,1982-05-02
16684,,501209,238,Sw Tait,2/22/1983,Right-hand Bat,Right-arm Fast,Australia,Player,Rajasthan Royals,Delhi Daredevils,2011,,28,,Blank,Blank,Sk Warne,V Sehwag,Ag Paunikar,Nv Ojha,1983-02-22
16685,,501209,252,Ag Paunikar,4/18/1988,Right-hand Bat,N/a,India,Keeper,Rajasthan Royals,Delhi Daredevils,2011,,23,,Blank,Blank,Sk Warne,V Sehwag,Ag Paunikar,Nv Ojha,1988-04-18
16687,,501209,29,Ik Pathan,10/27/1984,Left-hand Bat,Left-arm Medium-fast,India,Player,Delhi Daredevils,Rajasthan Royals,2011,,27,,Blank,Blank,V Sehwag,Sk Warne,Nv Ojha,Ag Paunikar,1984-10-27
16688,,501209,41,V Sehwag,10/20/1978,Right-hand Bat,Right-arm Offbreak,India,Captain,Delhi Daredevils,Rajasthan Royals,2011,,33,,Blank,Blank,V Sehwag,Sk Warne,Nv Ojha,Ag Paunikar,1978-10-20
16693,,501209,187,Da Warner,10/27/1986,Left-hand Bat,Legbreak,Australia,Player,Delhi Daredevils,Rajasthan Royals,2011,,25,,Blank,Blank,V Sehwag,Sk Warne,Nv Ojha,Ag Paunikar,1986-10-27
16694,,501209,190,M Morkel,10/6/1984,Left-hand Bat,Right-arm Fast,South Africa,Player,Delhi Daredevils,Rajasthan Royals,2011,,27,,Blank,Blank,V Sehwag,Sk Warne,Nv Ojha,Ag Paunikar,1984-10-06
16695,,501209,254,Aj Finch,11/17/1986,Right-hand Bat,Slow Left-arm Orthodox,Australia,Player,Delhi Daredevils,Rajasthan Royals,2011,,25,,Blank,Blank,V Sehwag,Sk Warne,Nv Ojha,Ag Paunikar,1986-11-17
16697,,501209,293,S Nadeem,8/12/1989,Right-hand Bat,Slow Left-arm Orthodox,India,Player,Delhi Daredevils,Rajasthan Royals,2011,,22,,Blank,Blank,V Sehwag,Sk Warne,Nv Ojha,Ag Paunikar,1989-08-12
16698,,501210,8,V Kohli,11/5/1988,Right-hand Bat,Right-arm Medium,India,Player,Royal Challengers Bangalore,Mumbai Indians,2011,,23,,Blank,Blank,Dl Vettori,Sr Tendulkar,Ab De Villiers,Dj Jacobs,1988-11-05
16699,,501210,15,Z Khan,10/7/1978,Right-hand Bat,Left-arm Fast-medium,India,Player,Royal Challengers Bangalore,Mumbai Indians,2011,,33,,Blank,Blank,Dl Vettori,Sr Tendulkar,Ab De Villiers,Dj Jacobs,1978-10-07
16706,,501210,244,A Mithun,10/25/1989,Right-hand Bat,Right-arm Medium,India,Player,Royal Challengers Bangalore,Mumbai Indians,2011,,22,,Blank,Blank,Dl Vettori,Sr Tendulkar,Ab De Villiers,Dj Jacobs,1989-10-25
16707,,501210,260,Ma Agarwal,2/16/1991,Right-hand Bat,N/a,India,Player,Royal Challengers Bangalore,Mumbai Indians,2011,,20,,Blank,Blank,Dl Vettori,Sr Tendulkar,Ab De Villiers,Dj Jacobs,1991-02-16
16716,,501210,221,Ka Pollard,5/12/1987,Right-hand Bat,Right-arm Medium-fast,West Indies,Player,Mumbai Indians,Royal Challengers Bangalore,2011,,24,,Blank,Blank,Sr Tendulkar,Dl Vettori,Dj Jacobs,Ab De Villiers,1987-05-12
16719,,501210,286,Ag Murtaza,1/1/1990,Left-hand Bat,Slow Left-arm Orthodox,India,Player,Mumbai Indians,Royal Challengers Bangalore,2011,,21,,Blank,Blank,Sr Tendulkar,Dl Vettori,Dj Jacobs,Ab De Villiers,1990-01-01
16720,,501211,14,P Kumar,10/2/1986,Right-hand Bat,Right-arm Medium,India,Player,Kings Xi Punjab,Chennai Super Kings,2011,,25,,Blank,Blank,Ac Gilchrist,Ms Dhoni,Ac Gilchrist,Ms Dhoni,1986-10-02
16721,,501211,48,Am Nayar,10/8/1983,Left-hand Bat,Right-arm Medium,India,Player,Kings Xi Punjab,Chennai Super Kings,2011,,28,,Blank,Blank,Ac Gilchrist,Ms Dhoni,Ac Gilchrist,Ms Dhoni,1983-10-08
16724,,501211,88,Kd Karthik,6/1/1985,Right-hand Bat,N/a,India,Player,Kings Xi Punjab,Chennai Super Kings,2011,,26,,Blank,Blank,Ac Gilchrist,Ms Dhoni,Ac Gilchrist,Ms Dhoni,1985-06-01
16726,,501211,167,Pc Valthaty,12/7/1983,Right-hand Bat,Right-arm Medium,India,Player,Kings Xi Punjab,Chennai Super Kings,2011,,28,,Blank,Blank,Ac Gilchrist,Ms Dhoni,Ac Gilchrist,Ms Dhoni,1983-12-07
16728,,501211,210,R Mclaren,2/9/1983,Left-hand Bat,Right-arm Medium-fast,South Africa,Player,Kings Xi Punjab,Chennai Super Kings,2011,,28,,Blank,Blank,Ac Gilchrist,Ms Dhoni,Ac Gilchrist,Ms Dhoni,1983-02-09
16732,,501211,21,Sk Raina,11/27/1986,Left-hand Bat,Right-arm Offbreak,India,Player,Chennai Super Kings,Kings Xi Punjab,2011,,25,,Blank,Blank,Ms Dhoni,Ac Gilchrist,Ms Dhoni,Ac Gilchrist,1986-11-27
16733,,501211,23,S Badrinath,8/30/1980,Right-hand Bat,Right-arm Offbreak,India,Player,Chennai Super Kings,Kings Xi Punjab,2011,,31,,Blank,Blank,Ms Dhoni,Ac Gilchrist,Ms Dhoni,Ac Gilchrist,1980-08-30
16736,,501211,125,S Anirudha,4/14/1987,Right-hand Bat,N/a,India,Player,Chennai Super Kings,Kings Xi Punjab,2011,,24,,Blank,Blank,Ms Dhoni,Ac Gilchrist,Ms Dhoni,Ac Gilchrist,1987-04-14
16738,,501211,186,Sb Jakati,11/27/1980,Left-hand Bat,Slow Left-arm Orthodox,India,Player,Chennai Super Kings,Kings Xi Punjab,2011,,31,,Blank,Blank,Ms Dhoni,Ac Gilchrist,Ms Dhoni,Ac Gilchrist,1980-11-27
16741,,501211,377,Tg Southee,12/11/1988,Right-hand Bat,Right-arm Medium-fast,New Zealand,Player,Chennai Super Kings,Kings Xi Punjab,2011,,23,,Blank,Blank,Ms Dhoni,Ac Gilchrist,Ms Dhoni,Ac Gilchrist,1988-12-11
16743,,501212,17,Pa Patel,3/9/1985,Left-hand Bat,N/a,India,Keeper,Kochi Tuskers Kerala,Pune Warriors,2011,,26,,Blank,Blank,Dpmd Jayawardene,Yuvraj Singh,Pa Patel,Rv Uthappa,1985-03-09
16745,,501212,55,Vvs Laxman,11/1/1974,Right-hand Bat,Right-arm Offbreak,India,Player,Kochi Tuskers Kerala,Pune Warriors,2011,,37,,Blank,Blank,Dpmd Jayawardene,Yuvraj Singh,Pa Patel,Rv Uthappa,1974-11-01
16746,,501212,61,Rp Singh,12/6/1985,Right-hand Bat,Left-arm Fast-medium,India,Player,Kochi Tuskers Kerala,Pune Warriors,2011,,26,,Blank,Blank,Dpmd Jayawardene,Yuvraj Singh,Pa Patel,Rv Uthappa,1985-12-06
16747,,501212,64,Dpmd Jayawardene,5/27/1977,Right-hand Bat,Right-arm Medium,Sri Lanka,Captain,Kochi Tuskers Kerala,Pune Warriors,2011,,34,,Blank,Blank,Dpmd Jayawardene,Yuvraj Singh,Pa Patel,Rv Uthappa,1977-05-27
16754,,501212,46,Rv Uthappa,11/11/1985,Right-hand Bat,Right-arm Medium,India,Keeper,Pune Warriors,Kochi Tuskers Kerala,2011,,26,,Blank,Blank,Yuvraj Singh,Dpmd Jayawardene,Rv Uthappa,Pa Patel,1985-11-11
16756,,501212,83,M Kartik,9/11/1976,Left-hand Bat,Slow Left-arm Orthodox,India,Player,Pune Warriors,Kochi Tuskers Kerala,2011,,35,,Blank,Blank,Yuvraj Singh,Dpmd Jayawardene,Rv Uthappa,Pa Patel,1976-09-11
16760,,501212,235,R Sharma,4/30/1987,Right-hand Bat,Right-arm Offbreak,India,Player,Pune Warriors,Kochi Tuskers Kerala,2011,,24,,Blank,Blank,Yuvraj Singh,Dpmd Jayawardene,Rv Uthappa,Pa Patel,1987-04-30
16761,,501212,267,Wd Parnell,7/30/1989,Left-hand Bat,Left-arm Medium-fast,South Africa,Player,Pune Warriors,Kochi Tuskers Kerala,2011,,22,,Blank,Blank,Yuvraj Singh,Dpmd Jayawardene,Rv Uthappa,Pa Patel,1989-07-30
16764,,501213,8,V Kohli,11/5/1988,Right-hand Bat,Right-arm Medium,India,Player,Royal Challengers Bangalore,Deccan Chargers,2011,,23,,Blank,Blank,Dl Vettori,Kc Sangakkara,Ab De Villiers,Kc Sangakkara,1988-11-05
16765,,501213,15,Z Khan,10/7/1978,Right-hand Bat,Left-arm Fast-medium,India,Player,Royal Challengers Bangalore,Deccan Chargers,2011,,33,,Blank,Blank,Dl Vettori,Kc Sangakkara,Ab De Villiers,Kc Sangakkara,1978-10-07
16766,,501213,79,Ss Tiwary,12/30/1989,Left-hand Bat,N/a,India,Player,Royal Challengers Bangalore,Deccan Chargers,2011,,22,,Blank,Blank,Dl Vettori,Kc Sangakkara,Ab De Villiers,Kc Sangakkara,1989-12-30
16767,,501213,110,Ab De Villiers,2/17/1984,Right-hand Bat,Right-arm Medium,South Africa,Keeper,Royal Challengers Bangalore,Deccan Chargers,2011,,27,,Blank,Blank,Dl Vettori,Kc Sangakkara,Ab De Villiers,Kc Sangakkara,1984-02-17
16769,,501213,175,Dl Vettori,1/27/1979,Left-hand Bat,Slow Left-arm Orthodox,New Zealand,Captain,Royal Challengers Bangalore,Deccan Chargers,2011,,32,,Blank,Blank,Dl Vettori,Kc Sangakkara,Ab De Villiers,Kc Sangakkara,1979-01-27
16770,,501213,203,Ca Pujara,1/25/1988,Right-hand Bat,Legbreak,India,Player,Royal Challengers Bangalore,Deccan Chargers,2011,,23,,Blank,Blank,Dl Vettori,Kc Sangakkara,Ab De Villiers,Kc Sangakkara,1988-01-25
16771,,501213,260,Ma Agarwal,2/16/1991,Right-hand Bat,N/a,India,Player,Royal Challengers Bangalore,Deccan Chargers,2011,,20,,Blank,Blank,Dl Vettori,Kc Sangakkara,Ab De Villiers,Kc Sangakkara,1991-02-16
16773,,501213,269,R Ninan,11/19/1985,Right-hand Bat,Right-arm Offbreak,India,Player,Royal Challengers Bangalore,Deccan Chargers,2011,,26,,Blank,Blank,Dl Vettori,Kc Sangakkara,Ab De Villiers,Kc Sangakkara,1985-11-19
16774,,501213,270,S Aravind,4/8/1984,Left-hand Bat,Left-arm Medium-fast,India,Player,Royal Challengers Bangalore,Deccan Chargers,2011,,27,,Blank,Blank,Dl Vettori,Kc Sangakkara,Ab De Villiers,Kc Sangakkara,1984-04-08
16775,,501213,26,Kc Sangakkara,10/27/1977,Left-hand Bat,Right-arm Offbreak,Sri Lanka,Captainkeeper,Deccan Chargers,Royal Challengers Bangalore,2011,,34,,Blank,Blank,Kc Sangakkara,Dl Vettori,Kc Sangakkara,Ab De Villiers,1977-10-27
16777,,501213,65,S Sohal,11/10/1987,Right-hand Bat,Legbreak,India,Player,Deccan Chargers,Royal Challengers Bangalore,2011,,24,,Blank,Blank,Kc Sangakkara,Dl Vettori,Kc Sangakkara,Ab De Villiers,1987-11-10
16780,,501213,94,Dw Steyn,6/27/1983,Right-hand Bat,Right-arm Fast,South Africa,Player,Deccan Chargers,Royal Challengers Bangalore,2011,,28,,Blank,Blank,Kc Sangakkara,Dl Vettori,Kc Sangakkara,Ab De Villiers,1983-06-27
16781,,501213,112,Db Ravi Teja,9/5/1987,Right-hand Bat,Legbreak Googly,India,Player,Deccan Chargers,Royal Challengers Bangalore,2011,,24,,Blank,Blank,Kc Sangakkara,Dl Vettori,Kc Sangakkara,Ab De Villiers,1987-09-05
16784,,501213,154,Jp Duminy,4/14/1984,Left-hand Bat,Right-arm Offbreak,South Africa,Player,Deccan Chargers,Royal Challengers Bangalore,2011,,27,,Blank,Blank,Kc Sangakkara,Dl Vettori,Kc Sangakkara,Ab De Villiers,1984-04-14
16786,,501214,6,R Dravid,1/11/1973,Right-hand Bat,Right-arm Offbreak,India,Player,Rajasthan Royals,Kolkata Knight Riders,2011,,38,,Blank,Blank,Sk Warne,G Gambhir,Ag Paunikar,Ms Bisla,1973-01-11
16791,,501214,169,As Raut,3/3/1987,Right-hand Bat,Legbreak Googly,India,Player,Rajasthan Royals,Kolkata Knight Riders,2011,,24,,Blank,Blank,Sk Warne,G Gambhir,Ag Paunikar,Ms Bisla,1987-03-03
16792,,501214,192,J Botha,5/2/1982,Right-hand Bat,Right-arm Offbreak,South Africa,Player,Rajasthan Royals,Kolkata Knight Riders,2011,,29,,Blank,Blank,Sk Warne,G Gambhir,Ag Paunikar,Ms Bisla,1982-05-02
16795,,501214,266,Al Menaria,10/29/1990,Left-hand Bat,Slow Left-arm Orthodox,India,Player,Rajasthan Royals,Kolkata Knight Riders,2011,,21,,Blank,Blank,Sk Warne,G Gambhir,Ag Paunikar,Ms Bisla,1990-10-29
16796,,501214,298,Nd Doshi,10/6/1978,Right-hand Bat,Slow Left-arm Orthodox,India,Player,Rajasthan Royals,Kolkata Knight Riders,2011,,33,,Blank,Blank,Sk Warne,G Gambhir,Ag Paunikar,Ms Bisla,1978-10-06
16798,,501214,31,Yk Pathan,11/17/1982,Right-hand Bat,Right-arm Offbreak,India,Player,Kolkata Knight Riders,Rajasthan Royals,2011,,29,,Blank,Blank,G Gambhir,Sk Warne,Ms Bisla,Ag Paunikar,1982-11-17
16799,,501214,40,G Gambhir,10/14/1981,Left-hand Bat,Legbreak,India,Captain,Kolkata Knight Riders,Rajasthan Royals,2011,,30,,Blank,Blank,G Gambhir,Sk Warne,Ms Bisla,Ag Paunikar,1981-10-14
16800,,501214,66,B Lee,11/8/1976,Right-hand Bat,Right-arm Fast,Australia,Player,Kolkata Knight Riders,Rajasthan Royals,2011,,35,,Blank,Blank,G Gambhir,Sk Warne,Ms Bisla,Ag Paunikar,1976-11-08
16801,,501214,87,Mk Tiwary,11/14/1985,Right-hand Bat,Legbreak Googly,India,Player,Kolkata Knight Riders,Rajasthan Royals,2011,,26,,Blank,Blank,G Gambhir,Sk Warne,Ms Bisla,Ag Paunikar,1985-11-14
16805,,501214,214,Ms Bisla,12/27/1984,Right-hand Bat,N/a,India,Keeper,Kolkata Knight Riders,Rajasthan Royals,2011,,27,,Blank,Blank,G Gambhir,Sk Warne,Ms Bisla,Ag Paunikar,1984-12-27
16806,,501214,216,Ejg Morgan,9/10/1986,Left-hand Bat,Right-arm Medium,England,Player,Kolkata Knight Riders,Rajasthan Royals,2011,,25,,Blank,Blank,G Gambhir,Sk Warne,Ms Bisla,Ag Paunikar,1986-09-10
16811,,501215,126,Mm Patel,7/12/1983,Right-hand Bat,Right-arm Medium-fast,India,Player,Mumbai Indians,Kochi Tuskers Kerala,2011,,28,,Blank,Blank,Sr Tendulkar,Dpmd Jayawardene,Dj Jacobs,Pa Patel,1983-07-12
16813,,501215,194,Sl Malinga,8/28/1983,Right-hand Bat,Right-arm Fast,Sri Lanka,Player,Mumbai Indians,Kochi Tuskers Kerala,2011,,28,,Blank,Blank,Sr Tendulkar,Dpmd Jayawardene,Dj Jacobs,Pa Patel,1983-08-28
16819,,501215,2,Bb Mccullum,9/27/1981,Right-hand Bat,Right-arm Medium,New Zealand,Player,Kochi Tuskers Kerala,Mumbai Indians,2011,,30,,Blank,Blank,Dpmd Jayawardene,Sr Tendulkar,Pa Patel,Dj Jacobs,1981-09-27
16820,,501215,17,Pa Patel,3/9/1985,Left-hand Bat,N/a,India,Keeper,Kochi Tuskers Kerala,Mumbai Indians,2011,,26,,Blank,Blank,Dpmd Jayawardene,Sr Tendulkar,Pa Patel,Dj Jacobs,1985-03-09
16826,,501215,153,Rr Powar,5/20/1978,Right-hand Bat,Right-arm Offbreak,India,Player,Kochi Tuskers Kerala,Mumbai Indians,2011,,33,,Blank,Blank,Dpmd Jayawardene,Sr Tendulkar,Pa Patel,Dj Jacobs,1978-05-20
16828,,501215,259,Rv Gomez,10/16/1985,Right-hand Bat,Right-arm Medium,India,Player,Kochi Tuskers Kerala,Mumbai Indians,2011,,26,,Blank,Blank,Dpmd Jayawardene,Sr Tendulkar,Pa Patel,Dj Jacobs,1985-10-16
16829,,501215,280,Nltc Perera,4/3/1989,Left-hand Bat,Right-arm Medium-fast,Sri Lanka,Player,Kochi Tuskers Kerala,Mumbai Indians,2011,,22,,Blank,Blank,Dpmd Jayawardene,Sr Tendulkar,Pa Patel,Dj Jacobs,1989-04-03
16834,,501216,135,Tm Dilshan,10/14/1976,Right-hand Bat,Right-arm Offbreak,Sri Lanka,Player,Royal Challengers Bangalore,Chennai Super Kings,2011,,35,,Blank,Blank,Dl Vettori,Ms Dhoni,Ab De Villiers,Ms Dhoni,1976-10-14
16835,,501216,175,Dl Vettori,1/27/1979,Left-hand Bat,Slow Left-arm Orthodox,New Zealand,Captain,Royal Challengers Bangalore,Chennai Super Kings,2011,,32,,Blank,Blank,Dl Vettori,Ms Dhoni,Ab De Villiers,Ms Dhoni,1979-01-27
16839,,501216,268,Jj Van Der Wath,1/10/1978,Right-hand Bat,Right-arm Medium-fast,South Africa,Player,Royal Challengers Bangalore,Chennai Super Kings,2011,,33,,Blank,Blank,Dl Vettori,Ms Dhoni,Ab De Villiers,Ms Dhoni,1978-01-10
16840,,501216,269,R Ninan,11/19/1985,Right-hand Bat,Right-arm Offbreak,India,Player,Royal Challengers Bangalore,Chennai Super Kings,2011,,26,,Blank,Blank,Dl Vettori,Ms Dhoni,Ab De Villiers,Ms Dhoni,1985-11-19
16842,,501216,20,Ms Dhoni,7/7/1981,Right-hand Bat,Right-arm Medium,India,Captainkeeper,Chennai Super Kings,Royal Challengers Bangalore,2011,,30,,Blank,Blank,Ms Dhoni,Dl Vettori,Ms Dhoni,Ab De Villiers,1981-07-07
16846,,501216,125,S Anirudha,4/14/1987,Right-hand Bat,N/a,India,Player,Chennai Super Kings,Royal Challengers Bangalore,2011,,24,,Blank,Blank,Ms Dhoni,Dl Vettori,Ms Dhoni,Ab De Villiers,1987-04-14
16849,,501216,201,R Ashwin,9/17/1986,Right-hand Bat,Right-arm Offbreak,India,Player,Chennai Super Kings,Royal Challengers Bangalore,2011,,25,,Blank,Blank,Ms Dhoni,Dl Vettori,Ms Dhoni,Ab De Villiers,1986-09-17
16853,,501217,48,Am Nayar,10/8/1983,Left-hand Bat,Right-arm Medium,India,Player,Kings Xi Punjab,Deccan Chargers,2011,,28,,Blank,Blank,Ac Gilchrist,Kc Sangakkara,Ac Gilchrist,Kc Sangakkara,1983-10-08
16856,,501217,88,Kd Karthik,6/1/1985,Right-hand Bat,N/a,India,Player,Kings Xi Punjab,Deccan Chargers,2011,,26,,Blank,Blank,Ac Gilchrist,Kc Sangakkara,Ac Gilchrist,Kc Sangakkara,1985-06-01
16861,,501217,243,Vs Malik,5/9/1983,Right-hand Bat,Right-arm Medium,India,Player,Kings Xi Punjab,Deccan Chargers,2011,,28,,Blank,Blank,Ac Gilchrist,Kc Sangakkara,Ac Gilchrist,Kc Sangakkara,1983-05-09
16863,,501217,26,Kc Sangakkara,10/27/1977,Left-hand Bat,Right-arm Offbreak,Sri Lanka,Captainkeeper,Deccan Chargers,Kings Xi Punjab,2011,,34,,Blank,Blank,Kc Sangakkara,Ac Gilchrist,Kc Sangakkara,Ac Gilchrist,1977-10-27
16871,,501217,136,A Mishra,11/24/1982,Right-hand Bat,Legbreak,India,Player,Deccan Chargers,Kings Xi Punjab,2011,,29,,Blank,Blank,Kc Sangakkara,Ac Gilchrist,Kc Sangakkara,Ac Gilchrist,1982-11-24
16874,,501218,25,Jr Hopes,10/24/1978,Right-hand Bat,Right-arm Medium,Australia,Player,Delhi Daredevils,Pune Warriors,2011,,33,,Blank,Blank,V Sehwag,Yuvraj Singh,Nv Ojha,Rv Uthappa,1978-10-24
16876,,501218,41,V Sehwag,10/20/1978,Right-hand Bat,Right-arm Offbreak,India,Captain,Delhi Daredevils,Pune Warriors,2011,,33,,Blank,Blank,V Sehwag,Yuvraj Singh,Nv Ojha,Rv Uthappa,1978-10-20
16879,,501218,183,Nv Ojha,7/20/1983,Right-hand Bat,N/a,India,Keeper,Delhi Daredevils,Pune Warriors,2011,,28,,Blank,Blank,V Sehwag,Yuvraj Singh,Nv Ojha,Rv Uthappa,1983-07-20
16880,,501218,187,Da Warner,10/27/1986,Left-hand Bat,Legbreak,Australia,Player,Delhi Daredevils,Pune Warriors,2011,,25,,Blank,Blank,V Sehwag,Yuvraj Singh,Nv Ojha,Rv Uthappa,1986-10-27
16882,,501218,254,Aj Finch,11/17/1986,Right-hand Bat,Slow Left-arm Orthodox,Australia,Player,Delhi Daredevils,Pune Warriors,2011,,25,,Blank,Blank,V Sehwag,Yuvraj Singh,Nv Ojha,Rv Uthappa,1986-11-17
16885,,501218,27,Yuvraj Singh,12/12/1981,Left-hand Bat,Slow Left-arm Orthodox,India,Captain,Pune Warriors,Delhi Daredevils,2011,,30,,Blank,Blank,Yuvraj Singh,V Sehwag,Rv Uthappa,Nv Ojha,1981-12-12
16887,,501218,74,Gc Smith,2/1/1981,Left-hand Bat,Right-arm Offbreak,South Africa,Player,Pune Warriors,Delhi Daredevils,2011,,30,,Blank,Blank,Yuvraj Singh,V Sehwag,Rv Uthappa,Nv Ojha,1981-02-01
16891,,501218,231,Md Mishra,2/9/1984,Right-hand Bat,Right-arm Offbreak,India,Player,Pune Warriors,Delhi Daredevils,2011,,27,,Blank,Blank,Yuvraj Singh,V Sehwag,Rv Uthappa,Nv Ojha,1984-02-09
16893,,501218,267,Wd Parnell,7/30/1989,Left-hand Bat,Left-arm Medium-fast,South Africa,Player,Pune Warriors,Delhi Daredevils,2011,,22,,Blank,Blank,Yuvraj Singh,V Sehwag,Rv Uthappa,Nv Ojha,1989-07-30
16895,,501218,274,Ac Thomas,2/9/1977,Right-hand Bat,Right-arm Fast-medium,England,Player,Pune Warriors,Delhi Daredevils,2011,,34,,Blank,Blank,Yuvraj Singh,V Sehwag,Rv Uthappa,Nv Ojha,1977-02-09
16899,,501219,52,Lrpl Taylor,3/8/1984,Right-hand Bat,Right-arm Offbreak,New Zealand,Player,Rajasthan Royals,Kolkata Knight Riders,2011,,27,,Blank,Blank,Sk Warne,G Gambhir,Ag Paunikar,Ms Bisla,1984-03-08
16902,,501219,196,A Singh,6/21/1981,Right-hand Bat,Right-arm Medium-fast,India,Player,Rajasthan Royals,Kolkata Knight Riders,2011,,30,,Blank,Blank,Sk Warne,G Gambhir,Ag Paunikar,Ms Bisla,1981-06-21
16905,,501219,252,Ag Paunikar,4/18/1988,Right-hand Bat,N/a,India,Keeper,Rajasthan Royals,Kolkata Knight Riders,2011,,23,,Blank,Blank,Sk Warne,G Gambhir,Ag Paunikar,Ms Bisla,1988-04-18
16907,,501219,9,Jh Kallis,10/16/1975,Right-hand Bat,Right-arm Fast-medium,South Africa,Player,Kolkata Knight Riders,Rajasthan Royals,2011,,36,,Blank,Blank,G Gambhir,Sk Warne,Ms Bisla,Ag Paunikar,1975-10-16
16909,,501219,40,G Gambhir,10/14/1981,Left-hand Bat,Legbreak,India,Captain,Kolkata Knight Riders,Rajasthan Royals,2011,,30,,Blank,Blank,G Gambhir,Sk Warne,Ms Bisla,Ag Paunikar,1981-10-14
16910,,501219,66,B Lee,11/8/1976,Right-hand Bat,Right-arm Fast,Australia,Player,Kolkata Knight Riders,Rajasthan Royals,2011,,35,,Blank,Blank,G Gambhir,Sk Warne,Ms Bisla,Ag Paunikar,1976-11-08
16913,,501219,140,Iqbal Abdulla,12/2/1989,Left-hand Bat,Slow Left-arm Orthodox,India,Player,Kolkata Knight Riders,Rajasthan Royals,2011,,22,,Blank,Blank,G Gambhir,Sk Warne,Ms Bisla,Ag Paunikar,1989-12-02
16916,,501219,216,Ejg Morgan,9/10/1986,Left-hand Bat,Right-arm Medium,England,Player,Kolkata Knight Riders,Rajasthan Royals,2011,,25,,Blank,Blank,G Gambhir,Sk Warne,Ms Bisla,Ag Paunikar,1986-09-10
16917,,501219,276,Shakib Al Hasan,3/24/1987,Left-hand Bat,Slow Left-arm Orthodox,Bangladesh,Player,Kolkata Knight Riders,Rajasthan Royals,2011,,24,,Blank,Blank,G Gambhir,Sk Warne,Ms Bisla,Ag Paunikar,1987-03-24
16920,,501220,21,Sk Raina,11/27/1986,Left-hand Bat,Right-arm Offbreak,India,Player,Chennai Super Kings,Kochi Tuskers Kerala,2011,,25,,Blank,Blank,Ms Dhoni,Dpmd Jayawardene,Ms Dhoni,Pa Patel,1986-11-27
16921,,501220,23,S Badrinath,8/30/1980,Right-hand Bat,Right-arm Offbreak,India,Player,Chennai Super Kings,Kochi Tuskers Kerala,2011,,31,,Blank,Blank,Ms Dhoni,Dpmd Jayawardene,Ms Dhoni,Pa Patel,1980-08-30
16924,,501220,185,M Vijay,4/1/1984,Right-hand Bat,Right-arm Offbreak,India,Player,Chennai Super Kings,Kochi Tuskers Kerala,2011,,27,,Blank,Blank,Ms Dhoni,Dpmd Jayawardene,Ms Dhoni,Pa Patel,1984-04-01
16926,,501220,201,R Ashwin,9/17/1986,Right-hand Bat,Right-arm Offbreak,India,Player,Chennai Super Kings,Kochi Tuskers Kerala,2011,,25,,Blank,Blank,Ms Dhoni,Dpmd Jayawardene,Ms Dhoni,Pa Patel,1986-09-17
16928,,501220,377,Tg Southee,12/11/1988,Right-hand Bat,Right-arm Medium-fast,New Zealand,Player,Chennai Super Kings,Kochi Tuskers Kerala,2011,,23,,Blank,Blank,Ms Dhoni,Dpmd Jayawardene,Ms Dhoni,Pa Patel,1988-12-11
16929,,501220,2,Bb Mccullum,9/27/1981,Right-hand Bat,Right-arm Medium,New Zealand,Player,Kochi Tuskers Kerala,Chennai Super Kings,2011,,30,,Blank,Blank,Dpmd Jayawardene,Ms Dhoni,Pa Patel,Ms Dhoni,1981-09-27
16930,,501220,17,Pa Patel,3/9/1985,Left-hand Bat,N/a,India,Keeper,Kochi Tuskers Kerala,Chennai Super Kings,2011,,26,,Blank,Blank,Dpmd Jayawardene,Ms Dhoni,Pa Patel,Ms Dhoni,1985-03-09
16932,,501220,61,Rp Singh,12/6/1985,Right-hand Bat,Left-arm Fast-medium,India,Player,Kochi Tuskers Kerala,Chennai Super Kings,2011,,26,,Blank,Blank,Dpmd Jayawardene,Ms Dhoni,Pa Patel,Ms Dhoni,1985-12-06
16933,,501220,64,Dpmd Jayawardene,5/27/1977,Right-hand Bat,Right-arm Medium,Sri Lanka,Captain,Kochi Tuskers Kerala,Chennai Super Kings,2011,,34,,Blank,Blank,Dpmd Jayawardene,Ms Dhoni,Pa Patel,Ms Dhoni,1977-05-27
16934,,501220,81,R Vinay Kumar,2/12/1984,Right-hand Bat,Right-arm Medium,India,Player,Kochi Tuskers Kerala,Chennai Super Kings,2011,,27,,Blank,Blank,Dpmd Jayawardene,Ms Dhoni,Pa Patel,Ms Dhoni,1984-02-12
16942,,501221,42,S Dhawan,12/5/1985,Left-hand Bat,Right-arm Offbreak,India,Player,Deccan Chargers,Delhi Daredevils,2011,,26,,Blank,Blank,Kc Sangakkara,V Sehwag,Kc Sangakkara,Nv Ojha,1985-12-05
16944,,501221,93,B Chipli,1/27/1983,Right-hand Bat,Right-arm Medium,India,Player,Deccan Chargers,Delhi Daredevils,2011,,28,,Blank,Blank,Kc Sangakkara,V Sehwag,Kc Sangakkara,Nv Ojha,1983-01-27
16947,,501221,131,Pp Ojha,9/5/1986,Left-hand Bat,Slow Left-arm Orthodox,India,Player,Deccan Chargers,Delhi Daredevils,2011,,25,,Blank,Blank,Kc Sangakkara,V Sehwag,Kc Sangakkara,Nv Ojha,1986-09-05
16948,,501221,136,A Mishra,11/24/1982,Right-hand Bat,Legbreak,India,Player,Deccan Chargers,Delhi Daredevils,2011,,29,,Blank,Blank,Kc Sangakkara,V Sehwag,Kc Sangakkara,Nv Ojha,1982-11-24
16949,,501221,256,Harmeet Singh,9/7/1992,Left-hand Bat,Slow Left-arm Orthodox,India,Player,Deccan Chargers,Delhi Daredevils,2011,,19,,Blank,Blank,Kc Sangakkara,V Sehwag,Kc Sangakkara,Nv Ojha,1992-09-07
16952,,501221,29,Ik Pathan,10/27/1984,Left-hand Bat,Left-arm Medium-fast,India,Player,Delhi Daredevils,Deccan Chargers,2011,,27,,Blank,Blank,V Sehwag,Kc Sangakkara,Nv Ojha,Kc Sangakkara,1984-10-27
16954,,501221,54,Y Venugopal Rao,2/26/1982,Right-hand Bat,Right-arm Offbreak,India,Player,Delhi Daredevils,Deccan Chargers,2011,,29,,Blank,Blank,V Sehwag,Kc Sangakkara,Nv Ojha,Kc Sangakkara,1982-02-26
16960,,501221,254,Aj Finch,11/17/1986,Right-hand Bat,Slow Left-arm Orthodox,Australia,Player,Delhi Daredevils,Deccan Chargers,2011,,25,,Blank,Blank,V Sehwag,Kc Sangakkara,Nv Ojha,Kc Sangakkara,1986-11-17
16965,,501223,133,Sr Tendulkar,4/24/1973,Right-hand Bat,Right-arm Offbreak,India,Captain,Mumbai Indians,Pune Warriors,2011,,38,,Blank,Blank,Sr Tendulkar,Yuvraj Singh,At Rayudu,Td Paine,1973-04-24
16967,,501223,208,At Rayudu,9/23/1985,Right-hand Bat,Right-arm Offbreak,India,Keeper,Mumbai Indians,Pune Warriors,2011,,26,,Blank,Blank,Sr Tendulkar,Yuvraj Singh,At Rayudu,Td Paine,1985-09-23
16968,,501223,209,R Sathish,1/14/1981,Right-hand Bat,Right-arm Medium,India,Player,Mumbai Indians,Pune Warriors,2011,,30,,Blank,Blank,Sr Tendulkar,Yuvraj Singh,At Rayudu,Td Paine,1981-01-14
16969,,501223,221,Ka Pollard,5/12/1987,Right-hand Bat,Right-arm Medium-fast,West Indies,Player,Mumbai Indians,Pune Warriors,2011,,24,,Blank,Blank,Sr Tendulkar,Yuvraj Singh,At Rayudu,Td Paine,1987-05-12
16971,,501223,275,Jec Franklin,11/7/1980,Left-hand Bat,Left-arm Medium,New Zealand,Player,Mumbai Indians,Pune Warriors,2011,,31,,Blank,Blank,Sr Tendulkar,Yuvraj Singh,At Rayudu,Td Paine,1980-11-07
16974,,501223,46,Rv Uthappa,11/11/1985,Right-hand Bat,Right-arm Medium,India,Player,Pune Warriors,Mumbai Indians,2011,,26,,Blank,Blank,Yuvraj Singh,Sr Tendulkar,Td Paine,At Rayudu,1985-11-11
16979,,501223,235,R Sharma,4/30/1987,Right-hand Bat,Right-arm Offbreak,India,Player,Pune Warriors,Mumbai Indians,2011,,24,,Blank,Blank,Yuvraj Singh,Sr Tendulkar,Td Paine,At Rayudu,1987-04-30
16981,,501223,272,Td Paine,12/8/1984,Right-hand Bat,Right-arm Medium,Australia,Keeper,Pune Warriors,Mumbai Indians,2011,,27,,Blank,Blank,Yuvraj Singh,Sr Tendulkar,Td Paine,At Rayudu,1984-12-08
16984,,501224,9,Jh Kallis,10/16/1975,Right-hand Bat,Right-arm Fast-medium,South Africa,Player,Kolkata Knight Riders,Kochi Tuskers Kerala,2011,,36,,Blank,Blank,G Gambhir,Dpmd Jayawardene,Ms Bisla,Pa Patel,1975-10-16
16985,,501224,31,Yk Pathan,11/17/1982,Right-hand Bat,Right-arm Offbreak,India,Player,Kolkata Knight Riders,Kochi Tuskers Kerala,2011,,29,,Blank,Blank,G Gambhir,Dpmd Jayawardene,Ms Bisla,Pa Patel,1982-11-17
16992,,501224,214,Ms Bisla,12/27/1984,Right-hand Bat,N/a,India,Keeper,Kolkata Knight Riders,Kochi Tuskers Kerala,2011,,27,,Blank,Blank,G Gambhir,Dpmd Jayawardene,Ms Bisla,Pa Patel,1984-12-27
16995,,501224,2,Bb Mccullum,9/27/1981,Right-hand Bat,Right-arm Medium,New Zealand,Player,Kochi Tuskers Kerala,Kolkata Knight Riders,2011,,30,,Blank,Blank,Dpmd Jayawardene,G Gambhir,Pa Patel,Ms Bisla,1981-09-27
16998,,501224,61,Rp Singh,12/6/1985,Right-hand Bat,Left-arm Fast-medium,India,Player,Kochi Tuskers Kerala,Kolkata Knight Riders,2011,,26,,Blank,Blank,Dpmd Jayawardene,G Gambhir,Pa Patel,Ms Bisla,1985-12-06
16999,,501224,64,Dpmd Jayawardene,5/27/1977,Right-hand Bat,Right-arm Medium,Sri Lanka,Captain,Kochi Tuskers Kerala,Kolkata Knight Riders,2011,,34,,Blank,Blank,Dpmd Jayawardene,G Gambhir,Pa Patel,Ms Bisla,1977-05-27
17001,,501224,104,Bj Hodge,12/29/1974,Right-hand Bat,Right-arm Offbreak,Australia,Player,Kochi Tuskers Kerala,Kolkata Knight Riders,2011,,37,,Blank,Blank,Dpmd Jayawardene,G Gambhir,Pa Patel,Ms Bisla,1974-12-29
17003,,501224,153,Rr Powar,5/20/1978,Right-hand Bat,Right-arm Offbreak,India,Player,Kochi Tuskers Kerala,Kolkata Knight Riders,2011,,33,,Blank,Blank,Dpmd Jayawardene,G Gambhir,Pa Patel,Ms Bisla,1978-05-20
17006,,501225,14,P Kumar,10/2/1986,Right-hand Bat,Right-arm Medium,India,Player,Kings Xi Punjab,Rajasthan Royals,2011,,25,,Blank,Blank,Ac Gilchrist,Sk Warne,Ac Gilchrist,Dh Yagnik,1986-10-02
17008,,501225,53,Ac Gilchrist,11/14/1971,Left-hand Bat,Right-arm Offbreak,Australia,Captainkeeper,Kings Xi Punjab,Rajasthan Royals,2011,,40,,Blank,Blank,Ac Gilchrist,Sk Warne,Ac Gilchrist,Dh Yagnik,1971-11-14
17013,,501225,188,Rj Harris,10/11/1979,Right-hand Bat,Right-arm Fast,Australia,Player,Kings Xi Punjab,Rajasthan Royals,2011,,32,,Blank,Blank,Ac Gilchrist,Sk Warne,Ac Gilchrist,Dh Yagnik,1979-10-11
17014,,501225,210,R Mclaren,2/9/1983,Left-hand Bat,Right-arm Medium-fast,South Africa,Player,Kings Xi Punjab,Rajasthan Royals,2011,,28,,Blank,Blank,Ac Gilchrist,Sk Warne,Ac Gilchrist,Dh Yagnik,1983-02-09
17016,,501225,302,Ba Bhatt,5/13/1990,Left-hand Bat,Slow Left-arm Orthodox,India,Player,Kings Xi Punjab,Rajasthan Royals,2011,,21,,Blank,Blank,Ac Gilchrist,Sk Warne,Ac Gilchrist,Dh Yagnik,1990-05-13
17018,,501225,32,Sr Watson,6/17/1981,Right-hand Bat,Right-arm Fast-medium,Australia,Player,Rajasthan Royals,Kings Xi Punjab,2011,,30,,Blank,Blank,Sk Warne,Ac Gilchrist,Dh Yagnik,Ac Gilchrist,1981-06-17
17019,,501225,38,Sk Warne,9/13/1969,Right-hand Bat,Legbreak Googly,Australia,Captain,Rajasthan Royals,Kings Xi Punjab,2011,,42,,Blank,Blank,Sk Warne,Ac Gilchrist,Dh Yagnik,Ac Gilchrist,1969-09-13
17020,,501225,39,Sk Trivedi,9/4/1982,Right-hand Bat,Right-arm Medium,India,Player,Rajasthan Royals,Kings Xi Punjab,2011,,29,,Blank,Blank,Sk Warne,Ac Gilchrist,Dh Yagnik,Ac Gilchrist,1982-09-04
17023,,501225,169,As Raut,3/3/1987,Right-hand Bat,Legbreak Googly,India,Player,Rajasthan Royals,Kings Xi Punjab,2011,,24,,Blank,Blank,Sk Warne,Ac Gilchrist,Dh Yagnik,Ac Gilchrist,1987-03-03
17025,,501225,255,Str Binny,6/3/1984,Right-hand Bat,Right-arm Medium,India,Player,Rajasthan Royals,Kings Xi Punjab,2011,,27,,Blank,Blank,Sk Warne,Ac Gilchrist,Dh Yagnik,Ac Gilchrist,1984-06-03
17026,,501225,266,Al Menaria,10/29/1990,Left-hand Bat,Slow Left-arm Orthodox,India,Player,Rajasthan Royals,Kings Xi Punjab,2011,,21,,Blank,Blank,Sk Warne,Ac Gilchrist,Dh Yagnik,Ac Gilchrist,1990-10-29
17028,,501226,50,Harbhajan Singh,7/3/1980,Right-hand Bat,Right-arm Offbreak,India,Player,Mumbai Indians,Chennai Super Kings,2011,,31,,Blank,Blank,Sr Tendulkar,Ms Dhoni,At Rayudu,Ms Dhoni,1980-07-03
17029,,501226,56,A Symonds,6/9/1975,Right-hand Bat,Right-arm Offbreak,Australia,Player,Mumbai Indians,Chennai Super Kings,2011,,36,,Blank,Blank,Sr Tendulkar,Ms Dhoni,At Rayudu,Ms Dhoni,1975-06-09
17032,,501226,133,Sr Tendulkar,4/24/1973,Right-hand Bat,Right-arm Offbreak,India,Captain,Mumbai Indians,Chennai Super Kings,2011,,38,,Blank,Blank,Sr Tendulkar,Ms Dhoni,At Rayudu,Ms Dhoni,1973-04-24
17033,,501226,194,Sl Malinga,8/28/1983,Right-hand Bat,Right-arm Fast,Sri Lanka,Player,Mumbai Indians,Chennai Super Kings,2011,,28,,Blank,Blank,Sr Tendulkar,Ms Dhoni,At Rayudu,Ms Dhoni,1983-08-28
17036,,501226,221,Ka Pollard,5/12/1987,Right-hand Bat,Right-arm Medium-fast,West Indies,Player,Mumbai Indians,Chennai Super Kings,2011,,24,,Blank,Blank,Sr Tendulkar,Ms Dhoni,At Rayudu,Ms Dhoni,1987-05-12
17039,,501226,19,Mek Hussey,5/27/1975,Left-hand Bat,Right-arm Medium,Australia,Player,Chennai Super Kings,Mumbai Indians,2011,,36,,Blank,Blank,Ms Dhoni,Sr Tendulkar,Ms Dhoni,At Rayudu,1975-05-27
17043,,501226,109,Ja Morkel,6/10/1981,Left-hand Bat,Right-arm Medium-fast,South Africa,Player,Chennai Super Kings,Mumbai Indians,2011,,30,,Blank,Blank,Ms Dhoni,Sr Tendulkar,Ms Dhoni,At Rayudu,1981-06-10
17044,,501226,119,Joginder Sharma,10/23/1983,Right-hand Bat,Right-arm Fast-medium,India,Player,Chennai Super Kings,Mumbai Indians,2011,,28,,Blank,Blank,Ms Dhoni,Sr Tendulkar,Ms Dhoni,At Rayudu,1983-10-23
17045,,501226,125,S Anirudha,4/14/1987,Right-hand Bat,N/a,India,Player,Chennai Super Kings,Mumbai Indians,2011,,24,,Blank,Blank,Ms Dhoni,Sr Tendulkar,Ms Dhoni,At Rayudu,1987-04-14
17046,,501226,185,M Vijay,4/1/1984,Right-hand Bat,Right-arm Offbreak,India,Player,Chennai Super Kings,Mumbai Indians,2011,,27,,Blank,Blank,Ms Dhoni,Sr Tendulkar,Ms Dhoni,At Rayudu,1984-04-01
17049,,501226,278,S Randiv,1/30/1985,Right-hand Bat,Right-arm Offbreak,Sri Lanka,Player,Chennai Super Kings,Mumbai Indians,2011,,26,,Blank,Blank,Ms Dhoni,Sr Tendulkar,Ms Dhoni,At Rayudu,1985-01-30
17052,,501227,79,Ss Tiwary,12/30/1989,Left-hand Bat,N/a,India,Player,Royal Challengers Bangalore,Kolkata Knight Riders,2011,,22,,Blank,Blank,Dl Vettori,G Gambhir,Ab De Villiers,Bj Haddin,1989-12-30
17053,,501227,110,Ab De Villiers,2/17/1984,Right-hand Bat,Right-arm Medium,South Africa,Keeper,Royal Challengers Bangalore,Kolkata Knight Riders,2011,,27,,Blank,Blank,Dl Vettori,G Gambhir,Ab De Villiers,Bj Haddin,1984-02-17
17056,,501227,175,Dl Vettori,1/27/1979,Left-hand Bat,Slow Left-arm Orthodox,New Zealand,Captain,Royal Challengers Bangalore,Kolkata Knight Riders,2011,,32,,Blank,Blank,Dl Vettori,G Gambhir,Ab De Villiers,Bj Haddin,1979-01-27
17058,,501227,261,Auk Pathan,6/17/1984,Right-hand Bat,Right-arm Medium,India,Player,Royal Challengers Bangalore,Kolkata Knight Riders,2011,,27,,Blank,Blank,Dl Vettori,G Gambhir,Ab De Villiers,Bj Haddin,1984-06-17
17059,,501227,270,S Aravind,4/8/1984,Left-hand Bat,Left-arm Medium-fast,India,Player,Royal Challengers Bangalore,Kolkata Knight Riders,2011,,27,,Blank,Blank,Dl Vettori,G Gambhir,Ab De Villiers,Bj Haddin,1984-04-08
17062,,501227,31,Yk Pathan,11/17/1982,Right-hand Bat,Right-arm Offbreak,India,Player,Kolkata Knight Riders,Royal Challengers Bangalore,2011,,29,,Blank,Blank,G Gambhir,Dl Vettori,Bj Haddin,Ab De Villiers,1982-11-17
17066,,501227,140,Iqbal Abdulla,12/2/1989,Left-hand Bat,Slow Left-arm Orthodox,India,Player,Kolkata Knight Riders,Royal Challengers Bangalore,2011,,22,,Blank,Blank,G Gambhir,Dl Vettori,Bj Haddin,Ab De Villiers,1989-12-02
17067,,501227,151,L Balaji,9/27/1981,Right-hand Bat,Right-arm Medium-fast,India,Player,Kolkata Knight Riders,Royal Challengers Bangalore,2011,,30,,Blank,Blank,G Gambhir,Dl Vettori,Bj Haddin,Ab De Villiers,1981-09-27
17069,,501227,276,Shakib Al Hasan,3/24/1987,Left-hand Bat,Slow Left-arm Orthodox,Bangladesh,Player,Kolkata Knight Riders,Royal Challengers Bangalore,2011,,24,,Blank,Blank,G Gambhir,Dl Vettori,Bj Haddin,Ab De Villiers,1987-03-24
17070,,501227,279,Bj Haddin,10/23/1977,Right-hand Bat,N/a,Australia,Keeper,Kolkata Knight Riders,Royal Challengers Bangalore,2011,,34,,Blank,Blank,G Gambhir,Dl Vettori,Bj Haddin,Ab De Villiers,1977-10-23
17071,,501227,346,Jd Unadkat,10/18/1991,Right-hand Bat,Left-arm Medium,India,Player,Kolkata Knight Riders,Royal Challengers Bangalore,2011,,20,,Blank,Blank,G Gambhir,Dl Vettori,Bj Haddin,Ab De Villiers,1991-10-18
17074,,501228,48,Am Nayar,10/8/1983,Left-hand Bat,Right-arm Medium,India,Player,Kings Xi Punjab,Delhi Daredevils,2011,,28,,Blank,Blank,Ac Gilchrist,V Sehwag,Ac Gilchrist,Nv Ojha,1983-10-08
17077,,501228,88,Kd Karthik,6/1/1985,Right-hand Bat,N/a,India,Player,Kings Xi Punjab,Delhi Daredevils,2011,,26,,Blank,Blank,Ac Gilchrist,V Sehwag,Ac Gilchrist,Nv Ojha,1985-06-01
17080,,501228,188,Rj Harris,10/11/1979,Right-hand Bat,Right-arm Fast,Australia,Player,Kings Xi Punjab,Delhi Daredevils,2011,,32,,Blank,Blank,Ac Gilchrist,V Sehwag,Ac Gilchrist,Nv Ojha,1979-10-11
17081,,501228,234,Sj Srivastava,9/22/1981,Right-hand Bat,Left-arm Fast-medium,India,Player,Kings Xi Punjab,Delhi Daredevils,2011,,30,,Blank,Blank,Ac Gilchrist,V Sehwag,Ac Gilchrist,Nv Ojha,1981-09-22
17091,,501228,199,Y Nagar,1/6/1990,Right-hand Bat,Right-arm Offbreak,India,Player,Delhi Daredevils,Kings Xi Punjab,2011,,21,,Blank,Blank,V Sehwag,Ac Gilchrist,Nv Ojha,Ac Gilchrist,1990-01-06
17094,,501229,50,Harbhajan Singh,7/3/1980,Right-hand Bat,Right-arm Offbreak,India,Player,Mumbai Indians,Deccan Chargers,2011,,31,,Blank,Blank,Sr Tendulkar,Kc Sangakkara,Dj Jacobs,Kc Sangakkara,1980-07-03
17095,,501229,56,A Symonds,6/9/1975,Right-hand Bat,Right-arm Offbreak,Australia,Player,Mumbai Indians,Deccan Chargers,2011,,36,,Blank,Blank,Sr Tendulkar,Kc Sangakkara,Dj Jacobs,Kc Sangakkara,1975-06-09
17097,,501229,126,Mm Patel,7/12/1983,Right-hand Bat,Right-arm Medium-fast,India,Player,Mumbai Indians,Deccan Chargers,2011,,28,,Blank,Blank,Sr Tendulkar,Kc Sangakkara,Dj Jacobs,Kc Sangakkara,1983-07-12
17098,,501229,133,Sr Tendulkar,4/24/1973,Right-hand Bat,Right-arm Offbreak,India,Captain,Mumbai Indians,Deccan Chargers,2011,,38,,Blank,Blank,Sr Tendulkar,Kc Sangakkara,Dj Jacobs,Kc Sangakkara,1973-04-24
17100,,501229,208,At Rayudu,9/23/1985,Right-hand Bat,Right-arm Offbreak,India,Player,Mumbai Indians,Deccan Chargers,2011,,26,,Blank,Blank,Sr Tendulkar,Kc Sangakkara,Dj Jacobs,Kc Sangakkara,1985-09-23
17101,,501229,209,R Sathish,1/14/1981,Right-hand Bat,Right-arm Medium,India,Player,Mumbai Indians,Deccan Chargers,2011,,30,,Blank,Blank,Sr Tendulkar,Kc Sangakkara,Dj Jacobs,Kc Sangakkara,1981-01-14
17103,,501229,246,An Ahmed,11/5/1988,Right-hand Bat,Right-arm Medium-fast,India,Player,Mumbai Indians,Deccan Chargers,2011,,23,,Blank,Blank,Sr Tendulkar,Kc Sangakkara,Dj Jacobs,Kc Sangakkara,1988-11-05
17104,,501229,263,Dj Jacobs,11/4/1982,Right-hand Bat,Right-arm Medium,South Africa,Keeper,Mumbai Indians,Deccan Chargers,2011,,29,,Blank,Blank,Sr Tendulkar,Kc Sangakkara,Dj Jacobs,Kc Sangakkara,1982-11-04
17111,,501229,94,Dw Steyn,6/27/1983,Right-hand Bat,Right-arm Fast,South Africa,Player,Deccan Chargers,Mumbai Indians,2011,,28,,Blank,Blank,Kc Sangakkara,Sr Tendulkar,Kc Sangakkara,Dj Jacobs,1983-06-27
17113,,501229,131,Pp Ojha,9/5/1986,Left-hand Bat,Slow Left-arm Orthodox,India,Player,Deccan Chargers,Mumbai Indians,2011,,25,,Blank,Blank,Kc Sangakkara,Sr Tendulkar,Kc Sangakkara,Dj Jacobs,1986-09-05
17119,,501230,39,Sk Trivedi,9/4/1982,Right-hand Bat,Right-arm Medium,India,Player,Rajasthan Royals,Kochi Tuskers Kerala,2011,,29,,Blank,Blank,Sk Warne,Dpmd Jayawardene,Dh Yagnik,Pa Patel,1982-09-04
17120,,501230,52,Lrpl Taylor,3/8/1984,Right-hand Bat,Right-arm Offbreak,New Zealand,Player,Rajasthan Royals,Kochi Tuskers Kerala,2011,,27,,Blank,Blank,Sk Warne,Dpmd Jayawardene,Dh Yagnik,Pa Patel,1984-03-08
17124,,501230,255,Str Binny,6/3/1984,Right-hand Bat,Right-arm Medium,India,Player,Rajasthan Royals,Kochi Tuskers Kerala,2011,,27,,Blank,Blank,Sk Warne,Dpmd Jayawardene,Dh Yagnik,Pa Patel,1984-06-03
17126,,501230,277,Dh Yagnik,6/22/1983,Left-hand Bat,N/a,India,Keeper,Rajasthan Royals,Kochi Tuskers Kerala,2011,,28,,Blank,Blank,Sk Warne,Dpmd Jayawardene,Dh Yagnik,Pa Patel,1983-06-22
17129,,501230,55,Vvs Laxman,11/1/1974,Right-hand Bat,Right-arm Offbreak,India,Player,Kochi Tuskers Kerala,Rajasthan Royals,2011,,37,,Blank,Blank,Dpmd Jayawardene,Sk Warne,Pa Patel,Dh Yagnik,1974-11-01
17130,,501230,61,Rp Singh,12/6/1985,Right-hand Bat,Left-arm Fast-medium,India,Player,Kochi Tuskers Kerala,Rajasthan Royals,2011,,26,,Blank,Blank,Dpmd Jayawardene,Sk Warne,Pa Patel,Dh Yagnik,1985-12-06
17135,,501230,237,Km Jadhav,3/26/1985,Right-hand Bat,Right-arm Offbreak,India,Player,Kochi Tuskers Kerala,Rajasthan Royals,2011,,26,,Blank,Blank,Dpmd Jayawardene,Sk Warne,Pa Patel,Dh Yagnik,1985-03-26
17138,,501231,19,Mek Hussey,5/27/1975,Left-hand Bat,Right-arm Medium,Australia,Player,Chennai Super Kings,Pune Warriors,2011,,36,,Blank,Blank,Ms Dhoni,Yuvraj Singh,Ms Dhoni,Rv Uthappa,1975-05-27
17147,,501231,248,De Bollinger,7/24/1981,Left-hand Bat,Left-arm Fast-medium,Australia,Player,Chennai Super Kings,Pune Warriors,2011,,30,,Blank,Blank,Ms Dhoni,Yuvraj Singh,Ms Dhoni,Rv Uthappa,1981-07-24
17148,,501231,278,S Randiv,1/30/1985,Right-hand Bat,Right-arm Offbreak,Sri Lanka,Player,Chennai Super Kings,Pune Warriors,2011,,26,,Blank,Blank,Ms Dhoni,Yuvraj Singh,Ms Dhoni,Rv Uthappa,1985-01-30
17150,,501231,46,Rv Uthappa,11/11/1985,Right-hand Bat,Right-arm Medium,India,Keeper,Pune Warriors,Chennai Super Kings,2011,,26,,Blank,Blank,Yuvraj Singh,Ms Dhoni,Rv Uthappa,Ms Dhoni,1985-11-11
17152,,501231,96,Mk Pandey,9/10/1989,Right-hand Bat,Right-arm Medium,India,Player,Pune Warriors,Chennai Super Kings,2011,,22,,Blank,Blank,Yuvraj Singh,Ms Dhoni,Rv Uthappa,Ms Dhoni,1989-09-10
17154,,501231,171,M Manhas,10/12/1979,Right-hand Bat,Right-arm Offbreak,India,Player,Pune Warriors,Chennai Super Kings,2011,,32,,Blank,Blank,Yuvraj Singh,Ms Dhoni,Rv Uthappa,Ms Dhoni,1979-10-12
17155,,501231,231,Md Mishra,2/9/1984,Right-hand Bat,Right-arm Offbreak,India,Player,Pune Warriors,Chennai Super Kings,2011,,27,,Blank,Blank,Yuvraj Singh,Ms Dhoni,Rv Uthappa,Ms Dhoni,1984-02-09
17156,,501231,235,R Sharma,4/30/1987,Right-hand Bat,Right-arm Offbreak,India,Player,Pune Warriors,Chennai Super Kings,2011,,24,,Blank,Blank,Yuvraj Singh,Ms Dhoni,Rv Uthappa,Ms Dhoni,1987-04-30
17157,,501231,274,Ac Thomas,2/9/1977,Right-hand Bat,Right-arm Fast-medium,England,Player,Pune Warriors,Chennai Super Kings,2011,,34,,Blank,Blank,Yuvraj Singh,Ms Dhoni,Rv Uthappa,Ms Dhoni,1977-02-09
17160,,501232,8,V Kohli,11/5/1988,Right-hand Bat,Right-arm Medium,India,Player,Royal Challengers Bangalore,Delhi Daredevils,2011,,23,,Blank,Blank,Dl Vettori,V Sehwag,Ab De Villiers,Nv Ojha,1988-11-05
17165,,501232,162,Ch Gayle,9/21/1979,Left-hand Bat,Right-arm Offbreak,West Indies,Player,Royal Challengers Bangalore,Delhi Daredevils,2011,,32,,Blank,Blank,Dl Vettori,V Sehwag,Ab De Villiers,Nv Ojha,1979-09-21
17166,,501232,175,Dl Vettori,1/27/1979,Left-hand Bat,Slow Left-arm Orthodox,New Zealand,Captain,Royal Challengers Bangalore,Delhi Daredevils,2011,,32,,Blank,Blank,Dl Vettori,V Sehwag,Ab De Villiers,Nv Ojha,1979-01-27
17167,,501232,203,Ca Pujara,1/25/1988,Right-hand Bat,Legbreak,India,Player,Royal Challengers Bangalore,Delhi Daredevils,2011,,23,,Blank,Blank,Dl Vettori,V Sehwag,Ab De Villiers,Nv Ojha,1988-01-25
17170,,501232,283,J Syed Mohammad,6/3/1983,Left-hand Bat,Slow Left-arm Orthodox,India,Player,Royal Challengers Bangalore,Delhi Daredevils,2011,,28,,Blank,Blank,Dl Vettori,V Sehwag,Ab De Villiers,Nv Ojha,1983-06-03
17171,,501232,25,Jr Hopes,10/24/1978,Right-hand Bat,Right-arm Medium,Australia,Player,Delhi Daredevils,Royal Challengers Bangalore,2011,,33,,Blank,Blank,V Sehwag,Dl Vettori,Nv Ojha,Ab De Villiers,1978-10-24
17172,,501232,29,Ik Pathan,10/27/1984,Left-hand Bat,Left-arm Medium-fast,India,Player,Delhi Daredevils,Royal Challengers Bangalore,2011,,27,,Blank,Blank,V Sehwag,Dl Vettori,Nv Ojha,Ab De Villiers,1984-10-27
17176,,501232,183,Nv Ojha,7/20/1983,Right-hand Bat,N/a,India,Keeper,Delhi Daredevils,Royal Challengers Bangalore,2011,,28,,Blank,Blank,V Sehwag,Dl Vettori,Nv Ojha,Ab De Villiers,1983-07-20
17177,,501232,187,Da Warner,10/27/1986,Left-hand Bat,Legbreak,Australia,Player,Delhi Daredevils,Royal Challengers Bangalore,2011,,25,,Blank,Blank,V Sehwag,Dl Vettori,Nv Ojha,Ab De Villiers,1986-10-27
17179,,501232,199,Y Nagar,1/6/1990,Right-hand Bat,Right-arm Offbreak,India,Player,Delhi Daredevils,Royal Challengers Bangalore,2011,,21,,Blank,Blank,V Sehwag,Dl Vettori,Nv Ojha,Ab De Villiers,1990-01-06
17183,,501233,20,Ms Dhoni,7/7/1981,Right-hand Bat,Right-arm Medium,India,Captainkeeper,Chennai Super Kings,Pune Warriors,2011,,30,,Blank,Blank,Ms Dhoni,Yuvraj Singh,Ms Dhoni,Rv Uthappa,1981-07-07
17185,,501233,23,S Badrinath,8/30/1980,Right-hand Bat,Right-arm Offbreak,India,Player,Chennai Super Kings,Pune Warriors,2011,,31,,Blank,Blank,Ms Dhoni,Yuvraj Singh,Ms Dhoni,Rv Uthappa,1980-08-30
17186,,501233,125,S Anirudha,4/14/1987,Right-hand Bat,N/a,India,Player,Chennai Super Kings,Pune Warriors,2011,,24,,Blank,Blank,Ms Dhoni,Yuvraj Singh,Ms Dhoni,Rv Uthappa,1987-04-14
17187,,501233,185,M Vijay,4/1/1984,Right-hand Bat,Right-arm Offbreak,India,Player,Chennai Super Kings,Pune Warriors,2011,,27,,Blank,Blank,Ms Dhoni,Yuvraj Singh,Ms Dhoni,Rv Uthappa,1984-04-01
17190,,501233,248,De Bollinger,7/24/1981,Left-hand Bat,Left-arm Fast-medium,Australia,Player,Chennai Super Kings,Pune Warriors,2011,,30,,Blank,Blank,Ms Dhoni,Yuvraj Singh,Ms Dhoni,Rv Uthappa,1981-07-24
17191,,501233,324,Kmdn Kulasekara,7/22/1982,Right-hand Bat,Right-arm Fast-medium,Sri Lanka,Player,Chennai Super Kings,Pune Warriors,2011,,29,,Blank,Blank,Ms Dhoni,Yuvraj Singh,Ms Dhoni,Rv Uthappa,1982-07-22
17192,,501233,377,Tg Southee,12/11/1988,Right-hand Bat,Right-arm Medium-fast,New Zealand,Player,Chennai Super Kings,Pune Warriors,2011,,23,,Blank,Blank,Ms Dhoni,Yuvraj Singh,Ms Dhoni,Rv Uthappa,1988-12-11
17193,,501233,27,Yuvraj Singh,12/12/1981,Left-hand Bat,Slow Left-arm Orthodox,India,Captain,Pune Warriors,Chennai Super Kings,2011,,30,,Blank,Blank,Yuvraj Singh,Ms Dhoni,Rv Uthappa,Ms Dhoni,1981-12-12
17196,,501233,96,Mk Pandey,9/10/1989,Right-hand Bat,Right-arm Medium,India,Player,Pune Warriors,Chennai Super Kings,2011,,22,,Blank,Blank,Yuvraj Singh,Ms Dhoni,Rv Uthappa,Ms Dhoni,1989-09-10
17198,,501233,171,M Manhas,10/12/1979,Right-hand Bat,Right-arm Offbreak,India,Player,Pune Warriors,Chennai Super Kings,2011,,32,,Blank,Blank,Yuvraj Singh,Ms Dhoni,Rv Uthappa,Ms Dhoni,1979-10-12
17204,,501234,10,Cl White,8/18/1983,Right-hand Bat,Legbreak Googly,Australia,Player,Deccan Chargers,Kochi Tuskers Kerala,2011,,28,,Blank,Blank,Kc Sangakkara,Dpmd Jayawardene,Kc Sangakkara,Pa Patel,1983-08-18
17205,,501234,26,Kc Sangakkara,10/27/1977,Left-hand Bat,Right-arm Offbreak,Sri Lanka,Captainkeeper,Deccan Chargers,Kochi Tuskers Kerala,2011,,34,,Blank,Blank,Kc Sangakkara,Dpmd Jayawardene,Kc Sangakkara,Pa Patel,1977-10-27
17207,,501234,65,S Sohal,11/10/1987,Right-hand Bat,Legbreak,India,Player,Deccan Chargers,Kochi Tuskers Kerala,2011,,24,,Blank,Blank,Kc Sangakkara,Dpmd Jayawardene,Kc Sangakkara,Pa Patel,1987-11-10
17209,,501234,93,B Chipli,1/27/1983,Right-hand Bat,Right-arm Medium,India,Player,Deccan Chargers,Kochi Tuskers Kerala,2011,,28,,Blank,Blank,Kc Sangakkara,Dpmd Jayawardene,Kc Sangakkara,Pa Patel,1983-01-27
17213,,501234,136,A Mishra,11/24/1982,Right-hand Bat,Legbreak,India,Player,Deccan Chargers,Kochi Tuskers Kerala,2011,,29,,Blank,Blank,Kc Sangakkara,Dpmd Jayawardene,Kc Sangakkara,Pa Patel,1982-11-24
17220,,501234,77,S Sreesanth,2/6/1983,Right-hand Bat,Right-arm Fast-medium,India,Player,Kochi Tuskers Kerala,Deccan Chargers,2011,,28,,Blank,Blank,Dpmd Jayawardene,Kc Sangakkara,Pa Patel,Kc Sangakkara,1983-02-06
17221,,501234,81,R Vinay Kumar,2/12/1984,Right-hand Bat,Right-arm Medium,India,Player,Kochi Tuskers Kerala,Deccan Chargers,2011,,27,,Blank,Blank,Dpmd Jayawardene,Kc Sangakkara,Pa Patel,Kc Sangakkara,1984-02-12
17222,,501234,104,Bj Hodge,12/29/1974,Right-hand Bat,Right-arm Offbreak,Australia,Player,Kochi Tuskers Kerala,Deccan Chargers,2011,,37,,Blank,Blank,Dpmd Jayawardene,Kc Sangakkara,Pa Patel,Kc Sangakkara,1974-12-29
17223,,501234,237,Km Jadhav,3/26/1985,Right-hand Bat,Right-arm Offbreak,India,Player,Kochi Tuskers Kerala,Deccan Chargers,2011,,26,,Blank,Blank,Dpmd Jayawardene,Kc Sangakkara,Pa Patel,Kc Sangakkara,1985-03-26
17225,,501234,280,Nltc Perera,4/3/1989,Left-hand Bat,Right-arm Medium-fast,Sri Lanka,Player,Kochi Tuskers Kerala,Deccan Chargers,2011,,22,,Blank,Blank,Dpmd Jayawardene,Kc Sangakkara,Pa Patel,Kc Sangakkara,1989-04-03
17230,,501235,82,Ab Agarkar,12/4/1977,Right-hand Bat,Right-arm Fast,India,Player,Delhi Daredevils,Kolkata Knight Riders,2011,,34,,Blank,Blank,V Sehwag,G Gambhir,Nv Ojha,Sp Goswami,1977-12-04
17238,,501235,31,Yk Pathan,11/17/1982,Right-hand Bat,Right-arm Offbreak,India,Player,Kolkata Knight Riders,Delhi Daredevils,2011,,29,,Blank,Blank,G Gambhir,V Sehwag,Sp Goswami,Nv Ojha,1982-11-17
17241,,501235,87,Mk Tiwary,11/14/1985,Right-hand Bat,Legbreak Googly,India,Player,Kolkata Knight Riders,Delhi Daredevils,2011,,26,,Blank,Blank,G Gambhir,V Sehwag,Sp Goswami,Nv Ojha,1985-11-14
17242,,501235,132,Sp Goswami,5/18/1989,Left-hand Bat,N/a,India,Keeper,Kolkata Knight Riders,Delhi Daredevils,2011,,22,,Blank,Blank,G Gambhir,V Sehwag,Sp Goswami,Nv Ojha,1989-05-18
17244,,501235,151,L Balaji,9/27/1981,Right-hand Bat,Right-arm Medium-fast,India,Player,Kolkata Knight Riders,Delhi Daredevils,2011,,30,,Blank,Blank,G Gambhir,V Sehwag,Sp Goswami,Nv Ojha,1981-09-27
17245,,501235,216,Ejg Morgan,9/10/1986,Left-hand Bat,Right-arm Medium,England,Player,Kolkata Knight Riders,Delhi Daredevils,2011,,25,,Blank,Blank,G Gambhir,V Sehwag,Sp Goswami,Nv Ojha,1986-09-10
17246,,501235,284,Rn Ten Doeschate,6/30/1980,Right-hand Bat,Right-arm Medium-fast,Netherlands,Player,Kolkata Knight Riders,Delhi Daredevils,2011,,31,,Blank,Blank,G Gambhir,V Sehwag,Sp Goswami,Nv Ojha,1980-06-30
17249,,501236,32,Sr Watson,6/17/1981,Right-hand Bat,Right-arm Fast-medium,Australia,Player,Rajasthan Royals,Mumbai Indians,2011,,30,,Blank,Blank,Sk Warne,Sr Tendulkar,Dh Yagnik,Dj Jacobs,1981-06-17
17253,,501236,85,Am Rahane,6/6/1988,Right-hand Bat,Right-arm Medium,India,Player,Rajasthan Royals,Mumbai Indians,2011,,23,,Blank,Blank,Sk Warne,Sr Tendulkar,Dh Yagnik,Dj Jacobs,1988-06-06
17255,,501236,196,A Singh,6/21/1981,Right-hand Bat,Right-arm Medium-fast,India,Player,Rajasthan Royals,Mumbai Indians,2011,,30,,Blank,Blank,Sk Warne,Sr Tendulkar,Dh Yagnik,Dj Jacobs,1981-06-21
17258,,501236,277,Dh Yagnik,6/22/1983,Left-hand Bat,N/a,India,Keeper,Rajasthan Royals,Mumbai Indians,2011,,28,,Blank,Blank,Sk Warne,Sr Tendulkar,Dh Yagnik,Dj Jacobs,1983-06-22
17259,,501236,50,Harbhajan Singh,7/3/1980,Right-hand Bat,Right-arm Offbreak,India,Player,Mumbai Indians,Rajasthan Royals,2011,,31,,Blank,Blank,Sr Tendulkar,Sk Warne,Dj Jacobs,Dh Yagnik,1980-07-03
17261,,501236,57,Rg Sharma,4/30/1987,Right-hand Bat,Right-arm Offbreak,India,Player,Mumbai Indians,Rajasthan Royals,2011,,24,,Blank,Blank,Sr Tendulkar,Sk Warne,Dj Jacobs,Dh Yagnik,1987-04-30
17263,,501236,133,Sr Tendulkar,4/24/1973,Right-hand Bat,Right-arm Offbreak,India,Captain,Mumbai Indians,Rajasthan Royals,2011,,38,,Blank,Blank,Sr Tendulkar,Sk Warne,Dj Jacobs,Dh Yagnik,1973-04-24
17265,,501236,208,At Rayudu,9/23/1985,Right-hand Bat,Right-arm Offbreak,India,Player,Mumbai Indians,Rajasthan Royals,2011,,26,,Blank,Blank,Sr Tendulkar,Sk Warne,Dj Jacobs,Dh Yagnik,1985-09-23
17267,,501236,221,Ka Pollard,5/12/1987,Right-hand Bat,Right-arm Medium-fast,West Indies,Player,Mumbai Indians,Rajasthan Royals,2011,,24,,Blank,Blank,Sr Tendulkar,Sk Warne,Dj Jacobs,Dh Yagnik,1987-05-12
17268,,501236,263,Dj Jacobs,11/4/1982,Right-hand Bat,Right-arm Medium,South Africa,Keeper,Mumbai Indians,Rajasthan Royals,2011,,29,,Blank,Blank,Sr Tendulkar,Sk Warne,Dj Jacobs,Dh Yagnik,1982-11-04
17271,,501237,15,Z Khan,10/7/1978,Right-hand Bat,Left-arm Fast-medium,India,Player,Royal Challengers Bangalore,Pune Warriors,2011,,33,,Blank,Blank,Dl Vettori,Yuvraj Singh,Ab De Villiers,Rv Uthappa,1978-10-07
17274,,501237,110,Ab De Villiers,2/17/1984,Right-hand Bat,Right-arm Medium,South Africa,Keeper,Royal Challengers Bangalore,Pune Warriors,2011,,27,,Blank,Blank,Dl Vettori,Yuvraj Singh,Ab De Villiers,Rv Uthappa,1984-02-17
17276,,501237,162,Ch Gayle,9/21/1979,Left-hand Bat,Right-arm Offbreak,West Indies,Player,Royal Challengers Bangalore,Pune Warriors,2011,,32,,Blank,Blank,Dl Vettori,Yuvraj Singh,Ab De Villiers,Rv Uthappa,1979-09-21
17281,,501237,27,Yuvraj Singh,12/12/1981,Left-hand Bat,Slow Left-arm Orthodox,India,Captain,Pune Warriors,Royal Challengers Bangalore,2011,,30,,Blank,Blank,Yuvraj Singh,Dl Vettori,Rv Uthappa,Ab De Villiers,1981-12-12
17282,,501237,46,Rv Uthappa,11/11/1985,Right-hand Bat,Right-arm Medium,India,Keeper,Pune Warriors,Royal Challengers Bangalore,2011,,26,,Blank,Blank,Yuvraj Singh,Dl Vettori,Rv Uthappa,Ab De Villiers,1985-11-11
17283,,501237,96,Mk Pandey,9/10/1989,Right-hand Bat,Right-arm Medium,India,Player,Pune Warriors,Royal Challengers Bangalore,2011,,22,,Blank,Blank,Yuvraj Singh,Dl Vettori,Rv Uthappa,Ab De Villiers,1989-09-10
17285,,501237,160,Kamran Khan,3/10/1991,Left-hand Bat,Left-arm Medium-fast,India,Player,Pune Warriors,Royal Challengers Bangalore,2011,,20,,Blank,Blank,Yuvraj Singh,Dl Vettori,Rv Uthappa,Ab De Villiers,1991-03-10
17286,,501237,171,M Manhas,10/12/1979,Right-hand Bat,Right-arm Offbreak,India,Player,Pune Warriors,Royal Challengers Bangalore,2011,,32,,Blank,Blank,Yuvraj Singh,Dl Vettori,Rv Uthappa,Ab De Villiers,1979-10-12
17291,,501237,287,Harpreet Singh,8/11/1991,Left-hand Bat,Right-arm Medium,India,Player,Pune Warriors,Royal Challengers Bangalore,2011,,20,,Blank,Blank,Yuvraj Singh,Dl Vettori,Rv Uthappa,Ab De Villiers,1991-08-11
17295,,501238,82,Ab Agarkar,12/4/1977,Right-hand Bat,Right-arm Fast,India,Player,Delhi Daredevils,Kochi Tuskers Kerala,2011,,34,,Blank,Blank,V Sehwag,Dpmd Jayawardene,Nv Ojha,Pa Patel,1977-12-04
17296,,501238,177,Re Van Der Merwe,12/31/1984,Right-hand Bat,Slow Left-arm Orthodox,South Africa,Player,Delhi Daredevils,Kochi Tuskers Kerala,2011,,27,,Blank,Blank,V Sehwag,Dpmd Jayawardene,Nv Ojha,Pa Patel,1984-12-31
17297,,501238,183,Nv Ojha,7/20/1983,Right-hand Bat,N/a,India,Keeper,Delhi Daredevils,Kochi Tuskers Kerala,2011,,28,,Blank,Blank,V Sehwag,Dpmd Jayawardene,Nv Ojha,Pa Patel,1983-07-20
17305,,501238,17,Pa Patel,3/9/1985,Left-hand Bat,N/a,India,Keeper,Kochi Tuskers Kerala,Delhi Daredevils,2011,,26,,Blank,Blank,Dpmd Jayawardene,V Sehwag,Pa Patel,Nv Ojha,1985-03-09
17307,,501238,61,Rp Singh,12/6/1985,Right-hand Bat,Left-arm Fast-medium,India,Player,Kochi Tuskers Kerala,Delhi Daredevils,2011,,26,,Blank,Blank,Dpmd Jayawardene,V Sehwag,Pa Patel,Nv Ojha,1985-12-06
17312,,501238,153,Rr Powar,5/20/1978,Right-hand Bat,Right-arm Offbreak,India,Player,Kochi Tuskers Kerala,Delhi Daredevils,2011,,33,,Blank,Blank,Dpmd Jayawardene,V Sehwag,Pa Patel,Nv Ojha,1978-05-20
17313,,501238,288,M Klinger,7/4/1980,Right-hand Bat,N/a,Australia,Player,Kochi Tuskers Kerala,Delhi Daredevils,2011,,31,,Blank,Blank,Dpmd Jayawardene,V Sehwag,Pa Patel,Nv Ojha,1980-07-04
17314,,501239,4,Dj Hussey,7/15/1977,Right-hand Bat,Right-arm Offbreak,Australia,Player,Kings Xi Punjab,Kolkata Knight Riders,2011,,34,,Blank,Blank,Ac Gilchrist,G Gambhir,Ac Gilchrist,Sp Goswami,1977-07-15
17318,,501239,67,Pp Chawla,12/24/1988,Left-hand Bat,Legbreak,India,Player,Kings Xi Punjab,Kolkata Knight Riders,2011,,23,,Blank,Blank,Ac Gilchrist,G Gambhir,Ac Gilchrist,Sp Goswami,1988-12-24
17319,,501239,88,Kd Karthik,6/1/1985,Right-hand Bat,N/a,India,Player,Kings Xi Punjab,Kolkata Knight Riders,2011,,26,,Blank,Blank,Ac Gilchrist,G Gambhir,Ac Gilchrist,Sp Goswami,1985-06-01
17323,,501239,228,Bipul Sharma,9/28/1983,Left-hand Bat,Slow Left-arm Orthodox,India,Player,Kings Xi Punjab,Kolkata Knight Riders,2011,,28,,Blank,Blank,Ac Gilchrist,G Gambhir,Ac Gilchrist,Sp Goswami,1983-09-28
17324,,501239,302,Ba Bhatt,5/13/1990,Left-hand Bat,Slow Left-arm Orthodox,India,Player,Kings Xi Punjab,Kolkata Knight Riders,2011,,21,,Blank,Blank,Ac Gilchrist,G Gambhir,Ac Gilchrist,Sp Goswami,1990-05-13
17325,,501239,9,Jh Kallis,10/16/1975,Right-hand Bat,Right-arm Fast-medium,South Africa,Player,Kolkata Knight Riders,Kings Xi Punjab,2011,,36,,Blank,Blank,G Gambhir,Ac Gilchrist,Sp Goswami,Ac Gilchrist,1975-10-16
17326,,501239,31,Yk Pathan,11/17/1982,Right-hand Bat,Right-arm Offbreak,India,Player,Kolkata Knight Riders,Kings Xi Punjab,2011,,29,,Blank,Blank,G Gambhir,Ac Gilchrist,Sp Goswami,Ac Gilchrist,1982-11-17
17330,,501239,89,R Bhatia,10/22/1979,Right-hand Bat,Right-arm Medium-fast,India,Player,Kolkata Knight Riders,Kings Xi Punjab,2011,,32,,Blank,Blank,G Gambhir,Ac Gilchrist,Sp Goswami,Ac Gilchrist,1979-10-22
17331,,501239,132,Sp Goswami,5/18/1989,Left-hand Bat,N/a,India,Keeper,Kolkata Knight Riders,Kings Xi Punjab,2011,,22,,Blank,Blank,G Gambhir,Ac Gilchrist,Sp Goswami,Ac Gilchrist,1989-05-18
17332,,501239,140,Iqbal Abdulla,12/2/1989,Left-hand Bat,Slow Left-arm Orthodox,India,Player,Kolkata Knight Riders,Kings Xi Punjab,2011,,22,,Blank,Blank,G Gambhir,Ac Gilchrist,Sp Goswami,Ac Gilchrist,1989-12-02
17335,,501239,284,Rn Ten Doeschate,6/30/1980,Right-hand Bat,Right-arm Medium-fast,Netherlands,Player,Kolkata Knight Riders,Kings Xi Punjab,2011,,31,,Blank,Blank,G Gambhir,Ac Gilchrist,Sp Goswami,Ac Gilchrist,1980-06-30
17336,,501240,6,R Dravid,1/11/1973,Right-hand Bat,Right-arm Offbreak,India,Player,Rajasthan Royals,Pune Warriors,2011,,38,,Blank,Blank,Sk Warne,Yuvraj Singh,Dh Yagnik,Rv Uthappa,1973-01-11
17342,,501240,192,J Botha,5/2/1982,Right-hand Bat,Right-arm Offbreak,South Africa,Player,Rajasthan Royals,Pune Warriors,2011,,29,,Blank,Blank,Sk Warne,Yuvraj Singh,Dh Yagnik,Rv Uthappa,1982-05-02
17345,,501240,266,Al Menaria,10/29/1990,Left-hand Bat,Slow Left-arm Orthodox,India,Player,Rajasthan Royals,Pune Warriors,2011,,21,,Blank,Blank,Sk Warne,Yuvraj Singh,Dh Yagnik,Rv Uthappa,1990-10-29
17346,,501240,277,Dh Yagnik,6/22/1983,Left-hand Bat,N/a,India,Keeper,Rajasthan Royals,Pune Warriors,2011,,28,,Blank,Blank,Sk Warne,Yuvraj Singh,Dh Yagnik,Rv Uthappa,1983-06-22
17347,,501240,27,Yuvraj Singh,12/12/1981,Left-hand Bat,Slow Left-arm Orthodox,India,Captain,Pune Warriors,Rajasthan Royals,2011,,30,,Blank,Blank,Yuvraj Singh,Sk Warne,Rv Uthappa,Dh Yagnik,1981-12-12
17350,,501240,96,Mk Pandey,9/10/1989,Right-hand Bat,Right-arm Medium,India,Player,Pune Warriors,Rajasthan Royals,2011,,22,,Blank,Blank,Yuvraj Singh,Sk Warne,Rv Uthappa,Dh Yagnik,1989-09-10
17353,,501240,235,R Sharma,4/30/1987,Right-hand Bat,Right-arm Offbreak,India,Player,Pune Warriors,Rajasthan Royals,2011,,24,,Blank,Blank,Yuvraj Singh,Sk Warne,Rv Uthappa,Dh Yagnik,1987-04-30
17357,,501240,287,Harpreet Singh,8/11/1991,Left-hand Bat,Right-arm Medium,India,Player,Pune Warriors,Rajasthan Royals,2011,,20,,Blank,Blank,Yuvraj Singh,Sk Warne,Rv Uthappa,Dh Yagnik,1991-08-11
17358,,501241,10,Cl White,8/18/1983,Right-hand Bat,Legbreak Googly,Australia,Player,Deccan Chargers,Chennai Super Kings,2011,,28,,Blank,Blank,Kc Sangakkara,Ms Dhoni,Kc Sangakkara,Ms Dhoni,1983-08-18
17359,,501241,26,Kc Sangakkara,10/27/1977,Left-hand Bat,Right-arm Offbreak,Sri Lanka,Captainkeeper,Deccan Chargers,Chennai Super Kings,2011,,34,,Blank,Blank,Kc Sangakkara,Ms Dhoni,Kc Sangakkara,Ms Dhoni,1977-10-27
17362,,501241,84,I Sharma,9/2/1988,Right-hand Bat,Right-arm Fast-medium,India,Player,Deccan Chargers,Chennai Super Kings,2011,,23,,Blank,Blank,Kc Sangakkara,Ms Dhoni,Kc Sangakkara,Ms Dhoni,1988-09-02
17373,,501241,109,Ja Morkel,6/10/1981,Left-hand Bat,Right-arm Medium-fast,South Africa,Player,Chennai Super Kings,Deccan Chargers,2011,,30,,Blank,Blank,Ms Dhoni,Kc Sangakkara,Ms Dhoni,Kc Sangakkara,1981-06-10
17377,,501241,201,R Ashwin,9/17/1986,Right-hand Bat,Right-arm Offbreak,India,Player,Chennai Super Kings,Deccan Chargers,2011,,25,,Blank,Blank,Ms Dhoni,Kc Sangakkara,Ms Dhoni,Kc Sangakkara,1986-09-17
17378,,501241,248,De Bollinger,7/24/1981,Left-hand Bat,Left-arm Fast-medium,Australia,Player,Chennai Super Kings,Deccan Chargers,2011,,30,,Blank,Blank,Ms Dhoni,Kc Sangakkara,Ms Dhoni,Kc Sangakkara,1981-07-24
17382,,501242,48,Am Nayar,10/8/1983,Left-hand Bat,Right-arm Medium,India,Player,Kings Xi Punjab,Mumbai Indians,2011,,28,,Blank,Blank,Ac Gilchrist,Sr Tendulkar,Ac Gilchrist,Dj Jacobs,1983-10-08
17384,,501242,67,Pp Chawla,12/24/1988,Left-hand Bat,Legbreak,India,Player,Kings Xi Punjab,Mumbai Indians,2011,,23,,Blank,Blank,Ac Gilchrist,Sr Tendulkar,Ac Gilchrist,Dj Jacobs,1988-12-24
17385,,501242,88,Kd Karthik,6/1/1985,Right-hand Bat,N/a,India,Player,Kings Xi Punjab,Mumbai Indians,2011,,26,,Blank,Blank,Ac Gilchrist,Sr Tendulkar,Ac Gilchrist,Dj Jacobs,1985-06-01
17386,,501242,100,Se Marsh,7/9/1983,Left-hand Bat,Slow Left-arm Orthodox,Australia,Player,Kings Xi Punjab,Mumbai Indians,2011,,28,,Blank,Blank,Ac Gilchrist,Sr Tendulkar,Ac Gilchrist,Dj Jacobs,1983-07-09
17388,,501242,188,Rj Harris,10/11/1979,Right-hand Bat,Right-arm Fast,Australia,Player,Kings Xi Punjab,Mumbai Indians,2011,,32,,Blank,Blank,Ac Gilchrist,Sr Tendulkar,Ac Gilchrist,Dj Jacobs,1979-10-11
17389,,501242,228,Bipul Sharma,9/28/1983,Left-hand Bat,Slow Left-arm Orthodox,India,Player,Kings Xi Punjab,Mumbai Indians,2011,,28,,Blank,Blank,Ac Gilchrist,Sr Tendulkar,Ac Gilchrist,Dj Jacobs,1983-09-28
17392,,501242,56,A Symonds,6/9/1975,Right-hand Bat,Right-arm Offbreak,Australia,Player,Mumbai Indians,Kings Xi Punjab,2011,,36,,Blank,Blank,Sr Tendulkar,Ac Gilchrist,Dj Jacobs,Ac Gilchrist,1975-06-09
17394,,501242,126,Mm Patel,7/12/1983,Right-hand Bat,Right-arm Medium-fast,India,Player,Mumbai Indians,Kings Xi Punjab,2011,,28,,Blank,Blank,Sr Tendulkar,Ac Gilchrist,Dj Jacobs,Ac Gilchrist,1983-07-12
17396,,501242,178,Tl Suman,12/15/1983,Right-hand Bat,Right-arm Offbreak,India,Player,Mumbai Indians,Kings Xi Punjab,2011,,28,,Blank,Blank,Sr Tendulkar,Ac Gilchrist,Dj Jacobs,Ac Gilchrist,1983-12-15
17397,,501242,194,Sl Malinga,8/28/1983,Right-hand Bat,Right-arm Fast,Sri Lanka,Player,Mumbai Indians,Kings Xi Punjab,2011,,28,,Blank,Blank,Sr Tendulkar,Ac Gilchrist,Dj Jacobs,Ac Gilchrist,1983-08-28
17398,,501242,208,At Rayudu,9/23/1985,Right-hand Bat,Right-arm Offbreak,India,Player,Mumbai Indians,Kings Xi Punjab,2011,,26,,Blank,Blank,Sr Tendulkar,Ac Gilchrist,Dj Jacobs,Ac Gilchrist,1985-09-23
17399,,501242,221,Ka Pollard,5/12/1987,Right-hand Bat,Right-arm Medium-fast,West Indies,Player,Mumbai Indians,Kings Xi Punjab,2011,,24,,Blank,Blank,Sr Tendulkar,Ac Gilchrist,Dj Jacobs,Ac Gilchrist,1987-05-12
17400,,501242,246,An Ahmed,11/5/1988,Right-hand Bat,Right-arm Medium-fast,India,Player,Mumbai Indians,Kings Xi Punjab,2011,,23,,Blank,Blank,Sr Tendulkar,Ac Gilchrist,Dj Jacobs,Ac Gilchrist,1988-11-05
17407,,501243,183,Nv Ojha,7/20/1983,Right-hand Bat,N/a,India,Keeper,Delhi Daredevils,Kochi Tuskers Kerala,2011,,28,,Blank,Blank,V Sehwag,Dpmd Jayawardene,Nv Ojha,Pa Patel,1983-07-20
17419,,501243,81,R Vinay Kumar,2/12/1984,Right-hand Bat,Right-arm Medium,India,Player,Kochi Tuskers Kerala,Delhi Daredevils,2011,,27,,Blank,Blank,Dpmd Jayawardene,V Sehwag,Pa Patel,Nv Ojha,1984-02-12
17420,,501243,104,Bj Hodge,12/29/1974,Right-hand Bat,Right-arm Offbreak,Australia,Player,Kochi Tuskers Kerala,Delhi Daredevils,2011,,37,,Blank,Blank,Dpmd Jayawardene,V Sehwag,Pa Patel,Nv Ojha,1974-12-29
17423,,501243,294,P Parameswaran,5/30/1985,Right-hand Bat,Left-arm Medium,India,Player,Kochi Tuskers Kerala,Delhi Daredevils,2011,,26,,Blank,Blank,Dpmd Jayawardene,V Sehwag,Pa Patel,Nv Ojha,1985-05-30
17424,,501244,10,Cl White,8/18/1983,Right-hand Bat,Legbreak Googly,Australia,Player,Deccan Chargers,Kolkata Knight Riders,2011,,28,,Blank,Blank,Kc Sangakkara,G Gambhir,Kc Sangakkara,Mv Boucher,1983-08-18
17427,,501244,65,S Sohal,11/10/1987,Right-hand Bat,Legbreak,India,Player,Deccan Chargers,Kolkata Knight Riders,2011,,24,,Blank,Blank,Kc Sangakkara,G Gambhir,Kc Sangakkara,Mv Boucher,1987-11-10
17429,,501244,93,B Chipli,1/27/1983,Right-hand Bat,Right-arm Medium,India,Player,Deccan Chargers,Kolkata Knight Riders,2011,,28,,Blank,Blank,Kc Sangakkara,G Gambhir,Kc Sangakkara,Mv Boucher,1983-01-27
17430,,501244,94,Dw Steyn,6/27/1983,Right-hand Bat,Right-arm Fast,South Africa,Player,Deccan Chargers,Kolkata Knight Riders,2011,,28,,Blank,Blank,Kc Sangakkara,G Gambhir,Kc Sangakkara,Mv Boucher,1983-06-27
17433,,501244,136,A Mishra,11/24/1982,Right-hand Bat,Legbreak,India,Player,Deccan Chargers,Kolkata Knight Riders,2011,,29,,Blank,Blank,Kc Sangakkara,G Gambhir,Kc Sangakkara,Mv Boucher,1982-11-24
17435,,501244,9,Jh Kallis,10/16/1975,Right-hand Bat,Right-arm Fast-medium,South Africa,Player,Kolkata Knight Riders,Deccan Chargers,2011,,36,,Blank,Blank,G Gambhir,Kc Sangakkara,Mv Boucher,Kc Sangakkara,1975-10-16
17437,,501244,31,Yk Pathan,11/17/1982,Right-hand Bat,Right-arm Offbreak,India,Player,Kolkata Knight Riders,Deccan Chargers,2011,,29,,Blank,Blank,G Gambhir,Kc Sangakkara,Mv Boucher,Kc Sangakkara,1982-11-17
17438,,501244,40,G Gambhir,10/14/1981,Left-hand Bat,Legbreak,India,Captain,Kolkata Knight Riders,Deccan Chargers,2011,,30,,Blank,Blank,G Gambhir,Kc Sangakkara,Mv Boucher,Kc Sangakkara,1981-10-14
17444,,501244,216,Ejg Morgan,9/10/1986,Left-hand Bat,Right-arm Medium,England,Player,Kolkata Knight Riders,Deccan Chargers,2011,,25,,Blank,Blank,G Gambhir,Kc Sangakkara,Mv Boucher,Kc Sangakkara,1986-09-10
17447,,501245,32,Sr Watson,6/17/1981,Right-hand Bat,Right-arm Fast-medium,Australia,Player,Rajasthan Royals,Chennai Super Kings,2011,,30,,Blank,Blank,Sk Warne,Ms Dhoni,Dh Yagnik,Ms Dhoni,1981-06-17
17448,,501245,38,Sk Warne,9/13/1969,Right-hand Bat,Legbreak Googly,Australia,Captain,Rajasthan Royals,Chennai Super Kings,2011,,42,,Blank,Blank,Sk Warne,Ms Dhoni,Dh Yagnik,Ms Dhoni,1969-09-13
17453,,501245,255,Str Binny,6/3/1984,Right-hand Bat,Right-arm Medium,India,Player,Rajasthan Royals,Chennai Super Kings,2011,,27,,Blank,Blank,Sk Warne,Ms Dhoni,Dh Yagnik,Ms Dhoni,1984-06-03
17455,,501245,277,Dh Yagnik,6/22/1983,Left-hand Bat,N/a,India,Keeper,Rajasthan Royals,Chennai Super Kings,2011,,28,,Blank,Blank,Sk Warne,Ms Dhoni,Dh Yagnik,Ms Dhoni,1983-06-22
17457,,501245,19,Mek Hussey,5/27/1975,Left-hand Bat,Right-arm Medium,Australia,Player,Chennai Super Kings,Rajasthan Royals,2011,,36,,Blank,Blank,Ms Dhoni,Sk Warne,Ms Dhoni,Dh Yagnik,1975-05-27
17462,,501245,125,S Anirudha,4/14/1987,Right-hand Bat,N/a,India,Player,Chennai Super Kings,Rajasthan Royals,2011,,24,,Blank,Blank,Ms Dhoni,Sk Warne,Ms Dhoni,Dh Yagnik,1987-04-14
17463,,501245,185,M Vijay,4/1/1984,Right-hand Bat,Right-arm Offbreak,India,Player,Chennai Super Kings,Rajasthan Royals,2011,,27,,Blank,Blank,Ms Dhoni,Sk Warne,Ms Dhoni,Dh Yagnik,1984-04-01
17465,,501245,201,R Ashwin,9/17/1986,Right-hand Bat,Right-arm Offbreak,India,Player,Chennai Super Kings,Rajasthan Royals,2011,,25,,Blank,Blank,Ms Dhoni,Sk Warne,Ms Dhoni,Dh Yagnik,1986-09-17
17466,,501245,248,De Bollinger,7/24/1981,Left-hand Bat,Left-arm Fast-medium,Australia,Player,Chennai Super Kings,Rajasthan Royals,2011,,30,,Blank,Blank,Ms Dhoni,Sk Warne,Ms Dhoni,Dh Yagnik,1981-07-24
17475,,501246,194,Sl Malinga,8/28/1983,Right-hand Bat,Right-arm Fast,Sri Lanka,Player,Mumbai Indians,Pune Warriors,2011,,28,,Blank,Blank,Sr Tendulkar,Yuvraj Singh,At Rayudu,Rv Uthappa,1983-08-28
17476,,501246,208,At Rayudu,9/23/1985,Right-hand Bat,Right-arm Offbreak,India,Keeper,Mumbai Indians,Pune Warriors,2011,,26,,Blank,Blank,Sr Tendulkar,Yuvraj Singh,At Rayudu,Rv Uthappa,1985-09-23
17477,,501246,221,Ka Pollard,5/12/1987,Right-hand Bat,Right-arm Medium-fast,West Indies,Player,Mumbai Indians,Pune Warriors,2011,,24,,Blank,Blank,Sr Tendulkar,Yuvraj Singh,At Rayudu,Rv Uthappa,1987-05-12
17478,,501246,289,Ac Blizzard,6/27/1984,Left-hand Bat,Left-arm Medium,Australia,Player,Mumbai Indians,Pune Warriors,2011,,27,,Blank,Blank,Sr Tendulkar,Yuvraj Singh,At Rayudu,Rv Uthappa,1984-06-27
17482,,501246,96,Mk Pandey,9/10/1989,Right-hand Bat,Right-arm Medium,India,Player,Pune Warriors,Mumbai Indians,2011,,22,,Blank,Blank,Yuvraj Singh,Sr Tendulkar,Rv Uthappa,At Rayudu,1989-09-10
17483,,501246,157,Jd Ryder,8/6/1984,Left-hand Bat,Right-arm Medium,New Zealand,Player,Pune Warriors,Mumbai Indians,2011,,27,,Blank,Blank,Yuvraj Singh,Sr Tendulkar,Rv Uthappa,At Rayudu,1984-08-06
17484,,501246,171,M Manhas,10/12/1979,Right-hand Bat,Right-arm Offbreak,India,Player,Pune Warriors,Mumbai Indians,2011,,32,,Blank,Blank,Yuvraj Singh,Sr Tendulkar,Rv Uthappa,At Rayudu,1979-10-12
17486,,501246,235,R Sharma,4/30/1987,Right-hand Bat,Right-arm Offbreak,India,Player,Pune Warriors,Mumbai Indians,2011,,24,,Blank,Blank,Yuvraj Singh,Sr Tendulkar,Rv Uthappa,At Rayudu,1987-04-30
17488,,501246,274,Ac Thomas,2/9/1977,Right-hand Bat,Right-arm Fast-medium,England,Player,Pune Warriors,Mumbai Indians,2011,,34,,Blank,Blank,Yuvraj Singh,Sr Tendulkar,Rv Uthappa,At Rayudu,1977-02-09
17492,,501247,31,Yk Pathan,11/17/1982,Right-hand Bat,Right-arm Offbreak,India,Player,Kolkata Knight Riders,Kochi Tuskers Kerala,2011,,29,,Blank,Blank,G Gambhir,Dpmd Jayawardene,Mv Boucher,Pa Patel,1982-11-17
17496,,501247,89,R Bhatia,10/22/1979,Right-hand Bat,Right-arm Medium-fast,India,Player,Kolkata Knight Riders,Kochi Tuskers Kerala,2011,,32,,Blank,Blank,G Gambhir,Dpmd Jayawardene,Mv Boucher,Pa Patel,1979-10-22
17500,,501247,346,Jd Unadkat,10/18/1991,Right-hand Bat,Left-arm Medium,India,Player,Kolkata Knight Riders,Kochi Tuskers Kerala,2011,,20,,Blank,Blank,G Gambhir,Dpmd Jayawardene,Mv Boucher,Pa Patel,1991-10-18
17502,,501247,17,Pa Patel,3/9/1985,Left-hand Bat,N/a,India,Keeper,Kochi Tuskers Kerala,Kolkata Knight Riders,2011,,26,,Blank,Blank,Dpmd Jayawardene,G Gambhir,Pa Patel,Mv Boucher,1985-03-09
17503,,501247,35,Ra Jadeja,12/6/1988,Left-hand Bat,Slow Left-arm Orthodox,India,Player,Kochi Tuskers Kerala,Kolkata Knight Riders,2011,,23,,Blank,Blank,Dpmd Jayawardene,G Gambhir,Pa Patel,Mv Boucher,1988-12-06
17504,,501247,61,Rp Singh,12/6/1985,Right-hand Bat,Left-arm Fast-medium,India,Player,Kochi Tuskers Kerala,Kolkata Knight Riders,2011,,26,,Blank,Blank,Dpmd Jayawardene,G Gambhir,Pa Patel,Mv Boucher,1985-12-06
17505,,501247,64,Dpmd Jayawardene,5/27/1977,Right-hand Bat,Right-arm Medium,Sri Lanka,Captain,Kochi Tuskers Kerala,Kolkata Knight Riders,2011,,34,,Blank,Blank,Dpmd Jayawardene,G Gambhir,Pa Patel,Mv Boucher,1977-05-27
17506,,501247,77,S Sreesanth,2/6/1983,Right-hand Bat,Right-arm Fast-medium,India,Player,Kochi Tuskers Kerala,Kolkata Knight Riders,2011,,28,,Blank,Blank,Dpmd Jayawardene,G Gambhir,Pa Patel,Mv Boucher,1983-02-06
17508,,501247,104,Bj Hodge,12/29/1974,Right-hand Bat,Right-arm Offbreak,Australia,Player,Kochi Tuskers Kerala,Kolkata Knight Riders,2011,,37,,Blank,Blank,Dpmd Jayawardene,G Gambhir,Pa Patel,Mv Boucher,1974-12-29
17509,,501247,259,Rv Gomez,10/16/1985,Right-hand Bat,Right-arm Medium,India,Player,Kochi Tuskers Kerala,Kolkata Knight Riders,2011,,26,,Blank,Blank,Dpmd Jayawardene,G Gambhir,Pa Patel,Mv Boucher,1985-10-16
17510,,501247,288,M Klinger,7/4/1980,Right-hand Bat,N/a,Australia,Player,Kochi Tuskers Kerala,Kolkata Knight Riders,2011,,31,,Blank,Blank,Dpmd Jayawardene,G Gambhir,Pa Patel,Mv Boucher,1980-07-04
17513,,501248,42,S Dhawan,12/5/1985,Left-hand Bat,Right-arm Offbreak,India,Player,Deccan Chargers,Delhi Daredevils,2011,,26,,Blank,Blank,Kc Sangakkara,V Sehwag,Kc Sangakkara,Nv Ojha,1985-12-05
17515,,501248,84,I Sharma,9/2/1988,Right-hand Bat,Right-arm Fast-medium,India,Player,Deccan Chargers,Delhi Daredevils,2011,,23,,Blank,Blank,Kc Sangakkara,V Sehwag,Kc Sangakkara,Nv Ojha,1988-09-02
17517,,501248,94,Dw Steyn,6/27/1983,Right-hand Bat,Right-arm Fast,South Africa,Player,Deccan Chargers,Delhi Daredevils,2011,,28,,Blank,Blank,Kc Sangakkara,V Sehwag,Kc Sangakkara,Nv Ojha,1983-06-27
17519,,501248,136,A Mishra,11/24/1982,Right-hand Bat,Legbreak,India,Player,Deccan Chargers,Delhi Daredevils,2011,,29,,Blank,Blank,Kc Sangakkara,V Sehwag,Kc Sangakkara,Nv Ojha,1982-11-24
17524,,501248,29,Ik Pathan,10/27/1984,Left-hand Bat,Left-arm Medium-fast,India,Player,Delhi Daredevils,Deccan Chargers,2011,,27,,Blank,Blank,V Sehwag,Kc Sangakkara,Nv Ojha,Kc Sangakkara,1984-10-27
17525,,501248,41,V Sehwag,10/20/1978,Right-hand Bat,Right-arm Offbreak,India,Captain,Delhi Daredevils,Deccan Chargers,2011,,33,,Blank,Blank,V Sehwag,Kc Sangakkara,Nv Ojha,Kc Sangakkara,1978-10-20
17528,,501248,183,Nv Ojha,7/20/1983,Right-hand Bat,N/a,India,Keeper,Delhi Daredevils,Deccan Chargers,2011,,28,,Blank,Blank,V Sehwag,Kc Sangakkara,Nv Ojha,Kc Sangakkara,1983-07-20
17531,,501248,254,Aj Finch,11/17/1986,Right-hand Bat,Slow Left-arm Orthodox,Australia,Player,Delhi Daredevils,Deccan Chargers,2011,,25,,Blank,Blank,V Sehwag,Kc Sangakkara,Nv Ojha,Kc Sangakkara,1986-11-17
17535,,501249,15,Z Khan,10/7/1978,Right-hand Bat,Left-arm Fast-medium,India,Player,Royal Challengers Bangalore,Kings Xi Punjab,2011,,33,,Blank,Blank,Dl Vettori,Ac Gilchrist,Ab De Villiers,Ac Gilchrist,1978-10-07
17536,,501249,33,M Kaif,12/1/1980,Right-hand Bat,Right-arm Offbreak,India,Player,Royal Challengers Bangalore,Kings Xi Punjab,2011,,31,,Blank,Blank,Dl Vettori,Ac Gilchrist,Ab De Villiers,Ac Gilchrist,1980-12-01
17539,,501249,135,Tm Dilshan,10/14/1976,Right-hand Bat,Right-arm Offbreak,Sri Lanka,Player,Royal Challengers Bangalore,Kings Xi Punjab,2011,,35,,Blank,Blank,Dl Vettori,Ac Gilchrist,Ab De Villiers,Ac Gilchrist,1976-10-14
17542,,501249,244,A Mithun,10/25/1989,Right-hand Bat,Right-arm Medium,India,Player,Royal Challengers Bangalore,Kings Xi Punjab,2011,,22,,Blank,Blank,Dl Vettori,Ac Gilchrist,Ab De Villiers,Ac Gilchrist,1989-10-25
17543,,501249,261,Auk Pathan,6/17/1984,Right-hand Bat,Right-arm Medium,India,Player,Royal Challengers Bangalore,Kings Xi Punjab,2011,,27,,Blank,Blank,Dl Vettori,Ac Gilchrist,Ab De Villiers,Ac Gilchrist,1984-06-17
17544,,501249,270,S Aravind,4/8/1984,Left-hand Bat,Left-arm Medium-fast,India,Player,Royal Challengers Bangalore,Kings Xi Punjab,2011,,27,,Blank,Blank,Dl Vettori,Ac Gilchrist,Ab De Villiers,Ac Gilchrist,1984-04-08
17545,,501249,14,P Kumar,10/2/1986,Right-hand Bat,Right-arm Medium,India,Player,Kings Xi Punjab,Royal Challengers Bangalore,2011,,25,,Blank,Blank,Ac Gilchrist,Dl Vettori,Ac Gilchrist,Ab De Villiers,1986-10-02
17547,,501249,53,Ac Gilchrist,11/14/1971,Left-hand Bat,Right-arm Offbreak,Australia,Captainkeeper,Kings Xi Punjab,Royal Challengers Bangalore,2011,,40,,Blank,Blank,Ac Gilchrist,Dl Vettori,Ac Gilchrist,Ab De Villiers,1971-11-14
17549,,501249,88,Kd Karthik,6/1/1985,Right-hand Bat,N/a,India,Player,Kings Xi Punjab,Royal Challengers Bangalore,2011,,26,,Blank,Blank,Ac Gilchrist,Dl Vettori,Ac Gilchrist,Ab De Villiers,1985-06-01
17550,,501249,100,Se Marsh,7/9/1983,Left-hand Bat,Slow Left-arm Orthodox,Australia,Player,Kings Xi Punjab,Royal Challengers Bangalore,2011,,28,,Blank,Blank,Ac Gilchrist,Dl Vettori,Ac Gilchrist,Ab De Villiers,1983-07-09
17551,,501249,167,Pc Valthaty,12/7/1983,Right-hand Bat,Right-arm Medium,India,Player,Kings Xi Punjab,Royal Challengers Bangalore,2011,,28,,Blank,Blank,Ac Gilchrist,Dl Vettori,Ac Gilchrist,Ab De Villiers,1983-12-07
17554,,501249,264,Sunny Singh,12/18/1986,Right-hand Bat,Right-arm Medium-fast,India,Player,Kings Xi Punjab,Royal Challengers Bangalore,2011,,25,,Blank,Blank,Ac Gilchrist,Dl Vettori,Ac Gilchrist,Ab De Villiers,1986-12-18
17556,,501250,19,Mek Hussey,5/27/1975,Left-hand Bat,Right-arm Medium,Australia,Player,Chennai Super Kings,Kolkata Knight Riders,2011,,36,,Blank,Blank,Ms Dhoni,G Gambhir,Ms Dhoni,Mv Boucher,1975-05-27
17560,,501250,62,Wp Saha,10/24/1984,Right-hand Bat,N/a,India,Player,Chennai Super Kings,Kolkata Knight Riders,2011,,27,,Blank,Blank,Ms Dhoni,G Gambhir,Ms Dhoni,Mv Boucher,1984-10-24
17563,,501250,186,Sb Jakati,11/27/1980,Left-hand Bat,Slow Left-arm Orthodox,India,Player,Chennai Super Kings,Kolkata Knight Riders,2011,,31,,Blank,Blank,Ms Dhoni,G Gambhir,Ms Dhoni,Mv Boucher,1980-11-27
17564,,501250,201,R Ashwin,9/17/1986,Right-hand Bat,Right-arm Offbreak,India,Player,Chennai Super Kings,Kolkata Knight Riders,2011,,25,,Blank,Blank,Ms Dhoni,G Gambhir,Ms Dhoni,Mv Boucher,1986-09-17
17566,,501250,278,S Randiv,1/30/1985,Right-hand Bat,Right-arm Offbreak,Sri Lanka,Player,Chennai Super Kings,Kolkata Knight Riders,2011,,26,,Blank,Blank,Ms Dhoni,G Gambhir,Ms Dhoni,Mv Boucher,1985-01-30
17567,,501250,9,Jh Kallis,10/16/1975,Right-hand Bat,Right-arm Fast-medium,South Africa,Player,Kolkata Knight Riders,Chennai Super Kings,2011,,36,,Blank,Blank,G Gambhir,Ms Dhoni,Mv Boucher,Ms Dhoni,1975-10-16
17570,,501250,40,G Gambhir,10/14/1981,Left-hand Bat,Legbreak,India,Captain,Kolkata Knight Riders,Chennai Super Kings,2011,,30,,Blank,Blank,G Gambhir,Ms Dhoni,Mv Boucher,Ms Dhoni,1981-10-14
17571,,501250,66,B Lee,11/8/1976,Right-hand Bat,Right-arm Fast,Australia,Player,Kolkata Knight Riders,Chennai Super Kings,2011,,35,,Blank,Blank,G Gambhir,Ms Dhoni,Mv Boucher,Ms Dhoni,1976-11-08
17572,,501250,87,Mk Tiwary,11/14/1985,Right-hand Bat,Legbreak Googly,India,Player,Kolkata Knight Riders,Chennai Super Kings,2011,,26,,Blank,Blank,G Gambhir,Ms Dhoni,Mv Boucher,Ms Dhoni,1985-11-14
17573,,501250,89,R Bhatia,10/22/1979,Right-hand Bat,Right-arm Medium-fast,India,Player,Kolkata Knight Riders,Chennai Super Kings,2011,,32,,Blank,Blank,G Gambhir,Ms Dhoni,Mv Boucher,Ms Dhoni,1979-10-22
17574,,501250,140,Iqbal Abdulla,12/2/1989,Left-hand Bat,Slow Left-arm Orthodox,India,Player,Kolkata Knight Riders,Chennai Super Kings,2011,,22,,Blank,Blank,G Gambhir,Ms Dhoni,Mv Boucher,Ms Dhoni,1989-12-02
17575,,501250,151,L Balaji,9/27/1981,Right-hand Bat,Right-arm Medium-fast,India,Player,Kolkata Knight Riders,Chennai Super Kings,2011,,30,,Blank,Blank,G Gambhir,Ms Dhoni,Mv Boucher,Ms Dhoni,1981-09-27
17584,,501251,178,Tl Suman,12/15/1983,Right-hand Bat,Right-arm Offbreak,India,Player,Mumbai Indians,Delhi Daredevils,2011,,28,,Blank,Blank,Sr Tendulkar,V Sehwag,At Rayudu,Nv Ojha,1983-12-15
17585,,501251,194,Sl Malinga,8/28/1983,Right-hand Bat,Right-arm Fast,Sri Lanka,Player,Mumbai Indians,Delhi Daredevils,2011,,28,,Blank,Blank,Sr Tendulkar,V Sehwag,At Rayudu,Nv Ojha,1983-08-28
17586,,501251,208,At Rayudu,9/23/1985,Right-hand Bat,Right-arm Offbreak,India,Keeper,Mumbai Indians,Delhi Daredevils,2011,,26,,Blank,Blank,Sr Tendulkar,V Sehwag,At Rayudu,Nv Ojha,1985-09-23
17588,,501251,289,Ac Blizzard,6/27/1984,Left-hand Bat,Left-arm Medium,Australia,Player,Mumbai Indians,Delhi Daredevils,2011,,27,,Blank,Blank,Sr Tendulkar,V Sehwag,At Rayudu,Nv Ojha,1984-06-27
17589,,501251,25,Jr Hopes,10/24/1978,Right-hand Bat,Right-arm Medium,Australia,Player,Delhi Daredevils,Mumbai Indians,2011,,33,,Blank,Blank,V Sehwag,Sr Tendulkar,Nv Ojha,At Rayudu,1978-10-24
17594,,501251,183,Nv Ojha,7/20/1983,Right-hand Bat,N/a,India,Keeper,Delhi Daredevils,Mumbai Indians,2011,,28,,Blank,Blank,V Sehwag,Sr Tendulkar,Nv Ojha,At Rayudu,1983-07-20
17596,,501251,190,M Morkel,10/6/1984,Left-hand Bat,Right-arm Fast,South Africa,Player,Delhi Daredevils,Mumbai Indians,2011,,27,,Blank,Blank,V Sehwag,Sr Tendulkar,Nv Ojha,At Rayudu,1984-10-06
17598,,501251,292,Ca Ingram,7/3/1985,Left-hand Bat,Legbreak,South Africa,Player,Delhi Daredevils,Mumbai Indians,2011,,26,,Blank,Blank,V Sehwag,Sr Tendulkar,Nv Ojha,At Rayudu,1985-07-03
17603,,501252,79,Ss Tiwary,12/30/1989,Left-hand Bat,N/a,India,Player,Royal Challengers Bangalore,Kochi Tuskers Kerala,2011,,22,,Blank,Blank,Dl Vettori,Dpmd Jayawardene,Ab De Villiers,Pa Patel,1989-12-30
17606,,501252,162,Ch Gayle,9/21/1979,Left-hand Bat,Right-arm Offbreak,West Indies,Player,Royal Challengers Bangalore,Kochi Tuskers Kerala,2011,,32,,Blank,Blank,Dl Vettori,Dpmd Jayawardene,Ab De Villiers,Pa Patel,1979-09-21
17607,,501252,175,Dl Vettori,1/27/1979,Left-hand Bat,Slow Left-arm Orthodox,New Zealand,Captain,Royal Challengers Bangalore,Kochi Tuskers Kerala,2011,,32,,Blank,Blank,Dl Vettori,Dpmd Jayawardene,Ab De Villiers,Pa Patel,1979-01-27
17608,,501252,203,Ca Pujara,1/25/1988,Right-hand Bat,Legbreak,India,Player,Royal Challengers Bangalore,Kochi Tuskers Kerala,2011,,23,,Blank,Blank,Dl Vettori,Dpmd Jayawardene,Ab De Villiers,Pa Patel,1988-01-25
17609,,501252,244,A Mithun,10/25/1989,Right-hand Bat,Right-arm Medium,India,Player,Royal Challengers Bangalore,Kochi Tuskers Kerala,2011,,22,,Blank,Blank,Dl Vettori,Dpmd Jayawardene,Ab De Villiers,Pa Patel,1989-10-25
17613,,501252,35,Ra Jadeja,12/6/1988,Left-hand Bat,Slow Left-arm Orthodox,India,Player,Kochi Tuskers Kerala,Royal Challengers Bangalore,2011,,23,,Blank,Blank,Dpmd Jayawardene,Dl Vettori,Pa Patel,Ab De Villiers,1988-12-06
17615,,501252,64,Dpmd Jayawardene,5/27/1977,Right-hand Bat,Right-arm Medium,Sri Lanka,Captain,Kochi Tuskers Kerala,Royal Challengers Bangalore,2011,,34,,Blank,Blank,Dpmd Jayawardene,Dl Vettori,Pa Patel,Ab De Villiers,1977-05-27
17618,,501252,153,Rr Powar,5/20/1978,Right-hand Bat,Right-arm Offbreak,India,Player,Kochi Tuskers Kerala,Royal Challengers Bangalore,2011,,33,,Blank,Blank,Dpmd Jayawardene,Dl Vettori,Pa Patel,Ab De Villiers,1978-05-20
17619,,501252,259,Rv Gomez,10/16/1985,Right-hand Bat,Right-arm Medium,India,Player,Kochi Tuskers Kerala,Royal Challengers Bangalore,2011,,26,,Blank,Blank,Dpmd Jayawardene,Dl Vettori,Pa Patel,Ab De Villiers,1985-10-16
17623,,501253,14,P Kumar,10/2/1986,Right-hand Bat,Right-arm Medium,India,Player,Kings Xi Punjab,Pune Warriors,2011,,25,,Blank,Blank,Ac Gilchrist,Yuvraj Singh,Ac Gilchrist,Rv Uthappa,1986-10-02
17624,,501253,53,Ac Gilchrist,11/14/1971,Left-hand Bat,Right-arm Offbreak,Australia,Captainkeeper,Kings Xi Punjab,Pune Warriors,2011,,40,,Blank,Blank,Ac Gilchrist,Yuvraj Singh,Ac Gilchrist,Rv Uthappa,1971-11-14
17625,,501253,88,Kd Karthik,6/1/1985,Right-hand Bat,N/a,India,Player,Kings Xi Punjab,Pune Warriors,2011,,26,,Blank,Blank,Ac Gilchrist,Yuvraj Singh,Ac Gilchrist,Rv Uthappa,1985-06-01
17627,,501253,148,Sd Chitnis,5/6/1987,Right-hand Bat,Right-arm Offbreak,India,Player,Kings Xi Punjab,Pune Warriors,2011,,24,,Blank,Blank,Ac Gilchrist,Yuvraj Singh,Ac Gilchrist,Rv Uthappa,1987-05-06
17629,,501253,188,Rj Harris,10/11/1979,Right-hand Bat,Right-arm Fast,Australia,Player,Kings Xi Punjab,Pune Warriors,2011,,32,,Blank,Blank,Ac Gilchrist,Yuvraj Singh,Ac Gilchrist,Rv Uthappa,1979-10-11
17630,,501253,234,Sj Srivastava,9/22/1981,Right-hand Bat,Left-arm Fast-medium,India,Player,Kings Xi Punjab,Pune Warriors,2011,,30,,Blank,Blank,Ac Gilchrist,Yuvraj Singh,Ac Gilchrist,Rv Uthappa,1981-09-22
17634,,501253,46,Rv Uthappa,11/11/1985,Right-hand Bat,Right-arm Medium,India,Keeper,Pune Warriors,Kings Xi Punjab,2011,,26,,Blank,Blank,Yuvraj Singh,Ac Gilchrist,Rv Uthappa,Ac Gilchrist,1985-11-11
17635,,501253,96,Mk Pandey,9/10/1989,Right-hand Bat,Right-arm Medium,India,Player,Pune Warriors,Kings Xi Punjab,2011,,22,,Blank,Blank,Yuvraj Singh,Ac Gilchrist,Rv Uthappa,Ac Gilchrist,1989-09-10
17636,,501253,157,Jd Ryder,8/6/1984,Left-hand Bat,Right-arm Medium,New Zealand,Player,Pune Warriors,Kings Xi Punjab,2011,,27,,Blank,Blank,Yuvraj Singh,Ac Gilchrist,Rv Uthappa,Ac Gilchrist,1984-08-06
17637,,501253,211,Aa Jhunjhunwala,12/1/1982,Right-hand Bat,Right-arm Offbreak,India,Player,Pune Warriors,Kings Xi Punjab,2011,,29,,Blank,Blank,Yuvraj Singh,Ac Gilchrist,Rv Uthappa,Ac Gilchrist,1982-12-01
17639,,501253,253,Mr Marsh,10/20/1991,Right-hand Bat,Right-arm Medium,Australia,Player,Pune Warriors,Kings Xi Punjab,2011,,20,,Blank,Blank,Yuvraj Singh,Ac Gilchrist,Rv Uthappa,Ac Gilchrist,1991-10-20
17643,,501253,299,B Kumar,2/5/1990,Right-hand Bat,Right-arm Medium,India,Player,Pune Warriors,Kings Xi Punjab,2011,,21,,Blank,Blank,Yuvraj Singh,Ac Gilchrist,Rv Uthappa,Ac Gilchrist,1990-02-05
17647,,501254,39,Sk Trivedi,9/4/1982,Right-hand Bat,Right-arm Medium,India,Player,Rajasthan Royals,Chennai Super Kings,2011,,29,,Blank,Blank,Sk Warne,Ms Dhoni,Dh Yagnik,Ms Dhoni,1982-09-04
17650,,501254,169,As Raut,3/3/1987,Right-hand Bat,Legbreak Googly,India,Player,Rajasthan Royals,Chennai Super Kings,2011,,24,,Blank,Blank,Sk Warne,Ms Dhoni,Dh Yagnik,Ms Dhoni,1987-03-03
17652,,501254,196,A Singh,6/21/1981,Right-hand Bat,Right-arm Medium-fast,India,Player,Rajasthan Royals,Chennai Super Kings,2011,,30,,Blank,Blank,Sk Warne,Ms Dhoni,Dh Yagnik,Ms Dhoni,1981-06-21
17655,,501254,19,Mek Hussey,5/27/1975,Left-hand Bat,Right-arm Medium,Australia,Player,Chennai Super Kings,Rajasthan Royals,2011,,36,,Blank,Blank,Ms Dhoni,Sk Warne,Ms Dhoni,Dh Yagnik,1975-05-27
17660,,501254,71,Dj Bravo,10/7/1983,Right-hand Bat,Right-arm Medium-fast,West Indies,Player,Chennai Super Kings,Rajasthan Royals,2011,,28,,Blank,Blank,Ms Dhoni,Sk Warne,Ms Dhoni,Dh Yagnik,1983-10-07
17663,,501254,186,Sb Jakati,11/27/1980,Left-hand Bat,Slow Left-arm Orthodox,India,Player,Chennai Super Kings,Rajasthan Royals,2011,,31,,Blank,Blank,Ms Dhoni,Sk Warne,Ms Dhoni,Dh Yagnik,1980-11-27
17665,,501254,248,De Bollinger,7/24/1981,Left-hand Bat,Left-arm Fast-medium,Australia,Player,Chennai Super Kings,Rajasthan Royals,2011,,30,,Blank,Blank,Ms Dhoni,Sk Warne,Ms Dhoni,Dh Yagnik,1981-07-24
17666,,501255,26,Kc Sangakkara,10/27/1977,Left-hand Bat,Right-arm Offbreak,Sri Lanka,Captainkeeper,Deccan Chargers,Pune Warriors,2011,,34,,Blank,Blank,Kc Sangakkara,Yuvraj Singh,Kc Sangakkara,Rv Uthappa,1977-10-27
17669,,501255,84,I Sharma,9/2/1988,Right-hand Bat,Right-arm Fast-medium,India,Player,Deccan Chargers,Pune Warriors,2011,,23,,Blank,Blank,Kc Sangakkara,Yuvraj Singh,Kc Sangakkara,Rv Uthappa,1988-09-02
17675,,501255,154,Jp Duminy,4/14/1984,Left-hand Bat,Right-arm Offbreak,South Africa,Player,Deccan Chargers,Pune Warriors,2011,,27,,Blank,Blank,Kc Sangakkara,Yuvraj Singh,Kc Sangakkara,Rv Uthappa,1984-04-14
17677,,501255,1,Sc Ganguly,7/8/1972,Left-hand Bat,Right-arm Medium,India,Player,Pune Warriors,Deccan Chargers,2011,,39,,Blank,Blank,Yuvraj Singh,Kc Sangakkara,Rv Uthappa,Kc Sangakkara,1972-07-08
17678,,501255,27,Yuvraj Singh,12/12/1981,Left-hand Bat,Slow Left-arm Orthodox,India,Captain,Pune Warriors,Deccan Chargers,2011,,30,,Blank,Blank,Yuvraj Singh,Kc Sangakkara,Rv Uthappa,Kc Sangakkara,1981-12-12
17679,,501255,46,Rv Uthappa,11/11/1985,Right-hand Bat,Right-arm Medium,India,Keeper,Pune Warriors,Deccan Chargers,2011,,26,,Blank,Blank,Yuvraj Singh,Kc Sangakkara,Rv Uthappa,Kc Sangakkara,1985-11-11
17680,,501255,96,Mk Pandey,9/10/1989,Right-hand Bat,Right-arm Medium,India,Player,Pune Warriors,Deccan Chargers,2011,,22,,Blank,Blank,Yuvraj Singh,Kc Sangakkara,Rv Uthappa,Kc Sangakkara,1989-09-10
17682,,501255,235,R Sharma,4/30/1987,Right-hand Bat,Right-arm Offbreak,India,Player,Pune Warriors,Deccan Chargers,2011,,24,,Blank,Blank,Yuvraj Singh,Kc Sangakkara,Rv Uthappa,Kc Sangakkara,1987-04-30
17685,,501255,273,Sb Wagh,10/9/1988,Left-hand Bat,Left-arm Medium-fast,India,Player,Pune Warriors,Deccan Chargers,2011,,23,,Blank,Blank,Yuvraj Singh,Kc Sangakkara,Rv Uthappa,Kc Sangakkara,1988-10-09
17688,,501256,4,Dj Hussey,7/15/1977,Right-hand Bat,Right-arm Offbreak,Australia,Player,Kings Xi Punjab,Mumbai Indians,2011,,34,,Blank,Blank,Ac Gilchrist,Sr Tendulkar,Ac Gilchrist,At Rayudu,1977-07-15
17691,,501256,88,Kd Karthik,6/1/1985,Right-hand Bat,N/a,India,Player,Kings Xi Punjab,Mumbai Indians,2011,,26,,Blank,Blank,Ac Gilchrist,Sr Tendulkar,Ac Gilchrist,At Rayudu,1985-06-01
17692,,501256,100,Se Marsh,7/9/1983,Left-hand Bat,Slow Left-arm Orthodox,Australia,Player,Kings Xi Punjab,Mumbai Indians,2011,,28,,Blank,Blank,Ac Gilchrist,Sr Tendulkar,Ac Gilchrist,At Rayudu,1983-07-09
17694,,501256,188,Rj Harris,10/11/1979,Right-hand Bat,Right-arm Fast,Australia,Player,Kings Xi Punjab,Mumbai Indians,2011,,32,,Blank,Blank,Ac Gilchrist,Sr Tendulkar,Ac Gilchrist,At Rayudu,1979-10-11
17698,,501256,302,Ba Bhatt,5/13/1990,Left-hand Bat,Slow Left-arm Orthodox,India,Player,Kings Xi Punjab,Mumbai Indians,2011,,21,,Blank,Blank,Ac Gilchrist,Sr Tendulkar,Ac Gilchrist,At Rayudu,1990-05-13
17702,,501256,80,Ds Kulkarni,12/10/1988,Right-hand Bat,Right-arm Medium,India,Player,Mumbai Indians,Kings Xi Punjab,2011,,23,,Blank,Blank,Sr Tendulkar,Ac Gilchrist,At Rayudu,Ac Gilchrist,1988-12-10
17703,,501256,126,Mm Patel,7/12/1983,Right-hand Bat,Right-arm Medium-fast,India,Player,Mumbai Indians,Kings Xi Punjab,2011,,28,,Blank,Blank,Sr Tendulkar,Ac Gilchrist,At Rayudu,Ac Gilchrist,1983-07-12
17705,,501256,178,Tl Suman,12/15/1983,Right-hand Bat,Right-arm Offbreak,India,Player,Mumbai Indians,Kings Xi Punjab,2011,,28,,Blank,Blank,Sr Tendulkar,Ac Gilchrist,At Rayudu,Ac Gilchrist,1983-12-15
17706,,501256,194,Sl Malinga,8/28/1983,Right-hand Bat,Right-arm Fast,Sri Lanka,Player,Mumbai Indians,Kings Xi Punjab,2011,,28,,Blank,Blank,Sr Tendulkar,Ac Gilchrist,At Rayudu,Ac Gilchrist,1983-08-28
17708,,501256,221,Ka Pollard,5/12/1987,Right-hand Bat,Right-arm Medium-fast,West Indies,Player,Mumbai Indians,Kings Xi Punjab,2011,,24,,Blank,Blank,Sr Tendulkar,Ac Gilchrist,At Rayudu,Ac Gilchrist,1987-05-12
17709,,501256,289,Ac Blizzard,6/27/1984,Left-hand Bat,Left-arm Medium,Australia,Player,Mumbai Indians,Kings Xi Punjab,2011,,27,,Blank,Blank,Sr Tendulkar,Ac Gilchrist,At Rayudu,Ac Gilchrist,1984-06-27
17712,,501257,38,Sk Warne,9/13/1969,Right-hand Bat,Legbreak Googly,Australia,Captain,Rajasthan Royals,Royal Challengers Bangalore,2011,,42,,Blank,Blank,Sk Warne,V Kohli,Dh Yagnik,Kb Arun Karthik,1969-09-13
17715,,501257,75,Pankaj Singh,5/6/1985,Right-hand Bat,Right-arm Medium-fast,India,Player,Rajasthan Royals,Royal Challengers Bangalore,2011,,26,,Blank,Blank,Sk Warne,V Kohli,Dh Yagnik,Kb Arun Karthik,1985-05-06
17718,,501257,192,J Botha,5/2/1982,Right-hand Bat,Right-arm Offbreak,South Africa,Player,Rajasthan Royals,Royal Challengers Bangalore,2011,,29,,Blank,Blank,Sk Warne,V Kohli,Dh Yagnik,Kb Arun Karthik,1982-05-02
17720,,501257,277,Dh Yagnik,6/22/1983,Left-hand Bat,N/a,India,Keeper,Rajasthan Royals,Royal Challengers Bangalore,2011,,28,,Blank,Blank,Sk Warne,V Kohli,Dh Yagnik,Kb Arun Karthik,1983-06-22
17722,,501257,15,Z Khan,10/7/1978,Right-hand Bat,Left-arm Fast-medium,India,Player,Royal Challengers Bangalore,Rajasthan Royals,2011,,33,,Blank,Blank,V Kohli,Sk Warne,Kb Arun Karthik,Dh Yagnik,1978-10-07
17728,,501257,239,Kb Arun Karthik,2/15/1986,Right-hand Bat,Legbreak Googly,India,Keeper,Royal Challengers Bangalore,Rajasthan Royals,2011,,25,,Blank,Blank,V Kohli,Sk Warne,Kb Arun Karthik,Dh Yagnik,1986-02-15
17730,,501257,270,S Aravind,4/8/1984,Left-hand Bat,Left-arm Medium-fast,India,Player,Royal Challengers Bangalore,Rajasthan Royals,2011,,27,,Blank,Blank,V Kohli,Sk Warne,Kb Arun Karthik,Dh Yagnik,1984-04-08
17732,,501258,19,Mek Hussey,5/27/1975,Left-hand Bat,Right-arm Medium,Australia,Player,Chennai Super Kings,Delhi Daredevils,2011,,36,,Blank,Blank,Ms Dhoni,Jr Hopes,Ms Dhoni,Nv Ojha,1975-05-27
17736,,501258,62,Wp Saha,10/24/1984,Right-hand Bat,N/a,India,Player,Chennai Super Kings,Delhi Daredevils,2011,,27,,Blank,Blank,Ms Dhoni,Jr Hopes,Ms Dhoni,Nv Ojha,1984-10-24
17737,,501258,71,Dj Bravo,10/7/1983,Right-hand Bat,Right-arm Medium-fast,West Indies,Player,Chennai Super Kings,Delhi Daredevils,2011,,28,,Blank,Blank,Ms Dhoni,Jr Hopes,Ms Dhoni,Nv Ojha,1983-10-07
17739,,501258,185,M Vijay,4/1/1984,Right-hand Bat,Right-arm Offbreak,India,Player,Chennai Super Kings,Delhi Daredevils,2011,,27,,Blank,Blank,Ms Dhoni,Jr Hopes,Ms Dhoni,Nv Ojha,1984-04-01
17740,,501258,186,Sb Jakati,11/27/1980,Left-hand Bat,Slow Left-arm Orthodox,India,Player,Chennai Super Kings,Delhi Daredevils,2011,,31,,Blank,Blank,Ms Dhoni,Jr Hopes,Ms Dhoni,Nv Ojha,1980-11-27
17741,,501258,201,R Ashwin,9/17/1986,Right-hand Bat,Right-arm Offbreak,India,Player,Chennai Super Kings,Delhi Daredevils,2011,,25,,Blank,Blank,Ms Dhoni,Jr Hopes,Ms Dhoni,Nv Ojha,1986-09-17
17742,,501258,248,De Bollinger,7/24/1981,Left-hand Bat,Left-arm Fast-medium,Australia,Player,Chennai Super Kings,Delhi Daredevils,2011,,30,,Blank,Blank,Ms Dhoni,Jr Hopes,Ms Dhoni,Nv Ojha,1981-07-24
17744,,501258,29,Ik Pathan,10/27/1984,Left-hand Bat,Left-arm Medium-fast,India,Player,Delhi Daredevils,Chennai Super Kings,2011,,27,,Blank,Blank,Jr Hopes,Ms Dhoni,Nv Ojha,Ms Dhoni,1984-10-27
17751,,501258,292,Ca Ingram,7/3/1985,Left-hand Bat,Legbreak,South Africa,Player,Delhi Daredevils,Chennai Super Kings,2011,,26,,Blank,Blank,Jr Hopes,Ms Dhoni,Nv Ojha,Ms Dhoni,1985-07-03
17753,,501258,296,Vr Aaron,10/29/1989,Right-hand Bat,Right-arm Fast,India,Player,Delhi Daredevils,Chennai Super Kings,2011,,22,,Blank,Blank,Jr Hopes,Ms Dhoni,Nv Ojha,Ms Dhoni,1989-10-29
17754,,501259,4,Dj Hussey,7/15/1977,Right-hand Bat,Right-arm Offbreak,Australia,Player,Kings Xi Punjab,Kochi Tuskers Kerala,2011,,34,,Blank,Blank,Ac Gilchrist,Dpmd Jayawardene,Ac Gilchrist,Pa Patel,1977-07-15
17755,,501259,53,Ac Gilchrist,11/14/1971,Left-hand Bat,Right-arm Offbreak,Australia,Captainkeeper,Kings Xi Punjab,Kochi Tuskers Kerala,2011,,40,,Blank,Blank,Ac Gilchrist,Dpmd Jayawardene,Ac Gilchrist,Pa Patel,1971-11-14
17757,,501259,88,Kd Karthik,6/1/1985,Right-hand Bat,N/a,India,Player,Kings Xi Punjab,Kochi Tuskers Kerala,2011,,26,,Blank,Blank,Ac Gilchrist,Dpmd Jayawardene,Ac Gilchrist,Pa Patel,1985-06-01
17759,,501259,167,Pc Valthaty,12/7/1983,Right-hand Bat,Right-arm Medium,India,Player,Kings Xi Punjab,Kochi Tuskers Kerala,2011,,28,,Blank,Blank,Ac Gilchrist,Dpmd Jayawardene,Ac Gilchrist,Pa Patel,1983-12-07
17760,,501259,188,Rj Harris,10/11/1979,Right-hand Bat,Right-arm Fast,Australia,Player,Kings Xi Punjab,Kochi Tuskers Kerala,2011,,32,,Blank,Blank,Ac Gilchrist,Dpmd Jayawardene,Ac Gilchrist,Pa Patel,1979-10-11
17762,,501259,234,Sj Srivastava,9/22/1981,Right-hand Bat,Left-arm Fast-medium,India,Player,Kings Xi Punjab,Kochi Tuskers Kerala,2011,,30,,Blank,Blank,Ac Gilchrist,Dpmd Jayawardene,Ac Gilchrist,Pa Patel,1981-09-22
17767,,501259,35,Ra Jadeja,12/6/1988,Left-hand Bat,Slow Left-arm Orthodox,India,Player,Kochi Tuskers Kerala,Kings Xi Punjab,2011,,23,,Blank,Blank,Dpmd Jayawardene,Ac Gilchrist,Pa Patel,Ac Gilchrist,1988-12-06
17768,,501259,61,Rp Singh,12/6/1985,Right-hand Bat,Left-arm Fast-medium,India,Player,Kochi Tuskers Kerala,Kings Xi Punjab,2011,,26,,Blank,Blank,Dpmd Jayawardene,Ac Gilchrist,Pa Patel,Ac Gilchrist,1985-12-06
17771,,501259,81,R Vinay Kumar,2/12/1984,Right-hand Bat,Right-arm Medium,India,Player,Kochi Tuskers Kerala,Kings Xi Punjab,2011,,27,,Blank,Blank,Dpmd Jayawardene,Ac Gilchrist,Pa Patel,Ac Gilchrist,1984-02-12
17772,,501259,104,Bj Hodge,12/29/1974,Right-hand Bat,Right-arm Offbreak,Australia,Player,Kochi Tuskers Kerala,Kings Xi Punjab,2011,,37,,Blank,Blank,Dpmd Jayawardene,Ac Gilchrist,Pa Patel,Ac Gilchrist,1974-12-29
17774,,501259,259,Rv Gomez,10/16/1985,Right-hand Bat,Right-arm Medium,India,Player,Kochi Tuskers Kerala,Kings Xi Punjab,2011,,26,,Blank,Blank,Dpmd Jayawardene,Ac Gilchrist,Pa Patel,Ac Gilchrist,1985-10-16
17775,,501259,294,P Parameswaran,5/30/1985,Right-hand Bat,Left-arm Medium,India,Player,Kochi Tuskers Kerala,Kings Xi Punjab,2011,,26,,Blank,Blank,Dpmd Jayawardene,Ac Gilchrist,Pa Patel,Ac Gilchrist,1985-05-30
17777,,501260,15,Z Khan,10/7/1978,Right-hand Bat,Left-arm Fast-medium,India,Player,Royal Challengers Bangalore,Kolkata Knight Riders,2011,,33,,Blank,Blank,V Kohli,G Gambhir,Kb Arun Karthik,Mv Boucher,1978-10-07
17779,,501260,79,Ss Tiwary,12/30/1989,Left-hand Bat,N/a,India,Player,Royal Challengers Bangalore,Kolkata Knight Riders,2011,,22,,Blank,Blank,V Kohli,G Gambhir,Kb Arun Karthik,Mv Boucher,1989-12-30
17780,,501260,110,Ab De Villiers,2/17/1984,Right-hand Bat,Right-arm Medium,South Africa,Player,Royal Challengers Bangalore,Kolkata Knight Riders,2011,,27,,Blank,Blank,V Kohli,G Gambhir,Kb Arun Karthik,Mv Boucher,1984-02-17
17781,,501260,139,La Pomersbach,9/28/1984,Left-hand Bat,Right-arm Offbreak,Australia,Player,Royal Challengers Bangalore,Kolkata Knight Riders,2011,,27,,Blank,Blank,V Kohli,G Gambhir,Kb Arun Karthik,Mv Boucher,1984-09-28
17782,,501260,162,Ch Gayle,9/21/1979,Left-hand Bat,Right-arm Offbreak,West Indies,Player,Royal Challengers Bangalore,Kolkata Knight Riders,2011,,32,,Blank,Blank,V Kohli,G Gambhir,Kb Arun Karthik,Mv Boucher,1979-09-21
17783,,501260,239,Kb Arun Karthik,2/15/1986,Right-hand Bat,Legbreak Googly,India,Keeper,Royal Challengers Bangalore,Kolkata Knight Riders,2011,,25,,Blank,Blank,V Kohli,G Gambhir,Kb Arun Karthik,Mv Boucher,1986-02-15
17785,,501260,244,A Mithun,10/25/1989,Right-hand Bat,Right-arm Medium,India,Player,Royal Challengers Bangalore,Kolkata Knight Riders,2011,,22,,Blank,Blank,V Kohli,G Gambhir,Kb Arun Karthik,Mv Boucher,1989-10-25
17787,,501260,9,Jh Kallis,10/16/1975,Right-hand Bat,Right-arm Fast-medium,South Africa,Player,Kolkata Knight Riders,Royal Challengers Bangalore,2011,,36,,Blank,Blank,G Gambhir,V Kohli,Mv Boucher,Kb Arun Karthik,1975-10-16
17789,,501260,31,Yk Pathan,11/17/1982,Right-hand Bat,Right-arm Offbreak,India,Player,Kolkata Knight Riders,Royal Challengers Bangalore,2011,,29,,Blank,Blank,G Gambhir,V Kohli,Mv Boucher,Kb Arun Karthik,1982-11-17
17790,,501260,40,G Gambhir,10/14/1981,Left-hand Bat,Legbreak,India,Captain,Kolkata Knight Riders,Royal Challengers Bangalore,2011,,30,,Blank,Blank,G Gambhir,V Kohli,Mv Boucher,Kb Arun Karthik,1981-10-14
17792,,501260,87,Mk Tiwary,11/14/1985,Right-hand Bat,Legbreak Googly,India,Player,Kolkata Knight Riders,Royal Challengers Bangalore,2011,,26,,Blank,Blank,G Gambhir,V Kohli,Mv Boucher,Kb Arun Karthik,1985-11-14
17793,,501260,89,R Bhatia,10/22/1979,Right-hand Bat,Right-arm Medium-fast,India,Player,Kolkata Knight Riders,Royal Challengers Bangalore,2011,,32,,Blank,Blank,G Gambhir,V Kohli,Mv Boucher,Kb Arun Karthik,1979-10-22
17798,,501261,50,Harbhajan Singh,7/3/1980,Right-hand Bat,Right-arm Offbreak,India,Player,Mumbai Indians,Deccan Chargers,2011,,31,,Blank,Blank,Sr Tendulkar,Kc Sangakkara,At Rayudu,Kc Sangakkara,1980-07-03
17804,,501261,178,Tl Suman,12/15/1983,Right-hand Bat,Right-arm Offbreak,India,Player,Mumbai Indians,Deccan Chargers,2011,,28,,Blank,Blank,Sr Tendulkar,Kc Sangakkara,At Rayudu,Kc Sangakkara,1983-12-15
17805,,501261,194,Sl Malinga,8/28/1983,Right-hand Bat,Right-arm Fast,Sri Lanka,Player,Mumbai Indians,Deccan Chargers,2011,,28,,Blank,Blank,Sr Tendulkar,Kc Sangakkara,At Rayudu,Kc Sangakkara,1983-08-28
17806,,501261,208,At Rayudu,9/23/1985,Right-hand Bat,Right-arm Offbreak,India,Keeper,Mumbai Indians,Deccan Chargers,2011,,26,,Blank,Blank,Sr Tendulkar,Kc Sangakkara,At Rayudu,Kc Sangakkara,1985-09-23
17808,,501261,289,Ac Blizzard,6/27/1984,Left-hand Bat,Left-arm Medium,Australia,Player,Mumbai Indians,Deccan Chargers,2011,,27,,Blank,Blank,Sr Tendulkar,Kc Sangakkara,At Rayudu,Kc Sangakkara,1984-06-27
17809,,501261,26,Kc Sangakkara,10/27/1977,Left-hand Bat,Right-arm Offbreak,Sri Lanka,Captainkeeper,Deccan Chargers,Mumbai Indians,2011,,34,,Blank,Blank,Kc Sangakkara,Sr Tendulkar,Kc Sangakkara,At Rayudu,1977-10-27
17811,,501261,65,S Sohal,11/10/1987,Right-hand Bat,Legbreak,India,Player,Deccan Chargers,Mumbai Indians,2011,,24,,Blank,Blank,Kc Sangakkara,Sr Tendulkar,Kc Sangakkara,At Rayudu,1987-11-10
17812,,501261,84,I Sharma,9/2/1988,Right-hand Bat,Right-arm Fast-medium,India,Player,Deccan Chargers,Mumbai Indians,2011,,23,,Blank,Blank,Kc Sangakkara,Sr Tendulkar,Kc Sangakkara,At Rayudu,1988-09-02
17813,,501261,93,B Chipli,1/27/1983,Right-hand Bat,Right-arm Medium,India,Player,Deccan Chargers,Mumbai Indians,2011,,28,,Blank,Blank,Kc Sangakkara,Sr Tendulkar,Kc Sangakkara,At Rayudu,1983-01-27
17817,,501261,224,Mj Lumb,2/12/1980,Left-hand Bat,Right-arm Medium,England,Player,Deccan Chargers,Mumbai Indians,2011,,31,,Blank,Blank,Kc Sangakkara,Sr Tendulkar,Kc Sangakkara,At Rayudu,1980-02-12
17819,,501261,446,Anand Rajan,4/17/1987,Right-hand Bat,Right-arm Medium,India,Player,Deccan Chargers,Mumbai Indians,2011,,24,,Blank,Blank,Kc Sangakkara,Sr Tendulkar,Kc Sangakkara,At Rayudu,1987-04-17
17821,,501262,14,P Kumar,10/2/1986,Right-hand Bat,Right-arm Medium,India,Player,Kings Xi Punjab,Delhi Daredevils,2011,,25,,Blank,Blank,Ac Gilchrist,Jr Hopes,Ac Gilchrist,Nv Ojha,1986-10-02
17824,,501262,88,Kd Karthik,6/1/1985,Right-hand Bat,N/a,India,Player,Kings Xi Punjab,Delhi Daredevils,2011,,26,,Blank,Blank,Ac Gilchrist,Jr Hopes,Ac Gilchrist,Nv Ojha,1985-06-01
17825,,501262,100,Se Marsh,7/9/1983,Left-hand Bat,Slow Left-arm Orthodox,Australia,Player,Kings Xi Punjab,Delhi Daredevils,2011,,28,,Blank,Blank,Ac Gilchrist,Jr Hopes,Ac Gilchrist,Nv Ojha,1983-07-09
17830,,501262,302,Ba Bhatt,5/13/1990,Left-hand Bat,Slow Left-arm Orthodox,India,Player,Kings Xi Punjab,Delhi Daredevils,2011,,21,,Blank,Blank,Ac Gilchrist,Jr Hopes,Ac Gilchrist,Nv Ojha,1990-05-13
17836,,501262,190,M Morkel,10/6/1984,Left-hand Bat,Right-arm Fast,South Africa,Player,Delhi Daredevils,Kings Xi Punjab,2011,,27,,Blank,Blank,Jr Hopes,Ac Gilchrist,Nv Ojha,Ac Gilchrist,1984-10-06
17837,,501262,199,Y Nagar,1/6/1990,Right-hand Bat,Right-arm Offbreak,India,Player,Delhi Daredevils,Kings Xi Punjab,2011,,21,,Blank,Blank,Jr Hopes,Ac Gilchrist,Nv Ojha,Ac Gilchrist,1990-01-06
17840,,501262,296,Vr Aaron,10/29/1989,Right-hand Bat,Right-arm Fast,India,Player,Delhi Daredevils,Kings Xi Punjab,2011,,22,,Blank,Blank,Jr Hopes,Ac Gilchrist,Nv Ojha,Ac Gilchrist,1989-10-29
17843,,501263,17,Pa Patel,3/9/1985,Left-hand Bat,N/a,India,Keeper,Kochi Tuskers Kerala,Rajasthan Royals,2011,,26,,Blank,Blank,Dpmd Jayawardene,Sk Warne,Pa Patel,Pr Shah,1985-03-09
17847,,501263,77,S Sreesanth,2/6/1983,Right-hand Bat,Right-arm Fast-medium,India,Player,Kochi Tuskers Kerala,Rajasthan Royals,2011,,28,,Blank,Blank,Dpmd Jayawardene,Sk Warne,Pa Patel,Pr Shah,1983-02-06
17850,,501263,294,P Parameswaran,5/30/1985,Right-hand Bat,Left-arm Medium,India,Player,Kochi Tuskers Kerala,Rajasthan Royals,2011,,26,,Blank,Blank,Dpmd Jayawardene,Sk Warne,Pa Patel,Pr Shah,1985-05-30
17851,,501263,300,Y Gnaneswara Rao,8/25/1984,Right-hand Bat,Right-arm Medium,India,Player,Kochi Tuskers Kerala,Rajasthan Royals,2011,,27,,Blank,Blank,Dpmd Jayawardene,Sk Warne,Pa Patel,Pr Shah,1984-08-25
17852,,501263,447,P Prasanth,5/22/1985,Left-hand Bat,Slow Left-arm Orthodox,India,Player,Kochi Tuskers Kerala,Rajasthan Royals,2011,,26,,Blank,Blank,Dpmd Jayawardene,Sk Warne,Pa Patel,Pr Shah,1985-05-22
17859,,501263,229,Fy Fazal,9/7/1985,Left-hand Bat,Right-arm Medium,India,Player,Rajasthan Royals,Kochi Tuskers Kerala,2011,,26,,Blank,Blank,Sk Warne,Dpmd Jayawardene,Pr Shah,Pa Patel,1985-09-07
17861,,501263,266,Al Menaria,10/29/1990,Left-hand Bat,Slow Left-arm Orthodox,India,Player,Rajasthan Royals,Kochi Tuskers Kerala,2011,,21,,Blank,Blank,Sk Warne,Dpmd Jayawardene,Pr Shah,Pa Patel,1990-10-29
17864,,501264,26,Kc Sangakkara,10/27/1977,Left-hand Bat,Right-arm Offbreak,Sri Lanka,Captainkeeper,Deccan Chargers,Pune Warriors,2011,,34,,Blank,Blank,Kc Sangakkara,Yuvraj Singh,Kc Sangakkara,Rv Uthappa,1977-10-27
17866,,501264,65,S Sohal,11/10/1987,Right-hand Bat,Legbreak,India,Player,Deccan Chargers,Pune Warriors,2011,,24,,Blank,Blank,Kc Sangakkara,Yuvraj Singh,Kc Sangakkara,Rv Uthappa,1987-11-10
17868,,501264,93,B Chipli,1/27/1983,Right-hand Bat,Right-arm Medium,India,Player,Deccan Chargers,Pune Warriors,2011,,28,,Blank,Blank,Kc Sangakkara,Yuvraj Singh,Kc Sangakkara,Rv Uthappa,1983-01-27
17869,,501264,94,Dw Steyn,6/27/1983,Right-hand Bat,Right-arm Fast,South Africa,Player,Deccan Chargers,Pune Warriors,2011,,28,,Blank,Blank,Kc Sangakkara,Yuvraj Singh,Kc Sangakkara,Rv Uthappa,1983-06-27
17871,,501264,131,Pp Ojha,9/5/1986,Left-hand Bat,Slow Left-arm Orthodox,India,Player,Deccan Chargers,Pune Warriors,2011,,25,,Blank,Blank,Kc Sangakkara,Yuvraj Singh,Kc Sangakkara,Rv Uthappa,1986-09-05
17873,,501264,154,Jp Duminy,4/14/1984,Left-hand Bat,Right-arm Offbreak,South Africa,Player,Deccan Chargers,Pune Warriors,2011,,27,,Blank,Blank,Kc Sangakkara,Yuvraj Singh,Kc Sangakkara,Rv Uthappa,1984-04-14
17874,,501264,258,Dt Christian,5/4/1983,Right-hand Bat,Right-arm Fast-medium,Australia,Player,Deccan Chargers,Pune Warriors,2011,,28,,Blank,Blank,Kc Sangakkara,Yuvraj Singh,Kc Sangakkara,Rv Uthappa,1983-05-04
17878,,501264,96,Mk Pandey,9/10/1989,Right-hand Bat,Right-arm Medium,India,Player,Pune Warriors,Deccan Chargers,2011,,22,,Blank,Blank,Yuvraj Singh,Kc Sangakkara,Rv Uthappa,Kc Sangakkara,1989-09-10
17879,,501264,157,Jd Ryder,8/6/1984,Left-hand Bat,Right-arm Medium,New Zealand,Player,Pune Warriors,Deccan Chargers,2011,,27,,Blank,Blank,Yuvraj Singh,Kc Sangakkara,Rv Uthappa,Kc Sangakkara,1984-08-06
17883,,501264,267,Wd Parnell,7/30/1989,Left-hand Bat,Left-arm Medium-fast,South Africa,Player,Pune Warriors,Deccan Chargers,2011,,22,,Blank,Blank,Yuvraj Singh,Kc Sangakkara,Rv Uthappa,Kc Sangakkara,1989-07-30
17884,,501264,295,Cj Ferguson,11/21/1984,Right-hand Bat,Right-arm Medium,Australia,Player,Pune Warriors,Deccan Chargers,2011,,27,,Blank,Blank,Yuvraj Singh,Kc Sangakkara,Rv Uthappa,Kc Sangakkara,1984-11-21
17885,,501264,299,B Kumar,2/5/1990,Right-hand Bat,Right-arm Medium,India,Player,Pune Warriors,Deccan Chargers,2011,,21,,Blank,Blank,Yuvraj Singh,Kc Sangakkara,Rv Uthappa,Kc Sangakkara,1990-02-05
17886,,501265,4,Dj Hussey,7/15/1977,Right-hand Bat,Right-arm Offbreak,Australia,Player,Kings Xi Punjab,Royal Challengers Bangalore,2011,,34,,Blank,Blank,Ac Gilchrist,V Kohli,Ac Gilchrist,Kb Arun Karthik,1977-07-15
17888,,501265,48,Am Nayar,10/8/1983,Left-hand Bat,Right-arm Medium,India,Player,Kings Xi Punjab,Royal Challengers Bangalore,2011,,28,,Blank,Blank,Ac Gilchrist,V Kohli,Ac Gilchrist,Kb Arun Karthik,1983-10-08
17889,,501265,53,Ac Gilchrist,11/14/1971,Left-hand Bat,Right-arm Offbreak,Australia,Captainkeeper,Kings Xi Punjab,Royal Challengers Bangalore,2011,,40,,Blank,Blank,Ac Gilchrist,V Kohli,Ac Gilchrist,Kb Arun Karthik,1971-11-14
17890,,501265,67,Pp Chawla,12/24/1988,Left-hand Bat,Legbreak,India,Player,Kings Xi Punjab,Royal Challengers Bangalore,2011,,23,,Blank,Blank,Ac Gilchrist,V Kohli,Ac Gilchrist,Kb Arun Karthik,1988-12-24
17894,,501265,188,Rj Harris,10/11/1979,Right-hand Bat,Right-arm Fast,Australia,Player,Kings Xi Punjab,Royal Challengers Bangalore,2011,,32,,Blank,Blank,Ac Gilchrist,V Kohli,Ac Gilchrist,Kb Arun Karthik,1979-10-11
17895,,501265,234,Sj Srivastava,9/22/1981,Right-hand Bat,Left-arm Fast-medium,India,Player,Kings Xi Punjab,Royal Challengers Bangalore,2011,,30,,Blank,Blank,Ac Gilchrist,V Kohli,Ac Gilchrist,Kb Arun Karthik,1981-09-22
17896,,501265,236,Mandeep Singh,12/18/1991,Right-hand Bat,Right-arm Medium,India,Player,Kings Xi Punjab,Royal Challengers Bangalore,2011,,20,,Blank,Blank,Ac Gilchrist,V Kohli,Ac Gilchrist,Kb Arun Karthik,1991-12-18
17898,,501265,33,M Kaif,12/1/1980,Right-hand Bat,Right-arm Offbreak,India,Player,Royal Challengers Bangalore,Kings Xi Punjab,2011,,31,,Blank,Blank,V Kohli,Ac Gilchrist,Kb Arun Karthik,Ac Gilchrist,1980-12-01
17899,,501265,79,Ss Tiwary,12/30/1989,Left-hand Bat,N/a,India,Player,Royal Challengers Bangalore,Kings Xi Punjab,2011,,22,,Blank,Blank,V Kohli,Ac Gilchrist,Kb Arun Karthik,Ac Gilchrist,1989-12-30
17900,,501265,110,Ab De Villiers,2/17/1984,Right-hand Bat,Right-arm Medium,South Africa,Player,Royal Challengers Bangalore,Kings Xi Punjab,2011,,27,,Blank,Blank,V Kohli,Ac Gilchrist,Kb Arun Karthik,Ac Gilchrist,1984-02-17
17901,,501265,162,Ch Gayle,9/21/1979,Left-hand Bat,Right-arm Offbreak,West Indies,Player,Royal Challengers Bangalore,Kings Xi Punjab,2011,,32,,Blank,Blank,V Kohli,Ac Gilchrist,Kb Arun Karthik,Ac Gilchrist,1979-09-21
17903,,501265,242,Ck Langeveldt,12/17/1974,Right-hand Bat,Right-arm Fast-medium,England,Player,Royal Challengers Bangalore,Kings Xi Punjab,2011,,37,,Blank,Blank,V Kohli,Ac Gilchrist,Kb Arun Karthik,Ac Gilchrist,1974-12-17
17904,,501265,244,A Mithun,10/25/1989,Right-hand Bat,Right-arm Medium,India,Player,Royal Challengers Bangalore,Kings Xi Punjab,2011,,22,,Blank,Blank,V Kohli,Ac Gilchrist,Kb Arun Karthik,Ac Gilchrist,1989-10-25
17906,,501265,268,Jj Van Der Wath,1/10/1978,Right-hand Bat,Right-arm Medium-fast,South Africa,Player,Royal Challengers Bangalore,Kings Xi Punjab,2011,,33,,Blank,Blank,V Kohli,Ac Gilchrist,Kb Arun Karthik,Ac Gilchrist,1978-01-10
17909,,501266,20,Ms Dhoni,7/7/1981,Right-hand Bat,Right-arm Medium,India,Captainkeeper,Chennai Super Kings,Kochi Tuskers Kerala,2011,,30,,Blank,Blank,Ms Dhoni,Pa Patel,Ms Dhoni,Pa Patel,1981-07-07
17911,,501266,23,S Badrinath,8/30/1980,Right-hand Bat,Right-arm Offbreak,India,Player,Chennai Super Kings,Kochi Tuskers Kerala,2011,,31,,Blank,Blank,Ms Dhoni,Pa Patel,Ms Dhoni,Pa Patel,1980-08-30
17913,,501266,71,Dj Bravo,10/7/1983,Right-hand Bat,Right-arm Medium-fast,West Indies,Player,Chennai Super Kings,Kochi Tuskers Kerala,2011,,28,,Blank,Blank,Ms Dhoni,Pa Patel,Ms Dhoni,Pa Patel,1983-10-07
17915,,501266,185,M Vijay,4/1/1984,Right-hand Bat,Right-arm Offbreak,India,Player,Chennai Super Kings,Kochi Tuskers Kerala,2011,,27,,Blank,Blank,Ms Dhoni,Pa Patel,Ms Dhoni,Pa Patel,1984-04-01
17916,,501266,186,Sb Jakati,11/27/1980,Left-hand Bat,Slow Left-arm Orthodox,India,Player,Chennai Super Kings,Kochi Tuskers Kerala,2011,,31,,Blank,Blank,Ms Dhoni,Pa Patel,Ms Dhoni,Pa Patel,1980-11-27
17918,,501266,248,De Bollinger,7/24/1981,Left-hand Bat,Left-arm Fast-medium,Australia,Player,Chennai Super Kings,Kochi Tuskers Kerala,2011,,30,,Blank,Blank,Ms Dhoni,Pa Patel,Ms Dhoni,Pa Patel,1981-07-24
17922,,501266,61,Rp Singh,12/6/1985,Right-hand Bat,Left-arm Fast-medium,India,Player,Kochi Tuskers Kerala,Chennai Super Kings,2011,,26,,Blank,Blank,Pa Patel,Ms Dhoni,Pa Patel,Ms Dhoni,1985-12-06
17924,,501266,81,R Vinay Kumar,2/12/1984,Right-hand Bat,Right-arm Medium,India,Player,Kochi Tuskers Kerala,Chennai Super Kings,2011,,27,,Blank,Blank,Pa Patel,Ms Dhoni,Pa Patel,Ms Dhoni,1984-02-12
17926,,501266,121,M Muralitharan,4/17/1972,Right-hand Bat,Right-arm Offbreak,Sri Lanka,Player,Kochi Tuskers Kerala,Chennai Super Kings,2011,,39,,Blank,Blank,Pa Patel,Ms Dhoni,Pa Patel,Ms Dhoni,1972-04-17
17927,,501266,204,Oa Shah,10/22/1978,Right-hand Bat,Right-arm Offbreak,England,Player,Kochi Tuskers Kerala,Chennai Super Kings,2011,,33,,Blank,Blank,Pa Patel,Ms Dhoni,Pa Patel,Ms Dhoni,1978-10-22
17928,,501266,237,Km Jadhav,3/26/1985,Right-hand Bat,Right-arm Offbreak,India,Player,Kochi Tuskers Kerala,Chennai Super Kings,2011,,26,,Blank,Blank,Pa Patel,Ms Dhoni,Pa Patel,Ms Dhoni,1985-03-26
17932,,501267,46,Rv Uthappa,11/11/1985,Right-hand Bat,Right-arm Medium,India,Keeper,Pune Warriors,Kolkata Knight Riders,2011,,26,,Blank,Blank,Yuvraj Singh,G Gambhir,Rv Uthappa,Sp Goswami,1985-11-11
17934,,501267,157,Jd Ryder,8/6/1984,Left-hand Bat,Right-arm Medium,New Zealand,Player,Pune Warriors,Kolkata Knight Riders,2011,,27,,Blank,Blank,Yuvraj Singh,G Gambhir,Rv Uthappa,Sp Goswami,1984-08-06
17935,,501267,235,R Sharma,4/30/1987,Right-hand Bat,Right-arm Offbreak,India,Player,Pune Warriors,Kolkata Knight Riders,2011,,24,,Blank,Blank,Yuvraj Singh,G Gambhir,Rv Uthappa,Sp Goswami,1987-04-30
17937,,501267,274,Ac Thomas,2/9/1977,Right-hand Bat,Right-arm Fast-medium,England,Player,Pune Warriors,Kolkata Knight Riders,2011,,34,,Blank,Blank,Yuvraj Singh,G Gambhir,Rv Uthappa,Sp Goswami,1977-02-09
17938,,501267,295,Cj Ferguson,11/21/1984,Right-hand Bat,Right-arm Medium,Australia,Player,Pune Warriors,Kolkata Knight Riders,2011,,27,,Blank,Blank,Yuvraj Singh,G Gambhir,Rv Uthappa,Sp Goswami,1984-11-21
17939,,501267,299,B Kumar,2/5/1990,Right-hand Bat,Right-arm Medium,India,Player,Pune Warriors,Kolkata Knight Riders,2011,,21,,Blank,Blank,Yuvraj Singh,G Gambhir,Rv Uthappa,Sp Goswami,1990-02-05
17941,,501267,9,Jh Kallis,10/16/1975,Right-hand Bat,Right-arm Fast-medium,South Africa,Player,Kolkata Knight Riders,Pune Warriors,2011,,36,,Blank,Blank,G Gambhir,Yuvraj Singh,Sp Goswami,Rv Uthappa,1975-10-16
17946,,501267,89,R Bhatia,10/22/1979,Right-hand Bat,Right-arm Medium-fast,India,Player,Kolkata Knight Riders,Pune Warriors,2011,,32,,Blank,Blank,G Gambhir,Yuvraj Singh,Sp Goswami,Rv Uthappa,1979-10-22
17947,,501267,132,Sp Goswami,5/18/1989,Left-hand Bat,N/a,India,Keeper,Kolkata Knight Riders,Pune Warriors,2011,,22,,Blank,Blank,G Gambhir,Yuvraj Singh,Sp Goswami,Rv Uthappa,1989-05-18
17948,,501267,140,Iqbal Abdulla,12/2/1989,Left-hand Bat,Slow Left-arm Orthodox,India,Player,Kolkata Knight Riders,Pune Warriors,2011,,22,,Blank,Blank,G Gambhir,Yuvraj Singh,Sp Goswami,Rv Uthappa,1989-12-02
17949,,501267,151,L Balaji,9/27/1981,Right-hand Bat,Right-arm Medium-fast,India,Player,Kolkata Knight Riders,Pune Warriors,2011,,30,,Blank,Blank,G Gambhir,Yuvraj Singh,Sp Goswami,Rv Uthappa,1981-09-27
17950,,501267,276,Shakib Al Hasan,3/24/1987,Left-hand Bat,Slow Left-arm Orthodox,Bangladesh,Player,Kolkata Knight Riders,Pune Warriors,2011,,24,,Blank,Blank,G Gambhir,Yuvraj Singh,Sp Goswami,Rv Uthappa,1987-03-24
17952,,501268,50,Harbhajan Singh,7/3/1980,Right-hand Bat,Right-arm Offbreak,India,Player,Mumbai Indians,Rajasthan Royals,2011,,31,,Blank,Blank,Sr Tendulkar,Sk Warne,At Rayudu,Pr Shah,1980-07-03
17955,,501268,80,Ds Kulkarni,12/10/1988,Right-hand Bat,Right-arm Medium,India,Player,Mumbai Indians,Rajasthan Royals,2011,,23,,Blank,Blank,Sr Tendulkar,Sk Warne,At Rayudu,Pr Shah,1988-12-10
17958,,501268,178,Tl Suman,12/15/1983,Right-hand Bat,Right-arm Offbreak,India,Player,Mumbai Indians,Rajasthan Royals,2011,,28,,Blank,Blank,Sr Tendulkar,Sk Warne,At Rayudu,Pr Shah,1983-12-15
17959,,501268,194,Sl Malinga,8/28/1983,Right-hand Bat,Right-arm Fast,Sri Lanka,Player,Mumbai Indians,Rajasthan Royals,2011,,28,,Blank,Blank,Sr Tendulkar,Sk Warne,At Rayudu,Pr Shah,1983-08-28
17964,,501268,32,Sr Watson,6/17/1981,Right-hand Bat,Right-arm Fast-medium,Australia,Player,Rajasthan Royals,Mumbai Indians,2011,,30,,Blank,Blank,Sk Warne,Sr Tendulkar,Pr Shah,At Rayudu,1981-06-17
17965,,501268,38,Sk Warne,9/13/1969,Right-hand Bat,Legbreak Googly,Australia,Captain,Rajasthan Royals,Mumbai Indians,2011,,42,,Blank,Blank,Sk Warne,Sr Tendulkar,Pr Shah,At Rayudu,1969-09-13
17966,,501268,39,Sk Trivedi,9/4/1982,Right-hand Bat,Right-arm Medium,India,Player,Rajasthan Royals,Mumbai Indians,2011,,29,,Blank,Blank,Sk Warne,Sr Tendulkar,Pr Shah,At Rayudu,1982-09-04
17967,,501268,47,Pr Shah,11/3/1987,Right-hand Bat,N/a,India,Keeper,Rajasthan Royals,Mumbai Indians,2011,,24,,Blank,Blank,Sk Warne,Sr Tendulkar,Pr Shah,At Rayudu,1987-11-03
17968,,501268,52,Lrpl Taylor,3/8/1984,Right-hand Bat,Right-arm Offbreak,New Zealand,Player,Rajasthan Royals,Mumbai Indians,2011,,27,,Blank,Blank,Sk Warne,Sr Tendulkar,Pr Shah,At Rayudu,1984-03-08
17969,,501268,85,Am Rahane,6/6/1988,Right-hand Bat,Right-arm Medium,India,Player,Rajasthan Royals,Mumbai Indians,2011,,23,,Blank,Blank,Sk Warne,Sr Tendulkar,Pr Shah,At Rayudu,1988-06-06
17972,,501268,266,Al Menaria,10/29/1990,Left-hand Bat,Slow Left-arm Orthodox,India,Player,Rajasthan Royals,Mumbai Indians,2011,,21,,Blank,Blank,Sk Warne,Sr Tendulkar,Pr Shah,At Rayudu,1990-10-29
17974,,501269,14,P Kumar,10/2/1986,Right-hand Bat,Right-arm Medium,India,Player,Kings Xi Punjab,Deccan Chargers,2011,,25,,Blank,Blank,Ac Gilchrist,Cl White,Ac Gilchrist,Kh Devdhar,1986-10-02
17976,,501269,53,Ac Gilchrist,11/14/1971,Left-hand Bat,Right-arm Offbreak,Australia,Captainkeeper,Kings Xi Punjab,Deccan Chargers,2011,,40,,Blank,Blank,Ac Gilchrist,Cl White,Ac Gilchrist,Kh Devdhar,1971-11-14
17978,,501269,88,Kd Karthik,6/1/1985,Right-hand Bat,N/a,India,Player,Kings Xi Punjab,Deccan Chargers,2011,,26,,Blank,Blank,Ac Gilchrist,Cl White,Ac Gilchrist,Kh Devdhar,1985-06-01
17980,,501269,167,Pc Valthaty,12/7/1983,Right-hand Bat,Right-arm Medium,India,Player,Kings Xi Punjab,Deccan Chargers,2011,,28,,Blank,Blank,Ac Gilchrist,Cl White,Ac Gilchrist,Kh Devdhar,1983-12-07
17981,,501269,188,Rj Harris,10/11/1979,Right-hand Bat,Right-arm Fast,Australia,Player,Kings Xi Punjab,Deccan Chargers,2011,,32,,Blank,Blank,Ac Gilchrist,Cl White,Ac Gilchrist,Kh Devdhar,1979-10-11
17982,,501269,210,R Mclaren,2/9/1983,Left-hand Bat,Right-arm Medium-fast,South Africa,Player,Kings Xi Punjab,Deccan Chargers,2011,,28,,Blank,Blank,Ac Gilchrist,Cl White,Ac Gilchrist,Kh Devdhar,1983-02-09
17983,,501269,236,Mandeep Singh,12/18/1991,Right-hand Bat,Right-arm Medium,India,Player,Kings Xi Punjab,Deccan Chargers,2011,,20,,Blank,Blank,Ac Gilchrist,Cl White,Ac Gilchrist,Kh Devdhar,1991-12-18
17984,,501269,302,Ba Bhatt,5/13/1990,Left-hand Bat,Slow Left-arm Orthodox,India,Player,Kings Xi Punjab,Deccan Chargers,2011,,21,,Blank,Blank,Ac Gilchrist,Cl White,Ac Gilchrist,Kh Devdhar,1990-05-13
17985,,501269,10,Cl White,8/18/1983,Right-hand Bat,Legbreak Googly,Australia,Captain,Deccan Chargers,Kings Xi Punjab,2011,,28,,Blank,Blank,Cl White,Ac Gilchrist,Kh Devdhar,Ac Gilchrist,1983-08-18
17991,,501269,136,A Mishra,11/24/1982,Right-hand Bat,Legbreak,India,Player,Deccan Chargers,Kings Xi Punjab,2011,,29,,Blank,Blank,Cl White,Ac Gilchrist,Kh Devdhar,Ac Gilchrist,1982-11-24
17993,,501269,258,Dt Christian,5/4/1983,Right-hand Bat,Right-arm Fast-medium,Australia,Player,Deccan Chargers,Kings Xi Punjab,2011,,28,,Blank,Blank,Cl White,Ac Gilchrist,Kh Devdhar,Ac Gilchrist,1983-05-04
17995,,501269,468,Kh Devdhar,12/14/1989,Right-hand Bat,N/a,India,Keeper,Deccan Chargers,Kings Xi Punjab,2011,,22,,Blank,Blank,Cl White,Ac Gilchrist,Kh Devdhar,Ac Gilchrist,1989-12-14
17996,,501270,25,Jr Hopes,10/24/1978,Right-hand Bat,Right-arm Medium,Australia,Captain,Delhi Daredevils,Pune Warriors,2011,,33,,Blank,Blank,Jr Hopes,Yuvraj Singh,Nv Ojha,Rv Uthappa,1978-10-24
18001,,501270,187,Da Warner,10/27/1986,Left-hand Bat,Legbreak,Australia,Player,Delhi Daredevils,Pune Warriors,2011,,25,,Blank,Blank,Jr Hopes,Yuvraj Singh,Nv Ojha,Rv Uthappa,1986-10-27
18002,,501270,199,Y Nagar,1/6/1990,Right-hand Bat,Right-arm Offbreak,India,Player,Delhi Daredevils,Pune Warriors,2011,,21,,Blank,Blank,Jr Hopes,Yuvraj Singh,Nv Ojha,Rv Uthappa,1990-01-06
18007,,501270,1,Sc Ganguly,7/8/1972,Left-hand Bat,Right-arm Medium,India,Player,Pune Warriors,Delhi Daredevils,2011,,39,,Blank,Blank,Yuvraj Singh,Jr Hopes,Rv Uthappa,Nv Ojha,1972-07-08
18008,,501270,27,Yuvraj Singh,12/12/1981,Left-hand Bat,Slow Left-arm Orthodox,India,Captain,Pune Warriors,Delhi Daredevils,2011,,30,,Blank,Blank,Yuvraj Singh,Jr Hopes,Rv Uthappa,Nv Ojha,1981-12-12
18012,,501270,253,Mr Marsh,10/20/1991,Right-hand Bat,Right-arm Medium,Australia,Player,Pune Warriors,Delhi Daredevils,2011,,20,,Blank,Blank,Yuvraj Singh,Jr Hopes,Rv Uthappa,Nv Ojha,1991-10-20
18014,,501270,295,Cj Ferguson,11/21/1984,Right-hand Bat,Right-arm Medium,Australia,Player,Pune Warriors,Delhi Daredevils,2011,,27,,Blank,Blank,Yuvraj Singh,Jr Hopes,Rv Uthappa,Nv Ojha,1984-11-21
18015,,501270,301,S Rana,9/18/1984,Right-hand Bat,Right-arm Medium-fast,India,Player,Pune Warriors,Delhi Daredevils,2011,,27,,Blank,Blank,Yuvraj Singh,Jr Hopes,Rv Uthappa,Nv Ojha,1984-09-18
18018,,501271,8,V Kohli,11/5/1988,Right-hand Bat,Right-arm Medium,India,Player,Royal Challengers Bangalore,Chennai Super Kings,2011,,23,,Blank,Blank,Dl Vettori,Ms Dhoni,Ab De Villiers,Ms Dhoni,1988-11-05
18020,,501271,33,M Kaif,12/1/1980,Right-hand Bat,Right-arm Offbreak,India,Player,Royal Challengers Bangalore,Chennai Super Kings,2011,,31,,Blank,Blank,Dl Vettori,Ms Dhoni,Ab De Villiers,Ms Dhoni,1980-12-01
18024,,501271,162,Ch Gayle,9/21/1979,Left-hand Bat,Right-arm Offbreak,West Indies,Player,Royal Challengers Bangalore,Chennai Super Kings,2011,,32,,Blank,Blank,Dl Vettori,Ms Dhoni,Ab De Villiers,Ms Dhoni,1979-09-21
18026,,501271,244,A Mithun,10/25/1989,Right-hand Bat,Right-arm Medium,India,Player,Royal Challengers Bangalore,Chennai Super Kings,2011,,22,,Blank,Blank,Dl Vettori,Ms Dhoni,Ab De Villiers,Ms Dhoni,1989-10-25
18027,,501271,260,Ma Agarwal,2/16/1991,Right-hand Bat,N/a,India,Player,Royal Challengers Bangalore,Chennai Super Kings,2011,,20,,Blank,Blank,Dl Vettori,Ms Dhoni,Ab De Villiers,Ms Dhoni,1991-02-16
18028,,501271,270,S Aravind,4/8/1984,Left-hand Bat,Left-arm Medium-fast,India,Player,Royal Challengers Bangalore,Chennai Super Kings,2011,,27,,Blank,Blank,Dl Vettori,Ms Dhoni,Ab De Villiers,Ms Dhoni,1984-04-08
18029,,501271,19,Mek Hussey,5/27/1975,Left-hand Bat,Right-arm Medium,Australia,Player,Chennai Super Kings,Royal Challengers Bangalore,2011,,36,,Blank,Blank,Ms Dhoni,Dl Vettori,Ms Dhoni,Ab De Villiers,1975-05-27
18030,,501271,20,Ms Dhoni,7/7/1981,Right-hand Bat,Right-arm Medium,India,Captainkeeper,Chennai Super Kings,Royal Challengers Bangalore,2011,,30,,Blank,Blank,Ms Dhoni,Dl Vettori,Ms Dhoni,Ab De Villiers,1981-07-07
18035,,501271,109,Ja Morkel,6/10/1981,Left-hand Bat,Right-arm Medium-fast,South Africa,Player,Chennai Super Kings,Royal Challengers Bangalore,2011,,30,,Blank,Blank,Ms Dhoni,Dl Vettori,Ms Dhoni,Ab De Villiers,1981-06-10
18036,,501271,185,M Vijay,4/1/1984,Right-hand Bat,Right-arm Offbreak,India,Player,Chennai Super Kings,Royal Challengers Bangalore,2011,,27,,Blank,Blank,Ms Dhoni,Dl Vettori,Ms Dhoni,Ab De Villiers,1984-04-01
18037,,501271,186,Sb Jakati,11/27/1980,Left-hand Bat,Slow Left-arm Orthodox,India,Player,Chennai Super Kings,Royal Challengers Bangalore,2011,,31,,Blank,Blank,Ms Dhoni,Dl Vettori,Ms Dhoni,Ab De Villiers,1980-11-27
18038,,501271,201,R Ashwin,9/17/1986,Right-hand Bat,Right-arm Offbreak,India,Player,Chennai Super Kings,Royal Challengers Bangalore,2011,,25,,Blank,Blank,Ms Dhoni,Dl Vettori,Ms Dhoni,Ab De Villiers,1986-09-17
18040,,501272,50,Harbhajan Singh,7/3/1980,Right-hand Bat,Right-arm Offbreak,India,Player,Mumbai Indians,Kolkata Knight Riders,2011,,31,,Blank,Blank,Sr Tendulkar,G Gambhir,At Rayudu,Sp Goswami,1980-07-03
18041,,501272,57,Rg Sharma,4/30/1987,Right-hand Bat,Right-arm Offbreak,India,Player,Mumbai Indians,Kolkata Knight Riders,2011,,24,,Blank,Blank,Sr Tendulkar,G Gambhir,At Rayudu,Sp Goswami,1987-04-30
18043,,501272,178,Tl Suman,12/15/1983,Right-hand Bat,Right-arm Offbreak,India,Player,Mumbai Indians,Kolkata Knight Riders,2011,,28,,Blank,Blank,Sr Tendulkar,G Gambhir,At Rayudu,Sp Goswami,1983-12-15
18044,,501272,194,Sl Malinga,8/28/1983,Right-hand Bat,Right-arm Fast,Sri Lanka,Player,Mumbai Indians,Kolkata Knight Riders,2011,,28,,Blank,Blank,Sr Tendulkar,G Gambhir,At Rayudu,Sp Goswami,1983-08-28
18050,,501272,449,Rw Price,6/12/1976,Right-hand Bat,Slow Left-arm Orthodox,Zimbabwea,Player,Mumbai Indians,Kolkata Knight Riders,2011,,35,,Blank,Blank,Sr Tendulkar,G Gambhir,At Rayudu,Sp Goswami,1976-06-12
18051,,501272,9,Jh Kallis,10/16/1975,Right-hand Bat,Right-arm Fast-medium,South Africa,Player,Kolkata Knight Riders,Mumbai Indians,2011,,36,,Blank,Blank,G Gambhir,Sr Tendulkar,Sp Goswami,At Rayudu,1975-10-16
18052,,501272,31,Yk Pathan,11/17/1982,Right-hand Bat,Right-arm Offbreak,India,Player,Kolkata Knight Riders,Mumbai Indians,2011,,29,,Blank,Blank,G Gambhir,Sr Tendulkar,Sp Goswami,At Rayudu,1982-11-17
18053,,501272,40,G Gambhir,10/14/1981,Left-hand Bat,Legbreak,India,Captain,Kolkata Knight Riders,Mumbai Indians,2011,,30,,Blank,Blank,G Gambhir,Sr Tendulkar,Sp Goswami,At Rayudu,1981-10-14
18057,,501272,132,Sp Goswami,5/18/1989,Left-hand Bat,N/a,India,Keeper,Kolkata Knight Riders,Mumbai Indians,2011,,22,,Blank,Blank,G Gambhir,Sr Tendulkar,Sp Goswami,At Rayudu,1989-05-18
18058,,501272,140,Iqbal Abdulla,12/2/1989,Left-hand Bat,Slow Left-arm Orthodox,India,Player,Kolkata Knight Riders,Mumbai Indians,2011,,22,,Blank,Blank,G Gambhir,Sr Tendulkar,Sp Goswami,At Rayudu,1989-12-02
18059,,501272,151,L Balaji,9/27/1981,Right-hand Bat,Right-arm Medium-fast,India,Player,Kolkata Knight Riders,Mumbai Indians,2011,,30,,Blank,Blank,G Gambhir,Sr Tendulkar,Sp Goswami,At Rayudu,1981-09-27
18060,,501272,276,Shakib Al Hasan,3/24/1987,Left-hand Bat,Slow Left-arm Orthodox,Bangladesh,Player,Kolkata Knight Riders,Mumbai Indians,2011,,24,,Blank,Blank,G Gambhir,Sr Tendulkar,Sp Goswami,At Rayudu,1987-03-24
18062,,501273,8,V Kohli,11/5/1988,Right-hand Bat,Right-arm Medium,India,Player,Royal Challengers Bangalore,Chennai Super Kings,2011,,23,,Blank,Blank,Dl Vettori,Ms Dhoni,Ab De Villiers,Ms Dhoni,1988-11-05
18068,,501273,162,Ch Gayle,9/21/1979,Left-hand Bat,Right-arm Offbreak,West Indies,Player,Royal Challengers Bangalore,Chennai Super Kings,2011,,32,,Blank,Blank,Dl Vettori,Ms Dhoni,Ab De Villiers,Ms Dhoni,1979-09-21
18071,,501273,260,Ma Agarwal,2/16/1991,Right-hand Bat,N/a,India,Player,Royal Challengers Bangalore,Chennai Super Kings,2011,,20,,Blank,Blank,Dl Vettori,Ms Dhoni,Ab De Villiers,Ms Dhoni,1991-02-16
18074,,501273,20,Ms Dhoni,7/7/1981,Right-hand Bat,Right-arm Medium,India,Captainkeeper,Chennai Super Kings,Royal Challengers Bangalore,2011,,30,,Blank,Blank,Ms Dhoni,Dl Vettori,Ms Dhoni,Ab De Villiers,1981-07-07
18075,,501273,21,Sk Raina,11/27/1986,Left-hand Bat,Right-arm Offbreak,India,Player,Chennai Super Kings,Royal Challengers Bangalore,2011,,25,,Blank,Blank,Ms Dhoni,Dl Vettori,Ms Dhoni,Ab De Villiers,1986-11-27
18076,,501273,23,S Badrinath,8/30/1980,Right-hand Bat,Right-arm Offbreak,India,Player,Chennai Super Kings,Royal Challengers Bangalore,2011,,31,,Blank,Blank,Ms Dhoni,Dl Vettori,Ms Dhoni,Ab De Villiers,1980-08-30
18077,,501273,62,Wp Saha,10/24/1984,Right-hand Bat,N/a,India,Player,Chennai Super Kings,Royal Challengers Bangalore,2011,,27,,Blank,Blank,Ms Dhoni,Dl Vettori,Ms Dhoni,Ab De Villiers,1984-10-24
18080,,501273,185,M Vijay,4/1/1984,Right-hand Bat,Right-arm Offbreak,India,Player,Chennai Super Kings,Royal Challengers Bangalore,2011,,27,,Blank,Blank,Ms Dhoni,Dl Vettori,Ms Dhoni,Ab De Villiers,1984-04-01
18081,,501273,186,Sb Jakati,11/27/1980,Left-hand Bat,Slow Left-arm Orthodox,India,Player,Chennai Super Kings,Royal Challengers Bangalore,2011,,31,,Blank,Blank,Ms Dhoni,Dl Vettori,Ms Dhoni,Ab De Villiers,1980-11-27
18083,,501273,248,De Bollinger,7/24/1981,Left-hand Bat,Left-arm Fast-medium,Australia,Player,Chennai Super Kings,Royal Challengers Bangalore,2011,,30,,Blank,Blank,Ms Dhoni,Dl Vettori,Ms Dhoni,Ab De Villiers,1981-07-24
18084,,501274,50,Harbhajan Singh,7/3/1980,Right-hand Bat,Right-arm Offbreak,India,Player,Mumbai Indians,Kolkata Knight Riders,2011,,31,,Blank,Blank,Sr Tendulkar,G Gambhir,At Rayudu,Sp Goswami,1980-07-03
18085,,501274,57,Rg Sharma,4/30/1987,Right-hand Bat,Right-arm Offbreak,India,Player,Mumbai Indians,Kolkata Knight Riders,2011,,24,,Blank,Blank,Sr Tendulkar,G Gambhir,At Rayudu,Sp Goswami,1987-04-30
18087,,501274,126,Mm Patel,7/12/1983,Right-hand Bat,Right-arm Medium-fast,India,Player,Mumbai Indians,Kolkata Knight Riders,2011,,28,,Blank,Blank,Sr Tendulkar,G Gambhir,At Rayudu,Sp Goswami,1983-07-12
18088,,501274,133,Sr Tendulkar,4/24/1973,Right-hand Bat,Right-arm Offbreak,India,Captain,Mumbai Indians,Kolkata Knight Riders,2011,,38,,Blank,Blank,Sr Tendulkar,G Gambhir,At Rayudu,Sp Goswami,1973-04-24
18092,,501274,221,Ka Pollard,5/12/1987,Right-hand Bat,Right-arm Medium-fast,West Indies,Player,Mumbai Indians,Kolkata Knight Riders,2011,,24,,Blank,Blank,Sr Tendulkar,G Gambhir,At Rayudu,Sp Goswami,1987-05-12
18093,,501274,275,Jec Franklin,11/7/1980,Left-hand Bat,Left-arm Medium,New Zealand,Player,Mumbai Indians,Kolkata Knight Riders,2011,,31,,Blank,Blank,Sr Tendulkar,G Gambhir,At Rayudu,Sp Goswami,1980-11-07
18096,,501274,31,Yk Pathan,11/17/1982,Right-hand Bat,Right-arm Offbreak,India,Player,Kolkata Knight Riders,Mumbai Indians,2011,,29,,Blank,Blank,G Gambhir,Sr Tendulkar,Sp Goswami,At Rayudu,1982-11-17
18099,,501274,87,Mk Tiwary,11/14/1985,Right-hand Bat,Legbreak Googly,India,Player,Kolkata Knight Riders,Mumbai Indians,2011,,26,,Blank,Blank,G Gambhir,Sr Tendulkar,Sp Goswami,At Rayudu,1985-11-14
18100,,501274,89,R Bhatia,10/22/1979,Right-hand Bat,Right-arm Medium-fast,India,Player,Kolkata Knight Riders,Mumbai Indians,2011,,32,,Blank,Blank,G Gambhir,Sr Tendulkar,Sp Goswami,At Rayudu,1979-10-22
18102,,501274,140,Iqbal Abdulla,12/2/1989,Left-hand Bat,Slow Left-arm Orthodox,India,Player,Kolkata Knight Riders,Mumbai Indians,2011,,22,,Blank,Blank,G Gambhir,Sr Tendulkar,Sp Goswami,At Rayudu,1989-12-02
18105,,501274,284,Rn Ten Doeschate,6/30/1980,Right-hand Bat,Right-arm Medium-fast,Netherlands,Player,Kolkata Knight Riders,Mumbai Indians,2011,,31,,Blank,Blank,G Gambhir,Sr Tendulkar,Sp Goswami,At Rayudu,1980-06-30
18107,,501275,15,Z Khan,10/7/1978,Right-hand Bat,Left-arm Fast-medium,India,Player,Royal Challengers Bangalore,Mumbai Indians,2011,,33,,Blank,Blank,Dl Vettori,Sr Tendulkar,Ab De Villiers,At Rayudu,1978-10-07
18108,,501275,79,Ss Tiwary,12/30/1989,Left-hand Bat,N/a,India,Player,Royal Challengers Bangalore,Mumbai Indians,2011,,22,,Blank,Blank,Dl Vettori,Sr Tendulkar,Ab De Villiers,At Rayudu,1989-12-30
18113,,501275,244,A Mithun,10/25/1989,Right-hand Bat,Right-arm Medium,India,Player,Royal Challengers Bangalore,Mumbai Indians,2011,,22,,Blank,Blank,Dl Vettori,Sr Tendulkar,Ab De Villiers,At Rayudu,1989-10-25
18117,,501275,50,Harbhajan Singh,7/3/1980,Right-hand Bat,Right-arm Offbreak,India,Player,Mumbai Indians,Royal Challengers Bangalore,2011,,31,,Blank,Blank,Sr Tendulkar,Dl Vettori,At Rayudu,Ab De Villiers,1980-07-03
18118,,501275,57,Rg Sharma,4/30/1987,Right-hand Bat,Right-arm Offbreak,India,Player,Mumbai Indians,Royal Challengers Bangalore,2011,,24,,Blank,Blank,Sr Tendulkar,Dl Vettori,At Rayudu,Ab De Villiers,1987-04-30
18121,,501275,194,Sl Malinga,8/28/1983,Right-hand Bat,Right-arm Fast,Sri Lanka,Player,Mumbai Indians,Royal Challengers Bangalore,2011,,28,,Blank,Blank,Sr Tendulkar,Dl Vettori,At Rayudu,Ab De Villiers,1983-08-28
18123,,501275,209,R Sathish,1/14/1981,Right-hand Bat,Right-arm Medium,India,Player,Mumbai Indians,Royal Challengers Bangalore,2011,,30,,Blank,Blank,Sr Tendulkar,Dl Vettori,At Rayudu,Ab De Villiers,1981-01-14
18124,,501275,221,Ka Pollard,5/12/1987,Right-hand Bat,Right-arm Medium-fast,West Indies,Player,Mumbai Indians,Royal Challengers Bangalore,2011,,24,,Blank,Blank,Sr Tendulkar,Dl Vettori,At Rayudu,Ab De Villiers,1987-05-12
18128,,501276,8,V Kohli,11/5/1988,Right-hand Bat,Right-arm Medium,India,Player,Royal Challengers Bangalore,Chennai Super Kings,2011,,23,,Blank,Blank,Dl Vettori,Ms Dhoni,Ab De Villiers,Ms Dhoni,1988-11-05
18129,,501276,15,Z Khan,10/7/1978,Right-hand Bat,Left-arm Fast-medium,India,Player,Royal Challengers Bangalore,Chennai Super Kings,2011,,33,,Blank,Blank,Dl Vettori,Ms Dhoni,Ab De Villiers,Ms Dhoni,1978-10-07
18133,,501276,162,Ch Gayle,9/21/1979,Left-hand Bat,Right-arm Offbreak,West Indies,Player,Royal Challengers Bangalore,Chennai Super Kings,2011,,32,,Blank,Blank,Dl Vettori,Ms Dhoni,Ab De Villiers,Ms Dhoni,1979-09-21
18134,,501276,175,Dl Vettori,1/27/1979,Left-hand Bat,Slow Left-arm Orthodox,New Zealand,Captain,Royal Challengers Bangalore,Chennai Super Kings,2011,,32,,Blank,Blank,Dl Vettori,Ms Dhoni,Ab De Villiers,Ms Dhoni,1979-01-27
18139,,501276,19,Mek Hussey,5/27/1975,Left-hand Bat,Right-arm Medium,Australia,Player,Chennai Super Kings,Royal Challengers Bangalore,2011,,36,,Blank,Blank,Ms Dhoni,Dl Vettori,Ms Dhoni,Ab De Villiers,1975-05-27
18140,,501276,20,Ms Dhoni,7/7/1981,Right-hand Bat,Right-arm Medium,India,Captainkeeper,Chennai Super Kings,Royal Challengers Bangalore,2011,,30,,Blank,Blank,Ms Dhoni,Dl Vettori,Ms Dhoni,Ab De Villiers,1981-07-07
18143,,501276,62,Wp Saha,10/24/1984,Right-hand Bat,N/a,India,Player,Chennai Super Kings,Royal Challengers Bangalore,2011,,27,,Blank,Blank,Ms Dhoni,Dl Vettori,Ms Dhoni,Ab De Villiers,1984-10-24
18145,,501276,109,Ja Morkel,6/10/1981,Left-hand Bat,Right-arm Medium-fast,South Africa,Player,Chennai Super Kings,Royal Challengers Bangalore,2011,,30,,Blank,Blank,Ms Dhoni,Dl Vettori,Ms Dhoni,Ab De Villiers,1981-06-10
18147,,501276,186,Sb Jakati,11/27/1980,Left-hand Bat,Slow Left-arm Orthodox,India,Player,Chennai Super Kings,Royal Challengers Bangalore,2011,,31,,Blank,Blank,Ms Dhoni,Dl Vettori,Ms Dhoni,Ab De Villiers,1980-11-27
18150,,548311,50,Harbhajan Singh,7/3/1980,Right-hand Bat,Right-arm Offbreak,India,Captain,Mumbai Indians,Chennai Super Kings,2012,,32,,Blank,Blank,Harbhajan Singh,Ms Dhoni,Kd Karthik,Ms Dhoni,1980-07-03
18153,,548311,131,Pp Ojha,9/5/1986,Left-hand Bat,Slow Left-arm Orthodox,India,Player,Mumbai Indians,Chennai Super Kings,2012,,26,,Blank,Blank,Harbhajan Singh,Ms Dhoni,Kd Karthik,Ms Dhoni,1986-09-05
18161,,548311,20,Ms Dhoni,7/7/1981,Right-hand Bat,Right-arm Medium,India,Captainkeeper,Chennai Super Kings,Mumbai Indians,2012,,31,,Blank,Blank,Ms Dhoni,Harbhajan Singh,Ms Dhoni,Kd Karthik,1981-07-07
18162,,548311,21,Sk Raina,11/27/1986,Left-hand Bat,Right-arm Offbreak,India,Player,Chennai Super Kings,Mumbai Indians,2012,,26,,Blank,Blank,Ms Dhoni,Harbhajan Singh,Ms Dhoni,Kd Karthik,1986-11-27
18166,,548311,109,Ja Morkel,6/10/1981,Left-hand Bat,Right-arm Medium-fast,South Africa,Player,Chennai Super Kings,Mumbai Indians,2012,,31,,Blank,Blank,Ms Dhoni,Harbhajan Singh,Ms Dhoni,Kd Karthik,1981-06-10
18167,,548311,185,M Vijay,4/1/1984,Right-hand Bat,Right-arm Offbreak,India,Player,Chennai Super Kings,Mumbai Indians,2012,,28,,Blank,Blank,Ms Dhoni,Harbhajan Singh,Ms Dhoni,Kd Karthik,1984-04-01
18168,,548311,186,Sb Jakati,11/27/1980,Left-hand Bat,Slow Left-arm Orthodox,India,Player,Chennai Super Kings,Mumbai Indians,2012,,32,,Blank,Blank,Ms Dhoni,Harbhajan Singh,Ms Dhoni,Kd Karthik,1980-11-27
18169,,548311,201,R Ashwin,9/17/1986,Right-hand Bat,Right-arm Offbreak,India,Player,Chennai Super Kings,Mumbai Indians,2012,,26,,Blank,Blank,Ms Dhoni,Harbhajan Singh,Ms Dhoni,Kd Karthik,1986-09-17
18170,,548311,248,De Bollinger,7/24/1981,Left-hand Bat,Left-arm Fast-medium,Australia,Player,Chennai Super Kings,Mumbai Indians,2012,,31,,Blank,Blank,Ms Dhoni,Harbhajan Singh,Ms Dhoni,Kd Karthik,1981-07-24
18171,,548311,303,F Du Plessis,7/13/1984,Right-hand Bat,Legbreak,South Africa,Player,Chennai Super Kings,Mumbai Indians,2012,,28,,Blank,Blank,Ms Dhoni,Harbhajan Singh,Ms Dhoni,Kd Karthik,1984-07-13
18173,,548312,9,Jh Kallis,10/16/1975,Right-hand Bat,Right-arm Fast-medium,South Africa,Player,Kolkata Knight Riders,Delhi Daredevils,2012,,37,,Blank,Blank,G Gambhir,V Sehwag,Bb Mccullum,Nv Ojha,1975-10-16
18174,,548312,31,Yk Pathan,11/17/1982,Right-hand Bat,Right-arm Offbreak,India,Player,Kolkata Knight Riders,Delhi Daredevils,2012,,30,,Blank,Blank,G Gambhir,V Sehwag,Bb Mccullum,Nv Ojha,1982-11-17
18177,,548312,66,B Lee,11/8/1976,Right-hand Bat,Right-arm Fast,Australia,Player,Kolkata Knight Riders,Delhi Daredevils,2012,,36,,Blank,Blank,G Gambhir,V Sehwag,Bb Mccullum,Nv Ojha,1976-11-08
18183,,548312,29,Ik Pathan,10/27/1984,Left-hand Bat,Left-arm Medium-fast,India,Player,Delhi Daredevils,Kolkata Knight Riders,2012,,28,,Blank,Blank,V Sehwag,G Gambhir,Nv Ojha,Bb Mccullum,1984-10-27
18190,,548312,232,Ut Yadav,10/25/1987,Right-hand Bat,Right-arm Fast-medium,India,Player,Delhi Daredevils,Kolkata Knight Riders,2012,,25,,Blank,Blank,V Sehwag,G Gambhir,Nv Ojha,Bb Mccullum,1987-10-25
18191,,548312,254,Aj Finch,11/17/1986,Right-hand Bat,Slow Left-arm Orthodox,Australia,Player,Delhi Daredevils,Kolkata Knight Riders,2012,,26,,Blank,Blank,V Sehwag,G Gambhir,Nv Ojha,Bb Mccullum,1986-11-17
18193,,548312,305,Gj Maxwell,10/14/1988,Right-hand Bat,Right-arm Offbreak,Australia,Player,Delhi Daredevils,Kolkata Knight Riders,2012,,24,,Blank,Blank,V Sehwag,G Gambhir,Nv Ojha,Bb Mccullum,1988-10-14
18197,,548313,126,Mm Patel,7/12/1983,Right-hand Bat,Right-arm Medium-fast,India,Player,Mumbai Indians,Pune Warriors,2012,,29,,Blank,Blank,Harbhajan Singh,Sc Ganguly,Kd Karthik,Rv Uthappa,1983-07-12
18199,,548313,194,Sl Malinga,8/28/1983,Right-hand Bat,Right-arm Fast,Sri Lanka,Player,Mumbai Indians,Pune Warriors,2012,,29,,Blank,Blank,Harbhajan Singh,Sc Ganguly,Kd Karthik,Rv Uthappa,1983-08-28
18201,,548313,221,Ka Pollard,5/12/1987,Right-hand Bat,Right-arm Medium-fast,West Indies,Player,Mumbai Indians,Pune Warriors,2012,,25,,Blank,Blank,Harbhajan Singh,Sc Ganguly,Kd Karthik,Rv Uthappa,1987-05-12
18209,,548313,106,Ab Dinda,3/25/1984,Right-hand Bat,Right-arm Medium-fast,India,Player,Pune Warriors,Mumbai Indians,2012,,28,,Blank,Blank,Sc Ganguly,Harbhajan Singh,Rv Uthappa,Kd Karthik,1984-03-25
18211,,548313,267,Wd Parnell,7/30/1989,Left-hand Bat,Left-arm Medium-fast,South Africa,Player,Pune Warriors,Mumbai Indians,2012,,23,,Blank,Blank,Sc Ganguly,Harbhajan Singh,Rv Uthappa,Kd Karthik,1989-07-30
18213,,548313,299,B Kumar,2/5/1990,Right-hand Bat,Right-arm Medium,India,Player,Pune Warriors,Mumbai Indians,2012,,22,,Blank,Blank,Sc Ganguly,Harbhajan Singh,Rv Uthappa,Kd Karthik,1990-02-05
18214,,548313,306,Spd Smith,6/2/1989,Right-hand Bat,Legbreak Googly,India,Player,Pune Warriors,Mumbai Indians,2012,,23,,Blank,Blank,Sc Ganguly,Harbhajan Singh,Rv Uthappa,Kd Karthik,1989-06-02
18215,,548313,307,Mn Samuels,2/5/1981,Right-hand Bat,Right-arm Offbreak,West Indies,Player,Pune Warriors,Mumbai Indians,2012,,31,,Blank,Blank,Sc Ganguly,Harbhajan Singh,Rv Uthappa,Kd Karthik,1981-02-05
18218,,548314,48,Am Nayar,10/8/1983,Left-hand Bat,Right-arm Medium,India,Player,Kings Xi Punjab,Rajasthan Royals,2012,,29,,Blank,Blank,Ac Gilchrist,R Dravid,Ac Gilchrist,Sp Goswami,1983-10-08
18219,,548314,53,Ac Gilchrist,11/14/1971,Left-hand Bat,Right-arm Offbreak,Australia,Captainkeeper,Kings Xi Punjab,Rajasthan Royals,2012,,41,,Blank,Blank,Ac Gilchrist,R Dravid,Ac Gilchrist,Sp Goswami,1971-11-14
18221,,548314,100,Se Marsh,7/9/1983,Left-hand Bat,Slow Left-arm Orthodox,Australia,Player,Kings Xi Punjab,Rajasthan Royals,2012,,29,,Blank,Blank,Ac Gilchrist,R Dravid,Ac Gilchrist,Sp Goswami,1983-07-09
18222,,548314,167,Pc Valthaty,12/7/1983,Right-hand Bat,Right-arm Medium,India,Player,Kings Xi Punjab,Rajasthan Royals,2012,,29,,Blank,Blank,Ac Gilchrist,R Dravid,Ac Gilchrist,Sp Goswami,1983-12-07
18227,,548314,6,R Dravid,1/11/1973,Right-hand Bat,Right-arm Offbreak,India,Captain,Rajasthan Royals,Kings Xi Punjab,2012,,39,,Blank,Blank,R Dravid,Ac Gilchrist,Sp Goswami,Ac Gilchrist,1973-01-11
18234,,548314,204,Oa Shah,10/22/1978,Right-hand Bat,Right-arm Offbreak,England,Player,Rajasthan Royals,Kings Xi Punjab,2012,,34,,Blank,Blank,R Dravid,Ac Gilchrist,Sp Goswami,Ac Gilchrist,1978-10-22
18235,,548314,266,Al Menaria,10/29/1990,Left-hand Bat,Slow Left-arm Orthodox,India,Player,Rajasthan Royals,Kings Xi Punjab,2012,,22,,Blank,Blank,R Dravid,Ac Gilchrist,Sp Goswami,Ac Gilchrist,1990-10-29
18237,,548314,309,Kk Cooper,2/16/1989,Right-hand Bat,Right-arm Medium,West Indies,Player,Rajasthan Royals,Kings Xi Punjab,2012,,23,,Blank,Blank,R Dravid,Ac Gilchrist,Sp Goswami,Ac Gilchrist,1989-02-16
18238,,548315,8,V Kohli,11/5/1988,Right-hand Bat,Right-arm Medium,India,Player,Royal Challengers Bangalore,Delhi Daredevils,2012,,24,,Blank,Blank,Dl Vettori,V Sehwag,Ab De Villiers,Nv Ojha,1988-11-05
18240,,548315,79,Ss Tiwary,12/30/1989,Left-hand Bat,N/a,India,Player,Royal Challengers Bangalore,Delhi Daredevils,2012,,23,,Blank,Blank,Dl Vettori,V Sehwag,Ab De Villiers,Nv Ojha,1989-12-30
18241,,548315,81,R Vinay Kumar,2/12/1984,Right-hand Bat,Right-arm Medium,India,Player,Royal Challengers Bangalore,Delhi Daredevils,2012,,28,,Blank,Blank,Dl Vettori,V Sehwag,Ab De Villiers,Nv Ojha,1984-02-12
18244,,548315,175,Dl Vettori,1/27/1979,Left-hand Bat,Slow Left-arm Orthodox,New Zealand,Captain,Royal Challengers Bangalore,Delhi Daredevils,2012,,33,,Blank,Blank,Dl Vettori,V Sehwag,Ab De Villiers,Nv Ojha,1979-01-27
18245,,548315,198,Ab Mcdonald,6/5/1981,Right-hand Bat,Right-arm Fast-medium,Australia,Player,Royal Challengers Bangalore,Delhi Daredevils,2012,,31,,Blank,Blank,Dl Vettori,V Sehwag,Ab De Villiers,Nv Ojha,1981-06-05
18246,,548315,203,Ca Pujara,1/25/1988,Right-hand Bat,Legbreak,India,Player,Royal Challengers Bangalore,Delhi Daredevils,2012,,24,,Blank,Blank,Dl Vettori,V Sehwag,Ab De Villiers,Nv Ojha,1988-01-25
18248,,548315,311,Hv Patel,11/23/1990,Right-hand Bat,Right-arm Medium,India,Player,Royal Challengers Bangalore,Delhi Daredevils,2012,,22,,Blank,Blank,Dl Vettori,V Sehwag,Ab De Villiers,Nv Ojha,1990-11-23
18252,,548315,183,Nv Ojha,7/20/1983,Right-hand Bat,N/a,India,Keeper,Delhi Daredevils,Royal Challengers Bangalore,2012,,29,,Blank,Blank,V Sehwag,Dl Vettori,Nv Ojha,Ab De Villiers,1983-07-20
18253,,548315,190,M Morkel,10/6/1984,Left-hand Bat,Right-arm Fast,South Africa,Player,Delhi Daredevils,Royal Challengers Bangalore,2012,,28,,Blank,Blank,V Sehwag,Dl Vettori,Nv Ojha,Ab De Villiers,1984-10-06
18255,,548315,232,Ut Yadav,10/25/1987,Right-hand Bat,Right-arm Fast-medium,India,Player,Delhi Daredevils,Royal Challengers Bangalore,2012,,25,,Blank,Blank,V Sehwag,Dl Vettori,Nv Ojha,Ab De Villiers,1987-10-25
18258,,548315,305,Gj Maxwell,10/14/1988,Right-hand Bat,Right-arm Offbreak,Australia,Player,Delhi Daredevils,Royal Challengers Bangalore,2012,,24,,Blank,Blank,V Sehwag,Dl Vettori,Nv Ojha,Ab De Villiers,1988-10-14
18259,,548315,312,Daj Bracewell,9/28/1990,Right-hand Bat,Right-arm Fast-medium,New Zealand,Player,Delhi Daredevils,Royal Challengers Bangalore,2012,,22,,Blank,Blank,V Sehwag,Dl Vettori,Nv Ojha,Ab De Villiers,1990-09-28
18265,,548316,109,Ja Morkel,6/10/1981,Left-hand Bat,Right-arm Medium-fast,South Africa,Player,Chennai Super Kings,Deccan Chargers,2012,,31,,Blank,Blank,Ms Dhoni,Cl White,Ms Dhoni,Pa Patel,1981-06-10
18271,,548316,10,Cl White,8/18/1983,Right-hand Bat,Legbreak Googly,Australia,Captain,Deccan Chargers,Chennai Super Kings,2012,,29,,Blank,Blank,Cl White,Ms Dhoni,Pa Patel,Ms Dhoni,1983-08-18
18272,,548316,17,Pa Patel,3/9/1985,Left-hand Bat,N/a,India,Keeper,Deccan Chargers,Chennai Super Kings,2012,,27,,Blank,Blank,Cl White,Ms Dhoni,Pa Patel,Ms Dhoni,1985-03-09
18274,,548316,93,B Chipli,1/27/1983,Right-hand Bat,Right-arm Medium,India,Player,Deccan Chargers,Chennai Super Kings,2012,,29,,Blank,Blank,Cl White,Ms Dhoni,Pa Patel,Ms Dhoni,1983-01-27
18278,,548316,258,Dt Christian,5/4/1983,Right-hand Bat,Right-arm Fast-medium,Australia,Player,Deccan Chargers,Chennai Super Kings,2012,,29,,Blank,Blank,Cl White,Ms Dhoni,Pa Patel,Ms Dhoni,1983-05-04
18282,,548317,2,Bb Mccullum,9/27/1981,Right-hand Bat,Right-arm Medium,New Zealand,Keeper,Kolkata Knight Riders,Rajasthan Royals,2012,,31,,Blank,Blank,G Gambhir,R Dravid,Bb Mccullum,Sp Goswami,1981-09-27
18283,,548317,9,Jh Kallis,10/16/1975,Right-hand Bat,Right-arm Fast-medium,South Africa,Player,Kolkata Knight Riders,Rajasthan Royals,2012,,37,,Blank,Blank,G Gambhir,R Dravid,Bb Mccullum,Sp Goswami,1975-10-16
18285,,548317,40,G Gambhir,10/14/1981,Left-hand Bat,Legbreak,India,Captain,Kolkata Knight Riders,Rajasthan Royals,2012,,31,,Blank,Blank,G Gambhir,R Dravid,Bb Mccullum,Sp Goswami,1981-10-14
18286,,548317,63,Lr Shukla,5/6/1981,Right-hand Bat,Right-arm Medium,India,Player,Kolkata Knight Riders,Rajasthan Royals,2012,,31,,Blank,Blank,G Gambhir,R Dravid,Bb Mccullum,Sp Goswami,1981-05-06
18289,,548317,89,R Bhatia,10/22/1979,Right-hand Bat,Right-arm Medium-fast,India,Player,Kolkata Knight Riders,Rajasthan Royals,2012,,33,,Blank,Blank,G Gambhir,R Dravid,Bb Mccullum,Sp Goswami,1979-10-22
18293,,548317,6,R Dravid,1/11/1973,Right-hand Bat,Right-arm Offbreak,India,Captain,Rajasthan Royals,Kolkata Knight Riders,2012,,39,,Blank,Blank,R Dravid,G Gambhir,Sp Goswami,Bb Mccullum,1973-01-11
18296,,548317,104,Bj Hodge,12/29/1974,Right-hand Bat,Right-arm Offbreak,Australia,Player,Rajasthan Royals,Kolkata Knight Riders,2012,,38,,Blank,Blank,R Dravid,G Gambhir,Sp Goswami,Bb Mccullum,1974-12-29
18301,,548317,266,Al Menaria,10/29/1990,Left-hand Bat,Slow Left-arm Orthodox,India,Player,Rajasthan Royals,Kolkata Knight Riders,2012,,22,,Blank,Blank,R Dravid,G Gambhir,Sp Goswami,Bb Mccullum,1990-10-29
18303,,548317,309,Kk Cooper,2/16/1989,Right-hand Bat,Right-arm Medium,West Indies,Player,Rajasthan Royals,Kolkata Knight Riders,2012,,23,,Blank,Blank,R Dravid,G Gambhir,Sp Goswami,Bb Mccullum,1989-02-16
18304,,548318,4,Dj Hussey,7/15/1977,Right-hand Bat,Right-arm Offbreak,Australia,Player,Kings Xi Punjab,Pune Warriors,2012,,35,,Blank,Blank,Ac Gilchrist,Sc Ganguly,Ac Gilchrist,Rv Uthappa,1977-07-15
18307,,548318,53,Ac Gilchrist,11/14/1971,Left-hand Bat,Right-arm Offbreak,Australia,Captainkeeper,Kings Xi Punjab,Pune Warriors,2012,,41,,Blank,Blank,Ac Gilchrist,Sc Ganguly,Ac Gilchrist,Rv Uthappa,1971-11-14
18311,,548318,228,Bipul Sharma,9/28/1983,Left-hand Bat,Slow Left-arm Orthodox,India,Player,Kings Xi Punjab,Pune Warriors,2012,,29,,Blank,Blank,Ac Gilchrist,Sc Ganguly,Ac Gilchrist,Rv Uthappa,1983-09-28
18313,,548318,256,Harmeet Singh,9/7/1992,Left-hand Bat,Slow Left-arm Orthodox,India,Player,Kings Xi Punjab,Pune Warriors,2012,,20,,Blank,Blank,Ac Gilchrist,Sc Ganguly,Ac Gilchrist,Rv Uthappa,1992-09-07
18315,,548318,1,Sc Ganguly,7/8/1972,Left-hand Bat,Right-arm Medium,India,Captain,Pune Warriors,Kings Xi Punjab,2012,,40,,Blank,Blank,Sc Ganguly,Ac Gilchrist,Rv Uthappa,Ac Gilchrist,1972-07-08
18317,,548318,73,A Nehra,4/29/1979,Right-hand Bat,Left-arm Medium-fast,India,Player,Pune Warriors,Kings Xi Punjab,2012,,33,,Blank,Blank,Sc Ganguly,Ac Gilchrist,Rv Uthappa,Ac Gilchrist,1979-04-29
18319,,548318,96,Mk Pandey,9/10/1989,Right-hand Bat,Right-arm Medium,India,Player,Pune Warriors,Kings Xi Punjab,2012,,23,,Blank,Blank,Sc Ganguly,Ac Gilchrist,Rv Uthappa,Ac Gilchrist,1989-09-10
18323,,548318,295,Cj Ferguson,11/21/1984,Right-hand Bat,Right-arm Medium,Australia,Player,Pune Warriors,Kings Xi Punjab,2012,,28,,Blank,Blank,Sc Ganguly,Ac Gilchrist,Rv Uthappa,Ac Gilchrist,1984-11-21
18324,,548318,306,Spd Smith,6/2/1989,Right-hand Bat,Legbreak Googly,India,Player,Pune Warriors,Kings Xi Punjab,2012,,23,,Blank,Blank,Sc Ganguly,Ac Gilchrist,Rv Uthappa,Ac Gilchrist,1989-06-02
18326,,548319,50,Harbhajan Singh,7/3/1980,Right-hand Bat,Right-arm Offbreak,India,Captain,Mumbai Indians,Deccan Chargers,2012,,32,,Blank,Blank,Harbhajan Singh,Kc Sangakkara,Kd Karthik,Pa Patel,1980-07-03
18327,,548319,57,Rg Sharma,4/30/1987,Right-hand Bat,Right-arm Offbreak,India,Player,Mumbai Indians,Deccan Chargers,2012,,25,,Blank,Blank,Harbhajan Singh,Kc Sangakkara,Kd Karthik,Pa Patel,1987-04-30
18328,,548319,88,Kd Karthik,6/1/1985,Right-hand Bat,N/a,India,Keeper,Mumbai Indians,Deccan Chargers,2012,,27,,Blank,Blank,Harbhajan Singh,Kc Sangakkara,Kd Karthik,Pa Patel,1985-06-01
18330,,548319,131,Pp Ojha,9/5/1986,Left-hand Bat,Slow Left-arm Orthodox,India,Player,Mumbai Indians,Deccan Chargers,2012,,26,,Blank,Blank,Harbhajan Singh,Kc Sangakkara,Kd Karthik,Pa Patel,1986-09-05
18331,,548319,178,Tl Suman,12/15/1983,Right-hand Bat,Right-arm Offbreak,India,Player,Mumbai Indians,Deccan Chargers,2012,,29,,Blank,Blank,Harbhajan Singh,Kc Sangakkara,Kd Karthik,Pa Patel,1983-12-15
18332,,548319,194,Sl Malinga,8/28/1983,Right-hand Bat,Right-arm Fast,Sri Lanka,Player,Mumbai Indians,Deccan Chargers,2012,,29,,Blank,Blank,Harbhajan Singh,Kc Sangakkara,Kd Karthik,Pa Patel,1983-08-28
18334,,548319,221,Ka Pollard,5/12/1987,Right-hand Bat,Right-arm Medium-fast,West Indies,Player,Mumbai Indians,Deccan Chargers,2012,,25,,Blank,Blank,Harbhajan Singh,Kc Sangakkara,Kd Karthik,Pa Patel,1987-05-12
18342,,548319,94,Dw Steyn,6/27/1983,Right-hand Bat,Right-arm Fast,South Africa,Player,Deccan Chargers,Mumbai Indians,2012,,29,,Blank,Blank,Kc Sangakkara,Harbhajan Singh,Pa Patel,Kd Karthik,1983-06-27
18343,,548319,112,Db Ravi Teja,9/5/1987,Right-hand Bat,Legbreak Googly,India,Player,Deccan Chargers,Mumbai Indians,2012,,25,,Blank,Blank,Kc Sangakkara,Harbhajan Singh,Pa Patel,Kd Karthik,1987-09-05
18346,,548319,314,Ankit Sharma,4/20/1991,Left-hand Bat,Slow Left-arm Orthodox,India,Player,Deccan Chargers,Mumbai Indians,2012,,21,,Blank,Blank,Kc Sangakkara,Harbhajan Singh,Pa Patel,Kd Karthik,1991-04-20
18350,,548320,79,Ss Tiwary,12/30/1989,Left-hand Bat,N/a,India,Player,Royal Challengers Bangalore,Kolkata Knight Riders,2012,,23,,Blank,Blank,Dl Vettori,G Gambhir,Ab De Villiers,Ms Bisla,1989-12-30
18358,,548320,311,Hv Patel,11/23/1990,Right-hand Bat,Right-arm Medium,India,Player,Royal Challengers Bangalore,Kolkata Knight Riders,2012,,22,,Blank,Blank,Dl Vettori,G Gambhir,Ab De Villiers,Ms Bisla,1990-11-23
18361,,548320,40,G Gambhir,10/14/1981,Left-hand Bat,Legbreak,India,Captain,Kolkata Knight Riders,Royal Challengers Bangalore,2012,,31,,Blank,Blank,G Gambhir,Dl Vettori,Ms Bisla,Ab De Villiers,1981-10-14
18365,,548320,89,R Bhatia,10/22/1979,Right-hand Bat,Right-arm Medium-fast,India,Player,Kolkata Knight Riders,Royal Challengers Bangalore,2012,,33,,Blank,Blank,G Gambhir,Dl Vettori,Ms Bisla,Ab De Villiers,1979-10-22
18366,,548320,151,L Balaji,9/27/1981,Right-hand Bat,Right-arm Medium-fast,India,Player,Kolkata Knight Riders,Royal Challengers Bangalore,2012,,31,,Blank,Blank,G Gambhir,Dl Vettori,Ms Bisla,Ab De Villiers,1981-09-27
18369,,548320,284,Rn Ten Doeschate,6/30/1980,Right-hand Bat,Right-arm Medium-fast,Netherlands,Player,Kolkata Knight Riders,Royal Challengers Bangalore,2012,,32,,Blank,Blank,G Gambhir,Dl Vettori,Ms Bisla,Ab De Villiers,1980-06-30
18371,,548321,21,Sk Raina,11/27/1986,Left-hand Bat,Right-arm Offbreak,India,Player,Chennai Super Kings,Delhi Daredevils,2012,,26,,Blank,Blank,Ms Dhoni,V Sehwag,Ms Dhoni,Nv Ojha,1986-11-27
18372,,548321,23,S Badrinath,8/30/1980,Right-hand Bat,Right-arm Offbreak,India,Player,Chennai Super Kings,Delhi Daredevils,2012,,32,,Blank,Blank,Ms Dhoni,V Sehwag,Ms Dhoni,Nv Ojha,1980-08-30
18373,,548321,35,Ra Jadeja,12/6/1988,Left-hand Bat,Slow Left-arm Orthodox,India,Player,Chennai Super Kings,Delhi Daredevils,2012,,24,,Blank,Blank,Ms Dhoni,V Sehwag,Ms Dhoni,Nv Ojha,1988-12-06
18375,,548321,109,Ja Morkel,6/10/1981,Left-hand Bat,Right-arm Medium-fast,South Africa,Player,Chennai Super Kings,Delhi Daredevils,2012,,31,,Blank,Blank,Ms Dhoni,V Sehwag,Ms Dhoni,Nv Ojha,1981-06-10
18376,,548321,185,M Vijay,4/1/1984,Right-hand Bat,Right-arm Offbreak,India,Player,Chennai Super Kings,Delhi Daredevils,2012,,28,,Blank,Blank,Ms Dhoni,V Sehwag,Ms Dhoni,Nv Ojha,1984-04-01
18378,,548321,201,R Ashwin,9/17/1986,Right-hand Bat,Right-arm Offbreak,India,Player,Chennai Super Kings,Delhi Daredevils,2012,,26,,Blank,Blank,Ms Dhoni,V Sehwag,Ms Dhoni,Nv Ojha,1986-09-17
18380,,548321,303,F Du Plessis,7/13/1984,Right-hand Bat,Legbreak,South Africa,Player,Chennai Super Kings,Delhi Daredevils,2012,,28,,Blank,Blank,Ms Dhoni,V Sehwag,Ms Dhoni,Nv Ojha,1984-07-13
18381,,548321,29,Ik Pathan,10/27/1984,Left-hand Bat,Left-arm Medium-fast,India,Player,Delhi Daredevils,Chennai Super Kings,2012,,28,,Blank,Blank,V Sehwag,Ms Dhoni,Nv Ojha,Ms Dhoni,1984-10-27
18382,,548321,41,V Sehwag,10/20/1978,Right-hand Bat,Right-arm Offbreak,India,Captain,Delhi Daredevils,Chennai Super Kings,2012,,34,,Blank,Blank,V Sehwag,Ms Dhoni,Nv Ojha,Ms Dhoni,1978-10-20
18388,,548321,190,M Morkel,10/6/1984,Left-hand Bat,Right-arm Fast,South Africa,Player,Delhi Daredevils,Chennai Super Kings,2012,,28,,Blank,Blank,V Sehwag,Ms Dhoni,Nv Ojha,Ms Dhoni,1984-10-06
18390,,548321,232,Ut Yadav,10/25/1987,Right-hand Bat,Right-arm Fast-medium,India,Player,Delhi Daredevils,Chennai Super Kings,2012,,25,,Blank,Blank,V Sehwag,Ms Dhoni,Nv Ojha,Ms Dhoni,1987-10-25
18391,,548321,293,S Nadeem,8/12/1989,Right-hand Bat,Slow Left-arm Orthodox,India,Player,Delhi Daredevils,Chennai Super Kings,2012,,23,,Blank,Blank,V Sehwag,Ms Dhoni,Nv Ojha,Ms Dhoni,1989-08-12
18392,,548322,50,Harbhajan Singh,7/3/1980,Right-hand Bat,Right-arm Offbreak,India,Captain,Mumbai Indians,Rajasthan Royals,2012,,32,,Blank,Blank,Harbhajan Singh,R Dravid,Kd Karthik,Sp Goswami,1980-07-03
18394,,548322,88,Kd Karthik,6/1/1985,Right-hand Bat,N/a,India,Keeper,Mumbai Indians,Rajasthan Royals,2012,,27,,Blank,Blank,Harbhajan Singh,R Dravid,Kd Karthik,Sp Goswami,1985-06-01
18399,,548322,208,At Rayudu,9/23/1985,Right-hand Bat,Right-arm Offbreak,India,Player,Mumbai Indians,Rajasthan Royals,2012,,27,,Blank,Blank,Harbhajan Singh,R Dravid,Kd Karthik,Sp Goswami,1985-09-23
18401,,548322,275,Jec Franklin,11/7/1980,Left-hand Bat,Left-arm Medium,New Zealand,Player,Mumbai Indians,Rajasthan Royals,2012,,32,,Blank,Blank,Harbhajan Singh,R Dravid,Kd Karthik,Sp Goswami,1980-11-07
18403,,548322,6,R Dravid,1/11/1973,Right-hand Bat,Right-arm Offbreak,India,Captain,Rajasthan Royals,Mumbai Indians,2012,,39,,Blank,Blank,R Dravid,Harbhajan Singh,Sp Goswami,Kd Karthik,1973-01-11
18405,,548322,85,Am Rahane,6/6/1988,Right-hand Bat,Right-arm Medium,India,Player,Rajasthan Royals,Mumbai Indians,2012,,24,,Blank,Blank,R Dravid,Harbhajan Singh,Sp Goswami,Kd Karthik,1988-06-06
18406,,548322,132,Sp Goswami,5/18/1989,Left-hand Bat,N/a,India,Keeper,Rajasthan Royals,Mumbai Indians,2012,,23,,Blank,Blank,R Dravid,Harbhajan Singh,Sp Goswami,Kd Karthik,1989-05-18
18407,,548322,192,J Botha,5/2/1982,Right-hand Bat,Right-arm Offbreak,South Africa,Player,Rajasthan Royals,Mumbai Indians,2012,,30,,Blank,Blank,R Dravid,Harbhajan Singh,Sp Goswami,Kd Karthik,1982-05-02
18409,,548322,204,Oa Shah,10/22/1978,Right-hand Bat,Right-arm Offbreak,England,Player,Rajasthan Royals,Mumbai Indians,2012,,34,,Blank,Blank,R Dravid,Harbhajan Singh,Sp Goswami,Kd Karthik,1978-10-22
18412,,548322,309,Kk Cooper,2/16/1989,Right-hand Bat,Right-arm Medium,West Indies,Player,Rajasthan Royals,Mumbai Indians,2012,,23,,Blank,Blank,R Dravid,Harbhajan Singh,Sp Goswami,Kd Karthik,1989-02-16
18417,,548323,81,R Vinay Kumar,2/12/1984,Right-hand Bat,Right-arm Medium,India,Player,Royal Challengers Bangalore,Chennai Super Kings,2012,,28,,Blank,Blank,Dl Vettori,Ms Dhoni,Ab De Villiers,Ms Dhoni,1984-02-12
18418,,548323,110,Ab De Villiers,2/17/1984,Right-hand Bat,Right-arm Medium,South Africa,Keeper,Royal Challengers Bangalore,Chennai Super Kings,2012,,28,,Blank,Blank,Dl Vettori,Ms Dhoni,Ab De Villiers,Ms Dhoni,1984-02-17
18422,,548323,203,Ca Pujara,1/25/1988,Right-hand Bat,Legbreak,India,Player,Royal Challengers Bangalore,Chennai Super Kings,2012,,24,,Blank,Blank,Dl Vettori,Ms Dhoni,Ab De Villiers,Ms Dhoni,1988-01-25
18423,,548323,260,Ma Agarwal,2/16/1991,Right-hand Bat,N/a,India,Player,Royal Challengers Bangalore,Chennai Super Kings,2012,,21,,Blank,Blank,Dl Vettori,Ms Dhoni,Ab De Villiers,Ms Dhoni,1991-02-16
18425,,548323,20,Ms Dhoni,7/7/1981,Right-hand Bat,Right-arm Medium,India,Captainkeeper,Chennai Super Kings,Royal Challengers Bangalore,2012,,31,,Blank,Blank,Ms Dhoni,Dl Vettori,Ms Dhoni,Ab De Villiers,1981-07-07
18428,,548323,35,Ra Jadeja,12/6/1988,Left-hand Bat,Slow Left-arm Orthodox,India,Player,Chennai Super Kings,Royal Challengers Bangalore,2012,,24,,Blank,Blank,Ms Dhoni,Dl Vettori,Ms Dhoni,Ab De Villiers,1988-12-06
18429,,548323,71,Dj Bravo,10/7/1983,Right-hand Bat,Right-arm Medium-fast,West Indies,Player,Chennai Super Kings,Royal Challengers Bangalore,2012,,29,,Blank,Blank,Ms Dhoni,Dl Vettori,Ms Dhoni,Ab De Villiers,1983-10-07
18430,,548323,109,Ja Morkel,6/10/1981,Left-hand Bat,Right-arm Medium-fast,South Africa,Player,Chennai Super Kings,Royal Challengers Bangalore,2012,,31,,Blank,Blank,Ms Dhoni,Dl Vettori,Ms Dhoni,Ab De Villiers,1981-06-10
18431,,548323,185,M Vijay,4/1/1984,Right-hand Bat,Right-arm Offbreak,India,Player,Chennai Super Kings,Royal Challengers Bangalore,2012,,28,,Blank,Blank,Ms Dhoni,Dl Vettori,Ms Dhoni,Ab De Villiers,1984-04-01
18433,,548323,201,R Ashwin,9/17/1986,Right-hand Bat,Right-arm Offbreak,India,Player,Chennai Super Kings,Royal Challengers Bangalore,2012,,26,,Blank,Blank,Ms Dhoni,Dl Vettori,Ms Dhoni,Ab De Villiers,1986-09-17
18438,,548324,53,Ac Gilchrist,11/14/1971,Left-hand Bat,Right-arm Offbreak,Australia,Captainkeeper,Kings Xi Punjab,Pune Warriors,2012,,41,,Blank,Blank,Ac Gilchrist,Sc Ganguly,Ac Gilchrist,Rv Uthappa,1971-11-14
18441,,548324,137,Ad Mascarenhas,10/30/1977,Right-hand Bat,Right-arm Fast-medium,England,Player,Kings Xi Punjab,Pune Warriors,2012,,35,,Blank,Blank,Ac Gilchrist,Sc Ganguly,Ac Gilchrist,Rv Uthappa,1977-10-30
18445,,548324,256,Harmeet Singh,9/7/1992,Left-hand Bat,Slow Left-arm Orthodox,India,Player,Kings Xi Punjab,Pune Warriors,2012,,20,,Blank,Blank,Ac Gilchrist,Sc Ganguly,Ac Gilchrist,Rv Uthappa,1992-09-07
18446,,548324,333,P Awana,7/19/1986,Right-hand Bat,Right-arm Medium,India,Player,Kings Xi Punjab,Pune Warriors,2012,,26,,Blank,Blank,Ac Gilchrist,Sc Ganguly,Ac Gilchrist,Rv Uthappa,1986-07-19
18448,,548324,46,Rv Uthappa,11/11/1985,Right-hand Bat,Right-arm Medium,India,Keeper,Pune Warriors,Kings Xi Punjab,2012,,27,,Blank,Blank,Sc Ganguly,Ac Gilchrist,Rv Uthappa,Ac Gilchrist,1985-11-11
18455,,548324,235,R Sharma,4/30/1987,Right-hand Bat,Right-arm Offbreak,India,Player,Pune Warriors,Kings Xi Punjab,2012,,25,,Blank,Blank,Sc Ganguly,Ac Gilchrist,Rv Uthappa,Ac Gilchrist,1987-04-30
18461,,548325,87,Mk Tiwary,11/14/1985,Right-hand Bat,Legbreak Googly,India,Player,Kolkata Knight Riders,Rajasthan Royals,2012,,27,,Blank,Blank,G Gambhir,R Dravid,Ms Bisla,Sp Goswami,1985-11-14
18462,,548325,89,R Bhatia,10/22/1979,Right-hand Bat,Right-arm Medium-fast,India,Player,Kolkata Knight Riders,Rajasthan Royals,2012,,33,,Blank,Blank,G Gambhir,R Dravid,Ms Bisla,Sp Goswami,1979-10-22
18464,,548325,151,L Balaji,9/27/1981,Right-hand Bat,Right-arm Medium-fast,India,Player,Kolkata Knight Riders,Rajasthan Royals,2012,,31,,Blank,Blank,G Gambhir,R Dravid,Ms Bisla,Sp Goswami,1981-09-27
18466,,548325,276,Shakib Al Hasan,3/24/1987,Left-hand Bat,Slow Left-arm Orthodox,Bangladesh,Player,Kolkata Knight Riders,Rajasthan Royals,2012,,25,,Blank,Blank,G Gambhir,R Dravid,Ms Bisla,Sp Goswami,1987-03-24
18467,,548325,284,Rn Ten Doeschate,6/30/1980,Right-hand Bat,Right-arm Medium-fast,Netherlands,Player,Kolkata Knight Riders,Rajasthan Royals,2012,,32,,Blank,Blank,G Gambhir,R Dravid,Ms Bisla,Sp Goswami,1980-06-30
18469,,548325,6,R Dravid,1/11/1973,Right-hand Bat,Right-arm Offbreak,India,Captain,Rajasthan Royals,Kolkata Knight Riders,2012,,39,,Blank,Blank,R Dravid,G Gambhir,Sp Goswami,Ms Bisla,1973-01-11
18471,,548325,85,Am Rahane,6/6/1988,Right-hand Bat,Right-arm Medium,India,Player,Rajasthan Royals,Kolkata Knight Riders,2012,,24,,Blank,Blank,R Dravid,G Gambhir,Sp Goswami,Ms Bisla,1988-06-06
18472,,548325,104,Bj Hodge,12/29/1974,Right-hand Bat,Right-arm Offbreak,Australia,Player,Rajasthan Royals,Kolkata Knight Riders,2012,,38,,Blank,Blank,R Dravid,G Gambhir,Sp Goswami,Ms Bisla,1974-12-29
18474,,548325,192,J Botha,5/2/1982,Right-hand Bat,Right-arm Offbreak,South Africa,Player,Rajasthan Royals,Kolkata Knight Riders,2012,,30,,Blank,Blank,R Dravid,G Gambhir,Sp Goswami,Ms Bisla,1982-05-02
18478,,548325,297,Aa Chavan,10/28/1985,Left-hand Bat,Slow Left-arm Orthodox,India,Player,Rajasthan Royals,Kolkata Knight Riders,2012,,27,,Blank,Blank,R Dravid,G Gambhir,Sp Goswami,Ms Bisla,1985-10-28
18479,,548325,316,Gb Hogg,2/6/1971,Left-hand Bat,Slow Left-arm Chinaman,Australia,Player,Rajasthan Royals,Kolkata Knight Riders,2012,,41,,Blank,Blank,R Dravid,G Gambhir,Sp Goswami,Ms Bisla,1971-02-06
18481,,548326,41,V Sehwag,10/20/1978,Right-hand Bat,Right-arm Offbreak,India,Captain,Delhi Daredevils,Deccan Chargers,2012,,34,,Blank,Blank,V Sehwag,Kc Sangakkara,Nv Ojha,Pa Patel,1978-10-20
18483,,548326,64,Dpmd Jayawardene,5/27/1977,Right-hand Bat,Right-arm Medium,Sri Lanka,Player,Delhi Daredevils,Deccan Chargers,2012,,35,,Blank,Blank,V Sehwag,Kc Sangakkara,Nv Ojha,Pa Patel,1977-05-27
18486,,548326,183,Nv Ojha,7/20/1983,Right-hand Bat,N/a,India,Keeper,Delhi Daredevils,Deccan Chargers,2012,,29,,Blank,Blank,V Sehwag,Kc Sangakkara,Nv Ojha,Pa Patel,1983-07-20
18487,,548326,190,M Morkel,10/6/1984,Left-hand Bat,Right-arm Fast,South Africa,Player,Delhi Daredevils,Deccan Chargers,2012,,28,,Blank,Blank,V Sehwag,Kc Sangakkara,Nv Ojha,Pa Patel,1984-10-06
18490,,548326,293,S Nadeem,8/12/1989,Right-hand Bat,Slow Left-arm Orthodox,India,Player,Delhi Daredevils,Deccan Chargers,2012,,23,,Blank,Blank,V Sehwag,Kc Sangakkara,Nv Ojha,Pa Patel,1989-08-12
18494,,548326,93,B Chipli,1/27/1983,Right-hand Bat,Right-arm Medium,India,Player,Deccan Chargers,Delhi Daredevils,2012,,29,,Blank,Blank,Kc Sangakkara,V Sehwag,Pa Patel,Nv Ojha,1983-01-27
18496,,548326,136,A Mishra,11/24/1982,Right-hand Bat,Legbreak,India,Player,Deccan Chargers,Delhi Daredevils,2012,,30,,Blank,Blank,Kc Sangakkara,V Sehwag,Pa Patel,Nv Ojha,1982-11-24
18497,,548326,154,Jp Duminy,4/14/1984,Left-hand Bat,Right-arm Offbreak,South Africa,Player,Deccan Chargers,Delhi Daredevils,2012,,28,,Blank,Blank,Kc Sangakkara,V Sehwag,Pa Patel,Nv Ojha,1984-04-14
18498,,548326,211,Aa Jhunjhunwala,12/1/1982,Right-hand Bat,Right-arm Offbreak,India,Player,Deccan Chargers,Delhi Daredevils,2012,,30,,Blank,Blank,Kc Sangakkara,V Sehwag,Pa Patel,Nv Ojha,1982-12-01
18499,,548326,258,Dt Christian,5/4/1983,Right-hand Bat,Right-arm Fast-medium,Australia,Player,Deccan Chargers,Delhi Daredevils,2012,,29,,Blank,Blank,Kc Sangakkara,V Sehwag,Pa Patel,Nv Ojha,1983-05-04
18500,,548326,314,Ankit Sharma,4/20/1991,Left-hand Bat,Slow Left-arm Orthodox,India,Player,Deccan Chargers,Delhi Daredevils,2012,,21,,Blank,Blank,Kc Sangakkara,V Sehwag,Pa Patel,Nv Ojha,1991-04-20
18502,,548327,20,Ms Dhoni,7/7/1981,Right-hand Bat,Right-arm Medium,India,Captainkeeper,Chennai Super Kings,Pune Warriors,2012,,31,,Blank,Blank,Ms Dhoni,Sc Ganguly,Ms Dhoni,Rv Uthappa,1981-07-07
18503,,548327,21,Sk Raina,11/27/1986,Left-hand Bat,Right-arm Offbreak,India,Player,Chennai Super Kings,Pune Warriors,2012,,26,,Blank,Blank,Ms Dhoni,Sc Ganguly,Ms Dhoni,Rv Uthappa,1986-11-27
18506,,548327,71,Dj Bravo,10/7/1983,Right-hand Bat,Right-arm Medium-fast,West Indies,Player,Chennai Super Kings,Pune Warriors,2012,,29,,Blank,Blank,Ms Dhoni,Sc Ganguly,Ms Dhoni,Rv Uthappa,1983-10-07
18508,,548327,109,Ja Morkel,6/10/1981,Left-hand Bat,Right-arm Medium-fast,South Africa,Player,Chennai Super Kings,Pune Warriors,2012,,31,,Blank,Blank,Ms Dhoni,Sc Ganguly,Ms Dhoni,Rv Uthappa,1981-06-10
18509,,548327,185,M Vijay,4/1/1984,Right-hand Bat,Right-arm Offbreak,India,Player,Chennai Super Kings,Pune Warriors,2012,,28,,Blank,Blank,Ms Dhoni,Sc Ganguly,Ms Dhoni,Rv Uthappa,1984-04-01
18511,,548327,303,F Du Plessis,7/13/1984,Right-hand Bat,Legbreak,South Africa,Player,Chennai Super Kings,Pune Warriors,2012,,28,,Blank,Blank,Ms Dhoni,Sc Ganguly,Ms Dhoni,Rv Uthappa,1984-07-13
18512,,548327,324,Kmdn Kulasekara,7/22/1982,Right-hand Bat,Right-arm Fast-medium,Sri Lanka,Player,Chennai Super Kings,Pune Warriors,2012,,30,,Blank,Blank,Ms Dhoni,Sc Ganguly,Ms Dhoni,Rv Uthappa,1982-07-22
18514,,548327,46,Rv Uthappa,11/11/1985,Right-hand Bat,Right-arm Medium,India,Keeper,Pune Warriors,Chennai Super Kings,2012,,27,,Blank,Blank,Sc Ganguly,Ms Dhoni,Rv Uthappa,Ms Dhoni,1985-11-11
18518,,548327,157,Jd Ryder,8/6/1984,Left-hand Bat,Right-arm Medium,New Zealand,Player,Pune Warriors,Chennai Super Kings,2012,,28,,Blank,Blank,Sc Ganguly,Ms Dhoni,Rv Uthappa,Ms Dhoni,1984-08-06
18521,,548327,235,R Sharma,4/30/1987,Right-hand Bat,Right-arm Offbreak,India,Player,Pune Warriors,Chennai Super Kings,2012,,25,,Blank,Blank,Sc Ganguly,Ms Dhoni,Rv Uthappa,Ms Dhoni,1987-04-30
18522,,548327,306,Spd Smith,6/2/1989,Right-hand Bat,Legbreak Googly,India,Player,Pune Warriors,Chennai Super Kings,2012,,23,,Blank,Blank,Sc Ganguly,Ms Dhoni,Rv Uthappa,Ms Dhoni,1989-06-02
18529,,548328,137,Ad Mascarenhas,10/30/1977,Right-hand Bat,Right-arm Fast-medium,England,Player,Kings Xi Punjab,Kolkata Knight Riders,2012,,35,,Blank,Blank,Ac Gilchrist,G Gambhir,Ac Gilchrist,Ms Bisla,1977-10-30
18539,,548328,89,R Bhatia,10/22/1979,Right-hand Bat,Right-arm Medium-fast,India,Player,Kolkata Knight Riders,Kings Xi Punjab,2012,,33,,Blank,Blank,G Gambhir,Ac Gilchrist,Ms Bisla,Ac Gilchrist,1979-10-22
18540,,548328,95,Db Das,9/22/1986,Right-hand Bat,Legbreak Googly,India,Player,Kolkata Knight Riders,Kings Xi Punjab,2012,,26,,Blank,Blank,G Gambhir,Ac Gilchrist,Ms Bisla,Ac Gilchrist,1986-09-22
18541,,548328,214,Ms Bisla,12/27/1984,Right-hand Bat,N/a,India,Keeper,Kolkata Knight Riders,Kings Xi Punjab,2012,,28,,Blank,Blank,G Gambhir,Ac Gilchrist,Ms Bisla,Ac Gilchrist,1984-12-27
18544,,548328,315,Sp Narine,5/26/1988,Left-hand Bat,Right-arm Offbreak,West Indies,Player,Kolkata Knight Riders,Kings Xi Punjab,2012,,24,,Blank,Blank,G Gambhir,Ac Gilchrist,Ms Bisla,Ac Gilchrist,1988-05-26
18547,,548329,15,Z Khan,10/7/1978,Right-hand Bat,Left-arm Fast-medium,India,Player,Royal Challengers Bangalore,Rajasthan Royals,2012,,34,,Blank,Blank,Dl Vettori,R Dravid,Ab De Villiers,Sp Goswami,1978-10-07
18548,,548329,33,M Kaif,12/1/1980,Right-hand Bat,Right-arm Offbreak,India,Player,Royal Challengers Bangalore,Rajasthan Royals,2012,,32,,Blank,Blank,Dl Vettori,R Dravid,Ab De Villiers,Sp Goswami,1980-12-01
18551,,548329,110,Ab De Villiers,2/17/1984,Right-hand Bat,Right-arm Medium,South Africa,Keeper,Royal Challengers Bangalore,Rajasthan Royals,2012,,28,,Blank,Blank,Dl Vettori,R Dravid,Ab De Villiers,Sp Goswami,1984-02-17
18553,,548329,162,Ch Gayle,9/21/1979,Left-hand Bat,Right-arm Offbreak,West Indies,Player,Royal Challengers Bangalore,Rajasthan Royals,2012,,33,,Blank,Blank,Dl Vettori,R Dravid,Ab De Villiers,Sp Goswami,1979-09-21
18554,,548329,175,Dl Vettori,1/27/1979,Left-hand Bat,Slow Left-arm Orthodox,New Zealand,Captain,Royal Challengers Bangalore,Rajasthan Royals,2012,,33,,Blank,Blank,Dl Vettori,R Dravid,Ab De Villiers,Sp Goswami,1979-01-27
18560,,548329,85,Am Rahane,6/6/1988,Right-hand Bat,Right-arm Medium,India,Player,Rajasthan Royals,Royal Challengers Bangalore,2012,,24,,Blank,Blank,R Dravid,Dl Vettori,Sp Goswami,Ab De Villiers,1988-06-06
18563,,548329,192,J Botha,5/2/1982,Right-hand Bat,Right-arm Offbreak,South Africa,Player,Rajasthan Royals,Royal Challengers Bangalore,2012,,30,,Blank,Blank,R Dravid,Dl Vettori,Sp Goswami,Ab De Villiers,1982-05-02
18564,,548329,196,A Singh,6/21/1981,Right-hand Bat,Right-arm Medium-fast,India,Player,Rajasthan Royals,Royal Challengers Bangalore,2012,,31,,Blank,Blank,R Dravid,Dl Vettori,Sp Goswami,Ab De Villiers,1981-06-21
18565,,548329,204,Oa Shah,10/22/1978,Right-hand Bat,Right-arm Offbreak,England,Player,Rajasthan Royals,Royal Challengers Bangalore,2012,,34,,Blank,Blank,R Dravid,Dl Vettori,Sp Goswami,Ab De Villiers,1978-10-22
18567,,548329,316,Gb Hogg,2/6/1971,Left-hand Bat,Slow Left-arm Chinaman,Australia,Player,Rajasthan Royals,Royal Challengers Bangalore,2012,,41,,Blank,Blank,R Dravid,Dl Vettori,Sp Goswami,Ab De Villiers,1971-02-06
18568,,548330,50,Harbhajan Singh,7/3/1980,Right-hand Bat,Right-arm Offbreak,India,Captain,Mumbai Indians,Delhi Daredevils,2012,,32,,Blank,Blank,Harbhajan Singh,V Sehwag,Kd Karthik,Nv Ojha,1980-07-03
18571,,548330,88,Kd Karthik,6/1/1985,Right-hand Bat,N/a,India,Keeper,Mumbai Indians,Delhi Daredevils,2012,,27,,Blank,Blank,Harbhajan Singh,V Sehwag,Kd Karthik,Nv Ojha,1985-06-01
18572,,548330,126,Mm Patel,7/12/1983,Right-hand Bat,Right-arm Medium-fast,India,Player,Mumbai Indians,Delhi Daredevils,2012,,29,,Blank,Blank,Harbhajan Singh,V Sehwag,Kd Karthik,Nv Ojha,1983-07-12
18575,,548330,221,Ka Pollard,5/12/1987,Right-hand Bat,Right-arm Medium-fast,West Indies,Player,Mumbai Indians,Delhi Daredevils,2012,,25,,Blank,Blank,Harbhajan Singh,V Sehwag,Kd Karthik,Nv Ojha,1987-05-12
18576,,548330,263,Dj Jacobs,11/4/1982,Right-hand Bat,Right-arm Medium,South Africa,Player,Mumbai Indians,Delhi Daredevils,2012,,30,,Blank,Blank,Harbhajan Singh,V Sehwag,Kd Karthik,Nv Ojha,1982-11-04
18582,,548330,64,Dpmd Jayawardene,5/27/1977,Right-hand Bat,Right-arm Medium,Sri Lanka,Player,Delhi Daredevils,Mumbai Indians,2012,,35,,Blank,Blank,V Sehwag,Harbhajan Singh,Nv Ojha,Kd Karthik,1977-05-27
18583,,548330,82,Ab Agarkar,12/4/1977,Right-hand Bat,Right-arm Fast,India,Player,Delhi Daredevils,Mumbai Indians,2012,,35,,Blank,Blank,V Sehwag,Harbhajan Singh,Nv Ojha,Kd Karthik,1977-12-04
18585,,548330,183,Nv Ojha,7/20/1983,Right-hand Bat,N/a,India,Keeper,Delhi Daredevils,Mumbai Indians,2012,,29,,Blank,Blank,V Sehwag,Harbhajan Singh,Nv Ojha,Kd Karthik,1983-07-20
18588,,548330,232,Ut Yadav,10/25/1987,Right-hand Bat,Right-arm Fast-medium,India,Player,Delhi Daredevils,Mumbai Indians,2012,,25,,Blank,Blank,V Sehwag,Harbhajan Singh,Nv Ojha,Kd Karthik,1987-10-25
18590,,548331,6,R Dravid,1/11/1973,Right-hand Bat,Right-arm Offbreak,India,Captain,Rajasthan Royals,Deccan Chargers,2012,,39,,Blank,Blank,R Dravid,Kc Sangakkara,Dh Yagnik,Kc Sangakkara,1973-01-11
18593,,548331,85,Am Rahane,6/6/1988,Right-hand Bat,Right-arm Medium,India,Player,Rajasthan Royals,Deccan Chargers,2012,,24,,Blank,Blank,R Dravid,Kc Sangakkara,Dh Yagnik,Kc Sangakkara,1988-06-06
18594,,548331,104,Bj Hodge,12/29/1974,Right-hand Bat,Right-arm Offbreak,Australia,Player,Rajasthan Royals,Deccan Chargers,2012,,38,,Blank,Blank,R Dravid,Kc Sangakkara,Dh Yagnik,Kc Sangakkara,1974-12-29
18595,,548331,192,J Botha,5/2/1982,Right-hand Bat,Right-arm Offbreak,South Africa,Player,Rajasthan Royals,Deccan Chargers,2012,,30,,Blank,Blank,R Dravid,Kc Sangakkara,Dh Yagnik,Kc Sangakkara,1982-05-02
18598,,548331,266,Al Menaria,10/29/1990,Left-hand Bat,Slow Left-arm Orthodox,India,Player,Rajasthan Royals,Deccan Chargers,2012,,22,,Blank,Blank,R Dravid,Kc Sangakkara,Dh Yagnik,Kc Sangakkara,1990-10-29
18599,,548331,277,Dh Yagnik,6/22/1983,Left-hand Bat,N/a,India,Keeper,Rajasthan Royals,Deccan Chargers,2012,,29,,Blank,Blank,R Dravid,Kc Sangakkara,Dh Yagnik,Kc Sangakkara,1983-06-22
18605,,548331,136,A Mishra,11/24/1982,Right-hand Bat,Legbreak,India,Player,Deccan Chargers,Rajasthan Royals,2012,,30,,Blank,Blank,Kc Sangakkara,R Dravid,Kc Sangakkara,Dh Yagnik,1982-11-24
18606,,548331,154,Jp Duminy,4/14/1984,Left-hand Bat,Right-arm Offbreak,South Africa,Player,Deccan Chargers,Rajasthan Royals,2012,,28,,Blank,Blank,Kc Sangakkara,R Dravid,Kc Sangakkara,Dh Yagnik,1984-04-14
18608,,548331,258,Dt Christian,5/4/1983,Right-hand Bat,Right-arm Fast-medium,Australia,Player,Deccan Chargers,Rajasthan Royals,2012,,29,,Blank,Blank,Kc Sangakkara,R Dravid,Kc Sangakkara,Dh Yagnik,1983-05-04
18609,,548331,314,Ankit Sharma,4/20/1991,Left-hand Bat,Slow Left-arm Orthodox,India,Player,Deccan Chargers,Rajasthan Royals,2012,,21,,Blank,Blank,Kc Sangakkara,R Dravid,Kc Sangakkara,Dh Yagnik,1991-04-20
18612,,548332,8,V Kohli,11/5/1988,Right-hand Bat,Right-arm Medium,India,Player,Royal Challengers Bangalore,Pune Warriors,2012,,24,,Blank,Blank,Dl Vettori,Sc Ganguly,Ab De Villiers,Rv Uthappa,1988-11-05
18613,,548332,15,Z Khan,10/7/1978,Right-hand Bat,Left-arm Fast-medium,India,Player,Royal Challengers Bangalore,Pune Warriors,2012,,34,,Blank,Blank,Dl Vettori,Sc Ganguly,Ab De Villiers,Rv Uthappa,1978-10-07
18614,,548332,79,Ss Tiwary,12/30/1989,Left-hand Bat,N/a,India,Player,Royal Challengers Bangalore,Pune Warriors,2012,,23,,Blank,Blank,Dl Vettori,Sc Ganguly,Ab De Villiers,Rv Uthappa,1989-12-30
18616,,548332,110,Ab De Villiers,2/17/1984,Right-hand Bat,Right-arm Medium,South Africa,Keeper,Royal Challengers Bangalore,Pune Warriors,2012,,28,,Blank,Blank,Dl Vettori,Sc Ganguly,Ab De Villiers,Rv Uthappa,1984-02-17
18617,,548332,135,Tm Dilshan,10/14/1976,Right-hand Bat,Right-arm Offbreak,Sri Lanka,Player,Royal Challengers Bangalore,Pune Warriors,2012,,36,,Blank,Blank,Dl Vettori,Sc Ganguly,Ab De Villiers,Rv Uthappa,1976-10-14
18618,,548332,162,Ch Gayle,9/21/1979,Left-hand Bat,Right-arm Offbreak,West Indies,Player,Royal Challengers Bangalore,Pune Warriors,2012,,33,,Blank,Blank,Dl Vettori,Sc Ganguly,Ab De Villiers,Rv Uthappa,1979-09-21
18619,,548332,175,Dl Vettori,1/27/1979,Left-hand Bat,Slow Left-arm Orthodox,New Zealand,Captain,Royal Challengers Bangalore,Pune Warriors,2012,,33,,Blank,Blank,Dl Vettori,Sc Ganguly,Ab De Villiers,Rv Uthappa,1979-01-27
18620,,548332,181,Kp Appanna,12/20/1988,Right-hand Bat,Slow Left-arm Orthodox,India,Player,Royal Challengers Bangalore,Pune Warriors,2012,,24,,Blank,Blank,Dl Vettori,Sc Ganguly,Ab De Villiers,Rv Uthappa,1988-12-20
18621,,548332,260,Ma Agarwal,2/16/1991,Right-hand Bat,N/a,India,Player,Royal Challengers Bangalore,Pune Warriors,2012,,21,,Blank,Blank,Dl Vettori,Sc Ganguly,Ab De Villiers,Rv Uthappa,1991-02-16
18626,,548332,106,Ab Dinda,3/25/1984,Right-hand Bat,Right-arm Medium-fast,India,Player,Pune Warriors,Royal Challengers Bangalore,2012,,28,,Blank,Blank,Sc Ganguly,Dl Vettori,Rv Uthappa,Ab De Villiers,1984-03-25
18632,,548332,306,Spd Smith,6/2/1989,Right-hand Bat,Legbreak Googly,India,Player,Pune Warriors,Royal Challengers Bangalore,2012,,23,,Blank,Blank,Sc Ganguly,Dl Vettori,Rv Uthappa,Ab De Villiers,1989-06-02
18645,,548333,2,Bb Mccullum,9/27/1981,Right-hand Bat,Right-arm Medium,New Zealand,Player,Kolkata Knight Riders,Kings Xi Punjab,2012,,31,,Blank,Blank,G Gambhir,Ac Gilchrist,Ms Bisla,Ac Gilchrist,1981-09-27
18646,,548333,9,Jh Kallis,10/16/1975,Right-hand Bat,Right-arm Fast-medium,South Africa,Player,Kolkata Knight Riders,Kings Xi Punjab,2012,,37,,Blank,Blank,G Gambhir,Ac Gilchrist,Ms Bisla,Ac Gilchrist,1975-10-16
18649,,548333,66,B Lee,11/8/1976,Right-hand Bat,Right-arm Fast,Australia,Player,Kolkata Knight Riders,Kings Xi Punjab,2012,,36,,Blank,Blank,G Gambhir,Ac Gilchrist,Ms Bisla,Ac Gilchrist,1976-11-08
18650,,548333,87,Mk Tiwary,11/14/1985,Right-hand Bat,Legbreak Googly,India,Player,Kolkata Knight Riders,Kings Xi Punjab,2012,,27,,Blank,Blank,G Gambhir,Ac Gilchrist,Ms Bisla,Ac Gilchrist,1985-11-14
18651,,548333,89,R Bhatia,10/22/1979,Right-hand Bat,Right-arm Medium-fast,India,Player,Kolkata Knight Riders,Kings Xi Punjab,2012,,33,,Blank,Blank,G Gambhir,Ac Gilchrist,Ms Bisla,Ac Gilchrist,1979-10-22
18652,,548333,95,Db Das,9/22/1986,Right-hand Bat,Legbreak Googly,India,Player,Kolkata Knight Riders,Kings Xi Punjab,2012,,26,,Blank,Blank,G Gambhir,Ac Gilchrist,Ms Bisla,Ac Gilchrist,1986-09-22
18654,,548333,214,Ms Bisla,12/27/1984,Right-hand Bat,N/a,India,Keeper,Kolkata Knight Riders,Kings Xi Punjab,2012,,28,,Blank,Blank,G Gambhir,Ac Gilchrist,Ms Bisla,Ac Gilchrist,1984-12-27
18659,,548334,64,Dpmd Jayawardene,5/27/1977,Right-hand Bat,Right-arm Medium,Sri Lanka,Player,Delhi Daredevils,Deccan Chargers,2012,,35,,Blank,Blank,V Sehwag,Kc Sangakkara,Nv Ojha,Pa Patel,1977-05-27
18660,,548334,183,Nv Ojha,7/20/1983,Right-hand Bat,N/a,India,Keeper,Delhi Daredevils,Deccan Chargers,2012,,29,,Blank,Blank,V Sehwag,Kc Sangakkara,Nv Ojha,Pa Patel,1983-07-20
18663,,548334,199,Y Nagar,1/6/1990,Right-hand Bat,Right-arm Offbreak,India,Player,Delhi Daredevils,Deccan Chargers,2012,,22,,Blank,Blank,V Sehwag,Kc Sangakkara,Nv Ojha,Pa Patel,1990-01-06
18664,,548334,293,S Nadeem,8/12/1989,Right-hand Bat,Slow Left-arm Orthodox,India,Player,Delhi Daredevils,Deccan Chargers,2012,,23,,Blank,Blank,V Sehwag,Kc Sangakkara,Nv Ojha,Pa Patel,1989-08-12
18668,,548334,17,Pa Patel,3/9/1985,Left-hand Bat,N/a,India,Keeper,Deccan Chargers,Delhi Daredevils,2012,,27,,Blank,Blank,Kc Sangakkara,V Sehwag,Pa Patel,Nv Ojha,1985-03-09
18673,,548334,154,Jp Duminy,4/14/1984,Left-hand Bat,Right-arm Offbreak,South Africa,Player,Deccan Chargers,Delhi Daredevils,2012,,28,,Blank,Blank,Kc Sangakkara,V Sehwag,Pa Patel,Nv Ojha,1984-04-14
18677,,548334,450,Tp Sudhindra,4/24/1984,Left-hand Bat,Right-arm Fast,India,Player,Deccan Chargers,Delhi Daredevils,2012,,28,,Blank,Blank,Kc Sangakkara,V Sehwag,Pa Patel,Nv Ojha,1984-04-24
18679,,548335,21,Sk Raina,11/27/1986,Left-hand Bat,Right-arm Offbreak,India,Player,Chennai Super Kings,Pune Warriors,2012,,26,,Blank,Blank,Ms Dhoni,Sc Ganguly,Ms Dhoni,Rv Uthappa,1986-11-27
18684,,548335,186,Sb Jakati,11/27/1980,Left-hand Bat,Slow Left-arm Orthodox,India,Player,Chennai Super Kings,Pune Warriors,2012,,32,,Blank,Blank,Ms Dhoni,Sc Ganguly,Ms Dhoni,Rv Uthappa,1980-11-27
18688,,548335,324,Kmdn Kulasekara,7/22/1982,Right-hand Bat,Right-arm Fast-medium,Sri Lanka,Player,Chennai Super Kings,Pune Warriors,2012,,30,,Blank,Blank,Ms Dhoni,Sc Ganguly,Ms Dhoni,Rv Uthappa,1982-07-22
18693,,548335,96,Mk Pandey,9/10/1989,Right-hand Bat,Right-arm Medium,India,Player,Pune Warriors,Chennai Super Kings,2012,,23,,Blank,Blank,Sc Ganguly,Ms Dhoni,Rv Uthappa,Ms Dhoni,1989-09-10
18695,,548335,191,Ad Mathews,6/2/1987,Right-hand Bat,Right-arm Fast-medium,Sri Lanka,Player,Pune Warriors,Chennai Super Kings,2012,,25,,Blank,Blank,Sc Ganguly,Ms Dhoni,Rv Uthappa,Ms Dhoni,1987-06-02
18696,,548335,235,R Sharma,4/30/1987,Right-hand Bat,Right-arm Offbreak,India,Player,Pune Warriors,Chennai Super Kings,2012,,25,,Blank,Blank,Sc Ganguly,Ms Dhoni,Rv Uthappa,Ms Dhoni,1987-04-30
18698,,548335,306,Spd Smith,6/2/1989,Right-hand Bat,Legbreak Googly,India,Player,Pune Warriors,Chennai Super Kings,2012,,23,,Blank,Blank,Sc Ganguly,Ms Dhoni,Rv Uthappa,Ms Dhoni,1989-06-02
18700,,548336,8,V Kohli,11/5/1988,Right-hand Bat,Right-arm Medium,India,Player,Royal Challengers Bangalore,Kings Xi Punjab,2012,,24,,Blank,Blank,Dl Vettori,Dj Hussey,Kb Arun Karthik,N Saini,1988-11-05
18701,,548336,15,Z Khan,10/7/1978,Right-hand Bat,Left-arm Fast-medium,India,Player,Royal Challengers Bangalore,Kings Xi Punjab,2012,,34,,Blank,Blank,Dl Vettori,Dj Hussey,Kb Arun Karthik,N Saini,1978-10-07
18707,,548336,198,Ab Mcdonald,6/5/1981,Right-hand Bat,Right-arm Fast-medium,Australia,Player,Royal Challengers Bangalore,Kings Xi Punjab,2012,,31,,Blank,Blank,Dl Vettori,Dj Hussey,Kb Arun Karthik,N Saini,1981-06-05
18708,,548336,239,Kb Arun Karthik,2/15/1986,Right-hand Bat,Legbreak Googly,India,Keeper,Royal Challengers Bangalore,Kings Xi Punjab,2012,,26,,Blank,Blank,Dl Vettori,Dj Hussey,Kb Arun Karthik,N Saini,1986-02-15
18710,,548336,311,Hv Patel,11/23/1990,Right-hand Bat,Right-arm Medium,India,Player,Royal Challengers Bangalore,Kings Xi Punjab,2012,,22,,Blank,Blank,Dl Vettori,Dj Hussey,Kb Arun Karthik,N Saini,1990-11-23
18711,,548336,4,Dj Hussey,7/15/1977,Right-hand Bat,Right-arm Offbreak,Australia,Captain,Kings Xi Punjab,Royal Challengers Bangalore,2012,,35,,Blank,Blank,Dj Hussey,Dl Vettori,N Saini,Kb Arun Karthik,1977-07-15
18712,,548336,14,P Kumar,10/2/1986,Right-hand Bat,Right-arm Medium,India,Player,Kings Xi Punjab,Royal Challengers Bangalore,2012,,26,,Blank,Blank,Dj Hussey,Dl Vettori,N Saini,Kb Arun Karthik,1986-10-02
